Storage & organization/Storage containers/Clothes organizers/Hanging clothes organizers,Storage & organization/Storage containers/Hooks & hangers/Hangers,Storage & organization/Dressers & storage drawers/Drawer units/Drawer units for home,Storage & organization/Storage containers/Clothes organizers/Hanging clothes organizers,Storage & organization/Armoires & wardrobes/Solitaire wardrobes,Storage & organization/Dressers & storage drawers/Drawer units/Drawer units for home,Storage & organization/Armoires & wardrobes/Solitaire wardrobes,Furniture/Beds/Bed legs,Furniture/Kids furniture/Kids chairs,Furniture/Armchairs & chaises/Fabric armchairs,Furniture/Patio furniture/Outdoor sofa sections,Furniture/Chairs/Dining chairs/Dining chairs,Furniture/Sofas & sectionals/Sectionals/Sofa modules,Furniture/Sofas & sectionals/Ottomans/Fabric ottomans,Furniture/Chairs/Bar stools & chairs,Furniture/Beds/Cribs,Furniture/Chairs/Dining chairs/Dining chairs,"Baby & kids/Baby/Changing, bathing & potty/Potties & baby baths",Storage & organization/Storage solution systems/PAX system/PAX Interior organizers,Rugs/Rugs/Large & medium rugs,Rugs/Rugs/Runners & small rugs,Rugs/Rugs/Door mats,Furniture/Tables & desks/Accent tables/Coffee tables,Furniture/Tables & desks/Accent tables/Coffee tables,Furniture/Sofas & sectionals/Sofa legs,Furniture/Sofas & sectionals/Sofa legs,Laundry & cleaning/Laundry baskets,Storage & organization/Storage containers/Hooks & hangers/Hangers,Home Décor/Storage boxes & baskets/Baskets,Home Décor/Storage boxes & baskets/Baskets,Bathroom/Bathroom stools & benches,Cookware & tableware/Serveware/Trays,Storage & organization/Storage containers/Food storage & organizing/Food containers,Furniture/Tables & desks/Nightstands,Home Décor/Storage boxes & baskets/Baskets,Home Décor/Storage boxes & baskets/Paper & media boxes,Furniture/Tables & desks/Changing tables,Furniture/Beds/Twin beds,Furniture/Chairs/Dining chairs/Dining chairs,Storage & organization/Wall shelves & hooks/Hooks,Furniture/Armchairs & chaises/Fabric armchairs,Furniture/Chairs/Dining chairs/Dining chairs,Storage & organization/Armoires & wardrobes/Solitaire wardrobes,Rugs/Rugs/Runners & small rugs,Storage & organization/Bags/Backpacks & messenger bags,Storage & organization/Storage containers/Paper & media organizers/Desk accessories,Cookware & tableware/Dishwashing accessories/Sink accessories,Furniture/Armchairs & chaises/Coated fabric armchairs,Furniture/Chairs/Desk chairs/Desk chairs for home,Cookware & tableware/Dishwashing accessories/Dish drainers & drying racks,Furniture/Beds/Cribs,Furniture/Patio furniture/Outdoor chairs/Outdoor dining chairs,Furniture/Tables & desks/Accent tables/End tables & side tables,Beds & mattresses/Mattresses/Spring mattresses,Furniture/Chairs/Dining chairs/Dining chairs,Furniture/Kids furniture/Kids chairs,Furniture/Beds/Kids beds/Junior & extendable beds,Storage & organization/Storage containers/Bins & bags/Trash cans & pedal bins,Storage & organization/Storage containers/Paper & media organizers/Desk accessories,Furniture/Beds/Kids beds/Bunk beds,Furniture/Chairs/Desk chairs/Desk chairs for home,Storage & organization/Clothes organizers/Coat stands,Storage & organization/Clothes organizers/Shoe racks & stands,Furniture/Beds/Kids beds/Junior & extendable beds,Outdoor/Outdoor flooring,Furniture/Kids furniture/Kids chairs,Storage & organization/Bags/Travel accessories,Furniture/Tables & desks/Nightstands,Beds & mattresses/Mattress bases,Furniture/Chairs/Dining chairs/Upholstered chairs,Furniture/Patio furniture/Outdoor tables/Outdoor coffee & side tables,Furniture/Patio furniture/Outdoor sofa sections,Furniture/Patio furniture/Outdoor sofa sections,Home Décor/Storage boxes & baskets/Clothes boxes,Storage & organization/Storage containers/Hooks & hangers/Hangers,Storage & organization/Storage solution systems/PAX system/PAX Interior organizers,Home Textiles/Window treatments/Curtains & drapes/Room darkening curtains & drapes,Home Textiles/Window treatments/Curtains & drapes/Room darkening curtains & drapes,Storage & organization/Storage solution systems/PAX system/PAX Interior organizers,Storage & organization/Armoires & wardrobes/Solitaire wardrobes,Storage & organization/Armoires & wardrobes/Solitaire wardrobes,Storage & organization/Armoires & wardrobes/Solitaire wardrobes,Furniture/Beds/Cribs,Furniture/Chairs/Dining chairs/Upholstered chairs,Furniture/Tables & desks/Changing tables,Furniture/Tables & desks/Changing tables,Home Décor/Storage boxes & baskets/Clothes boxes,Home Décor/Storage boxes & baskets/Baskets,Home Décor/Storage boxes & baskets/Baskets,Cookware & tableware/Napkins & napkin holders/Napkin holders,Furniture/Patio furniture/Outdoor chairs/Outdoor dining chairs,Storage & organization/Bags/Shopping bags & tote bags,Storage & organization/Bags/Shopping bags & tote bags,Storage & organization/Storage containers/Bathroom accessories/Towel rails & towel holders,Furniture/Chairs/Dining chairs/Upholstered chairs,Furniture/Armchairs & chaises/Lounge chairs,Storage & organization/Storage containers/Bins & bags/Bags,Furniture/Patio furniture/Outdoor chaises & hammocks,Storage & organization/Storage containers/Hooks & hangers/Hangers,Furniture/Chairs/Desk chairs/Desk chairs for home
Storage & organization/Storage solution systems/SMÅSTAD system/SMÅSTAD doors & drawers,Storage & organization/Storage solution systems/SMÅSTAD system/SMÅSTAD doors & drawers,Storage & organization/Wall shelves/Brackets,Storage & organization/Wall shelves/Brackets,Storage & organization/Wall shelves/Brackets,"Storage & organization/Shelving units, bookcases & storage options/Bookcases",Storage & organization/Display & storage cabinets/Dining room cabinets & cupboards,Storage & organization/Display & storage cabinets/Dining room cabinets & cupboards,"Storage & organization/Storage solution systems/ELVARLI system/Post, side units & interiors",Storage & organization/Storage containers/Paper & media organizers/Desk accessories,Bathroom/Bathroom storage/Bathroom shelving units,Kitchen & appliances/Kitchen systems/SEKTION kitchen/SEKTION kitchen cabinets,"Storage & organization/Storage solution systems/ELVARLI system/Post, side units & interiors","Storage & organization/Storage solution systems/ELVARLI system/Post, side units & interiors",Storage & organization/Storage containers/Bins & bags/Trash cans & pedal bins,Storage & organization/Storage containers/Bins & bags/Trash cans & pedal bins,Cookware & tableware/Knives & cutting boards/Cutting boards,Storage & organization/Storage solution systems/IVAR system/All parts,Kitchen & appliances/Kitchen drawer organization/Shelves & drawers,Storage & organization/Storage solution systems/BOAXEL system/BOAXEL parts,Storage & organization/Wall shelves/Brackets,"Storage & organization/Storage solution systems/ELVARLI system/Post, side units & interiors",Storage & organization/TV & media furniture/TV stands & benches,Storage & organization/TV & media furniture/TV stands & benches,Storage & organization/TV & media furniture/TV stands & benches,Home Décor/Storage boxes & baskets/Kids boxes & baskets,Storage & organization/Wall shelves/Brackets,Furniture/Tables & desks/Accent tables/End tables & side tables,Storage & organization/Storage solution systems/IVAR system/All parts,Storage & organization/Armoires & wardrobes/Solitaire wardrobes,"Storage & organization/Storage solution systems/ELVARLI system/Post, side units & interiors","Storage & organization/Storage solution systems/ELVARLI system/Post, side units & interiors","Storage & organization/Storage solution systems/ELVARLI system/Post, side units & interiors","Storage & organization/Storage solution systems/ELVARLI system/Post, side units & interiors",Bathroom/Bathroom storage/Bathroom storage/Bathroom tall cabinets,Kitchen & appliances/Kitchen systems/SEKTION kitchen/SEKTION kitchen cabinets,Kitchen & appliances/Kitchen drawer organization/Drawer dividers,Storage & organization/Clothes organizers/Shoe racks & stands,Storage & organization/Clothes organizers/Shoe racks & stands,Storage & organization/Storage containers/Paper & media organizers/Magazine files,"Storage & organization/Shelving units, bookcases & storage options/Storage shelves & units",Storage & organization/Storage solution systems/IVAR system/All parts,Storage & organization/Storage solution systems/BOAXEL system/BOAXEL parts,Furniture/Tables & desks/Console tables & sofa tables,"Storage & organization/Shelving units, bookcases & storage options/Shelf units & cube storage",Storage & organization/Storage containers/Paper & media organizers/Desk accessories,Storage & organization/Storage solution systems/PAX system/PAX Interior organizers,Storage & organization/Storage solution systems/PAX system/PAX Interior organizers,Home electronics/Speakers/Wi-Fi speakers,"Storage & organization/Shelving units, bookcases & storage options/Shelf units & cube storage",Home Décor/Wall décor/Picture ledges,Storage & organization/Display & storage cabinets/Dining room cabinets & cupboards,"Storage & organization/Shelving units, bookcases & storage options/Shelf units & cube storage",Furniture/Tables & desks/Desks & computer desks/Desks for home,Storage & organization/Storage containers/Cable management & accessories,Storage & organization/Dressers & storage drawers/Drawer units/Drawer units for home,Storage & organization/Display & storage cabinets/Display cabinets,Storage & organization/Display & storage cabinets/Display cabinets,Storage & organization/Armoires & wardrobes/Solitaire wardrobes,Furniture/Tables & desks/Desks & computer desks/Desks for home,Laundry & cleaning/Ironing boards,Storage & organization/Storage solution systems/BOAXEL system/BOAXEL parts,Storage & organization/Display & storage cabinets/Dining room cabinets & cupboards,Furniture/Chairs/Bar stools & chairs,Furniture/Patio furniture/Outdoor tables/Outdoor coffee & side tables,Kitchen & appliances/Appliances/Refrigerators & freezers/Free-standing refrigerators,Kitchen & appliances/Appliances/Refrigerators & freezers/Free-standing refrigerators,Storage & organization/Storage solution systems/PAX system/PAX Interior organizers,Storage & organization/Storage solution systems/PAX system/PAX Interior organizers,Kitchen & appliances/Appliances/Refrigerators & freezers/Free-standing refrigerators,Home Décor/Clocks/Wall & table clocks,Home Décor/Storage boxes & baskets/Paper & media boxes,Bathroom/Bathroom storage/Bathroom storage/Bathroom wall cabinets,Storage & organization/TV & media furniture/TV stands & benches,Bathroom/Bathroom vanities/Bathroom vanity legs,Furniture/Kids furniture/Toy storage,Furniture/Kids furniture/Toy storage,Furniture/Kids furniture/Toy storage,Furniture/Kids furniture/Toy storage,Storage & organization/Utility & storage carts/Bathroom Carts,Storage & organization/Storage solution systems/SMÅSTAD system/SMÅSTAD doors & drawers,Storage & organization/Storage solution systems/SMÅSTAD system/SMÅSTAD doors & drawers,Storage & organization/Storage solution systems/SMÅSTAD system/SMÅSTAD doors & drawers,Storage & organization/Display & storage cabinets/Dining room cabinets & cupboards,"Storage & organization/Shelving units, bookcases & storage options/Shelf units & cube storage",Storage & organization/Wall shelves/Shelves,Storage & organization/Storage solution systems/BOAXEL system/BOAXEL parts,Home Décor/Mirrors/Vanity mirrors,Cookware & tableware/Knives & cutting boards/Sharpening tools,Furniture/Tables & desks/Accent tables/End tables & side tables,Storage & organization/Display & storage cabinets/Dining room cabinets & cupboards,"Storage & organization/Storage solution systems/ELVARLI system/Post, side units & interiors","Storage & organization/Storage solution systems/ELVARLI system/Post, side units & interiors",Furniture/Tables & desks/Bar tables,"Storage & organization/Shelving units, bookcases & storage options/Shelf units & cube storage",Furniture/Tables & desks/Desks & computer desks/Desks for home,Furniture/Tables & desks/Desks & computer desks/Desks for home,Furniture/Tables & desks/Desks & computer desks/Desks for home,Storage & organization/Storage containers/Paper & media organizers/Desk accessories,Storage & organization/Display & storage cabinets/Display cabinets
Kitchen & appliances/Kitchen systems/SEKTION kitchen/SEKTION kitchen cabinets,Kitchen & appliances/Kitchen systems/SEKTION kitchen/SEKTION kitchen cabinets,Kitchen & appliances/Kitchen systems/SEKTION kitchen/SEKTION kitchen cabinets,Kitchen & appliances/Kitchen systems/SEKTION kitchen/SEKTION kitchen cabinets,Kitchen & appliances/Kitchen systems/SEKTION kitchen/SEKTION kitchen cabinets,Home Textiles/Window treatments/Curtain rods & rails/Curtain rods,Home Textiles/Window treatments/Curtain rods & rails/Track systems,Home Textiles/Window treatments/Curtain rods & rails/Track systems,Home Textiles/Window treatments/Curtain rods & rails/Track systems,Home Textiles/Window treatments/Curtain rods & rails/Track systems,Furniture/Patio furniture/Outdoor tables/Outdoor dining tables,Cookware & tableware/Knives & cutting boards/Cutting boards,Furniture/Tables & desks/Nightstands,Home Textiles/Window treatments/Curtain rods & rails/Curtain rods,Furniture/Tables & desks/Dining tables/Up to 4 seats,Home Décor/Mirrors/Wall mirrors,Home Décor/Mirrors/Vanity mirrors,Furniture/Tables & desks/Desks & computer desks/Desks for home,Home Décor/Mirrors/Wall mirrors,Bathroom/Bathroom textiles/Shower curtains,Furniture/Patio furniture/Outdoor chaises & hammocks,Furniture/Patio furniture/Outdoor tables/Outdoor dining tables,Home Décor/Wall décor/Picture & photo frames,Home Décor/Wall décor/Picture & photo frames,Home Décor/Wall décor/Picture & photo frames,Home Décor/Wall décor/Picture & photo frames,Home Décor/Storage boxes & baskets/Baskets,Furniture/Patio furniture/Outdoor tables/Outdoor dining tables,Storage & organization/Wall shelves & hooks/Hooks,Home Décor/Candle holders & candles/Lanterns,Home Décor/Flower pots & stands/Indoor plant pots,Storage & organization/Wall shelves & hooks/Hooks,"Laundry & cleaning/Drying racks/MULIG Drying rack, indoor",Storage & organization/Wall shelves & hooks/Hooks,"Storage & organization/Wall shelves & hooks/Hooks/BRANDUR Hook, in-","Storage & organization/Wall shelves & hooks/Hooks/BRANDUR Hook, in-","Storage & organization/Clothes organizers/Clothes racks & stands/TURBO Clothes rack, indoor","Storage & organization/Wall shelves & hooks/Hooks/BRANDUR Rail with 4 hooks, in-",Rugs/Rugs/Door mats,Home Textiles/Window treatments/Curtain rods & rails/Track systems,Furniture/Tables & desks/Dining tables/Up to 10 seats,Laundry & cleaning/Cleaning accessories,Home Décor/Storage boxes & baskets/Kids boxes & baskets,Cookware & tableware/Knives & cutting boards/Cutting boards,Cookware & tableware/Knives & cutting boards/Cutting boards,Cookware & tableware/Knives & cutting boards/Cutting boards,Furniture/Sofas & sectionals/Ottomans/Fabric ottomans,Home Décor/Wall décor/Art cards,Baby & kids/Kids/Toys & play/Physical play,Rugs/Rugs/Runners & small rugs,Rugs/Rugs/Runners & small rugs,Storage & organization/Wall shelves/Complete wall shelves/HEMNES Wall,Cookware & tableware/Dinnerware/Deep plates/VÄRDERA Deep plate,Storage & organization/Storage solution systems/PAX system/PAX sliding doors,Storage & organization/TV & media furniture/TV stands & benches,Home Décor/Decorative accessories,Furniture/Tables & desks/Bar tables,Furniture/Tables & desks/Café tables,Home improvement/Home safety/Child safety,Rugs/Rugs/Door mats,Baby & kids/Baby/Baby toys/Newborn,Lighting/Lamps & light fixtures/Kids lighting,Home Textiles/Window treatments/Curtain rods & rails/Track systems,Baby & kids/Kids/Toys & play/Physical play,Cookware & tableware/Dinnerware/Side plates,Storage & organization/Storage containers/Paper & media organizers/Desk accessories,Storage & organization/Storage containers/Bins & bags/Trash cans & pedal bins,Home Décor/Mirrors/Vanity mirrors,Cookware & tableware/Dinnerware/Plates,Home Décor/Wall décor/Collage picture frames,Furniture/Tables & desks/Accent tables/End tables & side tables,Storage & organization/Storage containers/Food storage & organizing/Food containers,Baby & kids/Kids/Toys & play/Role play,Kitchen & appliances/Kitchen countertops/Butcher block countertops,Kitchen & appliances/Kitchen countertops/Butcher block countertops,Kitchen & appliances/Kitchen countertops/Butcher block countertops,Kitchen & appliances/Kitchen countertops/Butcher block countertops,Kitchen & appliances/Kitchen countertops/Butcher block countertops,Kitchen & appliances/Kitchen countertops/Butcher block countertops,Furniture/Tables & desks/Makeup vanities & dressing tables,Kitchen & appliances/Kitchen countertops/Laminate countertops,Kitchen & appliances/Kitchen countertops/Laminate countertops,Kitchen & appliances/Kitchen countertops/Laminate countertops,Kitchen & appliances/Kitchen countertops/Laminate countertops,Kitchen & appliances/Kitchen countertops/Laminate countertops,Cookware & tableware/Dinnerware/Dinnerware sets,Furniture/Tables & desks/Dining tables/Up to 4 seats,Home Décor/Wall décor/Picture & photo frames,"Storage & organization/Display & storage cabinets/Buffet tables, sideboard buffets & buffet cabinets",Kitchen & appliances/Backsplashes & wall panels/Laminate backsplashes,Kitchen & appliances/Backsplashes & wall panels/Laminate backsplashes,Kitchen & appliances/Backsplashes & wall panels/Laminate backsplashes,Storage & organization/Clothes organizers/Shoe racks & stands,Baby & kids/Kids/Toys & play/Role play,Cookware & tableware/Cookware & kitchenware/Cooking pans/Frying pans & skillets,"Home Textiles/Window treatments/Shades, blinds & window treatments/Pleated & cellular blinds and shades",Home Textiles/Window treatments/Curtains & drapes/Light filtering curtains,Home Textiles/Window treatments/Curtains & drapes/Light filtering curtains,Home Textiles/Window treatments/Curtains & drapes/Light filtering curtains,Home Textiles/Window treatments/Curtains & drapes/Light filtering curtains
Kitchen & appliances/Kitchen systems/SEKTION kitchen/SEKTION kitchen cabinets,Kitchen & appliances/Kitchen systems/SEKTION kitchen/SEKTION kitchen cabinets,Kitchen & appliances/Kitchen systems/SEKTION kitchen/SEKTION kitchen cabinets,Kitchen & appliances/Kitchen systems/SEKTION kitchen/SEKTION kitchen cabinets,Kitchen & appliances/Kitchen systems/SEKTION kitchen/SEKTION kitchen cabinets,Home Textiles/Window treatments/Curtain rods & rails/Curtain rods,Home Textiles/Window treatments/Curtain rods & rails/Track systems,Home Textiles/Window treatments/Curtain rods & rails/Track systems,Home Textiles/Window treatments/Curtain rods & rails/Track systems,Home Textiles/Window treatments/Curtain rods & rails/Track systems,Furniture/Patio furniture/Outdoor tables/Outdoor dining tables,Cookware & tableware/Knives & cutting boards/Cutting boards,Furniture/Tables & desks/Nightstands,Home Textiles/Window treatments/Curtain rods & rails/Curtain rods,Furniture/Tables & desks/Dining tables/Up to 4 seats,Home Décor/Mirrors/Wall mirrors,Home Décor/Mirrors/Vanity mirrors,Furniture/Tables & desks/Desks & computer desks/Desks for home,Home Décor/Mirrors/Wall mirrors,Bathroom/Bathroom textiles/Shower curtains,Furniture/Patio furniture/Outdoor chaises & hammocks,Furniture/Patio furniture/Outdoor tables/Outdoor dining tables,Home Décor/Wall décor/Picture & photo frames,Home Décor/Wall décor/Picture & photo frames,Home Décor/Wall décor/Picture & photo frames,Home Décor/Wall décor/Picture & photo frames,Home Décor/Storage boxes & baskets/Baskets,Furniture/Patio furniture/Outdoor tables/Outdoor dining tables,Storage & organization/Wall shelves & hooks/Hooks,Home Décor/Candle holders & candles/Lanterns,Home Décor/Flower pots & stands/Indoor plant pots,Storage & organization/Wall shelves & hooks/Hooks,"Laundry & cleaning/Drying racks/MULIG Drying rack, indoor",Storage & organization/Wall shelves & hooks/Hooks,"Storage & organization/Wall shelves & hooks/Hooks/BRANDUR Hook, in-","Storage & organization/Wall shelves & hooks/Hooks/BRANDUR Hook, in-","Storage & organization/Clothes organizers/Clothes racks & stands/TURBO Clothes rack, indoor","Storage & organization/Wall shelves & hooks/Hooks/BRANDUR Rail with 4 hooks, in-",Rugs/Rugs/Door mats,Home Textiles/Window treatments/Curtain rods & rails/Track systems,Furniture/Tables & desks/Dining tables/Up to 10 seats,Laundry & cleaning/Cleaning accessories,Home Décor/Storage boxes & baskets/Kids boxes & baskets,Cookware & tableware/Knives & cutting boards/Cutting boards,Cookware & tableware/Knives & cutting boards/Cutting boards,Cookware & tableware/Knives & cutting boards/Cutting boards,Furniture/Sofas & sectionals/Ottomans/Fabric ottomans,Home Décor/Wall décor/Art cards,Baby & kids/Kids/Toys & play/Physical play,Rugs/Rugs/Runners & small rugs,Rugs/Rugs/Runners & small rugs,Storage & organization/Wall shelves/Complete wall shelves/HEMNES Wall,Cookware & tableware/Dinnerware/Deep plates/VÄRDERA Deep plate,Storage & organization/Storage solution systems/PAX system/PAX sliding doors,Storage & organization/TV & media furniture/TV stands & benches,Home Décor/Decorative accessories,Furniture/Tables & desks/Bar tables,Furniture/Tables & desks/Café tables,Home improvement/Home safety/Child safety,Rugs/Rugs/Door mats,Baby & kids/Baby/Baby toys/Newborn,Lighting/Lamps & light fixtures/Kids lighting,Home Textiles/Window treatments/Curtain rods & rails/Track systems,Baby & kids/Kids/Toys & play/Physical play,Cookware & tableware/Dinnerware/Side plates,Storage & organization/Storage containers/Paper & media organizers/Desk accessories,Storage & organization/Storage containers/Bins & bags/Trash cans & pedal bins,Home Décor/Mirrors/Vanity mirrors,Cookware & tableware/Dinnerware/Plates,Home Décor/Wall décor/Collage picture frames,Furniture/Tables & desks/Accent tables/End tables & side tables,Storage & organization/Storage containers/Food storage & organizing/Food containers,Baby & kids/Kids/Toys & play/Role play,Kitchen & appliances/Kitchen countertops/Butcher block countertops,Kitchen & appliances/Kitchen countertops/Butcher block countertops,Kitchen & appliances/Kitchen countertops/Butcher block countertops,Kitchen & appliances/Kitchen countertops/Butcher block countertops,Kitchen & appliances/Kitchen countertops/Butcher block countertops,Kitchen & appliances/Kitchen countertops/Butcher block countertops,Furniture/Tables & desks/Makeup vanities & dressing tables,Kitchen & appliances/Kitchen countertops/Laminate countertops,Kitchen & appliances/Kitchen countertops/Laminate countertops,Kitchen & appliances/Kitchen countertops/Laminate countertops,Kitchen & appliances/Kitchen countertops/Laminate countertops,Kitchen & appliances/Kitchen countertops/Laminate countertops,Cookware & tableware/Dinnerware/Dinnerware sets,Furniture/Tables & desks/Dining tables/Up to 4 seats,Home Décor/Wall décor/Picture & photo frames,"Storage & organization/Display & storage cabinets/Buffet tables, sideboard buffets & buffet cabinets",Kitchen & appliances/Backsplashes & wall panels/Laminate backsplashes,Kitchen & appliances/Backsplashes & wall panels/Laminate backsplashes,Kitchen & appliances/Backsplashes & wall panels/Laminate backsplashes,Storage & organization/Clothes organizers/Shoe racks & stands,Baby & kids/Kids/Toys & play/Role play,Cookware & tableware/Cookware & kitchenware/Cooking pans/Frying pans & skillets,"Home Textiles/Window treatments/Shades, blinds & window treatments/Pleated & cellular blinds and shades",Home Textiles/Window treatments/Curtains & drapes/Light filtering curtains,Home Textiles/Window treatments/Curtains & drapes/Light filtering curtains,Home Textiles/Window treatments/Curtains & drapes/Light filtering curtains,Home Textiles/Window treatments/Curtains & drapes/Light filtering curtains
