Beds & mattresses/Bedding/Blankets & throws,Beds & mattresses/Bedding/Bedlinen/Duvet cover sets,Beds & mattresses/Bedding/Pillows/Polyester pillows,Baby & kids/Baby/Baby textiles/Nursery rugs,Rugs/Bath mats,Storage & organization/Bags/Shopping bags & tote bags,Bathroom/Bathroom textiles/Towels/Wash cloths,Bathroom/Bathroom textiles/Towels/Hand towels,Bathroom/Bathroom textiles/Towels/Bath sheets,Rugs/Rugs/Door mats,Furniture/Sofas & sectionals/Fabric sofas/Modular fabric sofas,Furniture/Sofas & sectionals/Sofa & armchairs covers/HÄRLANDA covers,Furniture/Sofas & sectionals/Sofa & armchairs covers/HÄRLANDA covers,Furniture/Sofas & sectionals/Sofa & armchairs covers/HÄRLANDA covers,Furniture/Sofas & sectionals/Sofa & armchairs covers/HÄRLANDA covers,Cookware & tableware/Napkins & napkin holders/Napkins,Beds & mattresses/Bedding/Blankets & throws,Beds & mattresses/Bedding/Cushions & cushions covers/Children's cushions & blankets,Furniture/Armchairs & chaises/Rattan armchairs,Furniture/Armchairs & chaises/Rattan armchairs,Beds & mattresses/Bedding/Cushions & cushions covers/Cushion covers,Beds & mattresses/Bedding/Cushions & cushions covers/Cushion covers,Beds & mattresses/Mattresses/Crib mattresses,Beds & mattresses/Mattresses/Crib mattresses,Beds & mattresses/Mattresses/Crib mattresses,Beds & mattresses/Mattresses/Crib mattresses,Furniture/Sofas & sectionals/Sofa & armchairs covers/POÄNG,Furniture/Sofas & sectionals/Sofa & armchairs covers/POÄNG,Beds & mattresses/Bedding/Cushions & cushions covers/Cushions,"Outdoor/Outdoor cushions/Outdoor pillows/FUNKÖN Back cushion, indoor","Outdoor/Outdoor cushions/Outdoor pillows/FUNKÖN Cushion cover, in",Furniture/Patio furniture/Outdoor seat cushions,Furniture/Patio furniture/Outdoor seat cushions,Furniture/Armchairs & chaises/Kids armchairs,Beds & mattresses/Bedding/Cushions & cushions covers/Cushions,Baby & kids/Baby/Baby textiles/Nursery rugs,Furniture/Tables & desks/Changing tables,Bathroom/Bathroom textiles/Towels/Hand towels,Bathroom/Bathroom textiles/Towels/Bath towels,Baby & kids/Kids/Toys & play/Soft toys,Rugs/Rugs/Door mats,Baby & kids/Baby/Baby textiles/Baby towels & washcloths,Beds & mattresses/Bedding/Cushions & cushions covers/Cushion covers,Rugs/Rugs/Runners & small rugs,Beds & mattresses/Mattresses/Mattress toppers,Rugs/Bath mats,Rugs/Rugs/Large & medium rugs,Beds & mattresses/Bedding/Blankets & throws/FÄLTMAL Pillow,Cookware & tableware/Table linen/Table cloths & runners,Furniture/Patio furniture/Outdoor lounge furniture,Baby & kids/Kids/Toys & play/Soft toys,Beds & mattresses/Bedding/Cushions & cushions covers/Cushion covers,Furniture/Sofas & sectionals/Sofa & armchairs covers/POÄNG,Beds & mattresses/Mattresses/Kids mattresses,Rugs/Rugs/Runners & small rugs,Beds & mattresses/Bedding/Cushions & cushions covers/Cushion covers,Rugs/Rugs/Round rugs,Beds & mattresses/Bedding/Cushions & cushions covers/Cushion covers,Beds & mattresses/Bedding/Blankets & throws,Cookware & tableware/Kitchen textiles/Pot holders & oven mitts,Cookware & tableware/Kitchen textiles/Pot holders & oven mitts,Cookware & tableware/Kitchen textiles/Pot holders & oven mitts,Furniture/Patio furniture/Outdoor seat cushions,Beds & mattresses/Bedding/Comforters/Polyester comforters,Beds & mattresses/Bedding/Comforters/Polyester comforters,Beds & mattresses/Bedding/Blankets & throws,Rugs/Rugs/Large & medium rugs,Beds & mattresses/Bedding/Bedlinen/Duvet cover sets,Rugs/Rugs/Door mats,Beds & mattresses/Bedding/Bedspreads,Furniture/Sofas & sectionals/Sofa & armchairs covers/FLOTTEBO covers,Beds & mattresses/Bedding/Cushions & cushions covers/Children's cushions & blankets,Beds & mattresses/Bedding/Cushions & cushions covers/Children's cushions & blankets,"Beds & mattresses/Mattresses/Foam, memory foam & latex mattresses",Rugs/Rugs/Large & medium rugs,Rugs/Rugs/Door mats,Rugs/Rugs/Large & medium rugs,"Rugs/Rugs/Large & medium rugs/SVALLERUP Rug flatwoven, in","Baby & kids/Baby/Changing, bathing & potty/Changing accessories",Furniture/Sofas & sectionals/Sofa & armchairs covers/FÄRLÖV covers,Storage & organization/Storage containers/Bins & bags/Bags,"Rugs/Rugs/Large & medium rugs/VRENSTED Rug flatwoven, in",Beds & mattresses/Bedding/Pillows/Down & feather pillows,Beds & mattresses/Bedding/Pillows/Down & feather pillows,Storage & organization/Storage containers/Bins & bags/Bags,"Rugs/Rugs/Large & medium rugs/SKARRILD Rug flatwoven, in",Beds & mattresses/Bedding/Cushions & cushions covers/Cushions,Rugs/Rugs/Sheepskins & cowhides,Rugs/Rugs/Sheepskins & cowhides,Rugs/Rugs/Large & medium rugs,Furniture/Sofas & sectionals/Sofa & armchairs covers/POÄNG,Beds & mattresses/Bedding/Cushions & cushions covers/Cushion covers,Furniture/Sofas & sectionals/Sofa & armchairs covers/VINLIDEN covers,Furniture/Sofas & sectionals/Fabric sofas/Sofas,Beds & mattresses/Bedding/Cushions & cushions covers/Cushions,Beds & mattresses/Bedding/Bedlinen/Duvet cover sets,Furniture/Armchairs & chaises/Fabric armchairs,Storage & organization/Storage containers/Paper & media organizers/Magazine files,"Furniture/Patio furniture/Outdoor seat cushions/SÖTHOLMEN Cushion cover, in",Beds & mattresses/Bedding/Cushions & cushions covers/Cushion covers
Storage & organization/Storage solution systems/AURDAL system/AURDAL parts,Storage & organization/Storage solution systems/AURDAL system/AURDAL parts,Storage & organization/Storage solution systems/AURDAL system/AURDAL parts,Storage & organization/Storage solution systems/AURDAL system/AURDAL parts,Storage & organization/Storage solution systems/AURDAL system/AURDAL parts,Storage & organization/Storage solution systems/AURDAL system/AURDAL parts,Storage & organization/Storage solution systems/AURDAL system/AURDAL parts,Storage & organization/Storage solution systems/AURDAL system/AURDAL parts,Storage & organization/Storage solution systems/AURDAL system/AURDAL parts,Storage & organization/Storage solution systems/AURDAL system/AURDAL parts,Storage & organization/Storage solution systems/AURDAL system/AURDAL parts,Storage & organization/Storage solution systems/AURDAL system/AURDAL parts,Furniture/Tables & desks/Desks & computer desks/Desks for home,Home Décor/Mirrors/Wall mirrors,Home Décor/Mirrors/Wall mirrors,Home Décor/Mirrors/Wall mirrors,Home electronics/Speakers/Bluetooth speakers,"Storage & organization/Shelving units, bookcases & storage options/Storage shelves & units",Storage & organization/Clothes organizers/Shoe cabinets,Storage & organization/Clothes organizers/Shoe cabinets,Storage & organization/Clothes organizers/Shoe cabinets,Storage & organization/Clothes organizers/Shoe cabinets,Storage & organization/Clothes organizers/Shoe cabinets,Storage & organization/Clothes organizers/Shoe cabinets,Storage & organization/Clothes organizers/Shoe cabinets,Storage & organization/Storage containers/Bins & bags/Trash cans & pedal bins,Cookware & tableware/Knives & cutting boards/Cutting boards,Home Décor/Storage boxes & baskets/Secondary storage boxes,Home electronics/Cords & chargers/Wireless charging & accessories,Home electronics/Speakers/Bluetooth speakers,Home electronics/Speakers/Bluetooth speakers,Home electronics/Speakers/Bluetooth speakers,Home electronics/Speakers/Bluetooth speakers,Home electronics/Cords & chargers/Wireless charging & accessories,Home electronics/Cords & chargers/Wireless charging & accessories,Home Décor/Storage boxes & baskets/Paper & media boxes,Home Décor/Storage boxes & baskets/Secondary storage boxes,Home Décor/Storage boxes & baskets/Secondary storage boxes,Storage & organization/Wall shelves/Complete wall shelves,Storage & organization/Storage containers/Food storage & organizing/Food containers,Storage & organization/Display & storage cabinets/Dining room cabinets & cupboards,Bathroom/Bathroom storage/Bathroom shelving units,Storage & organization/Storage containers/Bathroom accessories/Bathroom shelves,Kitchen & appliances/Kitchen islands & carts,Furniture/Kids furniture/Toy storage,Storage & organization/Storage solution systems/BESTÅ storage system/BESTÅ all parts & accessories,"Storage & organization/Shelving units, bookcases & storage options/Storage shelves & units","Storage & organization/Shelving units, bookcases & storage options/Cube storage","Storage & organization/Shelving units, bookcases & storage options/Bookcases","Storage & organization/Shelving units, bookcases & storage options/Shelf units & cube storage","Storage & organization/Shelving units, bookcases & storage options/Cube storage","Storage & organization/Shelving units, bookcases & storage options/Storage shelves & units",Furniture/Tables & desks/Kids tables,Home electronics/Cords & chargers/Wireless charging & accessories,Home Décor/Vases & bowls/Vases,Home Décor/Vases & bowls/Vases/CYLINDER Vase,Bathroom/Bathroom vanities/Vanity cabinets with sink,Bathroom/Bathroom vanities/Vanity cabinets with sink,Home Décor/Storage boxes & baskets/Kids boxes & baskets,Storage & organization/Storage containers/Bathroom accessories/Bathroom boxes & baskets,Furniture/Tables & desks/Bar tables,Furniture/Tables & desks/Dining tables/Up to 4 seats,Storage & organization/Storage containers/Bins & bags/Trash cans & pedal bins,Furniture/Tables & desks/Dining tables/Up to 4 seats,"Storage & organization/Shelving units, bookcases & storage options/Shelf units & cube storage","Storage & organization/Shelving units, bookcases & storage options/Bookcases",Storage & organization/Display & storage cabinets/Display cabinets,Home Décor/Storage boxes & baskets/Secondary storage boxes,Home Décor/Storage boxes & baskets/Kids boxes & baskets,Home Décor/Storage boxes & baskets/Kids boxes & baskets,Home Décor/Storage boxes & baskets/Kids boxes & baskets,Storage & organization/Storage containers/Paper & media organizers/Media accessories,Baby & kids/Kids/Toys & play/Arts & crafts,Home electronics/Cords & chargers/Wireless charging & accessories,Storage & organization/Storage solution systems/SMÅSTAD system/SMÅSTAD doors & drawers,Storage & organization/Storage solution systems/SMÅSTAD system/SMÅSTAD doors & drawers,Furniture/Tables & desks/Desks & computer desks/Desks for home,Furniture/Kids furniture/Kids chairs,Storage & organization/Bags/Travel accessories,Storage & organization/Storage containers/Cable management & accessories,Storage & organization/Storage containers/Food storage & organizing/Cooler bags,Furniture/Tables & desks/Desks & computer desks/Desks for home,Home Décor/Wall décor/Picture & photo frames,"Storage & organization/Shelving units, bookcases & storage options/Shelf units & cube storage","Storage & organization/Shelving units, bookcases & storage options/Shelf units & cube storage","Storage & organization/Display & storage cabinets/Buffet tables, sideboard buffets & buffet cabinets",Storage & organization/Storage containers/Paper & media organizers/Desk accessories,Storage & organization/Storage containers/Bathroom accessories/Bathroom boxes & baskets,Home Décor/Storage boxes & baskets/Paper & media boxes,Storage & organization/Storage containers/Food storage & organizing/Food containers,Furniture/Chairs/High chairs,Furniture/Tables & desks/Desks & computer desks/Desks for home,Storage & organization/Storage solution systems/SMÅSTAD system/SMÅSTAD interior fittings,Storage & organization/Storage solution systems/BESTÅ storage system/BESTÅ all parts & accessories,Storage & organization/Wall shelves/Shelves,Storage & organization/Wall shelves/Shelves,Storage & organization/Storage containers/Bathroom accessories/Toilet roll holders & stands,Storage & organization/Clothes organizers/Shoe racks & stands,Storage & organization/Storage solution systems/SMÅSTAD system/SMÅSTAD interior fittings,Storage & organization/Storage containers/Food storage & organizing/Food containers
Home Textiles/Window treatments/Curtains & drapes/Light filtering curtains,Home Textiles/Window treatments/Curtains & drapes/Panel curtains,Home Textiles/Window treatments/Curtains & drapes/Panel curtains,Home Textiles/Window treatments/Curtains & drapes/Light filtering curtains,Home Textiles/Window treatments/Curtains & drapes/Light filtering curtains,Home Textiles/Window treatments/Curtains & drapes/Light filtering curtains,"Home Textiles/Window treatments/Shades, blinds & window treatments/Pleated & cellular blinds and shades","Home Textiles/Window treatments/Shades, blinds & window treatments/Roman shades",Home Textiles/Window treatments/Curtains & drapes/Light filtering curtains,Home Textiles/Window treatments/Curtains & drapes/Panel curtains,Home Textiles/Window treatments/Curtains & drapes/Panel curtains,Home Textiles/Window treatments/Curtains & drapes/Light filtering curtains,Home Textiles/Window treatments/Curtains & drapes/Light filtering curtains,Home Textiles/Window treatments/Curtains & drapes/Light filtering curtains,Home Textiles/Window treatments/Curtain rods & rails/Track systems,Home Décor/Clocks/Alarm clocks,Kitchen & appliances/Backsplashes & wall panels/Laminate backsplashes,Kitchen & appliances/Backsplashes & wall panels/Laminate backsplashes,Kitchen & appliances/Backsplashes & wall panels/Laminate backsplashes,Baby & kids/Kids/Toys & play/Physical play,Storage & organization/Storage solution systems/PAX system/PAX doors without hinges,Storage & organization/Dressers & storage drawers/Chests of drawers,Outdoor/Umbrellas & gazebos/Patio umbrellas & bases,Home electronics/Speakers/Wi-Fi speakers,"Home improvement/Oils, stains & product care","Home improvement/Oils, stains & product care","Home improvement/Oils, stains & product care","Home improvement/Oils, stains & product care","Storage & organization/Clothes organizers/Clothes racks & stands/TURBO Clothes rack, indoor",Home Décor/Candle holders & candles/Lanterns,Storage & organization/Wall shelves & hooks/Hooks,Storage & organization/Wall shelves & hooks/Hooks,"Storage & organization/Wall shelves & hooks/Hooks/BRANDUR Rail with 4 hooks, in-","Storage & organization/Wall shelves & hooks/Hooks/BRANDUR Hook, in-",Home Décor/Flower pots & stands/Indoor plant pots,"Storage & organization/Wall shelves & hooks/Hooks/BRANDUR Hook, in-","Laundry & cleaning/Drying racks/MULIG Drying rack, indoor",Storage & organization/Storage solution systems/PAX system/PAX doors without hinges,Cookware & tableware/Serveware/Trays,Storage & organization/Storage containers/Bathroom accessories/Towel rails & towel holders,Storage & organization/Storage containers/Bathroom accessories/Towel rails & towel holders,Pet accessories/Cats,Furniture/Tables & desks/Dining tables/Up to 4 seats,Storage & organization/Clothes organizers/Clothes racks & stands,Storage & organization/Clothes organizers/Clothes racks & stands,Home Décor/Storage boxes & baskets/Baskets,Rugs/Rugs/Door mats,Bathroom/Bathroom sinks,Bathroom/Bathroom sinks,Bathroom/Bathroom sinks,Bathroom/Bathroom sinks,Bathroom/Bathroom sinks,Furniture/Tables & desks/Bar tables,Furniture/Tables & desks/Café tables,Furniture/Tables & desks/Accent tables/Coffee tables,Furniture/Tables & desks/Accent tables/Coffee tables,Storage & organization/Storage containers/Paper & media organizers/Desk accessories,Storage & organization/Storage containers/Bins & bags/Trash cans & pedal bins,Lighting/Lamps & light fixtures/Kids lighting,Bathroom/Showers/Shower heads,Furniture/Tables & desks/Dining tables/Dining table tops & underframes,Home Textiles/Window treatments/Curtains & drapes/Room darkening curtains & drapes,Cookware & tableware/Cookware & kitchenware/Cooking pans/Frying pans & skillets,Storage & organization/Wall shelves/Complete wall shelves/HEMNES Wall,Storage & organization/TV & media furniture/TV stands & benches,Home Décor/Storage boxes & baskets/Kids boxes & baskets,Cookware & tableware/Coffee & tea/Mugs & cups,Cookware & tableware/Coffee & tea/Mugs & cups,Cookware & tableware/Dinnerware/Dinnerware sets,Kitchen & appliances/Kitchen countertops/Laminate countertops,Kitchen & appliances/Kitchen countertops/Laminate countertops,Kitchen & appliances/Kitchen countertops/Laminate countertops,Kitchen & appliances/Kitchen countertops/Laminate countertops,Kitchen & appliances/Kitchen countertops/Laminate countertops,Cookware & tableware/Coffee & tea/Mugs & cups,Cookware & tableware/Dinnerware/Bowls,Cookware & tableware/Dinnerware/Side plates,Cookware & tableware/Dinnerware/Plates,"Home Textiles/Window treatments/Shades, blinds & window treatments/Black-out shades & blinds",Storage & organization/Dressers & storage drawers/Chests of drawers,Storage & organization/Dressers & storage drawers/Chests of drawers,Furniture/Tables & desks/Nightstands,Home Décor/Clocks/Alarm clocks,Home Décor/Clocks/Alarm clocks,Furniture/Tables & desks/Changing tables/SMÅGÖRA Changing table,Storage & organization/Armoires & wardrobes/Children's wardrobes,Home Décor/Mirrors/Vanity mirrors,Kitchen & appliances/Kitchen systems/SEKTION kitchen/SEKTION kitchen cabinets,Kitchen & appliances/Kitchen systems/SEKTION kitchen/SEKTION kitchen cabinets,Kitchen & appliances/Kitchen systems/SEKTION kitchen/SEKTION kitchen cabinets,Kitchen & appliances/Kitchen systems/SEKTION kitchen/SEKTION kitchen cabinets,Kitchen & appliances/Kitchen systems/SEKTION kitchen/SEKTION kitchen cabinets,Furniture/Tables & desks/Dining tables/Up to 6 seats,Kitchen & appliances/Kitchen systems/SEKTION kitchen/SEKTION kitchen cabinets,Kitchen & appliances/Kitchen systems/SEKTION kitchen/SEKTION kitchen cabinets,Kitchen & appliances/Kitchen systems/SEKTION kitchen/SEKTION kitchen cabinets,Storage & organization/Storage containers/Bathroom accessories/Towel rails & towel holders,Home electronics/Speakers/Bluetooth speakers,Home Décor/Storage boxes & baskets/Baskets,Cookware & tableware/Cookware & kitchenware/Cooking pans/Woks
Storage & organization/Display & storage cabinets/Display cabinets,Cookware & tableware/Cookware & kitchenware/Cooking pans/Grill pans & griddles,Storage & organization/Storage solution systems/PAX system/PAX Interior organizers,Storage & organization/Storage solution systems/PAX system/PAX Interior organizers,Storage & organization/Storage solution systems/OMAR system/All parts,Home Décor/Mirrors/Mirror cabinets,Home Décor/Mirrors/Mirror cabinets,Storage & organization/Storage solution systems/BESTÅ storage system/BESTÅ all parts & accessories,"Storage & organization/Shelving units, bookcases & storage options/Shelf units & cube storage",Kitchen & appliances/Kitchen drawer organization/Drawer dividers,Cookware & tableware/Knives & cutting boards/Sharpening tools,Kitchen & appliances/Kitchen systems/SEKTION kitchen/SEKTION kitchen cabinets,Storage & organization/Clothes organizers/Shoe racks & stands,"Storage & organization/Shelving units, bookcases & storage options/Shelf units & cube storage","Storage & organization/Shelving units, bookcases & storage options/Shelf units & cube storage",Storage & organization/Clothes organizers/Shoe racks & stands,Storage & organization/Storage containers/Food storage & organizing/Food containers,Storage & organization/Display & storage cabinets/Display cabinets,Storage & organization/Display & storage cabinets/Display cabinets,Storage & organization/TV & media furniture/TV stands & benches,Storage & organization/TV & media furniture/TV stands & benches,Cookware & tableware/Serveware/Trays,Cookware & tableware/Serveware/Trays,Cookware & tableware/Serveware/Trays,Storage & organization/Bags/Shopping bags & tote bags,Bathroom/Bathroom vanities/Vanity cabinets without sink,Storage & organization/Storage solution systems/BESTÅ storage system/BESTÅ all parts & accessories,Storage & organization/Bags/Travel accessories,Storage & organization/Storage solution systems/SMÅSTAD system/SMÅSTAD doors & drawers,Storage & organization/Storage solution systems/SMÅSTAD system/SMÅSTAD doors & drawers,"Home Décor/Storage boxes & baskets/Secondary storage boxes/SAMLA Lid for box, 12",Storage & organization/Storage containers/Food storage & organizing/Food containers,Home Décor/Storage boxes & baskets/Paper & media boxes,Home Décor/Storage boxes & baskets/Clothes boxes,Home Décor/Storage boxes & baskets/Secondary storage boxes,Storage & organization/Storage containers/Paper & media organizers/Desk accessories,Bathroom/Bathroom vanities/Bathroom vanity legs,Kitchen & appliances/Kitchen drawer organization/Shelves & drawers,Home electronics/Speakers/Bluetooth speakers,Baby & kids/Kids/Kids storage & organization/Children's hooks & wall organization,Home Décor/Storage boxes & baskets/Secondary storage boxes,Kitchen & appliances/Kitchen systems/SEKTION kitchen/SEKTION kitchen cabinets,Storage & organization/TV & media furniture/TV stands & benches,Cookware & tableware/Serveware/Trays,Storage & organization/Wall shelves/Shelves,Storage & organization/Wall shelves/Shelves,Furniture/Tables & desks/Desks & computer desks/Desks for home,Furniture/Tables & desks/Desks & computer desks/Desks for home,Furniture/Tables & desks/Desks & computer desks/Desks for home,Furniture/Tables & desks/Dining tables/Up to 4 seats,Furniture/Kids furniture/Kids chairs,Storage & organization/Wall shelves/Complete wall shelves,Furniture/Patio furniture/Outdoor chairs/Outdoor dining chairs,Home Décor/Noticeboards,Home Décor/Noticeboards,Home Décor/Noticeboards,Home Décor/Noticeboards,Home Décor/Noticeboards,Home Décor/Noticeboards,Home Décor/Noticeboards,Home Décor/Noticeboards,Home Décor/Noticeboards,Home Décor/Noticeboards,Home Décor/Noticeboards,Home Décor/Noticeboards,Home Décor/Noticeboards,Home Décor/Noticeboards,Home Décor/Noticeboards,Furniture/Tables & desks/Console tables & sofa tables,Kitchen & appliances/Kitchen wall organization & storage/Kitchen shelves,Kitchen & appliances/Kitchen islands & carts,Kitchen & appliances/Kitchen wall organization & storage/Kitchen shelves,"Storage & organization/Display & storage cabinets/Buffet tables, sideboard buffets & buffet cabinets",Kitchen & appliances/Kitchen systems/SUNNERSTA modular kitchen/Accessories for SUNNERSTA,Kitchen & appliances/Kitchen wall organization & storage/Wall organizers,Kitchen & appliances/Kitchen wall organization & storage/Wall organizers,Kitchen & appliances/Kitchen systems/SUNNERSTA modular kitchen/Accessories for SUNNERSTA,Kitchen & appliances/Kitchen systems/SUNNERSTA modular kitchen/Accessories for SUNNERSTA,Kitchen & appliances/Kitchen systems/SUNNERSTA modular kitchen/Accessories for SUNNERSTA,Kitchen & appliances/Kitchen systems/SUNNERSTA modular kitchen/Accessories for SUNNERSTA,"Storage & organization/Shelving units, bookcases & storage options/Storage shelves & units",Storage & organization/Storage containers/Food storage & organizing/Food containers,Storage & organization/TV & media furniture/TV stands & benches,Home electronics/Cords & chargers/Wireless charging & accessories,Furniture/Patio furniture/Outdoor tables/Outdoor dining tables,"Storage & organization/Display & storage cabinets/Buffet tables, sideboard buffets & buffet cabinets",Bathroom/Bathroom storage/Bathroom shelving units,Home improvement/Tools & hardware/Tools,Storage & organization/Wall shelves & hooks/Hooks,Home Décor/Wall décor/Picture ledges,Kitchen & appliances/Kitchen islands & carts,Home electronics/Speakers/Bluetooth speakers,Home electronics/Speakers/Bluetooth speakers,Home electronics/Speakers/Bluetooth speakers,Home electronics/Speakers/Bluetooth speakers,"Storage & organization/Shelving units, bookcases & storage options/Storage shelves & units",Home electronics/Cords & chargers/Wireless charging & accessories,Home electronics/Cords & chargers/Wireless charging & accessories,Home electronics/Speakers/Wi-Fi speakers,Home electronics/Speakers/Wi-Fi speakers
