Home Décor/Flower pots & stands/Indoor plant pots,Home Décor/Flower pots & stands/Indoor plant pots,Home Décor/Flower pots & stands/Indoor plant pots,Home Décor/Flower pots & stands/Indoor plant pots,Home Décor/Flower pots & stands/Indoor plant pots,Home Décor/Flower pots & stands/Indoor plant pots,Home Décor/Flower pots & stands/Indoor plant pots,Home Décor/Flower pots & stands/Indoor plant pots,Home Décor/Flower pots & stands/Indoor plant pots,Home Décor/Flower pots & stands/Indoor plant pots,Lighting/Lamps & light fixtures/Ceiling lights/Pendants lights,Bathroom/Bathroom faucets/Faucets,Kitchen & appliances/Kitchen faucets & sinks/Kitchen faucets,Cookware & tableware/Flatware/Flatware,Bathroom/Bathroom faucets/Faucets,Lighting/Lamps & light fixtures/Desk lamps,Cookware & tableware/Coffee & tea/Tea pots & accessories,Lighting/Integrated lighting/Bookcase lighting,Lighting/Smart lighting/Smart lighting kits,Kitchen & appliances/Kitchen faucets & sinks/Kitchen faucets,Bathroom/Bathroom faucets/Faucets,Lighting/Integrated lighting/Bookcase lighting,Kitchen & appliances/Kitchen lighting,Lighting/Integrated lighting/Bookcase lighting,Kitchen & appliances/Kitchen faucets & sinks/Kitchen faucets,Lighting/Smart lighting/Remote & smart light switches,Home Décor/Flower pots & stands/Indoor plant pots,Home Décor/Flower pots & stands/Self watering plant pots,Lighting/Smart lighting/Remote & smart light switches,Lighting/Lamps & light fixtures/Ceiling lights/Pendants lights,Lighting/Lamps & light fixtures/Ceiling lights/Ceiling lamps,Lighting/Lamps & light fixtures/Ceiling lights/Ceiling lamps,Lighting/Lamps & light fixtures/Floor lamps/FLUGBO Floor uplt,Lighting/Lamps & light fixtures/Ceiling lights/Pendants lights,Lighting/Lamps & light fixtures/Table lamps,Lighting/Lamps & light fixtures/Wall lamps/Wall lamps,Lighting/Lamps & light fixtures/Ceiling lights/Pendants lights,Lighting/Lamps & light fixtures/Ceiling lights/Ceiling lamps,Lighting/Lamps & light fixtures/Ceiling lights/Pendants lights,Cookware & tableware/Drinkware/Glasses,Kitchen & appliances/Kitchen faucets & sinks/Kitchen faucets,Lighting/Lamps & light fixtures/Ceiling lights/Ceiling track lighting,Lighting/Lamps & light fixtures/Ceiling lights/Ceiling track lighting,Kitchen & appliances/Kitchen faucets & sinks/Kitchen faucets,Kitchen & appliances/Kitchen faucets & sinks/Kitchen faucets,Lighting/Lamps & light fixtures/Wall lamps/Wall lamps,Lighting/Lamps & light fixtures/Desk lamps,Lighting/Lamps & light fixtures/Desk lamps,Lighting/Lamps & light fixtures/Desk lamps,Lighting/Lamps & light fixtures/Desk lamps,Kitchen & appliances/Kitchen faucets & sinks/Kitchen faucets,Kitchen & appliances/Kitchen lighting,"Lighting/Lamps & light fixtures/Shades, bases & cords/Lamp bases & cords",Cookware & tableware/Cookware & kitchenware/Pots & pans/Cooking & stock pots,Cookware & tableware/Kitchen & cooking accessories/Kitchen utensils/Cooking preparation tools,Storage & organization/Storage solution systems/PAX system/Knobs & handles,Lighting/Lamps & light fixtures/Ceiling lights/Ceiling track lighting,Kitchen & appliances/Kitchen faucets & sinks/Kitchen faucets,Lighting/LED Light bulbs,Cookware & tableware/Cookware & kitchenware/Cooking accessories,Home electronics/Cords & chargers/Cables & accessories,Kitchen & appliances/Kitchen faucets & sinks/Kitchen faucets,Lighting/Lamps & light fixtures/Ceiling lights/Ceiling track lighting,Lighting/Lamps & light fixtures/Ceiling lights/Ceiling track lighting,Lighting/Smart lighting/Smart lighting kits,Storage & organization/Storage solution systems/PAX system/Knobs & handles,Kitchen & appliances/Kitchen lighting,"Baby & kids/Baby/Nursing, feeding & eating",Lighting/Lamps & light fixtures/Desk lamps,Lighting/Lamps & light fixtures/Floor lamps/ARÖD Floor,Lighting/Lamps & light fixtures/Ceiling lights/Pendants lights,Baby & kids/Kids/Toys & play/Role play,Home Décor/Flower pots & stands/Indoor plant pots,Home Décor/Flower pots & stands/Indoor plant pots,Home Décor/Flower pots & stands/Indoor plant pots,Home Décor/Flower pots & stands/Indoor plant pots,Home Décor/Flower pots & stands/Indoor plant pots,Home Décor/Flower pots & stands/Indoor plant pots,Home Décor/Candle holders & candles/Candle holders,Lighting/Smart lighting/Remote & smart light switches,Kitchen & appliances/Kitchen faucets & sinks/Kitchen faucets,Storage & organization/Storage solution systems/PAX system/Knobs & handles,Storage & organization/Storage solution systems/PAX system/Knobs & handles,Storage & organization/Storage solution systems/PAX system/Knobs & handles,Lighting/Lamps & light fixtures/Floor lamps/HALKIP Floor lamp w,Lighting/Lamps & light fixtures/Wall lamps/Wall lamps,Lighting/Lamps & light fixtures/Wall lamps/Wall lamps,Cookware & tableware/Drinkware/Glasses,Lighting/Integrated lighting/Bookcase lighting,Lighting/Integrated lighting/Bookcase lighting,Lighting/Lamps & light fixtures/Ceiling lights/Pendants lights,Lighting/LED Light bulbs,Lighting/LED Light bulbs,Kitchen & appliances/Kitchen drawer organization/Drawer dividers,Lighting/Lamps & light fixtures/Ceiling lights/Ceiling lamps,Lighting/Lamps & light fixtures/Ceiling lights/Ceiling lamps,Cookware & tableware/Coffee & tea/Tea pots & accessories,Kitchen & appliances/Kitchen faucets & sinks/Kitchen faucets,Storage & organization/Storage solution systems/PAX system/Knobs & handles,Kitchen & appliances/Kitchen faucets & sinks/Kitchen faucets/VITHAVET Kitchen faucet
Home Décor/Mirrors/Wall mirrors,Lighting/Lamps & light fixtures/Wall lamps/Wall lamps,Lighting/Decorative lighting/Decorative indoor lighting,Lighting/Lamps & light fixtures/Ceiling lights/Pendants lights,Storage & organization/Storage containers/Bathroom accessories/Soap dispensers & soap dishes,Home Décor/Clocks/Wall & table clocks,Cookware & tableware/Serveware/Bowls,Baby & kids/Kids/Toys & play/Role play,Baby & kids/Kids/Toys & play/Role play,Cookware & tableware/Drinkware/Drinking accessories,Home Décor/Mirrors/Round mirrors,Gardening & plants/Plant stands & movers,Gardening & plants/Plant stands & movers,Cookware & tableware/Drinkware/Specialty glassware,Home Décor/Mirrors/Vanity mirrors,Home Décor/Mirrors/Vanity mirrors,Home Décor/Candle holders & candles/Candle holders,Kitchen & appliances/Kitchen faucets & sinks/Kitchen faucets,Bathroom/Bathroom faucets/Faucets,Kitchen & appliances/Appliances/Range hoods & filters/Wall mounted range hoods,Lighting/Lamps & light fixtures/Wall lamps/Wall spotlights,Lighting/Lamps & light fixtures/Wall lamps/Wall spotlights,Lighting/Integrated lighting/Bookcase lighting,Cookware & tableware/Knives & cutting boards/Kitchen knives,Home Décor/Mirrors/Wall mirrors,Home Décor/Mirrors/Vanity mirrors,Lighting/Lamps & light fixtures/Floor lamps,Cookware & tableware/Coffee & tea/Tea pots & accessories,Cookware & tableware/Flatware/Kids cutlery,Cookware & tableware/Knives & cutting boards/Kitchen knives,Kitchen & appliances/Kitchen faucets & sinks/Kitchen faucets,Cookware & tableware/Coffee & tea/Tea pots & accessories,Lighting/Integrated lighting/Bookcase lighting,Cookware & tableware/Kitchen & cooking accessories/Kitchen utensils/Cooking preparation tools,Home Décor/Decorative accessories,Home Décor/Decorative accessories,Home Décor/Decorative accessories,Home Décor/Decorative accessories,Kitchen & appliances/Kitchen systems/SEKTION kitchen/SEKTION kitchen cabinets,Cookware & tableware/Serveware/Serving dishes,Home Décor/Flower pots & stands/Indoor plant pots,Home Textiles/Window treatments/Curtain rods & rails/Curtain rods,Cookware & tableware/Coffee & tea/Vacuum flasks,Lighting/Bathroom lighting/Bathroom vanity lights,Lighting/Bathroom lighting/Bathroom vanity lights,Lighting/Bathroom lighting/Bathroom vanity lights,Cookware & tableware/Dishwashing accessories/Sink accessories,Cookware & tableware/Bakeware/Baking pans & molds,Cookware & tableware/Coffee & tea/Coffee makers & accessories,Home electronics/Speakers/Wi-Fi speakers,Home electronics/Speakers/Wi-Fi speakers,"Outdoor/Outdoor storage benches, boxes & cabinets",Cookware & tableware/Coffee & tea/Coffee makers & accessories,Kitchen & appliances/Kitchen faucets & sinks/Kitchen faucets,Cookware & tableware/Flatware/Flatware,Home Textiles/Window treatments/Curtain rods & rails/Curtain rods,Home Textiles/Window treatments/Curtain rods & rails/Curtain rods,Home Textiles/Window treatments/Curtain rods & rails/Curtain rods,Home Textiles/Window treatments/Curtain rods & rails/Curtain rods,Home Textiles/Window treatments/Curtain rods & rails/Curtain rods,Home Textiles/Window treatments/Curtain rods & rails/Curtain rods,Home Textiles/Window treatments/Curtain rods & rails/Curtain rods,Cookware & tableware/Knives & cutting boards/Kitchen knives,Cookware & tableware/Knives & cutting boards/Kitchen knives,Lighting/Lamps & light fixtures/Table lamps,Cookware & tableware/Drinkware/Glasses,Home electronics/Cords & chargers/Batteries & battery chargers,Home electronics/Cords & chargers/Batteries & battery chargers,Home electronics/Cords & chargers/Batteries & battery chargers,Storage & organization/Storage containers/Bathroom accessories/Bathroom accessory sets,Storage & organization/Storage containers/Food storage & organizing/Jars & tins,Home electronics/Cords & chargers/Cables & accessories,Cookware & tableware/Kitchen & cooking accessories/Kitchen utensils/Cooking preparation tools,Cookware & tableware/Flatware/Flatware,Cookware & tableware/Coffee & tea/Vacuum flasks,Home Décor/Clocks/Wall & table clocks/KLOCKIS Clock/thermometer,Cookware & tableware/Kitchen & cooking accessories/Kitchen utensils/Colanders & strainers,Cookware & tableware/Dishwashing accessories/Dish drainers & drying racks,Cookware & tableware/Coffee & tea/Tea pots & accessories,Lighting/Lamps & light fixtures/Table lamps,Lighting/Lamps & light fixtures/Table lamps,Cookware & tableware/Dinnerware/Bowls,Cookware & tableware/Coffee & tea/Mugs & cups,Cookware & tableware/Dinnerware/Plates,Cookware & tableware/Dinnerware/Side plates,Cookware & tableware/Serveware/Serving dishes,Cookware & tableware/Dinnerware/Deep plates/STRIMMIG Deep plate,Lighting/Lamps & light fixtures/Ceiling lights/Pendants lights,Home Décor/Decorative accessories,Cookware & tableware/Flatware/Flatware,Cookware & tableware/Kitchen & cooking accessories/Kitchen utensils/Cooking preparation tools,Cookware & tableware/Serveware/Trays,Kitchen & appliances/Kitchen faucets & sinks/Kitchen faucets,Home Décor/Mirrors/Wall mirrors,Cookware & tableware/Kitchen & cooking accessories/Kitchen utensils/Cooking preparation tools,Cookware & tableware/Kitchen & cooking accessories/Kitchen utensils/Cooking preparation tools,Lighting/Decorative lighting/Decorative outdoor lighting,Lighting/Decorative lighting/Decorative outdoor lighting,Lighting/Decorative lighting/Decorative outdoor lighting,Lighting/Decorative lighting/Decorative outdoor lighting
Cookware & tableware/Coffee & tea/Mugs & cups,Home Décor/Mirrors/Wall mirrors,Home Décor/Mirrors/Wall mirrors,Home Décor/Mirrors/Wall mirrors,Home Décor/Clocks/Wall & table clocks,Home Décor/Clocks/Wall & table clocks,Home Décor/Clocks/Wall & table clocks,Home Décor/Clocks/Wall & table clocks,Home Décor/Clocks/Wall & table clocks,Storage & organization/Storage containers/Food storage & organizing/Spice & condiment stands,Storage & organization/Storage solution systems/PAX system/PAX doors without hinges,Storage & organization/Storage solution systems/PAX system/PAX doors without hinges,Storage & organization/Storage solution systems/PAX system/PAX doors without hinges,Home Textiles/Window treatments/Curtain rods & rails/Curtain rods,Home Textiles/Window treatments/Curtain rods & rails/Curtain rods,Home electronics/Cords & chargers/Wireless charging & accessories,Home electronics/Cords & chargers/Wireless charging & accessories,Home electronics/Cords & chargers/Wireless charging & accessories,Storage & organization/Storage containers/Food storage & organizing/Food containers,Storage & organization/Storage containers/Food storage & organizing/Food containers,Storage & organization/Storage containers/Food storage & organizing/Food containers,Storage & organization/Storage containers/Bathroom accessories/Toilet brushes,Storage & organization/Storage containers/Food storage & organizing/Spice & condiment stands,Home Textiles/Window treatments/Curtains & drapes/Light filtering curtains,Cookware & tableware/Dinnerware/Bowls,Home Décor/Clocks/Wall & table clocks,Cookware & tableware/Serveware/Serving dishes,Cookware & tableware/Dinnerware/Side plates,Cookware & tableware/Drinkware/Pitchers & carafes,Cookware & tableware/Coffee & tea/Mugs & cups,Cookware & tableware/Dinnerware/Deep plates/VARDAGEN Deep plate,Cookware & tableware/Drinkware/Specialty glassware,Cookware & tableware/Coffee & tea/Mugs & cups,Cookware & tableware/Dinnerware/Plates,Cookware & tableware/Serveware/Bowls,Cookware & tableware/Dinnerware/Bowls,Cookware & tableware/Table linen/Table cloths & runners,Outdoor/Grills,Bathroom/Bathroom textiles/Shower curtains,Bathroom/Bathroom textiles/Shower curtains,Bathroom/Bathroom textiles/Shower curtains,Outdoor/Grills,Outdoor/Grills,Storage & organization/Storage containers/Food storage & organizing/Food containers,Cookware & tableware/Drinkware/Glasses,Storage & organization/Storage containers/Bathroom accessories/Towel rails & towel holders,Storage & organization/Storage containers/Bathroom accessories/Towel rails & towel holders,Home Décor/Flower pots & stands/Indoor plant pots,Storage & organization/Storage containers/Bathroom accessories/Towel rails & towel holders,Home improvement/Home safety/Child safety,Baby & kids/Kids/Toys & play/Wooden toys,Cookware & tableware/Dishwashing accessories/Dish brushes,Home Décor/Flower pots & stands/Indoor plant pots,Furniture/Tables & desks/Accent tables/Coffee tables,Cookware & tableware/Dinnerware/Plates,Storage & organization/Storage solution systems/PAX system/PAX sliding doors,Storage & organization/Storage solution systems/PAX system/PAX sliding doors,Storage & organization/Storage solution systems/PAX system/PAX sliding doors,Home Textiles/Window treatments/Curtain rods & rails/Curtain rods,Cookware & tableware/Knives & cutting boards/Kitchen knives,Storage & organization/Storage containers/Food storage & organizing/Food containers,Baby & kids/Kids/Toys & play/Role play,Lighting/Lamps & light fixtures/Kids lighting,Lighting/Lamps & light fixtures/Kids lighting,Cookware & tableware/Dinnerware/Deep plates/OFTAST Deep plate,Cookware & tableware/Dinnerware/Side plates,Cookware & tableware/Serveware/Bowls,Cookware & tableware/Dinnerware/Plates,Cookware & tableware/Dinnerware/Bowls,Cookware & tableware/Dinnerware/Bowls,Home Décor/Mirrors/Wall mirrors,Home Décor/Mirrors/Wall mirrors,Cookware & tableware/Knives & cutting boards/Kitchen knives,Baby & kids/Baby/Baby toys/12+ months,Bathroom/Bathroom storage/Bathroom storage/Bathroom tall cabinets,Furniture/Tables & desks/Accent tables/End tables & side tables,Furniture/Tables & desks/Accent tables/End tables & side tables,Furniture/Tables & desks/Accent tables/End tables & side tables,Bathroom/Showers/Shower heads,Cookware & tableware/Table linen/Place mats & coasters,Cookware & tableware/Table linen/Place mats & coasters,Cookware & tableware/Table linen/Place mats & coasters,Cookware & tableware/Table linen/Place mats & coasters,Cookware & tableware/Serveware/Trays,Cookware & tableware/Napkins & napkin holders/Napkins,Cookware & tableware/Bakeware/Mixing bowls,Storage & organization/Storage containers/Bathroom accessories/Bathroom accessory sets,Baby & kids/Kids/Toys & play/Soft toys,Baby & kids/Kids/Toys & play/Soft toys,Baby & kids/Kids/Toys & play/Soft toys,Baby & kids/Kids/Toys & play/Soft toys,Baby & kids/Kids/Toys & play/Soft toys,Baby & kids/Kids/Toys & play/Soft toys,Baby & kids/Kids/Toys & play/Soft toys,Baby & kids/Kids/Toys & play/Soft toys,Baby & kids/Kids/Toys & play/Soft toys,Baby & kids/Kids/Toys & play/Soft toys,Baby & kids/Kids/Toys & play/Soft toys,Home Décor/Flower pots & stands/Indoor plant pots,Cookware & tableware/Dinnerware/Deep plates/FÄRGKLAR Deep plate
Storage & organization/Storage solution systems/PAX system/PAX sliding doors,Furniture/Tables & desks/Desks & computer desks/Desks for home,Baby & kids/Kids/Toys & play/Physical play,Cookware & tableware/Dinnerware/Deep plates/VÄRDERA Deep plate,Home improvement/Home safety/Child safety,Rugs/Rugs/Runners & small rugs,Rugs/Rugs/Runners & small rugs,Cookware & tableware/Knives & cutting boards/Cutting boards,Storage & organization/Wall shelves & hooks/Hooks,Cookware & tableware/Knives & cutting boards/Cutting boards,Cookware & tableware/Knives & cutting boards/Cutting boards,Home Décor/Mirrors/Wall mirrors,Home Décor/Mirrors/Wall mirrors,Home Décor/Mirrors/Vanity mirrors,Home Textiles/Window treatments/Curtain rods & rails/Track systems,Home Décor/Wall décor/Picture & photo frames,Home Décor/Wall décor/Collage picture frames,Cookware & tableware/Dinnerware/Plates,Cookware & tableware/Knives & cutting boards/Cutting boards,Furniture/Tables & desks/Nightstands,Furniture/Patio furniture/Outdoor tables/Outdoor dining tables,Storage & organization/Clothes organizers/Clothes racks & stands,Home Textiles/Window treatments/Curtain rods & rails/Curtain rods,Home Textiles/Window treatments/Curtain rods & rails/Curtain rods,Home Décor/Storage boxes & baskets/Kids boxes & baskets,Home Décor/Decorative accessories,Laundry & cleaning/Cleaning accessories,Outdoor/Outdoor flooring,Outdoor/Outdoor flooring,Outdoor/Outdoor flooring,Cookware & tableware/Dinnerware/Side plates,Storage & organization/Storage solution systems/BESTÅ storage system/BESTÅ all parts & accessories,Storage & organization/Storage containers/Food storage & organizing/Food containers,Furniture/Patio furniture/Outdoor tables/Outdoor dining tables,Storage & organization/Storage containers/Food storage & organizing/Food containers,Home Décor/Storage boxes & baskets/Clothes boxes,Home Textiles/Window treatments/Curtain rods & rails/Track systems,Kitchen & appliances/Kitchen drawer organization/Kitchen trash cans & bins,Furniture/Sofas & sectionals/Ottomans/Fabric ottomans,Kitchen & appliances/Kitchen systems/SEKTION kitchen/SEKTION kitchen cabinets,Kitchen & appliances/Kitchen systems/SEKTION kitchen/SEKTION kitchen cabinets,Kitchen & appliances/Kitchen systems/SEKTION kitchen/SEKTION kitchen cabinets,Kitchen & appliances/Kitchen systems/SEKTION kitchen/SEKTION kitchen cabinets,Kitchen & appliances/Kitchen systems/SEKTION kitchen/SEKTION kitchen cabinets,Home Textiles/Window treatments/Curtain rods & rails/Track systems,Home Textiles/Window treatments/Curtain rods & rails/Track systems,Home Textiles/Window treatments/Curtain rods & rails/Track systems,Home Textiles/Window treatments/Curtain rods & rails/Track systems,Cookware & tableware/Cookware & kitchenware/Ovenware,Furniture/Tables & desks/Dining tables/Up to 6 seats,Home improvement/Home safety/Child safety,Kitchen & appliances/Kitchen islands & carts,Furniture/Tables & desks/Kids tables,Storage & organization/Armoires & wardrobes/Solitaire wardrobes,Bathroom/Bathroom storage/Bathroom shelving units,Home Décor/Mirrors/Makeup & magnifying mirrors,Furniture/Tables & desks/Accent tables/End tables & side tables,Cookware & tableware/Dinnerware/Dinnerware sets,Furniture/Tables & desks/Desks & computer desks/Desks for home,Furniture/Tables & desks/Accent tables/Coffee tables,"Storage & organization/Shelving units, bookcases & storage options/Shelf units & cube storage",Home Décor/Wall décor/Picture & photo frames,Home Décor/Wall décor/Picture & photo frames,Home Décor/Wall décor/Picture & photo frames,Home Décor/Wall décor/Picture & photo frames,Kitchen & appliances/Kitchen countertops/Butcher block countertops,Kitchen & appliances/Kitchen countertops/Butcher block countertops,Kitchen & appliances/Kitchen countertops/Butcher block countertops,Kitchen & appliances/Kitchen countertops/Butcher block countertops,Kitchen & appliances/Kitchen countertops/Butcher block countertops,Kitchen & appliances/Kitchen countertops/Butcher block countertops,"Storage & organization/Display & storage cabinets/Buffet tables, sideboard buffets & buffet cabinets",Home Décor/Storage boxes & baskets/Kids boxes & baskets,Home Décor/Storage boxes & baskets/Kids boxes & baskets,Furniture/Tables & desks/Dining tables/Up to 10 seats,Furniture/Room dividers,Storage & organization/Storage containers/Bathroom accessories/Towel rails & towel holders,Furniture/Chairs/Dining chairs/Dining chairs,Kitchen & appliances/Kitchen islands & carts,Furniture/Patio furniture/Outdoor tables/Outdoor coffee & side tables,Furniture/Tables & desks/Accent tables/Coffee tables,Home Décor/Wall décor/Picture & photo frames,Home Décor/Wall décor/Picture & photo frames,Storage & organization/Storage solution systems/BESTÅ storage system/BESTÅ all parts & accessories,Furniture/Tables & desks/Café tables,Furniture/Tables & desks/Bar tables,Storage & organization/Storage solution systems/PAX system/PAX sliding doors,Cookware & tableware/Dishwashing accessories/Dish brushes,Storage & organization/Dressers & storage drawers/Chests of drawers,Cookware & tableware/Cookware & kitchenware/Cooking accessories,Cookware & tableware/Dinnerware/Dinnerware sets,Laundry & cleaning/Cleaning accessories,Home Textiles/Window treatments/Curtains & drapes/Panel curtains,Outdoor/Umbrellas & gazebos/Patio umbrellas & bases,Furniture/Patio furniture/Outdoor tables/Outdoor dining tables,Storage & organization/Bags/Bag organizers,Cookware & tableware/Cookware & kitchenware/Cooking pans/Frying pans & skillets,Furniture/Chairs/Desk chairs/Desk chairs for home,Home Décor/Wall décor/Art cards,Furniture/Chairs/Bar stools & chairs
