Storage & organization/Storage containers/Clothes organizers/Hanging clothes organizers,Storage & organization/Storage containers/Hooks & hangers/Hangers,Storage & organization/Dressers & storage drawers/Drawer units/Drawer units for home,Storage & organization/Dressers & storage drawers/Drawer units/Drawer units for home,Storage & organization/Storage containers/Clothes organizers/Hanging clothes organizers,Storage & organization/Armoires & wardrobes/Solitaire wardrobes,Storage & organization/Armoires & wardrobes/Solitaire wardrobes,Furniture/Beds/Bed legs,Furniture/Sofas & sectionals/Sectionals/Sofa modules,Furniture/Sofas & sectionals/Ottomans/Fabric ottomans,"Baby & kids/Baby/Changing, bathing & potty/Potties & baby baths",Furniture/Sofas & sectionals/Sofa legs,Furniture/Sofas & sectionals/Sofa legs,Furniture/Chairs/Dining chairs/Dining chairs,Storage & organization/Storage containers/Food storage & organizing/Food containers,Storage & organization/Storage solution systems/PAX system/PAX Interior organizers,Bathroom/Bathroom stools & benches,Furniture/Beds/Twin beds,Furniture/Chairs/Dining chairs/Dining chairs,Storage & organization/Storage containers/Paper & media organizers/Desk accessories,Furniture/Tables & desks/Changing tables,Furniture/Tables & desks/Nightstands,Laundry & cleaning/Laundry baskets,Furniture/Chairs/Bar stools & chairs,Furniture/Chairs/Dining chairs/Dining chairs,Furniture/Patio furniture/Outdoor sofa sections,Furniture/Kids furniture/Kids chairs,Furniture/Armchairs & chaises/Fabric armchairs,Home Décor/Storage boxes & baskets/Paper & media boxes,Home Décor/Storage boxes & baskets/Baskets,Furniture/Beds/Cribs,Home Décor/Storage boxes & baskets/Baskets,Home Décor/Storage boxes & baskets/Baskets,Furniture/Chairs/Desk chairs/Desk chairs for home,Furniture/Armchairs & chaises/Coated fabric armchairs,Cookware & tableware/Dishwashing accessories/Sink accessories,Furniture/Patio furniture/Outdoor chairs/Outdoor dining chairs,Rugs/Rugs/Runners & small rugs,Rugs/Rugs/Door mats,Rugs/Rugs/Large & medium rugs,Furniture/Beds/Cribs,Storage & organization/Storage containers/Bins & bags/Trash cans & pedal bins,Storage & organization/Storage containers/Hooks & hangers/Hangers,Furniture/Chairs/Dining chairs/Dining chairs,Furniture/Chairs/Dining chairs/Dining chairs,Furniture/Kids furniture/Kids chairs,Furniture/Tables & desks/Accent tables/Coffee tables,Furniture/Tables & desks/Accent tables/Coffee tables,Storage & organization/Wall shelves & hooks/Hooks,Furniture/Beds/Kids beds/Bunk beds,Cookware & tableware/Serveware/Trays,Furniture/Chairs/Dining chairs/Upholstered chairs,Storage & organization/Armoires & wardrobes/Solitaire wardrobes,Furniture/Tables & desks/Accent tables/End tables & side tables,Furniture/Armchairs & chaises/Fabric armchairs,Storage & organization/Storage solution systems/PAX system/PAX Interior organizers,Storage & organization/Storage solution systems/PAX system/PAX Interior organizers,Furniture/Patio furniture/Outdoor chairs/Outdoor dining chairs,"Storage & organization/Shelving units, bookcases & storage options/Storage shelves & units",Storage & organization/Storage containers/Paper & media organizers/Magazine files,Furniture/Chairs/Desk chairs/Desk chairs for home,Furniture/Tables & desks/Changing tables,Furniture/Tables & desks/Changing tables,Furniture/Patio furniture/Outdoor chaises & hammocks,Storage & organization/Armoires & wardrobes/Solitaire wardrobes,Storage & organization/Armoires & wardrobes/Solitaire wardrobes,Storage & organization/Armoires & wardrobes/Solitaire wardrobes,Furniture/Chairs/Desk chairs/Desk chairs for home,Storage & organization/Armoires & wardrobes/Solitaire wardrobes,Storage & organization/Armoires & wardrobes/Solitaire wardrobes,Storage & organization/Bags/Backpacks & messenger bags,Storage & organization/Armoires & wardrobes/Solitaire wardrobes,Bathroom/Bathroom vanities/Vanity cabinets without sink,Storage & organization/Dressers & storage drawers/Chests of drawers,Furniture/Armchairs & chaises/Lounge chairs,Home Décor/Storage boxes & baskets/Secondary storage boxes,Cookware & tableware/Dishwashing accessories/Dish drainers & drying racks,Storage & organization/Storage containers/Paper & media organizers/Desk accessories,Furniture/Patio furniture/Outdoor chairs/Outdoor dining chairs,Storage & organization/Clothes organizers/Shoe racks & stands,Storage & organization/Clothes organizers/Coat stands,Rugs/Rugs/Runners & small rugs,Kitchen & appliances/Kitchen drawer organization/Cleaning organizers,Furniture/Chairs/Bar stools & chairs,Storage & organization/Storage solution systems/PAX system/PAX Interior organizers,Furniture/Chairs/Café chairs,Beds & mattresses/Mattresses/Spring mattresses,Home Textiles/Window treatments/Curtains & drapes/Room darkening curtains & drapes,Home Textiles/Window treatments/Curtains & drapes/Room darkening curtains & drapes,Outdoor/Outdoor flooring,Storage & organization/Storage containers/Bathroom accessories/Towel rails & towel holders,Furniture/Tables & desks/Accent tables/Coffee tables,Furniture/Tables & desks/Accent tables/End tables & side tables,Furniture/Beds/Kids beds/Junior & extendable beds,Storage & organization/Storage containers/Hooks & hangers/Hangers,Home Décor/Storage boxes & baskets/Clothes boxes,Furniture/Chairs/Dining chairs/Dining chairs,Furniture/Chairs/Bar stools & chairs,Home electronics/Cords & chargers/Cables & accessories,Home electronics/Cords & chargers/Cables & accessories
Storage & organization/Storage solution systems/SMÅSTAD system/SMÅSTAD doors & drawers,Storage & organization/Storage solution systems/SMÅSTAD system/SMÅSTAD doors & drawers,Storage & organization/Wall shelves/Brackets,Storage & organization/Wall shelves/Brackets,Storage & organization/Wall shelves/Brackets,Storage & organization/Storage containers/Paper & media organizers/Desk accessories,Storage & organization/Display & storage cabinets/Dining room cabinets & cupboards,"Storage & organization/Shelving units, bookcases & storage options/Bookcases",Storage & organization/Display & storage cabinets/Dining room cabinets & cupboards,"Storage & organization/Storage solution systems/ELVARLI system/Post, side units & interiors",Bathroom/Bathroom storage/Bathroom shelving units,Storage & organization/Storage solution systems/BOAXEL system/BOAXEL parts,Storage & organization/Storage containers/Bins & bags/Trash cans & pedal bins,Storage & organization/Storage containers/Bins & bags/Trash cans & pedal bins,"Storage & organization/Storage solution systems/ELVARLI system/Post, side units & interiors",Cookware & tableware/Knives & cutting boards/Cutting boards,Storage & organization/Wall shelves/Brackets,Storage & organization/TV & media furniture/TV stands & benches,Storage & organization/TV & media furniture/TV stands & benches,Storage & organization/TV & media furniture/TV stands & benches,Kitchen & appliances/Kitchen systems/SEKTION kitchen/SEKTION kitchen cabinets,Kitchen & appliances/Kitchen drawer organization/Shelves & drawers,"Storage & organization/Storage solution systems/ELVARLI system/Post, side units & interiors","Storage & organization/Storage solution systems/ELVARLI system/Post, side units & interiors",Storage & organization/Armoires & wardrobes/Solitaire wardrobes,"Storage & organization/Storage solution systems/ELVARLI system/Post, side units & interiors","Storage & organization/Storage solution systems/ELVARLI system/Post, side units & interiors","Storage & organization/Storage solution systems/ELVARLI system/Post, side units & interiors",Storage & organization/Storage solution systems/IVAR system/All parts,"Storage & organization/Storage solution systems/ELVARLI system/Post, side units & interiors","Storage & organization/Shelving units, bookcases & storage options/Shelf units & cube storage",Home Décor/Storage boxes & baskets/Kids boxes & baskets,Furniture/Tables & desks/Console tables & sofa tables,Storage & organization/Wall shelves/Brackets,Bathroom/Bathroom storage/Bathroom storage/Bathroom tall cabinets,Storage & organization/Clothes organizers/Shoe racks & stands,Storage & organization/Clothes organizers/Shoe racks & stands,Storage & organization/Storage containers/Paper & media organizers/Magazine files,Storage & organization/Display & storage cabinets/Display cabinets,Storage & organization/Display & storage cabinets/Display cabinets,Storage & organization/Storage solution systems/PAX system/PAX Interior organizers,Storage & organization/Storage solution systems/PAX system/PAX Interior organizers,"Storage & organization/Shelving units, bookcases & storage options/Storage shelves & units",Furniture/Tables & desks/Desks & computer desks/Desks for home,Furniture/Tables & desks/Accent tables/End tables & side tables,Storage & organization/Display & storage cabinets/Dining room cabinets & cupboards,"Storage & organization/Shelving units, bookcases & storage options/Shelf units & cube storage",Storage & organization/Storage solution systems/IVAR system/All parts,Home Décor/Wall décor/Picture ledges,Kitchen & appliances/Kitchen drawer organization/Drawer dividers,Storage & organization/Storage solution systems/BOAXEL system/BOAXEL parts,Storage & organization/TV & media furniture/TV stands & benches,Storage & organization/Storage solution systems/PAX system/PAX Interior organizers,Storage & organization/Storage solution systems/PAX system/PAX Interior organizers,"Storage & organization/Shelving units, bookcases & storage options/Bookcases",Kitchen & appliances/Kitchen systems/SEKTION kitchen/SEKTION kitchen cabinets,"Storage & organization/Storage solution systems/ELVARLI system/Post, side units & interiors","Storage & organization/Storage solution systems/ELVARLI system/Post, side units & interiors",Home Décor/Mirrors/Vanity mirrors,Kitchen & appliances/Appliances/Refrigerators & freezers/Free-standing refrigerators,Storage & organization/Display & storage cabinets/Display cabinets,Kitchen & appliances/Kitchen drawer organization/Drawer dividers,Kitchen & appliances/Kitchen drawer organization/Drawer dividers,Storage & organization/Storage solution systems/BOAXEL system/BOAXEL parts,Laundry & cleaning/Ironing boards,Furniture/Chairs/Stools & benches/Stools,Furniture/Chairs/Bar stools & chairs,Storage & organization/Storage solution systems/IVAR system/All parts,Furniture/Patio furniture/Outdoor tables/Outdoor coffee & side tables,"Storage & organization/Shelving units, bookcases & storage options/Shelf units & cube storage",Furniture/Tables & desks/Desks & computer desks/Desks for home,Storage & organization/Dressers & storage drawers/Drawer units/Drawer units for home,Storage & organization/Storage containers/Paper & media organizers/Desk accessories,Storage & organization/Display & storage cabinets/Filing cabinets & storage cabinets/Office storage cabinets & units,Home Décor/Mirrors/Mirror cabinets,Furniture/Tables & desks/Console tables & sofa tables,Furniture/Tables & desks/Accent tables/End tables & side tables,Furniture/Tables & desks/Accent tables/End tables & side tables,Furniture/Tables & desks/Accent tables/Coffee tables,Furniture/Tables & desks/Accent tables/Coffee tables,Furniture/Tables & desks/Accent tables/Coffee tables,Furniture/Tables & desks/Accent tables/Coffee tables,Storage & organization/Display & storage cabinets/Dining room cabinets & cupboards,Kitchen & appliances/Appliances/Refrigerators & freezers/Free-standing refrigerators,Kitchen & appliances/Appliances/Refrigerators & freezers/Free-standing refrigerators,"Storage & organization/Shelving units, bookcases & storage options/Shelf units & cube storage",Storage & organization/Storage solution systems/BOAXEL system/BOAXEL parts,Storage & organization/Storage containers/Food storage & organizing/Wine racks,Storage & organization/Storage containers/Paper & media organizers/Desk accessories,"Storage & organization/Shelving units, bookcases & storage options/Shelf units & cube storage",Storage & organization/Display & storage cabinets/Dining room cabinets & cupboards,Storage & organization/Clothes organizers/Clothes racks & stands,Furniture/Tables & desks/Bar tables,Storage & organization/Storage containers/Cable management & accessories,Home Décor/Clocks/Wall & table clocks,Home electronics/Speakers/Wi-Fi speakers,Storage & organization/Display & storage cabinets/Dining room cabinets & cupboards,Storage & organization/Storage containers/Paper & media organizers/Desk accessories,Storage & organization/Storage solution systems/BESTÅ storage system/BESTÅ all parts & accessories,Storage & organization/Storage solution systems/BOAXEL system/BOAXEL parts
Kitchen & appliances/Kitchen systems/SEKTION kitchen/SEKTION kitchen cabinets,Kitchen & appliances/Kitchen systems/SEKTION kitchen/SEKTION kitchen cabinets,Kitchen & appliances/Kitchen systems/SEKTION kitchen/SEKTION kitchen cabinets,Kitchen & appliances/Kitchen systems/SEKTION kitchen/SEKTION kitchen cabinets,Kitchen & appliances/Kitchen systems/SEKTION kitchen/SEKTION kitchen cabinets,Home Textiles/Window treatments/Curtain rods & rails/Track systems,Home Textiles/Window treatments/Curtain rods & rails/Track systems,Home Textiles/Window treatments/Curtain rods & rails/Track systems,Home Textiles/Window treatments/Curtain rods & rails/Track systems,Home Textiles/Window treatments/Curtain rods & rails/Curtain rods,Furniture/Tables & desks/Nightstands,Cookware & tableware/Knives & cutting boards/Cutting boards,Furniture/Patio furniture/Outdoor tables/Outdoor dining tables,Furniture/Patio furniture/Outdoor tables/Outdoor dining tables,Home Textiles/Window treatments/Curtain rods & rails/Curtain rods,Home Décor/Wall décor/Picture & photo frames,Home Décor/Wall décor/Picture & photo frames,Home Décor/Wall décor/Picture & photo frames,Home Décor/Wall décor/Picture & photo frames,Furniture/Tables & desks/Dining tables/Up to 10 seats,Home Décor/Mirrors/Vanity mirrors,Home Décor/Mirrors/Wall mirrors,Home Décor/Mirrors/Wall mirrors,Furniture/Patio furniture/Outdoor tables/Outdoor dining tables,Furniture/Tables & desks/Desks & computer desks/Desks for home,Laundry & cleaning/Cleaning accessories,Furniture/Sofas & sectionals/Ottomans/Fabric ottomans,Home Décor/Wall décor/Art cards,Rugs/Rugs/Door mats,Home Décor/Storage boxes & baskets/Kids boxes & baskets,Bathroom/Bathroom textiles/Shower curtains,Home Textiles/Window treatments/Curtain rods & rails/Track systems,Furniture/Tables & desks/Bar tables,Furniture/Tables & desks/Café tables,Home Décor/Mirrors/Vanity mirrors,Storage & organization/Wall shelves & hooks/Hooks,Furniture/Tables & desks/Dining tables/Up to 4 seats,Home Décor/Decorative accessories,"Storage & organization/Clothes organizers/Clothes racks & stands/TURBO Clothes rack, indoor","Storage & organization/Wall shelves & hooks/Hooks/BRANDUR Rail with 4 hooks, in-","Storage & organization/Wall shelves & hooks/Hooks/BRANDUR Hook, in-",Home Décor/Candle holders & candles/Lanterns,"Storage & organization/Wall shelves & hooks/Hooks/BRANDUR Hook, in-","Laundry & cleaning/Drying racks/MULIG Drying rack, indoor",Storage & organization/Wall shelves & hooks/Hooks,Storage & organization/Wall shelves & hooks/Hooks,Home Décor/Flower pots & stands/Indoor plant pots,Baby & kids/Baby/Baby toys/Newborn,Home Textiles/Window treatments/Curtain rods & rails/Track systems,Furniture/Tables & desks/Accent tables/End tables & side tables,Storage & organization/Storage solution systems/PAX system/PAX sliding doors,Storage & organization/Clothes organizers/Shoe racks & stands,Home Décor/Storage boxes & baskets/Baskets,Home Décor/Storage boxes & baskets/Baskets,Cookware & tableware/Dinnerware/Dinnerware sets,Furniture/Tables & desks/Dining tables/Up to 4 seats,"Storage & organization/Display & storage cabinets/Buffet tables, sideboard buffets & buffet cabinets",Furniture/Patio furniture/Outdoor benches,Kitchen & appliances/Kitchen countertops/Laminate countertops,Kitchen & appliances/Kitchen countertops/Laminate countertops,Kitchen & appliances/Kitchen countertops/Laminate countertops,Kitchen & appliances/Kitchen countertops/Laminate countertops,Kitchen & appliances/Kitchen countertops/Laminate countertops,Storage & organization/Storage containers/Bins & bags/Trash cans & pedal bins,Storage & organization/Storage containers/Paper & media organizers/Desk accessories,Kitchen & appliances/Kitchen countertops/Butcher block countertops,Kitchen & appliances/Kitchen countertops/Butcher block countertops,Kitchen & appliances/Kitchen countertops/Butcher block countertops,Kitchen & appliances/Kitchen countertops/Butcher block countertops,Kitchen & appliances/Kitchen countertops/Butcher block countertops,Kitchen & appliances/Kitchen countertops/Butcher block countertops,Furniture/Patio furniture/Outdoor chaises & hammocks,Cookware & tableware/Dinnerware/Plates,Storage & organization/TV & media furniture/TV stands & benches,Storage & organization/Wall shelves/Complete wall shelves/HEMNES Wall,Cookware & tableware/Cookware & kitchenware/Ovenware,Cookware & tableware/Knives & cutting boards/Cutting boards,Cookware & tableware/Knives & cutting boards/Cutting boards,Cookware & tableware/Knives & cutting boards/Cutting boards,Furniture/Tables & desks/Makeup vanities & dressing tables,Home Décor/Wall décor/Picture & photo frames,Home Décor/Wall décor/Picture & photo frames,Home Décor/Wall décor/Picture & photo frames,Cookware & tableware/Dinnerware/Deep plates/VÄRDERA Deep plate,Baby & kids/Kids/Toys & play/Physical play,Home Décor/Flower pots & stands/Outdoor plant pots,Cookware & tableware/Cookware & kitchenware/Cooking pans/Frying pans & skillets,Home Décor/Wall décor/Picture & photo frames,Home Décor/Wall décor/Picture & photo frames,Home Textiles/Window treatments/Curtains & drapes/Room darkening curtains & drapes,Cookware & tableware/Cookware & kitchenware/Cooking accessories,Furniture/Chairs/Stools & benches/Benches,Furniture/Chairs/Dining chairs/Dining chairs,Furniture/Chairs/Dining chairs/Dining chairs,Home improvement/Home safety/Child safety,Rugs/Rugs/Runners & small rugs,Rugs/Rugs/Runners & small rugs,"Storage & organization/Shelving units, bookcases & storage options/Shelf units & cube storage",Lighting/Lamps & light fixtures/Kids lighting,Furniture/Sofas & sectionals/Sofa accessories
Kitchen & appliances/Kitchen systems/SEKTION kitchen/SEKTION kitchen cabinets,Kitchen & appliances/Kitchen systems/SEKTION kitchen/SEKTION kitchen cabinets,Kitchen & appliances/Kitchen systems/SEKTION kitchen/SEKTION kitchen cabinets,Kitchen & appliances/Kitchen systems/SEKTION kitchen/SEKTION kitchen cabinets,Kitchen & appliances/Kitchen systems/SEKTION kitchen/SEKTION kitchen cabinets,Home Textiles/Window treatments/Curtain rods & rails/Track systems,Home Textiles/Window treatments/Curtain rods & rails/Track systems,Home Textiles/Window treatments/Curtain rods & rails/Track systems,Home Textiles/Window treatments/Curtain rods & rails/Track systems,Home Textiles/Window treatments/Curtain rods & rails/Curtain rods,Furniture/Tables & desks/Nightstands,Cookware & tableware/Knives & cutting boards/Cutting boards,Furniture/Patio furniture/Outdoor tables/Outdoor dining tables,Furniture/Patio furniture/Outdoor tables/Outdoor dining tables,Home Textiles/Window treatments/Curtain rods & rails/Curtain rods,Home Décor/Wall décor/Picture & photo frames,Home Décor/Wall décor/Picture & photo frames,Home Décor/Wall décor/Picture & photo frames,Home Décor/Wall décor/Picture & photo frames,Furniture/Tables & desks/Dining tables/Up to 10 seats,Home Décor/Mirrors/Vanity mirrors,Home Décor/Mirrors/Wall mirrors,Home Décor/Mirrors/Wall mirrors,Furniture/Patio furniture/Outdoor tables/Outdoor dining tables,Furniture/Tables & desks/Desks & computer desks/Desks for home,Laundry & cleaning/Cleaning accessories,Furniture/Sofas & sectionals/Ottomans/Fabric ottomans,Home Décor/Wall décor/Art cards,Rugs/Rugs/Door mats,Home Décor/Storage boxes & baskets/Kids boxes & baskets,Bathroom/Bathroom textiles/Shower curtains,Home Textiles/Window treatments/Curtain rods & rails/Track systems,Furniture/Tables & desks/Bar tables,Furniture/Tables & desks/Café tables,Home Décor/Mirrors/Vanity mirrors,Storage & organization/Wall shelves & hooks/Hooks,Furniture/Tables & desks/Dining tables/Up to 4 seats,Home Décor/Decorative accessories,"Storage & organization/Clothes organizers/Clothes racks & stands/TURBO Clothes rack, indoor","Storage & organization/Wall shelves & hooks/Hooks/BRANDUR Rail with 4 hooks, in-","Storage & organization/Wall shelves & hooks/Hooks/BRANDUR Hook, in-",Home Décor/Candle holders & candles/Lanterns,"Storage & organization/Wall shelves & hooks/Hooks/BRANDUR Hook, in-","Laundry & cleaning/Drying racks/MULIG Drying rack, indoor",Storage & organization/Wall shelves & hooks/Hooks,Storage & organization/Wall shelves & hooks/Hooks,Home Décor/Flower pots & stands/Indoor plant pots,Baby & kids/Baby/Baby toys/Newborn,Home Textiles/Window treatments/Curtain rods & rails/Track systems,Furniture/Tables & desks/Accent tables/End tables & side tables,Storage & organization/Storage solution systems/PAX system/PAX sliding doors,Storage & organization/Clothes organizers/Shoe racks & stands,Home Décor/Storage boxes & baskets/Baskets,Home Décor/Storage boxes & baskets/Baskets,Cookware & tableware/Dinnerware/Dinnerware sets,Furniture/Tables & desks/Dining tables/Up to 4 seats,"Storage & organization/Display & storage cabinets/Buffet tables, sideboard buffets & buffet cabinets",Furniture/Patio furniture/Outdoor benches,Kitchen & appliances/Kitchen countertops/Laminate countertops,Kitchen & appliances/Kitchen countertops/Laminate countertops,Kitchen & appliances/Kitchen countertops/Laminate countertops,Kitchen & appliances/Kitchen countertops/Laminate countertops,Kitchen & appliances/Kitchen countertops/Laminate countertops,Storage & organization/Storage containers/Bins & bags/Trash cans & pedal bins,Storage & organization/Storage containers/Paper & media organizers/Desk accessories,Kitchen & appliances/Kitchen countertops/Butcher block countertops,Kitchen & appliances/Kitchen countertops/Butcher block countertops,Kitchen & appliances/Kitchen countertops/Butcher block countertops,Kitchen & appliances/Kitchen countertops/Butcher block countertops,Kitchen & appliances/Kitchen countertops/Butcher block countertops,Kitchen & appliances/Kitchen countertops/Butcher block countertops,Furniture/Patio furniture/Outdoor chaises & hammocks,Cookware & tableware/Dinnerware/Plates,Storage & organization/TV & media furniture/TV stands & benches,Storage & organization/Wall shelves/Complete wall shelves/HEMNES Wall,Cookware & tableware/Cookware & kitchenware/Ovenware,Cookware & tableware/Knives & cutting boards/Cutting boards,Cookware & tableware/Knives & cutting boards/Cutting boards,Cookware & tableware/Knives & cutting boards/Cutting boards,Furniture/Tables & desks/Makeup vanities & dressing tables,Home Décor/Wall décor/Picture & photo frames,Home Décor/Wall décor/Picture & photo frames,Home Décor/Wall décor/Picture & photo frames,Cookware & tableware/Dinnerware/Deep plates/VÄRDERA Deep plate,Baby & kids/Kids/Toys & play/Physical play,Home Décor/Flower pots & stands/Outdoor plant pots,Cookware & tableware/Cookware & kitchenware/Cooking pans/Frying pans & skillets,Home Décor/Wall décor/Picture & photo frames,Home Décor/Wall décor/Picture & photo frames,Home Textiles/Window treatments/Curtains & drapes/Room darkening curtains & drapes,Cookware & tableware/Cookware & kitchenware/Cooking accessories,Furniture/Chairs/Stools & benches/Benches,Furniture/Chairs/Dining chairs/Dining chairs,Furniture/Chairs/Dining chairs/Dining chairs,Home improvement/Home safety/Child safety,Rugs/Rugs/Runners & small rugs,Rugs/Rugs/Runners & small rugs,"Storage & organization/Shelving units, bookcases & storage options/Shelf units & cube storage",Lighting/Lamps & light fixtures/Kids lighting,Furniture/Sofas & sectionals/Sofa accessories
