Beds & mattresses/Bedding/Blankets & throws,Beds & mattresses/Bedding/Bedlinen/Duvet cover sets,Beds & mattresses/Bedding/Pillows/Polyester pillows,Baby & kids/Baby/Baby textiles/Nursery rugs,Rugs/Bath mats,Bathroom/Bathroom textiles/Towels/Wash cloths,Bathroom/Bathroom textiles/Towels/Hand towels,Bathroom/Bathroom textiles/Towels/Bath sheets,Storage & organization/Bags/Shopping bags & tote bags,Beds & mattresses/Bedding/Cushions & cushions covers/Cushions,Beds & mattresses/Bedding/Blankets & throws,Beds & mattresses/Bedding/Cushions & cushions covers/Cushions,Rugs/Rugs/Door mats,Beds & mattresses/Bedding/Cushions & cushions covers/Cushion covers,Furniture/Sofas & sectionals/Sofa & armchairs covers/HÄRLANDA covers,Furniture/Sofas & sectionals/Sofa & armchairs covers/HÄRLANDA covers,Furniture/Sofas & sectionals/Sofa & armchairs covers/HÄRLANDA covers,Furniture/Sofas & sectionals/Sofa & armchairs covers/HÄRLANDA covers,Furniture/Sofas & sectionals/Fabric sofas/Modular fabric sofas,Furniture/Patio furniture/Outdoor seat cushions,Furniture/Patio furniture/Outdoor seat cushions,Cookware & tableware/Napkins & napkin holders/Napkins,Furniture/Armchairs & chaises/Kids armchairs,Beds & mattresses/Mattresses/Crib mattresses,Beds & mattresses/Mattresses/Crib mattresses,Beds & mattresses/Mattresses/Crib mattresses,Beds & mattresses/Mattresses/Crib mattresses,Baby & kids/Baby/Baby textiles/Nursery rugs,Beds & mattresses/Bedding/Cushions & cushions covers/Cushion covers,Beds & mattresses/Bedding/Cushions & cushions covers/Cushion covers,Furniture/Sofas & sectionals/Sofa & armchairs covers/POÄNG,Furniture/Sofas & sectionals/Sofa & armchairs covers/POÄNG,Baby & kids/Kids/Toys & play/Soft toys,Rugs/Rugs/Door mats,Rugs/Bath mats,Beds & mattresses/Bedding/Cushions & cushions covers/Cushion covers,Baby & kids/Baby/Baby textiles/Baby towels & washcloths,Rugs/Rugs/Large & medium rugs,Furniture/Tables & desks/Changing tables,Beds & mattresses/Bedding/Comforters/Polyester comforters,Beds & mattresses/Bedding/Comforters/Polyester comforters,Beds & mattresses/Bedding/Blankets & throws,Rugs/Rugs/Door mats,"Outdoor/Outdoor cushions/Outdoor pillows/FUNKÖN Cushion cover, in","Outdoor/Outdoor cushions/Outdoor pillows/FUNKÖN Back cushion, indoor",Rugs/Rugs/Runners & small rugs,Beds & mattresses/Bedding/Cushions & cushions covers/Children's cushions & blankets,Beds & mattresses/Bedding/Cushions & cushions covers/Children's cushions & blankets,Beds & mattresses/Bedding/Cushions & cushions covers/Children's cushions & blankets,Furniture/Armchairs & chaises/Rattan armchairs,Furniture/Armchairs & chaises/Rattan armchairs,Rugs/Rugs/Door mats,Bathroom/Bathroom textiles/Towels/Bath towels,Bathroom/Bathroom textiles/Towels/Hand towels,"Rugs/Rugs/Large & medium rugs/VRENSTED Rug flatwoven, in","Rugs/Rugs/Large & medium rugs/SVALLERUP Rug flatwoven, in",Furniture/Sofas & sectionals/Sofa & armchairs covers/FÄRLÖV covers,Beds & mattresses/Mattresses/Mattress toppers,Beds & mattresses/Bedding/Bedlinen/Duvet cover sets,Furniture/Patio furniture/Outdoor lounge furniture,Rugs/Rugs/Large & medium rugs,Storage & organization/Storage containers/Bins & bags/Bags,Furniture/Sofas & sectionals/Sofa & armchairs covers/POÄNG,Beds & mattresses/Bedding/Bedspreads,Rugs/Rugs/Runners & small rugs,Beds & mattresses/Bedding/Cushions & cushions covers/Cushion covers,"Furniture/Patio furniture/Outdoor seat cushions/SÖTHOLMEN Cushion cover, in",Bathroom/Bathroom textiles/Shower curtains,Rugs/Rugs/Round rugs,Baby & kids/Kids/Toys & play/Soft toys,Beds & mattresses/Bedding/Cushions & cushions covers/Cushion covers,Laundry & cleaning/Cleaning accessories,Beds & mattresses/Bedding/Comforters/Down & feather comforters,Beds & mattresses/Bedding/Comforters/Down & feather comforters,Beds & mattresses/Bedding/Comforters/Down & feather comforters,Beds & mattresses/Bedding/Blankets & throws/FÄLTMAL Pillow,"Beds & mattresses/Mattresses/Foam, memory foam & latex mattresses",Cookware & tableware/Kitchen textiles/Pot holders & oven mitts,Cookware & tableware/Kitchen textiles/Pot holders & oven mitts,Cookware & tableware/Kitchen textiles/Pot holders & oven mitts,Cookware & tableware/Table linen/Table cloths & runners,Beds & mattresses/Bedding/Blankets & throws,Beds & mattresses/Bedding/Cushions & cushions covers/Cushion covers,Beds & mattresses/Mattresses/Kids mattresses,Cookware & tableware/Kitchen textiles/Kitchen towels,Furniture/Sofas & sectionals/Sofa & armchairs covers/FLOTTEBO covers,Rugs/Rugs/Door mats,Furniture/Sofas & sectionals/Sofa & armchairs covers/VINLIDEN covers,Rugs/Rugs/Large & medium rugs,Beds & mattresses/Bedding/Cushions & cushions covers/Cushion covers,Baby & kids/Kids/Kids textiles/Kids rugs,"Rugs/Rugs/Large & medium rugs/SKARRILD Rug flatwoven, in",Rugs/Rugs/Large & medium rugs,Furniture/Patio furniture/Outdoor seat cushions,"Baby & kids/Baby/Changing, bathing & potty/Changing accessories",Beds & mattresses/Bedding/Blankets & throws,Beds & mattresses/Bedding/Pillows/Polyester pillows,Beds & mattresses/Bedding/Bedlinen/Duvet cover sets,Rugs/Rugs/Large & medium rugs,Rugs/Rugs/Large & medium rugs
Storage & organization/Storage solution systems/AURDAL system/AURDAL parts,Storage & organization/Storage solution systems/AURDAL system/AURDAL parts,Storage & organization/Storage solution systems/AURDAL system/AURDAL parts,Storage & organization/Storage solution systems/AURDAL system/AURDAL parts,Storage & organization/Storage solution systems/AURDAL system/AURDAL parts,Storage & organization/Storage solution systems/AURDAL system/AURDAL parts,Storage & organization/Storage solution systems/AURDAL system/AURDAL parts,Storage & organization/Storage solution systems/AURDAL system/AURDAL parts,Storage & organization/Storage solution systems/AURDAL system/AURDAL parts,Storage & organization/Storage solution systems/AURDAL system/AURDAL parts,Storage & organization/Storage solution systems/AURDAL system/AURDAL parts,Storage & organization/Storage solution systems/AURDAL system/AURDAL parts,Storage & organization/Clothes organizers/Shoe cabinets,Storage & organization/Clothes organizers/Shoe cabinets,Storage & organization/Clothes organizers/Shoe cabinets,Storage & organization/Clothes organizers/Shoe cabinets,Storage & organization/Clothes organizers/Shoe cabinets,Storage & organization/Clothes organizers/Shoe cabinets,Storage & organization/Clothes organizers/Shoe cabinets,"Storage & organization/Shelving units, bookcases & storage options/Storage shelves & units",Furniture/Tables & desks/Desks & computer desks/Desks for home,Furniture/Kids furniture/Toy storage,Storage & organization/Bags/Travel accessories,Home Décor/Storage boxes & baskets/Secondary storage boxes,Home Décor/Storage boxes & baskets/Kids boxes & baskets,Home Décor/Storage boxes & baskets/Kids boxes & baskets,Home Décor/Storage boxes & baskets/Kids boxes & baskets,"Storage & organization/Shelving units, bookcases & storage options/Bookcases",Storage & organization/Display & storage cabinets/Dining room cabinets & cupboards,Home Décor/Mirrors/Wall mirrors,Storage & organization/Display & storage cabinets/Display cabinets,Home Décor/Mirrors/Wall mirrors,Home Décor/Mirrors/Wall mirrors,Storage & organization/Wall shelves/Complete wall shelves,"Storage & organization/Shelving units, bookcases & storage options/Storage shelves & units",Home Décor/Storage boxes & baskets/Secondary storage boxes,Home Décor/Storage boxes & baskets/Secondary storage boxes,Home Décor/Vases & bowls/Vases/CYLINDER Vase,Home Décor/Vases & bowls/Vases,Home Décor/Storage boxes & baskets/Secondary storage boxes,Bathroom/Bathroom storage/Bathroom shelving units,Kitchen & appliances/Kitchen islands & carts,Storage & organization/Storage containers/Bathroom accessories/Bathroom shelves,Storage & organization/Storage solution systems/SMÅSTAD system/SMÅSTAD doors & drawers,Storage & organization/Storage solution systems/SMÅSTAD system/SMÅSTAD doors & drawers,"Storage & organization/Shelving units, bookcases & storage options/Storage shelves & units",Home electronics/Speakers/Bluetooth speakers,Home electronics/Speakers/Bluetooth speakers,Home electronics/Speakers/Bluetooth speakers,Home electronics/Speakers/Bluetooth speakers,Home Décor/Storage boxes & baskets/Paper & media boxes,Storage & organization/Storage containers/Cable management & accessories,Home Décor/Storage boxes & baskets/Kids boxes & baskets,Storage & organization/Storage containers/Bins & bags/Trash cans & pedal bins,Home electronics/Speakers/Bluetooth speakers,Cookware & tableware/Knives & cutting boards/Cutting boards,Storage & organization/Storage solution systems/IVAR system/All parts,Home electronics/Cords & chargers/Wireless charging & accessories,Furniture/Tables & desks/Desks & computer desks/Desks for home,Storage & organization/Storage containers/Bathroom accessories/Bathroom boxes & baskets,Home Décor/Wall décor/Picture & photo frames,Home electronics/Cords & chargers/Wireless charging & accessories,Home electronics/Cords & chargers/Wireless charging & accessories,Storage & organization/Storage containers/Paper & media organizers/Desk accessories,"Storage & organization/Shelving units, bookcases & storage options/Shelf units & cube storage","Storage & organization/Shelving units, bookcases & storage options/Cube storage","Storage & organization/Shelving units, bookcases & storage options/Bookcases","Storage & organization/Shelving units, bookcases & storage options/Shelf units & cube storage","Storage & organization/Shelving units, bookcases & storage options/Cube storage",Home Décor/Storage boxes & baskets/Baskets,Home Décor/Storage boxes & baskets/Baskets,Storage & organization/Storage containers/Food storage & organizing/Food containers,Storage & organization/Storage containers/Bathroom accessories/Bathroom boxes & baskets,Storage & organization/Storage solution systems/BESTÅ storage system/BESTÅ all parts & accessories,"Storage & organization/Shelving units, bookcases & storage options/Storage shelves & units/KOLBJÖRN Cabinet, indoor",Home Décor/Storage boxes & baskets/Paper & media boxes,Storage & organization/Storage solution systems/BESTÅ storage system/BESTÅ all parts & accessories,"Storage & organization/Shelving units, bookcases & storage options/Shelf units & cube storage","Storage & organization/Shelving units, bookcases & storage options/Shelf units & cube storage",Storage & organization/Clothes organizers/Shoe racks & stands,Furniture/Tables & desks/Kids tables,Storage & organization/Wall shelves/Complete wall shelves,Storage & organization/Wall shelves/Complete wall shelves,Storage & organization/Storage containers/Food storage & organizing/Food containers,Storage & organization/Storage solution systems/OMAR system/All parts,Storage & organization/TV & media furniture/TV stands & benches,Home electronics/Speakers/Bluetooth speakers,Storage & organization/Storage solution systems/PAX system/PAX Interior organizers,Storage & organization/Storage solution systems/PAX system/PAX Interior organizers,Storage & organization/Storage solution systems/SMÅSTAD system/SMÅSTAD interior fittings,Storage & organization/Storage containers/Bathroom accessories/Toilet roll holders & stands,Furniture/Tables & desks/Dining tables/Up to 4 seats,Storage & organization/Storage containers/Bins & bags/Trash cans & pedal bins,Cookware & tableware/Cookware & kitchenware/Cooking pans/Grill pans & griddles,Storage & organization/Wall shelves/Shelves,Storage & organization/Wall shelves/Shelves,Home Décor/Mirrors/Mirror cabinets,Bathroom/Bathroom vanities/Vanity cabinets without sink,Home Décor/Mirrors/Mirror cabinets,Storage & organization/Storage containers/Paper & media organizers/Desk accessories
Home Textiles/Window treatments/Curtains & drapes/Panel curtains,Home Textiles/Window treatments/Curtains & drapes/Light filtering curtains,Home Textiles/Window treatments/Curtains & drapes/Light filtering curtains,Home Textiles/Window treatments/Curtains & drapes/Light filtering curtains,Home Textiles/Window treatments/Curtains & drapes/Panel curtains,"Home Textiles/Window treatments/Shades, blinds & window treatments/Roman shades","Home Textiles/Window treatments/Shades, blinds & window treatments/Pleated & cellular blinds and shades",Home Textiles/Window treatments/Curtains & drapes/Panel curtains,Home Textiles/Window treatments/Curtains & drapes/Light filtering curtains,Home Textiles/Window treatments/Curtains & drapes/Panel curtains,Home Textiles/Window treatments/Curtains & drapes/Light filtering curtains,Home Textiles/Window treatments/Curtains & drapes/Light filtering curtains,Home Textiles/Window treatments/Curtains & drapes/Light filtering curtains,Home Textiles/Window treatments/Curtains & drapes/Light filtering curtains,Kitchen & appliances/Backsplashes & wall panels/Laminate backsplashes,Kitchen & appliances/Backsplashes & wall panels/Laminate backsplashes,Kitchen & appliances/Backsplashes & wall panels/Laminate backsplashes,Home electronics/Speakers/Wi-Fi speakers,Home Textiles/Window treatments/Curtain rods & rails/Track systems,Storage & organization/Storage containers/Bathroom accessories/Towel rails & towel holders,Storage & organization/Storage containers/Bathroom accessories/Towel rails & towel holders,Home Décor/Clocks/Alarm clocks,Storage & organization/Dressers & storage drawers/Chests of drawers,Storage & organization/Storage solution systems/PAX system/PAX doors without hinges,Storage & organization/Storage solution systems/PAX system/PAX doors without hinges,Rugs/Rugs/Door mats,Home Textiles/Window treatments/Curtains & drapes/Room darkening curtains & drapes,"Storage & organization/Wall shelves & hooks/Hooks/BRANDUR Hook, in-","Storage & organization/Wall shelves & hooks/Hooks/BRANDUR Hook, in-",Storage & organization/Wall shelves & hooks/Hooks,"Storage & organization/Wall shelves & hooks/Hooks/BRANDUR Rail with 4 hooks, in-","Laundry & cleaning/Drying racks/MULIG Drying rack, indoor",Home Décor/Candle holders & candles/Lanterns,"Storage & organization/Clothes organizers/Clothes racks & stands/TURBO Clothes rack, indoor",Home Décor/Flower pots & stands/Indoor plant pots,Storage & organization/Wall shelves & hooks/Hooks,Baby & kids/Kids/Toys & play/Physical play,Cookware & tableware/Coffee & tea/Mugs & cups,Cookware & tableware/Dinnerware/Side plates,Cookware & tableware/Dinnerware/Plates,Cookware & tableware/Dinnerware/Bowls,Storage & organization/Dressers & storage drawers/Chests of drawers,Storage & organization/Dressers & storage drawers/Chests of drawers,Furniture/Tables & desks/Nightstands,Home electronics/Speakers/Bluetooth speakers,Outdoor/Umbrellas & gazebos/Patio umbrellas & bases,Furniture/Tables & desks/Accent tables/Coffee tables,Furniture/Tables & desks/Accent tables/Coffee tables,Lighting/Lamps & light fixtures/Kids lighting,Cookware & tableware/Serveware/Trays,Bathroom/Bathroom sinks,Bathroom/Bathroom sinks,Bathroom/Bathroom sinks,Bathroom/Bathroom sinks,Bathroom/Bathroom sinks,Furniture/Tables & desks/Bar tables,Furniture/Tables & desks/Café tables,Storage & organization/Storage containers/Bins & bags/Trash cans & pedal bins,Storage & organization/Storage containers/Paper & media organizers/Desk accessories,"Home improvement/Oils, stains & product care","Home improvement/Oils, stains & product care","Home improvement/Oils, stains & product care","Home improvement/Oils, stains & product care",Furniture/Tables & desks/Dining tables/Up to 4 seats,Furniture/Tables & desks/Dining tables/Dining table tops & underframes,Home Décor/Storage boxes & baskets/Baskets,Furniture/Tables & desks/Accent tables/End tables & side tables,Baby & kids/Kids/Toys & play/Arts & crafts,Kitchen & appliances/Kitchen systems/SEKTION kitchen/SEKTION kitchen cabinets,Kitchen & appliances/Kitchen systems/SEKTION kitchen/SEKTION kitchen cabinets,Kitchen & appliances/Kitchen systems/SEKTION kitchen/SEKTION kitchen cabinets,Home Décor/Storage boxes & baskets/Baskets,Storage & organization/Storage containers/Bathroom accessories/Towel rails & towel holders,Furniture/Tables & desks/Dining tables/Up to 6 seats,Storage & organization/Armoires & wardrobes/Children's wardrobes,Furniture/Tables & desks/Changing tables/SMÅGÖRA Changing table,Home Décor/Clocks/Alarm clocks/DÅNDIMPEN Alarm clock radio,Pet accessories/Cats,Kitchen & appliances/Kitchen countertops/Laminate countertops,Kitchen & appliances/Kitchen countertops/Laminate countertops,Kitchen & appliances/Kitchen countertops/Laminate countertops,Kitchen & appliances/Kitchen countertops/Laminate countertops,Kitchen & appliances/Kitchen countertops/Laminate countertops,Home Textiles/Window treatments/Curtain rods & rails/Track systems,Home Textiles/Window treatments/Curtain rods & rails/Track systems,Storage & organization/Bags/Travel bags,Storage & organization/Bags/Travel bags,Storage & organization/Bags/Travel bags,Kitchen & appliances/Kitchen systems/SEKTION kitchen/SEKTION kitchen cabinets,Kitchen & appliances/Kitchen systems/SEKTION kitchen/SEKTION kitchen cabinets,Kitchen & appliances/Kitchen systems/SEKTION kitchen/SEKTION kitchen cabinets,Kitchen & appliances/Kitchen systems/SEKTION kitchen/SEKTION kitchen cabinets,Kitchen & appliances/Kitchen systems/SEKTION kitchen/SEKTION kitchen cabinets,Storage & organization/Clothes organizers/Clothes racks & stands,Storage & organization/Clothes organizers/Clothes racks & stands,Home Décor/Storage boxes & baskets/Kids boxes & baskets,Cookware & tableware/Table linen/Place mats & coasters,Cookware & tableware/Dinnerware/Dinnerware sets,Laundry & cleaning/Cleaning accessories,Furniture/Tables & desks/Desks & computer desks/Desks for home
Storage & organization/Display & storage cabinets/Display cabinets,Kitchen & appliances/Kitchen systems/SEKTION kitchen/SEKTION kitchen cabinets,Home Décor/Mirrors/Mirror cabinets,Home Décor/Mirrors/Mirror cabinets,Cookware & tableware/Knives & cutting boards/Sharpening tools,Storage & organization/Clothes organizers/Shoe racks & stands,Storage & organization/Storage solution systems/PAX system/PAX Interior organizers,Storage & organization/Storage solution systems/PAX system/PAX Interior organizers,"Storage & organization/Shelving units, bookcases & storage options/Shelf units & cube storage",Storage & organization/Storage solution systems/BESTÅ storage system/BESTÅ all parts & accessories,Storage & organization/TV & media furniture/TV stands & benches,"Storage & organization/Shelving units, bookcases & storage options/Shelf units & cube storage",Storage & organization/Storage solution systems/OMAR system/All parts,Cookware & tableware/Cookware & kitchenware/Cooking pans/Grill pans & griddles,Storage & organization/Clothes organizers/Shoe racks & stands,Kitchen & appliances/Kitchen systems/SEKTION kitchen/SEKTION kitchen cabinets,"Storage & organization/Shelving units, bookcases & storage options/Shelf units & cube storage",Storage & organization/Storage solution systems/SMÅSTAD system/SMÅSTAD doors & drawers,Storage & organization/Storage solution systems/SMÅSTAD system/SMÅSTAD doors & drawers,Kitchen & appliances/Kitchen drawer organization/Drawer dividers,Bathroom/Bathroom vanities/Vanity cabinets without sink,Storage & organization/Storage containers/Food storage & organizing/Food containers,Storage & organization/Storage solution systems/BESTÅ storage system/BESTÅ all parts & accessories,Home Décor/Storage boxes & baskets/Paper & media boxes,Home Décor/Storage boxes & baskets/Secondary storage boxes,Bathroom/Bathroom vanities/Bathroom vanity legs,Storage & organization/TV & media furniture/TV stands & benches,Storage & organization/Wall shelves/Complete wall shelves,Storage & organization/Display & storage cabinets/Display cabinets,Storage & organization/Display & storage cabinets/Display cabinets,"Home Décor/Storage boxes & baskets/Secondary storage boxes/SAMLA Lid for box, 12",Kitchen & appliances/Kitchen drawer organization/Shelves & drawers,Storage & organization/Wall shelves/Shelves,Storage & organization/Wall shelves/Shelves,Storage & organization/Bags/Shopping bags & tote bags,Home Décor/Storage boxes & baskets/Clothes boxes,Storage & organization/Storage containers/Food storage & organizing/Food containers,Furniture/Tables & desks/Desks & computer desks/Desks for home,Furniture/Tables & desks/Desks & computer desks/Desks for home,Furniture/Tables & desks/Desks & computer desks/Desks for home,Storage & organization/TV & media furniture/TV stands & benches,Bathroom/Bathroom storage/Bathroom shelving units,Home Décor/Storage boxes & baskets/Secondary storage boxes,Storage & organization/Storage containers/Paper & media organizers/Desk accessories,Kitchen & appliances/Kitchen systems/SUNNERSTA modular kitchen/Accessories for SUNNERSTA,Kitchen & appliances/Kitchen wall organization & storage/Wall organizers,Kitchen & appliances/Kitchen wall organization & storage/Wall organizers,Kitchen & appliances/Kitchen systems/SUNNERSTA modular kitchen/Accessories for SUNNERSTA,Kitchen & appliances/Kitchen systems/SUNNERSTA modular kitchen/Accessories for SUNNERSTA,Kitchen & appliances/Kitchen systems/SUNNERSTA modular kitchen/Accessories for SUNNERSTA,Kitchen & appliances/Kitchen systems/SUNNERSTA modular kitchen/Accessories for SUNNERSTA,Storage & organization/Bags/Travel accessories,Cookware & tableware/Serveware/Trays,Cookware & tableware/Serveware/Trays,Cookware & tableware/Serveware/Trays,"Storage & organization/Display & storage cabinets/Buffet tables, sideboard buffets & buffet cabinets",Furniture/Kids furniture/Kids chairs,Furniture/Tables & desks/Dining tables/Up to 4 seats,Baby & kids/Kids/Kids storage & organization/Children's hooks & wall organization,"Storage & organization/Shelving units, bookcases & storage options/Storage shelves & units",Kitchen & appliances/Kitchen islands & carts,Storage & organization/TV & media furniture/TV stands & benches,Furniture/Patio furniture/Outdoor chairs/Outdoor dining chairs,Home electronics/Speakers/Bluetooth speakers,Laundry & cleaning/Cleaning accessories,Storage & organization/Storage containers/Food storage & organizing/Food containers,"Storage & organization/Shelving units, bookcases & storage options/Storage shelves & units",Kitchen & appliances/Kitchen wall organization & storage/Kitchen shelves,Kitchen & appliances/Kitchen islands & carts,Kitchen & appliances/Kitchen wall organization & storage/Kitchen shelves,Home Décor/Mirrors/Wall mirrors,Home Décor/Mirrors/Wall mirrors,Home Décor/Mirrors/Wall mirrors,Home Décor/Noticeboards,Home Décor/Noticeboards,Home Décor/Noticeboards,Home Décor/Noticeboards,Home Décor/Noticeboards,Home Décor/Noticeboards,Home Décor/Noticeboards,Home Décor/Noticeboards,Home Décor/Noticeboards,Home Décor/Noticeboards,Home Décor/Noticeboards,Home Décor/Noticeboards,Home Décor/Noticeboards,Home Décor/Noticeboards,Home Décor/Noticeboards,Storage & organization/Storage containers/Food storage & organizing/Food containers,Furniture/Tables & desks/Console tables & sofa tables,Furniture/Patio furniture/Outdoor tables/Outdoor dining tables,Storage & organization/Display & storage cabinets/Dining room cabinets & cupboards,"Storage & organization/Shelving units, bookcases & storage options/Shelf units & cube storage",Home electronics/Cords & chargers/Wireless charging & accessories,Storage & organization/Storage solution systems/SMÅSTAD system/SMÅSTAD doors & drawers,"Storage & organization/Display & storage cabinets/Buffet tables, sideboard buffets & buffet cabinets",Cookware & tableware/Serveware/Trays,Home Décor/Wall décor/Picture ledges,Furniture/Tables & desks/Desks & computer desks/Desks for home,Kitchen & appliances/Appliances/Refrigerators & freezers/Free-standing refrigerators
