Beds & mattresses/Bedding/Blankets & throws,Beds & mattresses/Bedding/Pillows/Polyester pillows,Furniture/Patio furniture/Outdoor seat cushions,Furniture/Patio furniture/Outdoor seat cushions,Furniture/Sofas & sectionals/Sofa & armchairs covers/HÄRLANDA covers,Furniture/Sofas & sectionals/Sofa & armchairs covers/HÄRLANDA covers,Furniture/Sofas & sectionals/Sofa & armchairs covers/HÄRLANDA covers,Furniture/Sofas & sectionals/Sofa & armchairs covers/HÄRLANDA covers,Furniture/Sofas & sectionals/Fabric sofas/Modular fabric sofas,Beds & mattresses/Bedding/Bedlinen/Duvet cover sets,Beds & mattresses/Bedding/Comforters/Polyester comforters,Beds & mattresses/Bedding/Comforters/Polyester comforters,Furniture/Patio furniture/Outdoor seat cushions,Beds & mattresses/Bedding/Blankets & throws,Beds & mattresses/Bedding/Cushions & cushions covers/Cushion covers,Beds & mattresses/Bedding/Blankets & throws,Beds & mattresses/Bedding/Bedspreads,"Baby & kids/Baby/Changing, bathing & potty/Changing accessories",Beds & mattresses/Bedding/Cushions & cushions covers/Children's cushions & blankets,Furniture/Tables & desks/Changing tables,Beds & mattresses/Bedding/Cushions & cushions covers/Cushions,Beds & mattresses/Bedding/Cushions & cushions covers/Cushion covers,Beds & mattresses/Bedding/Pillows/Down & feather pillows,Beds & mattresses/Bedding/Pillows/Down & feather pillows,Beds & mattresses/Bedding/Cushions & cushions covers/Cushion covers,Furniture/Sofas & sectionals/Sofa & armchairs covers/FLOTTEBO covers,Beds & mattresses/Bedding/Blankets & throws,Furniture/Sofas & sectionals/Sofa & armchairs covers/FÄRLÖV covers,Beds & mattresses/Bedding/Blankets & throws,Beds & mattresses/Bedding/Blankets & throws,Beds & mattresses/Bedding/Pillows/Polyester pillows,Beds & mattresses/Bedding/Pillows/Polyester pillows,Furniture/Armchairs & chaises/Kids armchairs,Furniture/Chairs/High chairs,Beds & mattresses/Bedding/Bedlinen/Duvet cover sets,Beds & mattresses/Bedding/Cushions & cushions covers/Cushion covers,"Outdoor/Outdoor cushions/Outdoor pillows/FUNKÖN Cushion cover, in","Outdoor/Outdoor cushions/Outdoor pillows/FUNKÖN Back cushion, indoor",Beds & mattresses/Bedding/Cushions & cushions covers/Cushion covers,Beds & mattresses/Bedding/Cushions & cushions covers/Cushions,Beds & mattresses/Bedding/Blankets & throws/FÄLTMAL Pillow,"Furniture/Patio furniture/Outdoor seat cushions/SÖTHOLMEN Cushion cover, in",Beds & mattresses/Bedding/Cushions & cushions covers/Cushion covers,Beds & mattresses/Mattresses/Crib mattresses,Beds & mattresses/Mattresses/Crib mattresses,Beds & mattresses/Mattresses/Crib mattresses,Beds & mattresses/Mattresses/Crib mattresses,Beds & mattresses/Bedding/Cushions & cushions covers/Cushions,Beds & mattresses/Mattresses/Mattress toppers,Beds & mattresses/Bedding/Cushions & cushions covers/Cushion covers,Beds & mattresses/Bedding/Cushions & cushions covers/Cushion covers,Baby & kids/Baby/Baby textiles/Baby quilts & pillows,Furniture/Patio furniture/Outdoor seat cushions,Furniture/Patio furniture/Outdoor seat cushions,Furniture/Patio furniture/Outdoor seat cushions,Furniture/Patio furniture/Outdoor seat cushions,Furniture/Patio furniture/Outdoor seat cushions/KUDDARNA Seat,Furniture/Patio furniture/Outdoor seat cushions/KUDDARNA Seat,Beds & mattresses/Bedding/Cushions & cushions covers/Children's cushions & blankets,Beds & mattresses/Bedding/Cushions & cushions covers/Children's cushions & blankets,Beds & mattresses/Mattresses/Kids mattresses,"Beds & mattresses/Mattresses/Foam, memory foam & latex mattresses",Beds & mattresses/Bedding/Cushions & cushions covers/Cushion covers,Beds & mattresses/Bedding/Cushions & cushions covers/Cushion covers,Beds & mattresses/Bedding/Cushions & cushions covers/Cushion covers,Furniture/Armchairs & chaises/Kids armchairs,Beds & mattresses/Bedding/Blankets & throws,Furniture/Sofas & sectionals/Sofa & armchairs covers/POÄNG,Furniture/Sofas & sectionals/Sofa & armchairs covers/VINLIDEN covers,Beds & mattresses/Mattresses/Spring mattresses,Beds & mattresses/Bedding/Pillows/Polyester pillows,Beds & mattresses/Bedding/Pillows/Polyester pillows,Beds & mattresses/Bedding/Comforters/Polyester comforters,Bathroom/Bathroom textiles/Towels/Bath towels,Beds & mattresses/Bedding/Pillows/Polyester pillows,Beds & mattresses/Bedding/Pillows/Polyester pillows,Beds & mattresses/Bedding/Cushions & cushions covers/Cushion covers,Beds & mattresses/Bedding/Cushions & cushions covers/Cushion covers,Beds & mattresses/Bedding/Comforters/Polyester comforters,Furniture/Sofas & sectionals/Leather & faux leather sofas/Leather sofas,Beds & mattresses/Bedding/Cushions & cushions covers/Cushions,Beds & mattresses/Bedding/Cushions & cushions covers/Cushions,Beds & mattresses/Bedding/Cushions & cushions covers/Children's cushions & blankets,Beds & mattresses/Bedding/Cushions & cushions covers/Cushion covers,Furniture/Sofas & sectionals/Sofa & armchairs covers/VALLENTUNA covers,Beds & mattresses/Bedding/Pillows/Down & feather pillows,Furniture/Sofas & sectionals/Sofa & armchairs covers/GRÖNLID covers,Cookware & tableware/Kitchen textiles/Pot holders & oven mitts,Cookware & tableware/Kitchen textiles/Pot holders & oven mitts,Cookware & tableware/Kitchen textiles/Pot holders & oven mitts,Beds & mattresses/Bedding/Cushions & cushions covers/Cushion covers,Furniture/Sofas & sectionals/Sofa & armchairs covers/LYCKSELE covers,Bathroom/Bathroom textiles/Shower curtains,Beds & mattresses/Bedding/Cushions & cushions covers/Children's cushions & blankets,Rugs/Rugs/Runners & small rugs,Furniture/Sofas & sectionals/Sofa & armchairs covers/STOCKSUND covers,Beds & mattresses/Bedding/Bedlinen/Duvet cover sets,Furniture/Chairs/High chairs,Furniture/Chairs/High chairs,Furniture/Beds/Sleeper sofas/Mattress choices
Storage & organization/Storage solution systems/AURDAL system/AURDAL parts,Storage & organization/Storage solution systems/AURDAL system/AURDAL parts,Storage & organization/Storage solution systems/AURDAL system/AURDAL parts,Storage & organization/Storage solution systems/AURDAL system/AURDAL parts,Storage & organization/Storage solution systems/AURDAL system/AURDAL parts,Storage & organization/Storage solution systems/AURDAL system/AURDAL parts,Storage & organization/Storage solution systems/AURDAL system/AURDAL parts,Storage & organization/Storage solution systems/AURDAL system/AURDAL parts,Storage & organization/Storage solution systems/AURDAL system/AURDAL parts,Storage & organization/Storage solution systems/AURDAL system/AURDAL parts,Storage & organization/Storage solution systems/AURDAL system/AURDAL parts,Storage & organization/Storage solution systems/AURDAL system/AURDAL parts,Storage & organization/Wall shelves/Complete wall shelves,Storage & organization/Wall shelves/Complete wall shelves,Storage & organization/Wall shelves/Shelves,Storage & organization/Storage containers/Bathroom accessories/Bathroom shelves,Bathroom/Bathroom storage/Bathroom shelving units,Kitchen & appliances/Kitchen islands & carts,Storage & organization/Clothes organizers/Shoe racks & stands,Storage & organization/Clothes organizers/Shoe cabinets,Storage & organization/Clothes organizers/Shoe cabinets,Storage & organization/Clothes organizers/Shoe cabinets,Storage & organization/Clothes organizers/Shoe cabinets,Storage & organization/Clothes organizers/Shoe cabinets,Storage & organization/Clothes organizers/Shoe cabinets,Storage & organization/Clothes organizers/Shoe cabinets,Storage & organization/Storage solution systems/OMAR system/All parts,Home Décor/Storage boxes & baskets/Clothes boxes,Storage & organization/Wall shelves/Shelves,Storage & organization/Wall shelves/Shelves,"Storage & organization/Shelving units, bookcases & storage options/Shelf units & cube storage","Storage & organization/Shelving units, bookcases & storage options/Cube storage","Storage & organization/Shelving units, bookcases & storage options/Cube storage","Storage & organization/Shelving units, bookcases & storage options/Shelf units & cube storage","Storage & organization/Shelving units, bookcases & storage options/Bookcases",Bathroom/Bathroom storage/Bathroom storage/Bathroom wall cabinets,Kitchen & appliances/Kitchen drawer organization/Shelves & drawers,Kitchen & appliances/Kitchen drawer organization/Shelves & drawers,Kitchen & appliances/Kitchen drawer organization/Shelves & drawers,Storage & organization/Storage solution systems/IVAR system/All parts,Storage & organization/Storage solution systems/IVAR system/All parts,Storage & organization/Storage solution systems/IVAR system/All parts,Storage & organization/Storage solution systems/IVAR system/All parts,Storage & organization/Storage solution systems/IVAR system/All parts,Storage & organization/Storage solution systems/IVAR system/All parts,Storage & organization/Storage solution systems/IVAR system/All parts,Storage & organization/Storage solution systems/IVAR system/All parts,Storage & organization/Display & storage cabinets/Dining room cabinets & cupboards,Storage & organization/Storage solution systems/IVAR system/All parts,Storage & organization/Display & storage cabinets/Dining room cabinets & cupboards,Storage & organization/Storage solution systems/IVAR system/All parts,Storage & organization/Storage solution systems/IVAR system/All parts,Storage & organization/Storage solution systems/IVAR system/All parts,Storage & organization/Storage solution systems/IVAR system/All parts,Storage & organization/Storage solution systems/IVAR system/All parts,Storage & organization/Storage solution systems/IVAR system/All parts,Storage & organization/Storage solution systems/IVAR system/All parts,Storage & organization/Storage solution systems/IVAR system/All parts,Storage & organization/Storage solution systems/IVAR system/All parts,Storage & organization/Storage solution systems/IVAR system/All parts,Storage & organization/Storage solution systems/IVAR system/All parts,Storage & organization/Display & storage cabinets/Dining room cabinets & cupboards,Storage & organization/Wall shelves/Shelves,Storage & organization/Wall shelves/Shelves,"Storage & organization/Shelving units, bookcases & storage options/Storage shelves & units",Storage & organization/Dressers & storage drawers/Chests of drawers,Storage & organization/Storage solution systems/IVAR system/All parts,Storage & organization/Storage containers/Bathroom accessories/Towel rails & towel holders,Kitchen & appliances/Kitchen drawer organization/Shelves & drawers,Storage & organization/Wall shelves & hooks/Hooks,Storage & organization/Storage solution systems/PAX system/PAX Interior organizers,Storage & organization/Storage solution systems/PAX system/PAX Interior organizers,Storage & organization/Storage containers/Bathroom accessories/Bathroom boxes & baskets,Storage & organization/Wall shelves/Brackets,Kitchen & appliances/Kitchen wall organization & storage/Wall organizers,Bathroom/Bathroom storage/Bathroom storage/Bathroom wall cabinets,Home Décor/Storage boxes & baskets/Clothes boxes,Storage & organization/Storage containers/Bathroom accessories/Bathroom boxes & baskets,Home Décor/Storage boxes & baskets/Secondary storage boxes,Storage & organization/Storage solution systems/SMÅSTAD system/SMÅSTAD interior fittings,Home Décor/Storage boxes & baskets/Kids boxes & baskets,Home Décor/Storage boxes & baskets/Kids boxes & baskets,Home Décor/Storage boxes & baskets/Kids boxes & baskets,Storage & organization/Storage solution systems/IVAR system/All parts,"Home Décor/Storage boxes & baskets/Secondary storage boxes/SAMLA Lid for box, 12",Storage & organization/Storage solution systems/SMÅSTAD system/SMÅSTAD interior fittings,Storage & organization/Wall shelves/Complete wall shelves/HEMNES Wall,Storage & organization/Wall shelves/Complete wall shelves,Baby & kids/Kids/Kids storage & organization/Children's hooks & wall organization,Storage & organization/Display & storage cabinets/Display cabinets,Bathroom/Bathroom vanities/Vanity cabinets without sink,Home Décor/Mirrors/Wall mirrors,Storage & organization/Display & storage cabinets/Display cabinets,"Storage & organization/Shelving units, bookcases & storage options/Shelf units & cube storage","Storage & organization/Shelving units, bookcases & storage options/Shelf units & cube storage",Home Décor/Wall décor/Picture ledges,Bathroom/Bathroom vanities/Vanity cabinets with sink,Bathroom/Bathroom vanities/Vanity cabinets with sink,"Storage & organization/Shelving units, bookcases & storage options/Storage shelves & units","Storage & organization/Shelving units, bookcases & storage options/Shelf units & cube storage"
Home Textiles/Window treatments/Curtains & drapes/Panel curtains,Home Textiles/Window treatments/Curtains & drapes/Light filtering curtains,Home Textiles/Window treatments/Curtains & drapes/Light filtering curtains,Home Textiles/Window treatments/Curtains & drapes/Panel curtains,Home Textiles/Window treatments/Curtains & drapes/Light filtering curtains,Home Textiles/Window treatments/Curtains & drapes/Light filtering curtains,Home Textiles/Window treatments/Curtains & drapes/Light filtering curtains,Home Textiles/Window treatments/Curtains & drapes/Panel curtains,"Home Textiles/Window treatments/Shades, blinds & window treatments/Roman shades",Home Textiles/Window treatments/Curtains & drapes/Panel curtains,"Home Textiles/Window treatments/Shades, blinds & window treatments/Pleated & cellular blinds and shades",Home Textiles/Window treatments/Curtains & drapes/Light filtering curtains,Home Textiles/Window treatments/Curtains & drapes/Light filtering curtains,Home Textiles/Window treatments/Curtains & drapes/Light filtering curtains,Home Textiles/Window treatments/Curtains & drapes/Light filtering curtains,Home Textiles/Window treatments/Curtains & drapes/Light filtering curtains,Furniture/Tables & desks/Table & desk systems/GALANT/BEKANT system,Furniture/Tables & desks/Table & desk systems/GALANT/BEKANT system,Furniture/Tables & desks/Table & desk systems/GALANT/BEKANT system,Furniture/Tables & desks/Table & desk systems/GALANT/BEKANT system,Furniture/Tables & desks/Table & desk systems/GALANT/BEKANT system,Home Textiles/Window treatments/Curtain rods & rails/Track systems,Home Décor/Mirrors/Wall mirrors,Home Décor/Mirrors/Wall mirrors,Home Textiles/Window treatments/Curtains & drapes/Light filtering curtains,Home Textiles/Window treatments/Curtains & drapes/Light filtering curtains,Home Textiles/Window treatments/Curtains & drapes/Light filtering curtains,Home electronics/Speakers/Wi-Fi speakers,Home Textiles/Window treatments/Curtain rods & rails/Track systems,Home Décor/Mirrors/Vanity mirrors,Home electronics/Speakers/Bluetooth speakers,Storage & organization/Clothes organizers/Clothes racks & stands,"Home Textiles/Window treatments/Shades, blinds & window treatments/Black-out shades & blinds","Home Textiles/Window treatments/Curtain rods & rails/Curtain wires, clips & hooks",Home Textiles/Window treatments/Curtains & drapes/Panel curtains,Kitchen & appliances/Backsplashes & wall panels/Laminate backsplashes,Kitchen & appliances/Backsplashes & wall panels/Laminate backsplashes,Kitchen & appliances/Backsplashes & wall panels/Laminate backsplashes,Home Textiles/Window treatments/Curtains & drapes/Room darkening curtains & drapes,Storage & organization/Storage solution systems/PAX system/PAX sliding doors,Kitchen & appliances/Kitchen systems/SEKTION kitchen/SEKTION kitchen cabinets,Kitchen & appliances/Kitchen systems/SEKTION kitchen/SEKTION kitchen cabinets,Kitchen & appliances/Kitchen systems/SEKTION kitchen/SEKTION kitchen cabinets,Home Textiles/Window treatments/Curtain rods & rails/Track systems,Furniture/Tables & desks/Desks & computer desks/Desks for home,Home Textiles/Window treatments/Curtain rods & rails/Track systems,Home Textiles/Window treatments/Curtain rods & rails/Track systems,Home Textiles/Window treatments/Curtain rods & rails/Track systems,Lighting/Lamps & light fixtures/Table lamps,Home Textiles/Window treatments/Curtains & drapes/Light filtering curtains,Home Textiles/Window treatments/Curtain rods & rails/Track systems,Home Textiles/Window treatments/Curtain rods & rails/Track systems,Home Textiles/Window treatments/Curtain rods & rails/Track systems,Home Textiles/Window treatments/Curtain rods & rails/Track systems,Home Textiles/Window treatments/Curtain rods & rails/Curtain rods,Furniture/Room dividers,Home Textiles/Window treatments/Curtains & drapes/Panel curtains,Home Textiles/Window treatments/Curtains & drapes/Light filtering curtains,Lighting/Lamps & light fixtures/Ceiling lights/Pendants lights,Lighting/Lamps & light fixtures/Table lamps,Lighting/Lamps & light fixtures/Table lamps,"Lighting/Lamps & light fixtures/Shades, bases & cords/Lamp bases & cords",Lighting/Lamps & light fixtures/Table lamps,Lighting/Lamps & light fixtures/Table lamps,Lighting/Lamps & light fixtures/Table lamps,Lighting/Lamps & light fixtures/Table lamps,Furniture/Room dividers,Storage & organization/Armoires & wardrobes/Solitaire wardrobes,Rugs/Rugs/Runners & small rugs,Lighting/Lamps & light fixtures/Kids lighting,Bathroom/Bathroom vanities/Vanity cabinets without sink,Storage & organization/Storage containers/Bathroom accessories/Towel rails & towel holders,Storage & organization/Storage containers/Bathroom accessories/Towel rails & towel holders,Home Décor/Mirrors/Vanity mirrors,Bathroom/Bathroom storage/Bathroom shelving units,Storage & organization/Storage solution systems/BESTÅ storage system/BESTÅ all parts & accessories/BESTÅ doors & drawer fronts,Storage & organization/Storage containers/Bathroom accessories/Towel rails & towel holders,Storage & organization/Storage containers/Bathroom accessories/Towel rails & towel holders,Storage & organization/Storage containers/Bathroom accessories/Toilet roll holders & stands,Storage & organization/Storage containers/Bathroom accessories/Bathroom boxes & baskets,Storage & organization/Storage containers/Bathroom accessories/Towel rails & towel holders,Home Décor/Clocks/Alarm clocks,Bathroom/Bathroom storage/Bathroom shelving units,Storage & organization/Storage containers/Bathroom accessories/Bathroom trash cans,Storage & organization/Storage containers/Bathroom accessories/Soap dispensers & soap dishes,Storage & organization/Storage containers/Bathroom accessories/Soap dispensers & soap dishes,Storage & organization/Storage containers/Bathroom accessories/Toilet brushes,Storage & organization/Storage containers/Bathroom accessories/Toothbrush holders,Storage & organization/Storage containers/Bathroom accessories/Towel rails & towel holders,Storage & organization/Storage containers/Bathroom accessories/Towel rails & towel holders,Storage & organization/Storage containers/Bathroom accessories/Towel rails & towel holders,Storage & organization/Storage solution systems/PAX system/PAX sliding doors,Storage & organization/Dressers & storage drawers/Chests of drawers,Storage & organization/Storage solution systems/PAX system/PAX doors without hinges,Storage & organization/Storage solution systems/PAX system/PAX doors without hinges,Storage & organization/Storage solution systems/PAX system/PAX doors without hinges,Storage & organization/Storage containers/Bathroom accessories/Toilet brushes,Storage & organization/Storage containers/Bathroom accessories/Towel rails & towel holders,Home Décor/Clocks/Alarm clocks,Home Décor/Clocks/Alarm clocks
