Beds & mattresses/Bedding/Blankets & throws,Beds & mattresses/Bedding/Pillows/Polyester pillows,Rugs/Rugs/Large & medium rugs,Beds & mattresses/Bedding/Cushions & cushions covers/Cushions,Rugs/Rugs/Door mats,Baby & kids/Baby/Cribs & crib mattresses/Baby canopies,Beds & mattresses/Bedding/Cushions & cushions covers/Cushion covers,Beds & mattresses/Bedding/Cushions & cushions covers/Cushion covers,Bathroom/Bathroom textiles/Towels/Bath sheets,Bathroom/Bathroom textiles/Towels/Wash cloths,Bathroom/Bathroom textiles/Towels/Hand towels,Beds & mattresses/Bedding/Blankets & throws,Furniture/Sofas & sectionals/Sofa & armchairs covers/FLOTTEBO covers,Beds & mattresses/Bedding/Cushions & cushions covers/Cushion covers,Beds & mattresses/Bedding/Blankets & throws,Beds & mattresses/Bedding/Blankets & throws,Bathroom/Bathroom textiles/Towels/Hand towels,Bathroom/Bathroom textiles/Towels/Bath towels,Beds & mattresses/Bedding/Cushions & cushions covers/Cushions,Beds & mattresses/Bedding/Blankets & throws,Beds & mattresses/Bedding/Bedlinen/Duvet cover sets,"Outdoor/Outdoor cushions/Outdoor pillows/FUNKÖN Cushion cover, in","Outdoor/Outdoor cushions/Outdoor pillows/FUNKÖN Back cushion, indoor",Beds & mattresses/Bedding/Blankets & throws/FÄLTMAL Pillow,Furniture/Sofas & sectionals/Sofa & armchairs covers/STOCKSUND covers,Rugs/Rugs/Sheepskins & cowhides,Beds & mattresses/Bedding/Cushions & cushions covers/Cushion covers,Rugs/Rugs/Sheepskins & cowhides,Rugs/Rugs/Runners & small rugs,Beds & mattresses/Bedding/Cushions & cushions covers/Cushions,Beds & mattresses/Bedding/Bedlinen/Duvet cover sets,Beds & mattresses/Bedding/Bedlinen/Duvet cover sets,Beds & mattresses/Bedding/Bedlinen/Duvet cover sets,Beds & mattresses/Bedding/Pillows/Down & feather pillows,Beds & mattresses/Bedding/Pillows/Down & feather pillows,Furniture/Beds/Kids beds/Kids bed accessories & canopies,Cookware & tableware/Kitchen textiles/Kitchen towels,Rugs/Rugs/Door mats,Baby & kids/Baby/Baby textiles/Nursery rugs,Baby & kids/Baby/Baby textiles/Baby quilts & pillows,Furniture/Armchairs & chaises/Rattan armchairs,Furniture/Armchairs & chaises/Rattan armchairs,Beds & mattresses/Bedding/Cushions & cushions covers/Children's cushions & blankets,Furniture/Sofas & sectionals/Sofa & armchairs covers/FÄRLÖV covers,Beds & mattresses/Bedding/Bedlinen/Duvet cover sets,Beds & mattresses/Mattresses/Kids mattresses,Laundry & cleaning/Laundry baskets,"Rugs/Rugs/Large & medium rugs/SKARRILD Rug flatwoven, in","Furniture/Patio furniture/Outdoor seat cushions/SÖTHOLMEN Cushion cover, in",Beds & mattresses/Bedding/Cushions & cushions covers/Cushion covers,Furniture/Chairs/High chairs,Furniture/Tables & desks/Changing tables,Furniture/Patio furniture/Outdoor seat cushions,Beds & mattresses/Bedding/Bedlinen/Duvet cover sets,Beds & mattresses/Bedding/Cushions & cushions covers/Inner cushions,Beds & mattresses/Bedding/Cushions & cushions covers/Inner cushions,Beds & mattresses/Bedding/Cushions & cushions covers/Inner cushions,Beds & mattresses/Mattresses/Mattress toppers,"Baby & kids/Baby/Changing, bathing & potty/Changing accessories",Beds & mattresses/Bedding/Cushions & cushions covers/Cushion covers,Beds & mattresses/Bedding/Blankets & throws,Beds & mattresses/Bedding/Cushions & cushions covers/Cushion covers,Beds & mattresses/Bedding/Mattress & pillow protectors,Beds & mattresses/Bedding/Bedlinen/Duvet cover sets,Beds & mattresses/Bedding/Bedlinen/Duvet cover sets,Beds & mattresses/Bedding/Cushions & cushions covers/Cushion covers,Beds & mattresses/Bedding/Cushions & cushions covers/Cushions,Baby & kids/Baby/Baby textiles/Baby towels & washcloths,Rugs/Rugs/Large & medium rugs,Beds & mattresses/Bedding/Comforters/Down & feather comforters,Beds & mattresses/Bedding/Comforters/Down & feather comforters,Beds & mattresses/Bedding/Comforters/Down & feather comforters,Furniture/Patio furniture/Outdoor seat cushions,Furniture/Patio furniture/Outdoor seat cushions,Furniture/Armchairs & chaises/Kids armchairs,Rugs/Rugs/Large & medium rugs,Rugs/Rugs/Large & medium rugs,Beds & mattresses/Bedding/Pillows/Polyester pillows,Beds & mattresses/Bedding/Pillows/Polyester pillows,Home Textiles/Window treatments/Curtains & drapes/Light filtering curtains,Furniture/Beds/Sleeper sofas/Mattress choices,Bathroom/Bathroom textiles/Towels/Bath sheets,Bathroom/Bathroom textiles/Towels/Bath towels,Bathroom/Bathroom textiles/Towels/Hand towels,Furniture/Beds/Sleeper sofas/Mattress choices,Beds & mattresses/Bedding/Cushions & cushions covers/Cushion covers,Beds & mattresses/Bedding/Cushions & cushions covers/Cushion covers,Beds & mattresses/Bedding/Comforters/Polyester comforters,Beds & mattresses/Bedding/Comforters/Polyester comforters,Rugs/Rugs/Runners & small rugs,Rugs/Rugs/Runners & small rugs,Rugs/Rugs/Round rugs,Beds & mattresses/Bedding/Cushions & cushions covers/Cushion covers,Furniture/Sofas & sectionals/Sofa & armchairs covers/HÄRLANDA covers,Furniture/Sofas & sectionals/Sofa & armchairs covers/HÄRLANDA covers,Furniture/Sofas & sectionals/Sofa & armchairs covers/HÄRLANDA covers,Furniture/Sofas & sectionals/Fabric sofas/Modular fabric sofas,Furniture/Sofas & sectionals/Sofa & armchairs covers/HÄRLANDA covers,Beds & mattresses/Bedding/Cushions & cushions covers/Cushion covers,Beds & mattresses/Bedding/Mattress & pillow protectors
Storage & organization/Storage solution systems/AURDAL system/AURDAL parts,Storage & organization/Storage solution systems/AURDAL system/AURDAL parts,Storage & organization/Storage solution systems/AURDAL system/AURDAL parts,Storage & organization/Storage solution systems/AURDAL system/AURDAL parts,Storage & organization/Storage solution systems/AURDAL system/AURDAL parts,Storage & organization/Storage solution systems/AURDAL system/AURDAL parts,Storage & organization/Storage solution systems/AURDAL system/AURDAL parts,Storage & organization/Storage solution systems/AURDAL system/AURDAL parts,Storage & organization/Storage solution systems/AURDAL system/AURDAL parts,Storage & organization/Storage solution systems/AURDAL system/AURDAL parts,Storage & organization/Storage solution systems/AURDAL system/AURDAL parts,Storage & organization/Storage solution systems/AURDAL system/AURDAL parts,Home Décor/Mirrors/Wall mirrors,Baby & kids/Kids/Kids storage & organization/Children's hooks & wall organization,Storage & organization/Clothes organizers/Shoe racks & stands,Home electronics/Cords & chargers/Wireless charging & accessories,Kitchen & appliances/Kitchen drawer organization/Drawer dividers,Storage & organization/Storage containers/Bathroom accessories/Shower accessories,Bathroom/Showers/Shower sets & rails,Storage & organization/Storage containers/Bathroom accessories/Towel rails & towel holders,Storage & organization/Storage containers/Bathroom accessories/Soap dispensers & soap dishes,Storage & organization/Storage containers/Bathroom accessories/Toilet roll holders & stands,Storage & organization/Storage containers/Bathroom accessories/Toothbrush holders,Storage & organization/Storage containers/Bathroom accessories/Shower accessories,Storage & organization/Storage containers/Bathroom accessories/Towel rails & towel holders,Storage & organization/Wall shelves/Brackets,"Storage & organization/Shelving units, bookcases & storage options/Shelf units & cube storage","Storage & organization/Shelving units, bookcases & storage options/Shelf units & cube storage",Home Décor/Mirrors/Makeup & magnifying mirrors,Storage & organization/Storage containers/Bins & bags/Trash cans & pedal bins,Cookware & tableware/Knives & cutting boards/Cutting boards,Storage & organization/Storage containers/Food storage & organizing/Cooler bags,Bathroom/Bathroom storage/Bathroom storage/Bathroom wall cabinets,Storage & organization/Storage solution systems/BESTÅ storage system/BESTÅ all parts & accessories,Cookware & tableware/Cookware & kitchenware/Ovenware,Storage & organization/Storage containers/Paper & media organizers/Media accessories,Cookware & tableware/Serveware/Trays,Cookware & tableware/Cookware & kitchenware/Cooking pans/Frying pans & skillets,Cookware & tableware/Cookware & kitchenware/Pots & pans/Cookware sets,Kitchen & appliances/Kitchen systems/SEKTION kitchen/SEKTION kitchen cabinets,Kitchen & appliances/Kitchen systems/SEKTION kitchen/SEKTION kitchen cabinets,Kitchen & appliances/Kitchen systems/SEKTION kitchen/SEKTION kitchen cabinets/Cabinet doors & drawer fronts,Cookware & tableware/Cookware & kitchenware/Cooking pans/Frying pans & skillets,Cookware & tableware/Cookware & kitchenware/Cooking pans/Frying pans & skillets,Cookware & tableware/Cookware & kitchenware/Cooking pans/Frying pans & skillets,Cookware & tableware/Cookware & kitchenware/Cooking pans/Frying pans & skillets,Kitchen & appliances/Kitchen faucets & sinks/Sink parts,Cookware & tableware/Cookware & kitchenware/Cooking pans/Frying pans & skillets,Cookware & tableware/Cookware & kitchenware/Pots & pans/Cooking & stock pots,Cookware & tableware/Cookware & kitchenware/Pots & pans/Saucepans,Bathroom/Bathroom storage/Bathroom shelving units,Kitchen & appliances/Kitchen systems/SEKTION kitchen/SEKTION kitchen cabinets,Storage & organization/Storage solution systems/BESTÅ storage system/BESTÅ all parts & accessories,Cookware & tableware/Cookware & kitchenware/Pots & pans/Saucepans,Cookware & tableware/Cookware & kitchenware/Pots & pans/Cooking & stock pots,Cookware & tableware/Cookware & kitchenware/Pots & pans/Cooking & stock pots,Cookware & tableware/Cookware & kitchenware/Pots & pans/Cooking & stock pots,Cookware & tableware/Cookware & kitchenware/Pots & pans/Cooking & stock pots,Cookware & tableware/Cookware & kitchenware/Cooking pans/Frying pans & skillets,Cookware & tableware/Cookware & kitchenware/Cooking pans/Frying pans & skillets,Cookware & tableware/Cookware & kitchenware/Cooking pans/Frying pans & skillets,Cookware & tableware/Cookware & kitchenware/Cooking pans/Frying pans & skillets,Storage & organization/Storage containers/Food storage & organizing/Jars & tins,Storage & organization/Storage containers/Bins & bags/Trash cans & pedal bins,Storage & organization/Storage containers/Bathroom accessories/Shower accessories,Storage & organization/Wall shelves/Complete wall shelves,Storage & organization/Display & storage cabinets/Filing cabinets & storage cabinets/Office storage cabinets & units,Storage & organization/Storage solution systems/PAX system/PAX Interior organizers,Storage & organization/Storage solution systems/PAX system/PAX Interior organizers,Storage & organization/Display & storage cabinets/Filing cabinets & storage cabinets/Office storage cabinets & units,Bathroom/Bathroom faucets/Faucets,Storage & organization/Storage solution systems/PAX system/PAX Interior organizers,Storage & organization/Dressers & storage drawers/Drawer units/Drawer units for office,Storage & organization/Dressers & storage drawers/Drawer units/Drawer units for office,Storage & organization/Storage solution systems/PAX system/PAX sliding doors,Storage & organization/Storage solution systems/PAX system/PAX Interior organizers,Storage & organization/Storage solution systems/PAX system/PAX Interior organizers,"Storage & organization/Shelving units, bookcases & storage options/Bookcases","Storage & organization/Shelving units, bookcases & storage options/Bookcases",Storage & organization/Storage solution systems/PAX system/PAX Interior organizers,Storage & organization/Dressers & storage drawers/Drawer units/Drawer units for office,Storage & organization/Storage solution systems/PAX system/PAX Interior organizers,Furniture/Tables & desks/Table & desk systems/GALANT/BEKANT system,Furniture/Tables & desks/Table & desk systems/GALANT/BEKANT system,Furniture/Tables & desks/Table & desk systems/GALANT/BEKANT system,Furniture/Tables & desks/Table & desk systems/GALANT/BEKANT system,Furniture/Tables & desks/Table & desk systems/GALANT/BEKANT system,Storage & organization/Display & storage cabinets/Dining room cabinets & cupboards,Furniture/Chairs/Desk chairs/Desk chairs for home,Furniture/Tables & desks/Table & desk systems/GALANT/BEKANT system,Furniture/Tables & desks/Table & desk systems/GALANT/BEKANT system/BEKANT desk underframes/BEKANT Sit,Furniture/Tables & desks/Table & desk systems/GALANT/BEKANT system,Furniture/Tables & desks/Table & desk systems/GALANT/BEKANT system,Furniture/Tables & desks/Table & desk systems/IDÅSEN system,"Storage & organization/Shelving units, bookcases & storage options/Bookcases",Furniture/Tables & desks/Table & desk systems/IDÅSEN system,Furniture/Tables & desks/Table & desk systems/IDÅSEN system,"Storage & organization/Shelving units, bookcases & storage options/Bookcases",Furniture/Tables & desks/Table & desk systems/GALANT/BEKANT system,Cookware & tableware/Serveware/Serving dishes
Home Textiles/Window treatments/Curtains & drapes/Light filtering curtains,Home Textiles/Window treatments/Curtains & drapes/Light filtering curtains,Home Textiles/Window treatments/Curtains & drapes/Panel curtains,Home Textiles/Window treatments/Curtains & drapes/Panel curtains,Home Textiles/Window treatments/Curtains & drapes/Light filtering curtains,Home Textiles/Window treatments/Curtains & drapes/Light filtering curtains,Home Textiles/Window treatments/Curtains & drapes/Light filtering curtains,Home Textiles/Window treatments/Curtains & drapes/Light filtering curtains,Home Textiles/Window treatments/Curtains & drapes/Light filtering curtains,"Home Textiles/Window treatments/Shades, blinds & window treatments/Roman shades","Home Textiles/Window treatments/Shades, blinds & window treatments/Pleated & cellular blinds and shades",Home Textiles/Window treatments/Curtains & drapes/Panel curtains,Home Textiles/Window treatments/Curtains & drapes/Panel curtains,Home Textiles/Window treatments/Curtains & drapes/Light filtering curtains,Home Décor/Noticeboards,Storage & organization/Clothes organizers/Clothes racks & stands,Storage & organization/Clothes organizers/Clothes racks & stands,Storage & organization/Storage solution systems/PAX system/PAX doors without hinges,Home Décor/Clocks/Alarm clocks,Home Décor/Mirrors/Vanity mirrors,Rugs/Rugs/Door mats,"Home improvement/Oils, stains & product care","Home improvement/Oils, stains & product care","Home improvement/Oils, stains & product care","Home improvement/Oils, stains & product care",Baby & kids/Kids/Toys & play/Role play,Baby & kids/Kids/Toys & play/Role play,Lighting/Lamps & light fixtures/Kids lighting,Cookware & tableware/Serveware/Trays,Baby & kids/Kids/Toys & play/Physical play,Bathroom/Bathroom sinks,Bathroom/Bathroom sinks,Bathroom/Bathroom sinks,Bathroom/Bathroom sinks,Bathroom/Bathroom sinks,Pet accessories/Cats,Cookware & tableware/Cookware & kitchenware/Cooking pans/Woks,Kitchen & appliances/Backsplashes & wall panels/Laminate backsplashes,Kitchen & appliances/Backsplashes & wall panels/Laminate backsplashes,Kitchen & appliances/Backsplashes & wall panels/Laminate backsplashes,Home electronics/Speakers/Wi-Fi speakers,Furniture/Patio furniture/Outdoor chaises & hammocks,Furniture/Tables & desks/Accent tables/Coffee tables,Furniture/Tables & desks/Accent tables/Coffee tables,Outdoor/Umbrellas & gazebos/Patio umbrellas & bases,Home Décor/Storage boxes & baskets/Secondary storage boxes,Outdoor/Umbrellas & gazebos/Patio umbrellas & bases,Cookware & tableware/Flatware/Flatware,Home Textiles/Window treatments/Curtain rods & rails/Track systems,Cookware & tableware/Serveware/Trays,Storage & organization/Storage solution systems/PAX system/PAX doors without hinges,"Home Textiles/Window treatments/Shades, blinds & window treatments/Black-out shades & blinds",Bathroom/Showers/Shower heads,Storage & organization/Dressers & storage drawers/Chests of drawers,Kitchen & appliances/Kitchen systems/SEKTION kitchen/SEKTION kitchen cabinets,Kitchen & appliances/Kitchen systems/SEKTION kitchen/SEKTION kitchen cabinets,Kitchen & appliances/Kitchen systems/SEKTION kitchen/SEKTION kitchen cabinets/Cabinet doors & drawer fronts,Kitchen & appliances/Kitchen systems/SEKTION kitchen/SEKTION kitchen cabinets,Kitchen & appliances/Kitchen systems/SEKTION kitchen/SEKTION kitchen cabinets,Kitchen & appliances/Kitchen systems/SEKTION kitchen/SEKTION kitchen cabinets,Home Décor/Clocks/Alarm clocks,Home Décor/Clocks/Alarm clocks,Cookware & tableware/Coffee & tea/Mugs & cups,Cookware & tableware/Dinnerware/Dinnerware sets,Cookware & tableware/Coffee & tea/Mugs & cups,Cookware & tableware/Cookware & kitchenware/Cooking pans/Frying pans & skillets,Home Décor/Storage boxes & baskets/Baskets,Storage & organization/Storage solution systems/PAX system/PAX doors without hinges,Laundry & cleaning/Cleaning accessories,Storage & organization/TV & media furniture/TV stands & benches,Storage & organization/Wall shelves/Complete wall shelves/HEMNES Wall,Bathroom/Bathroom textiles/Shower curtains,Furniture/Tables & desks/Dining tables/Up to 4 seats,Baby & kids/Kids/Toys & play/Physical play,Furniture/Tables & desks/Dining tables/Up to 6 seats,"Storage & organization/Wall shelves & hooks/Hooks/BRANDUR Rail with 4 hooks, in-","Storage & organization/Wall shelves & hooks/Hooks/BRANDUR Hook, in-",Home Décor/Flower pots & stands/Indoor plant pots,"Storage & organization/Wall shelves & hooks/Hooks/BRANDUR Hook, in-",Storage & organization/Wall shelves & hooks/Hooks,Storage & organization/Wall shelves & hooks/Hooks,"Laundry & cleaning/Drying racks/MULIG Drying rack, indoor",Home Décor/Candle holders & candles/Lanterns,"Storage & organization/Clothes organizers/Clothes racks & stands/TURBO Clothes rack, indoor",Home Décor/Storage boxes & baskets/Kids boxes & baskets,IKEA food & restaurant/Meat,Cookware & tableware/Serveware/Trays,Furniture/Tables & desks/Dining tables/Dining table tops & underframes,Cookware & tableware/Dinnerware/Plates,Cookware & tableware/Dinnerware/Bowls,Cookware & tableware/Coffee & tea/Mugs & cups,Cookware & tableware/Dinnerware/Side plates,Storage & organization/Storage containers/Paper & media organizers/Desk accessories,Storage & organization/Storage containers/Bins & bags/Trash cans & pedal bins,Storage & organization/Storage containers/Bathroom accessories/Towel rails & towel holders,Storage & organization/Storage containers/Bathroom accessories/Towel rails & towel holders,Cookware & tableware/Cookware & kitchenware/Ovenware,Cookware & tableware/Cookware & kitchenware/Ovenware,Cookware & tableware/Cookware & kitchenware/Ovenware,Kitchen & appliances/Kitchen systems/SEKTION kitchen/SEKTION kitchen cabinets
Storage & organization/Display & storage cabinets/Display cabinets,"Storage & organization/Shelving units, bookcases & storage options/Shelf units & cube storage",Kitchen & appliances/Kitchen drawer organization/Shelves & drawers,Storage & organization/Storage solution systems/PAX system/PAX Interior organizers,Storage & organization/Storage solution systems/PAX system/PAX Interior organizers,Cookware & tableware/Knives & cutting boards/Sharpening tools,Storage & organization/Wall shelves & hooks/Hooks,Home electronics/Speakers/Wi-Fi speakers,Home electronics/Speakers/Wi-Fi speakers,Storage & organization/Storage solution systems/BESTÅ storage system/BESTÅ all parts & accessories,Furniture/Tables & desks/Accent tables/End tables & side tables,Bathroom/Bathroom vanities/Bathroom vanity legs,Bathroom/Bathroom storage/Bathroom storage/Bathroom wall cabinets,Home Décor/Storage boxes & baskets/Paper & media boxes,Furniture/Kids furniture/Toy storage,Furniture/Kids furniture/Toy storage,Storage & organization/Storage solution systems/SMÅSTAD system/SMÅSTAD doors & drawers,Storage & organization/Storage solution systems/SMÅSTAD system/SMÅSTAD doors & drawers,Storage & organization/Storage solution systems/SMÅSTAD system/SMÅSTAD doors & drawers,Furniture/Kids furniture/Toy storage,Furniture/Kids furniture/Toy storage,Furniture/Chairs/Bar stools & chairs,Storage & organization/Storage solution systems/BESTÅ storage system/BESTÅ all parts & accessories,Bathroom/Bathroom storage/Bathroom storage/Bathroom tall cabinets,Storage & organization/Armoires & wardrobes/Solitaire wardrobes,Storage & organization/Storage containers/Cable management & accessories,Home electronics/Speakers/Wi-Fi speakers,Storage & organization/Storage containers/Food storage & organizing/Food containers,"Storage & organization/Shelving units, bookcases & storage options/Shelf units & cube storage",Kitchen & appliances/Kitchen islands & carts,Kitchen & appliances/Kitchen islands & carts,Kitchen & appliances/Kitchen islands & carts,Kitchen & appliances/Kitchen islands & carts,Storage & organization/Display & storage cabinets/Dining room cabinets & cupboards,Storage & organization/TV & media furniture/TV stands & benches,"Storage & organization/Shelving units, bookcases & storage options/Shelf units & cube storage",Furniture/Tables & desks/Desks & computer desks/Desks for home,Furniture/Tables & desks/Desks & computer desks/Desks for home,Furniture/Tables & desks/Desks & computer desks/Desks for home,Storage & organization/Storage containers/Food storage & organizing/Food containers,Kitchen & appliances/Appliances/Microwaves/Microwave ovens,Storage & organization/Storage solution systems/IVAR system/All parts,Storage & organization/Storage solution systems/IVAR system/All parts,Storage & organization/Storage solution systems/IVAR system/All parts,Storage & organization/Storage solution systems/IVAR system/All parts,Storage & organization/Storage solution systems/IVAR system/All parts,Storage & organization/Storage solution systems/IVAR system/All parts,Storage & organization/Storage solution systems/IVAR system/All parts,Storage & organization/Storage solution systems/IVAR system/All parts,Storage & organization/Storage solution systems/IVAR system/All parts,Storage & organization/Display & storage cabinets/Dining room cabinets & cupboards,Storage & organization/Storage solution systems/IVAR system/All parts,Storage & organization/Storage solution systems/IVAR system/All parts,Storage & organization/Storage solution systems/IVAR system/All parts,Storage & organization/Storage solution systems/IVAR system/All parts,Storage & organization/Storage solution systems/IVAR system/All parts,Storage & organization/Storage solution systems/IVAR system/All parts,Storage & organization/Storage solution systems/IVAR system/All parts,Storage & organization/Storage solution systems/IVAR system/All parts,Storage & organization/Display & storage cabinets/Dining room cabinets & cupboards,Storage & organization/Storage solution systems/IVAR system/All parts,Storage & organization/Storage solution systems/IVAR system/All parts,Storage & organization/Storage solution systems/IVAR system/All parts,Home Décor/Mirrors/Mirror cabinets,Home Décor/Mirrors/Mirror cabinets,Kitchen & appliances/Kitchen wall organization & storage/Wall organizers,Kitchen & appliances/Kitchen wall organization & storage/Wall organizers,Kitchen & appliances/Kitchen systems/SUNNERSTA modular kitchen/Accessories for SUNNERSTA,Kitchen & appliances/Kitchen systems/SUNNERSTA modular kitchen/Accessories for SUNNERSTA,Kitchen & appliances/Kitchen systems/SUNNERSTA modular kitchen/Accessories for SUNNERSTA,Kitchen & appliances/Kitchen systems/SUNNERSTA modular kitchen/Accessories for SUNNERSTA,Kitchen & appliances/Kitchen systems/SUNNERSTA modular kitchen/Accessories for SUNNERSTA,"Storage & organization/Display & storage cabinets/Buffet tables, sideboard buffets & buffet cabinets",Home electronics/Speakers/Wi-Fi speakers,"Storage & organization/Shelving units, bookcases & storage options/Shelf units & cube storage",Cookware & tableware/Serveware/Trays,Cookware & tableware/Serveware/Trays,Cookware & tableware/Serveware/Trays,Storage & organization/Storage containers/Paper & media organizers/Desk accessories,Storage & organization/Storage solution systems/IVAR system/All parts,Kitchen & appliances/Kitchen systems/SEKTION kitchen/SEKTION kitchen cabinets,"Storage & organization/Shelving units, bookcases & storage options/Shelf units & cube storage",Storage & organization/Display & storage cabinets/Dining room cabinets & cupboards,Kitchen & appliances/Kitchen drawer organization/Drawer dividers,Storage & organization/Dressers & storage drawers/Chests of drawers,Storage & organization/Dressers & storage drawers/Chests of drawers,Storage & organization/Dressers & storage drawers/Chests of drawers,Storage & organization/Dressers & storage drawers/Chests of drawers,Storage & organization/Dressers & storage drawers/Chests of drawers,Storage & organization/Dressers & storage drawers/Chests of drawers,Storage & organization/Dressers & storage drawers/Chests of drawers,Storage & organization/Dressers & storage drawers/Chests of drawers,Storage & organization/Dressers & storage drawers/Chests of drawers,Storage & organization/Dressers & storage drawers/Chests of drawers,Storage & organization/Dressers & storage drawers/Chests of drawers,Storage & organization/Dressers & storage drawers/Chests of drawers,Home Décor/Storage boxes & baskets/Secondary storage boxes,Storage & organization/Wall shelves & hooks/Hooks,Furniture/Tables & desks/Bar tables,Storage & organization/Storage containers/Food storage & organizing/Food containers
