Home Décor/Plants & flowers/House plants,Home Décor/Plants & flowers/House plants,Home Décor/Plants & flowers/House plants,Home Décor/Plants & flowers/House plants,Home Décor/Plants & flowers/House plants,Home Décor/Plants & flowers/House plants,Home Décor/Plants & flowers/House plants,Home Décor/Plants & flowers/House plants,Home Décor/Plants & flowers/House plants,Home Décor/Plants & flowers/House plants,Home Décor/Plants & flowers/House plants,Home Décor/Plants & flowers/House plants,Home Décor/Plants & flowers/House plants,Home Décor/Plants & flowers/House plants,Home Décor/Plants & flowers/House plants,Home Décor/Plants & flowers/House plants,Home Décor/Plants & flowers/House plants,Home Décor/Plants & flowers/House plants,Home Décor/Plants & flowers/House plants,Home Décor/Plants & flowers/House plants,Home Décor/Plants & flowers/House plants,Home Décor/Plants & flowers/House plants,Home Décor/Plants & flowers/House plants,Home Décor/Plants & flowers/House plants,Home Décor/Plants & flowers/House plants,Home Décor/Plants & flowers/House plants,Home Décor/Plants & flowers/House plants,Home Décor/Plants & flowers/House plants,Home Décor/Flower pots & stands/Indoor plant pots,Home Décor/Plants & flowers/House plants,Home Décor/Plants & flowers/Artificial plants & flowers,Home Décor/Flower pots & stands/Indoor plant pots,Home Décor/Vases & bowls/Vases,Home Décor/Flower pots & stands/Indoor plant pots,Home Décor/Candle holders & candles/Lanterns,Home Décor/Plants & flowers/Artificial plants & flowers,Home Décor/Plants & flowers/Dried plants & potpourri/EGENSINNIG Dried parts of flowers,Home Décor/Plants & flowers/Dried plants & potpourri/ENHÄLLIG Dried parts of flowers,Home Décor/Plants & flowers/Dried plants & potpourri/ENKELRIKTAD Dried parts of flowers,Home Décor/Plants & flowers/Dried plants & potpourri,Home Décor/Plants & flowers/Dried plants & potpourri,Home Décor/Plants & flowers/Artificial plants & flowers,Home Décor/Plants & flowers/Dried plants & potpourri,Home Décor/Plants & flowers/Artificial plants & flowers,Home Décor/Flower pots & stands/Indoor plant pots,Home Décor/Plants & flowers/Dried plants & potpourri,Home Décor/Vases & bowls/Bowls & dishes,Home Décor/Vases & bowls/Bowls & dishes,Home Décor/Flower pots & stands/Indoor plant pots,Home Décor/Flower pots & stands/Indoor plant pots,Home Décor/Flower pots & stands/Indoor plant pots,Home Décor/Vases & bowls/Vases,Home Décor/Vases & bowls/Vases,Home Décor/Vases & bowls/Vases,Gardening & plants/Plant stands & movers,Gardening & plants/Plant stands & movers,Home Décor/Plants & flowers/Artificial plants & flowers,Home Décor/Plants & flowers/Artificial plants & flowers,Home Décor/Vases & bowls/Vases,Gardening & plants/Plant stands & movers,Gardening & plants/Plant stands & movers,Home Décor/Flower pots & stands/Indoor plant pots,Home Décor/Plants & flowers/Dried plants & potpourri/DIVALATER Dried parts of flowers,Home Décor/Plants & flowers/Dried plants & potpourri,Home Décor/Plants & flowers/Dried plants & potpourri/DOGMATISK Dried parts of flowers,Home Décor/Plants & flowers/Dried plants & potpourri/DRÄGLIG Dried parts of flowers,Home Décor/Flower pots & stands/Outdoor plant pots,Home Décor/Plants & flowers/Artificial plants & flowers,Home Décor/Plants & flowers/Artificial plants & flowers,Home Décor/Plants & flowers/Artificial plants & flowers,Home Décor/Plants & flowers/Artificial plants & flowers,Home Décor/Plants & flowers/Artificial plants & flowers,Home Décor/Plants & flowers/Artificial plants & flowers,Home Décor/Plants & flowers/Artificial plants & flowers,Home Décor/Plants & flowers/Artificial plants & flowers,Home Décor/Plants & flowers/Artificial plants & flowers,Home Décor/Plants & flowers/Artificial plants & flowers,Home Décor/Plants & flowers/Artificial plants & flowers,Home Décor/Plants & flowers/Artificial plants & flowers,Home Décor/Plants & flowers/Artificial plants & flowers,Home Décor/Plants & flowers/Artificial plants & flowers,Home Décor/Plants & flowers/Artificial plants & flowers,Home Décor/Plants & flowers/Artificial plants & flowers,Home Décor/Plants & flowers/Artificial plants & flowers,Home Décor/Plants & flowers/Artificial plants & flowers,Home Décor/Plants & flowers/Artificial plants & flowers,Home Décor/Plants & flowers/Artificial plants & flowers,Home Décor/Plants & flowers/Artificial plants & flowers,Home Décor/Plants & flowers/Artificial plants & flowers,Home Décor/Plants & flowers/Artificial plants & flowers,Home Décor/Plants & flowers/Artificial plants & flowers,Home Décor/Plants & flowers/Artificial plants & flowers,Home Décor/Plants & flowers/Artificial plants & flowers,Home Décor/Plants & flowers/Artificial plants & flowers,Home Décor/Plants & flowers/Artificial plants & flowers,Home Décor/Plants & flowers/Artificial plants & flowers,Home Décor/Plants & flowers/Artificial plants & flowers,Home Décor/Plants & flowers/Artificial plants & flowers,Home Décor/Plants & flowers/Artificial plants & flowers,Home Décor/Plants & flowers/Artificial plants & flowers
Lighting/Lamps & light fixtures/Wall lamps/Wall lamps,Lighting/Lamps & light fixtures/Ceiling lights/Pendants lights,Lighting/Lamps & light fixtures/Ceiling lights/Pendants lights,Lighting/Lamps & light fixtures/Table lamps,Lighting/Lamps & light fixtures/Table lamps/SIMRISHAMN Table,Lighting/Lamps & light fixtures/Wall lamps/Wall lamps,Lighting/Lamps & light fixtures/Wall lamps/Wall lamps,Lighting/Lamps & light fixtures/Wall lamps/Wall lamps,Lighting/Lamps & light fixtures/Table lamps,Lighting/Lamps & light fixtures/Table lamps,Lighting/Lamps & light fixtures/Wall lamps/Wall lamps,Lighting/Lamps & light fixtures/Ceiling lights/Pendants lights,Lighting/Lamps & light fixtures/Ceiling lights/Ceiling lamps,Lighting/Lamps & light fixtures/Wall lamps/Wall lamps,Lighting/Lamps & light fixtures/Ceiling lights/Pendants lights,"Lighting/Lamps & light fixtures/Shades, bases & cords/Lamp bases & cords","Lighting/Lamps & light fixtures/Shades, bases & cords/Lamp bases & cords","Lighting/Lamps & light fixtures/Shades, bases & cords/Lamp bases & cords",Lighting/Lamps & light fixtures/Ceiling lights/Ceiling lamps,Lighting/Decorative lighting/Decorative outdoor lighting/SKINA LED string light w,Lighting/Decorative lighting/Decorative indoor lighting,Lighting/Decorative lighting/Decorative indoor lighting,Lighting/Decorative lighting/Decorative indoor lighting,Lighting/Lamps & light fixtures/Floor lamps,Lighting/Lamps & light fixtures/Floor lamps,Lighting/Lamps & light fixtures/Ceiling lights/Pendants lights,Lighting/Lamps & light fixtures/Floor lamps,Lighting/Lamps & light fixtures/Ceiling lights/Pendants lights,Lighting/Lamps & light fixtures/Ceiling lights/Pendants lights,Lighting/Lamps & light fixtures/Table lamps,Lighting/Lamps & light fixtures/Table lamps,Lighting/Lamps & light fixtures/Ceiling lights/Ceiling lamps,Lighting/Lamps & light fixtures/Ceiling lights/Ceiling lamps,Lighting/Lamps & light fixtures/Wall lamps/Wall lamps,Lighting/Lamps & light fixtures/Floor lamps/VIRRMO Floor,Lighting/Lamps & light fixtures/Ceiling lights/Ceiling lamps,Lighting/Lamps & light fixtures/Desk lamps,Lighting/Lamps & light fixtures/Desk lamps,Lighting/Lamps & light fixtures/Floor lamps/VIRRMO Floor,Lighting/Lamps & light fixtures/Ceiling lights/Ceiling track lighting,Lighting/Lamps & light fixtures/Desk lamps,Lighting/Lamps & light fixtures/Floor lamps,"Lighting/Lamps & light fixtures/Shades, bases & cords/Lamp bases & cords","Lighting/Lamps & light fixtures/Shades, bases & cords/Lamp bases & cords",Lighting/Lamps & light fixtures/Ceiling lights/Pendants lights,Lighting/Lamps & light fixtures/Ceiling lights/Pendants lights,Home Décor/Candle holders & candles/Lanterns/GLIMRANDE Lantern f,Lighting/Lamps & light fixtures/Ceiling lights/Pendants lights,Lighting/Lamps & light fixtures/LED lighting/LED lamps,Lighting/Lamps & light fixtures/Wall lamps/Wall lamps,Lighting/Lamps & light fixtures/Ceiling lights/Pendants lights,Lighting/Lamps & light fixtures/Wall lamps/Wall lamps,Lighting/Lamps & light fixtures/Kids lighting,Lighting/Lamps & light fixtures/Ceiling lights/Ceiling lamps,Lighting/Lamps & light fixtures/Ceiling lights/Ceiling track lighting,Lighting/Lamps & light fixtures/Table lamps,Lighting/Lamps & light fixtures/Ceiling lights/Pendants lights,Lighting/Lamps & light fixtures/Floor lamps/NÄVLINGE LED floor,Lighting/Lamps & light fixtures/Floor lamps/NÄVLINGE LED floor,Lighting/Lamps & light fixtures/Table lamps,Lighting/Lamps & light fixtures/Table lamps,Lighting/Lamps & light fixtures/Desk lamps/NÄVLINGE LED wall,Lighting/Lamps & light fixtures/Desk lamps/NÄVLINGE LED wall,Lighting/Lamps & light fixtures/Ceiling lights/Pendants lights,Lighting/Bathroom lighting/Bathroom wall lights/GUNNARP LED ceiling,Lighting/LED Light bulbs,Lighting/Lamps & light fixtures/Floor lamps,Lighting/Lamps & light fixtures/Desk lamps/HEKTAR Work lamp w,Lighting/Lamps & light fixtures/Desk lamps,Lighting/Lamps & light fixtures/Desk lamps,Lighting/Lamps & light fixtures/Ceiling lights/Pendants lights,Lighting/Lamps & light fixtures/Floor lamps/HEKTAR Floor lamp w,Lighting/Lamps & light fixtures/Floor lamps,Lighting/Lamps & light fixtures/Wall lamps/Wall spotlights,Lighting/Lamps & light fixtures/Ceiling lights/Ceiling track lighting,Home Décor/Candle holders & candles/Candle holders,Lighting/Lamps & light fixtures/Ceiling lights/Pendants lights,Lighting/Lamps & light fixtures/Ceiling lights/Ceiling lamps,Lighting/Lamps & light fixtures/Ceiling lights/Ceiling lamps,Lighting/Lamps & light fixtures/Wall lamps/Wall lamps,Lighting/Lamps & light fixtures/Floor lamps,Lighting/Lamps & light fixtures/Ceiling lights/Pendants lights,Lighting/Lamps & light fixtures/Wall lamps/Wall lamps,Lighting/Lamps & light fixtures/Wall lamps/Wall lamps,Lighting/Lamps & light fixtures/Table lamps,Home Décor/Decorative accessories,Lighting/Lamps & light fixtures/Wall lamps/Wall lamps,Home Décor/Candle holders & candles/Candle holders,Lighting/Lamps & light fixtures/Table lamps,Lighting/Lamps & light fixtures/Wall lamps/Wall lamps,Lighting/Lamps & light fixtures/Wall lamps/Wall lamps,Lighting/Lamps & light fixtures/Ceiling lights/Ceiling lamps,Lighting/Lamps & light fixtures/Wall lamps/Wall lamps,Lighting/Lamps & light fixtures/Table lamps,Lighting/Lamps & light fixtures/Kids lighting,Lighting/Lamps & light fixtures/Ceiling lights/Ceiling lamps,"Lighting/Lamps & light fixtures/Shades, bases & cords/Lamp shades",Lighting/Lamps & light fixtures/Ceiling lights/Pendants lights,Lighting/Lamps & light fixtures/Table lamps,Lighting/Lamps & light fixtures/Table lamps
Lighting/Lamps & light fixtures/LED lighting/LED lamps,Lighting/Bathroom lighting/Bathroom wall lights/GUNNARP LED ceiling,Lighting/Lamps & light fixtures/Table lamps,Lighting/Bathroom lighting/Bathroom vanity lights,Lighting/Bathroom lighting/Bathroom vanity lights,Lighting/Bathroom lighting/Bathroom vanity lights,Lighting/Lamps & light fixtures/Wall lamps/Wall lamps,Lighting/Lamps & light fixtures/Ceiling lights/Ceiling lamps,Lighting/Lamps & light fixtures/Ceiling lights/Ceiling lamps,Lighting/Lamps & light fixtures/Wall lamps/Wall lamps,Lighting/Lamps & light fixtures/Ceiling lights/Ceiling lamps,Lighting/Lamps & light fixtures/Ceiling lights/Ceiling lamps,Lighting/Lamps & light fixtures/Kids lighting,Lighting/Lamps & light fixtures/Ceiling lights/Ceiling lamps,Lighting/Lamps & light fixtures/Floor lamps/VIRRMO Floor,Lighting/Lamps & light fixtures/Floor lamps/VIRRMO Floor,Lighting/Lamps & light fixtures/Ceiling lights/Ceiling track lighting,Lighting/Lamps & light fixtures/Desk lamps,Lighting/Lamps & light fixtures/Desk lamps,Lighting/Lamps & light fixtures/Desk lamps,Home Décor/Mirrors/Vanity mirrors,Home Décor/Mirrors/Vanity mirrors,Lighting/Lamps & light fixtures/Floor lamps/NÄVLINGE LED floor,Lighting/Lamps & light fixtures/Table lamps,Lighting/Lamps & light fixtures/Kids lighting,Lighting/Lamps & light fixtures/Desk lamps/NÄVLINGE LED wall,Lighting/Lamps & light fixtures/Table lamps,Lighting/Lamps & light fixtures/Ceiling lights/Pendants lights,Lighting/Lamps & light fixtures/Desk lamps/NÄVLINGE LED wall,Lighting/Lamps & light fixtures/Table lamps,Lighting/Lamps & light fixtures/Floor lamps/NÄVLINGE LED floor,Lighting/Lamps & light fixtures/Ceiling lights/Ceiling lamps,Lighting/Lamps & light fixtures/Ceiling lights/Ceiling track lighting,Lighting/Lamps & light fixtures/Wall lamps/Wall lamps,"Lighting/Lamps & light fixtures/Shades, bases & cords/Lamp bases & cords","Lighting/Lamps & light fixtures/Shades, bases & cords/Lamp bases & cords","Lighting/Lamps & light fixtures/Shades, bases & cords/Lamp bases & cords",Lighting/Lamps & light fixtures/LED lighting/LED lamps,Lighting/Lamps & light fixtures/Table lamps,Lighting/Lamps & light fixtures/Floor lamps,Lighting/Lamps & light fixtures/Floor lamps,Lighting/Lamps & light fixtures/Floor lamps/HEKTOGRAM Floor uplt,Lighting/Lamps & light fixtures/Ceiling lights/Ceiling lamps,Lighting/Lamps & light fixtures/Ceiling lights/Ceiling lamps,Lighting/Lamps & light fixtures/Wall lamps/Wall lamps,Lighting/Lamps & light fixtures/Floor lamps/FLUGBO Floor uplt,Lighting/Lamps & light fixtures/Ceiling lights/Ceiling lamps,Lighting/Lamps & light fixtures/Desk lamps/NYMÅNE Work,Lighting/Lamps & light fixtures/Ceiling lights/Ceiling track lighting,Lighting/Lamps & light fixtures/Wall lamps/Wall lamps,Lighting/Lamps & light fixtures/Wall lamps/Wall lamps,Lighting/Lamps & light fixtures/Wall lamps/Wall spotlights,Lighting/Lamps & light fixtures/Floor lamps/NYMÅNE Floor,Lighting/Lamps & light fixtures/Wall lamps/Wall spotlights,Lighting/Lamps & light fixtures/Floor lamps,Lighting/Lamps & light fixtures/Wall lamps/Wall lamps,Lighting/Lamps & light fixtures/Ceiling lights/Ceiling track lighting,Lighting/Lamps & light fixtures/Ceiling lights/Ceiling track lighting,Lighting/Lamps & light fixtures/Ceiling lights/Ceiling lamps,Lighting/Lamps & light fixtures/Wall lamps/Wall lamps,Lighting/Lamps & light fixtures/Floor lamps,Lighting/Lamps & light fixtures/Ceiling lights/Pendants lights,Lighting/Lamps & light fixtures/Wall lamps/Wall lamps,Lighting/Lamps & light fixtures/Ceiling lights/Pendants lights,Lighting/Lamps & light fixtures/Wall lamps/Wall lamps,Lighting/Lamps & light fixtures/Table lamps,Lighting/Lamps & light fixtures/Table lamps/SIMRISHAMN Table,Lighting/LED Light bulbs,Lighting/Lamps & light fixtures/Ceiling lights/Ceiling track lighting,Lighting/Lamps & light fixtures/Wall lamps/Wall lamps,Lighting/Lamps & light fixtures/Wall lamps/Wall lamps,Lighting/Lamps & light fixtures/Wall lamps/Wall lamps,Lighting/Lamps & light fixtures/Ceiling lights/Ceiling lamps,Lighting/Lamps & light fixtures/Ceiling lights/Pendants lights,Lighting/Lamps & light fixtures/Table lamps,Lighting/Lamps & light fixtures/Wall lamps/Wall lamps,Lighting/Lamps & light fixtures/Table lamps,Lighting/Lamps & light fixtures/Desk lamps,"Lighting/Lamps & light fixtures/Shades, bases & cords/Lamp bases & cords","Lighting/Lamps & light fixtures/Shades, bases & cords/Lamp bases & cords",Lighting/Lamps & light fixtures/Floor lamps,Lighting/Lamps & light fixtures/Floor lamps,Lighting/Lamps & light fixtures/Wall lamps/Wall lamps,"Lighting/Lamps & light fixtures/Shades, bases & cords/Lamp bases & cords",Lighting/Lamps & light fixtures/Ceiling lights/Pendants lights,Lighting/Lamps & light fixtures/Ceiling lights/Pendants lights,Lighting/Lamps & light fixtures/Ceiling lights/Pendants lights,Lighting/Lamps & light fixtures/Wall lamps/Wall lamps,Lighting/Lamps & light fixtures/Floor lamps,Lighting/Lamps & light fixtures/Ceiling lights/Ceiling lamps,Lighting/Lamps & light fixtures/Desk lamps/SKURUP Work,Lighting/Lamps & light fixtures/Ceiling lights/Ceiling track lighting,Lighting/Lamps & light fixtures/Desk lamps,Lighting/Lamps & light fixtures/Wall lamps/Wall lamps,Lighting/Lamps & light fixtures/Floor lamps/TÅGARP Floor uplt,Lighting/Lamps & light fixtures/Wall lamps/Wall lamps,Lighting/Lamps & light fixtures/Floor lamps/ISJAKT LED floor uplighter,Lighting/Lamps & light fixtures/Ceiling lights/Ceiling lamps,Lighting/Lamps & light fixtures/Wall lamps/Wall lamps,Lighting/Lamps & light fixtures/Wall lamps/Wall lamps
Storage & organization/Storage containers/Bathroom accessories/Towel rails & towel holders,Storage & organization/Storage containers/Bathroom accessories/Towel rails & towel holders,Storage & organization/Dressers & storage drawers/Chests of drawers,Furniture/Tables & desks/Desks & computer desks/Desks for home,Furniture/Tables & desks/Makeup vanities & dressing tables,Furniture/Tables & desks/Makeup vanities & dressing tables,Storage & organization/Dressers & storage drawers/Chests of drawers,Furniture/Tables & desks/Nightstands,Storage & organization/Dressers & storage drawers/Chests of drawers,"Storage & organization/Clothes organizers/Clothes racks & stands/TURBO Clothes rack, indoor",Storage & organization/Wall shelves & hooks/Hooks,Storage & organization/Wall shelves & hooks/Hooks,"Storage & organization/Wall shelves & hooks/Hooks/BRANDUR Hook, in-","Storage & organization/Wall shelves & hooks/Hooks/BRANDUR Rail with 4 hooks, in-","Storage & organization/Wall shelves & hooks/Hooks/BRANDUR Hook, in-",Home Décor/Flower pots & stands/Indoor plant pots,Home Décor/Candle holders & candles/Lanterns,"Laundry & cleaning/Drying racks/MULIG Drying rack, indoor",Home Décor/Mirrors/Vanity mirrors,Home Décor/Mirrors/Vanity mirrors,Furniture/Tables & desks/Desks & computer desks/Desks for home,Home Décor/Decorative accessories,Home Décor/Wall décor/Picture & photo frames,Home Décor/Wall décor/Picture & photo frames,Home Décor/Wall décor/Picture & photo frames,Home Décor/Wall décor/Picture & photo frames,Lighting/Lamps & light fixtures/Table lamps,Cookware & tableware/Napkins & napkin holders/Napkin holders,Furniture/Tables & desks/Console tables & sofa tables,Furniture/Tables & desks/Accent tables/Coffee tables,Storage & organization/TV & media furniture/TV stands & benches,"Storage & organization/Display & storage cabinets/Buffet tables, sideboard buffets & buffet cabinets",Storage & organization/Display & storage cabinets/Display cabinets,"Storage & organization/Shelving units, bookcases & storage options/Bookcases/LIATORP Panel","Storage & organization/Shelving units, bookcases & storage options/Bookcases",Furniture/Tables & desks/Accent tables/End tables & side tables,Storage & organization/Storage containers/Bathroom accessories/Towel rails & towel holders,Kitchen & appliances/Kitchen islands & carts,Furniture/Tables & desks/Accent tables/Coffee tables,Storage & organization/Armoires & wardrobes/Children's wardrobes,Furniture/Tables & desks/Changing tables/SMÅGÖRA Changing table,Storage & organization/Storage containers/Bathroom accessories/Toilet roll holders & stands,"Home Textiles/Window treatments/Curtain rods & rails/Curtain wires, clips & hooks",Home Décor/Mirrors/Wall mirrors,Home Décor/Mirrors/Vanity mirrors,Home Décor/Mirrors/Wall mirrors,Bathroom/Bathroom vanities/Vanity cabinets without sink,Home Décor/Storage boxes & baskets/Baskets,Home Décor/Storage boxes & baskets/Baskets,Storage & organization/Storage containers/Bathroom accessories/Toilet brushes,Rugs/Rugs/Runners & small rugs,Furniture/Tables & desks/Desks & computer desks/Desks for home,Furniture/Tables & desks/Desks & computer desks/Desks for home,Home Décor/Wall décor/Picture & photo frames,Home Décor/Wall décor/Picture & photo frames,Home electronics/Speakers/Bluetooth speakers,Home Décor/Clocks/Alarm clocks,Bathroom/Bathroom storage/Bathroom shelving units,Furniture/Tables & desks/Nightstands,Home Décor/Wall décor/Picture & photo frames,Home Décor/Vases & bowls/Vases,Home Décor/Vases & bowls/Vases,Cookware & tableware/Dinnerware/Plates,Cookware & tableware/Coffee & tea/Mugs & cups,Cookware & tableware/Dinnerware/Side plates,Cookware & tableware/Dinnerware/Bowls,Storage & organization/Storage containers/Bathroom accessories/Toothbrush holders,Storage & organization/Storage containers/Bathroom accessories/Bathroom boxes & baskets,Storage & organization/Storage containers/Bathroom accessories/Soap dispensers & soap dishes,Storage & organization/Storage containers/Bathroom accessories/Bathroom boxes & baskets,Cookware & tableware/Coffee & tea/Mugs & cups,Cookware & tableware/Dinnerware/Dinnerware sets,Cookware & tableware/Coffee & tea/Mugs & cups,Storage & organization/Storage containers/Bathroom accessories/Toilet brushes,Storage & organization/Storage solution systems/BESTÅ storage system/BESTÅ all parts & accessories/BESTÅ doors & drawer fronts,Outdoor/Outdoor flooring,Outdoor/Outdoor flooring,Kitchen & appliances/Kitchen systems/SEKTION kitchen/SEKTION kitchen cabinets,Kitchen & appliances/Kitchen systems/SEKTION kitchen/SEKTION kitchen cabinets,Kitchen & appliances/Kitchen systems/SEKTION kitchen/SEKTION kitchen cabinets,Kitchen & appliances/Kitchen systems/SEKTION kitchen/SEKTION kitchen cabinets,Kitchen & appliances/Kitchen systems/SEKTION kitchen/SEKTION kitchen cabinets,Kitchen & appliances/Kitchen systems/SEKTION kitchen/SEKTION kitchen cabinets,Kitchen & appliances/Kitchen systems/SEKTION kitchen/SEKTION kitchen cabinets,Kitchen & appliances/Kitchen systems/SEKTION kitchen/SEKTION kitchen cabinets,Furniture/Beds/Kids' loft beds & bunk beds/Loft beds,Home Décor/Wall décor/Picture & photo frames,Home Décor/Wall décor/Picture & photo frames,Bathroom/Bathroom storage/Bathroom shelving units,Cookware & tableware/Napkins & napkin holders/Napkins,Storage & organization/Dressers & storage drawers/Chests of drawers,Storage & organization/Dressers & storage drawers/Chests of drawers,Storage & organization/Dressers & storage drawers/Chests of drawers,Storage & organization/Clothes organizers/Clothes racks & stands,Storage & organization/Clothes organizers/Clothes racks & stands,Storage & organization/Dressers & storage drawers/Chests of drawers,Home Décor/Clocks/Alarm clocks,Home Décor/Clocks/Alarm clocks,Home Décor/Wall décor/Picture & photo frames,Home Décor/Wall décor/Picture & photo frames
