Home Décor/Mirrors/Wall mirrors,Lighting/Decorative lighting/Decorative indoor lighting,Lighting/Lamps & light fixtures/Ceiling lights/Pendants lights,Lighting/Lamps & light fixtures/Wall lamps/Wall lamps,Storage & organization/Storage containers/Bathroom accessories/Soap dispensers & soap dishes,Home Décor/Clocks/Wall & table clocks,Gardening & plants/Plant stands & movers,Gardening & plants/Plant stands & movers,Home Décor/Mirrors/Round mirrors,Kitchen & appliances/Appliances/Range hoods & filters/Wall mounted range hoods,Home Décor/Mirrors/Vanity mirrors,Lighting/Lamps & light fixtures/Wall lamps/Wall spotlights,Cookware & tableware/Drinkware/Drinking accessories,Lighting/Lamps & light fixtures/Wall lamps/Wall spotlights,Lighting/Integrated lighting/Bookcase lighting,Home Décor/Mirrors/Vanity mirrors,Cookware & tableware/Serveware/Bowls,Home Décor/Candle holders & candles/Candle holders,Baby & kids/Kids/Toys & play/Role play,Baby & kids/Kids/Toys & play/Role play,Home Décor/Mirrors/Wall mirrors,Home Décor/Mirrors/Vanity mirrors,Cookware & tableware/Drinkware/Specialty glassware,Cookware & tableware/Knives & cutting boards/Kitchen knives,Kitchen & appliances/Kitchen faucets & sinks/Kitchen faucets,Cookware & tableware/Coffee & tea/Tea pots & accessories,Kitchen & appliances/Kitchen faucets & sinks/Kitchen faucets,Bathroom/Bathroom faucets/Faucets,Cookware & tableware/Coffee & tea/Tea pots & accessories,Home Décor/Flower pots & stands/Indoor plant pots,Cookware & tableware/Flatware/Kids cutlery,Cookware & tableware/Kitchen & cooking accessories/Kitchen utensils/Cooking preparation tools,Kitchen & appliances/Kitchen systems/SEKTION kitchen/SEKTION kitchen cabinets,Lighting/Lamps & light fixtures/Floor lamps,Home Décor/Decorative accessories,Home Décor/Decorative accessories,Home Décor/Decorative accessories,Home Décor/Decorative accessories,Cookware & tableware/Serveware/Serving dishes,Lighting/Integrated lighting/Bookcase lighting,Cookware & tableware/Knives & cutting boards/Kitchen knives,"Outdoor/Outdoor storage benches, boxes & cabinets",Home Textiles/Window treatments/Curtain rods & rails/Curtain rods,Cookware & tableware/Coffee & tea/Vacuum flasks,Cookware & tableware/Dishwashing accessories/Sink accessories,Kitchen & appliances/Kitchen faucets & sinks/Kitchen faucets,Cookware & tableware/Bakeware/Baking pans & molds,Home Textiles/Window treatments/Curtain rods & rails/Curtain rods,Home Textiles/Window treatments/Curtain rods & rails/Curtain rods,Home Textiles/Window treatments/Curtain rods & rails/Curtain rods,Home Textiles/Window treatments/Curtain rods & rails/Curtain rods,Home Textiles/Window treatments/Curtain rods & rails/Curtain rods,Home Textiles/Window treatments/Curtain rods & rails/Curtain rods,Home Textiles/Window treatments/Curtain rods & rails/Curtain rods,Cookware & tableware/Coffee & tea/Coffee makers & accessories,Home electronics/Cords & chargers/Batteries & battery chargers,Home electronics/Cords & chargers/Batteries & battery chargers,Home electronics/Cords & chargers/Batteries & battery chargers,Cookware & tableware/Coffee & tea/Coffee makers & accessories,Cookware & tableware/Flatware/Flatware,Home electronics/Speakers/Wi-Fi speakers,Home electronics/Speakers/Wi-Fi speakers,Lighting/Bathroom lighting/Bathroom vanity lights,Lighting/Bathroom lighting/Bathroom vanity lights,Lighting/Bathroom lighting/Bathroom vanity lights,Cookware & tableware/Knives & cutting boards/Kitchen knives,Cookware & tableware/Knives & cutting boards/Kitchen knives,Storage & organization/Storage containers/Bathroom accessories/Bathroom accessory sets,Cookware & tableware/Kitchen & cooking accessories/Kitchen utensils/Cooking preparation tools,Storage & organization/Storage containers/Food storage & organizing/Jars & tins,Cookware & tableware/Drinkware/Glasses,Home electronics/Cords & chargers/Cables & accessories,Cookware & tableware/Dinnerware/Deep plates/STRIMMIG Deep plate,Cookware & tableware/Dinnerware/Side plates,Cookware & tableware/Serveware/Serving dishes,Cookware & tableware/Dinnerware/Plates,Cookware & tableware/Dinnerware/Bowls,Cookware & tableware/Coffee & tea/Mugs & cups,Cookware & tableware/Dishwashing accessories/Dish drainers & drying racks,Home Décor/Clocks/Wall & table clocks/KLOCKIS Clock/thermometer,Home Décor/Decorative accessories,Cookware & tableware/Coffee & tea/Vacuum flasks,Lighting/Lamps & light fixtures/Table lamps,Lighting/Lamps & light fixtures/Table lamps,Cookware & tableware/Flatware/Flatware,Lighting/Lamps & light fixtures/Table lamps,Cookware & tableware/Flatware/Flatware,Home Décor/Mirrors/Wall mirrors,Baby & kids/Kids/Toys & play/Wooden toys,Cookware & tableware/Coffee & tea/Tea pots & accessories,Lighting/Lamps & light fixtures/Ceiling lights/Pendants lights,Cookware & tableware/Kitchen & cooking accessories/Kitchen utensils/Cooking preparation tools,Cookware & tableware/Kitchen & cooking accessories/Kitchen utensils/Cooking preparation tools,Cookware & tableware/Bakeware/Mixing bowls,Lighting/Decorative lighting/Decorative outdoor lighting,Lighting/Decorative lighting/Decorative outdoor lighting,Lighting/Decorative lighting/Decorative outdoor lighting,Lighting/Decorative lighting/Decorative outdoor lighting,Lighting/Decorative lighting/Decorative outdoor lighting,Lighting/Decorative lighting/Decorative outdoor lighting
Cookware & tableware/Coffee & tea/Mugs & cups,Home Décor/Mirrors/Wall mirrors,Home Décor/Mirrors/Wall mirrors,Home Décor/Mirrors/Wall mirrors,Home Décor/Clocks/Wall & table clocks,Home Décor/Clocks/Wall & table clocks,Home Décor/Clocks/Wall & table clocks,Home Décor/Clocks/Wall & table clocks,Home Décor/Clocks/Wall & table clocks,Storage & organization/Storage solution systems/PAX system/PAX doors without hinges,Storage & organization/Storage solution systems/PAX system/PAX doors without hinges,Storage & organization/Storage solution systems/PAX system/PAX doors without hinges,Storage & organization/Storage containers/Food storage & organizing/Spice & condiment stands,Storage & organization/Storage containers/Food storage & organizing/Food containers,Storage & organization/Storage containers/Food storage & organizing/Food containers,Storage & organization/Storage containers/Food storage & organizing/Food containers,Home Textiles/Window treatments/Curtain rods & rails/Curtain rods,Home Textiles/Window treatments/Curtain rods & rails/Curtain rods,Home electronics/Cords & chargers/Wireless charging & accessories,Home electronics/Cords & chargers/Wireless charging & accessories,Home electronics/Cords & chargers/Wireless charging & accessories,Bathroom/Bathroom textiles/Shower curtains,Bathroom/Bathroom textiles/Shower curtains,Bathroom/Bathroom textiles/Shower curtains,Outdoor/Grills,Home Textiles/Window treatments/Curtains & drapes/Light filtering curtains,Cookware & tableware/Dinnerware/Bowls,Cookware & tableware/Dinnerware/Bowls,Cookware & tableware/Drinkware/Pitchers & carafes,Cookware & tableware/Coffee & tea/Mugs & cups,Cookware & tableware/Dinnerware/Deep plates/VARDAGEN Deep plate,Cookware & tableware/Coffee & tea/Mugs & cups,Cookware & tableware/Drinkware/Specialty glassware,Cookware & tableware/Table linen/Table cloths & runners,Cookware & tableware/Serveware/Bowls,Cookware & tableware/Serveware/Serving dishes,Cookware & tableware/Dinnerware/Side plates,Cookware & tableware/Dinnerware/Plates,Home Décor/Clocks/Wall & table clocks,Cookware & tableware/Dishwashing accessories/Dish brushes,Storage & organization/Storage containers/Bathroom accessories/Toilet brushes,Storage & organization/Storage containers/Food storage & organizing/Spice & condiment stands,Outdoor/Grills,Outdoor/Grills,Storage & organization/Storage containers/Bathroom accessories/Towel rails & towel holders,Storage & organization/Storage containers/Bathroom accessories/Towel rails & towel holders,Storage & organization/Storage containers/Bathroom accessories/Towel rails & towel holders,Storage & organization/Storage containers/Food storage & organizing/Food containers,Baby & kids/Kids/Toys & play/Wooden toys,Cookware & tableware/Drinkware/Glasses,Home Décor/Flower pots & stands/Indoor plant pots,Home Textiles/Window treatments/Curtain rods & rails/Curtain rods,Cookware & tableware/Knives & cutting boards/Kitchen knives,Furniture/Tables & desks/Accent tables/Coffee tables,Cookware & tableware/Bakeware/Mixing bowls,Cookware & tableware/Dinnerware/Plates,Home Décor/Flower pots & stands/Indoor plant pots,Storage & organization/Storage solution systems/PAX system/PAX sliding doors,Storage & organization/Storage solution systems/PAX system/PAX sliding doors,Storage & organization/Storage solution systems/PAX system/PAX sliding doors,Lighting/Lamps & light fixtures/Kids lighting,Cookware & tableware/Knives & cutting boards/Kitchen knives,Lighting/Lamps & light fixtures/Kids lighting,Baby & kids/Kids/Toys & play/Role play,Home Décor/Mirrors/Wall mirrors,Home improvement/Home safety/Child safety,Home Décor/Mirrors/Wall mirrors,Storage & organization/Storage containers/Bathroom accessories/Bathroom accessory sets,Cookware & tableware/Table linen/Place mats & coasters,Cookware & tableware/Table linen/Place mats & coasters,Cookware & tableware/Table linen/Place mats & coasters,Cookware & tableware/Table linen/Place mats & coasters,Baby & kids/Baby/Baby toys/12+ months,Home Décor/Flower pots & stands/Indoor plant pots,Cookware & tableware/Drinkware/Pitchers & carafes,Bathroom/Bathroom storage/Bathroom storage/Bathroom tall cabinets,Furniture/Tables & desks/Accent tables/End tables & side tables,Furniture/Tables & desks/Accent tables/End tables & side tables,Furniture/Tables & desks/Accent tables/End tables & side tables,Cookware & tableware/Dinnerware/Deep plates/FÄRGKLAR Deep plate,Storage & organization/Storage containers/Food storage & organizing/Food containers,Cookware & tableware/Serveware/Trays,Cookware & tableware/Napkins & napkin holders/Napkins,Home improvement/Home safety/Home safety,Cookware & tableware/Dinnerware/Deep plates/OFTAST Deep plate,Cookware & tableware/Dinnerware/Plates,Cookware & tableware/Dinnerware/Bowls,Cookware & tableware/Serveware/Bowls,Cookware & tableware/Dinnerware/Side plates,Cookware & tableware/Dinnerware/Bowls,Cookware & tableware/Cookware & kitchenware/Cooking pans/Grill pans & griddles,Cookware & tableware/Cookware & kitchenware/Pots & pans/Casserole dishes,Cookware & tableware/Cookware & kitchenware/Pots & pans/Casserole dishes,Cookware & tableware/Cookware & kitchenware/Pots & pans/Cooking & stock pots,Baby & kids/Kids/Toys & play/Soft toys,Baby & kids/Kids/Toys & play/Soft toys,Baby & kids/Kids/Toys & play/Soft toys,Baby & kids/Kids/Toys & play/Soft toys,Baby & kids/Kids/Toys & play/Soft toys,Baby & kids/Kids/Toys & play/Soft toys
Storage & organization/Storage solution systems/PAX system/PAX sliding doors,Furniture/Tables & desks/Desks & computer desks/Desks for home,Home Décor/Mirrors/Wall mirrors,Home Décor/Mirrors/Vanity mirrors,Home Décor/Mirrors/Wall mirrors,Baby & kids/Kids/Toys & play/Physical play,Rugs/Rugs/Runners & small rugs,Rugs/Rugs/Runners & small rugs,Cookware & tableware/Dinnerware/Deep plates/VÄRDERA Deep plate,Home improvement/Home safety/Child safety,Home Décor/Wall décor/Picture & photo frames,Cookware & tableware/Knives & cutting boards/Cutting boards,Cookware & tableware/Knives & cutting boards/Cutting boards,Cookware & tableware/Knives & cutting boards/Cutting boards,Storage & organization/Wall shelves & hooks/Hooks,Furniture/Tables & desks/Nightstands,Cookware & tableware/Knives & cutting boards/Cutting boards,Home Textiles/Window treatments/Curtain rods & rails/Track systems,Home Décor/Wall décor/Collage picture frames,Storage & organization/Clothes organizers/Clothes racks & stands,Furniture/Patio furniture/Outdoor tables/Outdoor dining tables,Home Textiles/Window treatments/Curtain rods & rails/Curtain rods,Cookware & tableware/Dinnerware/Plates,Home Textiles/Window treatments/Curtain rods & rails/Curtain rods,Home Décor/Decorative accessories,Home Décor/Storage boxes & baskets/Kids boxes & baskets,Cookware & tableware/Dinnerware/Side plates,Storage & organization/Storage containers/Food storage & organizing/Food containers,Outdoor/Outdoor flooring,Outdoor/Outdoor flooring,Outdoor/Outdoor flooring,Home Décor/Storage boxes & baskets/Clothes boxes,Furniture/Patio furniture/Outdoor tables/Outdoor dining tables,Storage & organization/Storage solution systems/BESTÅ storage system/BESTÅ all parts & accessories,Furniture/Sofas & sectionals/Ottomans/Fabric ottomans,Storage & organization/Storage containers/Food storage & organizing/Food containers,Furniture/Tables & desks/Dining tables/Up to 10 seats,Home Décor/Wall décor/Picture & photo frames,Home Décor/Wall décor/Picture & photo frames,Home Décor/Wall décor/Picture & photo frames,Home Décor/Wall décor/Picture & photo frames,"Storage & organization/Display & storage cabinets/Buffet tables, sideboard buffets & buffet cabinets",Laundry & cleaning/Cleaning accessories,Kitchen & appliances/Kitchen systems/SEKTION kitchen/SEKTION kitchen cabinets,Kitchen & appliances/Kitchen systems/SEKTION kitchen/SEKTION kitchen cabinets,Kitchen & appliances/Kitchen systems/SEKTION kitchen/SEKTION kitchen cabinets,Kitchen & appliances/Kitchen systems/SEKTION kitchen/SEKTION kitchen cabinets,Kitchen & appliances/Kitchen systems/SEKTION kitchen/SEKTION kitchen cabinets,Home Textiles/Window treatments/Curtain rods & rails/Track systems,Home Textiles/Window treatments/Curtain rods & rails/Track systems,Home Textiles/Window treatments/Curtain rods & rails/Track systems,Home Textiles/Window treatments/Curtain rods & rails/Track systems,Kitchen & appliances/Kitchen countertops/Butcher block countertops,Kitchen & appliances/Kitchen islands & carts,Kitchen & appliances/Kitchen countertops/Butcher block countertops,Kitchen & appliances/Kitchen countertops/Butcher block countertops,Kitchen & appliances/Kitchen countertops/Butcher block countertops,Kitchen & appliances/Kitchen countertops/Butcher block countertops,Kitchen & appliances/Kitchen countertops/Butcher block countertops,Kitchen & appliances/Kitchen drawer organization/Kitchen trash cans & bins,Furniture/Tables & desks/Kids tables,Home improvement/Home safety/Child safety,Bathroom/Bathroom storage/Bathroom shelving units,"Storage & organization/Shelving units, bookcases & storage options/Shelf units & cube storage",Home Textiles/Window treatments/Curtain rods & rails/Track systems,Home Décor/Mirrors/Makeup & magnifying mirrors,Storage & organization/Armoires & wardrobes/Solitaire wardrobes,Furniture/Tables & desks/Desks & computer desks/Desks for home,Furniture/Tables & desks/Dining tables/Up to 6 seats,Home Décor/Storage boxes & baskets/Kids boxes & baskets,Home Décor/Storage boxes & baskets/Kids boxes & baskets,Furniture/Tables & desks/Accent tables/End tables & side tables,Furniture/Tables & desks/Accent tables/Coffee tables,Storage & organization/Storage containers/Bathroom accessories/Towel rails & towel holders,Home Décor/Wall décor/Picture & photo frames,Home Décor/Wall décor/Picture & photo frames,Storage & organization/Storage solution systems/BESTÅ storage system/BESTÅ all parts & accessories,Cookware & tableware/Dishwashing accessories/Dish brushes,Cookware & tableware/Cookware & kitchenware/Ovenware,Cookware & tableware/Cookware & kitchenware/Cooking accessories,Kitchen & appliances/Kitchen islands & carts,Home Décor/Wall décor/Art cards,Furniture/Room dividers,Storage & organization/Storage solution systems/PAX system/PAX sliding doors,Furniture/Tables & desks/Accent tables/Coffee tables,Laundry & cleaning/Cleaning accessories,Furniture/Tables & desks/Café tables,Furniture/Tables & desks/Bar tables,Furniture/Chairs/Dining chairs/Dining chairs,Home Textiles/Window treatments/Curtains & drapes/Panel curtains,Furniture/Patio furniture/Outdoor tables/Outdoor dining tables,Cookware & tableware/Dinnerware/Dinnerware sets,Furniture/Patio furniture/Outdoor tables/Outdoor coffee & side tables,Storage & organization/Dressers & storage drawers/Chests of drawers,Cookware & tableware/Dinnerware/Dinnerware sets,Home Décor/Storage boxes & baskets/Baskets,Outdoor/Umbrellas & gazebos/Patio umbrellas & bases,Cookware & tableware/Cookware & kitchenware/Cooking pans/Frying pans & skillets,Furniture/Chairs/Bar stools & chairs,Furniture/Chairs/Stools & benches/Stools
Home Décor/Storage boxes & baskets/Baskets,Home Décor/Storage boxes & baskets/Baskets,Storage & organization/Storage containers/Bins & bags/Bags,Cookware & tableware/Napkins & napkin holders/Napkin holders,Furniture/Kids furniture/Kids chairs,Furniture/Tables & desks/Dining tables/Up to 4 seats,Storage & organization/Dressers & storage drawers/Chests of drawers,Storage & organization/Dressers & storage drawers/Chests of drawers,Storage & organization/Dressers & storage drawers/Chests of drawers,Furniture/Tables & desks/Dining tables/Up to 4 seats,"Outdoor/Outdoor storage benches, boxes & cabinets",Furniture/Patio furniture/Outdoor tables/Outdoor dining tables,Furniture/Beds/Kids beds/Junior & extendable beds,Beds & mattresses/Mattress bases,Furniture/Beds/Kids beds/Junior & extendable beds,Storage & organization/Bags/Shopping bags & tote bags,Storage & organization/Bags/Shopping bags & tote bags,Rugs/Rugs/Runners & small rugs,Home Décor/Wall décor/Picture & photo frames,Home Décor/Wall décor/Picture & photo frames,"Outdoor/Umbrellas & gazebos/Shades, canopies & screens",Furniture/Armchairs & chaises/Leather/coated fabric chaises,Outdoor/Outdoor flooring,Kitchen & appliances/Kitchen systems/SEKTION kitchen/SEKTION kitchen cabinets,Kitchen & appliances/Kitchen systems/SEKTION kitchen/SEKTION kitchen cabinets,Kitchen & appliances/Kitchen systems/SEKTION kitchen/SEKTION kitchen cabinets,Kitchen & appliances/Kitchen systems/SEKTION kitchen/SEKTION kitchen cabinets,Home Décor/Wall décor/Picture & photo frames,Home Décor/Wall décor/Picture & photo frames,Home Décor/Wall décor/Picture & photo frames,Home Décor/Wall décor/Picture & photo frames,Cookware & tableware/Table linen/Place mats & coasters,Furniture/Beds/Cribs,Home Décor/Storage boxes & baskets/Baskets,Home Décor/Storage boxes & baskets/Baskets,Cookware & tableware/Serveware/Trays,Home Textiles/Window treatments/Curtains & drapes/Room darkening curtains & drapes,Home Textiles/Window treatments/Curtains & drapes/Room darkening curtains & drapes,Furniture/Chairs/Dining chairs/Upholstered chairs,Storage & organization/Storage containers/Bathroom accessories/Towel rails & towel holders,Beds & mattresses/Mattresses/Spring mattresses,Furniture/Kids furniture/Kids chairs,Storage & organization/Storage solution systems/BESTÅ storage system/BESTÅ all parts & accessories/BESTÅ doors & drawer fronts,Outdoor/Outdoor flooring,Outdoor/Outdoor flooring,Rugs/Rugs/Anti-slip pads & underlays,Rugs/Rugs/Anti-slip pads & underlays,Furniture/Tables & desks/Kids tables,Rugs/Rugs/Large & medium rugs,Rugs/Rugs/Runners & small rugs,Rugs/Rugs/Door mats,Kitchen & appliances/Kitchen systems/SEKTION kitchen/SEKTION kitchen cabinets,Furniture/Chairs/Chair pads,Furniture/Chairs/Chair pads,Furniture/Patio furniture/Outdoor tables/Outdoor dining tables,Storage & organization/Wall shelves & hooks/Hooks,Furniture/Patio furniture/Outdoor chairs/Outdoor dining chairs,Furniture/Patio furniture/Outdoor dining sets,Furniture/Patio furniture/Outdoor sofa sections,Furniture/Patio furniture/Outdoor sofa sections,Furniture/Patio furniture/Outdoor tables/Outdoor coffee & side tables,Furniture/Beds/Cribs,Furniture/Tables & desks/Kids tables,Furniture/Beds/Cribs,Furniture/Patio furniture/Outdoor sofa sections,Furniture/Patio furniture/Outdoor sofa sections,Furniture/Patio furniture/Outdoor sofa sections,"Baby & kids/Baby/Changing, bathing & potty/Potties & baby baths",Furniture/Beds/Kids beds/Bunk beds,Storage & organization/Storage containers/Bathroom accessories/Towel rails & towel holders,Beds & mattresses/Mattresses/Kids mattresses,Storage & organization/Storage containers/Bathroom accessories/Towel rails & towel holders,Storage & organization/Clothes organizers/Shoe cabinets,Storage & organization/Clothes organizers/Shoe cabinets,Storage & organization/Clothes organizers/Shoe cabinets,Storage & organization/Clothes organizers/Shoe cabinets,Storage & organization/Clothes organizers/Shoe racks & stands,Beds & mattresses/Mattresses/Kids mattresses,Storage & organization/Storage containers/Bathroom accessories/Towel rails & towel holders,Storage & organization/Storage containers/Bathroom accessories/Towel rails & towel holders,Storage & organization/Clothes organizers/Shoe racks & stands,Pet accessories/Cats,Pet accessories/Cats,Pet accessories/Cats,Furniture/Armchairs & chaises/Fabric armchairs,Home Décor/Mirrors/Wall mirrors,Home Décor/Mirrors/Wall mirrors,Home Décor/Storage boxes & baskets/Baskets,Home Décor/Storage boxes & baskets/Baskets,Furniture/Tables & desks/Accent tables/Coffee tables,Furniture/Tables & desks/Accent tables/Coffee tables,Furniture/Chairs/Dining chairs/Dining chairs,Home Décor/Storage boxes & baskets/Clothes boxes,Furniture/Patio furniture/Outdoor furniture covers,Home Décor/Storage boxes & baskets/Clothes boxes,Furniture/Armchairs & chaises/Fabric armchairs,Furniture/Kids furniture/Kids chairs,Furniture/Armchairs & chaises/Fabric armchairs,Furniture/Patio furniture/Outdoor sofa sections,Home Décor/Storage boxes & baskets/Baskets
