Cookware & tableware/Drinkware/Wine & champagne glasses,Cookware & tableware/Drinkware/Pitchers & carafes,Cookware & tableware/Drinkware/Wine & champagne glasses,Cookware & tableware/Drinkware/Glasses,Cookware & tableware/Drinkware/Glasses,Home Décor/Flower pots & stands/Indoor plant pots,Home Décor/Flower pots & stands/Indoor plant pots,Home Décor/Flower pots & stands/Indoor plant pots,Home Décor/Flower pots & stands/Indoor plant pots,Home Décor/Flower pots & stands/Indoor plant pots,Home Décor/Flower pots & stands/Indoor plant pots,Lighting/Lamps & light fixtures/Desk lamps,Home Décor/Flower pots & stands/Indoor plant pots,Home Décor/Flower pots & stands/Indoor plant pots,Kitchen & appliances/Kitchen faucets & sinks/Kitchen faucets,Home Décor/Flower pots & stands/Indoor plant pots,Home Décor/Flower pots & stands/Indoor plant pots,Home Décor/Flower pots & stands/Indoor plant pots,Home Décor/Flower pots & stands/Indoor plant pots,Home Décor/Candle holders & candles/Candle holders,Kitchen & appliances/Kitchen faucets & sinks/Kitchen faucets,Kitchen & appliances/Kitchen faucets & sinks/Kitchen faucets,Home Décor/Flower pots & stands/Indoor plant pots,Home Décor/Candle holders & candles/Candle holders,Lighting/Lamps & light fixtures/Ceiling lights/Pendants lights,Home Décor/Flower pots & stands/Indoor plant pots,Cookware & tableware/Dinnerware/Bowls,Home Décor/Candle holders & candles/Candle holders,Home Décor/Flower pots & stands/Indoor plant pots,Lighting/Smart lighting/Remote & smart light switches,Home Décor/Flower pots & stands/Indoor plant pots,Cookware & tableware/Serveware/Bowls,Home Décor/Flower pots & stands/Indoor plant pots,Lighting/Smart lighting/Smart lighting kits,Cookware & tableware/Flatware/Flatware,"Lighting/Lamps & light fixtures/Shades, bases & cords/Lamp bases & cords",Cookware & tableware/Drinkware/Pitchers & carafes,Lighting/LED Light bulbs,Bathroom/Bathroom faucets/Faucets,Kitchen & appliances/Kitchen faucets & sinks/Kitchen faucets,Lighting/LED Light bulbs,"Lighting/Lamps & light fixtures/Shades, bases & cords/Lamp bases & cords",Kitchen & appliances/Kitchen faucets & sinks/Kitchen faucets,"Lighting/Lamps & light fixtures/Shades, bases & cords/Lamp bases & cords",Cookware & tableware/Coffee & tea/Tea pots & accessories,Lighting/Lamps & light fixtures/Ceiling lights/Pendants lights,Lighting/Lamps & light fixtures/Ceiling lights/Pendants lights,Lighting/Lamps & light fixtures/Wall lamps/Wall lamps,Lighting/Lamps & light fixtures/Table lamps/SIMRISHAMN Table,Lighting/Lamps & light fixtures/Ceiling lights/Pendants lights,Lighting/Lamps & light fixtures/Table lamps,Furniture/Tables & desks/Accent tables/End tables & side tables,Furniture/Tables & desks/Accent tables/Coffee tables,Lighting/Lamps & light fixtures/LED lighting/LED lamps,Lighting/Lamps & light fixtures/Wall lamps/Wall lamps,Lighting/Lamps & light fixtures/Wall lamps/Wall lamps,Lighting/Bathroom lighting/Bathroom vanity lights,Cookware & tableware/Drinkware/Wine & champagne glasses,Kitchen & appliances/Kitchen faucets & sinks/Kitchen faucets,Lighting/LED Light bulbs,Lighting/LED Light bulbs,Cookware & tableware/Cookware & kitchenware/Cooking accessories,Cookware & tableware/Cookware & kitchenware/Cooking accessories,Cookware & tableware/Drinkware/Glasses,Gardening & plants/Watering cans,Home electronics/Cords & chargers/Batteries & battery chargers,Home electronics/Cords & chargers/Batteries & battery chargers,Lighting/LED Light bulbs,Lighting/Lamps & light fixtures/Wall lamps/Wall lamps,Cookware & tableware/Drinkware/Pitchers & carafes,Lighting/Lamps & light fixtures/Wall lamps/Wall lamps,Lighting/LED Light bulbs,Home Décor/Flower pots & stands/Self watering plant pots,Lighting/Bathroom lighting/Bathroom vanity lights,Lighting/Smart lighting/Smart lighting kits,Lighting/Integrated lighting/Bookcase lighting,Lighting/Integrated lighting/Bookcase lighting,Home electronics/Cords & chargers/Batteries & battery chargers,Lighting/Bathroom lighting/Bathroom vanity lights,Lighting/Smart lighting/Remote & smart light switches,Lighting/LED Light bulbs,Lighting/Lamps & light fixtures/Ceiling lights/Pendants lights,Lighting/Lamps & light fixtures/Ceiling lights/Ceiling lamps,Lighting/Integrated lighting/Bookcase lighting,Lighting/Decorative lighting/Decorative outdoor lighting/SKINA LED string light w,Lighting/Lamps & light fixtures/Table lamps,Storage & organization/Storage containers/Bathroom accessories/Towel rails & towel holders,Storage & organization/Storage containers/Bathroom accessories/Toothbrush holders,Lighting/Decorative lighting/Decorative indoor lighting,Lighting/Lamps & light fixtures/Desk lamps,Lighting/LED Light bulbs,"Lighting/Lamps & light fixtures/Shades, bases & cords/Lamp bases & cords",Storage & organization/Storage containers/Bathroom accessories/Soap dispensers & soap dishes,"Lighting/Lamps & light fixtures/Shades, bases & cords/Lamp bases & cords",Cookware & tableware/Drinkware/Glasses,Storage & organization/Storage containers/Bathroom accessories/Shower accessories,Kitchen & appliances/Kitchen faucets & sinks/Kitchen faucets,Kitchen & appliances/Appliances/Range hoods & filters/Wall mounted range hoods,Lighting/Lamps & light fixtures/Wall lamps/Wall lamps,Kitchen & appliances/Kitchen faucets & sinks/Kitchen faucets
Home Textiles/Window treatments/Curtain rods & rails/Curtain rods,Cookware & tableware/Bakeware/Mixing bowls,Lighting/Decorative lighting/Decorative outdoor lighting,Lighting/Decorative lighting/Decorative outdoor lighting,Lighting/Decorative lighting/Decorative outdoor lighting,Home Décor/Flower pots & stands/Indoor plant pots,Cookware & tableware/Serveware/Bowls,Cookware & tableware/Drinkware/Glasses,Home Textiles/Window treatments/Curtain rods & rails/Curtain rods,Home Textiles/Window treatments/Curtain rods & rails/Curtain rods,Home Textiles/Window treatments/Curtain rods & rails/Curtain rods,Home Textiles/Window treatments/Curtain rods & rails/Curtain rods,Home Textiles/Window treatments/Curtain rods & rails/Curtain rods,Home Textiles/Window treatments/Curtain rods & rails/Curtain rods,Home electronics/Cords & chargers/Batteries & battery chargers,Lighting/Decorative lighting/Decorative outdoor lighting,Cookware & tableware/Flatware/Flatware,Home electronics/Cords & chargers/Batteries & battery chargers,Home Décor/Flower pots & stands/Indoor plant pots,Storage & organization/Storage containers/Paper & media organizers/Desk accessories,Gardening & plants/Watering cans,Home Décor/Mirrors/Wall mirrors,Home Décor/Candle holders & candles/Candle holders,Cookware & tableware/Serveware/Trays,Lighting/Lamps & light fixtures/Floor lamps,Lighting/Lamps & light fixtures/Ceiling lights/Pendants lights,Kitchen & appliances/Kitchen systems/SEKTION kitchen/SEKTION kitchen cabinets,Gardening & plants/Watering cans,Gardening & plants/Watering cans,Cookware & tableware/Dishwashing accessories/Dish brushes,"Lighting/Lamps & light fixtures/Shades, bases & cords/Lamp bases & cords",Home electronics/Cords & chargers/Batteries & battery chargers,Cookware & tableware/Dinnerware/Bowls,"Lighting/Lamps & light fixtures/Shades, bases & cords/Lamp bases & cords",Lighting/Decorative lighting/Decorative outdoor lighting,Home electronics/Speakers/Wi-Fi speakers,Lighting/Decorative lighting/Decorative outdoor lighting,Lighting/Lamps & light fixtures/Table lamps,Lighting/Lamps & light fixtures/Table lamps,Lighting/Decorative lighting/Decorative outdoor lighting,Lighting/Decorative lighting/Decorative outdoor lighting,Cookware & tableware/Dinnerware/Side plates,Lighting/Decorative lighting/Decorative outdoor lighting,Lighting/Decorative lighting/Decorative outdoor lighting,Baby & kids/Kids/Toys & play/Wooden toys,Home Décor/Mirrors/Wall mirrors,Lighting/Decorative lighting/Decorative outdoor lighting,Cookware & tableware/Dinnerware/Deep plates/BESEGRA Deep plate,Lighting/Decorative lighting/Decorative outdoor lighting,Lighting/Decorative lighting/Decorative outdoor lighting,Lighting/Decorative lighting/Decorative outdoor lighting,Lighting/Decorative lighting/Decorative outdoor lighting,Home Décor/Wall décor/Picture & photo frames,Lighting/Decorative lighting/Decorative outdoor lighting,Home electronics/Speakers/Wi-Fi speakers,Lighting/Decorative lighting/Decorative outdoor lighting,Lighting/Decorative lighting/Decorative outdoor lighting,Lighting/Decorative lighting/Decorative outdoor lighting,Lighting/Decorative lighting/Decorative outdoor lighting,Cookware & tableware/Dinnerware/Plates,Lighting/Decorative lighting/Decorative outdoor lighting,Lighting/Decorative lighting/Decorative outdoor lighting,"Outdoor/Outdoor storage benches, boxes & cabinets",Cookware & tableware/Kitchen & cooking accessories/Kitchen utensils/Colanders & strainers,Lighting/Lamps & light fixtures/Kids lighting,Home Décor/Flower pots & stands/Indoor plant pots,Storage & organization/Storage containers/Bathroom accessories/Bathroom accessory sets,Cookware & tableware/Dishwashing accessories/Sink accessories,Cookware & tableware/Coffee & tea/Vacuum flasks,Kitchen & appliances/Kitchen faucets & sinks/Kitchen faucets,Home electronics/Cords & chargers/USB chargers,Cookware & tableware/Serveware/Trays,Home electronics/Cords & chargers/Cables & accessories,Lighting/Lamps & light fixtures/Kids lighting,Lighting/Lamps & light fixtures/Floor lamps/TÅGARP Floor uplt,Storage & organization/Storage containers/Food storage & organizing/Food containers,Home Décor/Clocks/Wall & table clocks,Cookware & tableware/Drinkware/Specialty glassware,Cookware & tableware/Flatware/Flatware,Home Décor/Mirrors/Vanity mirrors,Cookware & tableware/Coffee & tea/Vacuum flasks,Kitchen & appliances/Appliances/Range hoods & filters/Wall mounted range hoods,Cookware & tableware/Flatware/Flatware,Gardening & plants/Plant stands & movers,Lighting/Integrated lighting/Bookcase lighting,Cookware & tableware/Drinkware/Drinking accessories,Lighting/Lamps & light fixtures/Floor lamps,Cookware & tableware/Kitchen & cooking accessories/Kitchen utensils/Cooking preparation tools,Cookware & tableware/Flatware/Flatware,Lighting/Lamps & light fixtures/Ceiling lights/Pendants lights,Lighting/Lamps & light fixtures/Ceiling lights/Pendants lights,Cookware & tableware/Kitchen & cooking accessories/Kitchen utensils/Colanders & strainers,Cookware & tableware/Kitchen & cooking accessories/Kitchen utensils/Colanders & strainers,Storage & organization/Storage containers/Bathroom accessories/Shower accessories,Storage & organization/Storage containers/Bathroom accessories/Soap dispensers & soap dishes,Furniture/Kids furniture/Kids chairs,Home electronics/Cords & chargers/USB chargers,Outdoor/Grills,Cookware & tableware/Knives & cutting boards/Kitchen knives,Storage & organization/Storage containers/Bathroom accessories/Towel rails & towel holders
Lighting/Decorative lighting/Decorative outdoor lighting,Kitchen & appliances/Appliances/Range hoods & filters/Filters,Kitchen & appliances/Appliances/Range hoods & filters/Filters,Kitchen & appliances/Appliances/Range hoods & filters/Filters,Kitchen & appliances/Appliances/Range hoods & filters/Filters,Home Textiles/Window treatments/Curtain rods & rails/Track systems,Cookware & tableware/Coffee & tea/Mugs & cups,Storage & organization/Storage solution systems/PAX system/Knobs & handles,Home Décor/Flower pots & stands/Indoor plant pots,Cookware & tableware/Serveware/Serving dishes,Storage & organization/Storage solution systems/BESTÅ storage system/BESTÅ all parts & accessories,Kitchen & appliances/Kitchen drawer organization/Drawer dividers,Cookware & tableware/Table linen/Table cloths & runners,Cookware & tableware/Dinnerware/Bowls,Cookware & tableware/Dinnerware/Deep plates/BESEGRA Deep plate,Cookware & tableware/Dinnerware/Plates,Cookware & tableware/Dinnerware/Side plates,Cookware & tableware/Serveware/Serving dishes,Cookware & tableware/Serveware/Bowls,Cookware & tableware/Dinnerware/Plates,Cookware & tableware/Coffee & tea/Mugs & cups,Laundry & cleaning/Cleaning accessories,Kitchen & appliances/Appliances/Range hoods & filters/Filters,Kitchen & appliances/Appliances/Range hoods & filters/Filters,Home electronics/Speakers/Wi-Fi speakers,Home electronics/Speakers/Wi-Fi speakers,Lighting/Decorative lighting/Decorative outdoor lighting,Lighting/Decorative lighting/Decorative outdoor lighting,Lighting/Decorative lighting/Decorative outdoor lighting,Bathroom/Bathroom textiles/Shower curtains,Lighting/Decorative lighting/Decorative outdoor lighting,Lighting/Decorative lighting/Decorative outdoor lighting,Cookware & tableware/Drinkware/Drinking accessories,Home Décor/Wall décor/Picture & photo frames,Home Décor/Wall décor/Picture & photo frames,Home Décor/Flower pots & stands/Indoor plant pots,Home Décor/Wall décor/Picture & photo frames,Baby & kids/Kids/Kids decoration & accessories,"Baby & kids/Baby/Nursing, feeding & eating/SMÅGLI Plate",Kitchen & appliances/Kitchen systems/SEKTION kitchen/SEKTION kitchen cabinets,Kitchen & appliances/Kitchen systems/SEKTION kitchen/SEKTION kitchen cabinets,Home electronics/Cords & chargers/USB chargers,Cookware & tableware/Drinkware/Glasses,Home electronics/Cords & chargers/Wireless charging & accessories,Home electronics/Cords & chargers/Wireless charging & accessories,Home electronics/Cords & chargers/Wireless charging & accessories,Cookware & tableware/Serveware/Serving dishes,Home electronics/Speakers/Wi-Fi speakers,Home Décor/Wall décor/Picture & photo frames,Cookware & tableware/Dinnerware/Side plates,Cookware & tableware/Drinkware/Specialty glassware,Cookware & tableware/Dinnerware/Bowls,Storage & organization/Storage containers/Bathroom accessories/Towel rails & towel holders,Storage & organization/Storage containers/Bins & bags/Trash cans & pedal bins,Storage & organization/Storage containers/Bathroom accessories/Toilet brushes,Storage & organization/Storage containers/Bathroom accessories/Shower accessories,Cookware & tableware/Drinkware/Pitchers & carafes,Storage & organization/Storage containers/Bathroom accessories/Towel rails & towel holders,Baby & kids/Kids/Toys & play/Wooden toys,Home Décor/Wall décor/Picture & photo frames,Storage & organization/Storage containers/Bathroom accessories/Bathroom boxes & baskets,Cookware & tableware/Dishwashing accessories/Dish brushes,Home Décor/Wall décor/Picture & photo frames,Storage & organization/Storage containers/Bathroom accessories/Bathroom accessory sets,Home Textiles/Window treatments/Curtain rods & rails/Curtain rods,Cookware & tableware/Napkins & napkin holders/Napkins,Cookware & tableware/Serveware/Trays,Home Décor/Mirrors/Wall mirrors,Furniture/Kids furniture/Toy storage,Furniture/Kids furniture/Toy storage,Storage & organization/Storage containers/Bathroom accessories/Bathroom shelves,Storage & organization/Storage containers/Food storage & organizing/Food containers,Storage & organization/Storage containers/Food storage & organizing/Spice & condiment stands,Bathroom/Bathroom textiles/Shower curtains,Bathroom/Bathroom faucets/Water traps & strainers,Lighting/Decorative lighting/Decorative outdoor lighting,Home electronics/Cords & chargers/Batteries & battery chargers,Storage & organization/Storage containers/Bathroom accessories/Towel rails & towel holders,Cookware & tableware/Dinnerware/Deep plates/VARDAGEN Deep plate,Cookware & tableware/Coffee & tea/Mugs & cups,Cookware & tableware/Dinnerware/Bowls,Cookware & tableware/Dinnerware/Deep plates/OFTAST Deep plate,Cookware & tableware/Dinnerware/Plates,Cookware & tableware/Drinkware/Pitchers & carafes,Cookware & tableware/Dinnerware/Bowls,Cookware & tableware/Serveware/Bowls,Cookware & tableware/Dinnerware/Side plates,Cookware & tableware/Dinnerware/Bowls,Home Décor/Wall décor/Picture & photo frames,Bathroom/Bathroom textiles/Shower curtains,Storage & organization/Storage containers/Bathroom accessories/Shower accessories,Storage & organization/Storage containers/Bathroom accessories/Shower accessories,Bathroom/Showers/Shower sets & rails,Storage & organization/Storage containers/Bathroom accessories/Towel rails & towel holders,Storage & organization/Storage containers/Bathroom accessories/Soap dispensers & soap dishes,Home Décor/Flower pots & stands/Indoor plant pots,Storage & organization/Storage containers/Bathroom accessories/Toilet roll holders & stands,Kitchen & appliances/Kitchen islands & carts,Storage & organization/Storage containers/Bathroom accessories/Toothbrush holders,Kitchen & appliances/Kitchen islands & carts
Furniture/Room dividers,Storage & organization/Storage solution systems/PAX system/PAX sliding doors,Storage & organization/Storage solution systems/PAX system/PAX doors without hinges,Storage & organization/Storage solution systems/PAX system/PAX doors without hinges,Home Textiles/Window treatments/Curtain rods & rails/Curtain rods,Storage & organization/Storage solution systems/BESTÅ storage system/BESTÅ all parts & accessories,Home Textiles/Window treatments/Curtains & drapes/Panel curtains,Home Décor/Wall décor/Wall decals & stickers,Storage & organization/Storage solution systems/PAX system/PAX doors without hinges,Storage & organization/Storage solution systems/PAX system/PAX doors without hinges,"Storage & organization/Shelving units, bookcases & storage options/Shelf units & cube storage",Home Textiles/Window treatments/Curtains & drapes/Light filtering curtains,Furniture/Tables & desks/Desks & computer desks/Desks for home,Bathroom/Bathroom storage/Bathroom shelving units,Storage & organization/Armoires & wardrobes/Solitaire wardrobes,Kitchen & appliances/Kitchen systems/SEKTION kitchen/SEKTION kitchen cabinets,Kitchen & appliances/Kitchen systems/SEKTION kitchen/SEKTION kitchen cabinets,Home Décor/Wall décor/Picture & photo frames,Storage & organization/Storage solution systems/PAX system/PAX sliding doors,Storage & organization/Storage solution systems/BESTÅ storage system/BESTÅ all parts & accessories,Furniture/Tables & desks/Makeup vanities & dressing tables,Storage & organization/Clothes organizers/Clothes racks & stands,Storage & organization/Storage solution systems/PAX system/PAX doors without hinges,Kitchen & appliances/Kitchen systems/SEKTION kitchen/SEKTION kitchen cabinets/Cabinet doors & drawer fronts,Kitchen & appliances/Kitchen systems/SEKTION kitchen/SEKTION kitchen cabinets,Kitchen & appliances/Kitchen systems/SEKTION kitchen/SEKTION kitchen cabinets,Home Textiles/Window treatments/Curtains & drapes/Room darkening curtains & drapes,Home Décor/Mirrors/Makeup & magnifying mirrors,Outdoor/Outdoor flooring,Outdoor/Outdoor flooring,Outdoor/Outdoor flooring,Furniture/Chairs/Stools & benches/Stools,Storage & organization/Storage containers/Paper & media organizers/Desk accessories,Storage & organization/Storage solution systems/PAX system/PAX doors without hinges,Furniture/Chairs/Bar stools & chairs,Storage & organization/Storage solution systems/PAX system/PAX doors without hinges,Furniture/Patio furniture/Outdoor tables/Outdoor dining tables,Furniture/Tables & desks/Desks & computer desks/Desks for home,Storage & organization/Storage solution systems/PAX system/PAX doors without hinges,"Storage & organization/Shelving units, bookcases & storage options/Shelf units & cube storage",Home Décor/Noticeboards,Home Décor/Noticeboards,Rugs/Rugs/Runners & small rugs,Furniture/Chairs/Stools & benches/Stools,Storage & organization/Storage containers/Bathroom accessories/Towel rails & towel holders,Storage & organization/Storage containers/Bathroom accessories/Towel rails & towel holders,Storage & organization/Storage containers/Bathroom accessories/Toilet roll holders & stands,Storage & organization/Storage containers/Bathroom accessories/Towel rails & towel holders,Storage & organization/Dressers & storage drawers/Drawer units/Drawer units for home,Storage & organization/Storage containers/Bathroom accessories/Bathroom boxes & baskets,Home Décor/Wall décor/Collage picture frames,Storage & organization/Storage containers/Bathroom accessories/Toilet brushes,Home Décor/Wall décor/Art cards,Home Décor/Storage boxes & baskets/Clothes boxes,Furniture/Patio furniture/Outdoor chairs/Outdoor dining chairs,Kitchen & appliances/Kitchen countertops/Laminate countertops,Home Textiles/Window treatments/Curtain rods & rails/Curtain rods,Kitchen & appliances/Kitchen systems/SEKTION kitchen/SEKTION kitchen cabinets,Furniture/Patio furniture/Outdoor tables/Outdoor dining tables,Home Décor/Noticeboards,Furniture/Tables & desks/Nightstands,Cookware & tableware/Cookware & kitchenware/Ovenware,Storage & organization/Clothes organizers/Shoe racks & stands,Home Décor/Wall décor/Picture & photo frames,"Storage & organization/Display & storage cabinets/Buffet tables, sideboard buffets & buffet cabinets",Home Décor/Wall décor/Picture & photo frames,Baby & kids/Kids/Toys & play/Role play,Furniture/Kids furniture/Kids chairs,Storage & organization/Storage solution systems/BESTÅ storage system/BESTÅ all parts & accessories,Furniture/Armchairs & chaises/Fabric armchairs,Furniture/Armchairs & chaises/Fabric armchairs,Furniture/Chairs/Dining chairs/Dining chairs,Furniture/Tables & desks/Dining tables/Up to 4 seats,Cookware & tableware/Serveware/Trays,Cookware & tableware/Table linen/Table cloths & runners,Cookware & tableware/Table linen/Table cloths & runners,Furniture/Beds/Under bed storage/FREDVANG Underbed storage,Storage & organization/Storage containers/Food storage & organizing/Food containers,Storage & organization/Storage solution systems/BESTÅ storage system/BESTÅ all parts & accessories,Home Décor/Noticeboards,Kitchen & appliances/Kitchen countertops/Laminate countertops,Storage & organization/Dressers & storage drawers/Drawer units/Drawer units for home,Home Décor/Noticeboards,Furniture/Patio furniture/Outdoor chairs/Outdoor dining chairs,Furniture/Patio furniture/Outdoor tables/Outdoor dining tables,Cookware & tableware/Dinnerware/Plates,Storage & organization/Bags/Bag organizers,Cookware & tableware/Dinnerware/Side plates,Furniture/Tables & desks/Accent tables/Coffee tables,Cookware & tableware/Dinnerware/Plates,Cookware & tableware/Dinnerware/Side plates,Home Décor/Mirrors/Wall mirrors,Storage & organization/Dressers & storage drawers/Chests of drawers,Storage & organization/Storage containers/Bathroom accessories/Towel rails & towel holders,Home Décor/Storage boxes & baskets/Secondary storage boxes,Furniture/Chairs/Dining chairs/Dining chairs,Kitchen & appliances/Kitchen systems/SEKTION kitchen/SEKTION kitchen cabinets,Rugs/Rugs/Runners & small rugs,Storage & organization/Storage containers/Paper & media organizers/Magazine files,Baby & kids/Kids/Kids decoration & accessories
