Beds & mattresses/Bedding/Blankets & throws,Beds & mattresses/Bedding/Bedlinen/Duvet cover sets,Beds & mattresses/Bedding/Pillows/Polyester pillows,Storage & organization/Bags/Shopping bags & tote bags,Baby & kids/Baby/Baby textiles/Nursery rugs,Rugs/Bath mats,Bathroom/Bathroom textiles/Towels/Bath sheets,Bathroom/Bathroom textiles/Towels/Hand towels,Bathroom/Bathroom textiles/Towels/Wash cloths,Furniture/Armchairs & chaises/Rattan armchairs,Furniture/Armchairs & chaises/Rattan armchairs,Furniture/Sofas & sectionals/Sofa & armchairs covers/HÄRLANDA covers,Furniture/Sofas & sectionals/Sofa & armchairs covers/HÄRLANDA covers,Furniture/Sofas & sectionals/Sofa & armchairs covers/HÄRLANDA covers,Furniture/Sofas & sectionals/Sofa & armchairs covers/HÄRLANDA covers,Furniture/Sofas & sectionals/Fabric sofas/Modular fabric sofas,Furniture/Tables & desks/Changing tables,Beds & mattresses/Bedding/Cushions & cushions covers/Children's cushions & blankets,"Outdoor/Outdoor cushions/Outdoor pillows/FUNKÖN Back cushion, indoor","Outdoor/Outdoor cushions/Outdoor pillows/FUNKÖN Cushion cover, in",Baby & kids/Kids/Toys & play/Soft toys,Beds & mattresses/Bedding/Blankets & throws,Cookware & tableware/Napkins & napkin holders/Napkins,Rugs/Rugs/Runners & small rugs,Rugs/Rugs/Door mats,Baby & kids/Baby/Baby textiles/Nursery rugs,Beds & mattresses/Bedding/Cushions & cushions covers/Cushions,Beds & mattresses/Bedding/Cushions & cushions covers/Cushion covers,Beds & mattresses/Bedding/Cushions & cushions covers/Cushion covers,Beds & mattresses/Mattresses/Mattress toppers,Beds & mattresses/Mattresses/Crib mattresses,Beds & mattresses/Mattresses/Crib mattresses,Beds & mattresses/Mattresses/Crib mattresses,Beds & mattresses/Mattresses/Crib mattresses,Rugs/Rugs/Large & medium rugs,Furniture/Armchairs & chaises/Kids armchairs,Rugs/Rugs/Door mats,Furniture/Sofas & sectionals/Sofa & armchairs covers/POÄNG,Furniture/Sofas & sectionals/Sofa & armchairs covers/POÄNG,Rugs/Bath mats,Beds & mattresses/Bedding/Cushions & cushions covers/Cushions,Baby & kids/Baby/Baby textiles/Baby towels & washcloths,Furniture/Patio furniture/Outdoor seat cushions,Furniture/Patio furniture/Outdoor seat cushions,Bathroom/Bathroom textiles/Towels/Bath towels,Bathroom/Bathroom textiles/Towels/Hand towels,Cookware & tableware/Table linen/Table cloths & runners,Beds & mattresses/Bedding/Cushions & cushions covers/Cushion covers,Baby & kids/Kids/Toys & play/Soft toys,Rugs/Rugs/Round rugs,Beds & mattresses/Bedding/Blankets & throws/FÄLTMAL Pillow,Beds & mattresses/Bedding/Cushions & cushions covers/Cushion covers,Beds & mattresses/Bedding/Blankets & throws,Furniture/Patio furniture/Outdoor lounge furniture,Furniture/Sofas & sectionals/Sofa & armchairs covers/FLOTTEBO covers,Beds & mattresses/Bedding/Cushions & cushions covers/Cushion covers,Beds & mattresses/Bedding/Cushions & cushions covers/Cushion covers,Rugs/Rugs/Large & medium rugs,Beds & mattresses/Mattresses/Kids mattresses,Beds & mattresses/Bedding/Blankets & throws,Rugs/Rugs/Runners & small rugs,Beds & mattresses/Bedding/Comforters/Polyester comforters,Beds & mattresses/Bedding/Comforters/Polyester comforters,Rugs/Rugs/Door mats,Beds & mattresses/Bedding/Bedlinen/Duvet cover sets,Furniture/Patio furniture/Outdoor seat cushions,Rugs/Rugs/Large & medium rugs,Furniture/Sofas & sectionals/Sofa & armchairs covers/POÄNG,Rugs/Rugs/Door mats,Beds & mattresses/Bedding/Pillows/Down & feather pillows,Beds & mattresses/Bedding/Pillows/Down & feather pillows,Storage & organization/Storage containers/Bins & bags/Bags,Baby & kids/Baby/Baby textiles/Baby quilts & pillows,Furniture/Sofas & sectionals/Sofa & armchairs covers/FÄRLÖV covers,Beds & mattresses/Bedding/Cushions & cushions covers/Cushions,Furniture/Armchairs & chaises/Fabric armchairs,Rugs/Rugs/Large & medium rugs,Beds & mattresses/Bedding/Bedspreads,Laundry & cleaning/Cleaning accessories,Beds & mattresses/Bedding/Cushions & cushions covers/Children's cushions & blankets,Beds & mattresses/Bedding/Cushions & cushions covers/Children's cushions & blankets,Rugs/Rugs/Large & medium rugs,Cookware & tableware/Kitchen textiles/Pot holders & oven mitts,Cookware & tableware/Kitchen textiles/Pot holders & oven mitts,Cookware & tableware/Kitchen textiles/Pot holders & oven mitts,"Rugs/Rugs/Large & medium rugs/SVALLERUP Rug flatwoven, in",Beds & mattresses/Bedding/Cushions & cushions covers/Children's cushions & blankets,Rugs/Rugs/Large & medium rugs,Rugs/Rugs/Large & medium rugs,Rugs/Rugs/Door mats,Beds & mattresses/Bedding/Cushions & cushions covers/Cushion covers,"Beds & mattresses/Mattresses/Foam, memory foam & latex mattresses",Rugs/Rugs/Large & medium rugs,Rugs/Rugs/Large & medium rugs,Rugs/Rugs/Large & medium rugs,Rugs/Rugs/Large & medium rugs,Rugs/Rugs/Large & medium rugs,Rugs/Rugs/Large & medium rugs,Storage & organization/Storage containers/Bins & bags/Bags,"Rugs/Rugs/Large & medium rugs/VRENSTED Rug flatwoven, in"
Storage & organization/Storage solution systems/AURDAL system/AURDAL parts,Storage & organization/Storage solution systems/AURDAL system/AURDAL parts,Storage & organization/Storage solution systems/AURDAL system/AURDAL parts,Storage & organization/Storage solution systems/AURDAL system/AURDAL parts,Storage & organization/Storage solution systems/AURDAL system/AURDAL parts,Storage & organization/Storage solution systems/AURDAL system/AURDAL parts,Storage & organization/Storage solution systems/AURDAL system/AURDAL parts,Storage & organization/Storage solution systems/AURDAL system/AURDAL parts,Storage & organization/Storage solution systems/AURDAL system/AURDAL parts,Storage & organization/Storage solution systems/AURDAL system/AURDAL parts,Storage & organization/Storage solution systems/AURDAL system/AURDAL parts,Storage & organization/Storage solution systems/AURDAL system/AURDAL parts,Furniture/Tables & desks/Desks & computer desks/Desks for home,Storage & organization/Storage containers/Bins & bags/Trash cans & pedal bins,Home Décor/Storage boxes & baskets/Secondary storage boxes,"Storage & organization/Shelving units, bookcases & storage options/Storage shelves & units",Storage & organization/Clothes organizers/Shoe cabinets,Storage & organization/Clothes organizers/Shoe cabinets,Storage & organization/Clothes organizers/Shoe cabinets,Storage & organization/Clothes organizers/Shoe cabinets,Storage & organization/Clothes organizers/Shoe cabinets,Storage & organization/Clothes organizers/Shoe cabinets,Storage & organization/Clothes organizers/Shoe cabinets,Home Décor/Mirrors/Wall mirrors,Home Décor/Mirrors/Wall mirrors,Home Décor/Mirrors/Wall mirrors,Home electronics/Speakers/Bluetooth speakers,Bathroom/Bathroom storage/Bathroom shelving units,Storage & organization/Storage containers/Bathroom accessories/Bathroom shelves,Kitchen & appliances/Kitchen islands & carts,Storage & organization/Storage solution systems/BESTÅ storage system/BESTÅ all parts & accessories,Storage & organization/Storage containers/Bins & bags/Trash cans & pedal bins,Home electronics/Cords & chargers/Wireless charging & accessories,"Storage & organization/Shelving units, bookcases & storage options/Bookcases","Storage & organization/Shelving units, bookcases & storage options/Shelf units & cube storage","Storage & organization/Shelving units, bookcases & storage options/Cube storage","Storage & organization/Shelving units, bookcases & storage options/Cube storage",Furniture/Kids furniture/Toy storage,Cookware & tableware/Knives & cutting boards/Cutting boards,Home Décor/Storage boxes & baskets/Paper & media boxes,Storage & organization/Display & storage cabinets/Dining room cabinets & cupboards,Bathroom/Bathroom vanities/Vanity cabinets with sink,Bathroom/Bathroom vanities/Vanity cabinets with sink,Storage & organization/Wall shelves/Complete wall shelves,Home electronics/Speakers/Bluetooth speakers,Home electronics/Speakers/Bluetooth speakers,Home electronics/Speakers/Bluetooth speakers,Home electronics/Speakers/Bluetooth speakers,Home electronics/Cords & chargers/Wireless charging & accessories,Home electronics/Cords & chargers/Wireless charging & accessories,Home electronics/Cords & chargers/Wireless charging & accessories,Home Décor/Storage boxes & baskets/Secondary storage boxes,Home Décor/Storage boxes & baskets/Secondary storage boxes,Storage & organization/Storage containers/Food storage & organizing/Cooler bags,"Storage & organization/Shelving units, bookcases & storage options/Storage shelves & units","Storage & organization/Shelving units, bookcases & storage options/Storage shelves & units",Storage & organization/Storage containers/Food storage & organizing/Food containers,Home Décor/Storage boxes & baskets/Kids boxes & baskets,"Storage & organization/Shelving units, bookcases & storage options/Shelf units & cube storage",Furniture/Tables & desks/Desks & computer desks/Desks for home,Furniture/Tables & desks/Dining tables/Up to 4 seats,Storage & organization/Storage containers/Food storage & organizing/Food containers,Furniture/Tables & desks/Kids tables,Home Décor/Storage boxes & baskets/Kids boxes & baskets,Home Décor/Storage boxes & baskets/Kids boxes & baskets,Home Décor/Storage boxes & baskets/Kids boxes & baskets,Storage & organization/Storage containers/Bathroom accessories/Bathroom boxes & baskets,Furniture/Tables & desks/Bar tables,"Storage & organization/Shelving units, bookcases & storage options/Bookcases",Storage & organization/Display & storage cabinets/Display cabinets,Furniture/Tables & desks/Dining tables/Up to 4 seats,Home Décor/Vases & bowls/Vases,Home Décor/Vases & bowls/Vases/CYLINDER Vase,Baby & kids/Kids/Toys & play/Arts & crafts,Storage & organization/Storage containers/Bathroom accessories/Towel rails & towel holders,Home electronics/Cords & chargers/Wireless charging & accessories,Storage & organization/Storage containers/Paper & media organizers/Media accessories,"Storage & organization/Display & storage cabinets/Buffet tables, sideboard buffets & buffet cabinets",Storage & organization/Storage containers/Cable management & accessories,Furniture/Tables & desks/Desks & computer desks/Desks for home,Furniture/Tables & desks/Desks & computer desks/Desks for home,Home Décor/Storage boxes & baskets/Secondary storage boxes,Storage & organization/Storage solution systems/SMÅSTAD system/SMÅSTAD doors & drawers,Storage & organization/Storage solution systems/SMÅSTAD system/SMÅSTAD doors & drawers,Storage & organization/Storage containers/Paper & media organizers/Desk accessories,Cookware & tableware/Cookware & kitchenware/Pots & pans/Saucepans,Furniture/Chairs/Dining chairs/Upholstered chairs,"Storage & organization/Shelving units, bookcases & storage options/Shelf units & cube storage",Storage & organization/Storage solution systems/SMÅSTAD system/SMÅSTAD interior fittings,Home Décor/Wall décor/Picture & photo frames,Furniture/Kids furniture/Kids chairs,Storage & organization/Storage containers/Bathroom accessories/Bathroom boxes & baskets,Storage & organization/Bags/Travel accessories,"Storage & organization/Shelving units, bookcases & storage options/Shelf units & cube storage","Storage & organization/Shelving units, bookcases & storage options/Shelf units & cube storage",Storage & organization/Dressers & storage drawers/Chests of drawers,Storage & organization/Wall shelves/Shelves,Storage & organization/Wall shelves/Shelves,Storage & organization/Storage solution systems/BESTÅ storage system/BESTÅ all parts & accessories,Storage & organization/Storage containers/Bathroom accessories/Toilet roll holders & stands
Home Textiles/Window treatments/Curtains & drapes/Light filtering curtains,Home Textiles/Window treatments/Curtains & drapes/Light filtering curtains,"Home Textiles/Window treatments/Shades, blinds & window treatments/Roman shades",Home Textiles/Window treatments/Curtains & drapes/Light filtering curtains,Home Textiles/Window treatments/Curtains & drapes/Panel curtains,Home Textiles/Window treatments/Curtains & drapes/Panel curtains,Home Textiles/Window treatments/Curtains & drapes/Light filtering curtains,Home Textiles/Window treatments/Curtains & drapes/Light filtering curtains,Home Textiles/Window treatments/Curtains & drapes/Panel curtains,Home Textiles/Window treatments/Curtains & drapes/Light filtering curtains,"Home Textiles/Window treatments/Shades, blinds & window treatments/Pleated & cellular blinds and shades",Home Textiles/Window treatments/Curtains & drapes/Light filtering curtains,Home Textiles/Window treatments/Curtains & drapes/Light filtering curtains,Home Textiles/Window treatments/Curtains & drapes/Panel curtains,Home Décor/Clocks/Alarm clocks,Storage & organization/Storage solution systems/PAX system/PAX doors without hinges,Kitchen & appliances/Backsplashes & wall panels/Laminate backsplashes,Kitchen & appliances/Backsplashes & wall panels/Laminate backsplashes,Kitchen & appliances/Backsplashes & wall panels/Laminate backsplashes,Home Textiles/Window treatments/Curtain rods & rails/Track systems,Home electronics/Speakers/Wi-Fi speakers,Storage & organization/Clothes organizers/Clothes racks & stands,Storage & organization/Clothes organizers/Clothes racks & stands,Cookware & tableware/Serveware/Trays,Baby & kids/Kids/Toys & play/Physical play,Cookware & tableware/Dinnerware/Dinnerware sets,Cookware & tableware/Coffee & tea/Mugs & cups,Cookware & tableware/Coffee & tea/Mugs & cups,Storage & organization/Storage solution systems/PAX system/PAX doors without hinges,Storage & organization/Dressers & storage drawers/Chests of drawers,Storage & organization/Storage containers/Paper & media organizers/Desk accessories,Storage & organization/Storage containers/Bins & bags/Trash cans & pedal bins,Outdoor/Umbrellas & gazebos/Patio umbrellas & bases,Kitchen & appliances/Kitchen countertops/Laminate countertops,Kitchen & appliances/Kitchen countertops/Laminate countertops,Kitchen & appliances/Kitchen countertops/Laminate countertops,Kitchen & appliances/Kitchen countertops/Laminate countertops,Kitchen & appliances/Kitchen countertops/Laminate countertops,"Home improvement/Oils, stains & product care","Home improvement/Oils, stains & product care","Home improvement/Oils, stains & product care","Home improvement/Oils, stains & product care",Storage & organization/Storage containers/Bathroom accessories/Towel rails & towel holders,Storage & organization/Storage containers/Bathroom accessories/Towel rails & towel holders,Cookware & tableware/Cookware & kitchenware/Cooking pans/Frying pans & skillets,Cookware & tableware/Cookware & kitchenware/Cooking pans/Woks,Furniture/Tables & desks/Café tables,Furniture/Tables & desks/Bar tables,"Laundry & cleaning/Drying racks/MULIG Drying rack, indoor","Storage & organization/Wall shelves & hooks/Hooks/BRANDUR Rail with 4 hooks, in-","Storage & organization/Wall shelves & hooks/Hooks/BRANDUR Hook, in-","Storage & organization/Wall shelves & hooks/Hooks/BRANDUR Hook, in-",Storage & organization/Wall shelves & hooks/Hooks,Storage & organization/Wall shelves & hooks/Hooks,"Storage & organization/Clothes organizers/Clothes racks & stands/TURBO Clothes rack, indoor",Home Décor/Flower pots & stands/Indoor plant pots,Home Décor/Candle holders & candles/Lanterns,Bathroom/Showers/Shower heads,Pet accessories/Cats,Rugs/Rugs/Door mats,Home Décor/Storage boxes & baskets/Secondary storage boxes,Kitchen & appliances/Kitchen systems/SEKTION kitchen/SEKTION kitchen cabinets,Kitchen & appliances/Kitchen systems/SEKTION kitchen/SEKTION kitchen cabinets,Kitchen & appliances/Kitchen systems/SEKTION kitchen/SEKTION kitchen cabinets,Storage & organization/Storage containers/Bathroom accessories/Toilet brushes,"Home Textiles/Window treatments/Shades, blinds & window treatments/Black-out shades & blinds",Home Décor/Clocks/Alarm clocks,Home Décor/Clocks/Alarm clocks,Home Décor/Vases & bowls/Vases,Home Décor/Mirrors/Vanity mirrors,Home Décor/Vases & bowls/Vases,Furniture/Tables & desks/Dining tables/Up to 4 seats,Home Textiles/Window treatments/Curtains & drapes/Room darkening curtains & drapes,Outdoor/Umbrellas & gazebos/Patio umbrellas & bases,Furniture/Tables & desks/Accent tables/Coffee tables,Furniture/Tables & desks/Accent tables/Coffee tables,Home Décor/Storage boxes & baskets/Baskets,Furniture/Tables & desks/Dining tables/Dining table tops & underframes,Bathroom/Bathroom sinks,Bathroom/Bathroom sinks,Bathroom/Bathroom sinks,Bathroom/Bathroom sinks,Bathroom/Bathroom sinks,Lighting/Lamps & light fixtures/Kids lighting,Home Décor/Storage boxes & baskets/Kids boxes & baskets,Storage & organization/TV & media furniture/TV stands & benches,Storage & organization/Wall shelves/Complete wall shelves/HEMNES Wall,Storage & organization/Dressers & storage drawers/Chests of drawers,Storage & organization/Dressers & storage drawers/Chests of drawers,Furniture/Tables & desks/Nightstands,Storage & organization/Storage containers/Bathroom accessories/Towel rails & towel holders,Cookware & tableware/Dinnerware/Side plates,Cookware & tableware/Dinnerware/Plates,Cookware & tableware/Dinnerware/Bowls,Cookware & tableware/Coffee & tea/Mugs & cups,Home Décor/Storage boxes & baskets/Kids boxes & baskets,Storage & organization/Storage containers/Bathroom accessories/Toilet roll holders & stands,Storage & organization/Armoires & wardrobes/Children's wardrobes,Furniture/Tables & desks/Changing tables/SMÅGÖRA Changing table,Home electronics/Speakers/Bluetooth speakers
Storage & organization/Display & storage cabinets/Display cabinets,Storage & organization/Storage solution systems/BESTÅ storage system/BESTÅ all parts & accessories,Storage & organization/Storage solution systems/PAX system/PAX Interior organizers,Storage & organization/Storage solution systems/PAX system/PAX Interior organizers,Storage & organization/Storage solution systems/OMAR system/All parts,Storage & organization/Clothes organizers/Shoe racks & stands,Cookware & tableware/Cookware & kitchenware/Cooking pans/Grill pans & griddles,Kitchen & appliances/Kitchen systems/SEKTION kitchen/SEKTION kitchen cabinets,Cookware & tableware/Knives & cutting boards/Sharpening tools,"Storage & organization/Shelving units, bookcases & storage options/Shelf units & cube storage",Home Décor/Mirrors/Mirror cabinets,Home Décor/Mirrors/Mirror cabinets,Storage & organization/Clothes organizers/Shoe racks & stands,"Storage & organization/Shelving units, bookcases & storage options/Shelf units & cube storage",Storage & organization/Display & storage cabinets/Display cabinets,Storage & organization/Display & storage cabinets/Display cabinets,Kitchen & appliances/Kitchen drawer organization/Drawer dividers,"Storage & organization/Shelving units, bookcases & storage options/Shelf units & cube storage",Storage & organization/Storage containers/Food storage & organizing/Food containers,Cookware & tableware/Serveware/Trays,Cookware & tableware/Serveware/Trays,Cookware & tableware/Serveware/Trays,Storage & organization/TV & media furniture/TV stands & benches,Bathroom/Bathroom vanities/Vanity cabinets without sink,Storage & organization/Storage containers/Paper & media organizers/Desk accessories,Storage & organization/TV & media furniture/TV stands & benches,Baby & kids/Kids/Kids storage & organization/Children's hooks & wall organization,Storage & organization/TV & media furniture/TV stands & benches,Storage & organization/Storage containers/Food storage & organizing/Food containers,Storage & organization/Bags/Shopping bags & tote bags,Storage & organization/Storage solution systems/BESTÅ storage system/BESTÅ all parts & accessories,Kitchen & appliances/Kitchen drawer organization/Shelves & drawers,Home Décor/Storage boxes & baskets/Secondary storage boxes,Storage & organization/Storage solution systems/SMÅSTAD system/SMÅSTAD doors & drawers,Storage & organization/Storage solution systems/SMÅSTAD system/SMÅSTAD doors & drawers,Cookware & tableware/Serveware/Trays,Home Décor/Storage boxes & baskets/Clothes boxes,Home Décor/Storage boxes & baskets/Paper & media boxes,"Home Décor/Storage boxes & baskets/Secondary storage boxes/SAMLA Lid for box, 12",Storage & organization/Bags/Travel accessories,Bathroom/Bathroom vanities/Bathroom vanity legs,Storage & organization/Wall shelves/Shelves,Storage & organization/Wall shelves/Shelves,Furniture/Tables & desks/Desks & computer desks/Desks for home,Furniture/Tables & desks/Desks & computer desks/Desks for home,Furniture/Tables & desks/Desks & computer desks/Desks for home,Home Décor/Storage boxes & baskets/Secondary storage boxes,Kitchen & appliances/Kitchen systems/SEKTION kitchen/SEKTION kitchen cabinets,Furniture/Tables & desks/Console tables & sofa tables,Home electronics/Speakers/Bluetooth speakers,Kitchen & appliances/Kitchen wall organization & storage/Kitchen shelves,Kitchen & appliances/Kitchen islands & carts,Kitchen & appliances/Kitchen wall organization & storage/Kitchen shelves,Home Décor/Noticeboards,Home Décor/Noticeboards,Home Décor/Noticeboards,Home Décor/Noticeboards,Home Décor/Noticeboards,Home Décor/Noticeboards,Home Décor/Noticeboards,Home Décor/Noticeboards,Home Décor/Noticeboards,Home Décor/Noticeboards,Home Décor/Noticeboards,Home Décor/Noticeboards,Home Décor/Noticeboards,Home Décor/Noticeboards,Home Décor/Noticeboards,Furniture/Patio furniture/Outdoor chairs/Outdoor dining chairs,Storage & organization/TV & media furniture/TV stands & benches,"Storage & organization/Display & storage cabinets/Buffet tables, sideboard buffets & buffet cabinets",Furniture/Kids furniture/Kids chairs,Home improvement/Tools & hardware/Tools,Furniture/Tables & desks/Dining tables/Up to 4 seats,Storage & organization/Wall shelves/Complete wall shelves,Storage & organization/Storage containers/Food storage & organizing/Food containers,Storage & organization/Wall shelves & hooks/Hooks,Furniture/Tables & desks/Desks & computer desks/Desks for home,"Storage & organization/Display & storage cabinets/Buffet tables, sideboard buffets & buffet cabinets",Kitchen & appliances/Kitchen systems/SUNNERSTA modular kitchen/Accessories for SUNNERSTA,Kitchen & appliances/Kitchen systems/SUNNERSTA modular kitchen/Accessories for SUNNERSTA,Kitchen & appliances/Kitchen wall organization & storage/Wall organizers,Kitchen & appliances/Kitchen wall organization & storage/Wall organizers,Kitchen & appliances/Kitchen systems/SUNNERSTA modular kitchen/Accessories for SUNNERSTA,Kitchen & appliances/Kitchen systems/SUNNERSTA modular kitchen/Accessories for SUNNERSTA,Kitchen & appliances/Kitchen systems/SUNNERSTA modular kitchen/Accessories for SUNNERSTA,Home Décor/Wall décor/Picture ledges,Furniture/Patio furniture/Outdoor tables/Outdoor dining tables,"Storage & organization/Shelving units, bookcases & storage options/Storage shelves & units",Home electronics/Speakers/Wi-Fi speakers,Home electronics/Speakers/Wi-Fi speakers,Baby & kids/Kids/Kids decoration & accessories,Baby & kids/Kids/Kids decoration & accessories,Baby & kids/Kids/Kids decoration & accessories,Kitchen & appliances/Kitchen islands & carts,Storage & organization/Storage solution systems/SMÅSTAD system/SMÅSTAD doors & drawers,Storage & organization/Clothes organizers/Shoe racks & stands,Furniture/Kids furniture/Toy storage,Storage & organization/Dressers & storage drawers/Children's dressers and chests,Kitchen & appliances/Appliances/Range hoods & filters/Under cabinet and built-in range hoods
