Beds & mattresses/Bedding/Blankets & throws,Beds & mattresses/Bedding/Pillows/Polyester pillows,Rugs/Rugs/Large & medium rugs,Beds & mattresses/Bedding/Cushions & cushions covers/Cushion covers,Beds & mattresses/Bedding/Cushions & cushions covers/Cushion covers,Baby & kids/Baby/Cribs & crib mattresses/Baby canopies,Beds & mattresses/Bedding/Blankets & throws,Beds & mattresses/Bedding/Blankets & throws,Beds & mattresses/Bedding/Blankets & throws,Beds & mattresses/Bedding/Blankets & throws,Beds & mattresses/Bedding/Cushions & cushions covers/Cushion covers,Beds & mattresses/Bedding/Cushions & cushions covers/Cushions,Beds & mattresses/Bedding/Cushions & cushions covers/Cushions,Furniture/Sofas & sectionals/Sofa & armchairs covers/FLOTTEBO covers,Bathroom/Bathroom textiles/Towels/Hand towels,Bathroom/Bathroom textiles/Towels/Bath sheets,Bathroom/Bathroom textiles/Towels/Wash cloths,Rugs/Rugs/Door mats,Laundry & cleaning/Laundry baskets,Bathroom/Bathroom textiles/Towels/Hand towels,Bathroom/Bathroom textiles/Towels/Bath towels,Furniture/Beds/Kids beds/Kids bed accessories & canopies,Beds & mattresses/Bedding/Blankets & throws/FÄLTMAL Pillow,Furniture/Tables & desks/Changing tables,Beds & mattresses/Mattresses/Kids mattresses,Furniture/Sofas & sectionals/Sofa & armchairs covers/FÄRLÖV covers,"Furniture/Patio furniture/Outdoor seat cushions/SÖTHOLMEN Cushion cover, in",Beds & mattresses/Bedding/Cushions & cushions covers/Cushion covers,Furniture/Armchairs & chaises/Rattan armchairs,Furniture/Armchairs & chaises/Rattan armchairs,Beds & mattresses/Bedding/Cushions & cushions covers/Inner cushions,Beds & mattresses/Bedding/Cushions & cushions covers/Inner cushions,Beds & mattresses/Bedding/Cushions & cushions covers/Inner cushions,Beds & mattresses/Bedding/Cushions & cushions covers/Cushions,Beds & mattresses/Mattresses/Mattress toppers,Furniture/Patio furniture/Outdoor seat cushions,Beds & mattresses/Bedding/Bedlinen/Duvet cover sets,Beds & mattresses/Bedding/Bedlinen/Duvet cover sets,Beds & mattresses/Bedding/Blankets & throws,Beds & mattresses/Bedding/Bedlinen/Duvet cover sets,Rugs/Rugs/Sheepskins & cowhides,Rugs/Rugs/Sheepskins & cowhides,Beds & mattresses/Bedding/Cushions & cushions covers/Cushion covers,Beds & mattresses/Bedding/Pillows/Down & feather pillows,Beds & mattresses/Bedding/Pillows/Down & feather pillows,"Outdoor/Outdoor cushions/Outdoor pillows/FUNKÖN Back cushion, indoor","Outdoor/Outdoor cushions/Outdoor pillows/FUNKÖN Cushion cover, in",Beds & mattresses/Bedding/Cushions & cushions covers/Cushion covers,Furniture/Beds/Sleeper sofas/Mattress choices,Rugs/Rugs/Runners & small rugs,Furniture/Patio furniture/Outdoor seat cushions,Furniture/Patio furniture/Outdoor seat cushions,Rugs/Rugs/Large & medium rugs,Furniture/Sofas & sectionals/Sofa & armchairs covers/STOCKSUND covers,Home Textiles/Window treatments/Curtains & drapes/Light filtering curtains,Beds & mattresses/Bedding/Comforters/Down & feather comforters,Beds & mattresses/Bedding/Comforters/Down & feather comforters,Beds & mattresses/Bedding/Comforters/Down & feather comforters,Beds & mattresses/Bedding/Bedlinen/Duvet cover sets,Beds & mattresses/Bedding/Comforters/Polyester comforters,Beds & mattresses/Bedding/Comforters/Polyester comforters,Beds & mattresses/Bedding/Bedlinen/Duvet cover sets,Beds & mattresses/Bedding/Bedlinen/Duvet cover sets,Beds & mattresses/Bedding/Bedlinen/Duvet cover sets,Beds & mattresses/Bedding/Cushions & cushions covers/Cushion covers,Baby & kids/Baby/Baby textiles/Nursery rugs,Beds & mattresses/Bedding/Cushions & cushions covers/Cushion covers,Beds & mattresses/Bedding/Cushions & cushions covers/Cushion covers,Beds & mattresses/Bedding/Cushions & cushions covers/Children's cushions & blankets,Baby & kids/Baby/Baby textiles/Baby quilts & pillows,Beds & mattresses/Bedding/Bedlinen/Duvet cover sets,Rugs/Rugs/Runners & small rugs,Beds & mattresses/Bedding/Bedlinen/Duvet cover sets,"Baby & kids/Baby/Changing, bathing & potty/Changing accessories","Rugs/Rugs/Large & medium rugs/SKARRILD Rug flatwoven, in",Bathroom/Bathroom textiles/Shower curtains,Furniture/Beds/Sleeper sofas/Mattress choices,Furniture/Armchairs & chaises/Kids armchairs,Cookware & tableware/Kitchen textiles/Kitchen towels,Furniture/Sofas & sectionals/Sofa & armchairs covers/VINLIDEN covers,Furniture/Chairs/High chairs,Beds & mattresses/Bedding/Cushions & cushions covers/Cushion covers,Beds & mattresses/Bedding/Bedspreads,Rugs/Rugs/Door mats,Cookware & tableware/Kitchen textiles/Pot holders & oven mitts,Cookware & tableware/Kitchen textiles/Pot holders & oven mitts,Cookware & tableware/Kitchen textiles/Pot holders & oven mitts,Beds & mattresses/Bedding/Cushions & cushions covers/Cushion covers,Bathroom/Bathroom textiles/Towels/Bath sheets,Bathroom/Bathroom textiles/Towels/Hand towels,Bathroom/Bathroom textiles/Towels/Wash cloths,Beds & mattresses/Bedding/Cushions & cushions covers/Children's cushions & blankets,Beds & mattresses/Bedding/Blankets & throws,Furniture/Sofas & sectionals/Sofa & armchairs covers/POÄNG,Outdoor/Umbrellas & gazebos/Patio umbrellas & bases,"Baby & kids/Baby/Changing, bathing & potty/Changing accessories",Beds & mattresses/Bedding/Blankets & throws,Bathroom/Bathroom textiles/Towels/Bath towels,Beds & mattresses/Bedding/Cushions & cushions covers/Cushion covers,Outdoor/Umbrellas & gazebos/Patio umbrellas & bases
Storage & organization/Storage solution systems/AURDAL system/AURDAL parts,Storage & organization/Storage solution systems/AURDAL system/AURDAL parts,Storage & organization/Storage solution systems/AURDAL system/AURDAL parts,Storage & organization/Storage solution systems/AURDAL system/AURDAL parts,Storage & organization/Storage solution systems/AURDAL system/AURDAL parts,Storage & organization/Storage solution systems/AURDAL system/AURDAL parts,Storage & organization/Storage solution systems/AURDAL system/AURDAL parts,Storage & organization/Storage solution systems/AURDAL system/AURDAL parts,Storage & organization/Storage solution systems/AURDAL system/AURDAL parts,Storage & organization/Storage solution systems/AURDAL system/AURDAL parts,Storage & organization/Storage solution systems/AURDAL system/AURDAL parts,Storage & organization/Storage solution systems/AURDAL system/AURDAL parts,Home Décor/Mirrors/Wall mirrors,Storage & organization/Clothes organizers/Shoe racks & stands,"Storage & organization/Shelving units, bookcases & storage options/Shelf units & cube storage","Storage & organization/Shelving units, bookcases & storage options/Shelf units & cube storage",Baby & kids/Kids/Kids storage & organization/Children's hooks & wall organization,Home electronics/Cords & chargers/Wireless charging & accessories,Storage & organization/Wall shelves/Brackets,Kitchen & appliances/Kitchen drawer organization/Drawer dividers,Storage & organization/Storage containers/Bathroom accessories/Soap dispensers & soap dishes,Storage & organization/Storage containers/Bathroom accessories/Towel rails & towel holders,Storage & organization/Storage containers/Bathroom accessories/Shower accessories,Storage & organization/Storage containers/Bathroom accessories/Towel rails & towel holders,Storage & organization/Storage containers/Bathroom accessories/Toothbrush holders,Storage & organization/Storage containers/Bathroom accessories/Toilet roll holders & stands,Bathroom/Showers/Shower sets & rails,Storage & organization/Storage containers/Bathroom accessories/Shower accessories,Bathroom/Bathroom storage/Bathroom shelving units,Bathroom/Bathroom storage/Bathroom storage/Bathroom wall cabinets,Cookware & tableware/Knives & cutting boards/Cutting boards,Storage & organization/Storage containers/Food storage & organizing/Cooler bags,Cookware & tableware/Cookware & kitchenware/Ovenware,Cookware & tableware/Serveware/Trays,Storage & organization/Storage containers/Paper & media organizers/Media accessories,Storage & organization/Storage containers/Bathroom accessories/Shower accessories,Home Décor/Mirrors/Makeup & magnifying mirrors,Cookware & tableware/Cookware & kitchenware/Pots & pans/Saucepans,Cookware & tableware/Cookware & kitchenware/Pots & pans/Cooking & stock pots,Cookware & tableware/Cookware & kitchenware/Cooking pans/Frying pans & skillets,Cookware & tableware/Cookware & kitchenware/Pots & pans/Cooking & stock pots,Cookware & tableware/Cookware & kitchenware/Cooking pans/Frying pans & skillets,Cookware & tableware/Cookware & kitchenware/Pots & pans/Cooking & stock pots,Cookware & tableware/Cookware & kitchenware/Cooking pans/Frying pans & skillets,Cookware & tableware/Cookware & kitchenware/Cooking pans/Frying pans & skillets,Cookware & tableware/Cookware & kitchenware/Pots & pans/Cooking & stock pots,Storage & organization/Storage solution systems/BESTÅ storage system/BESTÅ all parts & accessories,Storage & organization/Storage solution systems/BESTÅ storage system/BESTÅ all parts & accessories,Storage & organization/Storage solution systems/IVAR system/All parts,Bathroom/Showers/Shower heads,Storage & organization/Dressers & storage drawers/Chests of drawers,Storage & organization/Dressers & storage drawers/Chests of drawers,Storage & organization/Dressers & storage drawers/Chests of drawers,Storage & organization/Wall shelves/Complete wall shelves,Storage & organization/Dressers & storage drawers/Chests of drawers,Storage & organization/Storage containers/Bins & bags/Trash cans & pedal bins,Storage & organization/Storage solution systems/SMÅSTAD system/SMÅSTAD interior fittings,Storage & organization/Storage solution systems/SMÅSTAD system/SMÅSTAD interior fittings,Home Décor/Storage boxes & baskets/Paper & media boxes,Storage & organization/Storage solution systems/BESTÅ storage system/BESTÅ all parts & accessories,Furniture/Tables & desks/Dining tables/Up to 10 seats,Kitchen & appliances/Kitchen drawer organization/Drawer dividers,Furniture/Tables & desks/Kids tables,Furniture/Tables & desks/Dining tables/Up to 6 seats,Storage & organization/Clothes organizers/Shoe cabinets,Storage & organization/Clothes organizers/Shoe cabinets,Storage & organization/Clothes organizers/Shoe cabinets,Storage & organization/Clothes organizers/Shoe cabinets,Storage & organization/Clothes organizers/Shoe cabinets,Storage & organization/Clothes organizers/Shoe cabinets,Storage & organization/Clothes organizers/Shoe cabinets,Furniture/Chairs/High chairs,Storage & organization/Storage solution systems/BESTÅ storage system/BESTÅ all parts & accessories,Cookware & tableware/Serveware/Serving dishes,Storage & organization/Storage containers/Bins & bags/Trash cans & pedal bins,Storage & organization/Storage solution systems/SMÅSTAD system/SMÅSTAD interior fittings,Cookware & tableware/Cookware & kitchenware/Cooking accessories,Storage & organization/Storage containers/Food storage & organizing/Jars & tins,Storage & organization/Storage containers/Bins & bags/Trash cans & pedal bins,Storage & organization/Display & storage cabinets/Dining room cabinets & cupboards,Storage & organization/Display & storage cabinets/Dining room cabinets & cupboards,Home electronics/Cords & chargers/Wireless charging & accessories,Cookware & tableware/Cookware & kitchenware/Cooking pans/Frying pans & skillets,Storage & organization/Wall shelves/Complete wall shelves,Cookware & tableware/Cookware & kitchenware/Cooking pans/Frying pans & skillets,Cookware & tableware/Cookware & kitchenware/Cooking pans/Frying pans & skillets,Storage & organization/Storage containers/Bins & bags/Trash cans & pedal bins,Storage & organization/Clothes organizers/Clothes racks & stands,Cookware & tableware/Cookware & kitchenware/Cooking pans/Frying pans & skillets,Cookware & tableware/Cookware & kitchenware/Cooking pans/Frying pans & skillets,Cookware & tableware/Cookware & kitchenware/Pots & pans/Cookware sets,Kitchen & appliances/Kitchen systems/SEKTION kitchen/SEKTION kitchen cabinets,Cookware & tableware/Cookware & kitchenware/Cooking pans/Frying pans & skillets,Kitchen & appliances/Kitchen systems/SEKTION kitchen/SEKTION kitchen cabinets,Kitchen & appliances/Kitchen systems/SEKTION kitchen/SEKTION kitchen cabinets,Kitchen & appliances/Kitchen systems/SEKTION kitchen/SEKTION kitchen cabinets/Cabinet doors & drawer fronts,Kitchen & appliances/Kitchen faucets & sinks/Sink parts,Storage & organization/Wall shelves/Complete wall shelves,Cookware & tableware/Cookware & kitchenware/Pots & pans/Cooking & stock pots,Cookware & tableware/Cookware & kitchenware/Pots & pans/Saucepans
Home Textiles/Window treatments/Curtains & drapes/Light filtering curtains,"Home Textiles/Window treatments/Shades, blinds & window treatments/Pleated & cellular blinds and shades",Home Textiles/Window treatments/Curtains & drapes/Light filtering curtains,Home Textiles/Window treatments/Curtains & drapes/Panel curtains,Home Textiles/Window treatments/Curtains & drapes/Light filtering curtains,Home Textiles/Window treatments/Curtains & drapes/Light filtering curtains,Home Textiles/Window treatments/Curtains & drapes/Light filtering curtains,Home Textiles/Window treatments/Curtains & drapes/Panel curtains,"Home Textiles/Window treatments/Shades, blinds & window treatments/Roman shades",Home Textiles/Window treatments/Curtains & drapes/Panel curtains,Home Textiles/Window treatments/Curtains & drapes/Light filtering curtains,Home Textiles/Window treatments/Curtains & drapes/Light filtering curtains,Home Textiles/Window treatments/Curtains & drapes/Panel curtains,Home Textiles/Window treatments/Curtains & drapes/Light filtering curtains,Rugs/Rugs/Door mats,Home Décor/Noticeboards,Lighting/Lamps & light fixtures/Kids lighting,Baby & kids/Kids/Toys & play/Role play,"Home improvement/Oils, stains & product care","Home improvement/Oils, stains & product care","Home improvement/Oils, stains & product care","Home improvement/Oils, stains & product care",Storage & organization/Clothes organizers/Clothes racks & stands,Storage & organization/Clothes organizers/Clothes racks & stands,Baby & kids/Kids/Toys & play/Physical play,Baby & kids/Kids/Toys & play/Role play,Home Décor/Mirrors/Vanity mirrors,Bathroom/Bathroom sinks,Bathroom/Bathroom sinks,Bathroom/Bathroom sinks,Bathroom/Bathroom sinks,Bathroom/Bathroom sinks,Pet accessories/Cats,Kitchen & appliances/Backsplashes & wall panels/Laminate backsplashes,Kitchen & appliances/Backsplashes & wall panels/Laminate backsplashes,Kitchen & appliances/Backsplashes & wall panels/Laminate backsplashes,Home Décor/Clocks/Alarm clocks,Furniture/Patio furniture/Outdoor chaises & hammocks,Storage & organization/Storage solution systems/PAX system/PAX doors without hinges,Outdoor/Umbrellas & gazebos/Patio umbrellas & bases,Home Textiles/Window treatments/Curtain rods & rails/Track systems,Bathroom/Bathroom textiles/Shower curtains,Furniture/Tables & desks/Accent tables/Coffee tables,Furniture/Tables & desks/Accent tables/Coffee tables,Cookware & tableware/Serveware/Trays,Bathroom/Showers/Shower heads,Rugs/Rugs/Door mats,"Home Textiles/Window treatments/Shades, blinds & window treatments/Black-out shades & blinds","Storage & organization/Clothes organizers/Clothes racks & stands/TURBO Clothes rack, indoor","Laundry & cleaning/Drying racks/MULIG Drying rack, indoor",Home Décor/Candle holders & candles/Lanterns,Home Décor/Flower pots & stands/Indoor plant pots,Storage & organization/Wall shelves & hooks/Hooks,"Storage & organization/Wall shelves & hooks/Hooks/BRANDUR Hook, in-",Storage & organization/Wall shelves & hooks/Hooks,"Storage & organization/Wall shelves & hooks/Hooks/BRANDUR Hook, in-","Storage & organization/Wall shelves & hooks/Hooks/BRANDUR Rail with 4 hooks, in-",Cookware & tableware/Serveware/Trays,Laundry & cleaning/Cleaning accessories,Cookware & tableware/Cookware & kitchenware/Cooking pans/Frying pans & skillets,Furniture/Tables & desks/Dining tables/Up to 4 seats,Storage & organization/Storage solution systems/PAX system/PAX doors without hinges,Home Décor/Storage boxes & baskets/Baskets,Cookware & tableware/Cookware & kitchenware/Cooking pans/Woks,Home electronics/Speakers/Wi-Fi speakers,Home Décor/Clocks/Alarm clocks,Home Décor/Clocks/Alarm clocks,Cookware & tableware/Flatware/Flatware,Storage & organization/Storage containers/Paper & media organizers/Desk accessories,Storage & organization/Storage containers/Bins & bags/Trash cans & pedal bins,Cookware & tableware/Dinnerware/Dinnerware sets,Cookware & tableware/Coffee & tea/Mugs & cups,Cookware & tableware/Coffee & tea/Mugs & cups,Cookware & tableware/Napkins & napkin holders/Napkin holders,Storage & organization/TV & media furniture/TV stands & benches,Storage & organization/Dressers & storage drawers/Chests of drawers,Storage & organization/Wall shelves/Complete wall shelves/HEMNES Wall,Furniture/Tables & desks/Dining tables/Up to 6 seats,Storage & organization/Storage solution systems/PAX system/PAX doors without hinges,Outdoor/Umbrellas & gazebos/Patio umbrellas & bases,Cookware & tableware/Dinnerware/Plates,Cookware & tableware/Dinnerware/Bowls,Cookware & tableware/Coffee & tea/Mugs & cups,Cookware & tableware/Dinnerware/Side plates,Kitchen & appliances/Kitchen systems/SEKTION kitchen/SEKTION kitchen cabinets,Kitchen & appliances/Kitchen systems/SEKTION kitchen/SEKTION kitchen cabinets,Kitchen & appliances/Kitchen systems/SEKTION kitchen/SEKTION kitchen cabinets,Kitchen & appliances/Kitchen systems/SEKTION kitchen/SEKTION kitchen cabinets,Home Textiles/Window treatments/Curtains & drapes/Room darkening curtains & drapes,Kitchen & appliances/Kitchen systems/SEKTION kitchen/SEKTION kitchen cabinets,Home Décor/Storage boxes & baskets/Secondary storage boxes,Cookware & tableware/Dinnerware/Dinnerware sets,Cookware & tableware/Dinnerware/Bowls,Cookware & tableware/Dinnerware/Side plates,Cookware & tableware/Dinnerware/Deep plates/FLITIGHET Deep plate,Cookware & tableware/Dinnerware/Plates,Kitchen & appliances/Kitchen countertops/Laminate countertops,Kitchen & appliances/Kitchen countertops/Laminate countertops,Kitchen & appliances/Kitchen countertops/Laminate countertops,Kitchen & appliances/Kitchen countertops/Laminate countertops
Storage & organization/Display & storage cabinets/Display cabinets,"Storage & organization/Shelving units, bookcases & storage options/Shelf units & cube storage",Kitchen & appliances/Kitchen drawer organization/Shelves & drawers,Storage & organization/Wall shelves & hooks/Hooks,Cookware & tableware/Knives & cutting boards/Sharpening tools,Storage & organization/Storage solution systems/PAX system/PAX Interior organizers,Storage & organization/Storage solution systems/PAX system/PAX Interior organizers,Home Décor/Storage boxes & baskets/Paper & media boxes,Bathroom/Bathroom storage/Bathroom storage/Bathroom wall cabinets,Furniture/Tables & desks/Accent tables/End tables & side tables,Home electronics/Speakers/Wi-Fi speakers,Home electronics/Speakers/Wi-Fi speakers,Storage & organization/Storage containers/Cable management & accessories,Storage & organization/Storage solution systems/BESTÅ storage system/BESTÅ all parts & accessories,Bathroom/Bathroom vanities/Bathroom vanity legs,Home electronics/Speakers/Wi-Fi speakers,"Storage & organization/Shelving units, bookcases & storage options/Shelf units & cube storage",Furniture/Chairs/Bar stools & chairs,Home Décor/Mirrors/Mirror cabinets,Home Décor/Mirrors/Mirror cabinets,Bathroom/Bathroom storage/Bathroom storage/Bathroom tall cabinets,Storage & organization/Storage solution systems/IVAR system/All parts,Storage & organization/Storage solution systems/IVAR system/All parts,Storage & organization/Display & storage cabinets/Dining room cabinets & cupboards,Storage & organization/Storage solution systems/IVAR system/All parts,Storage & organization/Storage solution systems/IVAR system/All parts,Storage & organization/Storage solution systems/IVAR system/All parts,Storage & organization/Storage solution systems/IVAR system/All parts,Storage & organization/Storage solution systems/IVAR system/All parts,Storage & organization/Storage solution systems/IVAR system/All parts,Storage & organization/Display & storage cabinets/Dining room cabinets & cupboards,Storage & organization/Storage solution systems/IVAR system/All parts,Storage & organization/Storage solution systems/IVAR system/All parts,Storage & organization/Storage solution systems/IVAR system/All parts,Storage & organization/Storage solution systems/IVAR system/All parts,Storage & organization/Storage solution systems/IVAR system/All parts,Storage & organization/Storage solution systems/IVAR system/All parts,Storage & organization/Storage solution systems/IVAR system/All parts,Storage & organization/Storage solution systems/IVAR system/All parts,Storage & organization/Storage solution systems/IVAR system/All parts,Storage & organization/Storage solution systems/IVAR system/All parts,Storage & organization/Storage solution systems/IVAR system/All parts,Storage & organization/Storage solution systems/IVAR system/All parts,Storage & organization/Storage solution systems/IVAR system/All parts,Kitchen & appliances/Kitchen systems/SUNNERSTA modular kitchen/Accessories for SUNNERSTA,Kitchen & appliances/Kitchen wall organization & storage/Wall organizers,Kitchen & appliances/Kitchen wall organization & storage/Wall organizers,Kitchen & appliances/Kitchen systems/SUNNERSTA modular kitchen/Accessories for SUNNERSTA,Kitchen & appliances/Kitchen systems/SUNNERSTA modular kitchen/Accessories for SUNNERSTA,Kitchen & appliances/Kitchen systems/SUNNERSTA modular kitchen/Accessories for SUNNERSTA,Kitchen & appliances/Kitchen systems/SUNNERSTA modular kitchen/Accessories for SUNNERSTA,Storage & organization/Display & storage cabinets/Dining room cabinets & cupboards,Kitchen & appliances/Kitchen systems/SEKTION kitchen/SEKTION kitchen cabinets,Home electronics/Speakers/Wi-Fi speakers,Storage & organization/TV & media furniture/TV stands & benches,Storage & organization/Storage solution systems/BESTÅ storage system/BESTÅ all parts & accessories,Storage & organization/Armoires & wardrobes/Solitaire wardrobes,Kitchen & appliances/Kitchen drawer organization/Drawer dividers,Cookware & tableware/Serveware/Trays,Cookware & tableware/Serveware/Trays,Cookware & tableware/Serveware/Trays,Storage & organization/Storage containers/Food storage & organizing/Food containers,Storage & organization/Storage solution systems/SMÅSTAD system/SMÅSTAD doors & drawers,Furniture/Kids furniture/Toy storage,Furniture/Kids furniture/Toy storage,Storage & organization/Storage solution systems/SMÅSTAD system/SMÅSTAD doors & drawers,Storage & organization/Storage solution systems/SMÅSTAD system/SMÅSTAD doors & drawers,Furniture/Kids furniture/Toy storage,Furniture/Kids furniture/Toy storage,Storage & organization/Storage containers/Food storage & organizing/Food containers,Storage & organization/Storage containers/Paper & media organizers/Desk accessories,Kitchen & appliances/Kitchen islands & carts,Kitchen & appliances/Kitchen islands & carts,Kitchen & appliances/Kitchen islands & carts,Kitchen & appliances/Kitchen islands & carts,Home Décor/Storage boxes & baskets/Secondary storage boxes,"Storage & organization/Shelving units, bookcases & storage options/Storage shelves & units",Storage & organization/Display & storage cabinets/Display cabinets,Storage & organization/Display & storage cabinets/Display cabinets,Storage & organization/Display & storage cabinets/Dining room cabinets & cupboards,"Storage & organization/Shelving units, bookcases & storage options/Shelf units & cube storage",Furniture/Patio furniture/Outdoor tables/Outdoor dining tables,Furniture/Tables & desks/Bar tables,"Storage & organization/Shelving units, bookcases & storage options/Shelf units & cube storage",Furniture/Tables & desks/Accent tables/End tables & side tables,Furniture/Tables & desks/Desks & computer desks/Desks for home,Storage & organization/Storage containers/Food storage & organizing/Food containers,Furniture/Tables & desks/Desks & computer desks/Desks for home,Furniture/Tables & desks/Desks & computer desks/Desks for home,Kitchen & appliances/Kitchen drawer organization/Shelves & drawers,"Storage & organization/Display & storage cabinets/Buffet tables, sideboard buffets & buffet cabinets",Cookware & tableware/Cookware & kitchenware/Cooking pans/Grill pans & griddles,Home Décor/Storage boxes & baskets/Paper & media boxes,Baby & kids/Kids/Kids storage & organization/Children's hooks & wall organization,Storage & organization/Wall shelves/Shelves,Storage & organization/Wall shelves/Shelves,Kitchen & appliances/Kitchen drawer organization/Shelves & drawers,Storage & organization/Storage solution systems/BESTÅ storage system/BESTÅ all parts & accessories/BESTÅ fittings & inside organizers,Furniture/Tables & desks/Table & desk systems/Table bar system,Storage & organization/Storage containers/Paper & media organizers/Magazine files
