Beds & mattresses/Bedding/Blankets & throws,Beds & mattresses/Bedding/Bedlinen/Duvet cover sets,Beds & mattresses/Bedding/Pillows/Polyester pillows,Rugs/Bath mats,Baby & kids/Baby/Baby textiles/Nursery rugs,Storage & organization/Bags/Shopping bags & tote bags,Bathroom/Bathroom textiles/Towels/Bath sheets,Bathroom/Bathroom textiles/Towels/Hand towels,Bathroom/Bathroom textiles/Towels/Wash cloths,Rugs/Rugs/Door mats,Furniture/Sofas & sectionals/Sofa & armchairs covers/HÄRLANDA covers,Furniture/Sofas & sectionals/Sofa & armchairs covers/HÄRLANDA covers,Furniture/Sofas & sectionals/Fabric sofas/Modular fabric sofas,Furniture/Sofas & sectionals/Sofa & armchairs covers/HÄRLANDA covers,Furniture/Sofas & sectionals/Sofa & armchairs covers/HÄRLANDA covers,Beds & mattresses/Bedding/Cushions & cushions covers/Children's cushions & blankets,Furniture/Armchairs & chaises/Rattan armchairs,Furniture/Armchairs & chaises/Rattan armchairs,Cookware & tableware/Napkins & napkin holders/Napkins,Beds & mattresses/Bedding/Blankets & throws,Beds & mattresses/Bedding/Cushions & cushions covers/Cushion covers,Beds & mattresses/Bedding/Cushions & cushions covers/Cushion covers,Furniture/Sofas & sectionals/Sofa & armchairs covers/POÄNG,Furniture/Sofas & sectionals/Sofa & armchairs covers/POÄNG,Beds & mattresses/Mattresses/Crib mattresses,Beds & mattresses/Mattresses/Crib mattresses,Beds & mattresses/Mattresses/Crib mattresses,Beds & mattresses/Mattresses/Crib mattresses,Beds & mattresses/Bedding/Cushions & cushions covers/Cushions,"Outdoor/Outdoor cushions/Outdoor pillows/FUNKÖN Back cushion, indoor","Outdoor/Outdoor cushions/Outdoor pillows/FUNKÖN Cushion cover, in",Furniture/Armchairs & chaises/Kids armchairs,Furniture/Patio furniture/Outdoor seat cushions,Furniture/Patio furniture/Outdoor seat cushions,Baby & kids/Baby/Baby textiles/Nursery rugs,Beds & mattresses/Bedding/Cushions & cushions covers/Cushions,Beds & mattresses/Mattresses/Mattress toppers,Furniture/Tables & desks/Changing tables,Baby & kids/Kids/Toys & play/Soft toys,Bathroom/Bathroom textiles/Towels/Hand towels,Bathroom/Bathroom textiles/Towels/Bath towels,Beds & mattresses/Bedding/Cushions & cushions covers/Cushion covers,Baby & kids/Baby/Baby textiles/Baby towels & washcloths,Rugs/Bath mats,Rugs/Rugs/Door mats,Beds & mattresses/Bedding/Blankets & throws/FÄLTMAL Pillow,Rugs/Rugs/Large & medium rugs,Rugs/Rugs/Runners & small rugs,Cookware & tableware/Table linen/Table cloths & runners,Furniture/Patio furniture/Outdoor lounge furniture,Beds & mattresses/Bedding/Cushions & cushions covers/Cushion covers,Beds & mattresses/Mattresses/Kids mattresses,Baby & kids/Kids/Toys & play/Soft toys,Beds & mattresses/Bedding/Blankets & throws,Furniture/Sofas & sectionals/Sofa & armchairs covers/POÄNG,Furniture/Sofas & sectionals/Sofa & armchairs covers/FLOTTEBO covers,Beds & mattresses/Bedding/Blankets & throws,Furniture/Patio furniture/Outdoor seat cushions,Rugs/Rugs/Round rugs,Rugs/Rugs/Large & medium rugs,Rugs/Rugs/Runners & small rugs,Beds & mattresses/Bedding/Comforters/Polyester comforters,Beds & mattresses/Bedding/Comforters/Polyester comforters,Cookware & tableware/Kitchen textiles/Pot holders & oven mitts,Cookware & tableware/Kitchen textiles/Pot holders & oven mitts,Cookware & tableware/Kitchen textiles/Pot holders & oven mitts,Beds & mattresses/Bedding/Cushions & cushions covers/Cushion covers,Beds & mattresses/Bedding/Cushions & cushions covers/Cushion covers,Beds & mattresses/Bedding/Bedlinen/Duvet cover sets,Beds & mattresses/Bedding/Bedspreads,Beds & mattresses/Bedding/Pillows/Down & feather pillows,Beds & mattresses/Bedding/Pillows/Down & feather pillows,Beds & mattresses/Bedding/Cushions & cushions covers/Children's cushions & blankets,Beds & mattresses/Bedding/Cushions & cushions covers/Children's cushions & blankets,Rugs/Rugs/Door mats,"Beds & mattresses/Mattresses/Foam, memory foam & latex mattresses",Rugs/Rugs/Door mats,Furniture/Sofas & sectionals/Sofa & armchairs covers/FÄRLÖV covers,Rugs/Rugs/Large & medium rugs,"Rugs/Rugs/Large & medium rugs/SVALLERUP Rug flatwoven, in","Baby & kids/Baby/Changing, bathing & potty/Changing accessories",Rugs/Rugs/Sheepskins & cowhides,Rugs/Rugs/Sheepskins & cowhides,Rugs/Rugs/Large & medium rugs,Beds & mattresses/Bedding/Cushions & cushions covers/Children's cushions & blankets,Baby & kids/Baby/Baby textiles/Baby quilts & pillows,Rugs/Rugs/Large & medium rugs,Beds & mattresses/Bedding/Cushions & cushions covers/Cushions,Storage & organization/Storage containers/Bins & bags/Bags,Storage & organization/Storage containers/Bins & bags/Bags,"Rugs/Rugs/Large & medium rugs/VRENSTED Rug flatwoven, in",Storage & organization/Storage containers/Paper & media organizers/Magazine files,Beds & mattresses/Bedding/Cushions & cushions covers/Cushions,Furniture/Sofas & sectionals/Fabric sofas/Sofas,Furniture/Sofas & sectionals/Sofa & armchairs covers/POÄNG,Furniture/Sofas & sectionals/Sofa & armchairs covers/VINLIDEN covers,Beds & mattresses/Bedding/Cushions & cushions covers/Cushion covers,"Rugs/Rugs/Large & medium rugs/SKARRILD Rug flatwoven, in",Beds & mattresses/Bedding/Bedlinen/Duvet cover sets,Beds & mattresses/Bedding/Cushions & cushions covers/Cushions
Storage & organization/Storage solution systems/AURDAL system/AURDAL parts,Storage & organization/Storage solution systems/AURDAL system/AURDAL parts,Storage & organization/Storage solution systems/AURDAL system/AURDAL parts,Storage & organization/Storage solution systems/AURDAL system/AURDAL parts,Storage & organization/Storage solution systems/AURDAL system/AURDAL parts,Storage & organization/Storage solution systems/AURDAL system/AURDAL parts,Storage & organization/Storage solution systems/AURDAL system/AURDAL parts,Storage & organization/Storage solution systems/AURDAL system/AURDAL parts,Storage & organization/Storage solution systems/AURDAL system/AURDAL parts,Storage & organization/Storage solution systems/AURDAL system/AURDAL parts,Storage & organization/Storage solution systems/AURDAL system/AURDAL parts,Storage & organization/Storage solution systems/AURDAL system/AURDAL parts,Furniture/Tables & desks/Desks & computer desks/Desks for home,Home electronics/Speakers/Bluetooth speakers,Storage & organization/Storage containers/Bins & bags/Trash cans & pedal bins,Home Décor/Mirrors/Wall mirrors,Home Décor/Mirrors/Wall mirrors,Home Décor/Mirrors/Wall mirrors,"Storage & organization/Shelving units, bookcases & storage options/Storage shelves & units",Storage & organization/Clothes organizers/Shoe cabinets,Storage & organization/Clothes organizers/Shoe cabinets,Storage & organization/Clothes organizers/Shoe cabinets,Storage & organization/Clothes organizers/Shoe cabinets,Storage & organization/Clothes organizers/Shoe cabinets,Storage & organization/Clothes organizers/Shoe cabinets,Storage & organization/Clothes organizers/Shoe cabinets,Cookware & tableware/Knives & cutting boards/Cutting boards,Home Décor/Storage boxes & baskets/Secondary storage boxes,Home electronics/Cords & chargers/Wireless charging & accessories,Storage & organization/Storage containers/Food storage & organizing/Food containers,Home electronics/Speakers/Bluetooth speakers,Home electronics/Speakers/Bluetooth speakers,Home electronics/Speakers/Bluetooth speakers,Home electronics/Speakers/Bluetooth speakers,Home electronics/Cords & chargers/Wireless charging & accessories,Home electronics/Cords & chargers/Wireless charging & accessories,Home Décor/Storage boxes & baskets/Paper & media boxes,Storage & organization/Wall shelves/Complete wall shelves,Storage & organization/Storage solution systems/BESTÅ storage system/BESTÅ all parts & accessories,Home Décor/Storage boxes & baskets/Secondary storage boxes,Home Décor/Storage boxes & baskets/Secondary storage boxes,Kitchen & appliances/Kitchen islands & carts,Storage & organization/Storage containers/Bathroom accessories/Bathroom shelves,Bathroom/Bathroom storage/Bathroom shelving units,"Storage & organization/Shelving units, bookcases & storage options/Cube storage","Storage & organization/Shelving units, bookcases & storage options/Bookcases","Storage & organization/Shelving units, bookcases & storage options/Shelf units & cube storage","Storage & organization/Shelving units, bookcases & storage options/Cube storage",Storage & organization/Display & storage cabinets/Dining room cabinets & cupboards,"Storage & organization/Shelving units, bookcases & storage options/Storage shelves & units",Home electronics/Cords & chargers/Wireless charging & accessories,Furniture/Kids furniture/Toy storage,"Storage & organization/Shelving units, bookcases & storage options/Storage shelves & units",Furniture/Tables & desks/Kids tables,Bathroom/Bathroom vanities/Vanity cabinets with sink,Bathroom/Bathroom vanities/Vanity cabinets with sink,Furniture/Tables & desks/Bar tables,Storage & organization/Storage containers/Bathroom accessories/Bathroom boxes & baskets,Storage & organization/Storage containers/Bins & bags/Trash cans & pedal bins,Storage & organization/Storage containers/Paper & media organizers/Media accessories,Home Décor/Vases & bowls/Vases/CYLINDER Vase,Home Décor/Vases & bowls/Vases,Baby & kids/Kids/Toys & play/Arts & crafts,Furniture/Tables & desks/Dining tables/Up to 4 seats,Home electronics/Cords & chargers/Wireless charging & accessories,Home Décor/Storage boxes & baskets/Kids boxes & baskets,Storage & organization/Storage containers/Food storage & organizing/Cooler bags,"Storage & organization/Shelving units, bookcases & storage options/Shelf units & cube storage",Home Décor/Storage boxes & baskets/Secondary storage boxes,Furniture/Tables & desks/Dining tables/Up to 4 seats,Storage & organization/Display & storage cabinets/Display cabinets,"Storage & organization/Shelving units, bookcases & storage options/Bookcases",Home Décor/Storage boxes & baskets/Kids boxes & baskets,Home Décor/Storage boxes & baskets/Kids boxes & baskets,Home Décor/Storage boxes & baskets/Kids boxes & baskets,Storage & organization/Storage solution systems/SMÅSTAD system/SMÅSTAD doors & drawers,Storage & organization/Storage solution systems/SMÅSTAD system/SMÅSTAD doors & drawers,Furniture/Tables & desks/Desks & computer desks/Desks for home,Furniture/Chairs/High chairs,"Storage & organization/Shelving units, bookcases & storage options/Shelf units & cube storage","Storage & organization/Shelving units, bookcases & storage options/Shelf units & cube storage",Storage & organization/Storage containers/Cable management & accessories,Furniture/Kids furniture/Kids chairs,Storage & organization/Storage containers/Food storage & organizing/Food containers,Storage & organization/Bags/Travel accessories,Furniture/Tables & desks/Desks & computer desks/Desks for home,"Storage & organization/Display & storage cabinets/Buffet tables, sideboard buffets & buffet cabinets",Home Décor/Wall décor/Picture & photo frames,Storage & organization/Storage solution systems/SMÅSTAD system/SMÅSTAD interior fittings,Storage & organization/Storage containers/Paper & media organizers/Desk accessories,Storage & organization/Storage containers/Bathroom accessories/Bathroom boxes & baskets,Kitchen & appliances/Appliances/Ranges,Furniture/Tables & desks/Desks & computer desks/Desks for home,Cookware & tableware/Cookware & kitchenware/Pots & pans/Saucepans,Home Décor/Storage boxes & baskets/Paper & media boxes,Storage & organization/Storage containers/Bathroom accessories/Towel rails & towel holders,Storage & organization/Wall shelves/Shelves,Storage & organization/Wall shelves/Shelves,Storage & organization/Storage solution systems/SMÅSTAD system/SMÅSTAD interior fittings,Storage & organization/Storage containers/Bathroom accessories/Toilet roll holders & stands
Home Textiles/Window treatments/Curtains & drapes/Light filtering curtains,Home Textiles/Window treatments/Curtains & drapes/Light filtering curtains,"Home Textiles/Window treatments/Shades, blinds & window treatments/Pleated & cellular blinds and shades",Home Textiles/Window treatments/Curtains & drapes/Panel curtains,Home Textiles/Window treatments/Curtains & drapes/Light filtering curtains,Home Textiles/Window treatments/Curtains & drapes/Panel curtains,Home Textiles/Window treatments/Curtains & drapes/Light filtering curtains,Home Textiles/Window treatments/Curtains & drapes/Light filtering curtains,Home Textiles/Window treatments/Curtains & drapes/Light filtering curtains,Home Textiles/Window treatments/Curtains & drapes/Panel curtains,Home Textiles/Window treatments/Curtains & drapes/Light filtering curtains,Home Textiles/Window treatments/Curtains & drapes/Panel curtains,"Home Textiles/Window treatments/Shades, blinds & window treatments/Roman shades",Home Textiles/Window treatments/Curtains & drapes/Light filtering curtains,Home Textiles/Window treatments/Curtain rods & rails/Track systems,Home Décor/Clocks/Alarm clocks,Baby & kids/Kids/Toys & play/Physical play,Kitchen & appliances/Backsplashes & wall panels/Laminate backsplashes,Kitchen & appliances/Backsplashes & wall panels/Laminate backsplashes,Kitchen & appliances/Backsplashes & wall panels/Laminate backsplashes,Storage & organization/Storage solution systems/PAX system/PAX doors without hinges,Outdoor/Umbrellas & gazebos/Patio umbrellas & bases,"Home improvement/Oils, stains & product care","Home improvement/Oils, stains & product care","Home improvement/Oils, stains & product care","Home improvement/Oils, stains & product care",Storage & organization/Dressers & storage drawers/Chests of drawers,Home electronics/Speakers/Wi-Fi speakers,Cookware & tableware/Serveware/Trays,Storage & organization/Storage solution systems/PAX system/PAX doors without hinges,Pet accessories/Cats,Storage & organization/Wall shelves & hooks/Hooks,Home Décor/Flower pots & stands/Indoor plant pots,"Storage & organization/Wall shelves & hooks/Hooks/BRANDUR Hook, in-","Storage & organization/Wall shelves & hooks/Hooks/BRANDUR Hook, in-","Storage & organization/Wall shelves & hooks/Hooks/BRANDUR Rail with 4 hooks, in-","Storage & organization/Clothes organizers/Clothes racks & stands/TURBO Clothes rack, indoor",Home Décor/Candle holders & candles/Lanterns,"Laundry & cleaning/Drying racks/MULIG Drying rack, indoor",Storage & organization/Wall shelves & hooks/Hooks,Storage & organization/Clothes organizers/Clothes racks & stands,Storage & organization/Clothes organizers/Clothes racks & stands,Storage & organization/Storage containers/Bathroom accessories/Towel rails & towel holders,Storage & organization/Storage containers/Bathroom accessories/Towel rails & towel holders,Bathroom/Showers/Shower heads,Home Décor/Storage boxes & baskets/Baskets,Furniture/Tables & desks/Dining tables/Up to 4 seats,Furniture/Tables & desks/Bar tables,Furniture/Tables & desks/Café tables,Rugs/Rugs/Door mats,Storage & organization/Storage containers/Bins & bags/Trash cans & pedal bins,Storage & organization/Storage containers/Paper & media organizers/Desk accessories,Bathroom/Bathroom sinks,Bathroom/Bathroom sinks,Bathroom/Bathroom sinks,Bathroom/Bathroom sinks,Bathroom/Bathroom sinks,Furniture/Tables & desks/Accent tables/Coffee tables,Furniture/Tables & desks/Accent tables/Coffee tables,Lighting/Lamps & light fixtures/Kids lighting,Cookware & tableware/Coffee & tea/Mugs & cups,Cookware & tableware/Coffee & tea/Mugs & cups,Cookware & tableware/Dinnerware/Dinnerware sets,Cookware & tableware/Cookware & kitchenware/Cooking pans/Frying pans & skillets,"Home Textiles/Window treatments/Shades, blinds & window treatments/Black-out shades & blinds",Home Textiles/Window treatments/Curtains & drapes/Room darkening curtains & drapes,Furniture/Tables & desks/Dining tables/Dining table tops & underframes,Kitchen & appliances/Kitchen countertops/Laminate countertops,Kitchen & appliances/Kitchen countertops/Laminate countertops,Kitchen & appliances/Kitchen countertops/Laminate countertops,Kitchen & appliances/Kitchen countertops/Laminate countertops,Kitchen & appliances/Kitchen countertops/Laminate countertops,Storage & organization/TV & media furniture/TV stands & benches,Storage & organization/Wall shelves/Complete wall shelves/HEMNES Wall,Home Décor/Clocks/Alarm clocks,Home Décor/Clocks/Alarm clocks,Home Décor/Storage boxes & baskets/Kids boxes & baskets,Cookware & tableware/Dinnerware/Side plates,Cookware & tableware/Dinnerware/Plates,Cookware & tableware/Dinnerware/Bowls,Cookware & tableware/Coffee & tea/Mugs & cups,Home Décor/Mirrors/Vanity mirrors,Cookware & tableware/Cookware & kitchenware/Cooking pans/Woks,Kitchen & appliances/Kitchen systems/SEKTION kitchen/SEKTION kitchen cabinets,Kitchen & appliances/Kitchen systems/SEKTION kitchen/SEKTION kitchen cabinets,Kitchen & appliances/Kitchen systems/SEKTION kitchen/SEKTION kitchen cabinets,Furniture/Tables & desks/Nightstands,Storage & organization/Dressers & storage drawers/Chests of drawers,Storage & organization/Dressers & storage drawers/Chests of drawers,Furniture/Tables & desks/Dining tables/Up to 6 seats,Kitchen & appliances/Kitchen systems/SEKTION kitchen/SEKTION kitchen cabinets,Kitchen & appliances/Kitchen systems/SEKTION kitchen/SEKTION kitchen cabinets,Kitchen & appliances/Kitchen systems/SEKTION kitchen/SEKTION kitchen cabinets,Kitchen & appliances/Kitchen systems/SEKTION kitchen/SEKTION kitchen cabinets,Kitchen & appliances/Kitchen systems/SEKTION kitchen/SEKTION kitchen cabinets,Storage & organization/Armoires & wardrobes/Children's wardrobes,Furniture/Tables & desks/Changing tables/SMÅGÖRA Changing table,Storage & organization/Storage containers/Bathroom accessories/Towel rails & towel holders,Cookware & tableware/Serveware/Trays,Furniture/Tables & desks/Nightstands
Storage & organization/Display & storage cabinets/Display cabinets,Cookware & tableware/Cookware & kitchenware/Cooking pans/Grill pans & griddles,Storage & organization/Storage solution systems/PAX system/PAX Interior organizers,Storage & organization/Storage solution systems/PAX system/PAX Interior organizers,Storage & organization/Storage solution systems/OMAR system/All parts,Storage & organization/Storage solution systems/BESTÅ storage system/BESTÅ all parts & accessories,Home Décor/Mirrors/Mirror cabinets,Home Décor/Mirrors/Mirror cabinets,"Storage & organization/Shelving units, bookcases & storage options/Shelf units & cube storage",Kitchen & appliances/Kitchen drawer organization/Drawer dividers,Cookware & tableware/Knives & cutting boards/Sharpening tools,Kitchen & appliances/Kitchen systems/SEKTION kitchen/SEKTION kitchen cabinets,"Storage & organization/Shelving units, bookcases & storage options/Shelf units & cube storage","Storage & organization/Shelving units, bookcases & storage options/Shelf units & cube storage",Storage & organization/Clothes organizers/Shoe racks & stands,Storage & organization/Clothes organizers/Shoe racks & stands,Storage & organization/Storage containers/Food storage & organizing/Food containers,Storage & organization/Display & storage cabinets/Display cabinets,Storage & organization/Display & storage cabinets/Display cabinets,Storage & organization/TV & media furniture/TV stands & benches,Storage & organization/TV & media furniture/TV stands & benches,Cookware & tableware/Serveware/Trays,Cookware & tableware/Serveware/Trays,Cookware & tableware/Serveware/Trays,Storage & organization/Bags/Shopping bags & tote bags,Bathroom/Bathroom vanities/Vanity cabinets without sink,Storage & organization/Bags/Travel accessories,Storage & organization/Storage solution systems/BESTÅ storage system/BESTÅ all parts & accessories,"Home Décor/Storage boxes & baskets/Secondary storage boxes/SAMLA Lid for box, 12",Storage & organization/Storage solution systems/SMÅSTAD system/SMÅSTAD doors & drawers,Storage & organization/Storage solution systems/SMÅSTAD system/SMÅSTAD doors & drawers,Storage & organization/Storage containers/Food storage & organizing/Food containers,Home Décor/Storage boxes & baskets/Secondary storage boxes,Home Décor/Storage boxes & baskets/Paper & media boxes,Storage & organization/Storage containers/Paper & media organizers/Desk accessories,Home Décor/Storage boxes & baskets/Clothes boxes,Bathroom/Bathroom vanities/Bathroom vanity legs,Baby & kids/Kids/Kids storage & organization/Children's hooks & wall organization,Home electronics/Speakers/Bluetooth speakers,Kitchen & appliances/Kitchen drawer organization/Shelves & drawers,Cookware & tableware/Serveware/Trays,Home Décor/Storage boxes & baskets/Secondary storage boxes,Storage & organization/TV & media furniture/TV stands & benches,Kitchen & appliances/Kitchen systems/SEKTION kitchen/SEKTION kitchen cabinets,Storage & organization/Wall shelves/Shelves,Storage & organization/Wall shelves/Shelves,Furniture/Tables & desks/Desks & computer desks/Desks for home,Furniture/Tables & desks/Desks & computer desks/Desks for home,Furniture/Tables & desks/Desks & computer desks/Desks for home,Furniture/Tables & desks/Dining tables/Up to 4 seats,Furniture/Kids furniture/Kids chairs,Furniture/Patio furniture/Outdoor chairs/Outdoor dining chairs,Storage & organization/Wall shelves/Complete wall shelves,Home Décor/Noticeboards,Home Décor/Noticeboards,Home Décor/Noticeboards,Home Décor/Noticeboards,Home Décor/Noticeboards,Home Décor/Noticeboards,Home Décor/Noticeboards,Home Décor/Noticeboards,Home Décor/Noticeboards,Home Décor/Noticeboards,Home Décor/Noticeboards,Home Décor/Noticeboards,Home Décor/Noticeboards,Home Décor/Noticeboards,Home Décor/Noticeboards,Kitchen & appliances/Kitchen wall organization & storage/Kitchen shelves,Kitchen & appliances/Kitchen wall organization & storage/Kitchen shelves,Kitchen & appliances/Kitchen islands & carts,"Storage & organization/Shelving units, bookcases & storage options/Storage shelves & units",Furniture/Tables & desks/Console tables & sofa tables,"Storage & organization/Display & storage cabinets/Buffet tables, sideboard buffets & buffet cabinets",Kitchen & appliances/Kitchen systems/SUNNERSTA modular kitchen/Accessories for SUNNERSTA,Kitchen & appliances/Kitchen systems/SUNNERSTA modular kitchen/Accessories for SUNNERSTA,Kitchen & appliances/Kitchen wall organization & storage/Wall organizers,Kitchen & appliances/Kitchen wall organization & storage/Wall organizers,Kitchen & appliances/Kitchen systems/SUNNERSTA modular kitchen/Accessories for SUNNERSTA,Kitchen & appliances/Kitchen systems/SUNNERSTA modular kitchen/Accessories for SUNNERSTA,Kitchen & appliances/Kitchen systems/SUNNERSTA modular kitchen/Accessories for SUNNERSTA,Storage & organization/TV & media furniture/TV stands & benches,Home electronics/Cords & chargers/Wireless charging & accessories,Storage & organization/Storage containers/Food storage & organizing/Food containers,Furniture/Patio furniture/Outdoor tables/Outdoor dining tables,Storage & organization/Wall shelves & hooks/Hooks,Home improvement/Tools & hardware/Tools,Home electronics/Speakers/Wi-Fi speakers,Home electronics/Speakers/Wi-Fi speakers,Bathroom/Bathroom storage/Bathroom shelving units,Home electronics/Cords & chargers/Wireless charging & accessories,Home electronics/Cords & chargers/Wireless charging & accessories,"Storage & organization/Display & storage cabinets/Buffet tables, sideboard buffets & buffet cabinets",Storage & organization/Wall shelves & hooks/Hooks,Home electronics/Speakers/Bluetooth speakers,Home electronics/Speakers/Bluetooth speakers,Home electronics/Speakers/Bluetooth speakers,Home electronics/Speakers/Bluetooth speakers,Furniture/Kids furniture/Toy storage,Furniture/Kids furniture/Toy storage
