Furniture/Beds/Cribs,Furniture/Sofas & sectionals/Sofa legs,Furniture/Sofas & sectionals/Sofa legs,Furniture/Kids furniture/Kids chairs,Furniture/Chairs/Dining chairs/Dining chairs,Rugs/Rugs/Runners & small rugs,Storage & organization/Dressers & storage drawers/Chests of drawers,Storage & organization/Storage containers/Bins & bags/Trash cans & pedal bins,Storage & organization/Bags/Shopping bags & tote bags,Storage & organization/Bags/Backpacks & messenger bags,Storage & organization/Bags/Backpacks & messenger bags,Rugs/Rugs/Door mats,Beds & mattresses/Mattresses/Kids mattresses,Rugs/Rugs/Large & medium rugs,Furniture/Tables & desks/Dining tables/Dining table tops & underframes,Storage & organization/Dressers & storage drawers/Chests of drawers,Storage & organization/Dressers & storage drawers/Chests of drawers,Storage & organization/Dressers & storage drawers/Chests of drawers,Beds & mattresses/Mattresses/Kids mattresses,Furniture/Chairs/Dining chairs/Dining chairs,Furniture/Chairs/Café chairs,Furniture/Tables & desks/Nightstands,Home Décor/Wall décor/Picture & photo frames,Pet accessories/Cats,Cookware & tableware/Dishwashing accessories/Sink accessories,Storage & organization/Storage solution systems/PAX system/PAX Interior organizers,Storage & organization/Storage solution systems/PAX system/PAX Interior organizers,Furniture/Tables & desks/Dining tables/Up to 4 seats,Storage & organization/Storage containers/Clothes organizers/Hanging clothes organizers,Storage & organization/Storage solution systems/PAX system/PAX Interior organizers,Storage & organization/Storage solution systems/PAX system/PAX Interior organizers,Furniture/Chairs/Dining chairs/Dining chair underframes & seat shells,Furniture/Sofas & sectionals/Ottomans/Fabric ottomans,Home Décor/Wall décor/Picture & photo frames,Furniture/Sofas & sectionals/Sectionals/Sofa modules,Furniture/Tables & desks/Accent tables/Coffee tables,Furniture/Tables & desks/Accent tables/Coffee tables,Outdoor/Outdoor flooring,Cookware & tableware/Dishwashing accessories/Dish drainers & drying racks,Furniture/Chairs/Dining chairs/Upholstered chairs,Pet accessories/Cats,Furniture/Armchairs & chaises/Lounge chairs,Pet accessories/Cats,Furniture/Patio furniture/Outdoor tables/Outdoor dining tables,Furniture/Patio furniture/Outdoor chaises & hammocks,Furniture/Tables & desks/Dining tables/Up to 4 seats,Storage & organization/Bags/Travel accessories,Storage & organization/Bags/Shopping bags & tote bags,Furniture/Beds/Cribs,Furniture/Armchairs & chaises/Fabric armchairs,Furniture/Armchairs & chaises/Kids armchairs,Furniture/Beds/Kids beds/Junior & extendable beds,Furniture/Beds/Bed legs,Storage & organization/Storage containers/Clothes organizers/Hanging clothes organizers,Furniture/Armchairs & chaises/Coated fabric armchairs,Storage & organization/Bags/Shopping bags & tote bags,Furniture/Tables & desks/Changing tables,Furniture/Armchairs & chaises/Fabric armchairs,Home Décor/Storage boxes & baskets/Secondary storage boxes,Furniture/Patio furniture/Outdoor sofa sections,Furniture/Patio furniture/Outdoor sofa sections,Furniture/Patio furniture/Outdoor tables/Outdoor coffee & side tables,Furniture/Patio furniture/Outdoor sofa sections,Furniture/Chairs/Desk chairs/Desk chairs for home,Kitchen & appliances/Kitchen systems/SEKTION kitchen/SEKTION kitchen cabinets,Furniture/Kids furniture/Kids chairs,Furniture/Chairs/Dining chairs/Dining chairs,Storage & organization/Storage containers/Paper & media organizers/Desk accessories,Storage & organization/Storage containers/Bathroom accessories/Towel rails & towel holders,Laundry & cleaning/Cleaning accessories,Furniture/Tables & desks/Accent tables/Coffee tables,Storage & organization/Storage containers/Hooks & hangers/Hangers,Home Décor/Storage boxes & baskets/Baskets,Storage & organization/Armoires & wardrobes/Solitaire wardrobes,Storage & organization/Armoires & wardrobes/Solitaire wardrobes,Storage & organization/Armoires & wardrobes/Solitaire wardrobes,Cookware & tableware/Serveware/Trays,Storage & organization/Storage containers/Bathroom accessories/Towel rails & towel holders,Furniture/Tables & desks/Kids tables,Furniture/Chairs/Dining chairs/Folding chairs,Furniture/Patio furniture/Outdoor chairs/Outdoor dining chairs,Home Décor/Wall décor/Picture & photo frames,Home Décor/Wall décor/Picture & photo frames,Furniture/Patio furniture/Outdoor chairs/Outdoor dining chairs,Laundry & cleaning/Laundry baskets,Furniture/Chairs/Stools & benches/Stools,Furniture/Patio furniture/Outdoor tables/Outdoor dining tables,Storage & organization/Storage containers/Bathroom accessories/Towel rails & towel holders,Storage & organization/Wall shelves & hooks/Hooks,Cookware & tableware/Table linen/Place mats & coasters,Storage & organization/Armoires & wardrobes/Solitaire wardrobes,Furniture/Tables & desks/Accent tables/Coffee tables,Laundry & cleaning/Ironing boards,Furniture/Chairs/Dining chairs/Dining chairs,Furniture/Chairs/Dining chairs/Upholstered chairs,Furniture/Chairs/Bar stools & chairs,Furniture/Chairs/Dining chairs/Dining chairs,Home Décor/Storage boxes & baskets/Baskets,"Storage & organization/Shelving units, bookcases & storage options/Storage shelves & units",Storage & organization/Storage containers/Food storage & organizing/Food containers
Storage & organization/Storage solution systems/IVAR system/All parts,Furniture/Tables & desks/Accent tables/End tables & side tables,Cookware & tableware/Serveware/Trays,Kitchen & appliances/Kitchen islands & carts,Home Décor/Noticeboards,Home Décor/Noticeboards,Home Décor/Noticeboards,Home Décor/Noticeboards,Home Décor/Noticeboards,Home Décor/Noticeboards,Kitchen & appliances/Kitchen systems/SEKTION kitchen/SEKTION kitchen cabinets,Home Décor/Noticeboards,Home Décor/Noticeboards,Storage & organization/Wall shelves/Brackets,Home Décor/Noticeboards,Home Décor/Noticeboards,Home Décor/Noticeboards,Home Décor/Noticeboards,Home Décor/Noticeboards,Home Décor/Noticeboards,Cookware & tableware/Serveware/Trays,"Storage & organization/Display & storage cabinets/Buffet tables, sideboard buffets & buffet cabinets",Home Décor/Storage boxes & baskets/Kids boxes & baskets,Baby & kids/Kids/Kids storage & organization/Children's hooks & wall organization,"Storage & organization/Shelving units, bookcases & storage options/Storage shelves & units","Storage & organization/Display & storage cabinets/Buffet tables, sideboard buffets & buffet cabinets",Storage & organization/Storage solution systems/IVAR system/All parts,Cookware & tableware/Knives & cutting boards/Sharpening tools,Furniture/Tables & desks/Accent tables/End tables & side tables,Storage & organization/Wall shelves & hooks/Hooks,Storage & organization/Clothes organizers/Shoe racks & stands,Storage & organization/Storage containers/Paper & media organizers/Desk accessories,Storage & organization/Storage containers/Food storage & organizing/Food containers,Furniture/Tables & desks/Desks & computer desks/Desks for home,Storage & organization/Wall shelves/Brackets,Storage & organization/Wall shelves/Brackets,"Storage & organization/Shelving units, bookcases & storage options/Storage shelves & units",Kitchen & appliances/Kitchen systems/SEKTION kitchen/SEKTION kitchen cabinets,Storage & organization/TV & media furniture/TV stands & benches,Storage & organization/TV & media furniture/TV stands & benches,Baby & kids/Kids/Toys & play/Arts & crafts,Storage & organization/Storage solution systems/BESTÅ storage system/BESTÅ all parts & accessories,Storage & organization/TV & media furniture/TV stands & benches,Storage & organization/Storage containers/Cable management & accessories,"Storage & organization/Shelving units, bookcases & storage options/Shelf units & cube storage",Kitchen & appliances/Kitchen islands & carts,Kitchen & appliances/Kitchen islands & carts,Home Décor/Storage boxes & baskets/Secondary storage boxes,Storage & organization/TV & media furniture/TV stands & benches,Kitchen & appliances/Kitchen islands & carts,Storage & organization/Storage solution systems/BESTÅ storage system/BESTÅ all parts & accessories,Furniture/Tables & desks/Desks & computer desks/Desks for home,Storage & organization/Storage solution systems/BOAXEL system/BOAXEL parts,Home Décor/Storage boxes & baskets/Secondary storage boxes,Storage & organization/Storage solution systems/IVAR system/All parts,Kitchen & appliances/Kitchen islands & carts,Cookware & tableware/Serveware/Trays,Laundry & cleaning/Ironing boards,Storage & organization/Storage solution systems/IVAR system/All parts,Home Décor/Noticeboards,Kitchen & appliances/Kitchen islands & carts,Storage & organization/Storage solution systems/IVAR system/All parts,Storage & organization/Storage solution systems/IVAR system/All parts,Kitchen & appliances/Kitchen systems/SUNNERSTA modular kitchen/Accessories for SUNNERSTA,Kitchen & appliances/Kitchen wall organization & storage/Wall organizers,Kitchen & appliances/Kitchen systems/SUNNERSTA modular kitchen/Accessories for SUNNERSTA,Kitchen & appliances/Kitchen systems/SUNNERSTA modular kitchen/Accessories for SUNNERSTA,Kitchen & appliances/Kitchen systems/SUNNERSTA modular kitchen/Accessories for SUNNERSTA,Kitchen & appliances/Kitchen systems/SUNNERSTA modular kitchen/Accessories for SUNNERSTA,Kitchen & appliances/Kitchen islands & carts,Home electronics/Speakers/Wi-Fi speakers,Storage & organization/Storage solution systems/IVAR system/All parts,Storage & organization/Display & storage cabinets/Dining room cabinets & cupboards,Storage & organization/Storage solution systems/IVAR system/All parts,Storage & organization/Storage solution systems/IVAR system/All parts,Storage & organization/Storage solution systems/IVAR system/All parts,"Storage & organization/Storage solution systems/ELVARLI system/Post, side units & interiors",Storage & organization/Storage containers/Paper & media organizers/Desk accessories,"Storage & organization/Storage solution systems/ELVARLI system/Post, side units & interiors",Storage & organization/Storage solution systems/IVAR system/All parts,Storage & organization/Storage solution systems/IVAR system/All parts,Storage & organization/Storage solution systems/IVAR system/All parts,Storage & organization/Storage solution systems/IVAR system/All parts,Storage & organization/Storage solution systems/IVAR system/All parts,Kitchen & appliances/Kitchen wall organization & storage/Wall organizers,Storage & organization/Storage solution systems/IVAR system/All parts,Storage & organization/Storage solution systems/IVAR system/All parts,Storage & organization/Storage solution systems/IVAR system/All parts,Storage & organization/Wall shelves/Complete wall shelves/LIATORP Wall,Storage & organization/Storage solution systems/IVAR system/All parts,Storage & organization/Display & storage cabinets/Dining room cabinets & cupboards,Storage & organization/Storage solution systems/IVAR system/All parts,Storage & organization/Display & storage cabinets/Dining room cabinets & cupboards,Home Décor/Wall décor/Picture ledges,Storage & organization/Storage solution systems/IVAR system/All parts,"Storage & organization/Shelving units, bookcases & storage options/Shelf units & cube storage",Storage & organization/Storage solution systems/BESTÅ storage system/BESTÅ all parts & accessories,Storage & organization/Wall shelves & hooks/Hooks,Home improvement/Home safety/Child safety,Furniture/Tables & desks/Table & desk systems/GALANT/BEKANT system/BEKANT desk underframes
Storage & organization/Clothes organizers/Clothes racks & stands,Storage & organization/Dressers & storage drawers/Drawer units/Drawer units for home,Furniture/Patio furniture/Outdoor tables/Outdoor dining tables,Furniture/Tables & desks/Accent tables/Coffee tables,Storage & organization/Dressers & storage drawers/Drawer units/Drawer units for home,Storage & organization/Clothes organizers/Shoe racks & stands,Home Décor/Wall décor/Collage picture frames,Rugs/Rugs/Runners & small rugs,Home Décor/Wall décor/Art cards,Storage & organization/Storage containers/Food storage & organizing/Food containers,Furniture/Tables & desks/Dining tables/Dining table tops & underframes,Storage & organization/Storage containers/Paper & media organizers/Desk accessories,Kitchen & appliances/Kitchen islands & carts,Rugs/Rugs/Runners & small rugs,Furniture/Tables & desks/Desks & computer desks/Desks for home,Home electronics/Cords & chargers/Cables & accessories,Storage & organization/Dressers & storage drawers/Drawer units/Drawer units for home,"Storage & organization/Shelving units, bookcases & storage options/Shelf units & cube storage",Storage & organization/Dressers & storage drawers/Drawer units/Drawer units for home,Home Décor/Storage boxes & baskets/Kids boxes & baskets,Kitchen & appliances/Kitchen countertops/Butcher block countertops,Cookware & tableware/Kitchen textiles/Aprons,Home Décor/Storage boxes & baskets/Kids boxes & baskets,Storage & organization/Dressers & storage drawers/Drawer units/Drawer units for home,Furniture/Tables & desks/Kids tables,Furniture/Sofas & sectionals/Sofa accessories,Home Décor/Storage boxes & baskets/Kids boxes & baskets,Storage & organization/Storage solution systems/BESTÅ storage system/BESTÅ all parts & accessories,Storage & organization/Dressers & storage drawers/Chests of drawers,Kitchen & appliances/Kitchen systems/SEKTION kitchen/SEKTION kitchen cabinets/Cabinet doors & drawer fronts,Kitchen & appliances/Kitchen systems/SEKTION kitchen/SEKTION kitchen cabinets,Kitchen & appliances/Kitchen systems/SEKTION kitchen/SEKTION kitchen cabinets,Bathroom/Showers/Shower heads,Home Décor/Storage boxes & baskets/Baskets,Home Décor/Mirrors/Makeup & magnifying mirrors,Kitchen & appliances/Kitchen countertops/Butcher block countertops,Storage & organization/Storage containers/Paper & media organizers/Desk accessories,Home Décor/Wall décor/Picture & photo frames,Home Décor/Wall décor/Picture & photo frames,Home Décor/Storage boxes & baskets/Clothes boxes,Furniture/Patio furniture/Outdoor tables/Outdoor coffee & side tables,Storage & organization/Storage solution systems/PAX system/PAX doors without hinges,Storage & organization/Storage solution systems/PAX system/PAX doors without hinges,"Storage & organization/Shelving units, bookcases & storage options/Shelf units & cube storage",Storage & organization/Storage solution systems/PAX system/PAX doors without hinges,Kitchen & appliances/Kitchen countertops/Butcher block countertops,Storage & organization/Storage containers/Bins & bags/Trash cans & pedal bins,Home Textiles/Window treatments/Curtains & drapes/Room darkening curtains & drapes,Kitchen & appliances/Kitchen countertops/Butcher block countertops,Home Décor/Wall décor/Wall decals & stickers,Home Décor/Decorative accessories,Home Textiles/Window treatments/Curtain rods & rails/Curtain rods,Cookware & tableware/Dinnerware/Dinnerware sets,Home Textiles/Window treatments/Curtain rods & rails/Curtain rods,Storage & organization/Wall shelves & hooks/Hooks,Storage & organization/Storage solution systems/PAX system/PAX doors without hinges,Cookware & tableware/Coffee & tea/Mugs & cups,Cookware & tableware/Coffee & tea/Mugs & cups,Furniture/Tables & desks/Dining tables/Dining table tops & underframes,Kitchen & appliances/Kitchen drawer organization/Kitchen trash cans & bins,Furniture/Tables & desks/Accent tables/End tables & side tables,Outdoor/Outdoor flooring,Kitchen & appliances/Kitchen countertops/Butcher block countertops,Furniture/Sofas & sectionals/Ottomans/Fabric ottomans,Furniture/Chairs/Desk chairs/Desk chairs for home,Home Décor/Storage boxes & baskets/Secondary storage boxes,Home electronics/Cords & chargers/Cables & accessories,Cookware & tableware/Dinnerware/Deep plates/VÄRDERA Deep plate,Outdoor/Outdoor flooring,Home Décor/Mirrors/Vanity mirrors,Kitchen & appliances/Kitchen countertops/Butcher block countertops,Kitchen & appliances/Kitchen systems/SEKTION kitchen/SEKTION kitchen cabinets,Baby & kids/Kids/Toys & play/Arts & crafts,Home Décor/Wall décor/Picture & photo frames,Home Décor/Wall décor/Picture & photo frames,Kitchen & appliances/Kitchen systems/SEKTION kitchen/SEKTION kitchen cabinets,Kitchen & appliances/Kitchen systems/SEKTION kitchen/SEKTION kitchen cabinets,Bathroom/Bathroom storage/Bathroom shelving units,Furniture/Tables & desks/Dining tables/Up to 10 seats,Kitchen & appliances/Kitchen systems/SEKTION kitchen/SEKTION kitchen cabinets,Kitchen & appliances/Kitchen systems/SEKTION kitchen/SEKTION kitchen cabinets,Storage & organization/Wall shelves/Complete wall shelves/HEMNES Wall,Cookware & tableware/Dinnerware/Dinnerware sets,Furniture/Patio furniture/Outdoor tables/Outdoor dining tables,Furniture/Chairs/Dining chairs/Dining chairs,Furniture/Tables & desks/Accent tables/End tables & side tables,Bathroom/Bathroom storage/Bathroom shelving units,Home Décor/Wall décor/Picture & photo frames,Furniture/Tables & desks/Makeup vanities & dressing tables,Storage & organization/TV & media furniture/TV stands & benches,Furniture/Patio furniture/Outdoor tables/Outdoor dining tables,Storage & organization/Wall shelves & hooks/Hooks,Outdoor/Outdoor flooring,Kitchen & appliances/Kitchen drawer organization/Drawer dividers,Furniture/Tables & desks/Dining tables/Up to 4 seats,Bathroom/Bathroom storage/Bathroom storage/Bathroom tall cabinets,Furniture/Beds/Cribs,Kitchen & appliances/Kitchen countertops/Laminate countertops,Home improvement/Home safety/Child safety,Furniture/Tables & desks/Accent tables/End tables & side tables
Storage & organization/Clothes organizers/Clothes racks & stands,Storage & organization/Dressers & storage drawers/Drawer units/Drawer units for home,Furniture/Patio furniture/Outdoor tables/Outdoor dining tables,Furniture/Tables & desks/Accent tables/Coffee tables,Storage & organization/Dressers & storage drawers/Drawer units/Drawer units for home,Storage & organization/Clothes organizers/Shoe racks & stands,Home Décor/Wall décor/Collage picture frames,Rugs/Rugs/Runners & small rugs,Home Décor/Wall décor/Art cards,Storage & organization/Storage containers/Food storage & organizing/Food containers,Furniture/Tables & desks/Dining tables/Dining table tops & underframes,Storage & organization/Storage containers/Paper & media organizers/Desk accessories,Kitchen & appliances/Kitchen islands & carts,Rugs/Rugs/Runners & small rugs,Furniture/Tables & desks/Desks & computer desks/Desks for home,Home electronics/Cords & chargers/Cables & accessories,Storage & organization/Dressers & storage drawers/Drawer units/Drawer units for home,"Storage & organization/Shelving units, bookcases & storage options/Shelf units & cube storage",Storage & organization/Dressers & storage drawers/Drawer units/Drawer units for home,Home Décor/Storage boxes & baskets/Kids boxes & baskets,Kitchen & appliances/Kitchen countertops/Butcher block countertops,Cookware & tableware/Kitchen textiles/Aprons,Home Décor/Storage boxes & baskets/Kids boxes & baskets,Storage & organization/Dressers & storage drawers/Drawer units/Drawer units for home,Furniture/Tables & desks/Kids tables,Furniture/Sofas & sectionals/Sofa accessories,Home Décor/Storage boxes & baskets/Kids boxes & baskets,Storage & organization/Storage solution systems/BESTÅ storage system/BESTÅ all parts & accessories,Storage & organization/Dressers & storage drawers/Chests of drawers,Kitchen & appliances/Kitchen systems/SEKTION kitchen/SEKTION kitchen cabinets/Cabinet doors & drawer fronts,Kitchen & appliances/Kitchen systems/SEKTION kitchen/SEKTION kitchen cabinets,Kitchen & appliances/Kitchen systems/SEKTION kitchen/SEKTION kitchen cabinets,Bathroom/Showers/Shower heads,Home Décor/Storage boxes & baskets/Baskets,Home Décor/Mirrors/Makeup & magnifying mirrors,Kitchen & appliances/Kitchen countertops/Butcher block countertops,Storage & organization/Storage containers/Paper & media organizers/Desk accessories,Home Décor/Wall décor/Picture & photo frames,Home Décor/Wall décor/Picture & photo frames,Home Décor/Storage boxes & baskets/Clothes boxes,Furniture/Patio furniture/Outdoor tables/Outdoor coffee & side tables,Storage & organization/Storage solution systems/PAX system/PAX doors without hinges,Storage & organization/Storage solution systems/PAX system/PAX doors without hinges,"Storage & organization/Shelving units, bookcases & storage options/Shelf units & cube storage",Storage & organization/Storage solution systems/PAX system/PAX doors without hinges,Kitchen & appliances/Kitchen countertops/Butcher block countertops,Storage & organization/Storage containers/Bins & bags/Trash cans & pedal bins,Home Textiles/Window treatments/Curtains & drapes/Room darkening curtains & drapes,Kitchen & appliances/Kitchen countertops/Butcher block countertops,Home Décor/Wall décor/Wall decals & stickers,Home Décor/Decorative accessories,Home Textiles/Window treatments/Curtain rods & rails/Curtain rods,Cookware & tableware/Dinnerware/Dinnerware sets,Home Textiles/Window treatments/Curtain rods & rails/Curtain rods,Storage & organization/Wall shelves & hooks/Hooks,Storage & organization/Storage solution systems/PAX system/PAX doors without hinges,Cookware & tableware/Coffee & tea/Mugs & cups,Cookware & tableware/Coffee & tea/Mugs & cups,Furniture/Tables & desks/Dining tables/Dining table tops & underframes,Kitchen & appliances/Kitchen drawer organization/Kitchen trash cans & bins,Furniture/Tables & desks/Accent tables/End tables & side tables,Outdoor/Outdoor flooring,Kitchen & appliances/Kitchen countertops/Butcher block countertops,Furniture/Sofas & sectionals/Ottomans/Fabric ottomans,Furniture/Chairs/Desk chairs/Desk chairs for home,Home Décor/Storage boxes & baskets/Secondary storage boxes,Home electronics/Cords & chargers/Cables & accessories,Cookware & tableware/Dinnerware/Deep plates/VÄRDERA Deep plate,Outdoor/Outdoor flooring,Home Décor/Mirrors/Vanity mirrors,Kitchen & appliances/Kitchen countertops/Butcher block countertops,Kitchen & appliances/Kitchen systems/SEKTION kitchen/SEKTION kitchen cabinets,Baby & kids/Kids/Toys & play/Arts & crafts,Home Décor/Wall décor/Picture & photo frames,Home Décor/Wall décor/Picture & photo frames,Kitchen & appliances/Kitchen systems/SEKTION kitchen/SEKTION kitchen cabinets,Kitchen & appliances/Kitchen systems/SEKTION kitchen/SEKTION kitchen cabinets,Bathroom/Bathroom storage/Bathroom shelving units,Furniture/Tables & desks/Dining tables/Up to 10 seats,Kitchen & appliances/Kitchen systems/SEKTION kitchen/SEKTION kitchen cabinets,Kitchen & appliances/Kitchen systems/SEKTION kitchen/SEKTION kitchen cabinets,Storage & organization/Wall shelves/Complete wall shelves/HEMNES Wall,Cookware & tableware/Dinnerware/Dinnerware sets,Furniture/Patio furniture/Outdoor tables/Outdoor dining tables,Furniture/Chairs/Dining chairs/Dining chairs,Furniture/Tables & desks/Accent tables/End tables & side tables,Bathroom/Bathroom storage/Bathroom shelving units,Home Décor/Wall décor/Picture & photo frames,Furniture/Tables & desks/Makeup vanities & dressing tables,Storage & organization/TV & media furniture/TV stands & benches,Furniture/Patio furniture/Outdoor tables/Outdoor dining tables,Storage & organization/Wall shelves & hooks/Hooks,Outdoor/Outdoor flooring,Kitchen & appliances/Kitchen drawer organization/Drawer dividers,Furniture/Tables & desks/Dining tables/Up to 4 seats,Bathroom/Bathroom storage/Bathroom storage/Bathroom tall cabinets,Furniture/Beds/Cribs,Kitchen & appliances/Kitchen countertops/Laminate countertops,Home improvement/Home safety/Child safety,Furniture/Tables & desks/Accent tables/End tables & side tables
