Baby & kids/Baby/Baby textiles/Baby sleeping bags,Baby & kids/Baby/Baby textiles/Baby sleeping bags,Baby & kids/Baby/Baby textiles/Baby sleeping bags,Baby & kids/Baby/Baby textiles/Baby towels & washcloths,Baby & kids/Baby/Baby textiles/Baby blankets & quilts,Beds & mattresses/Bedding/Cushions & cushions covers/Children's cushions & blankets,Baby & kids/Baby/Baby textiles/Baby blankets & quilts,Beds & mattresses/Bedding/Bedlinen/Duvet cover sets,Beds & mattresses/Bedding/Cushions & cushions covers/Cushion covers,Furniture/Sofas & sectionals/Fabric sofas/Modular fabric sofas,Furniture/Sofas & sectionals/Sofa & armchairs covers/HÄRLANDA covers,Furniture/Sofas & sectionals/Sofa & armchairs covers/HÄRLANDA covers,Bathroom/Bathroom textiles/Towels/Wash cloths,Bathroom/Bathroom textiles/Towels/Hand towels,Bathroom/Bathroom textiles/Towels/Bath towels,Bathroom/Bathroom textiles/Towels/Bath sheets,Furniture/Sofas & sectionals/Sofa & armchairs covers/SÖDERHAMN covers,Furniture/Sofas & sectionals/Sofa & armchairs covers/SÖDERHAMN covers,Furniture/Sofas & sectionals/Sofa & armchairs covers/SÖDERHAMN covers,Beds & mattresses/Bedding/Blankets & throws,Beds & mattresses/Bedding/Cushions & cushions covers/Cushion covers,Beds & mattresses/Bedding/Cushions & cushions covers/Cushion covers,Beds & mattresses/Bedding/Cushions & cushions covers/Cushion covers,Beds & mattresses/Bedding/Cushions & cushions covers/Cushion covers,Beds & mattresses/Bedding/Bedlinen/Baby bed linen,Beds & mattresses/Bedding/Bedlinen/Kids bed linen,Beds & mattresses/Bedding/Pillows/Down & feather pillows,Beds & mattresses/Bedding/Bedlinen/Duvet cover sets,Beds & mattresses/Bedding/Bedlinen/Duvet cover sets,Beds & mattresses/Bedding/Blankets & throws,Outdoor/Umbrellas & gazebos/Patio umbrellas & bases,Outdoor/Umbrellas & gazebos/Patio umbrellas & bases,Outdoor/Umbrellas & gazebos/Patio umbrellas & bases,Beds & mattresses/Bedding/Bedlinen/Pillowcases,Beds & mattresses/Bedding/Bedlinen/Baby bed linen,Beds & mattresses/Bedding/Bedlinen/Baby bed linen,Beds & mattresses/Bedding/Bedlinen/Baby bed linen,Beds & mattresses/Bedding/Bedlinen/Baby bed linen,Beds & mattresses/Bedding/Bedlinen/Baby bed linen,Beds & mattresses/Bedding/Cushions & cushions covers/Cushions,Beds & mattresses/Bedding/Bedlinen/Duvet cover sets,Beds & mattresses/Bedding/Bedlinen/Duvet cover sets,Beds & mattresses/Bedding/Bedlinen/Duvet cover sets,Baby & kids/Kids/Toys & play/Soft toys,Beds & mattresses/Bedding/Cushions & cushions covers/Cushions,Beds & mattresses/Bedding/Cushions & cushions covers/Cushion covers,Beds & mattresses/Bedding/Bedlinen/Duvet cover sets,Bathroom/Bathroom textiles/Towels/Hand towels,Bathroom/Bathroom textiles/Towels/Wash cloths,Bathroom/Bathroom textiles/Towels/Bath towels,Beds & mattresses/Bedding/Comforters/Down & feather comforters,Beds & mattresses/Bedding/Comforters/Down & feather comforters,Beds & mattresses/Bedding/Comforters/Down & feather comforters,"Baby & kids/Baby/Changing, bathing & potty/Changing accessories",Outdoor/Umbrellas & gazebos/Patio umbrellas & bases,Rugs/Rugs/Runners & small rugs,Beds & mattresses/Bedding/Bedlinen/Kids bed linen,Beds & mattresses/Bedding/Bedlinen/Pillowcases,Rugs/Bath mats,Beds & mattresses/Bedding/Cushions & cushions covers/Cushions,Beds & mattresses/Bedding/Cushions & cushions covers/Inner cushions,Beds & mattresses/Bedding/Cushions & cushions covers/Inner cushions,Beds & mattresses/Bedding/Cushions & cushions covers/Inner cushions,Furniture/Sofas & sectionals/Sofa & armchairs covers/FÄRLÖV covers,Rugs/Bath mats,Bathroom/Bathroom textiles/Shower curtains,Beds & mattresses/Bedding/Bedlinen/Duvet cover sets,Beds & mattresses/Bedding/Bedlinen/Kids bed linen,Beds & mattresses/Bedding/Bedlinen/Kids bed linen,Beds & mattresses/Bedding/Bedlinen/Kids bed linen,Beds & mattresses/Bedding/Bedlinen/Kids bed linen,Beds & mattresses/Bedding/Bedlinen/Kids bed linen,Beds & mattresses/Bedding/Bedlinen/Baby bed linen,Beds & mattresses/Bedding/Bedlinen/Kids bed linen,Beds & mattresses/Bedding/Bedlinen/Kids bed linen,Beds & mattresses/Bedding/Bedlinen/Kids bed linen,Beds & mattresses/Bedding/Bedlinen/Baby bed linen,Beds & mattresses/Bedding/Bedlinen/Kids bed linen,Beds & mattresses/Bedding/Blankets & throws,Beds & mattresses/Bedding/Cushions & cushions covers/Cushion covers,Beds & mattresses/Bedding/Cushions & cushions covers/Cushion covers,Furniture/Armchairs & chaises/Kids armchairs,Beds & mattresses/Bedding/Bedspreads,Beds & mattresses/Bedding/Bedlinen/Baby bed linen,Beds & mattresses/Bedding/Bedlinen/Duvet cover sets,Beds & mattresses/Bedding/Cushions & cushions covers/Cushion covers,Beds & mattresses/Bedding/Cushions & cushions covers/Cushion covers,Beds & mattresses/Bedding/Bedlinen/Pillowcases,Beds & mattresses/Bedding/Cushions & cushions covers/Cushion covers,Home Textiles/Window treatments/Curtains & drapes/Light filtering curtains,Beds & mattresses/Bedding/Cushions & cushions covers/Cushion covers,Furniture/Tables & desks/Changing tables,Furniture/Sofas & sectionals/Sofa & armchairs covers/FÄRLÖV covers,Furniture/Sofas & sectionals/Sofa & armchairs covers/FÄRLÖV covers,Furniture/Sofas & sectionals/Sofa & armchairs covers/FÄRLÖV covers,Furniture/Sofas & sectionals/Sofa & armchairs covers/FÄRLÖV covers,Baby & kids/Baby/Baby textiles/Baby towels & washcloths,Rugs/Rugs/Runners & small rugs,Beds & mattresses/Bedding/Bedspreads,Beds & mattresses/Bedding/Cushions & cushions covers/Cushion covers
Home Décor/Plants & flowers/House plants,Home Décor/Plants & flowers/House plants,Home Décor/Plants & flowers/House plants,Home Décor/Plants & flowers/House plants,Home Décor/Plants & flowers/House plants,Home Décor/Plants & flowers/House plants,Home Décor/Plants & flowers/House plants,Home Décor/Plants & flowers/House plants,Home Décor/Flower pots & stands/Indoor plant pots,Home Décor/Plants & flowers/House plants,Home Décor/Plants & flowers/House plants,Home Décor/Plants & flowers/House plants,Home Décor/Plants & flowers/House plants,Home Décor/Plants & flowers/House plants,Home Décor/Plants & flowers/House plants,Home Décor/Plants & flowers/House plants,Home Décor/Plants & flowers/House plants,Home Décor/Plants & flowers/House plants,Home Décor/Plants & flowers/House plants,Home Décor/Plants & flowers/House plants,Home Décor/Plants & flowers/House plants,Home Décor/Plants & flowers/House plants,Home Décor/Plants & flowers/House plants,Home Décor/Plants & flowers/House plants,Home Décor/Plants & flowers/House plants,Home Décor/Plants & flowers/House plants,Home Décor/Plants & flowers/House plants,Home Décor/Plants & flowers/House plants,Home Décor/Plants & flowers/House plants,Home Décor/Plants & flowers/House plants,Home Décor/Flower pots & stands/Indoor plant pots,"Lighting/Lamps & light fixtures/Shades, bases & cords/Lamp shades",Lighting/Lamps & light fixtures/Table lamps,Lighting/Lamps & light fixtures/Table lamps,Lighting/Lamps & light fixtures/Table lamps,Lighting/Lamps & light fixtures/Wall lamps/Wall lamps,Home Décor/Decorative accessories,Home Décor/Vases & bowls/Bowls & dishes,Home Décor/Vases & bowls/Bowls & dishes,Cookware & tableware/Drinkware/Specialty glassware,Home Décor/Candle holders & candles/Candle holders,Lighting/Lamps & light fixtures/Table lamps,Home Décor/Decorative accessories,Home Décor/Flower pots & stands/Indoor plant pots,Home Décor/Flower pots & stands/Indoor plant pots,Lighting/Lamps & light fixtures/Kids lighting,Lighting/LED Light bulbs,Lighting/LED Light bulbs,Lighting/LED Light bulbs,Lighting/LED Light bulbs,Lighting/LED Light bulbs,Lighting/LED Light bulbs,Lighting/LED Light bulbs,Lighting/LED Light bulbs,Lighting/LED Light bulbs,Lighting/LED Light bulbs,Home Décor/Candle holders & candles/Candle holders,Lighting/Decorative lighting/Decorative indoor lighting,Lighting/Lamps & light fixtures/Ceiling lights/Pendants lights,Lighting/Lamps & light fixtures/Wall lamps/Wall lamps,Lighting/Lamps & light fixtures/Wall lamps/Wall lamps,Home Décor/Decorative accessories,Home Décor/Decorative accessories,Home Décor/Candle holders & candles/Lanterns/GLIMRANDE Lantern f,Home electronics/Cords & chargers/Cables & accessories,"Lighting/Lamps & light fixtures/Shades, bases & cords/Lamp bases & cords","Lighting/Lamps & light fixtures/Shades, bases & cords/Lamp bases & cords","Lighting/Lamps & light fixtures/Shades, bases & cords/Lamp bases & cords",Lighting/Decorative lighting/Decorative indoor lighting,Lighting/Decorative lighting/Decorative indoor lighting,Lighting/Decorative lighting/Decorative outdoor lighting/SKINA LED string light w,Lighting/Decorative lighting/Decorative indoor lighting,Lighting/Lamps & light fixtures/Ceiling lights/Ceiling lamps,Lighting/Smart lighting/Smart LED light bulbs,Lighting/Smart lighting/Smart LED light bulbs,Lighting/Lamps & light fixtures/Ceiling lights/Pendants lights,"Lighting/Lamps & light fixtures/Shades, bases & cords/Lamp shades","Lighting/Lamps & light fixtures/Shades, bases & cords/Lamp shades","Lighting/Lamps & light fixtures/Shades, bases & cords/Lamp shades",Home Décor/Decorative accessories,Lighting/Lamps & light fixtures/Ceiling lights/Pendants lights,Lighting/LED Light bulbs,Lighting/Smart lighting/Smart LED light bulbs,Lighting/LED Light bulbs,Lighting/LED Light bulbs,Lighting/LED Light bulbs,Lighting/LED Light bulbs,Lighting/LED Light bulbs,Lighting/Lamps & light fixtures/Wall lamps/Wall lamps,Lighting/Lamps & light fixtures/Ceiling lights/Ceiling lamps,Home Décor/Candle holders & candles/Candle holders,Lighting/Lamps & light fixtures/Kids lighting,Lighting/Lamps & light fixtures/Kids lighting,Lighting/Decorative lighting/Decorative indoor lighting,Lighting/Lamps & light fixtures/Wall lamps/Wall lamps,Lighting/Lamps & light fixtures/Ceiling lights/Pendants lights,Lighting/Lamps & light fixtures/Table lamps,Lighting/Lamps & light fixtures/Ceiling lights/Ceiling lamps,Lighting/Lamps & light fixtures/Wall lamps/Wall lamps,Lighting/Lamps & light fixtures/Table lamps
Lighting/Lamps & light fixtures/Wall lamps/Wall lamps,Lighting/Lamps & light fixtures/Table lamps/SIMRISHAMN Table,Lighting/Lamps & light fixtures/Wall lamps/Wall lamps,Lighting/Lamps & light fixtures/Table lamps,Lighting/Lamps & light fixtures/Ceiling lights/Pendants lights,Lighting/Lamps & light fixtures/Ceiling lights/Pendants lights,Lighting/Lamps & light fixtures/Floor lamps,Home Décor/Candle holders & candles/Candle holders,Lighting/Lamps & light fixtures/Floor lamps,Lighting/Lamps & light fixtures/Floor lamps,Cookware & tableware/Drinkware/Wine & champagne glasses,Cookware & tableware/Drinkware/Wine & champagne glasses,Cookware & tableware/Drinkware/Wine & champagne glasses,Cookware & tableware/Drinkware/Specialty glassware,Cookware & tableware/Drinkware/Glasses,Cookware & tableware/Drinkware/Wine & champagne glasses,Cookware & tableware/Drinkware/Specialty glassware,Home Décor/Flower pots & stands/Indoor plant pots,Cookware & tableware/Drinkware/Glasses,Lighting/Lamps & light fixtures/Ceiling lights/Pendants lights,Lighting/LED Light bulbs,Lighting/LED Light bulbs,Lighting/LED Light bulbs,Lighting/LED Light bulbs,Lighting/LED Light bulbs,Lighting/LED Light bulbs,Lighting/LED Light bulbs,Cookware & tableware/Kitchen & cooking accessories/Kitchen utensils/Cooking preparation tools,Cookware & tableware/Kitchen & cooking accessories/Kitchen utensils/Cooking preparation tools,Cookware & tableware/Kitchen & cooking accessories/Kitchen utensils/Cooking preparation tools,Lighting/Lamps & light fixtures/Wall lamps/Wall lamps,Lighting/Lamps & light fixtures/Wall lamps/Wall lamps,Lighting/Lamps & light fixtures/Table lamps,Lighting/Lamps & light fixtures/Table lamps,Lighting/Lamps & light fixtures/Ceiling lights/Ceiling lamps,Lighting/Lamps & light fixtures/Ceiling lights/Pendants lights,Lighting/Lamps & light fixtures/Wall lamps/Wall lamps,Lighting/Lamps & light fixtures/Ceiling lights/Ceiling lamps,Lighting/Lamps & light fixtures/Wall lamps/Wall lamps,Lighting/Lamps & light fixtures/Wall lamps/Wall lamps,Kitchen & appliances/Kitchen faucets & sinks/Kitchen faucets,Cookware & tableware/Drinkware/Pitchers & carafes,Lighting/Lamps & light fixtures/Ceiling lights/Pendants lights,Lighting/Smart lighting/Smart LED light bulbs,Lighting/Smart lighting/Smart LED light bulbs,Lighting/Lamps & light fixtures/Ceiling lights/Ceiling lamps,Lighting/Smart lighting/Remote & smart light switches,Lighting/Decorative lighting/Decorative indoor lighting,Cookware & tableware/Drinkware/Glasses,Lighting/Lamps & light fixtures/Ceiling lights/Ceiling lamps,Lighting/Decorative lighting/Decorative outdoor lighting/SKINA LED string light w,Lighting/Decorative lighting/Decorative indoor lighting,Lighting/Decorative lighting/Decorative indoor lighting,Lighting/Decorative lighting/Decorative indoor lighting,Lighting/Lamps & light fixtures/Wall lamps/Wall lamps,Storage & organization/Storage containers/Food storage & organizing/Spice & condiment stands,Home Décor/Decorative accessories,Home Décor/Vases & bowls/Vases,Home Décor/Vases & bowls/Vases,Home Décor/Vases & bowls/Vases,Home Décor/Vases & bowls/Vases,Home Décor/Vases & bowls/Vases,Cookware & tableware/Drinkware/Wine & champagne glasses,Cookware & tableware/Drinkware/Wine & champagne glasses,Cookware & tableware/Drinkware/Wine & champagne glasses,Lighting/Bathroom lighting/Bathroom wall lights/GUNNARP LED ceiling,Kitchen & appliances/Kitchen faucets & sinks/Kitchen faucets,Lighting/Lamps & light fixtures/Ceiling lights/Pendants lights,Lighting/Lamps & light fixtures/Ceiling lights/Pendants lights,Cookware & tableware/Drinkware/Pitchers & carafes,Lighting/Lamps & light fixtures/Wall lamps/Wall lamps,Lighting/Lamps & light fixtures/Wall lamps/Wall lamps,Cookware & tableware/Drinkware/Wine & champagne glasses,Lighting/Lamps & light fixtures/Ceiling lights/Ceiling lamps,Home Décor/Clocks/Wall & table clocks,Lighting/Lamps & light fixtures/Kids lighting,Home Décor/Flower pots & stands/Indoor plant pots,Home Décor/Flower pots & stands/Indoor plant pots,Home Décor/Candle holders & candles/Candle holders,Lighting/Lamps & light fixtures/Ceiling lights/Pendants lights,Lighting/Lamps & light fixtures/Wall lamps/Wall lamps,Home Décor/Candle holders & candles/Candle holders,Lighting/Lamps & light fixtures/Ceiling lights/Ceiling lamps,Lighting/Lamps & light fixtures/Ceiling lights/Ceiling lamps,Lighting/Lamps & light fixtures/Wall lamps/Wall lamps,Home electronics/Cords & chargers/Cables & accessories,Lighting/Decorative lighting/Decorative indoor lighting,Lighting/Lamps & light fixtures/Ceiling lights/Ceiling lamps,Cookware & tableware/Flatware/Flatware,Lighting/Lamps & light fixtures/Table lamps,Lighting/Lamps & light fixtures/Table lamps,"Lighting/Lamps & light fixtures/Shades, bases & cords/Lamp bases & cords","Lighting/Lamps & light fixtures/Shades, bases & cords/Lamp bases & cords","Lighting/Lamps & light fixtures/Shades, bases & cords/Lamp bases & cords",Lighting/Lamps & light fixtures/Wall lamps/Wall lamps,Home Décor/Vases & bowls/Vases,Home Décor/Vases & bowls/Vases,Lighting/Lamps & light fixtures/Ceiling lights/Pendants lights,Lighting/Lamps & light fixtures/Kids lighting,Lighting/Lamps & light fixtures/Table lamps
Lighting/Lamps & light fixtures/LED lighting/LED lamps,Lighting/LED Light bulbs,Lighting/Lamps & light fixtures/Desk lamps,Home Décor/Vases & bowls/Vases,Cookware & tableware/Serveware/Serving dishes,Cookware & tableware/Coffee & tea/Mugs & cups,Cookware & tableware/Drinkware/Pitchers & carafes,Lighting/Lamps & light fixtures/Table lamps,Lighting/Lamps & light fixtures/Ceiling lights/Pendants lights,Lighting/Lamps & light fixtures/Desk lamps,Lighting/Lamps & light fixtures/Ceiling lights/Ceiling track lighting,Lighting/Lamps & light fixtures/Floor lamps/VIRRMO Floor,Lighting/Lamps & light fixtures/Floor lamps/VIRRMO Floor,Lighting/Lamps & light fixtures/Ceiling lights/Ceiling lamps,Lighting/Lamps & light fixtures/Desk lamps,Laundry & cleaning/Cleaning accessories,Cookware & tableware/Drinkware/Pitchers & carafes,Cookware & tableware/Drinkware/Specialty glassware,Lighting/Lamps & light fixtures/Table lamps,Home Décor/Plants & flowers/Dried plants & potpourri/DOGMATISK Dried parts of flowers,Home Décor/Plants & flowers/Dried plants & potpourri,Home Décor/Plants & flowers/Dried plants & potpourri/DIVALATER Dried parts of flowers,Home Décor/Plants & flowers/Dried plants & potpourri/DRÄGLIG Dried parts of flowers,Cookware & tableware/Serveware/Serving dishes,Home Décor/Flower pots & stands/Indoor plant pots,Furniture/Tables & desks/Accent tables/End tables & side tables,Furniture/Tables & desks/Accent tables/Coffee tables,Lighting/Lamps & light fixtures/Ceiling lights/Ceiling lamps,Lighting/Lamps & light fixtures/Wall lamps/Wall lamps,Lighting/Lamps & light fixtures/Ceiling lights/Ceiling lamps,Bathroom/Bathroom faucets/Faucets,Lighting/Lamps & light fixtures/Desk lamps/SKURUP Work,Lighting/Lamps & light fixtures/Wall lamps/Wall lamps,Lighting/Lamps & light fixtures/Wall lamps/Wall lamps,Lighting/Lamps & light fixtures/Ceiling lights/Ceiling track lighting,Lighting/Lamps & light fixtures/Ceiling lights/Pendants lights,Lighting/Lamps & light fixtures/Floor lamps,Lighting/Lamps & light fixtures/Desk lamps,Lighting/Lamps & light fixtures/Ceiling lights/Ceiling lamps,Lighting/Lamps & light fixtures/Ceiling lights/Pendants lights,Lighting/Lamps & light fixtures/Ceiling lights/Pendants lights,Baby & kids/Kids/Toys & play/Kids books,Kitchen & appliances/Kitchen faucets & sinks/Kitchen faucets,Lighting/Lamps & light fixtures/Kids lighting,Storage & organization/Storage containers/Bathroom accessories/Shower accessories,Storage & organization/Storage containers/Bathroom accessories/Towel rails & towel holders,Storage & organization/Storage containers/Bathroom accessories/Toothbrush holders,Storage & organization/Storage containers/Bathroom accessories/Soap dispensers & soap dishes,Home Décor/Vases & bowls/Vases,Home Décor/Vases & bowls/Vases,Lighting/Lamps & light fixtures/Table lamps,"Lighting/Lamps & light fixtures/Shades, bases & cords/Lamp bases & cords","Lighting/Lamps & light fixtures/Shades, bases & cords/Lamp bases & cords","Lighting/Lamps & light fixtures/Shades, bases & cords/Lamp bases & cords",Lighting/Lamps & light fixtures/Ceiling lights/Pendants lights,Cookware & tableware/Drinkware/Wine & champagne glasses,Lighting/Lamps & light fixtures/Ceiling lights/Pendants lights,Lighting/Lamps & light fixtures/Floor lamps,Lighting/Bathroom lighting/Bathroom wall lights/GUNNARP LED ceiling,Lighting/Lamps & light fixtures/Wall lamps/Wall lamps,Cookware & tableware/Drinkware/Specialty glassware,Home Décor/Flower pots & stands/Indoor plant pots,Home Décor/Flower pots & stands/Outdoor plant pots,Home Décor/Flower pots & stands/Indoor plant pots,Lighting/Lamps & light fixtures/Ceiling lights/Ceiling track lighting,Lighting/Lamps & light fixtures/Table lamps,Lighting/Lamps & light fixtures/Table lamps,Lighting/Lamps & light fixtures/Floor lamps/NÄVLINGE LED floor,Lighting/Lamps & light fixtures/Ceiling lights/Pendants lights,Lighting/Lamps & light fixtures/Desk lamps/NÄVLINGE LED wall,Lighting/Lamps & light fixtures/Desk lamps/NÄVLINGE LED wall,Lighting/Lamps & light fixtures/Floor lamps/NÄVLINGE LED floor,Lighting/Lamps & light fixtures/Table lamps,Lighting/Lamps & light fixtures/Kids lighting,Lighting/Lamps & light fixtures/Ceiling lights/Ceiling lamps,Cookware & tableware/Flatware/Flatware,Bathroom/Showers/Shower heads,Cookware & tableware/Coffee & tea/Mugs & cups,Home Décor/Vases & bowls/Vases/CHILIFRUKT Vase,Home Décor/Vases & bowls/Vases/CHILIFRUKT Vase,Home Décor/Clocks/Wall & table clocks,Cookware & tableware/Coffee & tea/Tea pots & accessories,Home Décor/Candle holders & candles/Lanterns,Home Décor/Candle holders & candles/Lanterns,Lighting/Smart lighting/Remote & smart light switches,Gardening & plants/Plant stands & movers,Gardening & plants/Plant stands & movers,Lighting/Lamps & light fixtures/Table lamps,Lighting/Lamps & light fixtures/Floor lamps,Cookware & tableware/Drinkware/Pitchers & carafes,Storage & organization/Storage containers/Food storage & organizing/Jars & tins,Home Décor/Candle holders & candles/Candle holders,Baby & kids/Kids/Toys & play/Physical play,Lighting/Lamps & light fixtures/Floor lamps/ISJAKT LED floor uplighter,Home Décor/Flower pots & stands/Outdoor plant pots,Lighting/Lamps & light fixtures/Ceiling lights/Pendants lights,Home Décor/Flower pots & stands/Indoor plant pots,Cookware & tableware/Drinkware/Pitchers & carafes,Cookware & tableware/Drinkware/Glasses,Cookware & tableware/Drinkware/Specialty glassware
