Beds & mattresses/Bedding/Blankets & throws,Beds & mattresses/Bedding/Bedlinen/Duvet cover sets,Beds & mattresses/Bedding/Pillows/Polyester pillows,Rugs/Bath mats,Bathroom/Bathroom textiles/Towels/Hand towels,Bathroom/Bathroom textiles/Towels/Wash cloths,Bathroom/Bathroom textiles/Towels/Bath sheets,Baby & kids/Baby/Baby textiles/Nursery rugs,Storage & organization/Bags/Shopping bags & tote bags,Rugs/Rugs/Door mats,Beds & mattresses/Bedding/Cushions & cushions covers/Cushions,Beds & mattresses/Bedding/Blankets & throws,Beds & mattresses/Bedding/Cushions & cushions covers/Cushions,Beds & mattresses/Bedding/Cushions & cushions covers/Cushion covers,Rugs/Rugs/Door mats,Furniture/Armchairs & chaises/Kids armchairs,Rugs/Rugs/Large & medium rugs,Beds & mattresses/Bedding/Cushions & cushions covers/Cushion covers,Beds & mattresses/Bedding/Cushions & cushions covers/Cushion covers,Furniture/Patio furniture/Outdoor seat cushions,Furniture/Patio furniture/Outdoor seat cushions,Beds & mattresses/Bedding/Cushions & cushions covers/Cushion covers,Furniture/Sofas & sectionals/Sofa & armchairs covers/POÄNG,Furniture/Sofas & sectionals/Sofa & armchairs covers/POÄNG,Baby & kids/Kids/Toys & play/Soft toys,Baby & kids/Baby/Baby textiles/Nursery rugs,Furniture/Sofas & sectionals/Sofa & armchairs covers/HÄRLANDA covers,Furniture/Sofas & sectionals/Sofa & armchairs covers/HÄRLANDA covers,Furniture/Sofas & sectionals/Sofa & armchairs covers/HÄRLANDA covers,Furniture/Sofas & sectionals/Sofa & armchairs covers/HÄRLANDA covers,Furniture/Sofas & sectionals/Fabric sofas/Modular fabric sofas,Furniture/Armchairs & chaises/Rattan armchairs,Furniture/Armchairs & chaises/Rattan armchairs,Cookware & tableware/Napkins & napkin holders/Napkins,Rugs/Bath mats,Beds & mattresses/Bedding/Blankets & throws,Furniture/Tables & desks/Changing tables,Beds & mattresses/Mattresses/Crib mattresses,Beds & mattresses/Mattresses/Crib mattresses,Beds & mattresses/Mattresses/Crib mattresses,Beds & mattresses/Mattresses/Crib mattresses,Beds & mattresses/Bedding/Comforters/Polyester comforters,Beds & mattresses/Bedding/Comforters/Polyester comforters,Beds & mattresses/Bedding/Cushions & cushions covers/Children's cushions & blankets,"Outdoor/Outdoor cushions/Outdoor pillows/FUNKÖN Cushion cover, in","Outdoor/Outdoor cushions/Outdoor pillows/FUNKÖN Back cushion, indoor",Furniture/Patio furniture/Outdoor lounge furniture,Rugs/Rugs/Door mats,Baby & kids/Baby/Baby textiles/Baby towels & washcloths,Furniture/Sofas & sectionals/Sofa & armchairs covers/FÄRLÖV covers,Furniture/Sofas & sectionals/Sofa & armchairs covers/FLOTTEBO covers,Bathroom/Bathroom textiles/Towels/Bath towels,Bathroom/Bathroom textiles/Towels/Hand towels,Beds & mattresses/Mattresses/Mattress toppers,Cookware & tableware/Table linen/Table cloths & runners,Beds & mattresses/Bedding/Bedlinen/Duvet cover sets,Beds & mattresses/Bedding/Cushions & cushions covers/Children's cushions & blankets,Beds & mattresses/Bedding/Cushions & cushions covers/Children's cushions & blankets,Storage & organization/Storage containers/Bins & bags/Bags,Rugs/Rugs/Large & medium rugs,"Rugs/Rugs/Large & medium rugs/SVALLERUP Rug flatwoven, in",Rugs/Rugs/Runners & small rugs,"Rugs/Rugs/Large & medium rugs/VRENSTED Rug flatwoven, in",Rugs/Rugs/Round rugs,Beds & mattresses/Bedding/Blankets & throws,Beds & mattresses/Bedding/Pillows/Polyester pillows,Beds & mattresses/Bedding/Blankets & throws/FÄLTMAL Pillow,Beds & mattresses/Bedding/Comforters/Down & feather comforters,Beds & mattresses/Bedding/Comforters/Down & feather comforters,Beds & mattresses/Bedding/Comforters/Down & feather comforters,Laundry & cleaning/Cleaning accessories,Rugs/Rugs/Runners & small rugs,"Furniture/Patio furniture/Outdoor seat cushions/SÖTHOLMEN Cushion cover, in",Beds & mattresses/Bedding/Cushions & cushions covers/Cushion covers,Beds & mattresses/Bedding/Comforters/Polyester comforters,Furniture/Sofas & sectionals/Sofa & armchairs covers/POÄNG,Baby & kids/Kids/Toys & play/Soft toys,Beds & mattresses/Mattresses/Kids mattresses,Rugs/Rugs/Door mats,Rugs/Rugs/Door mats,Rugs/Rugs/Large & medium rugs,Baby & kids/Baby/Baby textiles/Baby quilts & pillows,Beds & mattresses/Bedding/Pillows/Polyester pillows,Beds & mattresses/Bedding/Cushions & cushions covers/Cushion covers,Bathroom/Bathroom textiles/Shower curtains,Beds & mattresses/Bedding/Blankets & throws,Cookware & tableware/Kitchen textiles/Pot holders & oven mitts,Cookware & tableware/Kitchen textiles/Pot holders & oven mitts,Cookware & tableware/Kitchen textiles/Pot holders & oven mitts,Cookware & tableware/Kitchen textiles/Kitchen towels,Furniture/Patio furniture/Outdoor seat cushions,Furniture/Patio furniture/Outdoor seat cushions,Furniture/Patio furniture/Outdoor seat cushions,Furniture/Patio furniture/Outdoor seat cushions/KUDDARNA Seat,Furniture/Patio furniture/Outdoor seat cushions/KUDDARNA Seat,Furniture/Patio furniture/Outdoor seat cushions,Beds & mattresses/Bedding/Bedspreads,Rugs/Rugs/Large & medium rugs,Beds & mattresses/Bedding/Cushions & cushions covers/Cushion covers,Beds & mattresses/Bedding/Cushions & cushions covers/Cushion covers
Storage & organization/Storage solution systems/AURDAL system/AURDAL parts,Storage & organization/Storage solution systems/AURDAL system/AURDAL parts,Storage & organization/Storage solution systems/AURDAL system/AURDAL parts,Storage & organization/Storage solution systems/AURDAL system/AURDAL parts,Storage & organization/Storage solution systems/AURDAL system/AURDAL parts,Storage & organization/Storage solution systems/AURDAL system/AURDAL parts,Storage & organization/Storage solution systems/AURDAL system/AURDAL parts,Storage & organization/Storage solution systems/AURDAL system/AURDAL parts,Storage & organization/Storage solution systems/AURDAL system/AURDAL parts,Storage & organization/Storage solution systems/AURDAL system/AURDAL parts,Storage & organization/Storage solution systems/AURDAL system/AURDAL parts,Storage & organization/Storage solution systems/AURDAL system/AURDAL parts,Home electronics/Cords & chargers/Wireless charging & accessories,Storage & organization/Wall shelves/Complete wall shelves,Furniture/Tables & desks/Desks & computer desks/Desks for home,Home electronics/Speakers/Bluetooth speakers,Storage & organization/Storage containers/Bins & bags/Trash cans & pedal bins,Home electronics/Speakers/Bluetooth speakers,Home electronics/Speakers/Bluetooth speakers,Home electronics/Speakers/Bluetooth speakers,Home electronics/Speakers/Bluetooth speakers,Cookware & tableware/Knives & cutting boards/Cutting boards,"Storage & organization/Shelving units, bookcases & storage options/Storage shelves & units",Storage & organization/Clothes organizers/Shoe cabinets,Storage & organization/Clothes organizers/Shoe cabinets,Storage & organization/Clothes organizers/Shoe cabinets,Storage & organization/Clothes organizers/Shoe cabinets,Storage & organization/Clothes organizers/Shoe cabinets,Storage & organization/Clothes organizers/Shoe cabinets,Storage & organization/Clothes organizers/Shoe cabinets,Home Décor/Storage boxes & baskets/Paper & media boxes,Home Décor/Mirrors/Wall mirrors,Home Décor/Mirrors/Wall mirrors,Home Décor/Mirrors/Wall mirrors,Home electronics/Cords & chargers/Wireless charging & accessories,Home electronics/Cords & chargers/Wireless charging & accessories,Storage & organization/Storage containers/Food storage & organizing/Food containers,Storage & organization/Storage containers/Bathroom accessories/Bathroom boxes & baskets,Home Décor/Storage boxes & baskets/Secondary storage boxes,"Storage & organization/Shelving units, bookcases & storage options/Storage shelves & units",Furniture/Tables & desks/Dining tables/Up to 4 seats,Home Décor/Storage boxes & baskets/Secondary storage boxes,Home Décor/Storage boxes & baskets/Secondary storage boxes,Storage & organization/Storage solution systems/SMÅSTAD system/SMÅSTAD doors & drawers,Storage & organization/Storage solution systems/SMÅSTAD system/SMÅSTAD doors & drawers,Bathroom/Bathroom storage/Bathroom shelving units,Kitchen & appliances/Kitchen islands & carts,Storage & organization/Storage containers/Bathroom accessories/Bathroom shelves,Furniture/Tables & desks/Bar tables,Home Décor/Vases & bowls/Vases,Home Décor/Vases & bowls/Vases/CYLINDER Vase,Storage & organization/Storage containers/Paper & media organizers/Media accessories,Storage & organization/Storage solution systems/BESTÅ storage system/BESTÅ all parts & accessories,"Storage & organization/Shelving units, bookcases & storage options/Storage shelves & units",Storage & organization/Clothes organizers/Shoe racks & stands,Home Décor/Storage boxes & baskets/Secondary storage boxes,Home electronics/Cords & chargers/Wireless charging & accessories,"Storage & organization/Shelving units, bookcases & storage options/Bookcases","Storage & organization/Shelving units, bookcases & storage options/Cube storage","Storage & organization/Shelving units, bookcases & storage options/Cube storage","Storage & organization/Shelving units, bookcases & storage options/Shelf units & cube storage",Furniture/Tables & desks/Desks & computer desks/Desks for home,Home electronics/Speakers/Bluetooth speakers,Furniture/Tables & desks/Kids tables,Home Décor/Mirrors/Mirror cabinets,Home Décor/Mirrors/Mirror cabinets,"Storage & organization/Shelving units, bookcases & storage options/Shelf units & cube storage","Storage & organization/Shelving units, bookcases & storage options/Shelf units & cube storage","Storage & organization/Shelving units, bookcases & storage options/Shelf units & cube storage",Furniture/Kids furniture/Toy storage,Storage & organization/Bags/Travel accessories,Storage & organization/Display & storage cabinets/Dining room cabinets & cupboards,Storage & organization/Storage solution systems/SMÅSTAD system/SMÅSTAD interior fittings,Bathroom/Bathroom vanities/Vanity cabinets with sink,Bathroom/Bathroom vanities/Vanity cabinets with sink,Storage & organization/Storage containers/Bins & bags/Trash cans & pedal bins,Storage & organization/Storage containers/Cable management & accessories,Baby & kids/Kids/Toys & play/Arts & crafts,Storage & organization/Storage solution systems/IVAR system/All parts,Storage & organization/Storage containers/Paper & media organizers/Desk accessories,Furniture/Kids furniture/Kids chairs,"Storage & organization/Shelving units, bookcases & storage options/Shelf units & cube storage",Storage & organization/TV & media furniture/TV stands & benches,Furniture/Chairs/High chairs,"Storage & organization/Shelving units, bookcases & storage options/Bookcases",Storage & organization/Display & storage cabinets/Display cabinets,Home Décor/Noticeboards,Storage & organization/Storage solution systems/BESTÅ storage system/BESTÅ all parts & accessories,Storage & organization/Storage solution systems/OMAR system/All parts,Storage & organization/Storage containers/Food storage & organizing/Cooler bags,Home Décor/Wall décor/Picture & photo frames,Storage & organization/Display & storage cabinets/Display cabinets,Storage & organization/Storage containers/Food storage & organizing/Food containers,Storage & organization/Storage solution systems/PAX system/PAX Interior organizers,Storage & organization/Storage solution systems/PAX system/PAX Interior organizers,Home Décor/Storage boxes & baskets/Paper & media boxes,Storage & organization/Wall shelves/Complete wall shelves,Storage & organization/Wall shelves/Complete wall shelves,Storage & organization/Storage containers/Bathroom accessories/Shower accessories,Home Décor/Mirrors/Wall mirrors
Home Textiles/Window treatments/Curtains & drapes/Panel curtains,Home Textiles/Window treatments/Curtains & drapes/Light filtering curtains,Home Textiles/Window treatments/Curtains & drapes/Panel curtains,Home Textiles/Window treatments/Curtains & drapes/Light filtering curtains,Home Textiles/Window treatments/Curtains & drapes/Light filtering curtains,Home Textiles/Window treatments/Curtains & drapes/Light filtering curtains,"Home Textiles/Window treatments/Shades, blinds & window treatments/Roman shades",Home Textiles/Window treatments/Curtains & drapes/Light filtering curtains,Home Textiles/Window treatments/Curtains & drapes/Panel curtains,Home Textiles/Window treatments/Curtains & drapes/Light filtering curtains,"Home Textiles/Window treatments/Shades, blinds & window treatments/Pleated & cellular blinds and shades",Home Textiles/Window treatments/Curtains & drapes/Light filtering curtains,Home Textiles/Window treatments/Curtains & drapes/Light filtering curtains,Home Textiles/Window treatments/Curtains & drapes/Panel curtains,Home Textiles/Window treatments/Curtain rods & rails/Track systems,Home Décor/Clocks/Alarm clocks,Kitchen & appliances/Backsplashes & wall panels/Laminate backsplashes,Kitchen & appliances/Backsplashes & wall panels/Laminate backsplashes,Kitchen & appliances/Backsplashes & wall panels/Laminate backsplashes,Baby & kids/Kids/Toys & play/Physical play,Storage & organization/Storage solution systems/PAX system/PAX doors without hinges,Outdoor/Umbrellas & gazebos/Patio umbrellas & bases,Home electronics/Speakers/Wi-Fi speakers,Storage & organization/Storage solution systems/PAX system/PAX doors without hinges,"Home improvement/Oils, stains & product care","Home improvement/Oils, stains & product care","Home improvement/Oils, stains & product care","Home improvement/Oils, stains & product care",Cookware & tableware/Serveware/Trays,Storage & organization/Dressers & storage drawers/Chests of drawers,Rugs/Rugs/Door mats,Storage & organization/Wall shelves & hooks/Hooks,Storage & organization/Wall shelves & hooks/Hooks,"Storage & organization/Wall shelves & hooks/Hooks/BRANDUR Hook, in-","Storage & organization/Clothes organizers/Clothes racks & stands/TURBO Clothes rack, indoor","Storage & organization/Wall shelves & hooks/Hooks/BRANDUR Hook, in-",Home Décor/Candle holders & candles/Lanterns,"Storage & organization/Wall shelves & hooks/Hooks/BRANDUR Rail with 4 hooks, in-","Laundry & cleaning/Drying racks/MULIG Drying rack, indoor",Home Décor/Flower pots & stands/Indoor plant pots,Furniture/Tables & desks/Bar tables,Furniture/Tables & desks/Café tables,Pet accessories/Cats,Storage & organization/Clothes organizers/Clothes racks & stands,Storage & organization/Clothes organizers/Clothes racks & stands,Storage & organization/Storage containers/Bins & bags/Trash cans & pedal bins,Storage & organization/Storage containers/Paper & media organizers/Desk accessories,Storage & organization/Storage containers/Bathroom accessories/Towel rails & towel holders,Storage & organization/Storage containers/Bathroom accessories/Towel rails & towel holders,Home Textiles/Window treatments/Curtains & drapes/Room darkening curtains & drapes,Home Décor/Storage boxes & baskets/Baskets,Bathroom/Showers/Shower heads,Furniture/Tables & desks/Dining tables/Up to 4 seats,Furniture/Tables & desks/Accent tables/Coffee tables,Furniture/Tables & desks/Accent tables/Coffee tables,Cookware & tableware/Cookware & kitchenware/Cooking pans/Frying pans & skillets,Kitchen & appliances/Kitchen countertops/Laminate countertops,Kitchen & appliances/Kitchen countertops/Laminate countertops,Kitchen & appliances/Kitchen countertops/Laminate countertops,Kitchen & appliances/Kitchen countertops/Laminate countertops,Kitchen & appliances/Kitchen countertops/Laminate countertops,Cookware & tableware/Dinnerware/Dinnerware sets,Cookware & tableware/Coffee & tea/Mugs & cups,Cookware & tableware/Coffee & tea/Mugs & cups,Lighting/Lamps & light fixtures/Kids lighting,Bathroom/Bathroom sinks,Bathroom/Bathroom sinks,Bathroom/Bathroom sinks,Bathroom/Bathroom sinks,Bathroom/Bathroom sinks,Cookware & tableware/Dinnerware/Bowls,Cookware & tableware/Dinnerware/Side plates,Cookware & tableware/Coffee & tea/Mugs & cups,Cookware & tableware/Dinnerware/Plates,"Home Textiles/Window treatments/Shades, blinds & window treatments/Black-out shades & blinds",Kitchen & appliances/Kitchen systems/SEKTION kitchen/SEKTION kitchen cabinets,Kitchen & appliances/Kitchen systems/SEKTION kitchen/SEKTION kitchen cabinets,Kitchen & appliances/Kitchen systems/SEKTION kitchen/SEKTION kitchen cabinets,Home Décor/Clocks/Alarm clocks,Home Décor/Clocks/Alarm clocks,Furniture/Tables & desks/Dining tables/Dining table tops & underframes,Kitchen & appliances/Kitchen systems/SEKTION kitchen/SEKTION kitchen cabinets,Kitchen & appliances/Kitchen systems/SEKTION kitchen/SEKTION kitchen cabinets,Kitchen & appliances/Kitchen systems/SEKTION kitchen/SEKTION kitchen cabinets,Kitchen & appliances/Kitchen systems/SEKTION kitchen/SEKTION kitchen cabinets,Kitchen & appliances/Kitchen systems/SEKTION kitchen/SEKTION kitchen cabinets,Furniture/Tables & desks/Dining tables/Up to 6 seats,Storage & organization/TV & media furniture/TV stands & benches,Storage & organization/Wall shelves/Complete wall shelves/HEMNES Wall,Home Décor/Mirrors/Vanity mirrors,Home electronics/Speakers/Bluetooth speakers,Storage & organization/Dressers & storage drawers/Chests of drawers,Storage & organization/Dressers & storage drawers/Chests of drawers,Furniture/Tables & desks/Nightstands,Furniture/Tables & desks/Nightstands,Cookware & tableware/Cookware & kitchenware/Cooking pans/Woks,Home Décor/Storage boxes & baskets/Kids boxes & baskets,Storage & organization/Storage containers/Bathroom accessories/Toilet brushes,Cookware & tableware/Serveware/Trays,Laundry & cleaning/Cleaning accessories
Storage & organization/Display & storage cabinets/Display cabinets,Storage & organization/Storage solution systems/OMAR system/All parts,Cookware & tableware/Cookware & kitchenware/Cooking pans/Grill pans & griddles,"Storage & organization/Shelving units, bookcases & storage options/Shelf units & cube storage",Storage & organization/Storage solution systems/PAX system/PAX Interior organizers,Storage & organization/Storage solution systems/PAX system/PAX Interior organizers,Home Décor/Mirrors/Mirror cabinets,Home Décor/Mirrors/Mirror cabinets,Kitchen & appliances/Kitchen systems/SEKTION kitchen/SEKTION kitchen cabinets,Cookware & tableware/Knives & cutting boards/Sharpening tools,Storage & organization/Clothes organizers/Shoe racks & stands,Storage & organization/Bags/Travel accessories,Storage & organization/Storage solution systems/BESTÅ storage system/BESTÅ all parts & accessories,Storage & organization/Storage containers/Food storage & organizing/Food containers,"Storage & organization/Shelving units, bookcases & storage options/Shelf units & cube storage",Kitchen & appliances/Kitchen drawer organization/Drawer dividers,Storage & organization/Clothes organizers/Shoe racks & stands,Storage & organization/TV & media furniture/TV stands & benches,Storage & organization/Storage solution systems/SMÅSTAD system/SMÅSTAD doors & drawers,Storage & organization/Storage solution systems/SMÅSTAD system/SMÅSTAD doors & drawers,"Storage & organization/Shelving units, bookcases & storage options/Shelf units & cube storage",Storage & organization/TV & media furniture/TV stands & benches,Bathroom/Bathroom vanities/Bathroom vanity legs,Cookware & tableware/Serveware/Trays,Cookware & tableware/Serveware/Trays,Cookware & tableware/Serveware/Trays,Storage & organization/Display & storage cabinets/Display cabinets,Storage & organization/Display & storage cabinets/Display cabinets,Storage & organization/Storage solution systems/BESTÅ storage system/BESTÅ all parts & accessories,Home Décor/Storage boxes & baskets/Secondary storage boxes,Home Décor/Storage boxes & baskets/Paper & media boxes,Kitchen & appliances/Kitchen systems/SEKTION kitchen/SEKTION kitchen cabinets,Bathroom/Bathroom vanities/Vanity cabinets without sink,"Home Décor/Storage boxes & baskets/Secondary storage boxes/SAMLA Lid for box, 12",Furniture/Tables & desks/Dining tables/Up to 4 seats,Kitchen & appliances/Kitchen drawer organization/Shelves & drawers,Storage & organization/Wall shelves/Complete wall shelves,Storage & organization/Wall shelves/Shelves,Storage & organization/Wall shelves/Shelves,Storage & organization/Bags/Shopping bags & tote bags,Bathroom/Bathroom storage/Bathroom shelving units,Kitchen & appliances/Kitchen systems/SUNNERSTA modular kitchen/Accessories for SUNNERSTA,Kitchen & appliances/Kitchen wall organization & storage/Wall organizers,Kitchen & appliances/Kitchen systems/SUNNERSTA modular kitchen/Accessories for SUNNERSTA,Kitchen & appliances/Kitchen wall organization & storage/Wall organizers,Kitchen & appliances/Kitchen systems/SUNNERSTA modular kitchen/Accessories for SUNNERSTA,Kitchen & appliances/Kitchen systems/SUNNERSTA modular kitchen/Accessories for SUNNERSTA,Kitchen & appliances/Kitchen systems/SUNNERSTA modular kitchen/Accessories for SUNNERSTA,Home Décor/Storage boxes & baskets/Secondary storage boxes,Storage & organization/Storage containers/Food storage & organizing/Food containers,Furniture/Kids furniture/Toy storage,Furniture/Kids furniture/Toy storage,Storage & organization/Storage solution systems/SMÅSTAD system/SMÅSTAD doors & drawers,Storage & organization/Storage solution systems/SMÅSTAD system/SMÅSTAD doors & drawers,Furniture/Kids furniture/Toy storage,Storage & organization/Storage solution systems/SMÅSTAD system/SMÅSTAD doors & drawers,Furniture/Kids furniture/Toy storage,Home Décor/Storage boxes & baskets/Clothes boxes,Home electronics/Speakers/Bluetooth speakers,Baby & kids/Kids/Kids storage & organization/Children's hooks & wall organization,Storage & organization/Storage containers/Paper & media organizers/Desk accessories,Storage & organization/Wall shelves & hooks/Hooks,"Storage & organization/Shelving units, bookcases & storage options/Storage shelves & units",Furniture/Kids furniture/Kids chairs,Storage & organization/Display & storage cabinets/Dining room cabinets & cupboards,"Storage & organization/Shelving units, bookcases & storage options/Bookcases",Storage & organization/Display & storage cabinets/Dining room cabinets & cupboards,Storage & organization/TV & media furniture/TV stands & benches,Cookware & tableware/Serveware/Trays,"Storage & organization/Shelving units, bookcases & storage options/Storage shelves & units",Cookware & tableware/Knives & cutting boards/Cutting boards,Furniture/Patio furniture/Outdoor tables/Outdoor dining tables,Furniture/Tables & desks/Desks & computer desks/Desks for home,Furniture/Tables & desks/Desks & computer desks/Desks for home,Furniture/Tables & desks/Desks & computer desks/Desks for home,Home electronics/Cords & chargers/Wireless charging & accessories,Home electronics/Cords & chargers/Wireless charging & accessories,Home electronics/Cords & chargers/Wireless charging & accessories,Storage & organization/Storage containers/Cable management & accessories,Home Décor/Mirrors/Wall mirrors,Home Décor/Mirrors/Wall mirrors,Home Décor/Mirrors/Wall mirrors,Furniture/Tables & desks/Accent tables/End tables & side tables,Home Décor/Storage boxes & baskets/Paper & media boxes,Home electronics/Speakers/Bluetooth speakers,Home electronics/Speakers/Bluetooth speakers,Home electronics/Speakers/Bluetooth speakers,Home electronics/Speakers/Bluetooth speakers,Storage & organization/Storage solution systems/AURDAL system/AURDAL parts,Storage & organization/Storage solution systems/AURDAL system/AURDAL parts,Storage & organization/Storage solution systems/AURDAL system/AURDAL parts,Storage & organization/Storage solution systems/AURDAL system/AURDAL parts,Storage & organization/Storage solution systems/AURDAL system/AURDAL parts,Storage & organization/Storage solution systems/AURDAL system/AURDAL parts,Storage & organization/Storage solution systems/AURDAL system/AURDAL parts,Storage & organization/Storage solution systems/AURDAL system/AURDAL parts,Storage & organization/Storage solution systems/AURDAL system/AURDAL parts,Storage & organization/Storage solution systems/AURDAL system/AURDAL parts,Storage & organization/Storage solution systems/AURDAL system/AURDAL parts,Storage & organization/Storage solution systems/AURDAL system/AURDAL parts
