Furniture/Patio furniture/Outdoor tables/Outdoor dining tables,Furniture/Tables & desks/Nightstands,Furniture/Tables & desks/Dining tables/Up to 4 seats,Furniture/Chairs/Café chairs,Storage & organization/Storage containers/Clothes organizers/Hanging clothes organizers,Storage & organization/Armoires & wardrobes/Solitaire wardrobes,Furniture/Armchairs & chaises/Coated fabric armchairs,Furniture/Beds/Kids beds/Junior & extendable beds,Storage & organization/Armoires & wardrobes/Solitaire wardrobes,Furniture/Tables & desks/Changing tables,"Storage & organization/Shelving units, bookcases & storage options/Storage shelves & units",Storage & organization/Storage containers/Bathroom accessories/Towel rails & towel holders,Furniture/Kids furniture/Kids chairs,Storage & organization/Storage containers/Bathroom accessories/Towel rails & towel holders,Storage & organization/Storage containers/Hooks & hangers/Hangers,Furniture/Beds/Cribs,Home Textiles/Window treatments/Curtains & drapes/Room darkening curtains & drapes,Laundry & cleaning/Laundry baskets,Furniture/Sofas & sectionals/Sectionals/Sofa modules,Home Textiles/Window treatments/Curtains & drapes/Room darkening curtains & drapes,Furniture/Sofas & sectionals/Ottomans/Fabric ottomans,Home Décor/Storage boxes & baskets/Baskets,Home Décor/Storage boxes & baskets/Baskets,Home Décor/Storage boxes & baskets/Secondary storage boxes,Furniture/Chairs/Dining chairs/Dining chairs,Storage & organization/Storage containers/Bins & bags/Trash cans & pedal bins,Laundry & cleaning/Cleaning accessories,Furniture/Tables & desks/Changing tables,Storage & organization/Storage containers/Bathroom accessories/Towel rails & towel holders,Furniture/Kids furniture/Kids chairs,Storage & organization/Bags/Travel accessories,Furniture/Tables & desks/Makeup vanities & dressing tables,Furniture/Chairs/Bar stools & chairs,Furniture/Chairs/Dining chairs/Dining chairs,Storage & organization/Storage solution systems/PAX system/PAX Interior organizers,Storage & organization/Bags/Shopping bags & tote bags,Storage & organization/Storage containers/Paper & media organizers/Desk accessories,Furniture/Armchairs & chaises/Lounge chairs,Rugs/Rugs/Large & medium rugs,Rugs/Rugs/Runners & small rugs,Furniture/Beds/Cribs,Furniture/Beds/Headboards,Bathroom/Bathroom stools & benches,Storage & organization/Bags/Backpacks & messenger bags,Storage & organization/Storage solution systems/PAX system/PAX Interior organizers,Storage & organization/Bags/Shopping bags & tote bags,Furniture/Patio furniture/Outdoor sofa sections,Laundry & cleaning/Ironing boards,Storage & organization/Armoires & wardrobes/Solitaire wardrobes,Storage & organization/Armoires & wardrobes/Solitaire wardrobes,Furniture/Tables & desks/Changing tables,Storage & organization/Armoires & wardrobes/Solitaire wardrobes,Storage & organization/Armoires & wardrobes/Solitaire wardrobes,Storage & organization/Armoires & wardrobes/Solitaire wardrobes,Outdoor/Outdoor flooring,Storage & organization/Armoires & wardrobes/Solitaire wardrobes,Furniture/Beds/Bed legs,Storage & organization/Wall shelves & hooks/Hooks,Storage & organization/Dressers & storage drawers/Chests of drawers,Furniture/Patio furniture/Outdoor chaises & hammocks,Storage & organization/Armoires & wardrobes/Solitaire wardrobes,Furniture/Patio furniture/Outdoor chairs/Outdoor dining chairs,Home Décor/Storage boxes & baskets/Clothes boxes,Bathroom/Bathroom vanities/Vanity cabinets without sink,Furniture/Kids furniture/Kids chairs,Furniture/Armchairs & chaises/Fabric armchairs,Furniture/Tables & desks/Makeup vanities & dressing tables,Furniture/Patio furniture/Outdoor tables/Outdoor coffee & side tables,Furniture/Patio furniture/Outdoor chairs/Outdoor dining chairs,Rugs/Rugs/Door mats,Storage & organization/Storage containers/Clothes organizers/Hanging clothes organizers,Furniture/Chairs/Dining chairs/Upholstered chairs,Furniture/Patio furniture/Outdoor sofa sections,Furniture/Patio furniture/Outdoor tables/Outdoor dining tables,Home Décor/Wall décor/Picture & photo frames,Furniture/Chairs/Dining chairs/Folding chairs,Furniture/Patio furniture/Outdoor chairs/Outdoor dining chairs,Outdoor/Outdoor flooring,Outdoor/Outdoor flooring,Home Décor/Wall décor/Picture & photo frames,Home Décor/Wall décor/Picture & photo frames,Storage & organization/Storage containers/Paper & media organizers/Desk accessories,Furniture/Tables & desks/Dining tables/Dining table tops & underframes,Furniture/Chairs/Stools & benches/Benches,Storage & organization/Clothes organizers/Shoe racks & stands,Storage & organization/Clothes organizers/Shoe cabinets,Storage & organization/Clothes organizers/Shoe cabinets,Storage & organization/Storage containers/Bathroom accessories/Towel rails & towel holders,Storage & organization/Storage containers/Bathroom accessories/Towel rails & towel holders,Storage & organization/Clothes organizers/Shoe cabinets,Storage & organization/Clothes organizers/Shoe cabinets,Home Décor/Storage boxes & baskets/Clothes boxes,Furniture/Chairs/Bar stools & chairs,Storage & organization/Storage solution systems/BESTÅ storage system/BESTÅ all parts & accessories/BESTÅ doors & drawer fronts,Furniture/Armchairs & chaises/Kids armchairs,Furniture/Sofas & sectionals/Sofa legs,Furniture/Sofas & sectionals/Sofa legs,Home Décor/Wall décor/Picture & photo frames,Storage & organization/Storage containers/Hooks & hangers/Hangers,Furniture/Chairs/Desk chairs/Desk chairs for home
Home Décor/Storage boxes & baskets/Secondary storage boxes,Storage & organization/Clothes organizers/Clothes racks & stands,"Storage & organization/Storage solution systems/ELVARLI system/Post, side units & interiors",Storage & organization/Dressers & storage drawers/Drawer units/Drawer units for home,Storage & organization/Storage solution systems/IVAR system/All parts,Storage & organization/Display & storage cabinets/Dining room cabinets & cupboards,Storage & organization/Storage solution systems/BESTÅ storage system/BESTÅ all parts & accessories,Bathroom/Bathroom storage/Bathroom shelving units,Storage & organization/Storage containers/Bathroom accessories/Bathroom shelves,Kitchen & appliances/Kitchen islands & carts,Home electronics/Speakers/Wi-Fi speakers,Storage & organization/Storage containers/Paper & media organizers/Desk accessories,Furniture/Tables & desks/Desks & computer desks/Desks for home,Storage & organization/Storage containers/Food storage & organizing/Food containers,Furniture/Tables & desks/Desks & computer desks/Desks for home,Storage & organization/Wall shelves/Brackets,Kitchen & appliances/Kitchen islands & carts,"Storage & organization/Storage solution systems/ELVARLI system/Post, side units & interiors","Storage & organization/Storage solution systems/ELVARLI system/Post, side units & interiors",Cookware & tableware/Knives & cutting boards/Sharpening tools,"Storage & organization/Storage solution systems/ELVARLI system/Post, side units & interiors",Home Décor/Wall décor/Picture ledges,Home Décor/Wall décor/Picture ledges,Furniture/Tables & desks/Desks & computer desks/Desks for home,Furniture/Tables & desks/Desks & computer desks/Desks for home,Furniture/Tables & desks/Desks & computer desks/Desks for home,Storage & organization/Storage containers/Bins & bags/Trash cans & pedal bins,Storage & organization/Display & storage cabinets/Dining room cabinets & cupboards,Kitchen & appliances/Kitchen systems/SUNNERSTA modular kitchen/Accessories for SUNNERSTA,"Storage & organization/Shelving units, bookcases & storage options/Shelf units & cube storage",Home Décor/Wall décor/Picture ledges,Baby & kids/Kids/Toys & play/Arts & crafts,Home Décor/Wall décor/Picture ledges,Storage & organization/Storage solution systems/BESTÅ storage system/BESTÅ all parts & accessories,Kitchen & appliances/Kitchen islands & carts,Furniture/Tables & desks/Dining tables/Up to 4 seats,Furniture/Tables & desks/Bar tables,"Storage & organization/Shelving units, bookcases & storage options/Shelf units & cube storage",Kitchen & appliances/Kitchen systems/SUNNERSTA modular kitchen/Accessories for SUNNERSTA,Kitchen & appliances/Kitchen systems/SUNNERSTA modular kitchen/Accessories for SUNNERSTA,Furniture/Tables & desks/Desks & computer desks/Desks for home,Kitchen & appliances/Kitchen islands & carts,Storage & organization/TV & media furniture/TV stands & benches,Baby & kids/Kids/Kids storage & organization/Children's hooks & wall organization,Kitchen & appliances/Kitchen islands & carts,Kitchen & appliances/Kitchen systems/SEKTION kitchen/SEKTION kitchen cabinets,Kitchen & appliances/Kitchen wall organization & storage/Kitchen shelves,Kitchen & appliances/Kitchen drawer organization/Shelves & drawers,Storage & organization/Display & storage cabinets/Filing cabinets & storage cabinets/Office storage cabinets & units,Storage & organization/Storage solution systems/SMÅSTAD system/SMÅSTAD doors & drawers,Kitchen & appliances/Appliances/Refrigerators & freezers/Free-standing refrigerators,Furniture/Kids furniture/Toy storage,Furniture/Kids furniture/Toy storage,Furniture/Kids furniture/Toy storage,Furniture/Kids furniture/Toy storage,Storage & organization/Storage solution systems/SMÅSTAD system/SMÅSTAD doors & drawers,Storage & organization/TV & media furniture/TV stands & benches,Storage & organization/Storage solution systems/SMÅSTAD system/SMÅSTAD doors & drawers,"Storage & organization/Shelving units, bookcases & storage options/Storage shelves & units",Bathroom/Bathroom storage/Bathroom storage/Bathroom wall cabinets,Storage & organization/Storage solution systems/BOAXEL system/BOAXEL parts,Kitchen & appliances/Kitchen systems/SUNNERSTA modular kitchen/Accessories for SUNNERSTA,Storage & organization/TV & media furniture/TV stands & benches,Laundry & cleaning/Ironing boards,Kitchen & appliances/Kitchen islands & carts,Kitchen & appliances/Kitchen islands & carts,Kitchen & appliances/Kitchen islands & carts,Kitchen & appliances/Kitchen wall organization & storage/Wall organizers,Kitchen & appliances/Kitchen wall organization & storage/Wall organizers,Kitchen & appliances/Kitchen systems/SUNNERSTA modular kitchen/Accessories for SUNNERSTA,Storage & organization/Wall shelves/Brackets,Storage & organization/Storage containers/Cable management & accessories,Storage & organization/Storage containers/Bins & bags/Trash cans & pedal bins,"Storage & organization/Display & storage cabinets/Buffet tables, sideboard buffets & buffet cabinets",Outdoor/Grills,Storage & organization/Wall shelves/Brackets,Storage & organization/Storage solution systems/BOAXEL system/BOAXEL parts,Storage & organization/Storage solution systems/BOAXEL system/BOAXEL parts,Home Décor/Wall décor/Picture ledges,Home Décor/Flower pots & stands/Outdoor plant pots,Storage & organization/TV & media furniture/TV stands & benches,Storage & organization/Storage solution systems/SMÅSTAD system/SMÅSTAD doors & drawers,Kitchen & appliances/Appliances/Refrigerators & freezers/Free-standing refrigerators,Home Décor/Storage boxes & baskets/Paper & media boxes,Kitchen & appliances/Kitchen wall organization & storage/Kitchen shelves,Storage & organization/Storage solution systems/PAX system/PAX Interior organizers,Storage & organization/Wall shelves/Complete wall shelves/LIATORP Wall,Storage & organization/Wall shelves/Brackets,Furniture/Tables & desks/Accent tables/End tables & side tables,Kitchen & appliances/Kitchen wall organization & storage/Kitchen shelves,Home Décor/Wall décor/Picture ledges,Storage & organization/Storage solution systems/PAX system/PAX Interior organizers,Bathroom/Bathroom vanities/Vanity cabinets with sink,Kitchen & appliances/Kitchen islands & carts,Bathroom/Bathroom vanities/Vanity cabinets with sink,"Storage & organization/Shelving units, bookcases & storage options/Shelf units & cube storage",Storage & organization/Storage solution systems/SMÅSTAD system/SMÅSTAD doors & drawers,Kitchen & appliances/Kitchen wall organization & storage/Wall organizers,Storage & organization/Storage solution systems/IVAR system/All parts,Kitchen & appliances/Kitchen wall organization & storage/Wall organizers
Home Décor/Storage boxes & baskets/Kids boxes & baskets,Home Décor/Wall décor/Wall decals & stickers,Home Décor/Wall décor/Picture & photo frames,Home Décor/Wall décor/Picture & photo frames,Home Décor/Wall décor/Picture & photo frames,Home Décor/Wall décor/Picture & photo frames,Rugs/Rugs/Runners & small rugs,Storage & organization/Wall shelves & hooks/Hooks,Storage & organization/Storage containers/Bathroom accessories/Towel rails & towel holders,Kitchen & appliances/Kitchen countertops/Laminate countertops,Furniture/Patio furniture/Outdoor tables/Outdoor dining tables,Home Décor/Wall décor/Picture & photo frames,Kitchen & appliances/Kitchen countertops/Laminate countertops,"Storage & organization/Display & storage cabinets/Buffet tables, sideboard buffets & buffet cabinets",Kitchen & appliances/Kitchen countertops/Laminate countertops,Home Décor/Vases & bowls/Vases,Outdoor/Umbrellas & gazebos/Patio umbrellas & bases,Furniture/Chairs/Dining chairs/Dining chairs,Cookware & tableware/Knives & cutting boards/Cutting boards,Furniture/Sofas & sectionals/Ottomans/Fabric ottomans,Furniture/Patio furniture/Outdoor tables/Outdoor coffee & side tables,Home Textiles/Window treatments/Curtains & drapes/Panel curtains,Home Décor/Storage boxes & baskets/Kids boxes & baskets,Kitchen & appliances/Kitchen islands & carts,Storage & organization/Storage containers/Paper & media organizers/Desk accessories,Kitchen & appliances/Kitchen systems/SEKTION kitchen/SEKTION kitchen cabinets,Kitchen & appliances/Kitchen systems/SEKTION kitchen/SEKTION kitchen cabinets,Furniture/Chairs/Stools & benches/Benches,Furniture/Tables & desks/Dining tables/Up to 4 seats,Furniture/Chairs/Dining chairs/Dining chairs,Storage & organization/Storage containers/Paper & media organizers/Magazine files,Storage & organization/Clothes organizers/Shoe racks & stands,"Storage & organization/Shelving units, bookcases & storage options/Shelf units & cube storage",Furniture/Chairs/Dining chairs/Dining chairs,Storage & organization/Storage containers/Food storage & organizing/Food containers,Storage & organization/Storage containers/Food storage & organizing/Food containers,Storage & organization/Storage containers/Food storage & organizing/Food containers,Storage & organization/Storage containers/Food storage & organizing/Food containers,Storage & organization/Storage containers/Food storage & organizing/Food containers,Home Décor/Wall décor/Picture & photo frames,Home Décor/Wall décor/Picture & photo frames,Home Décor/Wall décor/Picture & photo frames,Furniture/Patio furniture/Outdoor chairs/Outdoor dining chairs,Furniture/Patio furniture/Outdoor tables/Outdoor dining tables,Storage & organization/Storage containers/Food storage & organizing/Food containers,Furniture/Patio furniture/Outdoor chairs/Outdoor dining chairs,Furniture/Patio furniture/Outdoor chairs/Outdoor dining chairs,Cookware & tableware/Knives & cutting boards/Cutting boards,Cookware & tableware/Knives & cutting boards/Cutting boards,Storage & organization/Clothes organizers/Clothes racks & stands,Furniture/Patio furniture/Outdoor tables/Outdoor dining tables,Bathroom/Bathroom storage/Bathroom shelving units,Cookware & tableware/Knives & cutting boards/Cutting boards,Home Décor/Mirrors/Wall mirrors,Home Décor/Mirrors/Vanity mirrors,Home Décor/Mirrors/Wall mirrors,Storage & organization/Storage containers/Bins & bags/Trash cans & pedal bins,Storage & organization/Storage solution systems/PAX system/PAX sliding doors,Kitchen & appliances/Kitchen systems/SEKTION kitchen/SEKTION kitchen cabinets,Kitchen & appliances/Kitchen systems/SEKTION kitchen/SEKTION kitchen cabinets,Home Décor/Mirrors/Makeup & magnifying mirrors,Kitchen & appliances/Kitchen countertops/Laminate countertops,Cookware & tableware/Dinnerware/Deep plates/VÄRDERA Deep plate,Home Décor/Noticeboards,Furniture/Patio furniture/Outdoor tables/Outdoor dining tables,Home Textiles/Window treatments/Curtain rods & rails/Track systems,Storage & organization/Storage containers/Food storage & organizing/Food containers,Furniture/Tables & desks/Dining tables/Up to 10 seats,Baby & kids/Kids/Kids decoration & accessories,Storage & organization/TV & media furniture/TV stands & benches,Furniture/Tables & desks/Dining tables/Up to 4 seats,Furniture/Patio furniture/Outdoor tables/Outdoor dining tables,Kitchen & appliances/Kitchen drawer organization/Drawer dividers,Kitchen & appliances/Kitchen systems/SEKTION kitchen/SEKTION kitchen cabinets,Furniture/Tables & desks/Accent tables/Coffee tables,Home electronics/Cords & chargers/Cables & accessories,Baby & kids/Kids/Toys & play/Physical play,Storage & organization/Storage solution systems/BESTÅ storage system/BESTÅ all parts & accessories,Kitchen & appliances/Kitchen countertops/Laminate countertops,Furniture/Patio furniture/Outdoor chaises & hammocks,Home Textiles/Window treatments/Curtain rods & rails/Track systems,Home Textiles/Window treatments/Curtain rods & rails/Track systems,Home Textiles/Window treatments/Curtain rods & rails/Track systems,Furniture/Tables & desks/Bar tables,Storage & organization/Storage containers/Food storage & organizing/Food containers,Storage & organization/Bags/Bag organizers,Furniture/Tables & desks/Accent tables/End tables & side tables,Cookware & tableware/Cookware & kitchenware/Cooking accessories,Cookware & tableware/Dinnerware/Side plates,Storage & organization/Dressers & storage drawers/Drawer units/Drawer units for home,Furniture/Tables & desks/Kids tables,Storage & organization/Wall shelves/Complete wall shelves/HEMNES Wall,Furniture/Sofas & sectionals/Sofa accessories,Rugs/Rugs/Runners & small rugs,Furniture/Tables & desks/Dining tables/Up to 4 seats,Furniture/Tables & desks/Café tables,Home Décor/Decorative accessories,Furniture/Patio furniture/Outdoor benches,Home Textiles/Window treatments/Curtain rods & rails/Track systems,Furniture/Tables & desks/Desks & computer desks/Desks for home
Home Décor/Storage boxes & baskets/Kids boxes & baskets,Home Décor/Wall décor/Wall decals & stickers,Home Décor/Wall décor/Picture & photo frames,Home Décor/Wall décor/Picture & photo frames,Home Décor/Wall décor/Picture & photo frames,Home Décor/Wall décor/Picture & photo frames,Rugs/Rugs/Runners & small rugs,Storage & organization/Wall shelves & hooks/Hooks,Storage & organization/Storage containers/Bathroom accessories/Towel rails & towel holders,Kitchen & appliances/Kitchen countertops/Laminate countertops,Furniture/Patio furniture/Outdoor tables/Outdoor dining tables,Home Décor/Wall décor/Picture & photo frames,Kitchen & appliances/Kitchen countertops/Laminate countertops,"Storage & organization/Display & storage cabinets/Buffet tables, sideboard buffets & buffet cabinets",Kitchen & appliances/Kitchen countertops/Laminate countertops,Home Décor/Vases & bowls/Vases,Outdoor/Umbrellas & gazebos/Patio umbrellas & bases,Furniture/Chairs/Dining chairs/Dining chairs,Cookware & tableware/Knives & cutting boards/Cutting boards,Furniture/Sofas & sectionals/Ottomans/Fabric ottomans,Furniture/Patio furniture/Outdoor tables/Outdoor coffee & side tables,Home Textiles/Window treatments/Curtains & drapes/Panel curtains,Home Décor/Storage boxes & baskets/Kids boxes & baskets,Kitchen & appliances/Kitchen islands & carts,Storage & organization/Storage containers/Paper & media organizers/Desk accessories,Kitchen & appliances/Kitchen systems/SEKTION kitchen/SEKTION kitchen cabinets,Kitchen & appliances/Kitchen systems/SEKTION kitchen/SEKTION kitchen cabinets,Furniture/Chairs/Stools & benches/Benches,Furniture/Tables & desks/Dining tables/Up to 4 seats,Furniture/Chairs/Dining chairs/Dining chairs,Storage & organization/Storage containers/Paper & media organizers/Magazine files,Storage & organization/Clothes organizers/Shoe racks & stands,"Storage & organization/Shelving units, bookcases & storage options/Shelf units & cube storage",Furniture/Chairs/Dining chairs/Dining chairs,Storage & organization/Storage containers/Food storage & organizing/Food containers,Storage & organization/Storage containers/Food storage & organizing/Food containers,Storage & organization/Storage containers/Food storage & organizing/Food containers,Storage & organization/Storage containers/Food storage & organizing/Food containers,Storage & organization/Storage containers/Food storage & organizing/Food containers,Home Décor/Wall décor/Picture & photo frames,Home Décor/Wall décor/Picture & photo frames,Home Décor/Wall décor/Picture & photo frames,Furniture/Patio furniture/Outdoor chairs/Outdoor dining chairs,Furniture/Patio furniture/Outdoor tables/Outdoor dining tables,Storage & organization/Storage containers/Food storage & organizing/Food containers,Furniture/Patio furniture/Outdoor chairs/Outdoor dining chairs,Furniture/Patio furniture/Outdoor chairs/Outdoor dining chairs,Cookware & tableware/Knives & cutting boards/Cutting boards,Cookware & tableware/Knives & cutting boards/Cutting boards,Storage & organization/Clothes organizers/Clothes racks & stands,Furniture/Patio furniture/Outdoor tables/Outdoor dining tables,Bathroom/Bathroom storage/Bathroom shelving units,Cookware & tableware/Knives & cutting boards/Cutting boards,Home Décor/Mirrors/Wall mirrors,Home Décor/Mirrors/Vanity mirrors,Home Décor/Mirrors/Wall mirrors,Storage & organization/Storage containers/Bins & bags/Trash cans & pedal bins,Storage & organization/Storage solution systems/PAX system/PAX sliding doors,Kitchen & appliances/Kitchen systems/SEKTION kitchen/SEKTION kitchen cabinets,Kitchen & appliances/Kitchen systems/SEKTION kitchen/SEKTION kitchen cabinets,Home Décor/Mirrors/Makeup & magnifying mirrors,Kitchen & appliances/Kitchen countertops/Laminate countertops,Cookware & tableware/Dinnerware/Deep plates/VÄRDERA Deep plate,Home Décor/Noticeboards,Furniture/Patio furniture/Outdoor tables/Outdoor dining tables,Home Textiles/Window treatments/Curtain rods & rails/Track systems,Storage & organization/Storage containers/Food storage & organizing/Food containers,Furniture/Tables & desks/Dining tables/Up to 10 seats,Baby & kids/Kids/Kids decoration & accessories,Storage & organization/TV & media furniture/TV stands & benches,Furniture/Tables & desks/Dining tables/Up to 4 seats,Furniture/Patio furniture/Outdoor tables/Outdoor dining tables,Kitchen & appliances/Kitchen drawer organization/Drawer dividers,Kitchen & appliances/Kitchen systems/SEKTION kitchen/SEKTION kitchen cabinets,Furniture/Tables & desks/Accent tables/Coffee tables,Home electronics/Cords & chargers/Cables & accessories,Baby & kids/Kids/Toys & play/Physical play,Storage & organization/Storage solution systems/BESTÅ storage system/BESTÅ all parts & accessories,Kitchen & appliances/Kitchen countertops/Laminate countertops,Furniture/Patio furniture/Outdoor chaises & hammocks,Home Textiles/Window treatments/Curtain rods & rails/Track systems,Home Textiles/Window treatments/Curtain rods & rails/Track systems,Home Textiles/Window treatments/Curtain rods & rails/Track systems,Furniture/Tables & desks/Bar tables,Storage & organization/Storage containers/Food storage & organizing/Food containers,Storage & organization/Bags/Bag organizers,Furniture/Tables & desks/Accent tables/End tables & side tables,Cookware & tableware/Cookware & kitchenware/Cooking accessories,Cookware & tableware/Dinnerware/Side plates,Storage & organization/Dressers & storage drawers/Drawer units/Drawer units for home,Furniture/Tables & desks/Kids tables,Storage & organization/Wall shelves/Complete wall shelves/HEMNES Wall,Furniture/Sofas & sectionals/Sofa accessories,Rugs/Rugs/Runners & small rugs,Furniture/Tables & desks/Dining tables/Up to 4 seats,Furniture/Tables & desks/Café tables,Home Décor/Decorative accessories,Furniture/Patio furniture/Outdoor benches,Home Textiles/Window treatments/Curtain rods & rails/Track systems,Furniture/Tables & desks/Desks & computer desks/Desks for home
