Pet accessories/Cats,Pet accessories/Cats,Pet accessories/Cats,Beds & mattresses/Bedding/Cushions & cushions covers/Cushion covers,Beds & mattresses/Bedding/Pillows/Down & feather pillows,Beds & mattresses/Bedding/Cushions & cushions covers/Children's cushions & blankets,Beds & mattresses/Bedding/Pillows/Polyester pillows,Beds & mattresses/Bedding/Pillows/Down & feather pillows,Furniture/Sofas & sectionals/Sofa & armchairs covers/FÄRLÖV covers,Rugs/Bath mats,Beds & mattresses/Bedding/Bedspreads,Furniture/Sofas & sectionals/Sofa & armchairs covers/FLOTTEBO covers,Beds & mattresses/Bedding/Bedlinen/Pillowcases,Beds & mattresses/Bedding/Bedlinen/Duvet cover sets,Rugs/Rugs/Runners & small rugs,Beds & mattresses/Bedding/Blankets & throws,Furniture/Chairs/High chairs,Beds & mattresses/Bedding/Bedlinen/Duvet cover sets,Rugs/Rugs/Large & medium rugs,Beds & mattresses/Bedding/Blankets & throws,Beds & mattresses/Bedding/Bedlinen/Duvet cover sets,Beds & mattresses/Bedding/Comforters/Down & feather comforters,Beds & mattresses/Bedding/Comforters/Down & feather comforters,Beds & mattresses/Bedding/Comforters/Down & feather comforters,Baby & kids/Baby/Baby textiles/Baby quilts & pillows,Rugs/Bath mats,Bathroom/Bathroom textiles/Towels/Bath towels,Beds & mattresses/Bedding/Bedspreads,Beds & mattresses/Bedding/Blankets & throws,Beds & mattresses/Bedding/Blankets & throws,Bathroom/Bathroom textiles/Towels/Hand towels,Beds & mattresses/Bedding/Blankets & throws,Beds & mattresses/Bedding/Comforters/Polyester comforters,Beds & mattresses/Bedding/Comforters/Polyester comforters,Beds & mattresses/Bedding/Blankets & throws,Beds & mattresses/Bedding/Blankets & throws,Bathroom/Bathroom textiles/Towels/Wash cloths,Beds & mattresses/Bedding/Comforters/Down & feather comforters,Bathroom/Bathroom textiles/Shower curtains,Beds & mattresses/Bedding/Cushions & cushions covers/Cushion covers,"Outdoor/Outdoor cushions/Outdoor pillows/FUNKÖN Back cushion, indoor",Beds & mattresses/Bedding/Cushions & cushions covers/Cushion covers,"Outdoor/Outdoor cushions/Outdoor pillows/FUNKÖN Cushion cover, in",Beds & mattresses/Bedding/Comforters/Down & feather comforters,Beds & mattresses/Bedding/Comforters/Down & feather comforters,Beds & mattresses/Bedding/Bedlinen/Duvet cover sets,Beds & mattresses/Bedding/Pillows/Down & feather pillows,Beds & mattresses/Bedding/Blankets & throws,Rugs/Rugs/Runners & small rugs,Beds & mattresses/Bedding/Pillows/Down & feather pillows,Beds & mattresses/Bedding/Cushions & cushions covers/Children's cushions & blankets,Furniture/Sofas & sectionals/Sofa & armchairs covers/VRETSTORP covers,Beds & mattresses/Bedding/Bedlinen/Kids bed linen,Furniture/Sofas & sectionals/Sofa & armchairs covers/UPPLAND covers,Furniture/Sofas & sectionals/Sofa & armchairs covers/UPPLAND covers,Furniture/Sofas & sectionals/Sofa & armchairs covers/UPPLAND covers,Furniture/Sofas & sectionals/Sofa & armchairs covers/UPPLAND covers,Beds & mattresses/Mattresses/Kids mattresses,Furniture/Sofas & sectionals/Sofa & armchairs covers/BRÅTHULT covers,Furniture/Sofas & sectionals/Sofa & armchairs covers/KLIPPAN covers,Beds & mattresses/Bedding/Blankets & throws/FÄLTMAL Pillow,Baby & kids/Baby/Baby textiles/Baby blankets & quilts,Furniture/Sofas & sectionals/Sofa & armchairs covers/BRÅTHULT covers,Beds & mattresses/Bedding/Pillows/Polyester pillows,Beds & mattresses/Bedding/Cushions & cushions covers/Cushion covers,Beds & mattresses/Bedding/Cushions & cushions covers/Cushion covers,Furniture/Patio furniture/Outdoor seat cushions,Beds & mattresses/Bedding/Cushions & cushions covers/Cushion covers,Beds & mattresses/Bedding/Cushions & cushions covers/Cushions,Bathroom/Bathroom textiles/Towels/Wash cloths,Bathroom/Bathroom textiles/Towels/Hand towels,"Furniture/Patio furniture/Outdoor seat cushions/SÖTHOLMEN Cushion cover, in",Bathroom/Bathroom textiles/Towels/Bath sheets,Beds & mattresses/Bedding/Cushions & cushions covers/Cushion covers,Beds & mattresses/Bedding/Blankets & throws,"Baby & kids/Baby/Changing, bathing & potty/Changing accessories",Beds & mattresses/Bedding/Blankets & throws,Baby & kids/Baby/Baby textiles/Baby towels & washcloths,Beds & mattresses/Bedding/Blankets & throws,Bathroom/Bathroom textiles/Towels/Bath towels,Beds & mattresses/Bedding/Bedlinen/Baby bed linen,Beds & mattresses/Bedding/Bedlinen/Baby bed linen,Bathroom/Bathroom textiles/Towels/Bath towels,Beds & mattresses/Bedding/Cushions & cushions covers/Cushion covers,Furniture/Sofas & sectionals/Sofa & armchairs covers/VINLIDEN covers,Beds & mattresses/Bedding/Bedlinen/Baby bed linen,Bathroom/Bathroom textiles/Towels/Wash cloths,Furniture/Sofas & sectionals/Sofa & armchairs covers/VINLIDEN covers,Bathroom/Bathroom textiles/Towels/Hand towels,Beds & mattresses/Bedding/Bedlinen/Baby bed linen,Bathroom/Bathroom textiles/Towels/Bath sheets,Beds & mattresses/Bedding/Blankets & throws,Beds & mattresses/Bedding/Mattress & pillow protectors,Furniture/Patio furniture/Outdoor seat cushions,Beds & mattresses/Bedding/Cushions & cushions covers/Cushion covers,Bathroom/Bathroom textiles/Towels/Hand towels,Beds & mattresses/Bedding/Blankets & throws,Furniture/Patio furniture/Outdoor seat cushions,Furniture/Chairs/High chairs,Beds & mattresses/Bedding/Blankets & throws
Kitchen & appliances/Kitchen systems/SEKTION kitchen/SEKTION kitchen cabinets,Storage & organization/Clothes organizers/Shoe racks & stands/MACKAPÄR Shoe,Storage & organization/Storage solution systems/BESTÅ storage system/BESTÅ all parts & accessories/BESTÅ doors & drawer fronts,Storage & organization/Clothes organizers/Shoe racks & stands,Storage & organization/Storage containers/Paper & media organizers/Media accessories,Storage & organization/Storage containers/Bathroom accessories/Shower accessories,Kitchen & appliances/Kitchen drawer organization/Kitchen trash cans & bins,Storage & organization/Storage containers/Bins & bags/Trash cans & pedal bins,Cookware & tableware/Knives & cutting boards/Cutting boards,Cookware & tableware/Kitchen & cooking accessories/Kitchen utensils/Cooking preparation tools,Storage & organization/Storage containers/Bins & bags/Trash cans & pedal bins,Storage & organization/Storage solution systems/BESTÅ storage system/BESTÅ all parts & accessories,Kitchen & appliances/Kitchen systems/SEKTION kitchen/SEKTION kitchen cabinets,Cookware & tableware/Kitchen & cooking accessories/Kitchen utensils/Colanders & strainers,Cookware & tableware/Kitchen & cooking accessories/Kitchen utensils/Colanders & strainers,Storage & organization/Storage containers/Bins & bags/Trash cans & pedal bins,Storage & organization/Storage solution systems/PAX system/PAX doors without hinges,Storage & organization/Storage solution systems/AURDAL system/AURDAL parts,Storage & organization/Storage solution systems/AURDAL system/AURDAL parts,Storage & organization/Storage solution systems/AURDAL system/AURDAL parts,Storage & organization/Storage solution systems/AURDAL system/AURDAL parts,Kitchen & appliances/Kitchen systems/SEKTION kitchen/SEKTION kitchen cabinets,Kitchen & appliances/Kitchen systems/SEKTION kitchen/SEKTION kitchen cabinets,Storage & organization/Storage solution systems/AURDAL system/AURDAL parts,Storage & organization/Storage solution systems/AURDAL system/AURDAL parts,Storage & organization/Storage solution systems/AURDAL system/AURDAL parts,Storage & organization/Storage solution systems/AURDAL system/AURDAL parts,Storage & organization/Storage solution systems/AURDAL system/AURDAL parts,Kitchen & appliances/Kitchen systems/SEKTION kitchen/SEKTION kitchen cabinets,Storage & organization/Storage solution systems/BESTÅ storage system/BESTÅ all parts & accessories,Storage & organization/Storage solution systems/AURDAL system/AURDAL parts,Storage & organization/Storage solution systems/AURDAL system/AURDAL parts,Storage & organization/Storage containers/Bathroom accessories/Bathroom shelves,Storage & organization/Storage containers/Bathroom accessories/Bathroom boxes & baskets,Storage & organization/Storage containers/Food storage & organizing/Food containers,Cookware & tableware/Serveware/Trays,Kitchen & appliances/Kitchen drawer organization/Drawer dividers,Home Textiles/Window treatments/Curtain rods & rails/Track systems,Furniture/Tables & desks/Dining tables/Up to 6 seats,Home Décor/Mirrors/Wall mirrors,Bathroom/Bathroom storage/Bathroom storage/Bathroom wall cabinets,Cookware & tableware/Cookware & kitchenware/Pots & pans/Cooking & stock pots,Storage & organization/Storage containers/Bathroom accessories/Bathroom boxes & baskets,Storage & organization/Storage solution systems/AURDAL system/AURDAL parts,Storage & organization/Storage solution systems/BESTÅ storage system/BESTÅ all parts & accessories,Cookware & tableware/Cookware & kitchenware/Pots & pans/Cooking & stock pots,Cookware & tableware/Cookware & kitchenware/Pots & pans/Cooking & stock pots,Cookware & tableware/Cookware & kitchenware/Pots & pans/Cooking & stock pots,Cookware & tableware/Cookware & kitchenware/Cooking pans/Frying pans & skillets,Cookware & tableware/Cookware & kitchenware/Cooking pans/Frying pans & skillets,Cookware & tableware/Cookware & kitchenware/Cooking pans/Frying pans & skillets,Cookware & tableware/Cookware & kitchenware/Cooking pans/Frying pans & skillets,Bathroom/Showers/Shower heads,Storage & organization/TV & media furniture/TV stands & benches,Cookware & tableware/Cookware & kitchenware/Pots & pans/Saucepans,Home electronics/Cords & chargers/Wireless charging & accessories,Furniture/Tables & desks/Accent tables/Coffee tables,Storage & organization/Storage containers/Bathroom accessories/Bathroom accessory sets,Home electronics/Cords & chargers/USB chargers,Home Décor/Noticeboards,Cookware & tableware/Dinnerware/Side plates,"Storage & organization/Shelving units, bookcases & storage options/Shelf units & cube storage",Storage & organization/Storage containers/Bins & bags/Trash cans & pedal bins,Storage & organization/Storage containers/Bathroom accessories/Bathroom boxes & baskets,Storage & organization/Storage containers/Bathroom accessories/Shower accessories,"Storage & organization/Shelving units, bookcases & storage options/Shelf units & cube storage",Storage & organization/Storage containers/Bathroom accessories/Towel rails & towel holders,"Storage & organization/Shelving units, bookcases & storage options/Shelf units & cube storage",Home electronics/Cords & chargers/Wireless charging & accessories,Storage & organization/Storage containers/Bathroom accessories/Toilet brushes,Storage & organization/Storage containers/Bathroom accessories/Towel rails & towel holders,Storage & organization/Storage containers/Bins & bags/Trash cans & pedal bins,Home electronics/Cords & chargers/USB chargers,Cookware & tableware/Dinnerware/Deep plates/VARDAGEN Deep plate,Cookware & tableware/Coffee & tea/Mugs & cups,Cookware & tableware/Cookware & kitchenware/Pots & pans/Casserole dishes,Cookware & tableware/Cookware & kitchenware/Pots & pans/Casserole dishes,Home electronics/Speakers/Bluetooth speakers,Storage & organization/Storage solution systems/SMÅSTAD system/SMÅSTAD interior fittings,Furniture/Kids furniture/Toy storage,Cookware & tableware/Drinkware/Pitchers & carafes,Storage & organization/Storage containers/Bathroom accessories/Towel rails & towel holders,Home Décor/Wall décor/Picture & photo frames,Furniture/Kids furniture/Toy storage,Kitchen & appliances/Kitchen islands & carts,Cookware & tableware/Dinnerware/Bowls,Cookware & tableware/Dinnerware/Bowls,Home Décor/Storage boxes & baskets/Paper & media boxes,Storage & organization/Storage solution systems/SMÅSTAD system/SMÅSTAD interior fittings,"Storage & organization/Shelving units, bookcases & storage options/Shelf units & cube storage",Home Décor/Wall décor/Picture & photo frames,Storage & organization/Clothes organizers/Shoe cabinets,Cookware & tableware/Cookware & kitchenware/Cooking pans/Grill pans & griddles,Furniture/Tables & desks/Table & desk systems/GALANT/BEKANT system,Furniture/Tables & desks/Table & desk systems/GALANT/BEKANT system,Furniture/Tables & desks/Table & desk systems/GALANT/BEKANT system,Furniture/Tables & desks/Table & desk systems/GALANT/BEKANT system,Furniture/Tables & desks/Table & desk systems/GALANT/BEKANT system,Storage & organization/Display & storage cabinets/Dining room cabinets & cupboards,Kitchen & appliances/Kitchen systems/SEKTION kitchen/SEKTION kitchen cabinets
Bathroom/Bathroom sinks,Kitchen & appliances/Backsplashes & wall panels/Laminate backsplashes,Home Décor/Mirrors/Vanity mirrors,Home Textiles/Window treatments/Curtains & drapes/Panel curtains,Home Décor/Noticeboards,Bathroom/Bathroom sinks,Bathroom/Bathroom sinks,Cookware & tableware/Flatware/Flatware,Home Textiles/Window treatments/Curtains & drapes/Light filtering curtains,Storage & organization/Clothes organizers/Clothes racks & stands,Home Textiles/Window treatments/Curtains & drapes/Light filtering curtains,Kitchen & appliances/Backsplashes & wall panels/Laminate backsplashes,Home Textiles/Window treatments/Curtains & drapes/Light filtering curtains,"Home Textiles/Window treatments/Shades, blinds & window treatments/Pleated & cellular blinds and shades",Bathroom/Bathroom sinks,Storage & organization/Clothes organizers/Clothes racks & stands,Home Textiles/Window treatments/Curtains & drapes/Light filtering curtains,Kitchen & appliances/Backsplashes & wall panels/Laminate backsplashes,Bathroom/Bathroom sinks,Home Textiles/Window treatments/Curtains & drapes/Panel curtains,"Home Textiles/Window treatments/Shades, blinds & window treatments/Roman shades",Home Textiles/Window treatments/Curtains & drapes/Light filtering curtains,Home Textiles/Window treatments/Curtains & drapes/Light filtering curtains,"Home improvement/Oils, stains & product care","Home improvement/Oils, stains & product care","Home improvement/Oils, stains & product care","Home improvement/Oils, stains & product care",Home Textiles/Window treatments/Curtains & drapes/Panel curtains,Home Textiles/Window treatments/Curtains & drapes/Light filtering curtains,Home Textiles/Window treatments/Curtains & drapes/Light filtering curtains,Home Textiles/Window treatments/Curtains & drapes/Panel curtains,Furniture/Patio furniture/Outdoor chaises & hammocks,Kitchen & appliances/Kitchen systems/SEKTION kitchen/SEKTION kitchen cabinets,Kitchen & appliances/Kitchen systems/SEKTION kitchen/SEKTION kitchen cabinets,Home Textiles/Window treatments/Curtain rods & rails/Track systems,Kitchen & appliances/Kitchen systems/SEKTION kitchen/SEKTION kitchen cabinets,Kitchen & appliances/Kitchen systems/SEKTION kitchen/SEKTION kitchen cabinets,Rugs/Rugs/Door mats,Home Textiles/Window treatments/Curtain rods & rails/Curtain rods,Kitchen & appliances/Kitchen systems/SEKTION kitchen/SEKTION kitchen cabinets,Kitchen & appliances/Kitchen systems/SEKTION kitchen/SEKTION kitchen cabinets/Cabinet doors & drawer fronts,Home Décor/Storage boxes & baskets/Secondary storage boxes,Lighting/Lamps & light fixtures/Kids lighting,Lighting/Lamps & light fixtures/Ceiling lights/Pendants lights,Lighting/Lamps & light fixtures/Ceiling lights/Pendants lights,Cookware & tableware/Napkins & napkin holders/Napkin holders,Home Textiles/Window treatments/Curtain rods & rails/Track systems,Home Textiles/Window treatments/Curtain rods & rails/Track systems,Home Textiles/Window treatments/Curtain rods & rails/Track systems,Storage & organization/Storage solution systems/PAX system/PAX doors without hinges,Cookware & tableware/Coffee & tea/Mugs & cups,Cookware & tableware/Dinnerware/Bowls,Storage & organization/Storage solution systems/PAX system/PAX doors without hinges,Home Textiles/Window treatments/Curtain rods & rails/Track systems,Baby & kids/Kids/Toys & play/Physical play,Cookware & tableware/Dinnerware/Dinnerware sets,Cookware & tableware/Coffee & tea/Mugs & cups,Cookware & tableware/Coffee & tea/Mugs & cups,Home electronics/Speakers/Bluetooth speakers,Storage & organization/Storage solution systems/PAX system/PAX doors without hinges,Cookware & tableware/Dinnerware/Plates,Baby & kids/Kids/Toys & play/Role play,Cookware & tableware/Cookware & kitchenware/Cooking pans/Frying pans & skillets,Cookware & tableware/Serveware/Trays,Baby & kids/Kids/Toys & play/Arts & crafts,Laundry & cleaning/Cleaning accessories,Kitchen & appliances/Kitchen systems/SEKTION kitchen/SEKTION kitchen cabinets,Kitchen & appliances/Kitchen systems/SEKTION kitchen/SEKTION kitchen cabinets,"Home Textiles/Window treatments/Shades, blinds & window treatments/Black-out shades & blinds",Storage & organization/Storage solution systems/PAX system/PAX doors without hinges,Cookware & tableware/Dinnerware/Side plates,Cookware & tableware/Dinnerware/Plates,Home Textiles/Window treatments/Curtains & drapes/Light filtering curtains,Cookware & tableware/Dinnerware/Deep plates/FLITIGHET Deep plate,Home Textiles/Window treatments/Curtain rods & rails/Track systems,Cookware & tableware/Dinnerware/Bowls,Cookware & tableware/Dinnerware/Side plates,Home Textiles/Window treatments/Curtain rods & rails/Curtain rods,Cookware & tableware/Dinnerware/Dinnerware sets,Outdoor/Umbrellas & gazebos/Patio umbrellas & bases,Rugs/Rugs/Door mats,Outdoor/Outdoor flooring,Outdoor/Outdoor flooring,Home Textiles/Window treatments/Curtains & drapes/Room darkening curtains & drapes,Pet accessories/Cats,Lighting/Lamps & light fixtures/Table lamps,Home electronics/Speakers/Wi-Fi speakers,Cookware & tableware/Cookware & kitchenware/Cooking pans/Woks,Home Décor/Storage boxes & baskets/Kids boxes & baskets,Home Décor/Storage boxes & baskets/Clothes boxes,Home Décor/Wall décor/Art posters,Home Décor/Wall décor/Wall art,Home Décor/Wall décor/Wall art,Baby & kids/Kids/Toys & play/Role play,Storage & organization/Storage containers/Paper & media organizers/Desk accessories,Bathroom/Bathroom textiles/Shower curtains,Cookware & tableware/Napkins & napkin holders/Napkin holders,Home Décor/Clocks/Alarm clocks,Home Décor/Clocks/Alarm clocks,Storage & organization/Storage containers/Bins & bags/Trash cans & pedal bins
Bathroom/Bathroom vanities/Bathroom vanity legs,Storage & organization/Wall shelves/Brackets,Furniture/Tables & desks/Bar tables,Storage & organization/Wall shelves/Shelves,Storage & organization/Wall shelves/Shelves,Bathroom/Bathroom storage/Bathroom storage/Bathroom wall cabinets,Home Décor/Storage boxes & baskets/Kids boxes & baskets,Storage & organization/Display & storage cabinets/Display cabinets,Storage & organization/Wall shelves/Shelves,Storage & organization/Display & storage cabinets/Dining room cabinets & cupboards,"Storage & organization/Shelving units, bookcases & storage options/Shelf units & cube storage",Storage & organization/Storage solution systems/IVAR system/All parts,Storage & organization/Display & storage cabinets/Dining room cabinets & cupboards,"Storage & organization/Shelving units, bookcases & storage options/Shelf units & cube storage",Storage & organization/Wall shelves/Brackets,Home Décor/Mirrors/Mirror cabinets,"Storage & organization/Shelving units, bookcases & storage options/Storage shelves & units","Storage & organization/Storage solution systems/ELVARLI system/Post, side units & interiors",Storage & organization/Wall shelves/Brackets,Kitchen & appliances/Kitchen drawer organization/Shelves & drawers,Kitchen & appliances/Kitchen drawer organization/Shelves & drawers,Furniture/Tables & desks/Console tables & sofa tables,Home Décor/Mirrors/Mirror cabinets,Storage & organization/Display & storage cabinets/Dining room cabinets & cupboards,Storage & organization/Storage solution systems/BOAXEL system/BOAXEL parts,Storage & organization/Storage solution systems/IVAR system/All parts,Storage & organization/Storage solution systems/IVAR system/All parts,Bathroom/Bathroom storage/Bathroom storage/Bathroom tall cabinets,Storage & organization/Display & storage cabinets/Dining room cabinets & cupboards,Storage & organization/Storage solution systems/PAX system/PAX Interior organizers,"Storage & organization/Shelving units, bookcases & storage options/Shelf units & cube storage",Storage & organization/Storage solution systems/PAX system/PAX Interior organizers,Storage & organization/Clothes organizers/Shoe racks & stands,"Storage & organization/Display & storage cabinets/Buffet tables, sideboard buffets & buffet cabinets",Storage & organization/Storage solution systems/BOAXEL system/BOAXEL parts,Bathroom/Bathroom vanities/Vanity cabinets with sink,Bathroom/Bathroom vanities/Vanity cabinets with sink,Storage & organization/TV & media furniture/TV stands & benches,Storage & organization/TV & media furniture/TV stands & benches,Storage & organization/TV & media furniture/TV stands & benches,Home Décor/Storage boxes & baskets/Secondary storage boxes,Kitchen & appliances/Kitchen systems/SEKTION kitchen/SEKTION kitchen cabinets,Storage & organization/Storage containers/Food storage & organizing/Food containers,Cookware & tableware/Knives & cutting boards/Sharpening tools,Storage & organization/Storage solution systems/BESTÅ storage system/BESTÅ all parts & accessories,Storage & organization/Storage solution systems/BESTÅ storage system/BESTÅ all parts & accessories,Storage & organization/Storage solution systems/BESTÅ storage system/BESTÅ all parts & accessories,"Storage & organization/Shelving units, bookcases & storage options/Shelf units & cube storage","Storage & organization/Storage solution systems/ELVARLI system/Post, side units & interiors",Storage & organization/Storage containers/Cable management & accessories,Storage & organization/Clothes organizers/Shoe racks & stands,"Storage & organization/Storage solution systems/ELVARLI system/Post, side units & interiors",Storage & organization/Storage solution systems/BOAXEL system/BOAXEL parts,Storage & organization/Wall shelves/Complete wall shelves,"Storage & organization/Display & storage cabinets/Buffet tables, sideboard buffets & buffet cabinets",Storage & organization/Display & storage cabinets/Display cabinets,Storage & organization/Storage solution systems/SMÅSTAD system/SMÅSTAD doors & drawers,Storage & organization/Storage solution systems/SMÅSTAD system/SMÅSTAD doors & drawers,Storage & organization/Dressers & storage drawers/Chests of drawers,Storage & organization/TV & media furniture/TV stands & benches,Storage & organization/Storage containers/Paper & media organizers/Magazine files,Storage & organization/Wall shelves/Brackets,Storage & organization/TV & media furniture/TV stands & benches,Storage & organization/TV & media furniture/TV stands & benches,Storage & organization/Dressers & storage drawers/Chests of drawers,Storage & organization/Dressers & storage drawers/Chests of drawers,Storage & organization/TV & media furniture/TV stands & benches,Storage & organization/Clothes organizers/Clothes racks & stands,Kitchen & appliances/Kitchen drawer organization/Shelves & drawers,Storage & organization/Storage containers/Paper & media organizers/Desk accessories,Furniture/Tables & desks/Desks & computer desks/Desks for home,Storage & organization/Dressers & storage drawers/Chests of drawers,Kitchen & appliances/Kitchen islands & carts,Cookware & tableware/Dishwashing accessories/Dish drainers & drying racks,Storage & organization/Dressers & storage drawers/Drawer units/Drawer units for home,Storage & organization/Storage containers/Food storage & organizing/Food containers,Furniture/Tables & desks/Desks & computer desks/Desks for home,Furniture/Tables & desks/Desks & computer desks/Desks for home,Storage & organization/Display & storage cabinets/Display cabinets,Storage & organization/Display & storage cabinets/Display cabinets,Storage & organization/Storage containers/Paper & media organizers/Desk accessories,Storage & organization/TV & media furniture/TV stands & benches,"Storage & organization/Shelving units, bookcases & storage options/Storage shelves & units",Furniture/Tables & desks/Desks & computer desks/Desks for home,Kitchen & appliances/Kitchen islands & carts,Kitchen & appliances/Kitchen islands & carts,"Storage & organization/Shelving units, bookcases & storage options/Shelf units & cube storage",Furniture/Tables & desks/Desks & computer desks/Desks for home,Storage & organization/Armoires & wardrobes/Solitaire wardrobes,Storage & organization/Display & storage cabinets/Filing cabinets & storage cabinets/Office storage cabinets & units,Storage & organization/Wall shelves & hooks/Hooks,Kitchen & appliances/Kitchen islands & carts,"Storage & organization/Storage solution systems/ELVARLI system/Post, side units & interiors",Laundry & cleaning/Ironing boards,Storage & organization/Dressers & storage drawers/Chests of drawers,Storage & organization/Storage solution systems/SMÅSTAD system/SMÅSTAD doors & drawers,Storage & organization/Storage containers/Paper & media organizers/Desk accessories,Storage & organization/Storage solution systems/SMÅSTAD system/SMÅSTAD doors & drawers,Storage & organization/Storage containers/Bathroom accessories/Towel rails & towel holders,Storage & organization/Dressers & storage drawers/Chests of drawers
