Beds & mattresses/Bedding/Blankets & throws,Beds & mattresses/Bedding/Pillows/Polyester pillows,Rugs/Rugs/Large & medium rugs,Beds & mattresses/Bedding/Cushions & cushions covers/Cushions,Rugs/Rugs/Door mats,Beds & mattresses/Bedding/Cushions & cushions covers/Cushion covers,Baby & kids/Baby/Cribs & crib mattresses/Baby canopies,Beds & mattresses/Bedding/Blankets & throws,Furniture/Sofas & sectionals/Sofa & armchairs covers/FLOTTEBO covers,Beds & mattresses/Bedding/Cushions & cushions covers/Cushion covers,Bathroom/Bathroom textiles/Towels/Hand towels,Bathroom/Bathroom textiles/Towels/Wash cloths,Bathroom/Bathroom textiles/Towels/Bath sheets,Beds & mattresses/Bedding/Cushions & cushions covers/Cushion covers,Beds & mattresses/Bedding/Blankets & throws,Beds & mattresses/Bedding/Blankets & throws,Beds & mattresses/Bedding/Blankets & throws,Bathroom/Bathroom textiles/Towels/Hand towels,Bathroom/Bathroom textiles/Towels/Bath towels,Beds & mattresses/Bedding/Bedlinen/Duvet cover sets,"Outdoor/Outdoor cushions/Outdoor pillows/FUNKÖN Cushion cover, in","Outdoor/Outdoor cushions/Outdoor pillows/FUNKÖN Back cushion, indoor",Beds & mattresses/Bedding/Cushions & cushions covers/Cushions,Furniture/Sofas & sectionals/Sofa & armchairs covers/STOCKSUND covers,Rugs/Rugs/Sheepskins & cowhides,Beds & mattresses/Bedding/Cushions & cushions covers/Cushion covers,Rugs/Rugs/Sheepskins & cowhides,Beds & mattresses/Bedding/Blankets & throws/FÄLTMAL Pillow,Furniture/Beds/Kids beds/Kids bed accessories & canopies,Baby & kids/Baby/Baby textiles/Baby quilts & pillows,Rugs/Rugs/Runners & small rugs,Furniture/Sofas & sectionals/Sofa & armchairs covers/FÄRLÖV covers,Baby & kids/Baby/Baby textiles/Nursery rugs,Beds & mattresses/Bedding/Bedlinen/Duvet cover sets,Beds & mattresses/Bedding/Bedlinen/Duvet cover sets,Beds & mattresses/Bedding/Bedlinen/Duvet cover sets,Cookware & tableware/Kitchen textiles/Kitchen towels,Beds & mattresses/Bedding/Cushions & cushions covers/Cushions,Rugs/Rugs/Door mats,Beds & mattresses/Bedding/Cushions & cushions covers/Children's cushions & blankets,Beds & mattresses/Bedding/Pillows/Down & feather pillows,Beds & mattresses/Bedding/Pillows/Down & feather pillows,Furniture/Chairs/High chairs,Furniture/Armchairs & chaises/Rattan armchairs,Furniture/Armchairs & chaises/Rattan armchairs,"Furniture/Patio furniture/Outdoor seat cushions/SÖTHOLMEN Cushion cover, in",Beds & mattresses/Bedding/Cushions & cushions covers/Cushion covers,"Rugs/Rugs/Large & medium rugs/SKARRILD Rug flatwoven, in",Laundry & cleaning/Laundry baskets,Beds & mattresses/Mattresses/Kids mattresses,Beds & mattresses/Bedding/Bedlinen/Duvet cover sets,Beds & mattresses/Bedding/Cushions & cushions covers/Inner cushions,Beds & mattresses/Bedding/Cushions & cushions covers/Inner cushions,Beds & mattresses/Bedding/Cushions & cushions covers/Inner cushions,Beds & mattresses/Bedding/Bedlinen/Duvet cover sets,Beds & mattresses/Bedding/Cushions & cushions covers/Cushion covers,Beds & mattresses/Mattresses/Mattress toppers,"Baby & kids/Baby/Changing, bathing & potty/Changing accessories",Furniture/Tables & desks/Changing tables,Beds & mattresses/Bedding/Cushions & cushions covers/Cushion covers,Beds & mattresses/Bedding/Bedlinen/Duvet cover sets,Beds & mattresses/Bedding/Bedlinen/Duvet cover sets,Beds & mattresses/Bedding/Comforters/Down & feather comforters,Beds & mattresses/Bedding/Comforters/Down & feather comforters,Beds & mattresses/Bedding/Comforters/Down & feather comforters,Beds & mattresses/Bedding/Mattress & pillow protectors,Beds & mattresses/Bedding/Blankets & throws,Furniture/Patio furniture/Outdoor seat cushions,Baby & kids/Baby/Baby textiles/Baby towels & washcloths,Furniture/Patio furniture/Outdoor seat cushions,Furniture/Patio furniture/Outdoor seat cushions,Beds & mattresses/Bedding/Cushions & cushions covers/Cushion covers,Beds & mattresses/Bedding/Cushions & cushions covers/Cushions,Rugs/Rugs/Large & medium rugs,Furniture/Armchairs & chaises/Kids armchairs,Beds & mattresses/Bedding/Comforters/Polyester comforters,Beds & mattresses/Bedding/Comforters/Polyester comforters,Furniture/Sofas & sectionals/Sofa & armchairs covers/HÄRLANDA covers,Beds & mattresses/Bedding/Pillows/Polyester pillows,Furniture/Sofas & sectionals/Sofa & armchairs covers/HÄRLANDA covers,Beds & mattresses/Bedding/Pillows/Polyester pillows,Furniture/Sofas & sectionals/Sofa & armchairs covers/HÄRLANDA covers,Furniture/Sofas & sectionals/Fabric sofas/Modular fabric sofas,Furniture/Sofas & sectionals/Sofa & armchairs covers/HÄRLANDA covers,Home Textiles/Window treatments/Curtains & drapes/Light filtering curtains,Rugs/Rugs/Large & medium rugs,Rugs/Rugs/Large & medium rugs,Pet accessories/Cats,Pet accessories/Cats,Pet accessories/Cats,Rugs/Rugs/Round rugs,Beds & mattresses/Bedding/Bedlinen/Duvet cover sets,Beds & mattresses/Bedding/Cushions & cushions covers/Cushion covers,Beds & mattresses/Bedding/Cushions & cushions covers/Cushion covers,Beds & mattresses/Bedding/Cushions & cushions covers/Cushion covers,Furniture/Beds/Sleeper sofas/Mattress choices,Furniture/Tables & desks/Changing tables,Rugs/Rugs/Runners & small rugs,Beds & mattresses/Bedding/Cushions & cushions covers/Cushion covers,Beds & mattresses/Bedding/Cushions & cushions covers/Cushions
Storage & organization/Storage solution systems/AURDAL system/AURDAL parts,Storage & organization/Storage solution systems/AURDAL system/AURDAL parts,Storage & organization/Storage solution systems/AURDAL system/AURDAL parts,Storage & organization/Storage solution systems/AURDAL system/AURDAL parts,Storage & organization/Storage solution systems/AURDAL system/AURDAL parts,Storage & organization/Storage solution systems/AURDAL system/AURDAL parts,Storage & organization/Storage solution systems/AURDAL system/AURDAL parts,Storage & organization/Storage solution systems/AURDAL system/AURDAL parts,Storage & organization/Storage solution systems/AURDAL system/AURDAL parts,Storage & organization/Storage solution systems/AURDAL system/AURDAL parts,Storage & organization/Storage solution systems/AURDAL system/AURDAL parts,Storage & organization/Storage solution systems/AURDAL system/AURDAL parts,Home Décor/Mirrors/Wall mirrors,Baby & kids/Kids/Kids storage & organization/Children's hooks & wall organization,Storage & organization/Clothes organizers/Shoe racks & stands,Storage & organization/Wall shelves/Brackets,"Storage & organization/Shelving units, bookcases & storage options/Shelf units & cube storage","Storage & organization/Shelving units, bookcases & storage options/Shelf units & cube storage",Kitchen & appliances/Kitchen drawer organization/Drawer dividers,Home electronics/Cords & chargers/Wireless charging & accessories,Home Décor/Mirrors/Makeup & magnifying mirrors,Bathroom/Bathroom storage/Bathroom storage/Bathroom wall cabinets,Storage & organization/Storage containers/Bathroom accessories/Shower accessories,Storage & organization/Storage containers/Bathroom accessories/Toilet roll holders & stands,Storage & organization/Storage containers/Bathroom accessories/Shower accessories,Bathroom/Showers/Shower sets & rails,Storage & organization/Storage containers/Bathroom accessories/Soap dispensers & soap dishes,Storage & organization/Storage containers/Bathroom accessories/Toothbrush holders,Storage & organization/Storage containers/Bathroom accessories/Towel rails & towel holders,Storage & organization/Storage containers/Bathroom accessories/Towel rails & towel holders,Storage & organization/Storage solution systems/BESTÅ storage system/BESTÅ all parts & accessories,Storage & organization/Storage containers/Paper & media organizers/Media accessories,Storage & organization/Storage containers/Bins & bags/Trash cans & pedal bins,Bathroom/Bathroom storage/Bathroom shelving units,Cookware & tableware/Cookware & kitchenware/Ovenware,Cookware & tableware/Serveware/Trays,Cookware & tableware/Knives & cutting boards/Cutting boards,Storage & organization/Wall shelves/Complete wall shelves,Storage & organization/Storage solution systems/BESTÅ storage system/BESTÅ all parts & accessories,Cookware & tableware/Cookware & kitchenware/Pots & pans/Cookware sets,Cookware & tableware/Cookware & kitchenware/Pots & pans/Saucepans,Cookware & tableware/Cookware & kitchenware/Cooking pans/Frying pans & skillets,Kitchen & appliances/Kitchen systems/SEKTION kitchen/SEKTION kitchen cabinets/Cabinet doors & drawer fronts,Cookware & tableware/Serveware/Serving dishes,Cookware & tableware/Cookware & kitchenware/Pots & pans/Cooking & stock pots,Cookware & tableware/Cookware & kitchenware/Cooking pans/Frying pans & skillets,Kitchen & appliances/Kitchen systems/SEKTION kitchen/SEKTION kitchen cabinets,Cookware & tableware/Cookware & kitchenware/Cooking pans/Frying pans & skillets,Cookware & tableware/Cookware & kitchenware/Cooking pans/Frying pans & skillets,Storage & organization/Storage containers/Food storage & organizing/Cooler bags,Kitchen & appliances/Kitchen systems/SEKTION kitchen/SEKTION kitchen cabinets,Cookware & tableware/Cookware & kitchenware/Cooking pans/Frying pans & skillets,Cookware & tableware/Cookware & kitchenware/Cooking pans/Frying pans & skillets,Kitchen & appliances/Kitchen faucets & sinks/Sink parts,Kitchen & appliances/Kitchen systems/SEKTION kitchen/SEKTION kitchen cabinets,Storage & organization/Storage containers/Food storage & organizing/Jars & tins,Storage & organization/Storage containers/Bins & bags/Trash cans & pedal bins,Cookware & tableware/Cookware & kitchenware/Cooking pans/Frying pans & skillets,Cookware & tableware/Cookware & kitchenware/Pots & pans/Cooking & stock pots,Cookware & tableware/Cookware & kitchenware/Cooking pans/Frying pans & skillets,Cookware & tableware/Cookware & kitchenware/Pots & pans/Cooking & stock pots,Cookware & tableware/Cookware & kitchenware/Cooking pans/Frying pans & skillets,Cookware & tableware/Cookware & kitchenware/Cooking pans/Frying pans & skillets,Cookware & tableware/Cookware & kitchenware/Pots & pans/Cooking & stock pots,Cookware & tableware/Cookware & kitchenware/Pots & pans/Cooking & stock pots,Cookware & tableware/Cookware & kitchenware/Pots & pans/Saucepans,Storage & organization/Storage solution systems/PAX system/PAX Interior organizers,Furniture/Tables & desks/Table & desk systems/GALANT/BEKANT system,Furniture/Tables & desks/Table & desk systems/GALANT/BEKANT system,Furniture/Chairs/Desk chairs/Desk chairs for home,Furniture/Tables & desks/Table & desk systems/GALANT/BEKANT system,Furniture/Tables & desks/Table & desk systems/GALANT/BEKANT system,Furniture/Tables & desks/Table & desk systems/GALANT/BEKANT system,Furniture/Tables & desks/Table & desk systems/GALANT/BEKANT system,"Storage & organization/Shelving units, bookcases & storage options/Bookcases",Bathroom/Bathroom faucets/Faucets,Furniture/Tables & desks/Table & desk systems/GALANT/BEKANT system/BEKANT desk underframes/BEKANT Sit,Furniture/Tables & desks/Table & desk systems/GALANT/BEKANT system,Furniture/Tables & desks/Table & desk systems/GALANT/BEKANT system,Furniture/Tables & desks/Table & desk systems/GALANT/BEKANT system,Storage & organization/Storage containers/Bathroom accessories/Shower accessories,Storage & organization/Storage solution systems/PAX system/PAX Interior organizers,"Storage & organization/Shelving units, bookcases & storage options/Bookcases","Storage & organization/Shelving units, bookcases & storage options/Bookcases",Storage & organization/Display & storage cabinets/Filing cabinets & storage cabinets/Office storage cabinets & units,Storage & organization/Display & storage cabinets/Filing cabinets & storage cabinets/Office storage cabinets & units,Storage & organization/Dressers & storage drawers/Drawer units/Drawer units for office,Storage & organization/Storage solution systems/PAX system/PAX Interior organizers,Storage & organization/Dressers & storage drawers/Drawer units/Drawer units for office,Storage & organization/Storage solution systems/PAX system/PAX Interior organizers,"Storage & organization/Shelving units, bookcases & storage options/Bookcases",Storage & organization/Dressers & storage drawers/Drawer units/Drawer units for office,Storage & organization/Display & storage cabinets/Dining room cabinets & cupboards,Storage & organization/Storage solution systems/PAX system/PAX Interior organizers,Storage & organization/Storage solution systems/PAX system/PAX Interior organizers,Storage & organization/Storage solution systems/PAX system/PAX sliding doors,Storage & organization/Storage solution systems/PAX system/PAX Interior organizers,Furniture/Tables & desks/Table & desk systems/IDÅSEN system,Furniture/Tables & desks/Table & desk systems/IDÅSEN system,Furniture/Tables & desks/Table & desk systems/IDÅSEN system
Home Textiles/Window treatments/Curtains & drapes/Light filtering curtains,Home Textiles/Window treatments/Curtains & drapes/Light filtering curtains,Home Textiles/Window treatments/Curtains & drapes/Light filtering curtains,Home Textiles/Window treatments/Curtains & drapes/Light filtering curtains,Home Textiles/Window treatments/Curtains & drapes/Light filtering curtains,"Home Textiles/Window treatments/Shades, blinds & window treatments/Roman shades",Home Textiles/Window treatments/Curtains & drapes/Panel curtains,Home Textiles/Window treatments/Curtains & drapes/Panel curtains,Home Textiles/Window treatments/Curtains & drapes/Light filtering curtains,"Home Textiles/Window treatments/Shades, blinds & window treatments/Pleated & cellular blinds and shades",Home Textiles/Window treatments/Curtains & drapes/Light filtering curtains,Home Textiles/Window treatments/Curtains & drapes/Panel curtains,Home Textiles/Window treatments/Curtains & drapes/Light filtering curtains,Home Textiles/Window treatments/Curtains & drapes/Panel curtains,Home Décor/Noticeboards,Storage & organization/Clothes organizers/Clothes racks & stands,Storage & organization/Clothes organizers/Clothes racks & stands,Storage & organization/Storage solution systems/PAX system/PAX doors without hinges,Home Décor/Clocks/Alarm clocks,Home Décor/Mirrors/Vanity mirrors,Lighting/Lamps & light fixtures/Kids lighting,Rugs/Rugs/Door mats,"Home improvement/Oils, stains & product care","Home improvement/Oils, stains & product care","Home improvement/Oils, stains & product care","Home improvement/Oils, stains & product care",Bathroom/Bathroom sinks,Bathroom/Bathroom sinks,Bathroom/Bathroom sinks,Bathroom/Bathroom sinks,Bathroom/Bathroom sinks,Kitchen & appliances/Backsplashes & wall panels/Laminate backsplashes,Kitchen & appliances/Backsplashes & wall panels/Laminate backsplashes,Kitchen & appliances/Backsplashes & wall panels/Laminate backsplashes,Baby & kids/Kids/Toys & play/Role play,Pet accessories/Cats,Cookware & tableware/Serveware/Trays,Baby & kids/Kids/Toys & play/Role play,Furniture/Tables & desks/Accent tables/Coffee tables,Furniture/Tables & desks/Accent tables/Coffee tables,Home electronics/Speakers/Wi-Fi speakers,Baby & kids/Kids/Toys & play/Physical play,Storage & organization/Storage solution systems/PAX system/PAX doors without hinges,Cookware & tableware/Cookware & kitchenware/Cooking pans/Woks,Cookware & tableware/Serveware/Trays,Outdoor/Umbrellas & gazebos/Patio umbrellas & bases,Home Décor/Storage boxes & baskets/Secondary storage boxes,Outdoor/Umbrellas & gazebos/Patio umbrellas & bases,Furniture/Patio furniture/Outdoor chaises & hammocks,Storage & organization/Dressers & storage drawers/Chests of drawers,Home Textiles/Window treatments/Curtain rods & rails/Track systems,Furniture/Tables & desks/Dining tables/Up to 6 seats,Cookware & tableware/Flatware/Flatware,Cookware & tableware/Dinnerware/Dinnerware sets,Cookware & tableware/Coffee & tea/Mugs & cups,Cookware & tableware/Coffee & tea/Mugs & cups,"Home Textiles/Window treatments/Shades, blinds & window treatments/Black-out shades & blinds",Cookware & tableware/Cookware & kitchenware/Cooking pans/Frying pans & skillets,Cookware & tableware/Coffee & tea/Mugs & cups,Cookware & tableware/Dinnerware/Side plates,Cookware & tableware/Dinnerware/Plates,Cookware & tableware/Dinnerware/Bowls,Baby & kids/Kids/Toys & play/Physical play,Home Décor/Clocks/Alarm clocks,Home Décor/Clocks/Alarm clocks,Bathroom/Showers/Shower heads,Storage & organization/Storage solution systems/PAX system/PAX doors without hinges,Storage & organization/Storage solution systems/PAX system/PAX doors without hinges,Kitchen & appliances/Kitchen systems/SEKTION kitchen/SEKTION kitchen cabinets,Kitchen & appliances/Kitchen systems/SEKTION kitchen/SEKTION kitchen cabinets,Kitchen & appliances/Kitchen systems/SEKTION kitchen/SEKTION kitchen cabinets,Kitchen & appliances/Kitchen systems/SEKTION kitchen/SEKTION kitchen cabinets,Kitchen & appliances/Kitchen systems/SEKTION kitchen/SEKTION kitchen cabinets,Kitchen & appliances/Kitchen systems/SEKTION kitchen/SEKTION kitchen cabinets/Cabinet doors & drawer fronts,Home Décor/Storage boxes & baskets/Kids boxes & baskets,Storage & organization/Storage containers/Bathroom accessories/Towel rails & towel holders,Storage & organization/Storage containers/Bathroom accessories/Towel rails & towel holders,Bathroom/Bathroom textiles/Shower curtains,Furniture/Tables & desks/Dining tables/Dining table tops & underframes,Laundry & cleaning/Cleaning accessories,Home Décor/Storage boxes & baskets/Baskets,"Laundry & cleaning/Drying racks/MULIG Drying rack, indoor","Storage & organization/Clothes organizers/Clothes racks & stands/TURBO Clothes rack, indoor",Home Décor/Flower pots & stands/Indoor plant pots,Storage & organization/Wall shelves & hooks/Hooks,Storage & organization/Wall shelves & hooks/Hooks,Home Décor/Candle holders & candles/Lanterns,"Storage & organization/Wall shelves & hooks/Hooks/BRANDUR Hook, in-","Storage & organization/Wall shelves & hooks/Hooks/BRANDUR Rail with 4 hooks, in-",Furniture/Tables & desks/Nightstands,Storage & organization/Dressers & storage drawers/Chests of drawers,Storage & organization/Dressers & storage drawers/Chests of drawers,"Storage & organization/Wall shelves & hooks/Hooks/BRANDUR Hook, in-",Storage & organization/Storage containers/Bins & bags/Trash cans & pedal bins,Storage & organization/Storage containers/Paper & media organizers/Desk accessories,Baby & kids/Kids/Toys & play/Arts & crafts,Storage & organization/Wall shelves/Complete wall shelves/HEMNES Wall,Storage & organization/TV & media furniture/TV stands & benches,Furniture/Tables & desks/Dining tables/Up to 4 seats,Cookware & tableware/Serveware/Trays
Storage & organization/Display & storage cabinets/Display cabinets,Kitchen & appliances/Kitchen drawer organization/Shelves & drawers,"Storage & organization/Shelving units, bookcases & storage options/Shelf units & cube storage",Cookware & tableware/Knives & cutting boards/Sharpening tools,Storage & organization/Storage solution systems/PAX system/PAX Interior organizers,Storage & organization/Storage solution systems/PAX system/PAX Interior organizers,Storage & organization/Storage solution systems/BESTÅ storage system/BESTÅ all parts & accessories,Storage & organization/Wall shelves & hooks/Hooks,Bathroom/Bathroom vanities/Bathroom vanity legs,Furniture/Tables & desks/Accent tables/End tables & side tables,Home electronics/Speakers/Wi-Fi speakers,Home electronics/Speakers/Wi-Fi speakers,Furniture/Chairs/Bar stools & chairs,Home Décor/Storage boxes & baskets/Paper & media boxes,Bathroom/Bathroom storage/Bathroom storage/Bathroom wall cabinets,Furniture/Kids furniture/Toy storage,Furniture/Kids furniture/Toy storage,Storage & organization/Storage solution systems/SMÅSTAD system/SMÅSTAD doors & drawers,Storage & organization/Storage solution systems/SMÅSTAD system/SMÅSTAD doors & drawers,Storage & organization/Storage solution systems/SMÅSTAD system/SMÅSTAD doors & drawers,Furniture/Kids furniture/Toy storage,Furniture/Kids furniture/Toy storage,Storage & organization/Armoires & wardrobes/Solitaire wardrobes,Home electronics/Speakers/Wi-Fi speakers,Bathroom/Bathroom storage/Bathroom storage/Bathroom tall cabinets,Storage & organization/Storage solution systems/BESTÅ storage system/BESTÅ all parts & accessories,Storage & organization/Storage containers/Cable management & accessories,"Storage & organization/Shelving units, bookcases & storage options/Shelf units & cube storage",Storage & organization/Storage containers/Food storage & organizing/Food containers,Kitchen & appliances/Kitchen islands & carts,Kitchen & appliances/Kitchen islands & carts,Kitchen & appliances/Kitchen islands & carts,Kitchen & appliances/Kitchen islands & carts,Storage & organization/Display & storage cabinets/Dining room cabinets & cupboards,"Storage & organization/Shelving units, bookcases & storage options/Shelf units & cube storage",Furniture/Tables & desks/Desks & computer desks/Desks for home,Furniture/Tables & desks/Desks & computer desks/Desks for home,Furniture/Tables & desks/Desks & computer desks/Desks for home,"Storage & organization/Display & storage cabinets/Buffet tables, sideboard buffets & buffet cabinets",Storage & organization/TV & media furniture/TV stands & benches,Home electronics/Speakers/Wi-Fi speakers,"Storage & organization/Shelving units, bookcases & storage options/Shelf units & cube storage",Storage & organization/Storage containers/Food storage & organizing/Food containers,Home Décor/Mirrors/Mirror cabinets,Home Décor/Mirrors/Mirror cabinets,Kitchen & appliances/Appliances/Microwaves/Microwave ovens,Storage & organization/Storage solution systems/IVAR system/All parts,Storage & organization/Storage solution systems/IVAR system/All parts,Storage & organization/Storage solution systems/IVAR system/All parts,Storage & organization/Storage solution systems/IVAR system/All parts,Storage & organization/Storage solution systems/IVAR system/All parts,Storage & organization/Storage solution systems/IVAR system/All parts,Storage & organization/Storage solution systems/IVAR system/All parts,Storage & organization/Display & storage cabinets/Dining room cabinets & cupboards,Storage & organization/Storage solution systems/IVAR system/All parts,Storage & organization/Storage solution systems/IVAR system/All parts,Storage & organization/Storage solution systems/IVAR system/All parts,Storage & organization/Display & storage cabinets/Dining room cabinets & cupboards,Storage & organization/Storage solution systems/IVAR system/All parts,Storage & organization/Storage solution systems/IVAR system/All parts,Storage & organization/Storage solution systems/IVAR system/All parts,Storage & organization/Storage solution systems/IVAR system/All parts,Storage & organization/Storage solution systems/IVAR system/All parts,Storage & organization/Storage solution systems/IVAR system/All parts,Storage & organization/Storage solution systems/IVAR system/All parts,Storage & organization/Storage solution systems/IVAR system/All parts,Storage & organization/Storage solution systems/IVAR system/All parts,Storage & organization/Storage solution systems/IVAR system/All parts,Kitchen & appliances/Kitchen systems/SUNNERSTA modular kitchen/Accessories for SUNNERSTA,Kitchen & appliances/Kitchen systems/SUNNERSTA modular kitchen/Accessories for SUNNERSTA,Kitchen & appliances/Kitchen wall organization & storage/Wall organizers,Kitchen & appliances/Kitchen wall organization & storage/Wall organizers,Kitchen & appliances/Kitchen systems/SUNNERSTA modular kitchen/Accessories for SUNNERSTA,Kitchen & appliances/Kitchen systems/SUNNERSTA modular kitchen/Accessories for SUNNERSTA,Kitchen & appliances/Kitchen systems/SUNNERSTA modular kitchen/Accessories for SUNNERSTA,Kitchen & appliances/Kitchen systems/SEKTION kitchen/SEKTION kitchen cabinets,Storage & organization/Storage solution systems/IVAR system/All parts,Home Décor/Storage boxes & baskets/Secondary storage boxes,Kitchen & appliances/Kitchen drawer organization/Drawer dividers,Furniture/Tables & desks/Table & desk systems/Table bar system,Furniture/Tables & desks/Table & desk systems/Table bar system,Storage & organization/Storage containers/Paper & media organizers/Desk accessories,Furniture/Tables & desks/Table & desk systems/Table bar system,Furniture/Tables & desks/Table & desk systems/Table bar system,Furniture/Tables & desks/Table & desk systems/Table bar system,Furniture/Tables & desks/Table & desk systems/Table bar system,Furniture/Tables & desks/Table & desk systems/Table bar system,Furniture/Tables & desks/Table & desk systems/Table bar system,Furniture/Tables & desks/Table & desk systems/Table bar system,Storage & organization/Dressers & storage drawers/Chests of drawers,Storage & organization/Dressers & storage drawers/Chests of drawers,Storage & organization/Dressers & storage drawers/Chests of drawers,Storage & organization/Dressers & storage drawers/Chests of drawers,Storage & organization/Dressers & storage drawers/Chests of drawers,Storage & organization/Dressers & storage drawers/Chests of drawers,Storage & organization/Dressers & storage drawers/Chests of drawers,Storage & organization/Dressers & storage drawers/Chests of drawers,Storage & organization/Dressers & storage drawers/Chests of drawers,Storage & organization/Dressers & storage drawers/Chests of drawers,Storage & organization/Dressers & storage drawers/Chests of drawers
