Home Décor/Wall décor/Picture & photo frames,Home Décor/Wall décor/Picture & photo frames,Home Décor/Wall décor/Picture & photo frames,Home Décor/Wall décor/Picture & photo frames,Home Décor/Wall décor/Picture & photo frames,Home Décor/Wall décor/Picture & photo frames,Home Décor/Wall décor/Picture & photo frames,Home Décor/Wall décor/Picture & photo frames,Home Décor/Wall décor/Picture & photo frames,Home Décor/Wall décor/Picture & photo frames,Home Décor/Wall décor/Picture & photo frames,Home Décor/Wall décor/Picture & photo frames,Home Décor/Wall décor/Picture & photo frames,Home Décor/Wall décor/Picture & photo frames,Home Décor/Wall décor/Picture & photo frames,Home Décor/Wall décor/Picture & photo frames,Home Décor/Wall décor/Picture & photo frames,Home Décor/Wall décor/Picture & photo frames,Home Décor/Mirrors/Wall mirrors,Home Décor/Mirrors/Vanity mirrors,Home Décor/Mirrors/Wall mirrors,Furniture/Tables & desks/Desks & computer desks/Desks for home,Furniture/Tables & desks/Desks & computer desks/Desks for home,Furniture/Tables & desks/Desks & computer desks/Desks for home,Furniture/Tables & desks/Accent tables/Coffee tables,Furniture/Chairs/Stools & benches/Stools,Furniture/Chairs/Bar stools & chairs,Home Décor/Wall décor/Picture & photo frames,Home Décor/Wall décor/Picture & photo frames,Home Décor/Wall décor/Picture & photo frames,Home Décor/Wall décor/Picture & photo frames,Furniture/Tables & desks/Nightstands,Storage & organization/Dressers & storage drawers/Chests of drawers,Furniture/Tables & desks/Makeup vanities & dressing tables,Furniture/Tables & desks/Makeup vanities & dressing tables,Storage & organization/Storage containers/Bathroom accessories/Towel rails & towel holders,Storage & organization/Storage containers/Bathroom accessories/Towel rails & towel holders,Storage & organization/Dressers & storage drawers/Chests of drawers,Furniture/Tables & desks/Desks & computer desks/Desks for home,Storage & organization/Storage solution systems/BESTÅ storage system/BESTÅ all parts & accessories,Bathroom/Bathroom storage/Bathroom shelving units,Bathroom/Bathroom storage/Bathroom shelving units,Furniture/Tables & desks/Nightstands,Storage & organization/Dressers & storage drawers/Chests of drawers,Storage & organization/Dressers & storage drawers/Chests of drawers,Storage & organization/Storage solution systems/BESTÅ storage system/BESTÅ all parts & accessories/BESTÅ doors & drawer fronts,Home Décor/Wall décor/Art cards,"Storage & organization/Display & storage cabinets/Buffet tables, sideboard buffets & buffet cabinets",Kitchen & appliances/Kitchen countertops/Butcher block countertops,Kitchen & appliances/Kitchen countertops/Butcher block countertops,Kitchen & appliances/Kitchen countertops/Butcher block countertops,Kitchen & appliances/Kitchen countertops/Butcher block countertops,Kitchen & appliances/Kitchen countertops/Butcher block countertops,Kitchen & appliances/Kitchen countertops/Butcher block countertops,Kitchen & appliances/Kitchen systems/SEKTION kitchen/SEKTION kitchen cabinets,Kitchen & appliances/Kitchen systems/SEKTION kitchen/SEKTION kitchen cabinets,Kitchen & appliances/Kitchen systems/SEKTION kitchen/SEKTION kitchen cabinets,Kitchen & appliances/Kitchen systems/SEKTION kitchen/SEKTION kitchen cabinets,Kitchen & appliances/Kitchen systems/SEKTION kitchen/SEKTION kitchen cabinets,Furniture/Beds/Headboards,Kitchen & appliances/Kitchen islands & carts,Storage & organization/Storage containers/Bathroom accessories/Toilet brushes,Furniture/Tables & desks/Nightstands,Storage & organization/Dressers & storage drawers/Drawer units/Drawer units for home,Storage & organization/Dressers & storage drawers/Drawer units/Drawer units for home,Furniture/Tables & desks/Accent tables/Coffee tables,Furniture/Tables & desks/Accent tables/End tables & side tables,Home Décor/Storage boxes & baskets/Baskets,Bathroom/Bathroom vanities/Vanity cabinets without sink,Home Décor/Mirrors/Vanity mirrors,Cookware & tableware/Coffee & tea/Mugs & cups,Cookware & tableware/Flatware/Flatware,Cookware & tableware/Flatware/Serving set,Cookware & tableware/Flatware/Flatware,Cookware & tableware/Dinnerware/Dinnerware sets,Cookware & tableware/Dinnerware/Plates,Cookware & tableware/Coffee & tea/Mugs & cups,Cookware & tableware/Dinnerware/Plates,Cookware & tableware/Dinnerware/Bowls,Cookware & tableware/Serveware/Serving dishes,Furniture/Tables & desks/Nightstands,Furniture/Tables & desks/Makeup vanities & dressing tables,Home Décor/Wall décor/Picture & photo frames,Storage & organization/Dressers & storage drawers/Chests of drawers,Storage & organization/Dressers & storage drawers/Chests of drawers,Storage & organization/Dressers & storage drawers/Chests of drawers,Furniture/Beds/Kids beds/Junior & extendable beds,"Storage & organization/Shelving units, bookcases & storage options/Shelf units & cube storage","Storage & organization/Shelving units, bookcases & storage options/Shelf units & cube storage","Storage & organization/Shelving units, bookcases & storage options/Shelf units & cube storage",Storage & organization/Storage solution systems/BESTÅ storage system/BESTÅ all parts & accessories,Storage & organization/Storage solution systems/BESTÅ storage system/BESTÅ all parts & accessories,Bathroom/Bathroom vanities/Vanity cabinets without sink,Bathroom/Bathroom vanities/Vanity cabinets without sink,Bathroom/Bathroom vanities/Vanity cabinets without sink,Bathroom/Bathroom vanities/Vanity cabinets without sink,Home Décor/Mirrors/Vanity mirrors,Rugs/Rugs/Runners & small rugs,Home Décor/Mirrors/Makeup & magnifying mirrors,Home Décor/Decorative accessories
Storage & organization/Storage containers/Clothes organizers/Hanging clothes organizers,Storage & organization/Storage containers/Hooks & hangers/Hangers,Storage & organization/Storage containers/Hooks & hangers/Hangers,Storage & organization/Storage containers/Hooks & hangers/Hangers,Storage & organization/Wall shelves & hooks/Hooks,Home Décor/Storage boxes & baskets/Paper & media boxes,Home Décor/Storage boxes & baskets/Baskets,Kitchen & appliances/Kitchen drawer organization/Cleaning organizers,Storage & organization/Storage solution systems/PAX system/PAX Interior organizers,Cookware & tableware/Dishwashing accessories/Sink accessories,Home Décor/Storage boxes & baskets/Baskets,Home Décor/Storage boxes & baskets/Baskets,Storage & organization/Storage containers/Hooks & hangers/Hangers,Storage & organization/Wall shelves & hooks/Hooks,Home electronics/Cords & chargers/Cables & accessories,Home electronics/Cords & chargers/Cables & accessories,Home electronics/Cords & chargers/Cables & accessories,Home electronics/Cords & chargers/Cables & accessories,Laundry & cleaning/Laundry baskets,Baby & kids/Kids/Kids storage & organization/Children's hooks & wall organization,Cookware & tableware/Dishwashing accessories/Dish drainers & drying racks,"Laundry & cleaning/Laundry baskets/TORKIS Flexible laundry basket, in","Laundry & cleaning/Laundry baskets/TORKIS Flexible laundry basket, in","Laundry & cleaning/Laundry baskets/TORKIS Flexible laundry basket, in",Storage & organization/Dressers & storage drawers/Chests of drawers,Furniture/Tables & desks/Accent tables/Coffee tables,Furniture/Tables & desks/Accent tables/Coffee tables,Bathroom/Bathroom storage/Bathroom shelving units,Baby & kids/Kids/Toys & play/Physical play,Home Décor/Storage boxes & baskets/Clothes boxes,Storage & organization/Storage containers/Bins & bags/Bags,Storage & organization/Storage containers/Bins & bags/Bags,Home Décor/Storage boxes & baskets/Secondary storage boxes,Furniture/Chairs/Stools & benches/Benches,Furniture/Chairs/Stools & benches/Benches,Storage & organization/Storage containers/Clothes organizers/Hanging clothes organizers,Furniture/Beds/Under bed storage,"Storage & organization/Shelving units, bookcases & storage options/Storage shelves & units",Home electronics/Cords & chargers/Cables & accessories,"Storage & organization/Shelving units, bookcases & storage options/Shelf units & cube storage",Home Décor/Storage boxes & baskets/Clothes boxes,Bathroom/Bathroom stools & benches,Storage & organization/Clothes organizers/Shoe racks & stands,Storage & organization/Clothes organizers/Coat stands,Home Décor/Storage boxes & baskets/Clothes boxes,Home Décor/Storage boxes & baskets/Baskets,Home Décor/Storage boxes & baskets/Baskets,Home Décor/Storage boxes & baskets/Clothes boxes,Storage & organization/Bags/Backpacks & messenger bags,Bathroom/Bathroom vanities/Vanity cabinets without sink,Storage & organization/Storage containers/Bins & bags/Bags,Pet accessories/Cats,Pet accessories/Cats,Pet accessories/Cats,Home Décor/Storage boxes & baskets/Baskets,Rugs/Rugs/Runners & small rugs,Home Décor/Storage boxes & baskets/Paper & media boxes,Home electronics/Cords & chargers/Cables & accessories,Furniture/Beds/Under bed storage/FREDVANG Underbed storage,Laundry & cleaning/Laundry baskets,Home Décor/Storage boxes & baskets/Secondary storage boxes,Home Décor/Storage boxes & baskets/Baskets,Home Décor/Storage boxes & baskets/Baskets,Baby & kids/Kids/Kids storage & organization/Kids clothes & shoe organization,Baby & kids/Kids/Kids storage & organization/Kids clothes & shoe organization,Storage & organization/Storage containers/Clothes organizers/Hanging clothes organizers,Storage & organization/Storage containers/Clothes organizers/Hanging clothes organizers,Storage & organization/Storage containers/Bathroom accessories/Towel rails & towel holders,Storage & organization/Storage solution systems/PAX system/PAX Interior organizers,Storage & organization/Storage solution systems/PAX system/PAX Interior organizers,Storage & organization/Armoires & wardrobes/Solitaire wardrobes,Cookware & tableware/Kitchen textiles/Aprons,Home Décor/Storage boxes & baskets/Baskets,Home Décor/Storage boxes & baskets/Baskets,Home Décor/Wall décor/Picture & photo frames,Laundry & cleaning/Cleaning accessories,"Laundry & cleaning/Drying racks/FROST Drying rack, indoor",Baby & kids/Kids/Toys & play/Arts & crafts,Furniture/Beds/Kids beds/Bunk beds,Storage & organization/Storage containers/Bathroom accessories/Towel rails & towel holders,Furniture/Beds/Cribs,Home Textiles/Window treatments/Curtains & drapes/Room darkening curtains & drapes,Home Textiles/Window treatments/Curtains & drapes/Room darkening curtains & drapes,Furniture/Tables & desks/Changing tables,Furniture/Tables & desks/Changing tables,Furniture/Patio furniture/Outdoor furniture covers,Home Décor/Storage boxes & baskets/Clothes boxes,Storage & organization/Dressers & storage drawers/Chests of drawers,Home Décor/Storage boxes & baskets/Secondary storage boxes,Storage & organization/Bags/Shopping bags & tote bags,Storage & organization/Bags/Shopping bags & tote bags,Furniture/Kids furniture/Kids chairs,Home Décor/Storage boxes & baskets/Paper & media boxes,Home Décor/Storage boxes & baskets/Clothes boxes,Bathroom/Bathroom storage/Bathroom shelving units,Storage & organization/Storage solution systems/BESTÅ storage system/BESTÅ all parts & accessories,Cookware & tableware/Napkins & napkin holders/Napkin holders,Bathroom/Bathroom storage/Bathroom shelving units,Storage & organization/Storage containers/Paper & media organizers/Newspaper racks,Home Décor/Storage boxes & baskets/Baskets
Storage & organization/Storage solution systems/SMÅSTAD system/SMÅSTAD doors & drawers,Storage & organization/Storage solution systems/SMÅSTAD system/SMÅSTAD doors & drawers,Storage & organization/Dressers & storage drawers/Drawer units/Drawer units for home,Storage & organization/TV & media furniture/TV stands & benches,Storage & organization/TV & media furniture/TV stands & benches,Storage & organization/TV & media furniture/TV stands & benches,Storage & organization/Storage containers/Paper & media organizers/Desk accessories,Cookware & tableware/Cookware & kitchenware/Ovenware/MIXTUR Oven,Storage & organization/Dressers & storage drawers/Drawer units/Drawer units for home,Storage & organization/Storage containers/Bins & bags/Trash cans & pedal bins,Storage & organization/Storage containers/Bins & bags/Trash cans & pedal bins,Storage & organization/Wall shelves/Brackets,Furniture/Tables & desks/Nightstands,Furniture/Tables & desks/Desks & computer desks/Desks for home,Storage & organization/Display & storage cabinets/Dining room cabinets & cupboards,Storage & organization/Dressers & storage drawers/Drawer units/Drawer units for home,"Storage & organization/Storage solution systems/ELVARLI system/Post, side units & interiors","Storage & organization/Shelving units, bookcases & storage options/Shelf units & cube storage",Storage & organization/Wall shelves/Brackets,Storage & organization/Wall shelves/Brackets,Storage & organization/Wall shelves/Brackets,Storage & organization/Wall shelves/Brackets,Storage & organization/Dressers & storage drawers/Drawer units/Drawer units for office,Kitchen & appliances/Kitchen drawer organization/Drawer dividers,"Storage & organization/Storage solution systems/ELVARLI system/Post, side units & interiors","Storage & organization/Storage solution systems/ELVARLI system/Post, side units & interiors","Storage & organization/Storage solution systems/ELVARLI system/Post, side units & interiors","Storage & organization/Storage solution systems/ELVARLI system/Post, side units & interiors",Home Décor/Storage boxes & baskets/Paper & media boxes,Storage & organization/Storage solution systems/BOAXEL system/BOAXEL parts,"Storage & organization/Storage solution systems/ELVARLI system/Post, side units & interiors","Storage & organization/Storage solution systems/ELVARLI system/Post, side units & interiors",Furniture/Tables & desks/Accent tables/End tables & side tables,Home Décor/Clocks/Wall & table clocks,Storage & organization/Display & storage cabinets/Dining room cabinets & cupboards,Storage & organization/Display & storage cabinets/Filing cabinets & storage cabinets/Home storage units & cabinets,"Storage & organization/Storage solution systems/ELVARLI system/Post, side units & interiors","Storage & organization/Storage solution systems/ELVARLI system/Post, side units & interiors",Storage & organization/Storage containers/Paper & media organizers/Desk accessories,"Storage & organization/Shelving units, bookcases & storage options/Bookcases",Storage & organization/Display & storage cabinets/Dining room cabinets & cupboards,Storage & organization/Display & storage cabinets/Dining room cabinets & cupboards,Storage & organization/Storage containers/Paper & media organizers/Magazine files,"Storage & organization/Shelving units, bookcases & storage options/Shelf units & cube storage",Home Décor/Storage boxes & baskets/Clothes boxes,Home Décor/Storage boxes & baskets/Kids boxes & baskets,Storage & organization/Storage containers/Paper & media organizers/Desk accessories,Storage & organization/Storage containers/Paper & media organizers/Desk accessories,Storage & organization/Display & storage cabinets/Filing cabinets & storage cabinets/Office storage cabinets & units,Storage & organization/Storage solution systems/BESTÅ storage system/BESTÅ all parts & accessories,Storage & organization/Storage solution systems/BESTÅ storage system/BESTÅ all parts & accessories,"Storage & organization/Shelving units, bookcases & storage options/Shelf units & cube storage",Home improvement/Home safety/Child safety,Storage & organization/Storage solution systems/IVAR system/All parts,"Storage & organization/Shelving units, bookcases & storage options/Storage shelves & units",Home Décor/Wall décor/Picture ledges,Storage & organization/Storage containers/Cable management & accessories,"Storage & organization/Storage solution systems/ELVARLI system/Post, side units & interiors",Storage & organization/Storage solution systems/PAX system/PAX Interior organizers,Storage & organization/Storage solution systems/PAX system/PAX Interior organizers,Storage & organization/Clothes organizers/Clothes racks & stands,Furniture/Patio furniture/Outdoor chairs/Outdoor dining chairs,"Storage & organization/Shelving units, bookcases & storage options/Storage shelves & units",Kitchen & appliances/Kitchen drawer organization/Shelves & drawers,Kitchen & appliances/Kitchen drawer organization/Shelves & drawers,Kitchen & appliances/Kitchen drawer organization/Shelves & drawers,Bathroom/Bathroom storage/Bathroom shelving units,Storage & organization/Storage solution systems/BOAXEL system/BOAXEL parts,Storage & organization/Storage solution systems/IVAR system/All parts,Storage & organization/Storage solution systems/IVAR system/All parts,Storage & organization/Storage solution systems/IVAR system/All parts,Storage & organization/Storage solution systems/IVAR system/All parts,Storage & organization/Display & storage cabinets/Dining room cabinets & cupboards,Storage & organization/Display & storage cabinets/Dining room cabinets & cupboards,Storage & organization/Storage solution systems/IVAR system/All parts,Storage & organization/Storage solution systems/IVAR system/All parts,Storage & organization/Storage solution systems/IVAR system/All parts,Storage & organization/Storage solution systems/IVAR system/All parts,Storage & organization/Storage solution systems/IVAR system/All parts,Storage & organization/Storage solution systems/IVAR system/All parts,Storage & organization/Storage solution systems/IVAR system/All parts,Storage & organization/Storage solution systems/IVAR system/All parts,Storage & organization/Storage solution systems/IVAR system/All parts,Storage & organization/Storage solution systems/IVAR system/All parts,Storage & organization/Storage solution systems/IVAR system/All parts,Storage & organization/Storage solution systems/IVAR system/All parts,Storage & organization/Storage solution systems/IVAR system/All parts,Storage & organization/Storage solution systems/IVAR system/All parts,Storage & organization/Storage solution systems/IVAR system/All parts,Storage & organization/Storage solution systems/IVAR system/All parts,Storage & organization/Storage solution systems/IVAR system/All parts,Kitchen & appliances/Appliances/Refrigerators & freezers/Free-standing refrigerators,Home improvement/Tools & hardware/Tools,Cookware & tableware/Knives & cutting boards/Sharpening tools,"Home Décor/Storage boxes & baskets/Secondary storage boxes/SAMLA Lid for box, 12",Kitchen & appliances/Kitchen systems/SEKTION kitchen/SEKTION kitchen cabinets,"Storage & organization/Shelving units, bookcases & storage options/Shelf units & cube storage",Storage & organization/Display & storage cabinets/Dining room cabinets & cupboards,Storage & organization/Storage solution systems/BESTÅ storage system/BESTÅ all parts & accessories,"Storage & organization/Shelving units, bookcases & storage options/Shelf units & cube storage"
Kitchen & appliances/Kitchen systems/SEKTION kitchen/SEKTION kitchen cabinets,Kitchen & appliances/Kitchen systems/SEKTION kitchen/SEKTION kitchen cabinets,Kitchen & appliances/Kitchen systems/SEKTION kitchen/SEKTION kitchen cabinets,Kitchen & appliances/Kitchen systems/SEKTION kitchen/SEKTION kitchen cabinets,Kitchen & appliances/Kitchen systems/SEKTION kitchen/SEKTION kitchen cabinets,Cookware & tableware/Coffee & tea/Mugs & cups,Cookware & tableware/Dinnerware/Dinnerware sets,Cookware & tableware/Coffee & tea/Mugs & cups,Storage & organization/Storage solution systems/BESTÅ storage system/BESTÅ all parts & accessories,Furniture/Tables & desks/Desks & computer desks/Desks for home,Cookware & tableware/Dinnerware/Bowls,Cookware & tableware/Coffee & tea/Mugs & cups,Cookware & tableware/Dinnerware/Plates,Cookware & tableware/Dinnerware/Side plates,Storage & organization/Storage solution systems/PAX system/PAX doors without hinges,Kitchen & appliances/Kitchen countertops/Laminate countertops,Kitchen & appliances/Kitchen countertops/Laminate countertops,Kitchen & appliances/Kitchen countertops/Laminate countertops,Kitchen & appliances/Kitchen countertops/Laminate countertops,Kitchen & appliances/Kitchen countertops/Laminate countertops,Kitchen & appliances/Kitchen systems/SEKTION kitchen/SEKTION kitchen cabinets,Kitchen & appliances/Kitchen systems/SEKTION kitchen/SEKTION kitchen cabinets,Kitchen & appliances/Kitchen countertops/Butcher block countertops,Kitchen & appliances/Kitchen countertops/Butcher block countertops,Kitchen & appliances/Kitchen countertops/Butcher block countertops,Kitchen & appliances/Kitchen countertops/Butcher block countertops,Kitchen & appliances/Kitchen countertops/Butcher block countertops,Kitchen & appliances/Kitchen countertops/Butcher block countertops,Cookware & tableware/Dinnerware/Side plates,Furniture/Tables & desks/Changing tables/SMÅGÖRA Changing table,Storage & organization/Armoires & wardrobes/Children's wardrobes,Kitchen & appliances/Kitchen systems/SEKTION kitchen/SEKTION kitchen cabinets,Storage & organization/Storage containers/Bathroom accessories/Toilet brushes,Home Décor/Wall décor/Picture & photo frames,Home Décor/Wall décor/Picture & photo frames,Home Décor/Wall décor/Picture & photo frames,Home Décor/Wall décor/Picture & photo frames,Storage & organization/Dressers & storage drawers/Chests of drawers,Cookware & tableware/Dinnerware/Plates,Kitchen & appliances/Kitchen systems/SEKTION kitchen/SEKTION kitchen cabinets/Cabinet doors & drawer fronts,Kitchen & appliances/Kitchen systems/SEKTION kitchen/SEKTION kitchen cabinets,Kitchen & appliances/Kitchen systems/SEKTION kitchen/SEKTION kitchen cabinets,Kitchen & appliances/Kitchen systems/SEKTION kitchen/SEKTION kitchen cabinets,Kitchen & appliances/Kitchen systems/SEKTION kitchen/SEKTION kitchen cabinets,Kitchen & appliances/Kitchen systems/SEKTION kitchen/SEKTION kitchen cabinets,Cookware & tableware/Dinnerware/Bowls,Cookware & tableware/Coffee & tea/Mugs & cups,Cookware & tableware/Dinnerware/Plates,Cookware & tableware/Dinnerware/Plates,Cookware & tableware/Serveware/Serving dishes,Cookware & tableware/Dinnerware/Dinnerware sets,Storage & organization/Storage containers/Bathroom accessories/Towel rails & towel holders,Storage & organization/Storage containers/Bathroom accessories/Towel rails & towel holders,Storage & organization/Storage containers/Bathroom accessories/Toilet brushes,Kitchen & appliances/Kitchen systems/SEKTION kitchen/SEKTION kitchen cabinets/Cabinet doors & drawer fronts,Kitchen & appliances/Kitchen systems/SEKTION kitchen/SEKTION kitchen cabinets,Storage & organization/Storage solution systems/BESTÅ storage system/BESTÅ all parts & accessories,Kitchen & appliances/Kitchen islands & carts,Cookware & tableware/Dinnerware/Side plates,Cookware & tableware/Dinnerware/Deep plates/VÄRDERA Deep plate,Storage & organization/Dressers & storage drawers/Chests of drawers,Storage & organization/Dressers & storage drawers/Chests of drawers,Furniture/Tables & desks/Nightstands,Furniture/Tables & desks/Nightstands,Cookware & tableware/Serveware/Trays,Cookware & tableware/Dinnerware/Plates,Storage & organization/Storage solution systems/BESTÅ storage system/BESTÅ all parts & accessories,Storage & organization/Storage solution systems/BESTÅ storage system/BESTÅ all parts & accessories/BESTÅ doors & drawer fronts,Furniture/Chairs/Stools & benches/Stools,Furniture/Chairs/Bar stools & chairs,Storage & organization/Storage containers/Bathroom accessories/Toilet roll holders & stands,Kitchen & appliances/Kitchen systems/SEKTION kitchen/SEKTION kitchen cabinets,Kitchen & appliances/Kitchen systems/SEKTION kitchen/SEKTION kitchen cabinets,"Storage & organization/Clothes organizers/Clothes racks & stands/TURBO Clothes rack, indoor","Storage & organization/Wall shelves & hooks/Hooks/BRANDUR Hook, in-","Storage & organization/Wall shelves & hooks/Hooks/BRANDUR Rail with 4 hooks, in-",Home Décor/Flower pots & stands/Indoor plant pots,"Storage & organization/Wall shelves & hooks/Hooks/BRANDUR Hook, in-",Home Décor/Candle holders & candles/Lanterns,Storage & organization/Wall shelves & hooks/Hooks,Storage & organization/Wall shelves & hooks/Hooks,"Laundry & cleaning/Drying racks/MULIG Drying rack, indoor",Storage & organization/Storage containers/Bathroom accessories/Towel rails & towel holders,Cookware & tableware/Napkins & napkin holders/Napkin holders,Home Décor/Wall décor/Picture & photo frames,Home Décor/Wall décor/Picture & photo frames,Kitchen & appliances/Kitchen systems/SEKTION kitchen/SEKTION kitchen cabinets,Kitchen & appliances/Kitchen systems/SEKTION kitchen/SEKTION kitchen cabinets,Kitchen & appliances/Kitchen systems/SEKTION kitchen/SEKTION kitchen cabinets,Kitchen & appliances/Kitchen systems/SEKTION kitchen/SEKTION kitchen cabinets,Kitchen & appliances/Kitchen systems/SEKTION kitchen/SEKTION kitchen cabinets,Kitchen & appliances/Kitchen systems/SEKTION kitchen/SEKTION kitchen cabinets,Home Décor/Vases & bowls/Vases,Bathroom/Bathroom storage/Bathroom shelving units,Bathroom/Bathroom storage/Bathroom shelving units/RÅGRUND Sink shelf,Home Décor/Mirrors/Vanity mirrors,Home Décor/Vases & bowls/Vases,Bathroom/Bathroom storage/Bathroom shelving units,Cookware & tableware/Knives & cutting boards/Cutting boards,Cookware & tableware/Knives & cutting boards/Cutting boards
