Furniture/Tables & desks/Accent tables/Coffee tables,Furniture/Tables & desks/Desks & computer desks/Desks for home,Furniture/Tables & desks/Desks & computer desks/Desks for home,Furniture/Tables & desks/Console tables & sofa tables,Storage & organization/TV & media furniture/TV stands & benches,Baby & kids/Kids/Kids decoration & accessories,Furniture/Tables & desks/Dining tables/Up to 4 seats,Furniture/Tables & desks/Accent tables/End tables & side tables,"Storage & organization/Display & storage cabinets/Buffet tables, sideboard buffets & buffet cabinets",Furniture/Tables & desks/Dining tables/Up to 4 seats,Furniture/Tables & desks/Dining tables/Up to 4 seats,Furniture/Tables & desks/Console tables & sofa tables,Furniture/Tables & desks/Dining tables/Up to 4 seats,Furniture/Chairs/Bar stools & chairs,Furniture/Tables & desks/Bar tables,Furniture/Tables & desks/Accent tables/Coffee tables,Furniture/Tables & desks/Accent tables/End tables & side tables,Furniture/Tables & desks/Accent tables/Coffee tables,Furniture/Chairs/Dining chairs/Dining chairs,Furniture/Tables & desks/Accent tables/End tables & side tables,Furniture/Chairs/Stools & benches/Benches,Storage & organization/TV & media furniture/TV stands & benches,Furniture/Tables & desks/Desks & computer desks/Desks for home,Furniture/Tables & desks/Desks & computer desks/Desks for home,Furniture/Tables & desks/Dining tables/Up to 10 seats,Furniture/Patio furniture/Outdoor tables/Outdoor dining tables,Furniture/Tables & desks/Table & desk systems/IDÅSEN system,Furniture/Tables & desks/Table & desk systems/IDÅSEN system,Furniture/Tables & desks/Accent tables/Coffee tables,Furniture/Chairs/Stools & benches/Benches,"Storage & organization/Display & storage cabinets/Buffet tables, sideboard buffets & buffet cabinets",Furniture/Tables & desks/Accent tables/End tables & side tables,Furniture/Tables & desks/Dining tables/Up to 4 seats,Furniture/Tables & desks/Accent tables/Coffee tables,Furniture/Patio furniture/Outdoor tables/Outdoor dining tables,"Storage & organization/Display & storage cabinets/Buffet tables, sideboard buffets & buffet cabinets",Bathroom/Bathroom vanities/Bathroom vanity legs,Furniture/Tables & desks/Dining tables/Dining table tops & underframes,Storage & organization/Display & storage cabinets/Dining room cabinets & cupboards,Furniture/Tables & desks/Desks & computer desks/Desks for home,Furniture/Tables & desks/Dining tables/Up to 10 seats,Furniture/Tables & desks/Dining tables/Up to 4 seats,Furniture/Tables & desks/Dining tables/Up to 6 seats,Furniture/Beds/Kids beds/Loft beds,Furniture/Tables & desks/Desks & computer desks/Desks for home,Furniture/Tables & desks/Dining tables/Up to 4 seats,Furniture/Tables & desks/Accent tables/Coffee tables,Furniture/Patio furniture/Outdoor tables/Outdoor dining tables,Furniture/Tables & desks/Desks & computer desks/Desks for home,Furniture/Tables & desks/Accent tables/Coffee tables,Furniture/Chairs/Desk chairs/Desk chairs for home,Furniture/Tables & desks/Makeup vanities & dressing tables,Furniture/Chairs/Bar stools & chairs,Furniture/Chairs/Stools & benches/Stools,Kitchen & appliances/Kitchen islands & carts,Furniture/Tables & desks/Makeup vanities & dressing tables,Furniture/Chairs/Desk chairs/Desk chairs for home,Furniture/Tables & desks/Changing tables,"Storage & organization/Shelving units, bookcases & storage options/Storage shelves & units","Storage & organization/Shelving units, bookcases & storage options/Storage shelves & units",Storage & organization/TV & media furniture/TV stands & benches,"Storage & organization/Shelving units, bookcases & storage options/Shelf units & cube storage",Furniture/Tables & desks/Kids tables,Home electronics/Cords & chargers/Cables & accessories,Storage & organization/Storage containers/Paper & media organizers/Desk accessories,Furniture/Chairs/Stools & benches/Stools,Furniture/Tables & desks/Accent tables/Coffee tables/TRANARÖ Stool,Furniture/Tables & desks/Dining tables/Up to 6 seats,Furniture/Tables & desks/Nightstands,Furniture/Tables & desks/Dining tables/Up to 6 seats,Storage & organization/Display & storage cabinets/Dining room cabinets & cupboards,Kitchen & appliances/Kitchen systems/SEKTION kitchen/SEKTION kitchen cabinets,Furniture/Kids furniture/Kids chairs,"Storage & organization/Shelving units, bookcases & storage options/Bookcases",Storage & organization/TV & media furniture/TV stands & benches,"Outdoor/Outdoor storage benches, boxes & cabinets",Furniture/Tables & desks/Desks & computer desks/Desks for home,"Storage & organization/Display & storage cabinets/Buffet tables, sideboard buffets & buffet cabinets",Furniture/Tables & desks/Dining tables/Up to 10 seats,"Outdoor/Outdoor storage benches, boxes & cabinets",Furniture/Tables & desks/Dining sets/Dining sets up to 4 seats,Baby & kids/Kids/Kids decoration & accessories,Kitchen & appliances/Kitchen wall organization & storage/Kitchen shelves,Kitchen & appliances/Kitchen wall organization & storage/Kitchen shelves,Kitchen & appliances/Kitchen islands & carts,Furniture/Kids furniture/Toy storage,Furniture/Kids furniture/Toy storage,Furniture/Kids furniture/Toy storage,Furniture/Kids furniture/Toy storage,Furniture/Kids furniture/Toy storage,Kitchen & appliances/Kitchen islands & carts,Baby & kids/Kids/Toys & play/Arts & crafts,Furniture/Tables & desks/Accent tables/Coffee tables,Furniture/Tables & desks/Accent tables/End tables & side tables,Furniture/Chairs/Bar stools & chairs,Cookware & tableware/Serveware/Serving dishes,Storage & organization/Storage solution systems/BESTÅ storage system/BESTÅ all parts & accessories,Furniture/Tables & desks/Desks & computer desks/Desks for home,Furniture/Chairs/Stools & benches/Benches,Storage & organization/Storage containers/Paper & media organizers/Desk accessories
Home Décor/Flower pots & stands/Indoor plant pots,Home Décor/Flower pots & stands/Indoor plant pots,Home Décor/Flower pots & stands/Indoor plant pots,Home Décor/Flower pots & stands/Indoor plant pots,Home Décor/Flower pots & stands/Indoor plant pots,Home Décor/Flower pots & stands/Indoor plant pots,Home Décor/Flower pots & stands/Indoor plant pots,Home Décor/Flower pots & stands/Indoor plant pots,Home Décor/Flower pots & stands/Indoor plant pots,Home Décor/Flower pots & stands/Indoor plant pots,Home Décor/Flower pots & stands/Indoor plant pots,Home Décor/Flower pots & stands/Self watering plant pots,Home Décor/Flower pots & stands/Indoor plant pots,Home Décor/Flower pots & stands/Indoor plant pots,Home Décor/Flower pots & stands/Indoor plant pots,Home Décor/Flower pots & stands/Indoor plant pots,Home Décor/Flower pots & stands/Indoor plant pots,Home Décor/Flower pots & stands/Indoor plant pots,Cookware & tableware/Drinkware/Pitchers & carafes,Kitchen & appliances/Kitchen drawer organization/Drawer dividers,Home Décor/Plants & flowers/House plants,Home Décor/Plants & flowers/House plants,Home Décor/Plants & flowers/House plants,Home Décor/Flower pots & stands/Indoor plant pots,Home Décor/Plants & flowers/House plants,Home Décor/Plants & flowers/House plants,Home Décor/Plants & flowers/House plants,Home Décor/Plants & flowers/House plants,Home Décor/Plants & flowers/House plants,Home Décor/Plants & flowers/House plants,Home Décor/Plants & flowers/House plants,Home Décor/Plants & flowers/House plants,Home Décor/Plants & flowers/House plants,Home Décor/Plants & flowers/House plants,Home Décor/Plants & flowers/House plants,Home Décor/Plants & flowers/House plants,Home Décor/Plants & flowers/House plants,Home Décor/Plants & flowers/House plants,Home Décor/Plants & flowers/House plants,Home Décor/Plants & flowers/House plants,Home Décor/Plants & flowers/House plants,Home Décor/Plants & flowers/House plants,Home Décor/Plants & flowers/House plants,Home Décor/Plants & flowers/House plants,Home Décor/Plants & flowers/House plants,Home Décor/Plants & flowers/House plants,Home Décor/Plants & flowers/House plants,Home Décor/Plants & flowers/House plants,Home Décor/Plants & flowers/House plants,Home Décor/Plants & flowers/House plants,Gardening & plants/Growing accessories,Home Décor/Vases & bowls/Vases,Home Décor/Flower pots & stands/Indoor plant pots,Cookware & tableware/Drinkware/Pitchers & carafes,Home Décor/Flower pots & stands/Indoor plant pots,Gardening & plants/Plant stands & movers,Gardening & plants/Plant stands & movers,Home Décor/Flower pots & stands/Indoor plant pots,Home Décor/Flower pots & stands/Indoor plant pots,Gardening & plants/Watering cans,Gardening & plants/Watering cans,Gardening & plants/Watering cans,Kitchen & appliances/Kitchen drawer organization/Shelves & drawers,Gardening & plants/Plant stands & movers,Home Décor/Flower pots & stands/Indoor plant pots,Gardening & plants/Plant stands & movers,Home Décor/Flower pots & stands/Indoor plant pots,Gardening & plants/Plant stands & movers,Gardening & plants/Plant stands & movers,Home Décor/Flower pots & stands/Outdoor plant pots,Home Décor/Vases & bowls/Vases,Gardening & plants/Plant stands & movers,Gardening & plants/Plant stands & movers,Home Décor/Flower pots & stands/Indoor plant pots,Home Décor/Vases & bowls/Bowls & dishes,Home Décor/Vases & bowls/Bowls & dishes,Lighting/Smart lighting/Smart lighting kits,Home Décor/Flower pots & stands/Indoor plant pots,Home Décor/Flower pots & stands/Indoor plant pots,Storage & organization/Storage containers/Food storage & organizing/Jars & tins,Kitchen & appliances/Kitchen drawer organization/Shelves & drawers,Home Décor/Plants & flowers/Dried plants & potpourri,Home Décor/Plants & flowers/Dried plants & potpourri/DRÄGLIG Dried parts of flowers,Home Décor/Plants & flowers/Dried plants & potpourri/DIVALATER Dried parts of flowers,Home Décor/Plants & flowers/Dried plants & potpourri/DOGMATISK Dried parts of flowers,Cookware & tableware/Cookware & kitchenware/Cooking accessories,Cookware & tableware/Cookware & kitchenware/Cooking accessories,Home Décor/Candle holders & candles/Candle holders,Storage & organization/Storage solution systems/PAX system/Knobs & handles,Home Décor/Candle holders & candles/Candle holders,Cookware & tableware/Cookware & kitchenware/Pots & pans/Cooking & stock pots,Home Décor/Vases & bowls/Vases,Kitchen & appliances/Kitchen lighting,Cookware & tableware/Coffee & tea/Coffee makers & accessories,Baby & kids/Kids/Toys & play/Role play,Kitchen & appliances/Appliances/Range hoods & filters/Wall mounted range hoods,Cookware & tableware/Drinkware/Pitchers & carafes,Home Décor/Candle holders & candles/Candle holders,Cookware & tableware/Drinkware/Glasses,Home Décor/Plants & flowers/Artificial plants & flowers
Home Décor/Mirrors/Wall mirrors,Home Décor/Mirrors/Wall mirrors,Home Décor/Mirrors/Vanity mirrors,Home Décor/Mirrors/Vanity mirrors,Home Décor/Mirrors/Mirrors with lights/STORJORM Mirror cabinet w,Home Décor/Mirrors/Mirrors with lights/STORJORM Mirror cabinet w,Home Décor/Mirrors/Mirrors with lights/STORJORM Mirror cabinet w,Home Décor/Mirrors/Wall mirrors,Home Décor/Mirrors/Vanity mirrors,Home Décor/Mirrors/Makeup & magnifying mirrors,Home Décor/Mirrors/Wall mirrors,Home Décor/Mirrors/Large mirrors,Home Textiles/Window treatments/Curtain rods & rails/Curtain rods,Home Textiles/Window treatments/Curtain rods & rails/Curtain rods,Home Textiles/Window treatments/Curtain rods & rails/Curtain rods,Home Textiles/Window treatments/Curtain rods & rails/Curtain rods,Home Textiles/Window treatments/Curtain rods & rails/Curtain rods,Home Textiles/Window treatments/Curtain rods & rails/Curtain rods,Home Textiles/Window treatments/Curtain rods & rails/Curtain rods,Home Décor/Mirrors/Vanity mirrors,Lighting/Lamps & light fixtures/Ceiling lights/Pendants lights,Storage & organization/Storage containers/Bathroom accessories/Toothbrush holders,Storage & organization/Storage containers/Bathroom accessories/Shower accessories,Storage & organization/Storage containers/Bathroom accessories/Towel rails & towel holders,Storage & organization/Storage containers/Bathroom accessories/Soap dispensers & soap dishes,Home Décor/Decorative accessories,Home Décor/Mirrors/Makeup & magnifying mirrors,Home Textiles/Window treatments/Curtains & drapes/Light filtering curtains,Lighting/Lamps & light fixtures/Ceiling lights/Ceiling lamps,Lighting/Lamps & light fixtures/Ceiling lights/Ceiling lamps,Lighting/Lamps & light fixtures/Ceiling lights/Pendants lights,Lighting/Lamps & light fixtures/Ceiling lights/Ceiling lamps,Lighting/Lamps & light fixtures/Ceiling lights/Pendants lights,Lighting/Lamps & light fixtures/Ceiling lights/Pendants lights,Lighting/Lamps & light fixtures/Floor lamps/FLUGBO Floor uplt,Lighting/Lamps & light fixtures/Ceiling lights/Pendants lights,Lighting/Lamps & light fixtures/Wall lamps/Wall lamps,Lighting/Lamps & light fixtures/Table lamps,Lighting/Lamps & light fixtures/Ceiling lights/Ceiling track lighting,Lighting/Lamps & light fixtures/Ceiling lights/Ceiling track lighting,Kitchen & appliances/Kitchen systems/SEKTION kitchen/SEKTION kitchen cabinets,Lighting/Integrated lighting/Bookcase lighting,Home Textiles/Window treatments/Curtains & drapes/Light filtering curtains,Home Textiles/Window treatments/Curtains & drapes/Light filtering curtains,Home Textiles/Window treatments/Curtains & drapes/Light filtering curtains,Lighting/Integrated lighting/Bookcase lighting,Storage & organization/Storage solution systems/PAX system/PAX sliding doors,Storage & organization/Storage solution systems/PAX system/PAX sliding doors,Storage & organization/Storage solution systems/PAX system/PAX sliding doors,Kitchen & appliances/Kitchen drawer organization/Cleaning organizers,Home Décor/Decorative accessories,Lighting/Integrated lighting/Bookcase lighting,Lighting/Integrated lighting/Bookcase lighting,Home Décor/Wall décor/Wall decals & stickers,Home Décor/Wall décor/Wall decals & stickers,Storage & organization/Storage solution systems/SMÅSTAD system/SMÅSTAD interior fittings,Kitchen & appliances/Kitchen lighting,Home Décor/Decorative accessories,Storage & organization/Display & storage cabinets/Display cabinets,Home Textiles/Window treatments/Curtain rods & rails/Curtain rods,Storage & organization/Display & storage cabinets/Display cabinets,Kitchen & appliances/Kitchen lighting,Home Décor/Mirrors/Makeup & magnifying mirrors,Home Décor/Clocks/Wall & table clocks,Home Décor/Decorative accessories,Home Décor/Decorative accessories,Home Décor/Decorative accessories,Home Décor/Decorative accessories,"Outdoor/Outdoor storage benches, boxes & cabinets",Storage & organization/Display & storage cabinets/Display cabinets,Kitchen & appliances/Kitchen drawer organization/Cleaning organizers,Home Décor/Mirrors/Wall mirrors,Home Décor/Mirrors/Wall mirrors,Home Décor/Mirrors/Wall mirrors,Lighting/Lamps & light fixtures/Ceiling lights/Ceiling lamps,Lighting/Lamps & light fixtures/Ceiling lights/Ceiling lamps,Storage & organization/Storage containers/Food storage & organizing/Jars & tins,Storage & organization/Storage containers/Food storage & organizing/Spice & condiment stands,Storage & organization/Wall shelves & hooks/Hooks,Storage & organization/Storage solution systems/BESTÅ storage system/BESTÅ all parts & accessories,Kitchen & appliances/Appliances/Range hoods & filters/Under cabinet and built-in range hoods,Home Textiles/Window treatments/Curtain rods & rails/Track systems,Storage & organization/Storage solution systems/BESTÅ storage system/BESTÅ all parts & accessories,Storage & organization/Storage containers/Bathroom accessories/Towel rails & towel holders,Storage & organization/Storage containers/Bathroom accessories/Towel rails & towel holders,Storage & organization/Storage containers/Bathroom accessories/Towel rails & towel holders,"Kitchen & appliances/Knobs, handles, & pulls",Home improvement/Home safety/Home safety,Lighting/Lamps & light fixtures/Ceiling lights/Ceiling track lighting,Kitchen & appliances/Appliances/Range hoods & filters/Wall mounted range hoods,Home Décor/Mirrors/Makeup & magnifying mirrors,Kitchen & appliances/Kitchen drawer organization/Shelves & drawers,Kitchen & appliances/Kitchen drawer organization/Hinges & dampers/UTRUSTA Hinge,Kitchen & appliances/Kitchen drawer organization/Hinges & dampers/UTRUSTA Hinge w,Storage & organization/Dressers & storage drawers/Chests of drawers,Storage & organization/Dressers & storage drawers/Chests of drawers,Cookware & tableware/Dishwashing accessories/Kitchen soap dispensers,Storage & organization/Display & storage cabinets/Display cabinets,Home Décor/Mirrors/Mirror cabinets,Home Décor/Mirrors/Mirror cabinets
Cookware & tableware/Coffee & tea/Mugs & cups,Cookware & tableware/Flatware/Flatware,Cookware & tableware/Dinnerware/Side plates,Kitchen & appliances/Kitchen islands & carts,Kitchen & appliances/Kitchen islands & carts,Cookware & tableware/Dinnerware/Plates,Cookware & tableware/Dinnerware/Side plates,Cookware & tableware/Flatware/Serving set,Cookware & tableware/Dinnerware/Dinnerware sets,Cookware & tableware/Dinnerware/Deep plates/FÄRGKLAR Deep plate,Furniture/Tables & desks/Accent tables/Coffee tables,Cookware & tableware/Serveware/Serving dishes,Cookware & tableware/Dinnerware/Side plates,Cookware & tableware/Dinnerware/Deep plates/STRIMMIG Deep plate,Cookware & tableware/Dinnerware/Plates,Cookware & tableware/Serveware/Serving dishes,Cookware & tableware/Coffee & tea/Mugs & cups,Cookware & tableware/Dinnerware/Bowls,Furniture/Patio furniture/Outdoor tables/Outdoor dining tables,Cookware & tableware/Flatware/Flatware,Cookware & tableware/Napkins & napkin holders/Napkins,Cookware & tableware/Serveware/Trays,Cookware & tableware/Serveware/Trays,Cookware & tableware/Drinkware/Glasses,Cookware & tableware/Drinkware/Pitchers & carafes,Cookware & tableware/Coffee & tea/Mugs & cups,Cookware & tableware/Drinkware/Pitchers & carafes,Cookware & tableware/Drinkware/Specialty glassware,Cookware & tableware/Coffee & tea/Mugs & cups,Cookware & tableware/Dinnerware/Plates,Cookware & tableware/Serveware/Serving dishes,Cookware & tableware/Dinnerware/Bowls,Cookware & tableware/Dinnerware/Plates,Cookware & tableware/Dinnerware/Dinnerware sets,Cookware & tableware/Flatware/Flatware,Cookware & tableware/Dinnerware/Dinnerware sets,Cookware & tableware/Dinnerware/Plates,Outdoor/Grills,Outdoor/Grills,Home Décor/Flower pots & stands/Indoor plant pots,Storage & organization/Storage solution systems/BESTÅ storage system/BESTÅ all parts & accessories,Outdoor/Outdoor flooring,Cookware & tableware/Drinkware/Specialty glassware,Cookware & tableware/Coffee & tea/Mugs & cups,Cookware & tableware/Drinkware/Pitchers & carafes,Cookware & tableware/Dinnerware/Bowls,Cookware & tableware/Coffee & tea/Mugs & cups,Cookware & tableware/Dinnerware/Plates,Cookware & tableware/Dinnerware/Bowls,Cookware & tableware/Serveware/Bowls,Cookware & tableware/Dinnerware/Deep plates/VARDAGEN Deep plate,Cookware & tableware/Dinnerware/Side plates,Cookware & tableware/Table linen/Table cloths & runners,Cookware & tableware/Serveware/Serving dishes,Furniture/Tables & desks/Accent tables/Coffee tables,Furniture/Tables & desks/Accent tables/End tables & side tables,Furniture/Tables & desks/Bar tables,Furniture/Tables & desks/Café tables,Cookware & tableware/Serveware/Serving dishes,Cookware & tableware/Flatware/Serving set,Cookware & tableware/Flatware/Flatware,Cookware & tableware/Flatware/Flatware,Cookware & tableware/Flatware/Flatware,Cookware & tableware/Flatware/Flatware,Cookware & tableware/Flatware/Flatware,Cookware & tableware/Flatware/Flatware,Cookware & tableware/Flatware/Flatware/DRAGON Salad,Storage & organization/Storage containers/Food storage & organizing/Spice & condiment stands,Furniture/Tables & desks/Dining tables/Up to 6 seats,Cookware & tableware/Dinnerware/Deep plates/BACKIG Deep plate,Cookware & tableware/Dinnerware/Plates,Cookware & tableware/Dinnerware/Side plates,Cookware & tableware/Dinnerware/Bowls,Cookware & tableware/Dinnerware/Plates,Furniture/Tables & desks/Accent tables/End tables & side tables,Furniture/Tables & desks/Accent tables/End tables & side tables,Furniture/Tables & desks/Accent tables/End tables & side tables,Kitchen & appliances/Kitchen islands & carts,Cookware & tableware/Flatware/Flatware,Cookware & tableware/Flatware/Serving set,Cookware & tableware/Flatware/Flatware,Cookware & tableware/Coffee & tea/Mugs & cups,Kitchen & appliances/Kitchen systems/SEKTION kitchen/SEKTION kitchen cabinets,Kitchen & appliances/Kitchen systems/SEKTION kitchen/SEKTION kitchen cabinets,Kitchen & appliances/Kitchen systems/SEKTION kitchen/SEKTION kitchen cabinets,Kitchen & appliances/Kitchen systems/SEKTION kitchen/SEKTION kitchen cabinets,Kitchen & appliances/Kitchen systems/SEKTION kitchen/SEKTION kitchen cabinets,Kitchen & appliances/Kitchen systems/SEKTION kitchen/SEKTION kitchen cabinets,Cookware & tableware/Coffee & tea/Mugs & cups,Cookware & tableware/Dinnerware/Side plates,Furniture/Patio furniture/Outdoor chairs/Outdoor dining chairs,Furniture/Patio furniture/Outdoor tables/Outdoor dining tables,Furniture/Patio furniture/Outdoor chairs/Outdoor dining chairs,Furniture/Patio furniture/Outdoor tables/Outdoor dining tables,Furniture/Patio furniture/Outdoor chairs/Outdoor dining chairs,Furniture/Tables & desks/Accent tables/End tables & side tables,Storage & organization/Storage containers/Bathroom accessories/Bathroom accessory sets,Kitchen & appliances/Kitchen systems/SEKTION kitchen/SEKTION kitchen cabinets/Cabinet doors & drawer fronts,Kitchen & appliances/Kitchen systems/SEKTION kitchen/SEKTION kitchen cabinets,Cookware & tableware/Flatware/Flatware
