Storage & organization/Armoires & wardrobes/Solitaire wardrobes,Furniture/Chairs/Dining chairs/Dining chairs,Storage & organization/Storage containers/Hooks & hangers/Hangers,"Baby & kids/Baby/Changing, bathing & potty/Potties & baby baths",Furniture/Chairs/Dining chairs/Dining chairs,Furniture/Kids furniture/Kids chairs,Storage & organization/Storage solution systems/PAX system/PAX Interior organizers,Storage & organization/Storage containers/Clothes organizers/Hanging clothes organizers,Furniture/Tables & desks/Dining tables/Up to 4 seats,Furniture/Chairs/Dining chairs/Dining chairs,Furniture/Armchairs & chaises/Coated fabric armchairs,Furniture/Chairs/Bar stools & chairs,Storage & organization/Storage solution systems/PAX system/PAX Interior organizers,Bathroom/Bathroom vanities/Vanity cabinets without sink,Storage & organization/Armoires & wardrobes/Solitaire wardrobes,Furniture/Sofas & sectionals/Sofa legs,Furniture/Patio furniture/Outdoor sofa sections,Furniture/Beds/Kids beds/Junior & extendable beds,Storage & organization/Storage containers/Bathroom accessories/Towel rails & towel holders,Laundry & cleaning/Ironing boards,Storage & organization/Wall shelves & hooks/Hooks,Furniture/Sofas & sectionals/Sofa legs,Storage & organization/Armoires & wardrobes/Solitaire wardrobes,Furniture/Tables & desks/Nightstands,Furniture/Tables & desks/Dining tables/Up to 4 seats,Furniture/Beds/Cribs,Furniture/Chairs/Dining chairs/Dining chairs,Furniture/Chairs/Dining chairs/Upholstered chairs,Storage & organization/Storage containers/Bins & bags/Trash cans & pedal bins,Rugs/Rugs/Runners & small rugs,Storage & organization/Storage solution systems/PAX system/PAX Interior organizers,Storage & organization/Bags/Travel accessories,Storage & organization/Storage containers/Clothes organizers/Hanging clothes organizers,Furniture/Patio furniture/Outdoor tables/Outdoor dining tables,Furniture/Beds/Twin beds,Rugs/Rugs/Runners & small rugs,Rugs/Rugs/Large & medium rugs,Cookware & tableware/Dishwashing accessories/Dish drainers & drying racks,Rugs/Rugs/Door mats,Furniture/Kids furniture/Kids chairs,"Outdoor/Outdoor storage benches, boxes & cabinets",Furniture/Armchairs & chaises/Fabric armchairs,Storage & organization/Armoires & wardrobes/Solitaire wardrobes,Furniture/Patio furniture/Outdoor chairs/Outdoor dining chairs,Storage & organization/Armoires & wardrobes/Solitaire wardrobes,Furniture/Patio furniture/Outdoor chairs/Outdoor dining chairs,Laundry & cleaning/Laundry baskets,Storage & organization/Storage containers/Paper & media organizers/Desk accessories,Furniture/Chairs/Desk chairs/Desk chairs for home,Storage & organization/Armoires & wardrobes/Solitaire wardrobes,Furniture/Patio furniture/Outdoor chaises & hammocks,Storage & organization/Armoires & wardrobes/Solitaire wardrobes,Storage & organization/Armoires & wardrobes/Solitaire wardrobes,Home Décor/Storage boxes & baskets/Clothes boxes,Home Décor/Storage boxes & baskets/Clothes boxes,Furniture/Tables & desks/Accent tables/Coffee tables,Home Décor/Storage boxes & baskets/Clothes boxes,Furniture/Beds/Bed legs,Furniture/Chairs/Café chairs,Storage & organization/Armoires & wardrobes/Solitaire wardrobes,Outdoor/Outdoor flooring,Furniture/Armchairs & chaises/Lounge chairs,Storage & organization/Bags/Backpacks & messenger bags,Furniture/Sofas & sectionals/Sectionals/Sofa modules,Furniture/Sofas & sectionals/Ottomans/Fabric ottomans,Home Décor/Storage boxes & baskets/Baskets,Furniture/Chairs/Dining chairs/Dining chairs,Home Décor/Storage boxes & baskets/Baskets,Furniture/Patio furniture/Outdoor tables/Outdoor dining tables,Furniture/Tables & desks/Changing tables,Furniture/Patio furniture/Outdoor sofa sections,Home Décor/Storage boxes & baskets/Baskets,Home Décor/Storage boxes & baskets/Baskets,Cookware & tableware/Dishwashing accessories/Sink accessories,Furniture/Chairs/Desk chairs/Desk chairs for home,Furniture/Patio furniture/Outdoor sofa sections,Furniture/Beds/Kids beds/Bunk beds,Furniture/Tables & desks/Accent tables/Coffee tables,Home Décor/Storage boxes & baskets/Baskets,Home Décor/Storage boxes & baskets/Paper & media boxes,Kitchen & appliances/Kitchen systems/SEKTION kitchen/SEKTION kitchen cabinets,Storage & organization/Storage solution systems/BESTÅ storage system/BESTÅ all parts & accessories/BESTÅ doors & drawer fronts,Storage & organization/Armoires & wardrobes/Solitaire wardrobes,Furniture/Tables & desks/Accent tables/Coffee tables,Kitchen & appliances/Kitchen systems/SEKTION kitchen/SEKTION kitchen cabinets,Kitchen & appliances/Kitchen systems/SEKTION kitchen/SEKTION kitchen cabinets,Storage & organization/Armoires & wardrobes/Solitaire wardrobes,Furniture/Armchairs & chaises/Fabric armchairs,Furniture/Patio furniture/Outdoor tables/Outdoor coffee & side tables,"Storage & organization/Shelving units, bookcases & storage options/Storage shelves & units",Cookware & tableware/Serveware/Trays,Kitchen & appliances/Kitchen systems/SEKTION kitchen/SEKTION kitchen cabinets,Furniture/Tables & desks/Kids tables,Storage & organization/Storage containers/Hooks & hangers/Hangers,Storage & organization/Bags/Shopping bags & tote bags,Storage & organization/Bags/Shopping bags & tote bags,Beds & mattresses/Mattresses/Spring mattresses,Home Décor/Wall décor/Picture & photo frames,Storage & organization/Storage containers/Food storage & organizing/Food containers,Furniture/Armchairs & chaises/Kids armchairs
"Storage & organization/Shelving units, bookcases & storage options/Shelf units & cube storage",Storage & organization/Storage solution systems/SMÅSTAD system/SMÅSTAD doors & drawers,Furniture/Tables & desks/Desks & computer desks/Desks for home,Storage & organization/Storage containers/Bins & bags/Trash cans & pedal bins,Bathroom/Bathroom storage/Bathroom storage/Bathroom wall cabinets,Storage & organization/Storage containers/Food storage & organizing/Food containers,Storage & organization/Wall shelves/Brackets,Home Décor/Storage boxes & baskets/Secondary storage boxes,Storage & organization/TV & media furniture/TV stands & benches,Furniture/Tables & desks/Desks & computer desks/Desks for home,Storage & organization/Wall shelves & hooks/Hooks,Bathroom/Bathroom vanities/Vanity cabinets with sink,Storage & organization/Wall shelves/Complete wall shelves,Storage & organization/Storage solution systems/SMÅSTAD system/SMÅSTAD doors & drawers,Storage & organization/Storage solution systems/SMÅSTAD system/SMÅSTAD doors & drawers,Furniture/Tables & desks/Desks & computer desks/Desks for home,Home Décor/Storage boxes & baskets/Secondary storage boxes,"Storage & organization/Display & storage cabinets/Buffet tables, sideboard buffets & buffet cabinets",Furniture/Tables & desks/Dining tables/Up to 4 seats,Home Décor/Mirrors/Mirror cabinets,Home Décor/Mirrors/Mirror cabinets,Home Décor/Storage boxes & baskets/Paper & media boxes,Storage & organization/Storage containers/Bins & bags/Trash cans & pedal bins,Storage & organization/Storage solution systems/IVAR system/All parts,Bathroom/Bathroom vanities/Vanity cabinets with sink,Storage & organization/Wall shelves/Brackets,Furniture/Tables & desks/Desks & computer desks/Desks for home,Furniture/Tables & desks/Desks & computer desks/Desks for home,Bathroom/Bathroom vanities/Bathroom vanity legs,Storage & organization/Storage solution systems/SMÅSTAD system/SMÅSTAD doors & drawers,Storage & organization/Storage solution systems/SMÅSTAD system/SMÅSTAD doors & drawers,"Storage & organization/Storage solution systems/ELVARLI system/Post, side units & interiors",Furniture/Kids furniture/Toy storage,Storage & organization/Storage solution systems/IVAR system/All parts,Furniture/Kids furniture/Toy storage,Furniture/Kids furniture/Toy storage,Furniture/Kids furniture/Toy storage,Storage & organization/Wall shelves/Brackets,Storage & organization/TV & media furniture/TV stands & benches,Kitchen & appliances/Kitchen drawer organization/Shelves & drawers,Storage & organization/Wall shelves/Brackets,Storage & organization/Display & storage cabinets/Display cabinets,Storage & organization/TV & media furniture/TV stands & benches,Storage & organization/Armoires & wardrobes/Solitaire wardrobes,Storage & organization/TV & media furniture/TV stands & benches,Home Décor/Storage boxes & baskets/Kids boxes & baskets,Kitchen & appliances/Kitchen islands & carts,Storage & organization/Display & storage cabinets/Dining room cabinets & cupboards,"Storage & organization/Storage solution systems/ELVARLI system/Post, side units & interiors",Storage & organization/Storage solution systems/BOAXEL system/BOAXEL parts,Laundry & cleaning/Ironing boards,Storage & organization/TV & media furniture/TV stands & benches,Storage & organization/TV & media furniture/TV stands & benches,Storage & organization/Storage solution systems/BOAXEL system/BOAXEL parts,Kitchen & appliances/Kitchen drawer organization/Drawer dividers,"Storage & organization/Storage solution systems/ELVARLI system/Post, side units & interiors",Kitchen & appliances/Kitchen islands & carts,"Storage & organization/Shelving units, bookcases & storage options/Storage shelves & units",Home Décor/Mirrors/Wall mirrors,Cookware & tableware/Knives & cutting boards/Sharpening tools,Storage & organization/TV & media furniture/TV stands & benches,Kitchen & appliances/Kitchen islands & carts,Kitchen & appliances/Kitchen islands & carts,Cookware & tableware/Cookware & kitchenware/Cooking pans/Grill pans & griddles,Storage & organization/Storage containers/Paper & media organizers/Desk accessories,Storage & organization/Wall shelves/Brackets,Home Décor/Mirrors/Wall mirrors,Home electronics/Speakers/Wi-Fi speakers,Storage & organization/Storage containers/Cable management & accessories,Home Décor/Mirrors/Wall mirrors,Storage & organization/Wall shelves/Shelves,"Storage & organization/Storage solution systems/ELVARLI system/Post, side units & interiors",Kitchen & appliances/Kitchen drawer organization/Shelves & drawers,Kitchen & appliances/Kitchen drawer organization/Shelves & drawers,Kitchen & appliances/Kitchen wall organization & storage/Wall organizers,Kitchen & appliances/Kitchen wall organization & storage/Wall organizers,Kitchen & appliances/Kitchen wall organization & storage/Wall organizers,Home Décor/Wall décor/Picture ledges,Kitchen & appliances/Kitchen systems/SEKTION kitchen/SEKTION kitchen cabinets,Kitchen & appliances/Kitchen wall organization & storage/Wall organizers,Kitchen & appliances/Kitchen wall organization & storage/Wall organizers,Kitchen & appliances/Kitchen wall organization & storage/Wall organizers,Kitchen & appliances/Kitchen wall organization & storage/Wall organizers,Kitchen & appliances/Kitchen wall organization & storage/Wall organizers,Kitchen & appliances/Kitchen wall organization & storage/Wall organizers,Storage & organization/Display & storage cabinets/Display cabinets,Storage & organization/Storage solution systems/BOAXEL system/BOAXEL parts,Storage & organization/Storage solution systems/IVAR system/All parts,Home Décor/Wall décor/Picture ledges,Bathroom/Bathroom storage/Bathroom shelving units,Storage & organization/Wall shelves/Complete wall shelves/LIATORP Wall,Storage & organization/Storage containers/Bathroom accessories/Towel rails & towel holders,Storage & organization/Wall shelves/Shelves,Storage & organization/Wall shelves/Shelves,Storage & organization/Storage containers/Bathroom accessories/Bathroom shelves,Kitchen & appliances/Kitchen islands & carts,Furniture/Tables & desks/Desks & computer desks/Desks for home,"Storage & organization/Shelving units, bookcases & storage options/Shelf units & cube storage",Furniture/Tables & desks/Console tables & sofa tables,Home Décor/Clocks/Wall & table clocks
Home Décor/Mirrors/Wall mirrors,Storage & organization/Storage containers/Food storage & organizing/Food containers,Kitchen & appliances/Kitchen systems/SEKTION kitchen/SEKTION kitchen cabinets,Kitchen & appliances/Kitchen systems/SEKTION kitchen/SEKTION kitchen cabinets,Kitchen & appliances/Kitchen systems/SEKTION kitchen/SEKTION kitchen cabinets,Kitchen & appliances/Kitchen systems/SEKTION kitchen/SEKTION kitchen cabinets,Kitchen & appliances/Kitchen systems/SEKTION kitchen/SEKTION kitchen cabinets,Furniture/Patio furniture/Outdoor tables/Outdoor dining tables,Home Décor/Mirrors/Vanity mirrors,Storage & organization/Bags/Bag organizers,Furniture/Tables & desks/Dining tables/Up to 4 seats,Home Décor/Mirrors/Wall mirrors,Outdoor/Outdoor flooring,Home Textiles/Window treatments/Curtain rods & rails/Track systems,Home Textiles/Window treatments/Curtain rods & rails/Track systems,Home Décor/Wall décor/Art cards,Home Textiles/Window treatments/Curtain rods & rails/Track systems,Home Textiles/Window treatments/Curtain rods & rails/Track systems,Home Décor/Flower pots & stands/Indoor plant pots,Storage & organization/Storage containers/Bathroom accessories/Towel rails & towel holders,Furniture/Patio furniture/Outdoor tables/Outdoor dining tables,Storage & organization/Clothes organizers/Shoe racks & stands,Home Textiles/Window treatments/Curtain rods & rails/Track systems,Furniture/Chairs/Dining chairs/Dining chairs,Cookware & tableware/Dinnerware/Deep plates/VÄRDERA Deep plate,Outdoor/Outdoor flooring,Furniture/Chairs/Stools & benches/Benches,Outdoor/Outdoor flooring,Cookware & tableware/Dinnerware/Side plates,Home Décor/Mirrors/Makeup & magnifying mirrors,Rugs/Rugs/Runners & small rugs,Home Décor/Wall décor/Collage picture frames,Furniture/Chairs/Stools & benches/Benches,Furniture/Tables & desks/Dining tables/Up to 10 seats,Storage & organization/Storage containers/Paper & media organizers/Magazine files,Storage & organization/Wall shelves/Complete wall shelves/HEMNES Wall,Rugs/Rugs/Runners & small rugs,Furniture/Tables & desks/Nightstands,"Laundry & cleaning/Drying racks/MULIG Drying rack, indoor","Storage & organization/Clothes organizers/Clothes racks & stands/TURBO Clothes rack, indoor",Furniture/Tables & desks/Bar tables,Storage & organization/TV & media furniture/TV stands & benches,Furniture/Tables & desks/Café tables,"Storage & organization/Wall shelves & hooks/Hooks/BRANDUR Rail with 4 hooks, in-","Storage & organization/Wall shelves & hooks/Hooks/BRANDUR Hook, in-","Storage & organization/Wall shelves & hooks/Hooks/BRANDUR Hook, in-",Storage & organization/Wall shelves & hooks/Hooks,Storage & organization/Wall shelves & hooks/Hooks,Furniture/Tables & desks/Accent tables/Coffee tables,Furniture/Tables & desks/Desks & computer desks/Desks for home,Furniture/Tables & desks/Accent tables/End tables & side tables,Storage & organization/Dressers & storage drawers/Drawer units/Drawer units for home,Furniture/Chairs/Dining chairs/Dining chairs,Baby & kids/Kids/Toys & play/Physical play,Kitchen & appliances/Kitchen drawer organization/Drawer dividers,Cookware & tableware/Knives & cutting boards/Cutting boards,Home Décor/Wall décor/Wall decals & stickers,Home Décor/Candle holders & candles/Lanterns,Home Décor/Wall décor/Picture & photo frames,Home Décor/Wall décor/Picture & photo frames,Storage & organization/Storage containers/Food storage & organizing/Food containers,Furniture/Tables & desks/Makeup vanities & dressing tables,Home Textiles/Window treatments/Curtains & drapes/Panel curtains,Cookware & tableware/Dinnerware/Plates,Storage & organization/Storage containers/Food storage & organizing/Food containers,Storage & organization/Storage containers/Food storage & organizing/Food containers,Storage & organization/Wall shelves & hooks/Hooks,Home improvement/Home safety/Child safety,Home Décor/Wall décor/Picture & photo frames,Kitchen & appliances/Kitchen countertops/Laminate countertops,Home Décor/Wall décor/Picture & photo frames,Home Décor/Wall décor/Picture & photo frames,Kitchen & appliances/Kitchen countertops/Laminate countertops,Home Textiles/Window treatments/Curtain rods & rails/Curtain rods,Outdoor/Umbrellas & gazebos/Patio umbrellas & bases,Home Textiles/Window treatments/Curtain rods & rails/Curtain rods,Home Décor/Decorative accessories,Furniture/Room dividers,"Baby & kids/Baby/Changing, bathing & potty/Potties & baby baths",Kitchen & appliances/Kitchen countertops/Laminate countertops,Storage & organization/Storage containers/Food storage & organizing/Food containers,Storage & organization/Storage containers/Food storage & organizing/Food containers,Furniture/Patio furniture/Outdoor tables/Outdoor dining tables,Kitchen & appliances/Kitchen countertops/Laminate countertops,Kitchen & appliances/Kitchen islands & carts,Storage & organization/Storage containers/Food storage & organizing/Food containers,Kitchen & appliances/Kitchen countertops/Laminate countertops,Kitchen & appliances/Kitchen drawer organization/Kitchen trash cans & bins,Home Décor/Wall décor/Picture & photo frames,Home Décor/Wall décor/Picture & photo frames,Rugs/Rugs/Door mats,Home electronics/Cords & chargers/Cables & accessories,Storage & organization/Storage solution systems/PAX system/PAX sliding doors,Cookware & tableware/Knives & cutting boards/Cutting boards,Cookware & tableware/Knives & cutting boards/Cutting boards,Storage & organization/Storage solution systems/BESTÅ storage system/BESTÅ all parts & accessories,Cookware & tableware/Dishwashing accessories/Dish brushes,Kitchen & appliances/Kitchen countertops/Butcher block countertops,Furniture/Sofas & sectionals/Sofa accessories,"Storage & organization/Shelving units, bookcases & storage options/Shelf units & cube storage"
Home Décor/Mirrors/Wall mirrors,Storage & organization/Storage containers/Food storage & organizing/Food containers,Kitchen & appliances/Kitchen systems/SEKTION kitchen/SEKTION kitchen cabinets,Kitchen & appliances/Kitchen systems/SEKTION kitchen/SEKTION kitchen cabinets,Kitchen & appliances/Kitchen systems/SEKTION kitchen/SEKTION kitchen cabinets,Kitchen & appliances/Kitchen systems/SEKTION kitchen/SEKTION kitchen cabinets,Kitchen & appliances/Kitchen systems/SEKTION kitchen/SEKTION kitchen cabinets,Furniture/Patio furniture/Outdoor tables/Outdoor dining tables,Home Décor/Mirrors/Vanity mirrors,Storage & organization/Bags/Bag organizers,Furniture/Tables & desks/Dining tables/Up to 4 seats,Home Décor/Mirrors/Wall mirrors,Outdoor/Outdoor flooring,Home Textiles/Window treatments/Curtain rods & rails/Track systems,Home Textiles/Window treatments/Curtain rods & rails/Track systems,Home Décor/Wall décor/Art cards,Home Textiles/Window treatments/Curtain rods & rails/Track systems,Home Textiles/Window treatments/Curtain rods & rails/Track systems,Home Décor/Flower pots & stands/Indoor plant pots,Storage & organization/Storage containers/Bathroom accessories/Towel rails & towel holders,Furniture/Patio furniture/Outdoor tables/Outdoor dining tables,Storage & organization/Clothes organizers/Shoe racks & stands,Home Textiles/Window treatments/Curtain rods & rails/Track systems,Furniture/Chairs/Dining chairs/Dining chairs,Cookware & tableware/Dinnerware/Deep plates/VÄRDERA Deep plate,Outdoor/Outdoor flooring,Furniture/Chairs/Stools & benches/Benches,Outdoor/Outdoor flooring,Cookware & tableware/Dinnerware/Side plates,Home Décor/Mirrors/Makeup & magnifying mirrors,Rugs/Rugs/Runners & small rugs,Home Décor/Wall décor/Collage picture frames,Furniture/Chairs/Stools & benches/Benches,Furniture/Tables & desks/Dining tables/Up to 10 seats,Storage & organization/Storage containers/Paper & media organizers/Magazine files,Storage & organization/Wall shelves/Complete wall shelves/HEMNES Wall,Rugs/Rugs/Runners & small rugs,Furniture/Tables & desks/Nightstands,"Laundry & cleaning/Drying racks/MULIG Drying rack, indoor","Storage & organization/Clothes organizers/Clothes racks & stands/TURBO Clothes rack, indoor",Furniture/Tables & desks/Bar tables,Storage & organization/TV & media furniture/TV stands & benches,Furniture/Tables & desks/Café tables,"Storage & organization/Wall shelves & hooks/Hooks/BRANDUR Rail with 4 hooks, in-","Storage & organization/Wall shelves & hooks/Hooks/BRANDUR Hook, in-","Storage & organization/Wall shelves & hooks/Hooks/BRANDUR Hook, in-",Storage & organization/Wall shelves & hooks/Hooks,Storage & organization/Wall shelves & hooks/Hooks,Furniture/Tables & desks/Accent tables/Coffee tables,Furniture/Tables & desks/Desks & computer desks/Desks for home,Furniture/Tables & desks/Accent tables/End tables & side tables,Storage & organization/Dressers & storage drawers/Drawer units/Drawer units for home,Furniture/Chairs/Dining chairs/Dining chairs,Baby & kids/Kids/Toys & play/Physical play,Kitchen & appliances/Kitchen drawer organization/Drawer dividers,Cookware & tableware/Knives & cutting boards/Cutting boards,Home Décor/Wall décor/Wall decals & stickers,Home Décor/Candle holders & candles/Lanterns,Home Décor/Wall décor/Picture & photo frames,Home Décor/Wall décor/Picture & photo frames,Storage & organization/Storage containers/Food storage & organizing/Food containers,Furniture/Tables & desks/Makeup vanities & dressing tables,Home Textiles/Window treatments/Curtains & drapes/Panel curtains,Cookware & tableware/Dinnerware/Plates,Storage & organization/Storage containers/Food storage & organizing/Food containers,Storage & organization/Storage containers/Food storage & organizing/Food containers,Storage & organization/Wall shelves & hooks/Hooks,Home improvement/Home safety/Child safety,Home Décor/Wall décor/Picture & photo frames,Kitchen & appliances/Kitchen countertops/Laminate countertops,Home Décor/Wall décor/Picture & photo frames,Home Décor/Wall décor/Picture & photo frames,Kitchen & appliances/Kitchen countertops/Laminate countertops,Home Textiles/Window treatments/Curtain rods & rails/Curtain rods,Outdoor/Umbrellas & gazebos/Patio umbrellas & bases,Home Textiles/Window treatments/Curtain rods & rails/Curtain rods,Home Décor/Decorative accessories,Furniture/Room dividers,"Baby & kids/Baby/Changing, bathing & potty/Potties & baby baths",Kitchen & appliances/Kitchen countertops/Laminate countertops,Storage & organization/Storage containers/Food storage & organizing/Food containers,Storage & organization/Storage containers/Food storage & organizing/Food containers,Furniture/Patio furniture/Outdoor tables/Outdoor dining tables,Kitchen & appliances/Kitchen countertops/Laminate countertops,Kitchen & appliances/Kitchen islands & carts,Storage & organization/Storage containers/Food storage & organizing/Food containers,Kitchen & appliances/Kitchen countertops/Laminate countertops,Kitchen & appliances/Kitchen drawer organization/Kitchen trash cans & bins,Home Décor/Wall décor/Picture & photo frames,Home Décor/Wall décor/Picture & photo frames,Rugs/Rugs/Door mats,Home electronics/Cords & chargers/Cables & accessories,Storage & organization/Storage solution systems/PAX system/PAX sliding doors,Cookware & tableware/Knives & cutting boards/Cutting boards,Cookware & tableware/Knives & cutting boards/Cutting boards,Storage & organization/Storage solution systems/BESTÅ storage system/BESTÅ all parts & accessories,Cookware & tableware/Dishwashing accessories/Dish brushes,Kitchen & appliances/Kitchen countertops/Butcher block countertops,Furniture/Sofas & sectionals/Sofa accessories,"Storage & organization/Shelving units, bookcases & storage options/Shelf units & cube storage"
