Beds & mattresses/Bedding/Blankets & throws,Beds & mattresses/Bedding/Pillows/Polyester pillows,Rugs/Rugs/Large & medium rugs,Beds & mattresses/Bedding/Cushions & cushions covers/Cushion covers,Beds & mattresses/Bedding/Cushions & cushions covers/Cushion covers,Beds & mattresses/Bedding/Blankets & throws,Baby & kids/Baby/Cribs & crib mattresses/Baby canopies,Beds & mattresses/Bedding/Cushions & cushions covers/Cushion covers,Beds & mattresses/Bedding/Blankets & throws,Beds & mattresses/Bedding/Blankets & throws,Beds & mattresses/Bedding/Blankets & throws,Beds & mattresses/Bedding/Cushions & cushions covers/Cushions,Rugs/Rugs/Door mats,Bathroom/Bathroom textiles/Towels/Hand towels,Bathroom/Bathroom textiles/Towels/Bath sheets,Bathroom/Bathroom textiles/Towels/Wash cloths,Beds & mattresses/Bedding/Cushions & cushions covers/Cushions,Bathroom/Bathroom textiles/Towels/Bath towels,Bathroom/Bathroom textiles/Towels/Hand towels,Furniture/Sofas & sectionals/Sofa & armchairs covers/FLOTTEBO covers,Laundry & cleaning/Laundry baskets,"Furniture/Patio furniture/Outdoor seat cushions/SÖTHOLMEN Cushion cover, in",Beds & mattresses/Bedding/Cushions & cushions covers/Cushion covers,Beds & mattresses/Mattresses/Kids mattresses,Furniture/Beds/Kids beds/Kids bed accessories & canopies,Beds & mattresses/Bedding/Blankets & throws/FÄLTMAL Pillow,Beds & mattresses/Bedding/Cushions & cushions covers/Inner cushions,Beds & mattresses/Bedding/Cushions & cushions covers/Inner cushions,Beds & mattresses/Bedding/Cushions & cushions covers/Inner cushions,Furniture/Tables & desks/Changing tables,Furniture/Sofas & sectionals/Sofa & armchairs covers/FÄRLÖV covers,Beds & mattresses/Bedding/Cushions & cushions covers/Cushions,Beds & mattresses/Bedding/Blankets & throws,Furniture/Patio furniture/Outdoor seat cushions,Beds & mattresses/Bedding/Bedlinen/Duvet cover sets,Beds & mattresses/Bedding/Pillows/Down & feather pillows,Beds & mattresses/Bedding/Pillows/Down & feather pillows,Beds & mattresses/Mattresses/Mattress toppers,Beds & mattresses/Bedding/Bedlinen/Duvet cover sets,Beds & mattresses/Bedding/Bedlinen/Duvet cover sets,Beds & mattresses/Bedding/Cushions & cushions covers/Cushion covers,Rugs/Rugs/Runners & small rugs,Home Textiles/Window treatments/Curtains & drapes/Light filtering curtains,Furniture/Armchairs & chaises/Rattan armchairs,Furniture/Armchairs & chaises/Rattan armchairs,Rugs/Rugs/Sheepskins & cowhides,Rugs/Rugs/Sheepskins & cowhides,Beds & mattresses/Bedding/Cushions & cushions covers/Cushion covers,Furniture/Sofas & sectionals/Sofa & armchairs covers/STOCKSUND covers,"Outdoor/Outdoor cushions/Outdoor pillows/FUNKÖN Cushion cover, in","Outdoor/Outdoor cushions/Outdoor pillows/FUNKÖN Back cushion, indoor",Beds & mattresses/Bedding/Cushions & cushions covers/Cushion covers,Furniture/Beds/Sleeper sofas/Mattress choices,Beds & mattresses/Bedding/Bedlinen/Duvet cover sets,Beds & mattresses/Bedding/Bedlinen/Duvet cover sets,Beds & mattresses/Bedding/Bedlinen/Duvet cover sets,"Rugs/Rugs/Large & medium rugs/SKARRILD Rug flatwoven, in",Furniture/Patio furniture/Outdoor seat cushions,Furniture/Patio furniture/Outdoor seat cushions,Beds & mattresses/Bedding/Comforters/Down & feather comforters,Beds & mattresses/Bedding/Comforters/Down & feather comforters,Beds & mattresses/Bedding/Comforters/Down & feather comforters,Rugs/Rugs/Runners & small rugs,Beds & mattresses/Bedding/Bedlinen/Duvet cover sets,Beds & mattresses/Bedding/Bedlinen/Duvet cover sets,Baby & kids/Baby/Baby textiles/Nursery rugs,Beds & mattresses/Bedding/Comforters/Polyester comforters,Beds & mattresses/Bedding/Comforters/Polyester comforters,Rugs/Rugs/Large & medium rugs,Beds & mattresses/Bedding/Cushions & cushions covers/Children's cushions & blankets,Furniture/Beds/Sleeper sofas/Mattress choices,Baby & kids/Baby/Baby textiles/Baby quilts & pillows,Bathroom/Bathroom textiles/Shower curtains,Beds & mattresses/Bedding/Cushions & cushions covers/Cushion covers,"Baby & kids/Baby/Changing, bathing & potty/Changing accessories",Cookware & tableware/Kitchen textiles/Kitchen towels,Beds & mattresses/Bedding/Bedlinen/Duvet cover sets,Rugs/Rugs/Door mats,Beds & mattresses/Bedding/Cushions & cushions covers/Cushion covers,Beds & mattresses/Bedding/Cushions & cushions covers/Cushion covers,Furniture/Chairs/High chairs,Furniture/Armchairs & chaises/Kids armchairs,Beds & mattresses/Bedding/Cushions & cushions covers/Cushion covers,Furniture/Sofas & sectionals/Sofa & armchairs covers/VINLIDEN covers,Beds & mattresses/Bedding/Cushions & cushions covers/Cushion covers,Beds & mattresses/Bedding/Bedspreads,Cookware & tableware/Kitchen textiles/Pot holders & oven mitts,Cookware & tableware/Kitchen textiles/Pot holders & oven mitts,Cookware & tableware/Kitchen textiles/Pot holders & oven mitts,Bathroom/Bathroom textiles/Towels/Wash cloths,Bathroom/Bathroom textiles/Towels/Bath sheets,Bathroom/Bathroom textiles/Towels/Hand towels,Bathroom/Bathroom textiles/Towels/Bath towels,Beds & mattresses/Bedding/Blankets & throws,"Baby & kids/Baby/Changing, bathing & potty/Changing accessories",Beds & mattresses/Bedding/Cushions & cushions covers/Children's cushions & blankets,Bathroom/Bathroom textiles/Towels/Bath sheets,Bathroom/Bathroom textiles/Towels/Bath towels,Bathroom/Bathroom textiles/Towels/Hand towels,Outdoor/Umbrellas & gazebos/Patio umbrellas & bases
Storage & organization/Storage solution systems/AURDAL system/AURDAL parts,Storage & organization/Storage solution systems/AURDAL system/AURDAL parts,Storage & organization/Storage solution systems/AURDAL system/AURDAL parts,Storage & organization/Storage solution systems/AURDAL system/AURDAL parts,Storage & organization/Storage solution systems/AURDAL system/AURDAL parts,Storage & organization/Storage solution systems/AURDAL system/AURDAL parts,Storage & organization/Storage solution systems/AURDAL system/AURDAL parts,Storage & organization/Storage solution systems/AURDAL system/AURDAL parts,Storage & organization/Storage solution systems/AURDAL system/AURDAL parts,Storage & organization/Storage solution systems/AURDAL system/AURDAL parts,Storage & organization/Storage solution systems/AURDAL system/AURDAL parts,Storage & organization/Storage solution systems/AURDAL system/AURDAL parts,Home Décor/Mirrors/Wall mirrors,Storage & organization/Clothes organizers/Shoe racks & stands,Baby & kids/Kids/Kids storage & organization/Children's hooks & wall organization,"Storage & organization/Shelving units, bookcases & storage options/Shelf units & cube storage","Storage & organization/Shelving units, bookcases & storage options/Shelf units & cube storage",Home electronics/Cords & chargers/Wireless charging & accessories,Kitchen & appliances/Kitchen drawer organization/Drawer dividers,Storage & organization/Wall shelves/Brackets,Storage & organization/Storage containers/Paper & media organizers/Media accessories,Bathroom/Bathroom storage/Bathroom storage/Bathroom wall cabinets,Storage & organization/Storage containers/Bathroom accessories/Towel rails & towel holders,Storage & organization/Storage containers/Bathroom accessories/Soap dispensers & soap dishes,Storage & organization/Storage containers/Bathroom accessories/Toilet roll holders & stands,Storage & organization/Storage containers/Bathroom accessories/Toothbrush holders,Storage & organization/Storage containers/Bathroom accessories/Towel rails & towel holders,Storage & organization/Storage containers/Bathroom accessories/Shower accessories,Storage & organization/Storage containers/Bathroom accessories/Shower accessories,Bathroom/Showers/Shower sets & rails,Cookware & tableware/Knives & cutting boards/Cutting boards,Bathroom/Bathroom storage/Bathroom shelving units,Cookware & tableware/Serveware/Trays,Cookware & tableware/Cookware & kitchenware/Ovenware,Home Décor/Mirrors/Makeup & magnifying mirrors,Storage & organization/Dressers & storage drawers/Chests of drawers,Storage & organization/Dressers & storage drawers/Chests of drawers,Storage & organization/Dressers & storage drawers/Chests of drawers,Storage & organization/Dressers & storage drawers/Chests of drawers,Storage & organization/Storage solution systems/BESTÅ storage system/BESTÅ all parts & accessories,Storage & organization/Storage containers/Bathroom accessories/Shower accessories,Storage & organization/Storage containers/Bins & bags/Trash cans & pedal bins,Storage & organization/Storage solution systems/BESTÅ storage system/BESTÅ all parts & accessories,Home Décor/Storage boxes & baskets/Paper & media boxes,Storage & organization/Storage containers/Food storage & organizing/Cooler bags,Cookware & tableware/Cookware & kitchenware/Cooking pans/Grill pans & griddles,Cookware & tableware/Cookware & kitchenware/Cooking pans/Frying pans & skillets,Storage & organization/Storage solution systems/IVAR system/All parts,Cookware & tableware/Cookware & kitchenware/Pots & pans/Cooking & stock pots,Cookware & tableware/Cookware & kitchenware/Pots & pans/Saucepans,Cookware & tableware/Cookware & kitchenware/Cooking pans/Frying pans & skillets,Cookware & tableware/Cookware & kitchenware/Pots & pans/Cooking & stock pots,Cookware & tableware/Cookware & kitchenware/Pots & pans/Cooking & stock pots,Cookware & tableware/Cookware & kitchenware/Cooking pans/Frying pans & skillets,Cookware & tableware/Cookware & kitchenware/Cooking pans/Frying pans & skillets,Cookware & tableware/Cookware & kitchenware/Pots & pans/Cooking & stock pots,Cookware & tableware/Cookware & kitchenware/Cooking pans/Frying pans & skillets,Storage & organization/Storage solution systems/BESTÅ storage system/BESTÅ all parts & accessories,Storage & organization/Storage solution systems/SMÅSTAD system/SMÅSTAD interior fittings,Storage & organization/Storage solution systems/SMÅSTAD system/SMÅSTAD interior fittings,Storage & organization/Wall shelves/Complete wall shelves,Furniture/Tables & desks/Dining tables/Up to 6 seats,Kitchen & appliances/Kitchen drawer organization/Drawer dividers,Furniture/Tables & desks/Kids tables,Storage & organization/Storage containers/Bins & bags/Trash cans & pedal bins,Home electronics/Cords & chargers/Wireless charging & accessories,Storage & organization/Clothes organizers/Shoe cabinets,Storage & organization/Clothes organizers/Shoe cabinets,Storage & organization/Clothes organizers/Shoe cabinets,Storage & organization/Clothes organizers/Shoe cabinets,Storage & organization/Clothes organizers/Shoe cabinets,Storage & organization/Clothes organizers/Shoe cabinets,Storage & organization/Clothes organizers/Shoe cabinets,Cookware & tableware/Kitchen & cooking accessories/Kitchen utensils/Colanders & strainers,Storage & organization/Storage solution systems/BESTÅ storage system/BESTÅ all parts & accessories,Cookware & tableware/Cookware & kitchenware/Cooking accessories,Kitchen & appliances/Appliances/Ranges,Bathroom/Showers/Shower heads,Kitchen & appliances/Kitchen systems/SEKTION kitchen/SEKTION kitchen cabinets,Kitchen & appliances/Kitchen systems/SEKTION kitchen/SEKTION kitchen cabinets,Kitchen & appliances/Kitchen faucets & sinks/Sink parts,Kitchen & appliances/Kitchen systems/SEKTION kitchen/SEKTION kitchen cabinets/Cabinet doors & drawer fronts,Cookware & tableware/Cookware & kitchenware/Pots & pans/Cookware sets,Cookware & tableware/Cookware & kitchenware/Cooking pans/Frying pans & skillets,Cookware & tableware/Cookware & kitchenware/Cooking pans/Frying pans & skillets,Cookware & tableware/Cookware & kitchenware/Cooking pans/Frying pans & skillets,Cookware & tableware/Cookware & kitchenware/Pots & pans/Saucepans,Cookware & tableware/Cookware & kitchenware/Pots & pans/Cooking & stock pots,Cookware & tableware/Cookware & kitchenware/Cooking pans/Frying pans & skillets,Cookware & tableware/Cookware & kitchenware/Cooking pans/Frying pans & skillets,Cookware & tableware/Cookware & kitchenware/Cooking pans/Frying pans & skillets,Kitchen & appliances/Kitchen systems/SEKTION kitchen/SEKTION kitchen cabinets,Storage & organization/Storage solution systems/SMÅSTAD system/SMÅSTAD interior fittings,Kitchen & appliances/Kitchen systems/SEKTION kitchen/SEKTION kitchen cabinets,"Storage & organization/Shelving units, bookcases & storage options/Shelf units & cube storage",Cookware & tableware/Serveware/Serving dishes,Storage & organization/Wall shelves/Complete wall shelves,Storage & organization/Wall shelves/Complete wall shelves,Storage & organization/Storage containers/Food storage & organizing/Jars & tins,Storage & organization/Storage containers/Bins & bags/Trash cans & pedal bins
Home Textiles/Window treatments/Curtains & drapes/Light filtering curtains,Home Textiles/Window treatments/Curtains & drapes/Light filtering curtains,Home Textiles/Window treatments/Curtains & drapes/Panel curtains,Home Textiles/Window treatments/Curtains & drapes/Light filtering curtains,Home Textiles/Window treatments/Curtains & drapes/Panel curtains,"Home Textiles/Window treatments/Shades, blinds & window treatments/Pleated & cellular blinds and shades",Home Textiles/Window treatments/Curtains & drapes/Panel curtains,Home Textiles/Window treatments/Curtains & drapes/Light filtering curtains,Home Textiles/Window treatments/Curtains & drapes/Light filtering curtains,Home Textiles/Window treatments/Curtains & drapes/Light filtering curtains,Home Textiles/Window treatments/Curtains & drapes/Light filtering curtains,"Home Textiles/Window treatments/Shades, blinds & window treatments/Roman shades",Home Textiles/Window treatments/Curtains & drapes/Panel curtains,Home Textiles/Window treatments/Curtains & drapes/Light filtering curtains,Rugs/Rugs/Door mats,Lighting/Lamps & light fixtures/Kids lighting,Home Décor/Noticeboards,Storage & organization/Clothes organizers/Clothes racks & stands,Storage & organization/Clothes organizers/Clothes racks & stands,Baby & kids/Kids/Toys & play/Role play,Home Décor/Mirrors/Vanity mirrors,"Home improvement/Oils, stains & product care","Home improvement/Oils, stains & product care","Home improvement/Oils, stains & product care","Home improvement/Oils, stains & product care",Kitchen & appliances/Backsplashes & wall panels/Laminate backsplashes,Kitchen & appliances/Backsplashes & wall panels/Laminate backsplashes,Storage & organization/Storage solution systems/PAX system/PAX doors without hinges,Kitchen & appliances/Backsplashes & wall panels/Laminate backsplashes,Baby & kids/Kids/Toys & play/Physical play,Home Décor/Clocks/Alarm clocks,Baby & kids/Kids/Toys & play/Role play,Bathroom/Bathroom textiles/Shower curtains,Furniture/Patio furniture/Outdoor chaises & hammocks,Bathroom/Bathroom sinks,Pet accessories/Cats,Bathroom/Bathroom sinks,Bathroom/Bathroom sinks,Bathroom/Bathroom sinks,Bathroom/Bathroom sinks,Home Textiles/Window treatments/Curtain rods & rails/Track systems,Furniture/Tables & desks/Accent tables/Coffee tables,Furniture/Tables & desks/Accent tables/Coffee tables,Rugs/Rugs/Door mats,Outdoor/Umbrellas & gazebos/Patio umbrellas & bases,Cookware & tableware/Serveware/Trays,"Storage & organization/Wall shelves & hooks/Hooks/BRANDUR Hook, in-",Home Décor/Flower pots & stands/Indoor plant pots,Storage & organization/Wall shelves & hooks/Hooks,Storage & organization/Wall shelves & hooks/Hooks,"Laundry & cleaning/Drying racks/MULIG Drying rack, indoor","Storage & organization/Wall shelves & hooks/Hooks/BRANDUR Rail with 4 hooks, in-","Storage & organization/Clothes organizers/Clothes racks & stands/TURBO Clothes rack, indoor","Storage & organization/Wall shelves & hooks/Hooks/BRANDUR Hook, in-",Home Décor/Storage boxes & baskets/Baskets,Home Décor/Candle holders & candles/Lanterns,"Home Textiles/Window treatments/Shades, blinds & window treatments/Black-out shades & blinds",Cookware & tableware/Serveware/Trays,Home electronics/Speakers/Wi-Fi speakers,Cookware & tableware/Flatware/Flatware,Furniture/Tables & desks/Dining tables/Up to 4 seats,Bathroom/Showers/Shower heads,Home Décor/Clocks/Alarm clocks,Home Décor/Clocks/Alarm clocks,Cookware & tableware/Cookware & kitchenware/Cooking pans/Frying pans & skillets,Storage & organization/Storage solution systems/PAX system/PAX doors without hinges,Baby & kids/Kids/Toys & play/Arts & crafts,Cookware & tableware/Cookware & kitchenware/Cooking pans/Woks,Storage & organization/Storage containers/Paper & media organizers/Desk accessories,Storage & organization/Storage containers/Bins & bags/Trash cans & pedal bins,Storage & organization/Dressers & storage drawers/Chests of drawers,Cookware & tableware/Napkins & napkin holders/Napkin holders,Laundry & cleaning/Cleaning accessories,Storage & organization/Wall shelves/Complete wall shelves/HEMNES Wall,Storage & organization/TV & media furniture/TV stands & benches,Outdoor/Umbrellas & gazebos/Patio umbrellas & bases,Furniture/Tables & desks/Dining tables/Up to 6 seats,Storage & organization/Storage solution systems/PAX system/PAX doors without hinges,Cookware & tableware/Dinnerware/Dinnerware sets,Cookware & tableware/Coffee & tea/Mugs & cups,Cookware & tableware/Coffee & tea/Mugs & cups,Baby & kids/Baby/Baby toys/Newborn,Home Textiles/Window treatments/Curtain rods & rails/Track systems,Home Textiles/Window treatments/Curtain rods & rails/Track systems,Home Textiles/Window treatments/Curtain rods & rails/Track systems,Home Textiles/Window treatments/Curtain rods & rails/Track systems,Kitchen & appliances/Kitchen systems/SEKTION kitchen/SEKTION kitchen cabinets,Kitchen & appliances/Kitchen systems/SEKTION kitchen/SEKTION kitchen cabinets,Kitchen & appliances/Kitchen systems/SEKTION kitchen/SEKTION kitchen cabinets,Cookware & tableware/Dinnerware/Side plates,Cookware & tableware/Dinnerware/Dinnerware sets,Cookware & tableware/Dinnerware/Plates,Kitchen & appliances/Kitchen systems/SEKTION kitchen/SEKTION kitchen cabinets,Cookware & tableware/Dinnerware/Bowls,Kitchen & appliances/Kitchen systems/SEKTION kitchen/SEKTION kitchen cabinets,Cookware & tableware/Dinnerware/Deep plates/FLITIGHET Deep plate,Home Textiles/Window treatments/Curtains & drapes/Room darkening curtains & drapes,Home Décor/Storage boxes & baskets/Secondary storage boxes,Cookware & tableware/Dinnerware/Side plates,Cookware & tableware/Dinnerware/Plates
Storage & organization/Display & storage cabinets/Display cabinets,"Storage & organization/Shelving units, bookcases & storage options/Shelf units & cube storage",Kitchen & appliances/Kitchen drawer organization/Shelves & drawers,Cookware & tableware/Knives & cutting boards/Sharpening tools,Bathroom/Bathroom storage/Bathroom storage/Bathroom wall cabinets,Home Décor/Storage boxes & baskets/Paper & media boxes,Storage & organization/Storage solution systems/PAX system/PAX Interior organizers,Storage & organization/Storage solution systems/PAX system/PAX Interior organizers,Storage & organization/Wall shelves & hooks/Hooks,Storage & organization/Storage solution systems/BESTÅ storage system/BESTÅ all parts & accessories,Furniture/Tables & desks/Accent tables/End tables & side tables,Home electronics/Speakers/Wi-Fi speakers,Home electronics/Speakers/Wi-Fi speakers,Bathroom/Bathroom vanities/Bathroom vanity legs,Storage & organization/Storage containers/Cable management & accessories,Home electronics/Speakers/Wi-Fi speakers,"Storage & organization/Shelving units, bookcases & storage options/Shelf units & cube storage",Furniture/Chairs/Bar stools & chairs,Storage & organization/Storage solution systems/IVAR system/All parts,Home Décor/Mirrors/Mirror cabinets,Home Décor/Mirrors/Mirror cabinets,Storage & organization/Display & storage cabinets/Dining room cabinets & cupboards,Furniture/Kids furniture/Toy storage,Furniture/Kids furniture/Toy storage,Furniture/Kids furniture/Toy storage,Storage & organization/Storage solution systems/SMÅSTAD system/SMÅSTAD doors & drawers,Storage & organization/Storage solution systems/SMÅSTAD system/SMÅSTAD doors & drawers,Storage & organization/Storage solution systems/SMÅSTAD system/SMÅSTAD doors & drawers,Furniture/Kids furniture/Toy storage,Kitchen & appliances/Kitchen systems/SEKTION kitchen/SEKTION kitchen cabinets,Storage & organization/Armoires & wardrobes/Solitaire wardrobes,Storage & organization/TV & media furniture/TV stands & benches,Storage & organization/Display & storage cabinets/Dining room cabinets & cupboards,"Storage & organization/Shelving units, bookcases & storage options/Shelf units & cube storage",Storage & organization/Storage containers/Food storage & organizing/Food containers,Storage & organization/Storage solution systems/IVAR system/All parts,Storage & organization/Storage solution systems/IVAR system/All parts,Storage & organization/Display & storage cabinets/Dining room cabinets & cupboards,Storage & organization/Storage solution systems/IVAR system/All parts,Storage & organization/Storage solution systems/IVAR system/All parts,Storage & organization/Storage solution systems/IVAR system/All parts,Storage & organization/Display & storage cabinets/Dining room cabinets & cupboards,Storage & organization/Storage solution systems/IVAR system/All parts,Storage & organization/Storage solution systems/IVAR system/All parts,Storage & organization/Storage solution systems/IVAR system/All parts,Storage & organization/Storage solution systems/IVAR system/All parts,Storage & organization/Storage solution systems/IVAR system/All parts,Storage & organization/Storage solution systems/IVAR system/All parts,Storage & organization/Storage solution systems/IVAR system/All parts,Storage & organization/Storage solution systems/IVAR system/All parts,Storage & organization/Storage solution systems/IVAR system/All parts,Storage & organization/Storage solution systems/IVAR system/All parts,Storage & organization/Storage solution systems/IVAR system/All parts,Storage & organization/Storage solution systems/IVAR system/All parts,Storage & organization/Storage solution systems/IVAR system/All parts,Bathroom/Bathroom storage/Bathroom storage/Bathroom tall cabinets,Storage & organization/Storage solution systems/IVAR system/All parts,Storage & organization/Storage solution systems/IVAR system/All parts,Storage & organization/Storage solution systems/BESTÅ storage system/BESTÅ all parts & accessories,Kitchen & appliances/Kitchen systems/SUNNERSTA modular kitchen/Accessories for SUNNERSTA,Kitchen & appliances/Kitchen wall organization & storage/Wall organizers,Kitchen & appliances/Kitchen wall organization & storage/Wall organizers,Kitchen & appliances/Kitchen systems/SUNNERSTA modular kitchen/Accessories for SUNNERSTA,Kitchen & appliances/Kitchen systems/SUNNERSTA modular kitchen/Accessories for SUNNERSTA,Kitchen & appliances/Kitchen systems/SUNNERSTA modular kitchen/Accessories for SUNNERSTA,Kitchen & appliances/Kitchen systems/SUNNERSTA modular kitchen/Accessories for SUNNERSTA,Kitchen & appliances/Kitchen islands & carts,Kitchen & appliances/Kitchen islands & carts,Kitchen & appliances/Kitchen islands & carts,Kitchen & appliances/Kitchen islands & carts,Home electronics/Speakers/Wi-Fi speakers,Storage & organization/Storage containers/Paper & media organizers/Desk accessories,Storage & organization/Display & storage cabinets/Display cabinets,Storage & organization/Display & storage cabinets/Display cabinets,Cookware & tableware/Serveware/Trays,Cookware & tableware/Serveware/Trays,Cookware & tableware/Serveware/Trays,"Storage & organization/Shelving units, bookcases & storage options/Shelf units & cube storage",Furniture/Tables & desks/Bar tables,Home Décor/Storage boxes & baskets/Secondary storage boxes,Storage & organization/Storage containers/Food storage & organizing/Food containers,Kitchen & appliances/Kitchen drawer organization/Drawer dividers,Furniture/Tables & desks/Desks & computer desks/Desks for home,Furniture/Tables & desks/Desks & computer desks/Desks for home,Furniture/Tables & desks/Desks & computer desks/Desks for home,"Storage & organization/Shelving units, bookcases & storage options/Storage shelves & units",Storage & organization/Storage containers/Paper & media organizers/Magazine files,Storage & organization/Storage containers/Food storage & organizing/Food containers,Storage & organization/Storage solution systems/BESTÅ storage system/BESTÅ all parts & accessories/BESTÅ fittings & inside organizers,Kitchen & appliances/Kitchen drawer organization/Shelves & drawers,Furniture/Patio furniture/Outdoor tables/Outdoor dining tables,"Storage & organization/Display & storage cabinets/Buffet tables, sideboard buffets & buffet cabinets",Kitchen & appliances/Appliances/Microwaves/Microwave ovens,Storage & organization/Wall shelves & hooks/Hooks,"Storage & organization/Shelving units, bookcases & storage options/Shelf units & cube storage",Storage & organization/Display & storage cabinets/Dining room cabinets & cupboards,Kitchen & appliances/Kitchen drawer organization/Shelves & drawers,Furniture/Tables & desks/Accent tables/End tables & side tables,Storage & organization/Storage solution systems/IVAR system/All parts,Storage & organization/Storage containers/Paper & media organizers/Desk accessories
