Beds & mattresses/Bedding/Bedlinen/Duvet cover sets,Beds & mattresses/Bedding/Bedlinen/Duvet cover sets,Furniture/Sofas & sectionals/Sofa & armchairs covers/FLOTTEBO covers,Beds & mattresses/Bedding/Comforters/Down & feather comforters,Furniture/Sofas & sectionals/Sofa & armchairs covers/UPPLAND covers,Furniture/Sofas & sectionals/Sofa & armchairs covers/UPPLAND covers,Rugs/Bath mats,Beds & mattresses/Bedding/Blankets & throws,Rugs/Bath mats,Furniture/Sofas & sectionals/Sofa & armchairs covers/VRETSTORP covers,Beds & mattresses/Bedding/Blankets & throws,Beds & mattresses/Bedding/Blankets & throws,Beds & mattresses/Bedding/Bedspreads,Home Textiles/Fabrics & sewing/Fabrics,Beds & mattresses/Bedding/Bedlinen/Duvet cover sets,Beds & mattresses/Bedding/Bedspreads,Furniture/Sofas & sectionals/Sofa & armchairs covers/FÄRLÖV covers,Baby & kids/Kids/Kids textiles/Kids rugs,Baby & kids/Baby/Baby textiles/Baby towels & washcloths,Furniture/Sofas & sectionals/Sofa & armchairs covers/BRÅTHULT covers,Furniture/Sofas & sectionals/Sofa & armchairs covers/BRÅTHULT covers,Furniture/Chairs/High chairs,Beds & mattresses/Bedding/Cushions & cushions covers/Children's cushions & blankets,Beds & mattresses/Bedding/Cushions & cushions covers/Children's cushions & blankets,Beds & mattresses/Bedding/Comforters/Down & feather comforters,Beds & mattresses/Bedding/Blankets & throws,Beds & mattresses/Bedding/Comforters/Down & feather comforters,Beds & mattresses/Bedding/Cushions & cushions covers/Cushion covers,Beds & mattresses/Bedding/Cushions & cushions covers/Children's cushions & blankets,Beds & mattresses/Bedding/Bedlinen/Kids bed linen,Beds & mattresses/Bedding/Cushions & cushions covers/Cushion covers,Beds & mattresses/Bedding/Comforters/Down & feather comforters,Furniture/Sofas & sectionals/Sofa & armchairs covers/UPPLAND covers,Furniture/Sofas & sectionals/Sofa & armchairs covers/UPPLAND covers,Beds & mattresses/Bedding/Pillows/Down & feather pillows,Beds & mattresses/Bedding/Blankets & throws,Beds & mattresses/Bedding/Blankets & throws,Beds & mattresses/Bedding/Cushions & cushions covers/Cushion covers,Baby & kids/Baby/Baby textiles/Baby quilts & pillows,Pet accessories/Cats,Furniture/Sofas & sectionals/Sofa & armchairs covers/KLIPPAN covers,Pet accessories/Cats,"Outdoor/Outdoor cushions/Outdoor pillows/FUNKÖN Back cushion, indoor","Outdoor/Outdoor cushions/Outdoor pillows/FUNKÖN Cushion cover, in",Pet accessories/Cats,Beds & mattresses/Bedding/Comforters/Down & feather comforters,Baby & kids/Baby/Baby textiles/Baby blankets & quilts,Beds & mattresses/Bedding/Bedlinen/Duvet cover sets,Beds & mattresses/Bedding/Bedspreads,Beds & mattresses/Bedding/Blankets & throws/FÄLTMAL Pillow,Beds & mattresses/Bedding/Blankets & throws,Beds & mattresses/Bedding/Pillows/Down & feather pillows,Bathroom/Bathroom textiles/Shower curtains,Beds & mattresses/Bedding/Pillows/Polyester pillows,Beds & mattresses/Bedding/Bedlinen/Pillowcases,Beds & mattresses/Bedding/Cushions & cushions covers/Cushion covers,Beds & mattresses/Bedding/Pillows/Down & feather pillows,Beds & mattresses/Bedding/Comforters/Down & feather comforters,Beds & mattresses/Bedding/Blankets & throws,Beds & mattresses/Bedding/Comforters/Polyester comforters,Beds & mattresses/Bedding/Comforters/Polyester comforters,Beds & mattresses/Bedding/Pillows/Down & feather pillows,Beds & mattresses/Bedding/Cushions & cushions covers/Cushion covers,Outdoor/Umbrellas & gazebos/Patio umbrellas & bases,Beds & mattresses/Bedding/Cushions & cushions covers/Cushion covers,Outdoor/Umbrellas & gazebos/Patio umbrellas & bases,Beds & mattresses/Bedding/Pillows/Polyester pillows,Bathroom/Bathroom textiles/Towels/Bath towels,Beds & mattresses/Bedding/Cushions & cushions covers/Cushion covers,Beds & mattresses/Bedding/Comforters/Polyester comforters,Beds & mattresses/Bedding/Blankets & throws,Beds & mattresses/Bedding/Cushions & cushions covers/Cushion covers,Bathroom/Bathroom textiles/Towels/Hand towels,Beds & mattresses/Bedding/Blankets & throws,Rugs/Rugs/Large & medium rugs,Beds & mattresses/Bedding/Cushions & cushions covers/Cushion covers,Rugs/Rugs/Runners & small rugs,Furniture/Patio furniture/Outdoor seat cushions,Beds & mattresses/Bedding/Cushions & cushions covers/Cushion covers,Bathroom/Bathroom textiles/Towels/Bath towels,Bathroom/Bathroom textiles/Towels/Hand towels,Beds & mattresses/Bedding/Cushions & cushions covers/Cushion covers,Beds & mattresses/Bedding/Blankets & throws,Beds & mattresses/Bedding/Cushions & cushions covers/Cushions,Bathroom/Bathroom textiles/Towels/Bath towels,Beds & mattresses/Bedding/Bedlinen/Duvet cover sets,Bathroom/Bathroom textiles/Towels/Hand towels,Beds & mattresses/Bedding/Blankets & throws,Bathroom/Bathroom textiles/Towels/Bath towels,"Baby & kids/Baby/Changing, bathing & potty/Changing accessories",Bathroom/Bathroom textiles/Towels/Bath towels,Outdoor/Umbrellas & gazebos/Patio umbrellas & bases,Outdoor/Umbrellas & gazebos/Patio umbrellas & bases,"Furniture/Patio furniture/Outdoor seat cushions/SÖTHOLMEN Cushion cover, in",Beds & mattresses/Bedding/Cushions & cushions covers/Cushion covers,Rugs/Rugs/Runners & small rugs,Bathroom/Bathroom textiles/Towels/Hand towels,Furniture/Chairs/High chairs,Bathroom/Bathroom textiles/Towels/Wash cloths,Bathroom/Bathroom textiles/Towels/Bath towels
Furniture/Tables & desks/Accent tables/End tables & side tables,Cookware & tableware/Table linen/Place mats & coasters,Storage & organization/Storage solution systems/AURDAL system/AURDAL parts,Storage & organization/Storage containers/Bathroom accessories/Towel rails & towel holders,Baby & kids/Kids/Kids decoration & accessories,Storage & organization/Storage containers/Bathroom accessories/Bathroom shelves,Storage & organization/Storage solution systems/AURDAL system/AURDAL parts,Storage & organization/Storage solution systems/AURDAL system/AURDAL parts,Storage & organization/Storage solution systems/AURDAL system/AURDAL parts,Storage & organization/Storage containers/Bathroom accessories/Shower accessories,Home Décor/Storage boxes & baskets/Baskets,Storage & organization/Storage solution systems/AURDAL system/AURDAL parts,Storage & organization/Storage solution systems/AURDAL system/AURDAL parts,Storage & organization/Clothes organizers/Shoe racks & stands,Cookware & tableware/Kitchen & cooking accessories/Kitchen utensils/Colanders & strainers,"Storage & organization/Shelving units, bookcases & storage options/Shelf units & cube storage",Storage & organization/Storage solution systems/AURDAL system/AURDAL parts,Cookware & tableware/Table linen/Place mats & coasters,Storage & organization/Storage solution systems/AURDAL system/AURDAL parts,Storage & organization/Storage containers/Bathroom accessories/Toilet roll holders & stands,Storage & organization/Storage solution systems/AURDAL system/AURDAL parts,Kitchen & appliances/Appliances/Range hoods & filters/Under cabinet and built-in range hoods,Storage & organization/Storage solution systems/PAX system/PAX doors without hinges,Furniture/Patio furniture/Outdoor tables/Outdoor dining tables,Home Décor/Storage boxes & baskets/Paper & media boxes,Storage & organization/Storage containers/Bathroom accessories/Shower accessories,Storage & organization/Storage containers/Bathroom accessories/Shower accessories,"Storage & organization/Shelving units, bookcases & storage options/Shelf units & cube storage",Storage & organization/Storage solution systems/BESTÅ storage system/BESTÅ all parts & accessories,Cookware & tableware/Table linen/Place mats & coasters,Storage & organization/Storage containers/Bathroom accessories/Shower accessories,Storage & organization/Storage containers/Bathroom accessories/Bathroom shelves,Kitchen & appliances/Kitchen systems/SEKTION kitchen/SEKTION kitchen cabinets,Home electronics/Cords & chargers/Wireless charging & accessories,Storage & organization/Storage solution systems/AURDAL system/AURDAL parts,Storage & organization/Storage containers/Bathroom accessories/Bathroom shelves,Storage & organization/Storage solution systems/AURDAL system/AURDAL parts,Storage & organization/Storage solution systems/AURDAL system/AURDAL parts,Storage & organization/Storage containers/Bathroom accessories/Towel rails & towel holders,Kitchen & appliances/Kitchen systems/SEKTION kitchen/SEKTION kitchen cabinets,Furniture/Kids furniture/Toy storage,Kitchen & appliances/Kitchen faucets & sinks/Sink parts,Home Décor/Storage boxes & baskets/Baskets,Cookware & tableware/Table linen/Place mats & coasters,Home electronics/Speakers/Wi-Fi speakers,Cookware & tableware/Table linen/Place mats & coasters,Storage & organization/Storage containers/Bathroom accessories/Bathroom boxes & baskets,Home electronics/Speakers/Wi-Fi speakers,Home electronics/Speakers/Wi-Fi speakers,Furniture/Kids furniture/Toy storage,Home electronics/Cords & chargers/USB chargers,Home Décor/Wall décor/Art posters,Storage & organization/Storage containers/Bathroom accessories/Bathroom boxes & baskets,Furniture/Kids furniture/Toy storage,Furniture/Kids furniture/Toy storage,Furniture/Kids furniture/Toy storage,Storage & organization/Storage solution systems/PAX system/PAX doors without hinges,Cookware & tableware/Kitchen & cooking accessories/Kitchen utensils/Colanders & strainers,Furniture/Kids furniture/Toy storage,Cookware & tableware/Table linen/Place mats & coasters,Home electronics/Speakers/Wi-Fi speakers,Home Textiles/Window treatments/Curtain rods & rails/Curtain rods,Storage & organization/Dressers & storage drawers/Children's dressers and chests,Storage & organization/Storage solution systems/BESTÅ storage system/BESTÅ all parts & accessories,Cookware & tableware/Table linen/Place mats & coasters,Cookware & tableware/Table linen/Place mats & coasters,Storage & organization/Storage containers/Bins & bags/Trash cans & pedal bins,Cookware & tableware/Table linen/Place mats & coasters,Kitchen & appliances/Kitchen drawer organization/Drawer dividers,Storage & organization/Storage containers/Bins & bags/Trash cans & pedal bins,Home Décor/Flower pots & stands/Indoor plant pots,Cookware & tableware/Kitchen & cooking accessories/Kitchen utensils/Cooking preparation tools,Storage & organization/Storage solution systems/SMÅSTAD system/SMÅSTAD interior fittings,Cookware & tableware/Table linen/Place mats & coasters,Storage & organization/Storage solution systems/PAX system/PAX sliding doors,Storage & organization/Storage solution systems/PAX system/PAX sliding doors,Storage & organization/Storage solution systems/PAX system/PAX sliding doors,Cookware & tableware/Table linen/Place mats & coasters,Cookware & tableware/Table linen/Place mats & coasters,Home Décor/Mirrors/Wall mirrors,Home Décor/Mirrors/Wall mirrors,Cookware & tableware/Table linen/Place mats & coasters,Kitchen & appliances/Kitchen drawer organization/Shelves & drawers,Furniture/Tables & desks/Accent tables/Coffee tables,Storage & organization/TV & media furniture/TV stands & benches,"Storage & organization/Shelving units, bookcases & storage options/Shelf units & cube storage","Storage & organization/Shelving units, bookcases & storage options/Shelf units & cube storage",Home Décor/Noticeboards,Furniture/Tables & desks/Accent tables/End tables & side tables,Home Textiles/Window treatments/Curtain rods & rails/Curtain rods,Furniture/Tables & desks/Accent tables/End tables & side tables,Cookware & tableware/Dinnerware/Plates,Cookware & tableware/Coffee & tea/Mugs & cups,Storage & organization/Storage containers/Bins & bags/Trash cans & pedal bins,Cookware & tableware/Serveware/Bowls,Cookware & tableware/Serveware/Serving dishes,Storage & organization/Storage solution systems/BESTÅ storage system/BESTÅ all parts & accessories,Cookware & tableware/Dinnerware/Side plates,Cookware & tableware/Table linen/Table cloths & runners,Baby & kids/Kids/Kids storage & organization/Children's hooks & wall organization
Storage & organization/Storage solution systems/PAX system/PAX doors without hinges,Home Décor/Candle holders & candles/Lanterns,"Home improvement/Oils, stains & product care",Kitchen & appliances/Kitchen systems/SEKTION kitchen/SEKTION kitchen cabinets,Kitchen & appliances/Kitchen systems/SEKTION kitchen/SEKTION kitchen cabinets,Storage & organization/Storage containers/Bins & bags/Trash cans & pedal bins,Furniture/Tables & desks/Accent tables/Coffee tables,Home Décor/Storage boxes & baskets/Secondary storage boxes,Furniture/Tables & desks/Accent tables/Coffee tables,Home Décor/Clocks/Alarm clocks,"Storage & organization/Clothes organizers/Clothes racks & stands/TURBO Clothes rack, indoor",Home Textiles/Window treatments/Curtain rods & rails/Track systems,Home Textiles/Window treatments/Curtains & drapes/Light filtering curtains,Storage & organization/Dressers & storage drawers/Chests of drawers,Storage & organization/Dressers & storage drawers/Chests of drawers,Storage & organization/Storage solution systems/PAX system/PAX sliding doors,Home Textiles/Window treatments/Curtain rods & rails/Track systems,Home Textiles/Window treatments/Curtain rods & rails/Track systems,"Home improvement/Oils, stains & product care","Home improvement/Oils, stains & product care",Home Décor/Storage boxes & baskets/Kids boxes & baskets,"Home improvement/Oils, stains & product care","Home Textiles/Window treatments/Shades, blinds & window treatments/Pleated & cellular blinds and shades",Cookware & tableware/Napkins & napkin holders/Napkin holders,Furniture/Tables & desks/Dining tables/Dining table tops & underframes,"Home Textiles/Window treatments/Shades, blinds & window treatments/Roman shades",Outdoor/Umbrellas & gazebos/Patio umbrellas & bases,Kitchen & appliances/Kitchen systems/SEKTION kitchen/SEKTION kitchen cabinets,Home Textiles/Window treatments/Curtains & drapes/Light filtering curtains,Furniture/Patio furniture/Outdoor chaises & hammocks,Home Textiles/Window treatments/Curtain rods & rails/Track systems,Storage & organization/Bags/Backpacks & messenger bags,Baby & kids/Baby/Baby toys/Newborn,Storage & organization/Storage solution systems/PAX system/PAX doors without hinges,Storage & organization/Storage solution systems/PAX system/PAX doors without hinges,Storage & organization/Storage solution systems/PAX system/PAX doors without hinges,Cookware & tableware/Flatware/Flatware,Baby & kids/Kids/Toys & play/Physical play,Home Textiles/Window treatments/Curtain rods & rails/Curtain rods,Home Textiles/Window treatments/Curtain rods & rails/Curtain rods,Storage & organization/Bags/Travel bags,Home Textiles/Window treatments/Curtains & drapes/Light filtering curtains,Furniture/Tables & desks/Nightstands,Home Textiles/Window treatments/Curtain rods & rails/Track systems,Home Textiles/Window treatments/Curtains & drapes/Panel curtains,Home Décor/Flower pots & stands/Indoor plant pots,Baby & kids/Kids/Toys & play/Arts & crafts,Storage & organization/Storage containers/Paper & media organizers/Desk accessories,Home electronics/Speakers/Wi-Fi speakers,Home Textiles/Window treatments/Curtains & drapes/Panel curtains,Home Décor/Wall décor/Picture & photo frames,Storage & organization/Wall shelves & hooks/Hooks,Storage & organization/Wall shelves & hooks/Hooks,"Storage & organization/Wall shelves & hooks/Hooks/BRANDUR Hook, in-","Storage & organization/Wall shelves & hooks/Hooks/BRANDUR Hook, in-","Storage & organization/Wall shelves & hooks/Hooks/BRANDUR Rail with 4 hooks, in-","Home Textiles/Window treatments/Shades, blinds & window treatments/Black-out shades & blinds",Home Textiles/Window treatments/Curtains & drapes/Light filtering curtains,Baby & kids/Kids/Toys & play/Role play,Home Textiles/Window treatments/Curtains & drapes/Panel curtains,Home Textiles/Window treatments/Curtains & drapes/Light filtering curtains,Home Décor/Mirrors/Vanity mirrors,Kitchen & appliances/Kitchen systems/SEKTION kitchen/SEKTION kitchen cabinets,Home Textiles/Window treatments/Curtains & drapes/Light filtering curtains,Cookware & tableware/Dinnerware/Plates,Cookware & tableware/Dinnerware/Side plates,Home Textiles/Window treatments/Curtains & drapes/Room darkening curtains & drapes,Home Textiles/Window treatments/Curtains & drapes/Panel curtains,Cookware & tableware/Dinnerware/Dinnerware sets,Storage & organization/Clothes organizers/Clothes racks & stands,Cookware & tableware/Dinnerware/Bowls,Cookware & tableware/Dinnerware/Deep plates/FLITIGHET Deep plate,Furniture/Tables & desks/Changing tables/SMÅGÖRA Changing table,"Laundry & cleaning/Drying racks/MULIG Drying rack, indoor",Storage & organization/Clothes organizers/Clothes racks & stands,Home Textiles/Window treatments/Curtains & drapes/Light filtering curtains,Home Textiles/Window treatments/Curtain rods & rails/Track systems,Home Textiles/Window treatments/Curtains & drapes/Light filtering curtains,Storage & organization/Armoires & wardrobes/Children's wardrobes,Cookware & tableware/Serveware/Trays,Home Textiles/Window treatments/Curtains & drapes/Light filtering curtains,Storage & organization/Wall shelves/Complete wall shelves/HEMNES Wall,Home Décor/Clocks/Alarm clocks,Home Décor/Clocks/Alarm clocks,Storage & organization/TV & media furniture/TV stands & benches,Storage & organization/Dressers & storage drawers/Chests of drawers,Lighting/Lamps & light fixtures/Table lamps,Furniture/Beds/Kids beds/Junior & extendable beds,Cookware & tableware/Dinnerware/Side plates,Cookware & tableware/Dinnerware/Plates,Cookware & tableware/Flatware/Flatware,Cookware & tableware/Dinnerware/Bowls,Home Décor/Clocks/Alarm clocks,Cookware & tableware/Coffee & tea/Mugs & cups,Rugs/Rugs/Door mats,Home Textiles/Window treatments/Curtain rods & rails/Track systems,Storage & organization/Storage solution systems/PAX system/PAX doors without hinges,Kitchen & appliances/Kitchen countertops/Laminate countertops,Storage & organization/Storage solution systems/PAX system/PAX doors without hinges,Kitchen & appliances/Kitchen countertops/Laminate countertops
Furniture/Tables & desks/Desks & computer desks/Desks for home,Storage & organization/Display & storage cabinets/Display cabinets,"Storage & organization/Shelving units, bookcases & storage options/Shelf units & cube storage",Bathroom/Bathroom vanities/Bathroom vanity legs,Storage & organization/Dressers & storage drawers/Chests of drawers,Storage & organization/Dressers & storage drawers/Chests of drawers,Home Décor/Storage boxes & baskets/Kids boxes & baskets,Storage & organization/Dressers & storage drawers/Chests of drawers,Storage & organization/Dressers & storage drawers/Chests of drawers,Storage & organization/Dressers & storage drawers/Chests of drawers,Storage & organization/Dressers & storage drawers/Chests of drawers,Storage & organization/Dressers & storage drawers/Chests of drawers,Storage & organization/Dressers & storage drawers/Chests of drawers,"Storage & organization/Shelving units, bookcases & storage options/Shelf units & cube storage",Storage & organization/Dressers & storage drawers/Chests of drawers,Storage & organization/Dressers & storage drawers/Chests of drawers,Storage & organization/Dressers & storage drawers/Chests of drawers,Storage & organization/Dressers & storage drawers/Chests of drawers,Kitchen & appliances/Kitchen wall organization & storage/Wall organizers,Kitchen & appliances/Kitchen wall organization & storage/Wall organizers,Furniture/Tables & desks/Bar tables,Storage & organization/Storage containers/Food storage & organizing/Wine racks,Kitchen & appliances/Kitchen wall organization & storage/Wall organizers,Kitchen & appliances/Kitchen wall organization & storage/Wall organizers,Kitchen & appliances/Kitchen wall organization & storage/Wall organizers,Kitchen & appliances/Kitchen wall organization & storage/Wall organizers,Kitchen & appliances/Kitchen wall organization & storage/Wall organizers,Kitchen & appliances/Kitchen wall organization & storage/Wall organizers,Kitchen & appliances/Kitchen wall organization & storage/Wall organizers,Kitchen & appliances/Kitchen wall organization & storage/Wall organizers,Bathroom/Bathroom storage/Bathroom storage/Bathroom wall cabinets,Kitchen & appliances/Kitchen wall organization & storage/Wall organizers,Storage & organization/Wall shelves & hooks/Hooks,"Storage & organization/Storage solution systems/ELVARLI system/Post, side units & interiors",Storage & organization/TV & media furniture/TV stands & benches,"Storage & organization/Shelving units, bookcases & storage options/Storage shelves & units",Storage & organization/Storage solution systems/BOAXEL system/BOAXEL parts,Storage & organization/Storage solution systems/SMÅSTAD system/SMÅSTAD doors & drawers,Storage & organization/Storage solution systems/BOAXEL system/BOAXEL parts,Furniture/Tables & desks/Desks & computer desks/Desks for home,Storage & organization/Storage solution systems/BOAXEL system/BOAXEL parts,Storage & organization/Storage solution systems/BOAXEL system/BOAXEL parts,Storage & organization/Storage solution systems/IVAR system/All parts,Storage & organization/TV & media furniture/TV stands & benches,Kitchen & appliances/Kitchen systems/SEKTION kitchen/SEKTION kitchen cabinets,Kitchen & appliances/Kitchen drawer organization/Shelves & drawers,Kitchen & appliances/Kitchen drawer organization/Shelves & drawers,Furniture/Tables & desks/Desks & computer desks/Desks for home,Furniture/Tables & desks/Desks & computer desks/Desks for home,Storage & organization/TV & media furniture/TV stands & benches,Storage & organization/Wall shelves/Shelves,Storage & organization/Wall shelves/Shelves,Storage & organization/TV & media furniture/TV stands & benches,Storage & organization/Display & storage cabinets/Display cabinets,Storage & organization/Display & storage cabinets/Display cabinets,Storage & organization/Storage solution systems/SMÅSTAD system/SMÅSTAD doors & drawers,Storage & organization/Storage solution systems/SMÅSTAD system/SMÅSTAD doors & drawers,Storage & organization/Armoires & wardrobes/Solitaire wardrobes,Bathroom/Bathroom vanities/Vanity cabinets with sink,Bathroom/Bathroom vanities/Vanity cabinets with sink,"Storage & organization/Storage solution systems/ELVARLI system/Post, side units & interiors","Storage & organization/Storage solution systems/ELVARLI system/Post, side units & interiors","Storage & organization/Storage solution systems/ELVARLI system/Post, side units & interiors","Storage & organization/Display & storage cabinets/Buffet tables, sideboard buffets & buffet cabinets","Storage & organization/Shelving units, bookcases & storage options/Storage shelves & units/KOLBJÖRN Cabinet, indoor",Storage & organization/Display & storage cabinets/Filing cabinets & storage cabinets/Office storage cabinets & units,Storage & organization/Display & storage cabinets/Dining room cabinets & cupboards,Storage & organization/Storage solution systems/PAX system/PAX Interior organizers,Furniture/Kids furniture/Toy storage,Storage & organization/Storage solution systems/PAX system/PAX Interior organizers,"Storage & organization/Display & storage cabinets/Buffet tables, sideboard buffets & buffet cabinets",Storage & organization/Storage containers/Paper & media organizers/Magazine files,"Storage & organization/Shelving units, bookcases & storage options/Kitchen pantry storage/KOLBJÖRN Shelf unit, indoor",Storage & organization/Display & storage cabinets/Dining room cabinets & cupboards,Storage & organization/Wall shelves/Shelves,Home Décor/Mirrors/Mirror cabinets,Furniture/Kids furniture/Toy storage,"Storage & organization/Shelving units, bookcases & storage options/Shelf units & cube storage",Laundry & cleaning/Ironing boards,Storage & organization/Clothes organizers/Clothes racks & stands,"Storage & organization/Shelving units, bookcases & storage options/Shelf units & cube storage",Furniture/Kids furniture/Toy storage,Furniture/Kids furniture/Toy storage,Cookware & tableware/Dishwashing accessories/Dish drainers & drying racks,"Storage & organization/Shelving units, bookcases & storage options/Shelf units & cube storage","Storage & organization/Shelving units, bookcases & storage options/Storage shelves & units/KOLBJÖRN Shelf unit, indoor",Home Décor/Mirrors/Mirror cabinets,Home Décor/Mirrors/Wall mirrors,Home Décor/Mirrors/Wall mirrors,Home Décor/Mirrors/Wall mirrors,Storage & organization/Display & storage cabinets/Dining room cabinets & cupboards,Storage & organization/Armoires & wardrobes/Solitaire wardrobes,Furniture/Tables & desks/Table & desk systems/Table bar system,Furniture/Tables & desks/Desks & computer desks/Desks for home,Storage & organization/Wall shelves/Brackets,Home electronics/Speakers/Wi-Fi speakers,Furniture/Tables & desks/Console tables & sofa tables,Furniture/Tables & desks/Table & desk systems/Table bar system,Storage & organization/TV & media furniture/TV & media storage,Furniture/Tables & desks/Desks & computer desks/Desks for home
