Storage & organization/Storage containers/Clothes organizers/Hanging clothes organizers,Storage & organization/Storage containers/Hooks & hangers/Hangers,Storage & organization/Dressers & storage drawers/Drawer units/Drawer units for home,Storage & organization/Dressers & storage drawers/Drawer units/Drawer units for home,Storage & organization/Armoires & wardrobes/Solitaire wardrobes,Storage & organization/Armoires & wardrobes/Solitaire wardrobes,Storage & organization/Storage containers/Clothes organizers/Hanging clothes organizers,Furniture/Chairs/Dining chairs/Dining chairs,Furniture/Beds/Bed legs,Storage & organization/Storage solution systems/PAX system/PAX Interior organizers,Furniture/Chairs/Dining chairs/Dining chairs,Furniture/Kids furniture/Kids chairs,Furniture/Armchairs & chaises/Fabric armchairs,Furniture/Sofas & sectionals/Ottomans/Fabric ottomans,Furniture/Sofas & sectionals/Sectionals/Sofa modules,"Baby & kids/Baby/Changing, bathing & potty/Potties & baby baths",Furniture/Beds/Cribs,Furniture/Sofas & sectionals/Sofa legs,Furniture/Sofas & sectionals/Sofa legs,Furniture/Chairs/Bar stools & chairs,Furniture/Chairs/Dining chairs/Dining chairs,Furniture/Patio furniture/Outdoor sofa sections,Storage & organization/Storage containers/Hooks & hangers/Hangers,Rugs/Rugs/Large & medium rugs,Rugs/Rugs/Door mats,Rugs/Rugs/Runners & small rugs,Laundry & cleaning/Laundry baskets,Furniture/Tables & desks/Nightstands,Home Décor/Storage boxes & baskets/Baskets,Home Décor/Storage boxes & baskets/Baskets,Storage & organization/Storage containers/Food storage & organizing/Food containers,Furniture/Tables & desks/Changing tables,Storage & organization/Storage containers/Paper & media organizers/Desk accessories,Cookware & tableware/Serveware/Trays,Storage & organization/Armoires & wardrobes/Solitaire wardrobes,Furniture/Chairs/Dining chairs/Dining chairs,Furniture/Tables & desks/Accent tables/Coffee tables,Furniture/Tables & desks/Accent tables/Coffee tables,Bathroom/Bathroom stools & benches,Home Décor/Storage boxes & baskets/Paper & media boxes,Home Décor/Storage boxes & baskets/Baskets,Furniture/Armchairs & chaises/Coated fabric armchairs,Furniture/Beds/Twin beds,Storage & organization/Wall shelves & hooks/Hooks,Storage & organization/Bags/Backpacks & messenger bags,Furniture/Chairs/Dining chairs/Dining chairs,Cookware & tableware/Dishwashing accessories/Sink accessories,Furniture/Armchairs & chaises/Fabric armchairs,Furniture/Chairs/Desk chairs/Desk chairs for home,Furniture/Beds/Cribs,Cookware & tableware/Dishwashing accessories/Dish drainers & drying racks,Furniture/Patio furniture/Outdoor chairs/Outdoor dining chairs,Rugs/Rugs/Runners & small rugs,Storage & organization/Storage containers/Bins & bags/Trash cans & pedal bins,Beds & mattresses/Mattresses/Spring mattresses,Furniture/Tables & desks/Accent tables/End tables & side tables,Storage & organization/Clothes organizers/Shoe racks & stands,Storage & organization/Clothes organizers/Coat stands,Furniture/Chairs/Desk chairs/Desk chairs for home,Storage & organization/Storage containers/Paper & media organizers/Desk accessories,Furniture/Kids furniture/Kids chairs,Furniture/Beds/Kids beds/Junior & extendable beds,Furniture/Beds/Kids beds/Bunk beds,Furniture/Chairs/Desk chairs/Desk chairs for home,Furniture/Tables & desks/Nightstands,Beds & mattresses/Mattress bases,Furniture/Patio furniture/Outdoor chairs/Outdoor dining chairs,Furniture/Chairs/Desk chairs/Kids desk chairs,Storage & organization/Bags/Travel accessories,Home Décor/Storage boxes & baskets/Clothes boxes,Storage & organization/Storage containers/Hooks & hangers/Hangers,Storage & organization/Storage solution systems/PAX system/PAX Interior organizers,Storage & organization/Storage solution systems/PAX system/PAX Interior organizers,Outdoor/Outdoor flooring,Furniture/Beds/Kids beds/Junior & extendable beds,Furniture/Chairs/Dining chairs/Upholstered chairs,Storage & organization/Armoires & wardrobes/Solitaire wardrobes,Storage & organization/Armoires & wardrobes/Solitaire wardrobes,Storage & organization/Armoires & wardrobes/Solitaire wardrobes,Furniture/Tables & desks/Changing tables,Furniture/Tables & desks/Changing tables,Furniture/Armchairs & chaises/Lounge chairs,Furniture/Patio furniture/Outdoor chairs/Outdoor dining chairs,Furniture/Beds/Cribs,Furniture/Chairs/Dining chairs/Upholstered chairs,Furniture/Patio furniture/Outdoor chaises & hammocks,"Storage & organization/Shelving units, bookcases & storage options/Storage shelves & units",Storage & organization/Bags/Shopping bags & tote bags,Storage & organization/Bags/Shopping bags & tote bags,Home Décor/Storage boxes & baskets/Clothes boxes,Storage & organization/Storage containers/Hooks & hangers/Hangers,Storage & organization/Storage solution systems/PAX system/PAX doors without hinges,Storage & organization/Storage solution systems/PAX system/PAX doors without hinges,Home Textiles/Window treatments/Curtains & drapes/Room darkening curtains & drapes,Home Textiles/Window treatments/Curtains & drapes/Room darkening curtains & drapes,Furniture/Kids furniture/Kids chairs,Storage & organization/Storage containers/Bathroom accessories/Towel rails & towel holders,Kitchen & appliances/Kitchen drawer organization/Cleaning organizers,Storage & organization/Storage containers/Bins & bags/Bags,Furniture/Beds/Guest beds & daybeds/Daybeds
Storage & organization/Storage solution systems/SMÅSTAD system/SMÅSTAD doors & drawers,Storage & organization/Storage solution systems/SMÅSTAD system/SMÅSTAD doors & drawers,Storage & organization/Wall shelves/Brackets,Storage & organization/Wall shelves/Brackets,Storage & organization/Wall shelves/Brackets,Storage & organization/Display & storage cabinets/Dining room cabinets & cupboards,Storage & organization/Display & storage cabinets/Dining room cabinets & cupboards,"Storage & organization/Shelving units, bookcases & storage options/Bookcases","Storage & organization/Storage solution systems/ELVARLI system/Post, side units & interiors",Storage & organization/Storage containers/Paper & media organizers/Desk accessories,"Storage & organization/Storage solution systems/ELVARLI system/Post, side units & interiors",Bathroom/Bathroom storage/Bathroom shelving units,Storage & organization/Storage containers/Bins & bags/Trash cans & pedal bins,Storage & organization/Storage containers/Bins & bags/Trash cans & pedal bins,Cookware & tableware/Knives & cutting boards/Cutting boards,Storage & organization/Armoires & wardrobes/Solitaire wardrobes,Kitchen & appliances/Kitchen systems/SEKTION kitchen/SEKTION kitchen cabinets,"Storage & organization/Storage solution systems/ELVARLI system/Post, side units & interiors","Storage & organization/Storage solution systems/ELVARLI system/Post, side units & interiors",Bathroom/Bathroom storage/Bathroom storage/Bathroom tall cabinets,Storage & organization/Storage solution systems/BOAXEL system/BOAXEL parts,Storage & organization/Storage solution systems/IVAR system/All parts,Storage & organization/Clothes organizers/Shoe racks & stands,Storage & organization/Clothes organizers/Shoe racks & stands,"Storage & organization/Storage solution systems/ELVARLI system/Post, side units & interiors","Storage & organization/Storage solution systems/ELVARLI system/Post, side units & interiors","Storage & organization/Storage solution systems/ELVARLI system/Post, side units & interiors","Storage & organization/Storage solution systems/ELVARLI system/Post, side units & interiors",Storage & organization/Wall shelves/Brackets,Storage & organization/TV & media furniture/TV stands & benches,Storage & organization/TV & media furniture/TV stands & benches,Storage & organization/TV & media furniture/TV stands & benches,Kitchen & appliances/Kitchen drawer organization/Shelves & drawers,Storage & organization/Wall shelves/Brackets,Kitchen & appliances/Kitchen drawer organization/Drawer dividers,Home Décor/Storage boxes & baskets/Kids boxes & baskets,"Storage & organization/Shelving units, bookcases & storage options/Storage shelves & units",Furniture/Tables & desks/Accent tables/End tables & side tables,Storage & organization/Storage solution systems/BOAXEL system/BOAXEL parts,"Storage & organization/Shelving units, bookcases & storage options/Shelf units & cube storage",Home Décor/Wall décor/Picture ledges,Storage & organization/Storage containers/Paper & media organizers/Desk accessories,Storage & organization/Dressers & storage drawers/Drawer units/Drawer units for home,Storage & organization/Storage solution systems/IVAR system/All parts,Laundry & cleaning/Ironing boards,Furniture/Tables & desks/Console tables & sofa tables,Furniture/Tables & desks/Desks & computer desks/Desks for home,Storage & organization/Display & storage cabinets/Display cabinets,Storage & organization/Display & storage cabinets/Display cabinets,Storage & organization/Storage containers/Paper & media organizers/Magazine files,Furniture/Patio furniture/Outdoor tables/Outdoor coffee & side tables,Storage & organization/Storage solution systems/PAX system/PAX Interior organizers,Storage & organization/Storage solution systems/PAX system/PAX Interior organizers,Kitchen & appliances/Kitchen systems/SEKTION kitchen/SEKTION kitchen cabinets,Storage & organization/Storage solution systems/PAX system/PAX Interior organizers,Storage & organization/Storage solution systems/PAX system/PAX Interior organizers,Storage & organization/Display & storage cabinets/Dining room cabinets & cupboards,Storage & organization/Wall shelves/Shelves,Furniture/Tables & desks/Accent tables/End tables & side tables,"Storage & organization/Shelving units, bookcases & storage options/Shelf units & cube storage",Home electronics/Speakers/Wi-Fi speakers,Storage & organization/Storage solution systems/IVAR system/All parts,Storage & organization/Storage containers/Cable management & accessories,Storage & organization/Storage solution systems/BOAXEL system/BOAXEL parts,Storage & organization/Display & storage cabinets/Dining room cabinets & cupboards,"Storage & organization/Shelving units, bookcases & storage options/Shelf units & cube storage",Furniture/Tables & desks/Desks & computer desks/Desks for home,Furniture/Tables & desks/Accent tables/Coffee tables,Furniture/Tables & desks/Accent tables/End tables & side tables,Furniture/Tables & desks/Accent tables/Coffee tables,Furniture/Tables & desks/Accent tables/Coffee tables,Furniture/Tables & desks/Accent tables/End tables & side tables,Furniture/Tables & desks/Accent tables/Coffee tables,Furniture/Tables & desks/Console tables & sofa tables,Kitchen & appliances/Appliances/Refrigerators & freezers/Free-standing refrigerators,Kitchen & appliances/Appliances/Refrigerators & freezers/Free-standing refrigerators,"Storage & organization/Storage solution systems/ELVARLI system/Post, side units & interiors","Storage & organization/Storage solution systems/ELVARLI system/Post, side units & interiors",Kitchen & appliances/Appliances/Refrigerators & freezers/Free-standing refrigerators,Storage & organization/Storage solution systems/BOAXEL system/BOAXEL parts,Storage & organization/Storage containers/Paper & media organizers/Desk accessories,Furniture/Chairs/Bar stools & chairs,"Storage & organization/Shelving units, bookcases & storage options/Shelf units & cube storage",Home Décor/Mirrors/Vanity mirrors,Home Décor/Clocks/Wall & table clocks,Home Décor/Storage boxes & baskets/Paper & media boxes,Storage & organization/Armoires & wardrobes/Solitaire wardrobes,Storage & organization/Utility & storage carts/Bathroom Carts,Kitchen & appliances/Kitchen drawer organization/Shelves & drawers,Kitchen & appliances/Kitchen drawer organization/Shelves & drawers,Storage & organization/TV & media furniture/TV stands & benches,Storage & organization/TV & media furniture/TV stands & benches,Storage & organization/Display & storage cabinets/Display cabinets,Storage & organization/TV & media furniture/TV stands & benches,Bathroom/Bathroom storage/Bathroom storage/Bathroom wall cabinets,Storage & organization/Display & storage cabinets/Dining room cabinets & cupboards,"Storage & organization/Shelving units, bookcases & storage options/Shelf units & cube storage",Cookware & tableware/Knives & cutting boards/Sharpening tools,Bathroom/Bathroom vanities/Bathroom vanity legs,Kitchen & appliances/Kitchen drawer organization/Drawer dividers
Kitchen & appliances/Kitchen systems/SEKTION kitchen/SEKTION kitchen cabinets,Kitchen & appliances/Kitchen systems/SEKTION kitchen/SEKTION kitchen cabinets,Kitchen & appliances/Kitchen systems/SEKTION kitchen/SEKTION kitchen cabinets,Kitchen & appliances/Kitchen systems/SEKTION kitchen/SEKTION kitchen cabinets,Kitchen & appliances/Kitchen systems/SEKTION kitchen/SEKTION kitchen cabinets,Home Textiles/Window treatments/Curtain rods & rails/Track systems,Home Textiles/Window treatments/Curtain rods & rails/Track systems,Home Textiles/Window treatments/Curtain rods & rails/Track systems,Home Textiles/Window treatments/Curtain rods & rails/Track systems,Home Textiles/Window treatments/Curtain rods & rails/Curtain rods,Furniture/Tables & desks/Nightstands,Cookware & tableware/Knives & cutting boards/Cutting boards,Home Textiles/Window treatments/Curtain rods & rails/Curtain rods,Furniture/Patio furniture/Outdoor tables/Outdoor dining tables,Home Décor/Mirrors/Wall mirrors,Home Décor/Mirrors/Vanity mirrors,Home Décor/Mirrors/Wall mirrors,Furniture/Patio furniture/Outdoor tables/Outdoor dining tables,Bathroom/Bathroom textiles/Shower curtains,Furniture/Tables & desks/Desks & computer desks/Desks for home,Furniture/Patio furniture/Outdoor tables/Outdoor dining tables,Home Décor/Wall décor/Picture & photo frames,Home Décor/Wall décor/Picture & photo frames,Home Décor/Wall décor/Picture & photo frames,Home Décor/Wall décor/Picture & photo frames,"Storage & organization/Wall shelves & hooks/Hooks/BRANDUR Hook, in-","Storage & organization/Wall shelves & hooks/Hooks/BRANDUR Hook, in-","Storage & organization/Clothes organizers/Clothes racks & stands/TURBO Clothes rack, indoor",Home Décor/Candle holders & candles/Lanterns,Home Décor/Flower pots & stands/Indoor plant pots,"Storage & organization/Wall shelves & hooks/Hooks/BRANDUR Rail with 4 hooks, in-",Storage & organization/Wall shelves & hooks/Hooks,Storage & organization/Wall shelves & hooks/Hooks,"Laundry & cleaning/Drying racks/MULIG Drying rack, indoor",Furniture/Tables & desks/Dining tables/Up to 4 seats,Rugs/Rugs/Door mats,Storage & organization/Storage solution systems/PAX system/PAX sliding doors,Furniture/Patio furniture/Outdoor chaises & hammocks,Home Décor/Storage boxes & baskets/Baskets,Laundry & cleaning/Cleaning accessories,Home Textiles/Window treatments/Curtain rods & rails/Track systems,Furniture/Tables & desks/Dining tables/Up to 10 seats,Home Décor/Storage boxes & baskets/Kids boxes & baskets,Furniture/Sofas & sectionals/Ottomans/Fabric ottomans,Furniture/Tables & desks/Café tables,Furniture/Tables & desks/Bar tables,Storage & organization/Wall shelves & hooks/Hooks,Cookware & tableware/Knives & cutting boards/Cutting boards,Cookware & tableware/Knives & cutting boards/Cutting boards,Cookware & tableware/Knives & cutting boards/Cutting boards,Lighting/Lamps & light fixtures/Kids lighting,Baby & kids/Baby/Baby toys/Newborn,Home Décor/Decorative accessories,Home Décor/Wall décor/Art cards,Cookware & tableware/Dinnerware/Deep plates/VÄRDERA Deep plate,Baby & kids/Kids/Toys & play/Physical play,Home improvement/Home safety/Child safety,Baby & kids/Kids/Toys & play/Role play,Rugs/Rugs/Door mats,Home Décor/Mirrors/Vanity mirrors,Baby & kids/Kids/Toys & play/Physical play,Storage & organization/TV & media furniture/TV stands & benches,Storage & organization/Wall shelves/Complete wall shelves/HEMNES Wall,Rugs/Rugs/Runners & small rugs,Rugs/Rugs/Runners & small rugs,Home Textiles/Window treatments/Curtain rods & rails/Track systems,Home Décor/Wall décor/Picture & photo frames,Cookware & tableware/Dinnerware/Plates,Baby & kids/Kids/Toys & play/Role play,Storage & organization/Storage containers/Bins & bags/Trash cans & pedal bins,Storage & organization/Storage containers/Paper & media organizers/Desk accessories,Cookware & tableware/Dinnerware/Side plates,Kitchen & appliances/Kitchen countertops/Laminate countertops,Kitchen & appliances/Kitchen countertops/Laminate countertops,Kitchen & appliances/Kitchen countertops/Laminate countertops,Kitchen & appliances/Kitchen countertops/Laminate countertops,Kitchen & appliances/Kitchen countertops/Laminate countertops,Home Décor/Wall décor/Collage picture frames,Storage & organization/Clothes organizers/Shoe racks & stands,Kitchen & appliances/Kitchen countertops/Butcher block countertops,Kitchen & appliances/Kitchen countertops/Butcher block countertops,Kitchen & appliances/Kitchen countertops/Butcher block countertops,Kitchen & appliances/Kitchen countertops/Butcher block countertops,Kitchen & appliances/Kitchen countertops/Butcher block countertops,Kitchen & appliances/Kitchen countertops/Butcher block countertops,Cookware & tableware/Cookware & kitchenware/Cooking pans/Frying pans & skillets,"Storage & organization/Display & storage cabinets/Buffet tables, sideboard buffets & buffet cabinets",Furniture/Tables & desks/Accent tables/End tables & side tables,"Home Textiles/Window treatments/Shades, blinds & window treatments/Roman shades",Home Textiles/Window treatments/Curtains & drapes/Light filtering curtains,"Home Textiles/Window treatments/Shades, blinds & window treatments/Pleated & cellular blinds and shades",Home Textiles/Window treatments/Curtains & drapes/Light filtering curtains,Home Textiles/Window treatments/Curtains & drapes/Panel curtains,Home Textiles/Window treatments/Curtains & drapes/Light filtering curtains,Home Textiles/Window treatments/Curtains & drapes/Panel curtains,Home Textiles/Window treatments/Curtains & drapes/Light filtering curtains,Home Textiles/Window treatments/Curtains & drapes/Light filtering curtains,Home Textiles/Window treatments/Curtains & drapes/Light filtering curtains,Home Textiles/Window treatments/Curtains & drapes/Light filtering curtains,Home Textiles/Window treatments/Curtains & drapes/Light filtering curtains
Kitchen & appliances/Kitchen systems/SEKTION kitchen/SEKTION kitchen cabinets,Kitchen & appliances/Kitchen systems/SEKTION kitchen/SEKTION kitchen cabinets,Kitchen & appliances/Kitchen systems/SEKTION kitchen/SEKTION kitchen cabinets,Kitchen & appliances/Kitchen systems/SEKTION kitchen/SEKTION kitchen cabinets,Kitchen & appliances/Kitchen systems/SEKTION kitchen/SEKTION kitchen cabinets,Home Textiles/Window treatments/Curtain rods & rails/Track systems,Home Textiles/Window treatments/Curtain rods & rails/Track systems,Home Textiles/Window treatments/Curtain rods & rails/Track systems,Home Textiles/Window treatments/Curtain rods & rails/Track systems,Home Textiles/Window treatments/Curtain rods & rails/Curtain rods,Furniture/Tables & desks/Nightstands,Cookware & tableware/Knives & cutting boards/Cutting boards,Home Textiles/Window treatments/Curtain rods & rails/Curtain rods,Furniture/Patio furniture/Outdoor tables/Outdoor dining tables,Home Décor/Mirrors/Wall mirrors,Home Décor/Mirrors/Vanity mirrors,Home Décor/Mirrors/Wall mirrors,Furniture/Patio furniture/Outdoor tables/Outdoor dining tables,Bathroom/Bathroom textiles/Shower curtains,Furniture/Tables & desks/Desks & computer desks/Desks for home,Furniture/Patio furniture/Outdoor tables/Outdoor dining tables,Home Décor/Wall décor/Picture & photo frames,Home Décor/Wall décor/Picture & photo frames,Home Décor/Wall décor/Picture & photo frames,Home Décor/Wall décor/Picture & photo frames,"Storage & organization/Wall shelves & hooks/Hooks/BRANDUR Hook, in-","Storage & organization/Wall shelves & hooks/Hooks/BRANDUR Hook, in-","Storage & organization/Clothes organizers/Clothes racks & stands/TURBO Clothes rack, indoor",Home Décor/Candle holders & candles/Lanterns,Home Décor/Flower pots & stands/Indoor plant pots,"Storage & organization/Wall shelves & hooks/Hooks/BRANDUR Rail with 4 hooks, in-",Storage & organization/Wall shelves & hooks/Hooks,Storage & organization/Wall shelves & hooks/Hooks,"Laundry & cleaning/Drying racks/MULIG Drying rack, indoor",Furniture/Tables & desks/Dining tables/Up to 4 seats,Rugs/Rugs/Door mats,Storage & organization/Storage solution systems/PAX system/PAX sliding doors,Furniture/Patio furniture/Outdoor chaises & hammocks,Home Décor/Storage boxes & baskets/Baskets,Laundry & cleaning/Cleaning accessories,Home Textiles/Window treatments/Curtain rods & rails/Track systems,Furniture/Tables & desks/Dining tables/Up to 10 seats,Home Décor/Storage boxes & baskets/Kids boxes & baskets,Furniture/Sofas & sectionals/Ottomans/Fabric ottomans,Furniture/Tables & desks/Café tables,Furniture/Tables & desks/Bar tables,Storage & organization/Wall shelves & hooks/Hooks,Cookware & tableware/Knives & cutting boards/Cutting boards,Cookware & tableware/Knives & cutting boards/Cutting boards,Cookware & tableware/Knives & cutting boards/Cutting boards,Lighting/Lamps & light fixtures/Kids lighting,Baby & kids/Baby/Baby toys/Newborn,Home Décor/Decorative accessories,Home Décor/Wall décor/Art cards,Cookware & tableware/Dinnerware/Deep plates/VÄRDERA Deep plate,Baby & kids/Kids/Toys & play/Physical play,Home improvement/Home safety/Child safety,Baby & kids/Kids/Toys & play/Role play,Rugs/Rugs/Door mats,Home Décor/Mirrors/Vanity mirrors,Baby & kids/Kids/Toys & play/Physical play,Storage & organization/TV & media furniture/TV stands & benches,Storage & organization/Wall shelves/Complete wall shelves/HEMNES Wall,Rugs/Rugs/Runners & small rugs,Rugs/Rugs/Runners & small rugs,Home Textiles/Window treatments/Curtain rods & rails/Track systems,Home Décor/Wall décor/Picture & photo frames,Cookware & tableware/Dinnerware/Plates,Baby & kids/Kids/Toys & play/Role play,Storage & organization/Storage containers/Bins & bags/Trash cans & pedal bins,Storage & organization/Storage containers/Paper & media organizers/Desk accessories,Cookware & tableware/Dinnerware/Side plates,Kitchen & appliances/Kitchen countertops/Laminate countertops,Kitchen & appliances/Kitchen countertops/Laminate countertops,Kitchen & appliances/Kitchen countertops/Laminate countertops,Kitchen & appliances/Kitchen countertops/Laminate countertops,Kitchen & appliances/Kitchen countertops/Laminate countertops,Home Décor/Wall décor/Collage picture frames,Storage & organization/Clothes organizers/Shoe racks & stands,Kitchen & appliances/Kitchen countertops/Butcher block countertops,Kitchen & appliances/Kitchen countertops/Butcher block countertops,Kitchen & appliances/Kitchen countertops/Butcher block countertops,Kitchen & appliances/Kitchen countertops/Butcher block countertops,Kitchen & appliances/Kitchen countertops/Butcher block countertops,Kitchen & appliances/Kitchen countertops/Butcher block countertops,Cookware & tableware/Cookware & kitchenware/Cooking pans/Frying pans & skillets,"Storage & organization/Display & storage cabinets/Buffet tables, sideboard buffets & buffet cabinets",Furniture/Tables & desks/Accent tables/End tables & side tables,"Home Textiles/Window treatments/Shades, blinds & window treatments/Roman shades",Home Textiles/Window treatments/Curtains & drapes/Light filtering curtains,"Home Textiles/Window treatments/Shades, blinds & window treatments/Pleated & cellular blinds and shades",Home Textiles/Window treatments/Curtains & drapes/Light filtering curtains,Home Textiles/Window treatments/Curtains & drapes/Panel curtains,Home Textiles/Window treatments/Curtains & drapes/Light filtering curtains,Home Textiles/Window treatments/Curtains & drapes/Panel curtains,Home Textiles/Window treatments/Curtains & drapes/Light filtering curtains,Home Textiles/Window treatments/Curtains & drapes/Light filtering curtains,Home Textiles/Window treatments/Curtains & drapes/Light filtering curtains,Home Textiles/Window treatments/Curtains & drapes/Light filtering curtains,Home Textiles/Window treatments/Curtains & drapes/Light filtering curtains
