Storage & organization/Storage containers/Clothes organizers/Hanging clothes organizers,Storage & organization/Storage containers/Hooks & hangers/Hangers,Storage & organization/Dressers & storage drawers/Drawer units/Drawer units for home,Storage & organization/Dressers & storage drawers/Drawer units/Drawer units for home,Storage & organization/Armoires & wardrobes/Solitaire wardrobes,Storage & organization/Armoires & wardrobes/Solitaire wardrobes,Storage & organization/Storage containers/Clothes organizers/Hanging clothes organizers,Furniture/Chairs/Dining chairs/Dining chairs,Furniture/Beds/Bed legs,Furniture/Armchairs & chaises/Fabric armchairs,Furniture/Kids furniture/Kids chairs,Storage & organization/Storage solution systems/PAX system/PAX Interior organizers,Furniture/Patio furniture/Outdoor sofa sections,Furniture/Chairs/Bar stools & chairs,Furniture/Chairs/Dining chairs/Dining chairs,Furniture/Sofas & sectionals/Ottomans/Fabric ottomans,Furniture/Sofas & sectionals/Sectionals/Sofa modules,Furniture/Beds/Cribs,Furniture/Sofas & sectionals/Sofa legs,Furniture/Sofas & sectionals/Sofa legs,"Baby & kids/Baby/Changing, bathing & potty/Potties & baby baths",Furniture/Chairs/Dining chairs/Dining chairs,Storage & organization/Storage containers/Hooks & hangers/Hangers,Rugs/Rugs/Runners & small rugs,Rugs/Rugs/Large & medium rugs,Rugs/Rugs/Door mats,Laundry & cleaning/Laundry baskets,Storage & organization/Storage containers/Food storage & organizing/Food containers,Furniture/Tables & desks/Accent tables/Coffee tables,Furniture/Tables & desks/Accent tables/Coffee tables,Furniture/Tables & desks/Nightstands,Bathroom/Bathroom stools & benches,Home Décor/Storage boxes & baskets/Paper & media boxes,Home Décor/Storage boxes & baskets/Baskets,Furniture/Tables & desks/Changing tables,Cookware & tableware/Serveware/Trays,Home Décor/Storage boxes & baskets/Baskets,Home Décor/Storage boxes & baskets/Baskets,Storage & organization/Storage containers/Paper & media organizers/Desk accessories,Furniture/Beds/Twin beds,Storage & organization/Armoires & wardrobes/Solitaire wardrobes,Furniture/Armchairs & chaises/Fabric armchairs,Furniture/Chairs/Dining chairs/Dining chairs,Cookware & tableware/Dishwashing accessories/Sink accessories,Storage & organization/Bags/Backpacks & messenger bags,Furniture/Armchairs & chaises/Coated fabric armchairs,Storage & organization/Wall shelves & hooks/Hooks,Furniture/Beds/Cribs,Cookware & tableware/Dishwashing accessories/Dish drainers & drying racks,Furniture/Chairs/Desk chairs/Desk chairs for home,Rugs/Rugs/Runners & small rugs,Furniture/Patio furniture/Outdoor chairs/Outdoor dining chairs,Furniture/Tables & desks/Accent tables/End tables & side tables,Storage & organization/Storage containers/Paper & media organizers/Desk accessories,Beds & mattresses/Mattresses/Spring mattresses,Furniture/Chairs/Dining chairs/Dining chairs,Storage & organization/Clothes organizers/Coat stands,Storage & organization/Clothes organizers/Shoe racks & stands,Furniture/Kids furniture/Kids chairs,Furniture/Beds/Kids beds/Junior & extendable beds,Storage & organization/Storage containers/Bins & bags/Trash cans & pedal bins,Furniture/Chairs/Desk chairs/Desk chairs for home,Home Décor/Storage boxes & baskets/Clothes boxes,Beds & mattresses/Mattress bases,Storage & organization/Storage containers/Hooks & hangers/Hangers,Storage & organization/Armoires & wardrobes/Solitaire wardrobes,Storage & organization/Armoires & wardrobes/Solitaire wardrobes,Storage & organization/Armoires & wardrobes/Solitaire wardrobes,Furniture/Tables & desks/Nightstands,Furniture/Beds/Kids beds/Bunk beds,Furniture/Chairs/Desk chairs/Desk chairs for home,Furniture/Chairs/Desk chairs/Kids desk chairs,Furniture/Beds/Cribs,Storage & organization/Storage solution systems/PAX system/PAX Interior organizers,Storage & organization/Storage solution systems/PAX system/PAX Interior organizers,Furniture/Chairs/Dining chairs/Upholstered chairs,Furniture/Chairs/Dining chairs/Upholstered chairs,Furniture/Beds/Kids beds/Junior & extendable beds,Furniture/Patio furniture/Outdoor chairs/Outdoor dining chairs,Storage & organization/Storage containers/Hooks & hangers/Hangers,Furniture/Patio furniture/Outdoor sofa sections,Furniture/Patio furniture/Outdoor sofa sections,Furniture/Patio furniture/Outdoor tables/Outdoor coffee & side tables,Outdoor/Outdoor flooring,Storage & organization/Bags/Travel accessories,Furniture/Patio furniture/Outdoor chaises & hammocks,Furniture/Chairs/Dining chairs/Upholstered chairs,"Storage & organization/Shelving units, bookcases & storage options/Storage shelves & units",Furniture/Kids furniture/Kids chairs,Storage & organization/Bags/Shopping bags & tote bags,Storage & organization/Bags/Shopping bags & tote bags,Furniture/Patio furniture/Outdoor chairs/Outdoor dining chairs,Furniture/Tables & desks/Changing tables,Furniture/Tables & desks/Changing tables,Kitchen & appliances/Kitchen drawer organization/Cleaning organizers,Furniture/Chairs/Dining chairs/Upholstered chairs,Home Décor/Storage boxes & baskets/Clothes boxes,Furniture/Armchairs & chaises/Lounge chairs,Storage & organization/Storage containers/Bins & bags/Bags,Cookware & tableware/Napkins & napkin holders/Napkin holders
Storage & organization/Storage solution systems/SMÅSTAD system/SMÅSTAD doors & drawers,Storage & organization/Storage solution systems/SMÅSTAD system/SMÅSTAD doors & drawers,Storage & organization/Wall shelves/Brackets,Storage & organization/Wall shelves/Brackets,Storage & organization/Wall shelves/Brackets,"Storage & organization/Shelving units, bookcases & storage options/Bookcases",Storage & organization/Display & storage cabinets/Dining room cabinets & cupboards,Storage & organization/Display & storage cabinets/Dining room cabinets & cupboards,"Storage & organization/Storage solution systems/ELVARLI system/Post, side units & interiors",Storage & organization/Storage containers/Paper & media organizers/Desk accessories,Bathroom/Bathroom storage/Bathroom shelving units,Storage & organization/Storage containers/Bins & bags/Trash cans & pedal bins,Storage & organization/Storage containers/Bins & bags/Trash cans & pedal bins,Storage & organization/Storage solution systems/BOAXEL system/BOAXEL parts,"Storage & organization/Storage solution systems/ELVARLI system/Post, side units & interiors",Kitchen & appliances/Kitchen systems/SEKTION kitchen/SEKTION kitchen cabinets,Cookware & tableware/Knives & cutting boards/Cutting boards,"Storage & organization/Storage solution systems/ELVARLI system/Post, side units & interiors","Storage & organization/Storage solution systems/ELVARLI system/Post, side units & interiors",Storage & organization/Armoires & wardrobes/Solitaire wardrobes,Kitchen & appliances/Kitchen drawer organization/Shelves & drawers,Storage & organization/Storage solution systems/IVAR system/All parts,Bathroom/Bathroom storage/Bathroom storage/Bathroom tall cabinets,"Storage & organization/Storage solution systems/ELVARLI system/Post, side units & interiors","Storage & organization/Storage solution systems/ELVARLI system/Post, side units & interiors","Storage & organization/Storage solution systems/ELVARLI system/Post, side units & interiors","Storage & organization/Storage solution systems/ELVARLI system/Post, side units & interiors",Storage & organization/Wall shelves/Brackets,Storage & organization/TV & media furniture/TV stands & benches,Storage & organization/TV & media furniture/TV stands & benches,Storage & organization/TV & media furniture/TV stands & benches,Storage & organization/Wall shelves/Brackets,Storage & organization/Clothes organizers/Shoe racks & stands,Storage & organization/Clothes organizers/Shoe racks & stands,Furniture/Tables & desks/Accent tables/End tables & side tables,Home Décor/Storage boxes & baskets/Kids boxes & baskets,Kitchen & appliances/Kitchen drawer organization/Drawer dividers,"Storage & organization/Shelving units, bookcases & storage options/Storage shelves & units",Storage & organization/Storage containers/Paper & media organizers/Magazine files,Furniture/Tables & desks/Console tables & sofa tables,Kitchen & appliances/Kitchen systems/SEKTION kitchen/SEKTION kitchen cabinets,Storage & organization/Storage solution systems/BOAXEL system/BOAXEL parts,Home Décor/Wall décor/Picture ledges,Storage & organization/Storage solution systems/IVAR system/All parts,"Storage & organization/Shelving units, bookcases & storage options/Shelf units & cube storage",Laundry & cleaning/Ironing boards,Storage & organization/Storage containers/Paper & media organizers/Desk accessories,Storage & organization/Dressers & storage drawers/Drawer units/Drawer units for home,Storage & organization/Storage solution systems/PAX system/PAX Interior organizers,Storage & organization/Storage solution systems/PAX system/PAX Interior organizers,Furniture/Tables & desks/Desks & computer desks/Desks for home,Storage & organization/Storage solution systems/IVAR system/All parts,Storage & organization/Display & storage cabinets/Display cabinets,Storage & organization/Display & storage cabinets/Display cabinets,Furniture/Patio furniture/Outdoor tables/Outdoor coffee & side tables,Home electronics/Speakers/Wi-Fi speakers,"Storage & organization/Shelving units, bookcases & storage options/Shelf units & cube storage","Storage & organization/Shelving units, bookcases & storage options/Shelf units & cube storage",Storage & organization/Display & storage cabinets/Dining room cabinets & cupboards,Storage & organization/Storage solution systems/PAX system/PAX Interior organizers,Storage & organization/Storage solution systems/PAX system/PAX Interior organizers,Furniture/Tables & desks/Desks & computer desks/Desks for home,Storage & organization/Storage containers/Cable management & accessories,Storage & organization/Display & storage cabinets/Dining room cabinets & cupboards,Storage & organization/Storage solution systems/BOAXEL system/BOAXEL parts,Furniture/Chairs/Bar stools & chairs,Home Décor/Storage boxes & baskets/Paper & media boxes,Kitchen & appliances/Appliances/Refrigerators & freezers/Free-standing refrigerators,Kitchen & appliances/Appliances/Refrigerators & freezers/Free-standing refrigerators,Storage & organization/Wall shelves/Shelves,Storage & organization/Armoires & wardrobes/Solitaire wardrobes,Kitchen & appliances/Appliances/Refrigerators & freezers/Free-standing refrigerators,"Storage & organization/Storage solution systems/ELVARLI system/Post, side units & interiors","Storage & organization/Storage solution systems/ELVARLI system/Post, side units & interiors",Furniture/Tables & desks/Accent tables/End tables & side tables,Storage & organization/TV & media furniture/TV stands & benches,Bathroom/Bathroom storage/Bathroom storage/Bathroom wall cabinets,Storage & organization/Storage containers/Paper & media organizers/Desk accessories,"Storage & organization/Shelving units, bookcases & storage options/Shelf units & cube storage",Storage & organization/Display & storage cabinets/Dining room cabinets & cupboards,Storage & organization/Storage solution systems/BOAXEL system/BOAXEL parts,Furniture/Tables & desks/Accent tables/End tables & side tables,Furniture/Tables & desks/Accent tables/Coffee tables,Furniture/Tables & desks/Accent tables/End tables & side tables,Furniture/Tables & desks/Accent tables/Coffee tables,Furniture/Tables & desks/Accent tables/Coffee tables,Furniture/Tables & desks/Console tables & sofa tables,Furniture/Tables & desks/Accent tables/Coffee tables,Storage & organization/Display & storage cabinets/Dining room cabinets & cupboards,Cookware & tableware/Knives & cutting boards/Sharpening tools,Home Décor/Clocks/Wall & table clocks,Furniture/Tables & desks/Bar tables,Bathroom/Bathroom vanities/Bathroom vanity legs,"Storage & organization/Shelving units, bookcases & storage options/Shelf units & cube storage",Home Décor/Mirrors/Vanity mirrors,Storage & organization/Utility & storage carts/Bathroom Carts,Storage & organization/Storage solution systems/BESTÅ storage system/BESTÅ all parts & accessories,"Storage & organization/Shelving units, bookcases & storage options/Shelf units & cube storage",Storage & organization/Display & storage cabinets/Filing cabinets & storage cabinets/Office storage cabinets & units,"Storage & organization/Shelving units, bookcases & storage options/Bookcases"
Kitchen & appliances/Kitchen systems/SEKTION kitchen/SEKTION kitchen cabinets,Kitchen & appliances/Kitchen systems/SEKTION kitchen/SEKTION kitchen cabinets,Kitchen & appliances/Kitchen systems/SEKTION kitchen/SEKTION kitchen cabinets,Kitchen & appliances/Kitchen systems/SEKTION kitchen/SEKTION kitchen cabinets,Kitchen & appliances/Kitchen systems/SEKTION kitchen/SEKTION kitchen cabinets,Furniture/Tables & desks/Nightstands,Home Textiles/Window treatments/Curtain rods & rails/Curtain rods,Cookware & tableware/Knives & cutting boards/Cutting boards,Home Textiles/Window treatments/Curtain rods & rails/Curtain rods,Home Textiles/Window treatments/Curtain rods & rails/Track systems,Home Textiles/Window treatments/Curtain rods & rails/Track systems,Home Textiles/Window treatments/Curtain rods & rails/Track systems,Home Textiles/Window treatments/Curtain rods & rails/Track systems,Furniture/Patio furniture/Outdoor tables/Outdoor dining tables,Furniture/Patio furniture/Outdoor tables/Outdoor dining tables,Home Décor/Mirrors/Vanity mirrors,Home Décor/Mirrors/Wall mirrors,Home Décor/Mirrors/Wall mirrors,Furniture/Tables & desks/Desks & computer desks/Desks for home,Bathroom/Bathroom textiles/Shower curtains,Furniture/Tables & desks/Dining tables/Up to 4 seats,Furniture/Patio furniture/Outdoor tables/Outdoor dining tables,Home Décor/Wall décor/Picture & photo frames,Home Décor/Wall décor/Picture & photo frames,Home Décor/Wall décor/Picture & photo frames,Home Décor/Wall décor/Picture & photo frames,"Storage & organization/Clothes organizers/Clothes racks & stands/TURBO Clothes rack, indoor","Storage & organization/Wall shelves & hooks/Hooks/BRANDUR Hook, in-",Storage & organization/Wall shelves & hooks/Hooks,Storage & organization/Wall shelves & hooks/Hooks,"Storage & organization/Wall shelves & hooks/Hooks/BRANDUR Rail with 4 hooks, in-","Storage & organization/Wall shelves & hooks/Hooks/BRANDUR Hook, in-",Home Décor/Candle holders & candles/Lanterns,"Laundry & cleaning/Drying racks/MULIG Drying rack, indoor",Home Décor/Flower pots & stands/Indoor plant pots,Rugs/Rugs/Door mats,Laundry & cleaning/Cleaning accessories,Furniture/Patio furniture/Outdoor chaises & hammocks,Home Décor/Storage boxes & baskets/Kids boxes & baskets,Storage & organization/Storage solution systems/PAX system/PAX sliding doors,Storage & organization/Wall shelves & hooks/Hooks,Furniture/Tables & desks/Dining tables/Up to 10 seats,Home Décor/Storage boxes & baskets/Baskets,Home Textiles/Window treatments/Curtain rods & rails/Track systems,Cookware & tableware/Knives & cutting boards/Cutting boards,Cookware & tableware/Knives & cutting boards/Cutting boards,Cookware & tableware/Knives & cutting boards/Cutting boards,Home Décor/Wall décor/Art cards,Cookware & tableware/Dinnerware/Deep plates/VÄRDERA Deep plate,Furniture/Sofas & sectionals/Ottomans/Fabric ottomans,Baby & kids/Kids/Toys & play/Physical play,Home Décor/Decorative accessories,Lighting/Lamps & light fixtures/Kids lighting,Baby & kids/Baby/Baby toys/Newborn,Storage & organization/TV & media furniture/TV stands & benches,Storage & organization/Wall shelves/Complete wall shelves/HEMNES Wall,Home improvement/Home safety/Child safety,Furniture/Tables & desks/Café tables,Furniture/Tables & desks/Bar tables,Rugs/Rugs/Runners & small rugs,Rugs/Rugs/Runners & small rugs,Baby & kids/Kids/Toys & play/Role play,Rugs/Rugs/Door mats,Home Textiles/Window treatments/Curtain rods & rails/Track systems,Baby & kids/Kids/Toys & play/Physical play,Cookware & tableware/Dinnerware/Plates,Home Décor/Wall décor/Picture & photo frames,Home Décor/Wall décor/Collage picture frames,Storage & organization/Storage containers/Bins & bags/Trash cans & pedal bins,Baby & kids/Kids/Toys & play/Role play,Storage & organization/Storage containers/Paper & media organizers/Desk accessories,Home Décor/Mirrors/Vanity mirrors,Cookware & tableware/Dinnerware/Side plates,Furniture/Tables & desks/Makeup vanities & dressing tables,Kitchen & appliances/Kitchen countertops/Laminate countertops,Kitchen & appliances/Kitchen countertops/Laminate countertops,Kitchen & appliances/Kitchen countertops/Laminate countertops,Cookware & tableware/Dinnerware/Dinnerware sets,Kitchen & appliances/Kitchen countertops/Laminate countertops,Kitchen & appliances/Kitchen countertops/Laminate countertops,Storage & organization/Clothes organizers/Shoe racks & stands,Cookware & tableware/Cookware & kitchenware/Cooking pans/Frying pans & skillets,Furniture/Tables & desks/Accent tables/End tables & side tables,Furniture/Tables & desks/Dining tables/Up to 4 seats,Storage & organization/Storage containers/Food storage & organizing/Food containers,Kitchen & appliances/Kitchen countertops/Butcher block countertops,Kitchen & appliances/Kitchen countertops/Butcher block countertops,Kitchen & appliances/Kitchen countertops/Butcher block countertops,Kitchen & appliances/Kitchen countertops/Butcher block countertops,Kitchen & appliances/Kitchen countertops/Butcher block countertops,Kitchen & appliances/Kitchen countertops/Butcher block countertops,"Storage & organization/Display & storage cabinets/Buffet tables, sideboard buffets & buffet cabinets",Home Textiles/Window treatments/Curtains & drapes/Light filtering curtains,Home Textiles/Window treatments/Curtains & drapes/Light filtering curtains,"Home Textiles/Window treatments/Shades, blinds & window treatments/Roman shades","Home Textiles/Window treatments/Shades, blinds & window treatments/Pleated & cellular blinds and shades",Home Textiles/Window treatments/Curtains & drapes/Light filtering curtains,Home Textiles/Window treatments/Curtains & drapes/Light filtering curtains,Home Textiles/Window treatments/Curtains & drapes/Panel curtains,Home Textiles/Window treatments/Curtains & drapes/Panel curtains
Kitchen & appliances/Kitchen systems/SEKTION kitchen/SEKTION kitchen cabinets,Kitchen & appliances/Kitchen systems/SEKTION kitchen/SEKTION kitchen cabinets,Kitchen & appliances/Kitchen systems/SEKTION kitchen/SEKTION kitchen cabinets,Kitchen & appliances/Kitchen systems/SEKTION kitchen/SEKTION kitchen cabinets,Kitchen & appliances/Kitchen systems/SEKTION kitchen/SEKTION kitchen cabinets,Furniture/Tables & desks/Nightstands,Home Textiles/Window treatments/Curtain rods & rails/Curtain rods,Cookware & tableware/Knives & cutting boards/Cutting boards,Home Textiles/Window treatments/Curtain rods & rails/Curtain rods,Home Textiles/Window treatments/Curtain rods & rails/Track systems,Home Textiles/Window treatments/Curtain rods & rails/Track systems,Home Textiles/Window treatments/Curtain rods & rails/Track systems,Home Textiles/Window treatments/Curtain rods & rails/Track systems,Furniture/Patio furniture/Outdoor tables/Outdoor dining tables,Furniture/Patio furniture/Outdoor tables/Outdoor dining tables,Home Décor/Mirrors/Vanity mirrors,Home Décor/Mirrors/Wall mirrors,Home Décor/Mirrors/Wall mirrors,Furniture/Tables & desks/Desks & computer desks/Desks for home,Bathroom/Bathroom textiles/Shower curtains,Furniture/Tables & desks/Dining tables/Up to 4 seats,Furniture/Patio furniture/Outdoor tables/Outdoor dining tables,Home Décor/Wall décor/Picture & photo frames,Home Décor/Wall décor/Picture & photo frames,Home Décor/Wall décor/Picture & photo frames,Home Décor/Wall décor/Picture & photo frames,"Storage & organization/Clothes organizers/Clothes racks & stands/TURBO Clothes rack, indoor","Storage & organization/Wall shelves & hooks/Hooks/BRANDUR Hook, in-",Storage & organization/Wall shelves & hooks/Hooks,Storage & organization/Wall shelves & hooks/Hooks,"Storage & organization/Wall shelves & hooks/Hooks/BRANDUR Rail with 4 hooks, in-","Storage & organization/Wall shelves & hooks/Hooks/BRANDUR Hook, in-",Home Décor/Candle holders & candles/Lanterns,"Laundry & cleaning/Drying racks/MULIG Drying rack, indoor",Home Décor/Flower pots & stands/Indoor plant pots,Rugs/Rugs/Door mats,Laundry & cleaning/Cleaning accessories,Furniture/Patio furniture/Outdoor chaises & hammocks,Home Décor/Storage boxes & baskets/Kids boxes & baskets,Storage & organization/Storage solution systems/PAX system/PAX sliding doors,Storage & organization/Wall shelves & hooks/Hooks,Furniture/Tables & desks/Dining tables/Up to 10 seats,Home Décor/Storage boxes & baskets/Baskets,Home Textiles/Window treatments/Curtain rods & rails/Track systems,Cookware & tableware/Knives & cutting boards/Cutting boards,Cookware & tableware/Knives & cutting boards/Cutting boards,Cookware & tableware/Knives & cutting boards/Cutting boards,Home Décor/Wall décor/Art cards,Cookware & tableware/Dinnerware/Deep plates/VÄRDERA Deep plate,Furniture/Sofas & sectionals/Ottomans/Fabric ottomans,Baby & kids/Kids/Toys & play/Physical play,Home Décor/Decorative accessories,Lighting/Lamps & light fixtures/Kids lighting,Baby & kids/Baby/Baby toys/Newborn,Storage & organization/TV & media furniture/TV stands & benches,Storage & organization/Wall shelves/Complete wall shelves/HEMNES Wall,Home improvement/Home safety/Child safety,Furniture/Tables & desks/Café tables,Furniture/Tables & desks/Bar tables,Rugs/Rugs/Runners & small rugs,Rugs/Rugs/Runners & small rugs,Baby & kids/Kids/Toys & play/Role play,Rugs/Rugs/Door mats,Home Textiles/Window treatments/Curtain rods & rails/Track systems,Baby & kids/Kids/Toys & play/Physical play,Cookware & tableware/Dinnerware/Plates,Home Décor/Wall décor/Picture & photo frames,Home Décor/Wall décor/Collage picture frames,Storage & organization/Storage containers/Bins & bags/Trash cans & pedal bins,Baby & kids/Kids/Toys & play/Role play,Storage & organization/Storage containers/Paper & media organizers/Desk accessories,Home Décor/Mirrors/Vanity mirrors,Cookware & tableware/Dinnerware/Side plates,Furniture/Tables & desks/Makeup vanities & dressing tables,Kitchen & appliances/Kitchen countertops/Laminate countertops,Kitchen & appliances/Kitchen countertops/Laminate countertops,Kitchen & appliances/Kitchen countertops/Laminate countertops,Cookware & tableware/Dinnerware/Dinnerware sets,Kitchen & appliances/Kitchen countertops/Laminate countertops,Kitchen & appliances/Kitchen countertops/Laminate countertops,Storage & organization/Clothes organizers/Shoe racks & stands,Cookware & tableware/Cookware & kitchenware/Cooking pans/Frying pans & skillets,Furniture/Tables & desks/Accent tables/End tables & side tables,Furniture/Tables & desks/Dining tables/Up to 4 seats,Storage & organization/Storage containers/Food storage & organizing/Food containers,Kitchen & appliances/Kitchen countertops/Butcher block countertops,Kitchen & appliances/Kitchen countertops/Butcher block countertops,Kitchen & appliances/Kitchen countertops/Butcher block countertops,Kitchen & appliances/Kitchen countertops/Butcher block countertops,Kitchen & appliances/Kitchen countertops/Butcher block countertops,Kitchen & appliances/Kitchen countertops/Butcher block countertops,"Storage & organization/Display & storage cabinets/Buffet tables, sideboard buffets & buffet cabinets",Home Textiles/Window treatments/Curtains & drapes/Light filtering curtains,Home Textiles/Window treatments/Curtains & drapes/Light filtering curtains,"Home Textiles/Window treatments/Shades, blinds & window treatments/Roman shades","Home Textiles/Window treatments/Shades, blinds & window treatments/Pleated & cellular blinds and shades",Home Textiles/Window treatments/Curtains & drapes/Light filtering curtains,Home Textiles/Window treatments/Curtains & drapes/Light filtering curtains,Home Textiles/Window treatments/Curtains & drapes/Panel curtains,Home Textiles/Window treatments/Curtains & drapes/Panel curtains
