Home Décor/Flower pots & stands/Indoor plant pots,Home Décor/Flower pots & stands/Indoor plant pots,Home Décor/Flower pots & stands/Indoor plant pots,Home Décor/Flower pots & stands/Indoor plant pots,Home Décor/Flower pots & stands/Indoor plant pots,Home Décor/Flower pots & stands/Indoor plant pots,Home Décor/Flower pots & stands/Indoor plant pots,Home Décor/Flower pots & stands/Indoor plant pots,Home Décor/Flower pots & stands/Indoor plant pots,Home Décor/Flower pots & stands/Indoor plant pots,Lighting/Lamps & light fixtures/Ceiling lights/Pendants lights,Lighting/Integrated lighting/Bookcase lighting,Kitchen & appliances/Kitchen lighting,Bathroom/Bathroom faucets/Faucets,Cookware & tableware/Flatware/Flatware,Kitchen & appliances/Kitchen faucets & sinks/Kitchen faucets,Lighting/Lamps & light fixtures/Desk lamps,Lighting/Smart lighting/Smart lighting kits,Cookware & tableware/Coffee & tea/Tea pots & accessories,Bathroom/Bathroom faucets/Faucets,Lighting/Integrated lighting/Bookcase lighting,Kitchen & appliances/Kitchen faucets & sinks/Kitchen faucets,Cookware & tableware/Cookware & kitchenware/Pots & pans/Cooking & stock pots,Home Décor/Flower pots & stands/Self watering plant pots,"Lighting/Lamps & light fixtures/Shades, bases & cords/Lamp bases & cords",Kitchen & appliances/Kitchen faucets & sinks/Kitchen faucets,Home Décor/Flower pots & stands/Indoor plant pots,Bathroom/Bathroom faucets/Faucets,Lighting/Integrated lighting/Bookcase lighting,Lighting/Lamps & light fixtures/Ceiling lights/Pendants lights,Lighting/Lamps & light fixtures/Wall lamps/Wall lamps,Lighting/Smart lighting/Remote & smart light switches,Lighting/Lamps & light fixtures/Ceiling lights/Ceiling track lighting,Lighting/Lamps & light fixtures/Ceiling lights/Ceiling track lighting,Cookware & tableware/Drinkware/Glasses,Home Décor/Flower pots & stands/Indoor plant pots,Home Décor/Flower pots & stands/Indoor plant pots,Home Décor/Flower pots & stands/Indoor plant pots,Home Décor/Flower pots & stands/Indoor plant pots,Home Décor/Flower pots & stands/Indoor plant pots,Home Décor/Flower pots & stands/Indoor plant pots,Storage & organization/Storage solution systems/PAX system/Knobs & handles,Bathroom/Bathroom faucets/Faucets,Bathroom/Bathroom faucets/Faucets,Bathroom/Bathroom faucets/Faucets,Bathroom/Bathroom faucets/Faucets,Bathroom/Bathroom faucets/Faucets,Bathroom/Bathroom faucets/Faucets,Bathroom/Bathroom faucets/Faucets,Bathroom/Bathroom faucets/Faucets,Bathroom/Bathroom faucets/Faucets,Bathroom/Bathroom faucets/Faucets,Bathroom/Bathroom faucets/Faucets,Bathroom/Bathroom faucets/Faucets,Lighting/Integrated lighting/Bookcase lighting,Kitchen & appliances/Kitchen faucets & sinks/Kitchen faucets,Kitchen & appliances/Kitchen faucets & sinks/Kitchen faucets,Cookware & tableware/Drinkware/Pitchers & carafes,Lighting/Smart lighting/Remote & smart light switches,Lighting/Lamps & light fixtures/Ceiling lights/Pendants lights,Kitchen & appliances/Kitchen faucets & sinks/Kitchen faucets,Lighting/Lamps & light fixtures/Ceiling lights/Ceiling track lighting,Lighting/Lamps & light fixtures/Ceiling lights/Ceiling track lighting,Lighting/Lamps & light fixtures/Ceiling lights/Ceiling track lighting,Lighting/Lamps & light fixtures/Ceiling lights/Ceiling track lighting,Lighting/Lamps & light fixtures/Ceiling lights/Pendants lights,Lighting/Lamps & light fixtures/Ceiling lights/Pendants lights,Lighting/Lamps & light fixtures/Ceiling lights/Pendants lights,Lighting/Lamps & light fixtures/Table lamps,Lighting/Lamps & light fixtures/Ceiling lights/Ceiling lamps,Lighting/Lamps & light fixtures/Wall lamps/Wall lamps,Lighting/Lamps & light fixtures/Ceiling lights/Ceiling lamps,Lighting/Lamps & light fixtures/Ceiling lights/Ceiling lamps,Lighting/Lamps & light fixtures/Ceiling lights/Pendants lights,Lighting/Lamps & light fixtures/Floor lamps/FLUGBO Floor uplt,Kitchen & appliances/Kitchen lighting,Lighting/Lamps & light fixtures/Ceiling lights/Ceiling track lighting,Lighting/Lamps & light fixtures/Ceiling lights/Ceiling track lighting,Lighting/Lamps & light fixtures/Table lamps,Kitchen & appliances/Kitchen drawer organization/Drawer dividers,Lighting/Smart lighting/Smart lighting kits,Lighting/Decorative lighting/Decorative indoor lighting,Lighting/Decorative lighting/Decorative indoor lighting,Lighting/Decorative lighting/Decorative indoor lighting,Lighting/Decorative lighting/Decorative indoor lighting,Lighting/Decorative lighting/Decorative indoor lighting,Home Décor/Candle holders & candles/Candle holders,Storage & organization/Storage solution systems/PAX system/Knobs & handles,Kitchen & appliances/Kitchen faucets & sinks/Kitchen faucets,Cookware & tableware/Cookware & kitchenware/Cooking accessories,Cookware & tableware/Cookware & kitchenware/Cooking accessories,Home electronics/Cords & chargers/Cables & accessories,Cookware & tableware/Kitchen & cooking accessories/Kitchen utensils/Cooking preparation tools,Lighting/Lamps & light fixtures/Floor lamps/ARÖD Floor,Lighting/Lamps & light fixtures/Desk lamps,Lighting/Lamps & light fixtures/Desk lamps,Lighting/Smart lighting/Remote & smart light switches,Lighting/Lamps & light fixtures/Desk lamps,Lighting/Lamps & light fixtures/Desk lamps,Lighting/Lamps & light fixtures/Desk lamps
Home Décor/Mirrors/Wall mirrors,Lighting/Lamps & light fixtures/Ceiling lights/Pendants lights,Home Décor/Mirrors/Vanity mirrors,Home Décor/Mirrors/Vanity mirrors,Home Décor/Clocks/Wall & table clocks,Lighting/Decorative lighting/Decorative indoor lighting,Baby & kids/Kids/Toys & play/Role play,Baby & kids/Kids/Toys & play/Role play,Storage & organization/Storage containers/Bathroom accessories/Soap dispensers & soap dishes,Home Décor/Candle holders & candles/Candle holders,Cookware & tableware/Serveware/Bowls,Home Décor/Mirrors/Round mirrors,Lighting/Lamps & light fixtures/Wall lamps/Wall lamps,Cookware & tableware/Flatware/Kids cutlery,Kitchen & appliances/Kitchen faucets & sinks/Kitchen faucets,Bathroom/Bathroom faucets/Faucets,Cookware & tableware/Drinkware/Specialty glassware,Home Décor/Mirrors/Vanity mirrors,Cookware & tableware/Knives & cutting boards/Kitchen knives,Home Décor/Mirrors/Wall mirrors,Kitchen & appliances/Appliances/Range hoods & filters/Wall mounted range hoods,Cookware & tableware/Drinkware/Drinking accessories,Gardening & plants/Plant stands & movers,Gardening & plants/Plant stands & movers,Kitchen & appliances/Kitchen faucets & sinks/Kitchen faucets,Cookware & tableware/Knives & cutting boards/Kitchen knives,Lighting/Lamps & light fixtures/Floor lamps,Cookware & tableware/Coffee & tea/Tea pots & accessories,Cookware & tableware/Kitchen & cooking accessories/Kitchen utensils/Cooking preparation tools,Cookware & tableware/Coffee & tea/Tea pots & accessories,Lighting/Integrated lighting/Bookcase lighting,Lighting/Lamps & light fixtures/Wall lamps/Wall spotlights,Lighting/Integrated lighting/Bookcase lighting,Lighting/Lamps & light fixtures/Wall lamps/Wall spotlights,Lighting/Bathroom lighting/Bathroom vanity lights,Lighting/Bathroom lighting/Bathroom vanity lights,Lighting/Bathroom lighting/Bathroom vanity lights,Home Décor/Decorative accessories,Home Décor/Decorative accessories,Home Décor/Decorative accessories,Home Décor/Decorative accessories,Cookware & tableware/Coffee & tea/Coffee makers & accessories,Home Décor/Flower pots & stands/Indoor plant pots,Cookware & tableware/Flatware/Flatware,Cookware & tableware/Bakeware/Baking pans & molds,Kitchen & appliances/Kitchen faucets & sinks/Kitchen faucets,Cookware & tableware/Coffee & tea/Tea pots & accessories,Lighting/Lamps & light fixtures/Floor lamps/ISJAKT LED floor uplighter,Cookware & tableware/Kitchen & cooking accessories/Kitchen utensils/Cooking preparation tools,Home Décor/Decorative accessories,Cookware & tableware/Flatware/Flatware,Cookware & tableware/Serveware/Serving dishes,Kitchen & appliances/Kitchen systems/SEKTION kitchen/SEKTION kitchen cabinets,Cookware & tableware/Dishwashing accessories/Sink accessories,Cookware & tableware/Coffee & tea/Vacuum flasks,Baby & kids/Kids/Toys & play/Wooden toys,Cookware & tableware/Knives & cutting boards/Kitchen knives,Home Décor/Mirrors/Large mirrors,Home electronics/Speakers/Wi-Fi speakers,Lighting/Lamps & light fixtures/Table lamps,Home electronics/Speakers/Wi-Fi speakers,Home Textiles/Window treatments/Curtain rods & rails/Curtain rods,Kitchen & appliances/Kitchen faucets & sinks/Kitchen faucets,Storage & organization/Wall shelves & hooks/Hooks,Home Décor/Mirrors/Wall mirrors,Home Décor/Mirrors/Vanity mirrors,Cookware & tableware/Coffee & tea/Coffee makers & accessories,Lighting/Lamps & light fixtures/Ceiling lights/Pendants lights,"Outdoor/Outdoor storage benches, boxes & cabinets",Gardening & plants/Watering cans,Gardening & plants/Watering cans,Gardening & plants/Watering cans,Cookware & tableware/Drinkware/Pitchers & carafes,Home Textiles/Window treatments/Curtain rods & rails/Curtain rods,Home Textiles/Window treatments/Curtain rods & rails/Curtain rods,Home Textiles/Window treatments/Curtain rods & rails/Curtain rods,Home Textiles/Window treatments/Curtain rods & rails/Curtain rods,Home Textiles/Window treatments/Curtain rods & rails/Curtain rods,Home Textiles/Window treatments/Curtain rods & rails/Curtain rods,Home Textiles/Window treatments/Curtain rods & rails/Curtain rods,Cookware & tableware/Kitchen & cooking accessories/Kitchen utensils/Colanders & strainers,Cookware & tableware/Kitchen & cooking accessories/Kitchen utensils/Colanders & strainers,Cookware & tableware/Flatware/Flatware,Home electronics/Cords & chargers/Batteries & battery chargers,Home electronics/Cords & chargers/Batteries & battery chargers,Home electronics/Cords & chargers/Batteries & battery chargers,Cookware & tableware/Coffee & tea/Vacuum flasks,Cookware & tableware/Kitchen & cooking accessories/Kitchen utensils/Colanders & strainers,Cookware & tableware/Serveware/Trays,Cookware & tableware/Knives & cutting boards/Kitchen knives,Cookware & tableware/Knives & cutting boards/Kitchen knives,Kitchen & appliances/Appliances/Dishwashers,Home electronics/Cords & chargers/Cables & accessories,Home electronics/Cords & chargers/Cables & accessories,Storage & organization/Storage containers/Food storage & organizing/Jars & tins,Lighting/Lamps & light fixtures/Ceiling lights/Pendants lights,Cookware & tableware/Kitchen & cooking accessories/Kitchen utensils/Cooking preparation tools,Cookware & tableware/Drinkware/Glasses,Home electronics/Cords & chargers/Cables & accessories,Storage & organization/Storage containers/Bathroom accessories/Towel rails & towel holders
Cookware & tableware/Coffee & tea/Mugs & cups,Storage & organization/Storage containers/Food storage & organizing/Spice & condiment stands,Home Décor/Mirrors/Wall mirrors,Home Décor/Mirrors/Wall mirrors,Home Décor/Mirrors/Wall mirrors,Storage & organization/Storage solution systems/PAX system/PAX doors without hinges,Storage & organization/Storage solution systems/PAX system/PAX doors without hinges,Storage & organization/Storage solution systems/PAX system/PAX doors without hinges,Home Textiles/Window treatments/Curtain rods & rails/Curtain rods,Home Textiles/Window treatments/Curtain rods & rails/Curtain rods,Home Décor/Clocks/Wall & table clocks,Home Décor/Clocks/Wall & table clocks,Home Décor/Clocks/Wall & table clocks,Home Décor/Clocks/Wall & table clocks,Home Décor/Clocks/Wall & table clocks,Baby & kids/Kids/Toys & play/Wooden toys,Cookware & tableware/Dinnerware/Bowls,Cookware & tableware/Dinnerware/Bowls,Cookware & tableware/Drinkware/Pitchers & carafes,Cookware & tableware/Drinkware/Specialty glassware,Cookware & tableware/Dinnerware/Deep plates/VARDAGEN Deep plate,Cookware & tableware/Coffee & tea/Mugs & cups,Cookware & tableware/Dinnerware/Plates,Cookware & tableware/Serveware/Bowls,Cookware & tableware/Serveware/Serving dishes,Cookware & tableware/Dinnerware/Side plates,Cookware & tableware/Table linen/Table cloths & runners,Cookware & tableware/Coffee & tea/Mugs & cups,Outdoor/Grills,Outdoor/Grills,Storage & organization/Storage containers/Bathroom accessories/Toilet brushes,Storage & organization/Storage containers/Food storage & organizing/Food containers,Storage & organization/Storage containers/Food storage & organizing/Food containers,Storage & organization/Storage containers/Food storage & organizing/Food containers,Storage & organization/Storage containers/Food storage & organizing/Food containers,Outdoor/Grills,Cookware & tableware/Dinnerware/Plates,Home Décor/Flower pots & stands/Indoor plant pots,Cookware & tableware/Dinnerware/Side plates,Cookware & tableware/Serveware/Bowls,Cookware & tableware/Dinnerware/Plates,Cookware & tableware/Dinnerware/Deep plates/OFTAST Deep plate,Cookware & tableware/Dinnerware/Bowls,Cookware & tableware/Dinnerware/Bowls,Home Décor/Clocks/Wall & table clocks,Storage & organization/Storage containers/Food storage & organizing/Spice & condiment stands,Storage & organization/Storage containers/Bathroom accessories/Towel rails & towel holders,Storage & organization/Storage containers/Bathroom accessories/Towel rails & towel holders,Storage & organization/Storage containers/Bathroom accessories/Towel rails & towel holders,Bathroom/Bathroom textiles/Shower curtains,Bathroom/Bathroom textiles/Shower curtains,Bathroom/Bathroom textiles/Shower curtains,Home improvement/Home safety/Child safety,Cookware & tableware/Napkins & napkin holders/Napkins,Cookware & tableware/Serveware/Trays,Home Décor/Mirrors/Wall mirrors,Storage & organization/Storage containers/Bathroom accessories/Bathroom accessory sets,Home Décor/Mirrors/Wall mirrors,Home Textiles/Window treatments/Curtains & drapes/Light filtering curtains,Home electronics/Cords & chargers/Wireless charging & accessories,Home electronics/Cords & chargers/Wireless charging & accessories,Home electronics/Cords & chargers/Wireless charging & accessories,Home Textiles/Window treatments/Curtain rods & rails/Curtain rods,Cookware & tableware/Table linen/Place mats & coasters,Cookware & tableware/Table linen/Place mats & coasters,Cookware & tableware/Table linen/Place mats & coasters,Cookware & tableware/Table linen/Place mats & coasters,Home Décor/Flower pots & stands/Indoor plant pots,Pet accessories/Cats,Kitchen & appliances/Kitchen islands & carts,Kitchen & appliances/Kitchen islands & carts,Cookware & tableware/Drinkware/Glasses,Storage & organization/Storage containers/Food storage & organizing/Food containers,Baby & kids/Baby/Baby toys/12+ months,Cookware & tableware/Bakeware/Mixing bowls,Cookware & tableware/Dishwashing accessories/Dish brushes,Storage & organization/Storage solution systems/BESTÅ storage system/BESTÅ all parts & accessories,Lighting/Lamps & light fixtures/Kids lighting,Home Décor/Flower pots & stands/Indoor plant pots,Cookware & tableware/Flatware/Flatware,Lighting/Lamps & light fixtures/Kids lighting,Lighting/Lamps & light fixtures/Kids lighting,Cookware & tableware/Drinkware/Pitchers & carafes,Kitchen & appliances/Kitchen drawer organization/Kitchen trash cans & bins,Cookware & tableware/Cookware & kitchenware/Cooking accessories,Cookware & tableware/Dinnerware/Dinnerware sets,Storage & organization/Storage solution systems/PAX system/PAX doors without hinges,Baby & kids/Kids/Toys & play/Role play,Cookware & tableware/Dinnerware/Side plates,Home Décor/Flower pots & stands/Indoor plant pots,Cookware & tableware/Knives & cutting boards/Kitchen knives,Cookware & tableware/Coffee & tea/Vacuum flasks,Baby & kids/Kids/Toys & play/Soft toys,Storage & organization/Storage solution systems/PAX system/PAX sliding doors,Storage & organization/Storage solution systems/PAX system/PAX sliding doors,Storage & organization/Storage solution systems/PAX system/PAX sliding doors,Home Textiles/Window treatments/Curtain rods & rails/Curtain rods,Furniture/Tables & desks/Accent tables/Coffee tables,Baby & kids/Kids/Toys & play/Soft toys,Baby & kids/Kids/Toys & play/Soft toys
Storage & organization/Storage solution systems/PAX system/PAX sliding doors,Furniture/Tables & desks/Desks & computer desks/Desks for home,Baby & kids/Kids/Toys & play/Physical play,Cookware & tableware/Knives & cutting boards/Cutting boards,Cookware & tableware/Knives & cutting boards/Cutting boards,Cookware & tableware/Knives & cutting boards/Cutting boards,Cookware & tableware/Dinnerware/Deep plates/VÄRDERA Deep plate,Home Décor/Mirrors/Vanity mirrors,Home Décor/Mirrors/Wall mirrors,Home Décor/Mirrors/Wall mirrors,Rugs/Rugs/Runners & small rugs,Rugs/Rugs/Runners & small rugs,Home improvement/Home safety/Child safety,Home Textiles/Window treatments/Curtain rods & rails/Curtain rods,Furniture/Tables & desks/Nightstands,Home Textiles/Window treatments/Curtain rods & rails/Track systems,Storage & organization/Wall shelves & hooks/Hooks,Home Décor/Wall décor/Picture & photo frames,Storage & organization/Storage containers/Food storage & organizing/Food containers,Home Textiles/Window treatments/Curtain rods & rails/Curtain rods,Cookware & tableware/Knives & cutting boards/Cutting boards,Storage & organization/Clothes organizers/Clothes racks & stands,Home improvement/Home safety/Child safety,Furniture/Patio furniture/Outdoor tables/Outdoor dining tables,Home Décor/Wall décor/Collage picture frames,Kitchen & appliances/Kitchen systems/SEKTION kitchen/SEKTION kitchen cabinets,Kitchen & appliances/Kitchen systems/SEKTION kitchen/SEKTION kitchen cabinets,Kitchen & appliances/Kitchen systems/SEKTION kitchen/SEKTION kitchen cabinets,Kitchen & appliances/Kitchen systems/SEKTION kitchen/SEKTION kitchen cabinets,Kitchen & appliances/Kitchen systems/SEKTION kitchen/SEKTION kitchen cabinets,Home Textiles/Window treatments/Curtain rods & rails/Track systems,Home Textiles/Window treatments/Curtain rods & rails/Track systems,Home Textiles/Window treatments/Curtain rods & rails/Track systems,Home Textiles/Window treatments/Curtain rods & rails/Track systems,Furniture/Room dividers,Cookware & tableware/Dinnerware/Side plates,Furniture/Tables & desks/Dining tables/Up to 6 seats,Storage & organization/Storage solution systems/BESTÅ storage system/BESTÅ all parts & accessories,Bathroom/Bathroom storage/Bathroom shelving units,Home Décor/Storage boxes & baskets/Kids boxes & baskets,Furniture/Patio furniture/Outdoor tables/Outdoor dining tables,Home Décor/Storage boxes & baskets/Clothes boxes,Furniture/Tables & desks/Accent tables/End tables & side tables,Storage & organization/Storage containers/Bathroom accessories/Towel rails & towel holders,Home Textiles/Window treatments/Curtains & drapes/Panel curtains,Outdoor/Outdoor flooring,Outdoor/Outdoor flooring,Outdoor/Outdoor flooring,Cookware & tableware/Dinnerware/Plates,Laundry & cleaning/Cleaning accessories,Home Décor/Decorative accessories,Outdoor/Umbrellas & gazebos/Patio umbrellas & bases,Furniture/Patio furniture/Outdoor tables/Outdoor coffee & side tables,Home Décor/Wall décor/Picture & photo frames,Home Décor/Wall décor/Picture & photo frames,Home Décor/Wall décor/Picture & photo frames,Home Décor/Wall décor/Picture & photo frames,Furniture/Chairs/Dining chairs/Dining chairs,Furniture/Sofas & sectionals/Ottomans/Fabric ottomans,Storage & organization/Bags/Bag organizers,Storage & organization/Storage containers/Food storage & organizing/Food containers,Home Décor/Wall décor/Picture & photo frames,Home Décor/Wall décor/Picture & photo frames,Home Décor/Wall décor/Wall decals & stickers,Furniture/Tables & desks/Dining tables/Up to 10 seats,Home Textiles/Window treatments/Curtain rods & rails/Track systems,Furniture/Patio furniture/Outdoor tables/Outdoor dining tables,Storage & organization/Armoires & wardrobes/Solitaire wardrobes,Furniture/Tables & desks/Accent tables/Coffee tables,Furniture/Chairs/Stools & benches/Stools,Furniture/Chairs/Bar stools & chairs,Storage & organization/Clothes organizers/Shoe racks & stands,Furniture/Tables & desks/Accent tables/End tables & side tables,Cookware & tableware/Dishwashing accessories/Dish brushes,Furniture/Tables & desks/Accent tables/End tables & side tables,Home Décor/Mirrors/Makeup & magnifying mirrors,Kitchen & appliances/Kitchen islands & carts,Cookware & tableware/Cookware & kitchenware/Cooking accessories,Furniture/Patio furniture/Outdoor benches,Home Décor/Wall décor/Picture & photo frames,Home Décor/Wall décor/Picture & photo frames,Home Décor/Wall décor/Picture & photo frames,Home Décor/Wall décor/Picture & photo frames,Furniture/Tables & desks/Bar tables,Furniture/Tables & desks/Café tables,Furniture/Tables & desks/Dining tables/Dining table tops & underframes,Kitchen & appliances/Kitchen countertops/Butcher block countertops,Kitchen & appliances/Kitchen countertops/Butcher block countertops,Kitchen & appliances/Kitchen countertops/Butcher block countertops,Kitchen & appliances/Kitchen countertops/Butcher block countertops,Kitchen & appliances/Kitchen countertops/Butcher block countertops,Kitchen & appliances/Kitchen countertops/Butcher block countertops,Rugs/Rugs/Door mats,Furniture/Patio furniture/Outdoor chairs/Outdoor dining chairs,Kitchen & appliances/Kitchen drawer organization/Kitchen trash cans & bins,Furniture/Patio furniture/Outdoor tables/Outdoor dining tables,Furniture/Patio furniture/Outdoor chairs/Outdoor dining chairs,Furniture/Patio furniture/Outdoor tables/Outdoor dining tables,Furniture/Tables & desks/Kids tables,Home Décor/Storage boxes & baskets/Kids boxes & baskets
