Home Décor/Flower pots & stands/Indoor plant pots,Home Décor/Flower pots & stands/Indoor plant pots,Home Décor/Flower pots & stands/Indoor plant pots,Home Décor/Flower pots & stands/Indoor plant pots,Home Décor/Flower pots & stands/Indoor plant pots,Home Décor/Flower pots & stands/Indoor plant pots,Home Décor/Flower pots & stands/Indoor plant pots,Home Décor/Flower pots & stands/Indoor plant pots,Home Décor/Flower pots & stands/Indoor plant pots,Home Décor/Flower pots & stands/Indoor plant pots,Bathroom/Bathroom faucets/Faucets,Lighting/Lamps & light fixtures/Ceiling lights/Pendants lights,Cookware & tableware/Flatware/Flatware,Kitchen & appliances/Kitchen faucets & sinks/Kitchen faucets,Lighting/Lamps & light fixtures/Desk lamps,Lighting/Integrated lighting/Bookcase lighting,Kitchen & appliances/Kitchen lighting,Lighting/Smart lighting/Smart lighting kits,Lighting/Integrated lighting/Bookcase lighting,Cookware & tableware/Coffee & tea/Tea pots & accessories,Bathroom/Bathroom faucets/Faucets,Kitchen & appliances/Kitchen faucets & sinks/Kitchen faucets,Kitchen & appliances/Kitchen faucets & sinks/Kitchen faucets,"Lighting/Lamps & light fixtures/Shades, bases & cords/Lamp bases & cords",Bathroom/Bathroom faucets/Faucets,Home Décor/Flower pots & stands/Self watering plant pots,Cookware & tableware/Cookware & kitchenware/Pots & pans/Cooking & stock pots,Lighting/Integrated lighting/Bookcase lighting,Lighting/Lamps & light fixtures/Wall lamps/Wall lamps,Home Décor/Flower pots & stands/Indoor plant pots,Lighting/Lamps & light fixtures/Ceiling lights/Pendants lights,Lighting/Smart lighting/Remote & smart light switches,Lighting/Integrated lighting/Bookcase lighting,Lighting/Lamps & light fixtures/Ceiling lights/Ceiling track lighting,Lighting/Lamps & light fixtures/Ceiling lights/Ceiling track lighting,Cookware & tableware/Drinkware/Glasses,Kitchen & appliances/Kitchen faucets & sinks/Kitchen faucets,Kitchen & appliances/Kitchen faucets & sinks/Kitchen faucets,Storage & organization/Storage solution systems/PAX system/Knobs & handles,Lighting/Smart lighting/Remote & smart light switches,Home Décor/Flower pots & stands/Indoor plant pots,Home Décor/Flower pots & stands/Indoor plant pots,Home Décor/Flower pots & stands/Indoor plant pots,Home Décor/Flower pots & stands/Indoor plant pots,Home Décor/Flower pots & stands/Indoor plant pots,Home Décor/Flower pots & stands/Indoor plant pots,Bathroom/Bathroom faucets/Faucets,Bathroom/Bathroom faucets/Faucets,Bathroom/Bathroom faucets/Faucets,Bathroom/Bathroom faucets/Faucets,Bathroom/Bathroom faucets/Faucets,Bathroom/Bathroom faucets/Faucets,Bathroom/Bathroom faucets/Faucets,Bathroom/Bathroom faucets/Faucets,Bathroom/Bathroom faucets/Faucets,Bathroom/Bathroom faucets/Faucets,Bathroom/Bathroom faucets/Faucets,Bathroom/Bathroom faucets/Faucets,Kitchen & appliances/Kitchen faucets & sinks/Kitchen faucets,Kitchen & appliances/Kitchen lighting,Cookware & tableware/Drinkware/Pitchers & carafes,Lighting/Lamps & light fixtures/Ceiling lights/Pendants lights,Lighting/Lamps & light fixtures/Floor lamps/FLUGBO Floor uplt,Lighting/Lamps & light fixtures/Table lamps,Lighting/Lamps & light fixtures/Ceiling lights/Ceiling lamps,Lighting/Lamps & light fixtures/Ceiling lights/Pendants lights,Lighting/Lamps & light fixtures/Ceiling lights/Pendants lights,Lighting/Lamps & light fixtures/Ceiling lights/Pendants lights,Lighting/Lamps & light fixtures/Ceiling lights/Ceiling lamps,Lighting/Lamps & light fixtures/Wall lamps/Wall lamps,Lighting/Lamps & light fixtures/Ceiling lights/Ceiling lamps,Lighting/Lamps & light fixtures/Ceiling lights/Pendants lights,Lighting/Lamps & light fixtures/Ceiling lights/Ceiling track lighting,Lighting/Lamps & light fixtures/Ceiling lights/Ceiling track lighting,Kitchen & appliances/Kitchen faucets & sinks/Kitchen faucets,Lighting/Smart lighting/Smart lighting kits,Lighting/Lamps & light fixtures/Ceiling lights/Ceiling track lighting,Lighting/Lamps & light fixtures/Ceiling lights/Ceiling track lighting,Lighting/Lamps & light fixtures/Ceiling lights/Ceiling track lighting,Lighting/Lamps & light fixtures/Ceiling lights/Ceiling track lighting,Home electronics/Cords & chargers/Cables & accessories,Lighting/Lamps & light fixtures/Desk lamps,Lighting/Lamps & light fixtures/Desk lamps,Lighting/Lamps & light fixtures/Desk lamps,Lighting/Lamps & light fixtures/Desk lamps,Cookware & tableware/Kitchen & cooking accessories/Kitchen utensils/Cooking preparation tools,Kitchen & appliances/Kitchen drawer organization/Drawer dividers,Lighting/Smart lighting/Remote & smart light switches,Home Décor/Candle holders & candles/Candle holders,Lighting/Lamps & light fixtures/Desk lamps,Lighting/Lamps & light fixtures/Floor lamps/ARÖD Floor,Lighting/LED Light bulbs,Lighting/LED Light bulbs,Storage & organization/Storage solution systems/PAX system/Knobs & handles,Cookware & tableware/Cookware & kitchenware/Cooking accessories,Cookware & tableware/Cookware & kitchenware/Cooking accessories,Lighting/Lamps & light fixtures/Table lamps,Lighting/Decorative lighting/Decorative indoor lighting,Lighting/Decorative lighting/Decorative indoor lighting,Lighting/Decorative lighting/Decorative indoor lighting
Home Décor/Mirrors/Wall mirrors,Lighting/Lamps & light fixtures/Ceiling lights/Pendants lights,Baby & kids/Kids/Toys & play/Role play,Baby & kids/Kids/Toys & play/Role play,Home Décor/Candle holders & candles/Candle holders,Home Décor/Clocks/Wall & table clocks,Home Décor/Mirrors/Round mirrors,Lighting/Decorative lighting/Decorative indoor lighting,Lighting/Lamps & light fixtures/Wall lamps/Wall lamps,Storage & organization/Storage containers/Bathroom accessories/Soap dispensers & soap dishes,Home Décor/Mirrors/Vanity mirrors,Home Décor/Mirrors/Vanity mirrors,Cookware & tableware/Knives & cutting boards/Kitchen knives,Kitchen & appliances/Kitchen faucets & sinks/Kitchen faucets,Bathroom/Bathroom faucets/Faucets,Cookware & tableware/Serveware/Bowls,Cookware & tableware/Flatware/Kids cutlery,Lighting/Lamps & light fixtures/Floor lamps,Gardening & plants/Plant stands & movers,Gardening & plants/Plant stands & movers,Kitchen & appliances/Appliances/Range hoods & filters/Wall mounted range hoods,Cookware & tableware/Drinkware/Specialty glassware,Home Décor/Mirrors/Vanity mirrors,Home Décor/Mirrors/Wall mirrors,Cookware & tableware/Knives & cutting boards/Kitchen knives,Cookware & tableware/Drinkware/Drinking accessories,Cookware & tableware/Kitchen & cooking accessories/Kitchen utensils/Cooking preparation tools,Cookware & tableware/Coffee & tea/Tea pots & accessories,Lighting/Lamps & light fixtures/Wall lamps/Wall spotlights,Lighting/Lamps & light fixtures/Wall lamps/Wall spotlights,Lighting/Integrated lighting/Bookcase lighting,Cookware & tableware/Coffee & tea/Tea pots & accessories,Lighting/Bathroom lighting/Bathroom vanity lights,Lighting/Bathroom lighting/Bathroom vanity lights,Lighting/Bathroom lighting/Bathroom vanity lights,Lighting/Integrated lighting/Bookcase lighting,Kitchen & appliances/Kitchen faucets & sinks/Kitchen faucets,Cookware & tableware/Bakeware/Baking pans & molds,Home Décor/Decorative accessories,Home Décor/Decorative accessories,Home Décor/Decorative accessories,Home Décor/Decorative accessories,Cookware & tableware/Coffee & tea/Coffee makers & accessories,Home Décor/Flower pots & stands/Indoor plant pots,Cookware & tableware/Coffee & tea/Tea pots & accessories,Cookware & tableware/Coffee & tea/Vacuum flasks,Cookware & tableware/Flatware/Flatware,Lighting/Lamps & light fixtures/Floor lamps/ISJAKT LED floor uplighter,Cookware & tableware/Dishwashing accessories/Sink accessories,Cookware & tableware/Flatware/Flatware,Cookware & tableware/Kitchen & cooking accessories/Kitchen utensils/Cooking preparation tools,Cookware & tableware/Serveware/Serving dishes,Home Décor/Decorative accessories,Kitchen & appliances/Kitchen systems/SEKTION kitchen/SEKTION kitchen cabinets,Home electronics/Speakers/Wi-Fi speakers,Home electronics/Speakers/Wi-Fi speakers,Kitchen & appliances/Kitchen faucets & sinks/Kitchen faucets,Home Textiles/Window treatments/Curtain rods & rails/Curtain rods,Cookware & tableware/Knives & cutting boards/Kitchen knives,Cookware & tableware/Coffee & tea/Coffee makers & accessories,Lighting/Lamps & light fixtures/Table lamps,Kitchen & appliances/Kitchen faucets & sinks/Kitchen faucets,Baby & kids/Kids/Toys & play/Wooden toys,Cookware & tableware/Coffee & tea/Vacuum flasks,Home Décor/Mirrors/Large mirrors,Cookware & tableware/Kitchen & cooking accessories/Kitchen utensils/Colanders & strainers,Cookware & tableware/Kitchen & cooking accessories/Kitchen utensils/Colanders & strainers,Home Décor/Mirrors/Wall mirrors,Home Décor/Mirrors/Vanity mirrors,Gardening & plants/Watering cans,Gardening & plants/Watering cans,Gardening & plants/Watering cans,Cookware & tableware/Drinkware/Pitchers & carafes,Cookware & tableware/Kitchen & cooking accessories/Kitchen utensils/Colanders & strainers,Lighting/Lamps & light fixtures/Ceiling lights/Pendants lights,Storage & organization/Wall shelves & hooks/Hooks,Home electronics/Cords & chargers/Cables & accessories,"Outdoor/Outdoor storage benches, boxes & cabinets",Cookware & tableware/Knives & cutting boards/Kitchen knives,Cookware & tableware/Knives & cutting boards/Kitchen knives,Cookware & tableware/Serveware/Trays,Storage & organization/Storage containers/Food storage & organizing/Jars & tins,Home Textiles/Window treatments/Curtain rods & rails/Curtain rods,Home Textiles/Window treatments/Curtain rods & rails/Curtain rods,Home Textiles/Window treatments/Curtain rods & rails/Curtain rods,Home Textiles/Window treatments/Curtain rods & rails/Curtain rods,Home Textiles/Window treatments/Curtain rods & rails/Curtain rods,Home Textiles/Window treatments/Curtain rods & rails/Curtain rods,Home Textiles/Window treatments/Curtain rods & rails/Curtain rods,Cookware & tableware/Flatware/Flatware,Cookware & tableware/Drinkware/Glasses,Kitchen & appliances/Appliances/Dishwashers,Storage & organization/Storage containers/Bathroom accessories/Towel rails & towel holders,Storage & organization/Storage containers/Bathroom accessories/Towel rails & towel holders,Kitchen & appliances/Appliances/Dishwashers,Home Décor/Clocks/Wall & table clocks/KLOCKIS Clock/thermometer,Cookware & tableware/Drinkware/Pitchers & carafes,Cookware & tableware/Kitchen & cooking accessories/Kitchen utensils/Cooking preparation tools,Lighting/Lamps & light fixtures/Ceiling lights/Pendants lights,Cookware & tableware/Dishwashing accessories/Dish drainers & drying racks
Cookware & tableware/Coffee & tea/Mugs & cups,Home Décor/Mirrors/Wall mirrors,Home Décor/Mirrors/Wall mirrors,Home Décor/Mirrors/Wall mirrors,Storage & organization/Storage containers/Food storage & organizing/Spice & condiment stands,Storage & organization/Storage solution systems/PAX system/PAX doors without hinges,Storage & organization/Storage solution systems/PAX system/PAX doors without hinges,Storage & organization/Storage solution systems/PAX system/PAX doors without hinges,Home Textiles/Window treatments/Curtain rods & rails/Curtain rods,Home Textiles/Window treatments/Curtain rods & rails/Curtain rods,Storage & organization/Storage containers/Bathroom accessories/Toilet brushes,Home Décor/Clocks/Wall & table clocks,Home Décor/Clocks/Wall & table clocks,Home Décor/Clocks/Wall & table clocks,Home Décor/Clocks/Wall & table clocks,Home Décor/Clocks/Wall & table clocks,Outdoor/Grills,Outdoor/Grills,Baby & kids/Kids/Toys & play/Wooden toys,Cookware & tableware/Dinnerware/Deep plates/VARDAGEN Deep plate,Cookware & tableware/Dinnerware/Bowls,Cookware & tableware/Drinkware/Pitchers & carafes,Cookware & tableware/Coffee & tea/Mugs & cups,Cookware & tableware/Drinkware/Specialty glassware,Cookware & tableware/Coffee & tea/Mugs & cups,Cookware & tableware/Dinnerware/Plates,Cookware & tableware/Serveware/Bowls,Cookware & tableware/Dinnerware/Side plates,Cookware & tableware/Table linen/Table cloths & runners,Cookware & tableware/Serveware/Serving dishes,Cookware & tableware/Dinnerware/Bowls,Storage & organization/Storage containers/Food storage & organizing/Food containers,Home electronics/Cords & chargers/Wireless charging & accessories,Home electronics/Cords & chargers/Wireless charging & accessories,Home electronics/Cords & chargers/Wireless charging & accessories,Storage & organization/Storage containers/Food storage & organizing/Food containers,Storage & organization/Storage containers/Food storage & organizing/Food containers,Storage & organization/Storage containers/Food storage & organizing/Food containers,Outdoor/Grills,Home improvement/Home safety/Child safety,Cookware & tableware/Serveware/Bowls,Cookware & tableware/Dinnerware/Side plates,Cookware & tableware/Dinnerware/Deep plates/OFTAST Deep plate,Cookware & tableware/Dinnerware/Bowls,Cookware & tableware/Dinnerware/Bowls,Cookware & tableware/Dinnerware/Plates,Cookware & tableware/Dinnerware/Plates,Home Décor/Flower pots & stands/Indoor plant pots,Storage & organization/Storage containers/Bathroom accessories/Towel rails & towel holders,Storage & organization/Storage containers/Bathroom accessories/Towel rails & towel holders,Storage & organization/Storage containers/Bathroom accessories/Towel rails & towel holders,Home Décor/Clocks/Wall & table clocks,Bathroom/Bathroom textiles/Shower curtains,Bathroom/Bathroom textiles/Shower curtains,Bathroom/Bathroom textiles/Shower curtains,Storage & organization/Storage containers/Food storage & organizing/Spice & condiment stands,Home Décor/Flower pots & stands/Indoor plant pots,Cookware & tableware/Drinkware/Glasses,Cookware & tableware/Serveware/Trays,Cookware & tableware/Napkins & napkin holders/Napkins,Home Décor/Mirrors/Wall mirrors,Home Décor/Mirrors/Wall mirrors,Home Textiles/Window treatments/Curtain rods & rails/Curtain rods,Home Textiles/Window treatments/Curtains & drapes/Light filtering curtains,Cookware & tableware/Table linen/Place mats & coasters,Cookware & tableware/Table linen/Place mats & coasters,Cookware & tableware/Table linen/Place mats & coasters,Cookware & tableware/Table linen/Place mats & coasters,Storage & organization/Storage containers/Bathroom accessories/Bathroom accessory sets,Baby & kids/Baby/Baby toys/12+ months,Kitchen & appliances/Kitchen islands & carts,Kitchen & appliances/Kitchen islands & carts,Storage & organization/Storage containers/Food storage & organizing/Food containers,Cookware & tableware/Cookware & kitchenware/Cooking accessories,Kitchen & appliances/Kitchen drawer organization/Kitchen trash cans & bins,Pet accessories/Cats,Cookware & tableware/Coffee & tea/Vacuum flasks,Storage & organization/Storage solution systems/BESTÅ storage system/BESTÅ all parts & accessories,Cookware & tableware/Drinkware/Pitchers & carafes,Lighting/Lamps & light fixtures/Kids lighting,Home Décor/Flower pots & stands/Indoor plant pots,Bathroom/Showers/Shower heads,Storage & organization/Storage solution systems/PAX system/PAX doors without hinges,Cookware & tableware/Dishwashing accessories/Dish brushes,Baby & kids/Kids/Toys & play/Soft toys,Furniture/Tables & desks/Accent tables/Coffee tables,Baby & kids/Kids/Toys & play/Role play,Storage & organization/Storage solution systems/PAX system/PAX sliding doors,Storage & organization/Storage solution systems/PAX system/PAX sliding doors,Storage & organization/Storage solution systems/PAX system/PAX sliding doors,Cookware & tableware/Flatware/Flatware,Cookware & tableware/Bakeware/Mixing bowls,Cookware & tableware/Dinnerware/Dinnerware sets,Cookware & tableware/Cookware & kitchenware/Pots & pans/Cooking & stock pots,Cookware & tableware/Cookware & kitchenware/Pots & pans/Casserole dishes,Cookware & tableware/Cookware & kitchenware/Cooking pans/Grill pans & griddles,Cookware & tableware/Cookware & kitchenware/Pots & pans/Casserole dishes,Home Textiles/Window treatments/Curtain rods & rails/Curtain rods,Lighting/Lamps & light fixtures/Kids lighting,Lighting/Lamps & light fixtures/Kids lighting
Storage & organization/Storage solution systems/PAX system/PAX sliding doors,Furniture/Tables & desks/Desks & computer desks/Desks for home,Cookware & tableware/Knives & cutting boards/Cutting boards,Cookware & tableware/Knives & cutting boards/Cutting boards,Cookware & tableware/Knives & cutting boards/Cutting boards,Baby & kids/Kids/Toys & play/Physical play,Cookware & tableware/Dinnerware/Deep plates/VÄRDERA Deep plate,Home Décor/Mirrors/Wall mirrors,Home Décor/Mirrors/Vanity mirrors,Home Décor/Mirrors/Wall mirrors,Rugs/Rugs/Runners & small rugs,Rugs/Rugs/Runners & small rugs,Home improvement/Home safety/Child safety,Home Textiles/Window treatments/Curtain rods & rails/Curtain rods,Home Textiles/Window treatments/Curtain rods & rails/Curtain rods,Home Textiles/Window treatments/Curtain rods & rails/Track systems,Furniture/Tables & desks/Nightstands,Storage & organization/Wall shelves & hooks/Hooks,Home Décor/Wall décor/Picture & photo frames,Cookware & tableware/Knives & cutting boards/Cutting boards,Storage & organization/Storage containers/Food storage & organizing/Food containers,Cookware & tableware/Dinnerware/Side plates,Storage & organization/Clothes organizers/Clothes racks & stands,Furniture/Patio furniture/Outdoor tables/Outdoor dining tables,Kitchen & appliances/Kitchen systems/SEKTION kitchen/SEKTION kitchen cabinets,Kitchen & appliances/Kitchen systems/SEKTION kitchen/SEKTION kitchen cabinets,Kitchen & appliances/Kitchen systems/SEKTION kitchen/SEKTION kitchen cabinets,Kitchen & appliances/Kitchen systems/SEKTION kitchen/SEKTION kitchen cabinets,Kitchen & appliances/Kitchen systems/SEKTION kitchen/SEKTION kitchen cabinets,Furniture/Tables & desks/Dining tables/Up to 6 seats,Home improvement/Home safety/Child safety,Home Textiles/Window treatments/Curtain rods & rails/Track systems,Home Textiles/Window treatments/Curtain rods & rails/Track systems,Home Textiles/Window treatments/Curtain rods & rails/Track systems,Home Textiles/Window treatments/Curtain rods & rails/Track systems,Furniture/Patio furniture/Outdoor tables/Outdoor dining tables,Home Décor/Wall décor/Collage picture frames,Furniture/Room dividers,Bathroom/Bathroom storage/Bathroom shelving units,Storage & organization/Storage solution systems/BESTÅ storage system/BESTÅ all parts & accessories,Home Décor/Storage boxes & baskets/Kids boxes & baskets,Outdoor/Outdoor flooring,Outdoor/Outdoor flooring,Outdoor/Outdoor flooring,Storage & organization/Storage containers/Bathroom accessories/Towel rails & towel holders,Laundry & cleaning/Cleaning accessories,Cookware & tableware/Dinnerware/Plates,Home Décor/Decorative accessories,Furniture/Tables & desks/Accent tables/End tables & side tables,Furniture/Patio furniture/Outdoor tables/Outdoor coffee & side tables,Furniture/Chairs/Dining chairs/Dining chairs,Home Décor/Storage boxes & baskets/Clothes boxes,Outdoor/Umbrellas & gazebos/Patio umbrellas & bases,Furniture/Sofas & sectionals/Ottomans/Fabric ottomans,Storage & organization/Bags/Bag organizers,Home Textiles/Window treatments/Curtains & drapes/Panel curtains,Home Décor/Wall décor/Picture & photo frames,Home Décor/Wall décor/Picture & photo frames,Home Décor/Wall décor/Picture & photo frames,Home Décor/Wall décor/Picture & photo frames,Home Décor/Wall décor/Wall decals & stickers,Storage & organization/Armoires & wardrobes/Solitaire wardrobes,Furniture/Tables & desks/Accent tables/Coffee tables,Home Textiles/Window treatments/Curtain rods & rails/Track systems,Storage & organization/Clothes organizers/Shoe racks & stands,Home Décor/Mirrors/Makeup & magnifying mirrors,Home Décor/Wall décor/Picture & photo frames,Home Décor/Wall décor/Picture & photo frames,Furniture/Patio furniture/Outdoor tables/Outdoor dining tables,Furniture/Tables & desks/Café tables,Furniture/Tables & desks/Bar tables,Kitchen & appliances/Kitchen islands & carts,Furniture/Tables & desks/Dining tables/Up to 10 seats,Furniture/Chairs/Bar stools & chairs,Furniture/Chairs/Stools & benches/Stools,Storage & organization/Storage containers/Food storage & organizing/Food containers,Home Décor/Wall décor/Picture & photo frames,Home Décor/Wall décor/Picture & photo frames,Home Décor/Wall décor/Picture & photo frames,Home Décor/Wall décor/Picture & photo frames,Rugs/Rugs/Door mats,Furniture/Tables & desks/Accent tables/End tables & side tables,Furniture/Tables & desks/Accent tables/End tables & side tables,Furniture/Tables & desks/Dining tables/Dining table tops & underframes,Furniture/Patio furniture/Outdoor benches,Furniture/Tables & desks/Kids tables,"Storage & organization/Shelving units, bookcases & storage options/Shelf units & cube storage",Furniture/Tables & desks/Accent tables/Coffee tables,Kitchen & appliances/Kitchen countertops/Butcher block countertops,Kitchen & appliances/Kitchen countertops/Butcher block countertops,Kitchen & appliances/Kitchen countertops/Butcher block countertops,Kitchen & appliances/Kitchen countertops/Butcher block countertops,Kitchen & appliances/Kitchen countertops/Butcher block countertops,Kitchen & appliances/Kitchen countertops/Butcher block countertops,Bathroom/Bathroom textiles/Shower curtains,Cookware & tableware/Dishwashing accessories/Dish brushes,Furniture/Patio furniture/Outdoor tables/Outdoor dining tables,Furniture/Patio furniture/Outdoor chairs/Outdoor dining chairs,Furniture/Patio furniture/Outdoor chairs/Outdoor dining chairs,Furniture/Patio furniture/Outdoor chairs/Outdoor dining chairs
