Beds & mattresses/Bedding/Blankets & throws,Beds & mattresses/Bedding/Bedlinen/Duvet cover sets,Beds & mattresses/Bedding/Pillows/Polyester pillows,Baby & kids/Baby/Baby textiles/Nursery rugs,Rugs/Bath mats,Storage & organization/Bags/Shopping bags & tote bags,Bathroom/Bathroom textiles/Towels/Wash cloths,Bathroom/Bathroom textiles/Towels/Hand towels,Bathroom/Bathroom textiles/Towels/Bath sheets,Beds & mattresses/Bedding/Blankets & throws,Rugs/Rugs/Door mats,Furniture/Sofas & sectionals/Fabric sofas/Modular fabric sofas,Furniture/Sofas & sectionals/Sofa & armchairs covers/HÄRLANDA covers,Furniture/Sofas & sectionals/Sofa & armchairs covers/HÄRLANDA covers,Furniture/Sofas & sectionals/Sofa & armchairs covers/HÄRLANDA covers,Furniture/Sofas & sectionals/Sofa & armchairs covers/HÄRLANDA covers,Beds & mattresses/Bedding/Cushions & cushions covers/Cushions,Cookware & tableware/Napkins & napkin holders/Napkins,Beds & mattresses/Bedding/Cushions & cushions covers/Cushions,Rugs/Rugs/Door mats,Furniture/Patio furniture/Outdoor seat cushions,Furniture/Patio furniture/Outdoor seat cushions,Beds & mattresses/Mattresses/Crib mattresses,Beds & mattresses/Mattresses/Crib mattresses,Beds & mattresses/Mattresses/Crib mattresses,Beds & mattresses/Mattresses/Crib mattresses,Beds & mattresses/Bedding/Cushions & cushions covers/Cushion covers,Beds & mattresses/Bedding/Cushions & cushions covers/Cushion covers,Furniture/Armchairs & chaises/Kids armchairs,Beds & mattresses/Bedding/Cushions & cushions covers/Cushion covers,Furniture/Sofas & sectionals/Sofa & armchairs covers/POÄNG,Furniture/Sofas & sectionals/Sofa & armchairs covers/POÄNG,Baby & kids/Kids/Toys & play/Soft toys,Baby & kids/Baby/Baby textiles/Nursery rugs,Beds & mattresses/Bedding/Cushions & cushions covers/Children's cushions & blankets,Furniture/Armchairs & chaises/Rattan armchairs,Furniture/Armchairs & chaises/Rattan armchairs,Baby & kids/Baby/Baby textiles/Baby towels & washcloths,Furniture/Tables & desks/Changing tables,"Outdoor/Outdoor cushions/Outdoor pillows/FUNKÖN Cushion cover, in","Outdoor/Outdoor cushions/Outdoor pillows/FUNKÖN Back cushion, indoor",Rugs/Bath mats,Rugs/Rugs/Large & medium rugs,Bathroom/Bathroom textiles/Towels/Hand towels,Bathroom/Bathroom textiles/Towels/Bath towels,Beds & mattresses/Bedding/Cushions & cushions covers/Cushion covers,Rugs/Rugs/Runners & small rugs,Beds & mattresses/Mattresses/Mattress toppers,Beds & mattresses/Bedding/Blankets & throws,Beds & mattresses/Bedding/Comforters/Polyester comforters,Beds & mattresses/Bedding/Comforters/Polyester comforters,Rugs/Rugs/Door mats,Furniture/Patio furniture/Outdoor lounge furniture,Beds & mattresses/Bedding/Cushions & cushions covers/Children's cushions & blankets,Beds & mattresses/Bedding/Cushions & cushions covers/Children's cushions & blankets,Baby & kids/Kids/Toys & play/Soft toys,Furniture/Sofas & sectionals/Sofa & armchairs covers/POÄNG,Cookware & tableware/Table linen/Table cloths & runners,Beds & mattresses/Bedding/Blankets & throws/FÄLTMAL Pillow,Rugs/Rugs/Door mats,Rugs/Rugs/Runners & small rugs,Beds & mattresses/Bedding/Bedspreads,Rugs/Rugs/Round rugs,"Rugs/Rugs/Large & medium rugs/SVALLERUP Rug flatwoven, in",Furniture/Sofas & sectionals/Sofa & armchairs covers/FÄRLÖV covers,Cookware & tableware/Kitchen textiles/Pot holders & oven mitts,Cookware & tableware/Kitchen textiles/Pot holders & oven mitts,Cookware & tableware/Kitchen textiles/Pot holders & oven mitts,Beds & mattresses/Mattresses/Kids mattresses,Rugs/Rugs/Large & medium rugs,"Rugs/Rugs/Large & medium rugs/VRENSTED Rug flatwoven, in",Beds & mattresses/Bedding/Cushions & cushions covers/Cushion covers,Storage & organization/Storage containers/Bins & bags/Bags,Beds & mattresses/Bedding/Cushions & cushions covers/Cushion covers,Furniture/Patio furniture/Outdoor seat cushions,Rugs/Rugs/Large & medium rugs,Beds & mattresses/Bedding/Bedlinen/Duvet cover sets,"Beds & mattresses/Mattresses/Foam, memory foam & latex mattresses",Furniture/Sofas & sectionals/Sofa & armchairs covers/FLOTTEBO covers,Beds & mattresses/Bedding/Bedlinen/Duvet cover sets,Beds & mattresses/Bedding/Blankets & throws,"Furniture/Patio furniture/Outdoor seat cushions/SÖTHOLMEN Cushion cover, in",Beds & mattresses/Bedding/Cushions & cushions covers/Cushion covers,Rugs/Rugs/Large & medium rugs,"Baby & kids/Baby/Changing, bathing & potty/Changing accessories",Furniture/Sofas & sectionals/Sofa & armchairs covers/VINLIDEN covers,Storage & organization/Storage containers/Bins & bags/Bags,Bathroom/Bathroom textiles/Shower curtains,Rugs/Rugs/Large & medium rugs,"Rugs/Rugs/Large & medium rugs/SKARRILD Rug flatwoven, in",Laundry & cleaning/Cleaning accessories,Beds & mattresses/Bedding/Cushions & cushions covers/Cushion covers,Beds & mattresses/Bedding/Cushions & cushions covers/Cushions,Beds & mattresses/Bedding/Blankets & throws,Furniture/Sofas & sectionals/Sofa & armchairs covers/POÄNG,Beds & mattresses/Bedding/Comforters/Down & feather comforters,Beds & mattresses/Bedding/Comforters/Down & feather comforters,Beds & mattresses/Bedding/Comforters/Down & feather comforters,Furniture/Sofas & sectionals/Fabric sofas/Sofas,Beds & mattresses/Bedding/Cushions & cushions covers/Cushions
Storage & organization/Storage solution systems/AURDAL system/AURDAL parts,Storage & organization/Storage solution systems/AURDAL system/AURDAL parts,Storage & organization/Storage solution systems/AURDAL system/AURDAL parts,Storage & organization/Storage solution systems/AURDAL system/AURDAL parts,Storage & organization/Storage solution systems/AURDAL system/AURDAL parts,Storage & organization/Storage solution systems/AURDAL system/AURDAL parts,Storage & organization/Storage solution systems/AURDAL system/AURDAL parts,Storage & organization/Storage solution systems/AURDAL system/AURDAL parts,Storage & organization/Storage solution systems/AURDAL system/AURDAL parts,Storage & organization/Storage solution systems/AURDAL system/AURDAL parts,Storage & organization/Storage solution systems/AURDAL system/AURDAL parts,Storage & organization/Storage solution systems/AURDAL system/AURDAL parts,Furniture/Tables & desks/Desks & computer desks/Desks for home,Storage & organization/Clothes organizers/Shoe cabinets,Storage & organization/Clothes organizers/Shoe cabinets,Storage & organization/Clothes organizers/Shoe cabinets,Storage & organization/Clothes organizers/Shoe cabinets,Storage & organization/Clothes organizers/Shoe cabinets,Storage & organization/Clothes organizers/Shoe cabinets,Storage & organization/Clothes organizers/Shoe cabinets,"Storage & organization/Shelving units, bookcases & storage options/Storage shelves & units",Home Décor/Mirrors/Wall mirrors,Home Décor/Mirrors/Wall mirrors,Home Décor/Mirrors/Wall mirrors,Cookware & tableware/Knives & cutting boards/Cutting boards,Home Décor/Storage boxes & baskets/Secondary storage boxes,Home electronics/Speakers/Bluetooth speakers,Home electronics/Speakers/Bluetooth speakers,Home electronics/Speakers/Bluetooth speakers,Home electronics/Speakers/Bluetooth speakers,Home electronics/Speakers/Bluetooth speakers,Home electronics/Cords & chargers/Wireless charging & accessories,Home electronics/Cords & chargers/Wireless charging & accessories,Home electronics/Cords & chargers/Wireless charging & accessories,Storage & organization/Storage containers/Bins & bags/Trash cans & pedal bins,Kitchen & appliances/Kitchen islands & carts,Storage & organization/Storage containers/Bathroom accessories/Bathroom shelves,Bathroom/Bathroom storage/Bathroom shelving units,Home Décor/Storage boxes & baskets/Secondary storage boxes,Home Décor/Storage boxes & baskets/Secondary storage boxes,Storage & organization/Wall shelves/Complete wall shelves,Home Décor/Storage boxes & baskets/Paper & media boxes,Storage & organization/Storage containers/Food storage & organizing/Food containers,"Storage & organization/Shelving units, bookcases & storage options/Storage shelves & units","Storage & organization/Shelving units, bookcases & storage options/Storage shelves & units",Storage & organization/Display & storage cabinets/Dining room cabinets & cupboards,Furniture/Kids furniture/Toy storage,Home Décor/Vases & bowls/Vases,Home Décor/Vases & bowls/Vases/CYLINDER Vase,Storage & organization/Storage solution systems/BESTÅ storage system/BESTÅ all parts & accessories,Storage & organization/Storage containers/Bathroom accessories/Bathroom boxes & baskets,Furniture/Tables & desks/Kids tables,"Storage & organization/Shelving units, bookcases & storage options/Cube storage","Storage & organization/Shelving units, bookcases & storage options/Cube storage","Storage & organization/Shelving units, bookcases & storage options/Shelf units & cube storage","Storage & organization/Shelving units, bookcases & storage options/Bookcases",Home electronics/Cords & chargers/Wireless charging & accessories,"Storage & organization/Shelving units, bookcases & storage options/Bookcases",Storage & organization/Display & storage cabinets/Display cabinets,Storage & organization/Storage solution systems/SMÅSTAD system/SMÅSTAD doors & drawers,Storage & organization/Storage solution systems/SMÅSTAD system/SMÅSTAD doors & drawers,Furniture/Tables & desks/Desks & computer desks/Desks for home,Home Décor/Storage boxes & baskets/Secondary storage boxes,Home Décor/Storage boxes & baskets/Kids boxes & baskets,Home Décor/Storage boxes & baskets/Kids boxes & baskets,Home Décor/Storage boxes & baskets/Kids boxes & baskets,Storage & organization/Storage containers/Cable management & accessories,Storage & organization/Storage containers/Bins & bags/Trash cans & pedal bins,Home Décor/Storage boxes & baskets/Kids boxes & baskets,Storage & organization/Bags/Travel accessories,Bathroom/Bathroom vanities/Vanity cabinets with sink,Bathroom/Bathroom vanities/Vanity cabinets with sink,Furniture/Tables & desks/Dining tables/Up to 4 seats,"Storage & organization/Shelving units, bookcases & storage options/Shelf units & cube storage",Furniture/Tables & desks/Dining tables/Up to 4 seats,Home Décor/Wall décor/Picture & photo frames,Home electronics/Speakers/Bluetooth speakers,Storage & organization/Storage containers/Paper & media organizers/Media accessories,Storage & organization/Storage containers/Paper & media organizers/Desk accessories,Storage & organization/Storage containers/Bathroom accessories/Bathroom boxes & baskets,Furniture/Kids furniture/Kids chairs,Baby & kids/Kids/Toys & play/Arts & crafts,Furniture/Tables & desks/Bar tables,Storage & organization/Storage solution systems/IVAR system/All parts,Storage & organization/Storage solution systems/BESTÅ storage system/BESTÅ all parts & accessories,Storage & organization/Storage solution systems/SMÅSTAD system/SMÅSTAD interior fittings,Storage & organization/Clothes organizers/Shoe racks & stands,Home Décor/Storage boxes & baskets/Paper & media boxes,Furniture/Tables & desks/Desks & computer desks/Desks for home,Storage & organization/TV & media furniture/TV stands & benches,Storage & organization/Storage containers/Bathroom accessories/Toilet roll holders & stands,"Storage & organization/Shelving units, bookcases & storage options/Shelf units & cube storage","Storage & organization/Shelving units, bookcases & storage options/Shelf units & cube storage",Storage & organization/Storage containers/Food storage & organizing/Cooler bags,Storage & organization/Storage containers/Food storage & organizing/Food containers,Home electronics/Cords & chargers/Wireless charging & accessories,"Storage & organization/Shelving units, bookcases & storage options/Storage shelves & units/KOLBJÖRN Cabinet, indoor","Storage & organization/Shelving units, bookcases & storage options/Shelf units & cube storage","Storage & organization/Shelving units, bookcases & storage options/Shelf units & cube storage",Storage & organization/Wall shelves/Shelves
Home Textiles/Window treatments/Curtains & drapes/Light filtering curtains,Home Textiles/Window treatments/Curtains & drapes/Panel curtains,Home Textiles/Window treatments/Curtains & drapes/Light filtering curtains,Home Textiles/Window treatments/Curtains & drapes/Light filtering curtains,Home Textiles/Window treatments/Curtains & drapes/Light filtering curtains,Home Textiles/Window treatments/Curtains & drapes/Panel curtains,Home Textiles/Window treatments/Curtains & drapes/Light filtering curtains,Home Textiles/Window treatments/Curtains & drapes/Light filtering curtains,Home Textiles/Window treatments/Curtains & drapes/Light filtering curtains,Home Textiles/Window treatments/Curtains & drapes/Panel curtains,Home Textiles/Window treatments/Curtains & drapes/Light filtering curtains,Home Textiles/Window treatments/Curtains & drapes/Panel curtains,"Home Textiles/Window treatments/Shades, blinds & window treatments/Pleated & cellular blinds and shades","Home Textiles/Window treatments/Shades, blinds & window treatments/Roman shades",Kitchen & appliances/Backsplashes & wall panels/Laminate backsplashes,Kitchen & appliances/Backsplashes & wall panels/Laminate backsplashes,Kitchen & appliances/Backsplashes & wall panels/Laminate backsplashes,Home Textiles/Window treatments/Curtain rods & rails/Track systems,Home Décor/Clocks/Alarm clocks,Baby & kids/Kids/Toys & play/Physical play,Storage & organization/Storage solution systems/PAX system/PAX doors without hinges,Home electronics/Speakers/Wi-Fi speakers,Storage & organization/Dressers & storage drawers/Chests of drawers,Outdoor/Umbrellas & gazebos/Patio umbrellas & bases,Storage & organization/Storage solution systems/PAX system/PAX doors without hinges,Rugs/Rugs/Door mats,"Home improvement/Oils, stains & product care","Home improvement/Oils, stains & product care","Home improvement/Oils, stains & product care","Home improvement/Oils, stains & product care",Cookware & tableware/Serveware/Trays,Storage & organization/Storage containers/Bathroom accessories/Towel rails & towel holders,Storage & organization/Storage containers/Bathroom accessories/Towel rails & towel holders,"Laundry & cleaning/Drying racks/MULIG Drying rack, indoor","Storage & organization/Wall shelves & hooks/Hooks/BRANDUR Rail with 4 hooks, in-","Storage & organization/Wall shelves & hooks/Hooks/BRANDUR Hook, in-",Storage & organization/Wall shelves & hooks/Hooks,Storage & organization/Wall shelves & hooks/Hooks,"Storage & organization/Clothes organizers/Clothes racks & stands/TURBO Clothes rack, indoor",Home Décor/Flower pots & stands/Indoor plant pots,Home Décor/Candle holders & candles/Lanterns,"Storage & organization/Wall shelves & hooks/Hooks/BRANDUR Hook, in-",Pet accessories/Cats,Furniture/Tables & desks/Accent tables/Coffee tables,Furniture/Tables & desks/Accent tables/Coffee tables,Home Textiles/Window treatments/Curtains & drapes/Room darkening curtains & drapes,Furniture/Tables & desks/Café tables,Furniture/Tables & desks/Bar tables,Storage & organization/Storage containers/Bins & bags/Trash cans & pedal bins,Storage & organization/Storage containers/Paper & media organizers/Desk accessories,Storage & organization/Clothes organizers/Clothes racks & stands,Storage & organization/Clothes organizers/Clothes racks & stands,Cookware & tableware/Dinnerware/Bowls,Cookware & tableware/Coffee & tea/Mugs & cups,Cookware & tableware/Dinnerware/Plates,Cookware & tableware/Dinnerware/Side plates,Lighting/Lamps & light fixtures/Kids lighting,Furniture/Tables & desks/Dining tables/Up to 4 seats,Bathroom/Bathroom sinks,Bathroom/Bathroom sinks,Bathroom/Bathroom sinks,Bathroom/Bathroom sinks,Bathroom/Bathroom sinks,Home Décor/Storage boxes & baskets/Baskets,Kitchen & appliances/Kitchen countertops/Laminate countertops,Kitchen & appliances/Kitchen countertops/Laminate countertops,Kitchen & appliances/Kitchen countertops/Laminate countertops,Kitchen & appliances/Kitchen countertops/Laminate countertops,Kitchen & appliances/Kitchen countertops/Laminate countertops,Storage & organization/Dressers & storage drawers/Chests of drawers,Storage & organization/Dressers & storage drawers/Chests of drawers,Furniture/Tables & desks/Nightstands,Furniture/Tables & desks/Dining tables/Up to 6 seats,Cookware & tableware/Cookware & kitchenware/Cooking pans/Frying pans & skillets,Home electronics/Speakers/Bluetooth speakers,Furniture/Tables & desks/Dining tables/Dining table tops & underframes,Cookware & tableware/Dinnerware/Dinnerware sets,Cookware & tableware/Coffee & tea/Mugs & cups,Cookware & tableware/Coffee & tea/Mugs & cups,Kitchen & appliances/Kitchen systems/SEKTION kitchen/SEKTION kitchen cabinets,Kitchen & appliances/Kitchen systems/SEKTION kitchen/SEKTION kitchen cabinets,Kitchen & appliances/Kitchen systems/SEKTION kitchen/SEKTION kitchen cabinets,Bathroom/Showers/Shower heads,Kitchen & appliances/Kitchen systems/SEKTION kitchen/SEKTION kitchen cabinets,Kitchen & appliances/Kitchen systems/SEKTION kitchen/SEKTION kitchen cabinets,Kitchen & appliances/Kitchen systems/SEKTION kitchen/SEKTION kitchen cabinets,Kitchen & appliances/Kitchen systems/SEKTION kitchen/SEKTION kitchen cabinets,Kitchen & appliances/Kitchen systems/SEKTION kitchen/SEKTION kitchen cabinets,Home Décor/Storage boxes & baskets/Kids boxes & baskets,Storage & organization/Storage containers/Bathroom accessories/Towel rails & towel holders,Home Décor/Storage boxes & baskets/Baskets,Storage & organization/Armoires & wardrobes/Children's wardrobes,Furniture/Tables & desks/Changing tables/SMÅGÖRA Changing table,"Home Textiles/Window treatments/Shades, blinds & window treatments/Black-out shades & blinds",Furniture/Tables & desks/Accent tables/End tables & side tables,Home Décor/Clocks/Alarm clocks,Home Décor/Clocks/Alarm clocks,Storage & organization/TV & media furniture/TV stands & benches,Storage & organization/Wall shelves/Complete wall shelves/HEMNES Wall,Cookware & tableware/Dinnerware/Dinnerware sets
Storage & organization/Display & storage cabinets/Display cabinets,Kitchen & appliances/Kitchen systems/SEKTION kitchen/SEKTION kitchen cabinets,Cookware & tableware/Knives & cutting boards/Sharpening tools,"Storage & organization/Shelving units, bookcases & storage options/Shelf units & cube storage",Storage & organization/Storage solution systems/PAX system/PAX Interior organizers,Storage & organization/Storage solution systems/PAX system/PAX Interior organizers,Storage & organization/Storage solution systems/BESTÅ storage system/BESTÅ all parts & accessories,Home Décor/Mirrors/Mirror cabinets,Home Décor/Mirrors/Mirror cabinets,Storage & organization/Storage solution systems/OMAR system/All parts,Cookware & tableware/Cookware & kitchenware/Cooking pans/Grill pans & griddles,"Storage & organization/Shelving units, bookcases & storage options/Shelf units & cube storage",Storage & organization/Clothes organizers/Shoe racks & stands,Kitchen & appliances/Kitchen drawer organization/Drawer dividers,Storage & organization/TV & media furniture/TV stands & benches,Storage & organization/Clothes organizers/Shoe racks & stands,"Storage & organization/Shelving units, bookcases & storage options/Shelf units & cube storage",Storage & organization/Storage containers/Food storage & organizing/Food containers,Storage & organization/Display & storage cabinets/Display cabinets,Storage & organization/Display & storage cabinets/Display cabinets,Storage & organization/TV & media furniture/TV stands & benches,Cookware & tableware/Serveware/Trays,Cookware & tableware/Serveware/Trays,Cookware & tableware/Serveware/Trays,Storage & organization/Storage solution systems/SMÅSTAD system/SMÅSTAD doors & drawers,Storage & organization/Storage solution systems/SMÅSTAD system/SMÅSTAD doors & drawers,Storage & organization/Storage solution systems/BESTÅ storage system/BESTÅ all parts & accessories,Bathroom/Bathroom vanities/Vanity cabinets without sink,Bathroom/Bathroom vanities/Bathroom vanity legs,Kitchen & appliances/Kitchen systems/SEKTION kitchen/SEKTION kitchen cabinets,"Home Décor/Storage boxes & baskets/Secondary storage boxes/SAMLA Lid for box, 12",Home Décor/Storage boxes & baskets/Paper & media boxes,Storage & organization/Bags/Travel accessories,Home Décor/Storage boxes & baskets/Secondary storage boxes,Storage & organization/Bags/Shopping bags & tote bags,Kitchen & appliances/Kitchen drawer organization/Shelves & drawers,Storage & organization/Storage containers/Food storage & organizing/Food containers,Home Décor/Storage boxes & baskets/Clothes boxes,Storage & organization/Wall shelves/Shelves,Storage & organization/Wall shelves/Shelves,Home Décor/Storage boxes & baskets/Secondary storage boxes,Storage & organization/Storage containers/Paper & media organizers/Desk accessories,Furniture/Tables & desks/Desks & computer desks/Desks for home,Furniture/Tables & desks/Desks & computer desks/Desks for home,Furniture/Tables & desks/Desks & computer desks/Desks for home,Storage & organization/TV & media furniture/TV stands & benches,Furniture/Tables & desks/Dining tables/Up to 4 seats,Baby & kids/Kids/Kids storage & organization/Children's hooks & wall organization,Storage & organization/Wall shelves/Complete wall shelves,Home electronics/Speakers/Bluetooth speakers,Furniture/Kids furniture/Kids chairs,Cookware & tableware/Serveware/Trays,Kitchen & appliances/Kitchen wall organization & storage/Wall organizers,Kitchen & appliances/Kitchen systems/SUNNERSTA modular kitchen/Accessories for SUNNERSTA,Kitchen & appliances/Kitchen systems/SUNNERSTA modular kitchen/Accessories for SUNNERSTA,Kitchen & appliances/Kitchen systems/SUNNERSTA modular kitchen/Accessories for SUNNERSTA,Kitchen & appliances/Kitchen systems/SUNNERSTA modular kitchen/Accessories for SUNNERSTA,Kitchen & appliances/Kitchen wall organization & storage/Wall organizers,Kitchen & appliances/Kitchen systems/SUNNERSTA modular kitchen/Accessories for SUNNERSTA,Bathroom/Bathroom storage/Bathroom shelving units,Furniture/Patio furniture/Outdoor chairs/Outdoor dining chairs,"Storage & organization/Display & storage cabinets/Buffet tables, sideboard buffets & buffet cabinets",Kitchen & appliances/Kitchen wall organization & storage/Kitchen shelves,Kitchen & appliances/Kitchen wall organization & storage/Kitchen shelves,Kitchen & appliances/Kitchen islands & carts,"Storage & organization/Shelving units, bookcases & storage options/Storage shelves & units",Storage & organization/TV & media furniture/TV stands & benches,Furniture/Tables & desks/Console tables & sofa tables,Home Décor/Noticeboards,Home Décor/Noticeboards,Home Décor/Noticeboards,Home Décor/Noticeboards,Home Décor/Noticeboards,Home Décor/Noticeboards,Home Décor/Noticeboards,Home Décor/Noticeboards,Home Décor/Noticeboards,Home Décor/Noticeboards,Home Décor/Noticeboards,Home Décor/Noticeboards,Home Décor/Noticeboards,Home Décor/Noticeboards,Home Décor/Noticeboards,Furniture/Patio furniture/Outdoor tables/Outdoor dining tables,"Storage & organization/Shelving units, bookcases & storage options/Storage shelves & units",Storage & organization/Storage containers/Food storage & organizing/Food containers,Laundry & cleaning/Cleaning accessories,Home electronics/Cords & chargers/Wireless charging & accessories,"Storage & organization/Display & storage cabinets/Buffet tables, sideboard buffets & buffet cabinets",Kitchen & appliances/Kitchen islands & carts,Home Décor/Mirrors/Wall mirrors,Home Décor/Mirrors/Wall mirrors,Home Décor/Mirrors/Wall mirrors,Storage & organization/Wall shelves & hooks/Hooks,Storage & organization/Storage solution systems/SMÅSTAD system/SMÅSTAD doors & drawers,Storage & organization/Storage solution systems/SMÅSTAD system/SMÅSTAD doors & drawers,Furniture/Kids furniture/Toy storage,Furniture/Kids furniture/Toy storage,Furniture/Kids furniture/Toy storage,Furniture/Kids furniture/Toy storage
