Home Décor/Flower pots & stands/Indoor plant pots,Home Décor/Flower pots & stands/Indoor plant pots,Home Décor/Flower pots & stands/Indoor plant pots,Home Décor/Flower pots & stands/Indoor plant pots,Home Décor/Flower pots & stands/Indoor plant pots,Home Décor/Flower pots & stands/Indoor plant pots,Home Décor/Flower pots & stands/Indoor plant pots,Home Décor/Flower pots & stands/Indoor plant pots,Home Décor/Flower pots & stands/Indoor plant pots,Home Décor/Flower pots & stands/Indoor plant pots,Kitchen & appliances/Kitchen lighting,Lighting/Integrated lighting/Bookcase lighting,Lighting/Lamps & light fixtures/Ceiling lights/Pendants lights,Lighting/Smart lighting/Smart lighting kits,Kitchen & appliances/Kitchen faucets & sinks/Kitchen faucets,Bathroom/Bathroom faucets/Faucets,Cookware & tableware/Flatware/Flatware,Cookware & tableware/Cookware & kitchenware/Pots & pans/Cooking & stock pots,Lighting/Integrated lighting/Bookcase lighting,Lighting/Lamps & light fixtures/Desk lamps,Kitchen & appliances/Kitchen faucets & sinks/Kitchen faucets,Cookware & tableware/Coffee & tea/Tea pots & accessories,Bathroom/Bathroom faucets/Faucets,Bathroom/Bathroom faucets/Faucets,Kitchen & appliances/Kitchen faucets & sinks/Kitchen faucets,Home Décor/Flower pots & stands/Indoor plant pots,Lighting/Lamps & light fixtures/Ceiling lights/Ceiling track lighting,Lighting/Lamps & light fixtures/Ceiling lights/Ceiling track lighting,Lighting/Integrated lighting/Bookcase lighting,Lighting/Smart lighting/Remote & smart light switches,Home Décor/Flower pots & stands/Self watering plant pots,"Lighting/Lamps & light fixtures/Shades, bases & cords/Lamp bases & cords",Bathroom/Bathroom faucets/Faucets,Bathroom/Bathroom faucets/Faucets,Bathroom/Bathroom faucets/Faucets,Bathroom/Bathroom faucets/Faucets,Bathroom/Bathroom faucets/Faucets,Bathroom/Bathroom faucets/Faucets,Bathroom/Bathroom faucets/Faucets,Bathroom/Bathroom faucets/Faucets,Bathroom/Bathroom faucets/Faucets,Bathroom/Bathroom faucets/Faucets,Bathroom/Bathroom faucets/Faucets,Bathroom/Bathroom faucets/Faucets,Lighting/Lamps & light fixtures/Ceiling lights/Pendants lights,Storage & organization/Storage solution systems/PAX system/Knobs & handles,Lighting/Lamps & light fixtures/Wall lamps/Wall lamps,Cookware & tableware/Drinkware/Pitchers & carafes,Lighting/Lamps & light fixtures/Ceiling lights/Ceiling track lighting,Lighting/Lamps & light fixtures/Ceiling lights/Ceiling track lighting,Lighting/Lamps & light fixtures/Ceiling lights/Ceiling track lighting,Lighting/Lamps & light fixtures/Ceiling lights/Ceiling track lighting,Cookware & tableware/Drinkware/Glasses,Home Décor/Flower pots & stands/Indoor plant pots,Home Décor/Flower pots & stands/Indoor plant pots,Home Décor/Flower pots & stands/Indoor plant pots,Home Décor/Flower pots & stands/Indoor plant pots,Home Décor/Flower pots & stands/Indoor plant pots,Home Décor/Flower pots & stands/Indoor plant pots,Kitchen & appliances/Kitchen faucets & sinks/Kitchen faucets,Lighting/Lamps & light fixtures/Table lamps,Lighting/Integrated lighting/Bookcase lighting,Kitchen & appliances/Kitchen drawer organization/Drawer dividers,Cookware & tableware/Cookware & kitchenware/Cooking accessories,Cookware & tableware/Cookware & kitchenware/Cooking accessories,Lighting/Lamps & light fixtures/Desk lamps,Lighting/Lamps & light fixtures/Floor lamps/ARÖD Floor,Kitchen & appliances/Kitchen faucets & sinks/Kitchen faucets,Lighting/Smart lighting/Remote & smart light switches,Storage & organization/Storage solution systems/PAX system/Knobs & handles,Kitchen & appliances/Kitchen faucets & sinks/Kitchen faucets,Lighting/Lamps & light fixtures/Ceiling lights/Ceiling lamps,Lighting/Lamps & light fixtures/Ceiling lights/Ceiling lamps,Lighting/Lamps & light fixtures/Ceiling lights/Pendants lights,Lighting/Lamps & light fixtures/Ceiling lights/Pendants lights,Lighting/Lamps & light fixtures/Floor lamps/FLUGBO Floor uplt,Lighting/Lamps & light fixtures/Ceiling lights/Pendants lights,Lighting/Lamps & light fixtures/Wall lamps/Wall lamps,Lighting/Lamps & light fixtures/Ceiling lights/Pendants lights,Lighting/Lamps & light fixtures/Table lamps,Lighting/Lamps & light fixtures/Ceiling lights/Ceiling lamps,Kitchen & appliances/Kitchen lighting,Lighting/Lamps & light fixtures/Ceiling lights/Ceiling track lighting,Lighting/Lamps & light fixtures/Ceiling lights/Ceiling track lighting,Cookware & tableware/Drinkware/Drinking accessories,Kitchen & appliances/Appliances/Range hoods & filters/Island and ceiling mounted range hoods,Lighting/Lamps & light fixtures/Ceiling lights/Ceiling track lighting,Lighting/Lamps & light fixtures/Ceiling lights/Ceiling track lighting,Kitchen & appliances/Kitchen lighting,Lighting/Lamps & light fixtures/Ceiling lights/Pendants lights,Kitchen & appliances/Kitchen lighting,Cookware & tableware/Kitchen & cooking accessories/Kitchen utensils/Cooking preparation tools,Lighting/Lamps & light fixtures/Floor lamps/HALKIP Floor lamp w,Lighting/Lamps & light fixtures/Wall lamps/Wall lamps,Lighting/Lamps & light fixtures/Wall lamps/Wall lamps,Kitchen & appliances/Kitchen faucets & sinks/Kitchen faucets,Lighting/Lamps & light fixtures/Desk lamps,Lighting/Lamps & light fixtures/Desk lamps,Lighting/Lamps & light fixtures/Desk lamps,Lighting/Lamps & light fixtures/Desk lamps
Home Décor/Mirrors/Wall mirrors,Lighting/Lamps & light fixtures/Ceiling lights/Pendants lights,Lighting/Decorative lighting/Decorative indoor lighting,Lighting/Lamps & light fixtures/Wall lamps/Wall lamps,Kitchen & appliances/Appliances/Range hoods & filters/Wall mounted range hoods,Home Décor/Mirrors/Vanity mirrors,Home Décor/Mirrors/Vanity mirrors,Storage & organization/Storage containers/Bathroom accessories/Soap dispensers & soap dishes,Home Décor/Candle holders & candles/Candle holders,Home Décor/Clocks/Wall & table clocks,Lighting/Integrated lighting/Bookcase lighting,Home Décor/Mirrors/Wall mirrors,Lighting/Lamps & light fixtures/Wall lamps/Wall spotlights,Lighting/Lamps & light fixtures/Wall lamps/Wall spotlights,Home Décor/Mirrors/Vanity mirrors,Home Décor/Mirrors/Round mirrors,Gardening & plants/Plant stands & movers,Gardening & plants/Plant stands & movers,Cookware & tableware/Coffee & tea/Tea pots & accessories,Kitchen & appliances/Kitchen faucets & sinks/Kitchen faucets,Cookware & tableware/Coffee & tea/Tea pots & accessories,Lighting/Lamps & light fixtures/Floor lamps,Baby & kids/Kids/Toys & play/Role play,Cookware & tableware/Flatware/Kids cutlery,Baby & kids/Kids/Toys & play/Role play,Cookware & tableware/Serveware/Bowls,Cookware & tableware/Kitchen & cooking accessories/Kitchen utensils/Cooking preparation tools,Bathroom/Bathroom faucets/Faucets,Kitchen & appliances/Kitchen faucets & sinks/Kitchen faucets,Cookware & tableware/Drinkware/Specialty glassware,Cookware & tableware/Drinkware/Drinking accessories,Lighting/Integrated lighting/Bookcase lighting,Cookware & tableware/Knives & cutting boards/Kitchen knives,Lighting/Bathroom lighting/Bathroom vanity lights,Cookware & tableware/Kitchen & cooking accessories/Kitchen utensils/Cooking preparation tools,Lighting/Bathroom lighting/Bathroom vanity lights,Lighting/Bathroom lighting/Bathroom vanity lights,Cookware & tableware/Knives & cutting boards/Kitchen knives,Home Décor/Decorative accessories,Home Décor/Decorative accessories,Home Décor/Decorative accessories,Home Décor/Decorative accessories,Home Décor/Flower pots & stands/Indoor plant pots,Cookware & tableware/Bakeware/Baking pans & molds,Home Décor/Decorative accessories,Baby & kids/Kids/Toys & play/Wooden toys,Cookware & tableware/Coffee & tea/Vacuum flasks,Cookware & tableware/Knives & cutting boards/Kitchen knives,Cookware & tableware/Coffee & tea/Coffee makers & accessories,Kitchen & appliances/Kitchen faucets & sinks/Kitchen faucets,Cookware & tableware/Flatware/Flatware,Cookware & tableware/Flatware/Flatware,Lighting/Lamps & light fixtures/Floor lamps/ISJAKT LED floor uplighter,Cookware & tableware/Serveware/Serving dishes,Home electronics/Speakers/Wi-Fi speakers,Home electronics/Speakers/Wi-Fi speakers,Home Textiles/Window treatments/Curtain rods & rails/Curtain rods,Cookware & tableware/Coffee & tea/Tea pots & accessories,Home Décor/Mirrors/Vanity mirrors,Home Décor/Mirrors/Wall mirrors,Storage & organization/Wall shelves & hooks/Hooks,Kitchen & appliances/Kitchen systems/SEKTION kitchen/SEKTION kitchen cabinets,Home Décor/Mirrors/Large mirrors,Cookware & tableware/Dishwashing accessories/Sink accessories,Cookware & tableware/Coffee & tea/Coffee makers & accessories,"Outdoor/Outdoor storage benches, boxes & cabinets",Kitchen & appliances/Appliances/Dishwashers,Kitchen & appliances/Appliances/Dishwashers,Home electronics/Cords & chargers/Cables & accessories,Lighting/Lamps & light fixtures/Table lamps,Home electronics/Cords & chargers/Cables & accessories,Gardening & plants/Watering cans,Cookware & tableware/Drinkware/Pitchers & carafes,Gardening & plants/Watering cans,Gardening & plants/Watering cans,Lighting/Lamps & light fixtures/Ceiling lights/Pendants lights,Cookware & tableware/Serveware/Trays,Home Textiles/Window treatments/Curtain rods & rails/Curtain rods,Home Textiles/Window treatments/Curtain rods & rails/Curtain rods,Home Textiles/Window treatments/Curtain rods & rails/Curtain rods,Home Textiles/Window treatments/Curtain rods & rails/Curtain rods,Home Textiles/Window treatments/Curtain rods & rails/Curtain rods,Home Textiles/Window treatments/Curtain rods & rails/Curtain rods,Home Textiles/Window treatments/Curtain rods & rails/Curtain rods,Storage & organization/Storage containers/Bathroom accessories/Towel rails & towel holders,Storage & organization/Storage containers/Bathroom accessories/Towel rails & towel holders,Kitchen & appliances/Kitchen faucets & sinks/Kitchen faucets,Home electronics/Speakers/Wi-Fi speakers,Cookware & tableware/Drinkware/Glasses,Cookware & tableware/Kitchen & cooking accessories/Kitchen utensils/Colanders & strainers,Home electronics/Cords & chargers/Batteries & battery chargers,Home electronics/Cords & chargers/Batteries & battery chargers,Home electronics/Cords & chargers/Batteries & battery chargers,Cookware & tableware/Knives & cutting boards/Kitchen knives,Cookware & tableware/Knives & cutting boards/Kitchen knives,Cookware & tableware/Flatware/Flatware,Cookware & tableware/Flatware/Flatware,Cookware & tableware/Coffee & tea/Vacuum flasks,Cookware & tableware/Cookware & kitchenware/Pots & pans/Cooking & stock pots,Cookware & tableware/Cookware & kitchenware/Pots & pans/Cookware sets
Cookware & tableware/Coffee & tea/Mugs & cups,Home Décor/Mirrors/Wall mirrors,Home Décor/Mirrors/Wall mirrors,Home Décor/Mirrors/Wall mirrors,Storage & organization/Storage solution systems/PAX system/PAX doors without hinges,Storage & organization/Storage solution systems/PAX system/PAX doors without hinges,Storage & organization/Storage solution systems/PAX system/PAX doors without hinges,Home Décor/Clocks/Wall & table clocks,Home Décor/Clocks/Wall & table clocks,Home Décor/Clocks/Wall & table clocks,Storage & organization/Storage containers/Food storage & organizing/Spice & condiment stands,Home Décor/Clocks/Wall & table clocks,Home Décor/Clocks/Wall & table clocks,Home Textiles/Window treatments/Curtain rods & rails/Curtain rods,Home Textiles/Window treatments/Curtain rods & rails/Curtain rods,Cookware & tableware/Serveware/Bowls,Cookware & tableware/Drinkware/Pitchers & carafes,Cookware & tableware/Serveware/Serving dishes,Cookware & tableware/Dinnerware/Bowls,Cookware & tableware/Dinnerware/Bowls,Cookware & tableware/Dinnerware/Deep plates/VARDAGEN Deep plate,Cookware & tableware/Coffee & tea/Mugs & cups,Cookware & tableware/Drinkware/Specialty glassware,Cookware & tableware/Table linen/Table cloths & runners,Cookware & tableware/Dinnerware/Side plates,Cookware & tableware/Coffee & tea/Mugs & cups,Cookware & tableware/Dinnerware/Plates,Bathroom/Bathroom textiles/Shower curtains,Bathroom/Bathroom textiles/Shower curtains,Bathroom/Bathroom textiles/Shower curtains,Storage & organization/Storage containers/Food storage & organizing/Food containers,Storage & organization/Storage containers/Food storage & organizing/Food containers,Storage & organization/Storage containers/Food storage & organizing/Food containers,Baby & kids/Kids/Toys & play/Wooden toys,Storage & organization/Storage containers/Bathroom accessories/Toilet brushes,Outdoor/Grills,Storage & organization/Storage containers/Bathroom accessories/Towel rails & towel holders,Storage & organization/Storage containers/Bathroom accessories/Towel rails & towel holders,Storage & organization/Storage containers/Bathroom accessories/Towel rails & towel holders,Home Textiles/Window treatments/Curtain rods & rails/Curtain rods,Home Décor/Clocks/Wall & table clocks,Cookware & tableware/Dinnerware/Bowls,Cookware & tableware/Serveware/Bowls,Cookware & tableware/Dinnerware/Plates,Cookware & tableware/Dinnerware/Deep plates/OFTAST Deep plate,Cookware & tableware/Dinnerware/Bowls,Cookware & tableware/Dinnerware/Side plates,Storage & organization/Storage containers/Bathroom accessories/Bathroom accessory sets,Home electronics/Cords & chargers/Wireless charging & accessories,Home electronics/Cords & chargers/Wireless charging & accessories,Home electronics/Cords & chargers/Wireless charging & accessories,Storage & organization/Storage containers/Food storage & organizing/Spice & condiment stands,Outdoor/Grills,Outdoor/Grills,Home Textiles/Window treatments/Curtains & drapes/Light filtering curtains,Cookware & tableware/Table linen/Place mats & coasters,Home Décor/Flower pots & stands/Indoor plant pots,Cookware & tableware/Table linen/Place mats & coasters,Baby & kids/Baby/Baby toys/12+ months,Home Décor/Mirrors/Wall mirrors,Home Décor/Mirrors/Wall mirrors,Cookware & tableware/Table linen/Place mats & coasters,Cookware & tableware/Table linen/Place mats & coasters,Storage & organization/Storage containers/Food storage & organizing/Food containers,Cookware & tableware/Dinnerware/Plates,Cookware & tableware/Dishwashing accessories/Dish brushes,Cookware & tableware/Serveware/Trays,Cookware & tableware/Napkins & napkin holders/Napkins,Home Décor/Flower pots & stands/Indoor plant pots,Home improvement/Home safety/Child safety,Kitchen & appliances/Kitchen islands & carts,Kitchen & appliances/Kitchen islands & carts,Pet accessories/Cats,Cookware & tableware/Drinkware/Pitchers & carafes,Cookware & tableware/Bakeware/Mixing bowls,Storage & organization/Storage containers/Food storage & organizing/Food containers,Storage & organization/Storage solution systems/BESTÅ storage system/BESTÅ all parts & accessories,Cookware & tableware/Drinkware/Glasses,Lighting/Lamps & light fixtures/Kids lighting,Lighting/Lamps & light fixtures/Kids lighting,Cookware & tableware/Knives & cutting boards/Kitchen knives,Storage & organization/Storage solution systems/PAX system/PAX doors without hinges,Home Décor/Flower pots & stands/Indoor plant pots,Cookware & tableware/Flatware/Flatware,Lighting/Lamps & light fixtures/Kids lighting,Furniture/Tables & desks/Accent tables/Coffee tables,Home Textiles/Window treatments/Curtain rods & rails/Curtain rods,Cookware & tableware/Cookware & kitchenware/Pots & pans/Casserole dishes,Cookware & tableware/Cookware & kitchenware/Pots & pans/Casserole dishes,Cookware & tableware/Cookware & kitchenware/Pots & pans/Cooking & stock pots,Cookware & tableware/Cookware & kitchenware/Cooking pans/Grill pans & griddles,"Storage & organization/Shelving units, bookcases & storage options/Shelf units & cube storage",Storage & organization/Storage containers/Bathroom accessories/Bathroom shelves,Baby & kids/Kids/Toys & play/Soft toys,Baby & kids/Kids/Toys & play/Soft toys,Baby & kids/Kids/Toys & play/Soft toys,Baby & kids/Kids/Toys & play/Soft toys,Baby & kids/Kids/Toys & play/Soft toys,Baby & kids/Kids/Toys & play/Soft toys,Baby & kids/Kids/Toys & play/Soft toys
Storage & organization/Storage solution systems/PAX system/PAX sliding doors,Furniture/Tables & desks/Desks & computer desks/Desks for home,Rugs/Rugs/Runners & small rugs,Rugs/Rugs/Runners & small rugs,Baby & kids/Kids/Toys & play/Physical play,Home Décor/Mirrors/Wall mirrors,Home Décor/Mirrors/Vanity mirrors,Home Décor/Mirrors/Wall mirrors,Cookware & tableware/Knives & cutting boards/Cutting boards,Cookware & tableware/Knives & cutting boards/Cutting boards,Cookware & tableware/Knives & cutting boards/Cutting boards,Cookware & tableware/Dinnerware/Deep plates/VÄRDERA Deep plate,Home Textiles/Window treatments/Curtain rods & rails/Curtain rods,Home improvement/Home safety/Child safety,Home Textiles/Window treatments/Curtain rods & rails/Track systems,Furniture/Tables & desks/Nightstands,Storage & organization/Clothes organizers/Clothes racks & stands,Home Décor/Wall décor/Picture & photo frames,Storage & organization/Wall shelves & hooks/Hooks,Cookware & tableware/Knives & cutting boards/Cutting boards,Bathroom/Bathroom storage/Bathroom shelving units,Storage & organization/Storage containers/Food storage & organizing/Food containers,Home improvement/Home safety/Child safety,Storage & organization/Storage containers/Bathroom accessories/Towel rails & towel holders,Furniture/Room dividers,Home Décor/Wall décor/Collage picture frames,Home Textiles/Window treatments/Curtain rods & rails/Curtain rods,Cookware & tableware/Dinnerware/Side plates,Furniture/Patio furniture/Outdoor tables/Outdoor dining tables,Home Textiles/Window treatments/Curtains & drapes/Panel curtains,Storage & organization/Storage solution systems/BESTÅ storage system/BESTÅ all parts & accessories,Storage & organization/Bags/Bag organizers,Furniture/Patio furniture/Outdoor tables/Outdoor dining tables,Home Décor/Storage boxes & baskets/Clothes boxes,Outdoor/Umbrellas & gazebos/Patio umbrellas & bases,Kitchen & appliances/Kitchen systems/SEKTION kitchen/SEKTION kitchen cabinets,Kitchen & appliances/Kitchen systems/SEKTION kitchen/SEKTION kitchen cabinets,Home Décor/Decorative accessories,Kitchen & appliances/Kitchen systems/SEKTION kitchen/SEKTION kitchen cabinets,Kitchen & appliances/Kitchen systems/SEKTION kitchen/SEKTION kitchen cabinets,Kitchen & appliances/Kitchen systems/SEKTION kitchen/SEKTION kitchen cabinets,Home Décor/Storage boxes & baskets/Kids boxes & baskets,Furniture/Tables & desks/Dining tables/Up to 6 seats,Furniture/Chairs/Dining chairs/Dining chairs,Home Textiles/Window treatments/Curtain rods & rails/Track systems,Home Textiles/Window treatments/Curtain rods & rails/Track systems,Home Textiles/Window treatments/Curtain rods & rails/Track systems,Home Textiles/Window treatments/Curtain rods & rails/Track systems,Furniture/Tables & desks/Accent tables/End tables & side tables,Outdoor/Outdoor flooring,Outdoor/Outdoor flooring,Outdoor/Outdoor flooring,Cookware & tableware/Dinnerware/Plates,Home Décor/Wall décor/Wall decals & stickers,Home Décor/Wall décor/Picture & photo frames,Home Décor/Wall décor/Picture & photo frames,Home Décor/Wall décor/Picture & photo frames,Home Décor/Wall décor/Picture & photo frames,Furniture/Patio furniture/Outdoor tables/Outdoor coffee & side tables,Furniture/Tables & desks/Accent tables/End tables & side tables,Furniture/Tables & desks/Accent tables/End tables & side tables,Home Textiles/Window treatments/Curtain rods & rails/Track systems,Laundry & cleaning/Cleaning accessories,Home Décor/Mirrors/Makeup & magnifying mirrors,Storage & organization/Storage containers/Food storage & organizing/Food containers,Furniture/Sofas & sectionals/Ottomans/Fabric ottomans,Furniture/Tables & desks/Dining tables/Up to 10 seats,Home Décor/Wall décor/Picture & photo frames,Home Décor/Wall décor/Picture & photo frames,Storage & organization/Clothes organizers/Shoe racks & stands,Storage & organization/Armoires & wardrobes/Solitaire wardrobes,Furniture/Patio furniture/Outdoor tables/Outdoor dining tables,Cookware & tableware/Dishwashing accessories/Dish brushes,Kitchen & appliances/Kitchen islands & carts,Furniture/Tables & desks/Bar tables,Furniture/Tables & desks/Café tables,Home Décor/Wall décor/Picture & photo frames,Home Décor/Wall décor/Picture & photo frames,Home Décor/Wall décor/Picture & photo frames,Home Décor/Wall décor/Picture & photo frames,Furniture/Tables & desks/Nightstands,Furniture/Chairs/Stools & benches/Stools,Furniture/Tables & desks/Nightstands,Furniture/Chairs/Bar stools & chairs,Cookware & tableware/Cookware & kitchenware/Cooking accessories,Furniture/Tables & desks/Kids tables,Furniture/Tables & desks/Accent tables/Coffee tables,Bathroom/Bathroom storage/Bathroom shelving units/RÅGRUND Sink shelf,Bathroom/Bathroom storage/Bathroom shelving units,Furniture/Tables & desks/Accent tables/Coffee tables,Kitchen & appliances/Kitchen countertops/Butcher block countertops,Kitchen & appliances/Kitchen countertops/Butcher block countertops,Kitchen & appliances/Kitchen countertops/Butcher block countertops,Kitchen & appliances/Kitchen countertops/Butcher block countertops,Kitchen & appliances/Kitchen countertops/Butcher block countertops,Kitchen & appliances/Kitchen countertops/Butcher block countertops,"Storage & organization/Shelving units, bookcases & storage options/Shelf units & cube storage",Furniture/Tables & desks/Dining tables/Dining table tops & underframes,"Storage & organization/Display & storage cabinets/Buffet tables, sideboard buffets & buffet cabinets",Kitchen & appliances/Kitchen drawer organization/Kitchen trash cans & bins
