Beds & mattresses/Bedding/Blankets & throws,Beds & mattresses/Bedding/Pillows/Polyester pillows,Rugs/Rugs/Large & medium rugs,Baby & kids/Baby/Cribs & crib mattresses/Baby canopies,Beds & mattresses/Bedding/Cushions & cushions covers/Cushion covers,Beds & mattresses/Bedding/Cushions & cushions covers/Cushion covers,Beds & mattresses/Bedding/Blankets & throws,Beds & mattresses/Bedding/Cushions & cushions covers/Cushions,Beds & mattresses/Bedding/Blankets & throws,Beds & mattresses/Bedding/Cushions & cushions covers/Cushion covers,Beds & mattresses/Bedding/Blankets & throws,Rugs/Rugs/Door mats,Beds & mattresses/Bedding/Blankets & throws,Beds & mattresses/Bedding/Cushions & cushions covers/Cushions,Bathroom/Bathroom textiles/Towels/Wash cloths,Bathroom/Bathroom textiles/Towels/Bath sheets,Bathroom/Bathroom textiles/Towels/Hand towels,Furniture/Sofas & sectionals/Sofa & armchairs covers/FLOTTEBO covers,Bathroom/Bathroom textiles/Towels/Hand towels,Bathroom/Bathroom textiles/Towels/Bath towels,Laundry & cleaning/Laundry baskets,Beds & mattresses/Bedding/Blankets & throws/FÄLTMAL Pillow,Furniture/Armchairs & chaises/Rattan armchairs,Furniture/Armchairs & chaises/Rattan armchairs,Beds & mattresses/Mattresses/Kids mattresses,Furniture/Tables & desks/Changing tables,Furniture/Beds/Kids beds/Kids bed accessories & canopies,Furniture/Sofas & sectionals/Sofa & armchairs covers/FÄRLÖV covers,Beds & mattresses/Bedding/Cushions & cushions covers/Cushion covers,"Furniture/Patio furniture/Outdoor seat cushions/SÖTHOLMEN Cushion cover, in",Beds & mattresses/Bedding/Cushions & cushions covers/Cushions,Beds & mattresses/Bedding/Bedlinen/Duvet cover sets,Furniture/Patio furniture/Outdoor seat cushions,"Outdoor/Outdoor cushions/Outdoor pillows/FUNKÖN Back cushion, indoor","Outdoor/Outdoor cushions/Outdoor pillows/FUNKÖN Cushion cover, in",Beds & mattresses/Bedding/Pillows/Down & feather pillows,Beds & mattresses/Bedding/Pillows/Down & feather pillows,Beds & mattresses/Bedding/Cushions & cushions covers/Inner cushions,Beds & mattresses/Bedding/Cushions & cushions covers/Inner cushions,Beds & mattresses/Bedding/Cushions & cushions covers/Inner cushions,Beds & mattresses/Bedding/Blankets & throws,Beds & mattresses/Mattresses/Mattress toppers,Beds & mattresses/Bedding/Cushions & cushions covers/Cushion covers,Rugs/Rugs/Sheepskins & cowhides,Rugs/Rugs/Sheepskins & cowhides,Beds & mattresses/Bedding/Bedlinen/Duvet cover sets,Beds & mattresses/Bedding/Bedlinen/Duvet cover sets,Rugs/Rugs/Runners & small rugs,Furniture/Sofas & sectionals/Sofa & armchairs covers/STOCKSUND covers,Beds & mattresses/Bedding/Cushions & cushions covers/Cushion covers,Beds & mattresses/Bedding/Bedlinen/Duvet cover sets,Beds & mattresses/Bedding/Bedlinen/Duvet cover sets,Beds & mattresses/Bedding/Bedlinen/Duvet cover sets,Furniture/Beds/Sleeper sofas/Mattress choices,Baby & kids/Baby/Baby textiles/Nursery rugs,Rugs/Rugs/Large & medium rugs,Home Textiles/Window treatments/Curtains & drapes/Light filtering curtains,Furniture/Patio furniture/Outdoor seat cushions,Furniture/Patio furniture/Outdoor seat cushions,Beds & mattresses/Bedding/Comforters/Down & feather comforters,Beds & mattresses/Bedding/Comforters/Down & feather comforters,Beds & mattresses/Bedding/Comforters/Down & feather comforters,Beds & mattresses/Bedding/Cushions & cushions covers/Children's cushions & blankets,"Rugs/Rugs/Large & medium rugs/SKARRILD Rug flatwoven, in",Beds & mattresses/Bedding/Bedlinen/Duvet cover sets,Beds & mattresses/Bedding/Cushions & cushions covers/Cushion covers,Beds & mattresses/Bedding/Cushions & cushions covers/Cushion covers,Beds & mattresses/Bedding/Cushions & cushions covers/Cushion covers,Beds & mattresses/Bedding/Comforters/Polyester comforters,Beds & mattresses/Bedding/Comforters/Polyester comforters,Baby & kids/Baby/Baby textiles/Baby quilts & pillows,Beds & mattresses/Bedding/Bedlinen/Duvet cover sets,Rugs/Rugs/Runners & small rugs,Rugs/Rugs/Door mats,Cookware & tableware/Kitchen textiles/Kitchen towels,Beds & mattresses/Bedding/Bedlinen/Duvet cover sets,Furniture/Beds/Sleeper sofas/Mattress choices,Furniture/Armchairs & chaises/Kids armchairs,Furniture/Chairs/High chairs,"Baby & kids/Baby/Changing, bathing & potty/Changing accessories",Furniture/Sofas & sectionals/Sofa & armchairs covers/VINLIDEN covers,Beds & mattresses/Bedding/Cushions & cushions covers/Cushion covers,Bathroom/Bathroom textiles/Shower curtains,Beds & mattresses/Bedding/Cushions & cushions covers/Cushion covers,Beds & mattresses/Bedding/Bedspreads,Cookware & tableware/Kitchen textiles/Pot holders & oven mitts,Cookware & tableware/Kitchen textiles/Pot holders & oven mitts,Cookware & tableware/Kitchen textiles/Pot holders & oven mitts,Beds & mattresses/Bedding/Mattress & pillow protectors,Bathroom/Bathroom textiles/Towels/Bath sheets,Bathroom/Bathroom textiles/Towels/Wash cloths,Bathroom/Bathroom textiles/Towels/Hand towels,Beds & mattresses/Bedding/Cushions & cushions covers/Children's cushions & blankets,Rugs/Rugs/Round rugs,Beds & mattresses/Bedding/Cushions & cushions covers/Cushion covers,Beds & mattresses/Bedding/Blankets & throws,Beds & mattresses/Bedding/Cushions & cushions covers/Cushion covers,Bathroom/Bathroom textiles/Towels/Bath towels,"Baby & kids/Baby/Changing, bathing & potty/Changing accessories",Furniture/Sofas & sectionals/Sofa & armchairs covers/POÄNG
Storage & organization/Storage solution systems/AURDAL system/AURDAL parts,Storage & organization/Storage solution systems/AURDAL system/AURDAL parts,Storage & organization/Storage solution systems/AURDAL system/AURDAL parts,Storage & organization/Storage solution systems/AURDAL system/AURDAL parts,Storage & organization/Storage solution systems/AURDAL system/AURDAL parts,Storage & organization/Storage solution systems/AURDAL system/AURDAL parts,Storage & organization/Storage solution systems/AURDAL system/AURDAL parts,Storage & organization/Storage solution systems/AURDAL system/AURDAL parts,Storage & organization/Storage solution systems/AURDAL system/AURDAL parts,Storage & organization/Storage solution systems/AURDAL system/AURDAL parts,Storage & organization/Storage solution systems/AURDAL system/AURDAL parts,Storage & organization/Storage solution systems/AURDAL system/AURDAL parts,Home Décor/Mirrors/Wall mirrors,Storage & organization/Clothes organizers/Shoe racks & stands,Baby & kids/Kids/Kids storage & organization/Children's hooks & wall organization,"Storage & organization/Shelving units, bookcases & storage options/Shelf units & cube storage","Storage & organization/Shelving units, bookcases & storage options/Shelf units & cube storage",Home electronics/Cords & chargers/Wireless charging & accessories,Kitchen & appliances/Kitchen drawer organization/Drawer dividers,Storage & organization/Wall shelves/Brackets,Storage & organization/Storage containers/Bathroom accessories/Shower accessories,Storage & organization/Storage containers/Bathroom accessories/Towel rails & towel holders,Bathroom/Showers/Shower sets & rails,Storage & organization/Storage containers/Bathroom accessories/Shower accessories,Storage & organization/Storage containers/Bathroom accessories/Towel rails & towel holders,Storage & organization/Storage containers/Bathroom accessories/Soap dispensers & soap dishes,Storage & organization/Storage containers/Bathroom accessories/Toilet roll holders & stands,Storage & organization/Storage containers/Bathroom accessories/Toothbrush holders,Bathroom/Bathroom storage/Bathroom shelving units,Storage & organization/Storage containers/Food storage & organizing/Cooler bags,Cookware & tableware/Knives & cutting boards/Cutting boards,Bathroom/Bathroom storage/Bathroom storage/Bathroom wall cabinets,Cookware & tableware/Cookware & kitchenware/Ovenware,Cookware & tableware/Serveware/Trays,Storage & organization/Storage containers/Bathroom accessories/Shower accessories,Storage & organization/Storage containers/Paper & media organizers/Media accessories,Cookware & tableware/Cookware & kitchenware/Cooking pans/Frying pans & skillets,Cookware & tableware/Cookware & kitchenware/Pots & pans/Cooking & stock pots,Cookware & tableware/Cookware & kitchenware/Pots & pans/Saucepans,Cookware & tableware/Cookware & kitchenware/Pots & pans/Cooking & stock pots,Cookware & tableware/Cookware & kitchenware/Pots & pans/Cooking & stock pots,Cookware & tableware/Cookware & kitchenware/Cooking pans/Frying pans & skillets,Cookware & tableware/Cookware & kitchenware/Cooking pans/Frying pans & skillets,Cookware & tableware/Cookware & kitchenware/Cooking pans/Frying pans & skillets,Cookware & tableware/Cookware & kitchenware/Pots & pans/Cooking & stock pots,Home Décor/Mirrors/Makeup & magnifying mirrors,Storage & organization/Storage solution systems/BESTÅ storage system/BESTÅ all parts & accessories,Bathroom/Showers/Shower heads,Storage & organization/Storage solution systems/IVAR system/All parts,Storage & organization/Storage containers/Bins & bags/Trash cans & pedal bins,Storage & organization/Storage solution systems/BESTÅ storage system/BESTÅ all parts & accessories,Storage & organization/Dressers & storage drawers/Chests of drawers,Storage & organization/Dressers & storage drawers/Chests of drawers,Storage & organization/Dressers & storage drawers/Chests of drawers,Storage & organization/Dressers & storage drawers/Chests of drawers,Storage & organization/Storage solution systems/SMÅSTAD system/SMÅSTAD interior fittings,Storage & organization/Storage solution systems/SMÅSTAD system/SMÅSTAD interior fittings,Storage & organization/Storage solution systems/BESTÅ storage system/BESTÅ all parts & accessories,Furniture/Tables & desks/Dining tables/Up to 6 seats,Furniture/Tables & desks/Kids tables,Furniture/Tables & desks/Dining tables/Up to 10 seats,Cookware & tableware/Cookware & kitchenware/Cooking pans/Frying pans & skillets,Kitchen & appliances/Kitchen systems/SEKTION kitchen/SEKTION kitchen cabinets,Kitchen & appliances/Kitchen systems/SEKTION kitchen/SEKTION kitchen cabinets/Cabinet doors & drawer fronts,Kitchen & appliances/Kitchen faucets & sinks/Sink parts,Cookware & tableware/Cookware & kitchenware/Pots & pans/Saucepans,Cookware & tableware/Cookware & kitchenware/Cooking pans/Frying pans & skillets,Kitchen & appliances/Kitchen systems/SEKTION kitchen/SEKTION kitchen cabinets,Cookware & tableware/Cookware & kitchenware/Cooking pans/Frying pans & skillets,Kitchen & appliances/Kitchen systems/SEKTION kitchen/SEKTION kitchen cabinets,Cookware & tableware/Cookware & kitchenware/Pots & pans/Cookware sets,Cookware & tableware/Cookware & kitchenware/Cooking pans/Frying pans & skillets,Cookware & tableware/Cookware & kitchenware/Pots & pans/Cooking & stock pots,Cookware & tableware/Cookware & kitchenware/Cooking pans/Frying pans & skillets,Cookware & tableware/Cookware & kitchenware/Cooking pans/Frying pans & skillets,Home Décor/Storage boxes & baskets/Paper & media boxes,Kitchen & appliances/Kitchen drawer organization/Drawer dividers,Storage & organization/Clothes organizers/Shoe cabinets,Storage & organization/Clothes organizers/Shoe cabinets,Storage & organization/Clothes organizers/Shoe cabinets,Storage & organization/Clothes organizers/Shoe cabinets,Storage & organization/Clothes organizers/Shoe cabinets,Storage & organization/Clothes organizers/Shoe cabinets,Storage & organization/Clothes organizers/Shoe cabinets,Storage & organization/Wall shelves/Complete wall shelves,Furniture/Chairs/High chairs,Storage & organization/Storage containers/Bins & bags/Trash cans & pedal bins,Furniture/Tables & desks/Table & desk systems/GALANT/BEKANT system,Furniture/Tables & desks/Table & desk systems/IDÅSEN system,Storage & organization/Storage solution systems/PAX system/PAX Interior organizers,"Storage & organization/Shelving units, bookcases & storage options/Bookcases",Furniture/Tables & desks/Table & desk systems/IDÅSEN system,Furniture/Tables & desks/Table & desk systems/GALANT/BEKANT system,Storage & organization/Storage solution systems/PAX system/PAX Interior organizers,Furniture/Tables & desks/Table & desk systems/GALANT/BEKANT system,Furniture/Tables & desks/Table & desk systems/GALANT/BEKANT system,Furniture/Tables & desks/Table & desk systems/GALANT/BEKANT system,Furniture/Tables & desks/Table & desk systems/GALANT/BEKANT system,Furniture/Tables & desks/Table & desk systems/GALANT/BEKANT system/BEKANT desk underframes/BEKANT Sit,Storage & organization/Storage solution systems/PAX system/PAX Interior organizers
"Home Textiles/Window treatments/Shades, blinds & window treatments/Roman shades",Home Textiles/Window treatments/Curtains & drapes/Light filtering curtains,Home Textiles/Window treatments/Curtains & drapes/Panel curtains,Home Textiles/Window treatments/Curtains & drapes/Light filtering curtains,Home Textiles/Window treatments/Curtains & drapes/Light filtering curtains,Home Textiles/Window treatments/Curtains & drapes/Panel curtains,Home Textiles/Window treatments/Curtains & drapes/Light filtering curtains,Home Textiles/Window treatments/Curtains & drapes/Light filtering curtains,Home Textiles/Window treatments/Curtains & drapes/Panel curtains,Home Textiles/Window treatments/Curtains & drapes/Light filtering curtains,Home Textiles/Window treatments/Curtains & drapes/Light filtering curtains,Home Textiles/Window treatments/Curtains & drapes/Light filtering curtains,"Home Textiles/Window treatments/Shades, blinds & window treatments/Pleated & cellular blinds and shades",Home Textiles/Window treatments/Curtains & drapes/Panel curtains,Rugs/Rugs/Door mats,Baby & kids/Kids/Toys & play/Role play,Lighting/Lamps & light fixtures/Kids lighting,Home Décor/Noticeboards,Baby & kids/Kids/Toys & play/Role play,"Home improvement/Oils, stains & product care","Home improvement/Oils, stains & product care","Home improvement/Oils, stains & product care","Home improvement/Oils, stains & product care",Baby & kids/Kids/Toys & play/Physical play,Storage & organization/Clothes organizers/Clothes racks & stands,Storage & organization/Clothes organizers/Clothes racks & stands,Bathroom/Bathroom sinks,Bathroom/Bathroom sinks,Bathroom/Bathroom sinks,Bathroom/Bathroom sinks,Bathroom/Bathroom sinks,Home Décor/Mirrors/Vanity mirrors,Pet accessories/Cats,Storage & organization/Storage solution systems/PAX system/PAX doors without hinges,Furniture/Patio furniture/Outdoor chaises & hammocks,Kitchen & appliances/Backsplashes & wall panels/Laminate backsplashes,Kitchen & appliances/Backsplashes & wall panels/Laminate backsplashes,Kitchen & appliances/Backsplashes & wall panels/Laminate backsplashes,Home Décor/Clocks/Alarm clocks,Outdoor/Umbrellas & gazebos/Patio umbrellas & bases,Home Textiles/Window treatments/Curtain rods & rails/Track systems,Bathroom/Bathroom textiles/Shower curtains,Bathroom/Showers/Shower heads,Cookware & tableware/Serveware/Trays,Cookware & tableware/Serveware/Trays,"Home Textiles/Window treatments/Shades, blinds & window treatments/Black-out shades & blinds","Storage & organization/Clothes organizers/Clothes racks & stands/TURBO Clothes rack, indoor","Storage & organization/Wall shelves & hooks/Hooks/BRANDUR Hook, in-",Storage & organization/Wall shelves & hooks/Hooks,"Storage & organization/Wall shelves & hooks/Hooks/BRANDUR Hook, in-","Storage & organization/Wall shelves & hooks/Hooks/BRANDUR Rail with 4 hooks, in-","Laundry & cleaning/Drying racks/MULIG Drying rack, indoor",Home Décor/Candle holders & candles/Lanterns,Home Décor/Flower pots & stands/Indoor plant pots,Storage & organization/Wall shelves & hooks/Hooks,Cookware & tableware/Flatware/Flatware,Furniture/Tables & desks/Accent tables/Coffee tables,Furniture/Tables & desks/Accent tables/Coffee tables,Furniture/Tables & desks/Dining tables/Up to 4 seats,Laundry & cleaning/Cleaning accessories,Home Décor/Storage boxes & baskets/Baskets,Cookware & tableware/Cookware & kitchenware/Cooking pans/Woks,Home Décor/Clocks/Alarm clocks,Home Décor/Clocks/Alarm clocks,Home electronics/Speakers/Wi-Fi speakers,Rugs/Rugs/Door mats,Cookware & tableware/Cookware & kitchenware/Cooking pans/Frying pans & skillets,Storage & organization/Storage solution systems/PAX system/PAX doors without hinges,Cookware & tableware/Coffee & tea/Mugs & cups,Cookware & tableware/Dinnerware/Dinnerware sets,Cookware & tableware/Coffee & tea/Mugs & cups,Cookware & tableware/Napkins & napkin holders/Napkin holders,Storage & organization/Storage solution systems/PAX system/PAX doors without hinges,Outdoor/Umbrellas & gazebos/Patio umbrellas & bases,Storage & organization/TV & media furniture/TV stands & benches,Storage & organization/Wall shelves/Complete wall shelves/HEMNES Wall,Home Décor/Storage boxes & baskets/Secondary storage boxes,Storage & organization/Storage containers/Bins & bags/Trash cans & pedal bins,Storage & organization/Storage containers/Paper & media organizers/Desk accessories,Storage & organization/Dressers & storage drawers/Chests of drawers,Home Textiles/Window treatments/Curtains & drapes/Room darkening curtains & drapes,Kitchen & appliances/Kitchen systems/SEKTION kitchen/SEKTION kitchen cabinets,Kitchen & appliances/Kitchen systems/SEKTION kitchen/SEKTION kitchen cabinets,Kitchen & appliances/Kitchen systems/SEKTION kitchen/SEKTION kitchen cabinets,Kitchen & appliances/Kitchen systems/SEKTION kitchen/SEKTION kitchen cabinets,Kitchen & appliances/Kitchen systems/SEKTION kitchen/SEKTION kitchen cabinets,Furniture/Patio furniture/Outdoor tables/Outdoor dining tables,Cookware & tableware/Dinnerware/Dinnerware sets,Cookware & tableware/Dinnerware/Bowls,Cookware & tableware/Dinnerware/Deep plates/FLITIGHET Deep plate,Cookware & tableware/Dinnerware/Plates,Cookware & tableware/Dinnerware/Side plates,Baby & kids/Baby/Baby toys/Newborn,Furniture/Tables & desks/Dining tables/Up to 6 seats,IKEA food & restaurant/Meat,Cookware & tableware/Coffee & tea/Mugs & cups,Cookware & tableware/Dinnerware/Side plates,Cookware & tableware/Dinnerware/Bowls,Cookware & tableware/Dinnerware/Plates,Kitchen & appliances/Kitchen countertops/Laminate countertops
Storage & organization/Display & storage cabinets/Display cabinets,"Storage & organization/Shelving units, bookcases & storage options/Shelf units & cube storage",Kitchen & appliances/Kitchen drawer organization/Shelves & drawers,Storage & organization/Wall shelves & hooks/Hooks,Cookware & tableware/Knives & cutting boards/Sharpening tools,Storage & organization/Storage solution systems/PAX system/PAX Interior organizers,Storage & organization/Storage solution systems/PAX system/PAX Interior organizers,Bathroom/Bathroom storage/Bathroom storage/Bathroom wall cabinets,Home Décor/Storage boxes & baskets/Paper & media boxes,Furniture/Tables & desks/Accent tables/End tables & side tables,Home electronics/Speakers/Wi-Fi speakers,Home electronics/Speakers/Wi-Fi speakers,Storage & organization/Storage solution systems/BESTÅ storage system/BESTÅ all parts & accessories,Bathroom/Bathroom vanities/Bathroom vanity legs,Bathroom/Bathroom storage/Bathroom storage/Bathroom tall cabinets,Home electronics/Speakers/Wi-Fi speakers,Storage & organization/Storage containers/Cable management & accessories,"Storage & organization/Shelving units, bookcases & storage options/Shelf units & cube storage",Home Décor/Mirrors/Mirror cabinets,Home Décor/Mirrors/Mirror cabinets,Kitchen & appliances/Kitchen systems/SUNNERSTA modular kitchen/Accessories for SUNNERSTA,Kitchen & appliances/Kitchen wall organization & storage/Wall organizers,Kitchen & appliances/Kitchen systems/SUNNERSTA modular kitchen/Accessories for SUNNERSTA,Kitchen & appliances/Kitchen systems/SUNNERSTA modular kitchen/Accessories for SUNNERSTA,Kitchen & appliances/Kitchen systems/SUNNERSTA modular kitchen/Accessories for SUNNERSTA,Kitchen & appliances/Kitchen systems/SUNNERSTA modular kitchen/Accessories for SUNNERSTA,Kitchen & appliances/Kitchen wall organization & storage/Wall organizers,Storage & organization/Display & storage cabinets/Dining room cabinets & cupboards,Storage & organization/Storage solution systems/IVAR system/All parts,Storage & organization/Storage solution systems/IVAR system/All parts,Storage & organization/Storage solution systems/IVAR system/All parts,Storage & organization/Storage solution systems/IVAR system/All parts,Storage & organization/Storage solution systems/IVAR system/All parts,Storage & organization/Storage solution systems/IVAR system/All parts,Storage & organization/Storage solution systems/IVAR system/All parts,Storage & organization/Storage solution systems/IVAR system/All parts,Storage & organization/Storage solution systems/IVAR system/All parts,Storage & organization/Storage solution systems/IVAR system/All parts,Storage & organization/Storage solution systems/IVAR system/All parts,Storage & organization/Storage solution systems/IVAR system/All parts,Storage & organization/Storage solution systems/IVAR system/All parts,Storage & organization/Storage solution systems/IVAR system/All parts,Storage & organization/Storage solution systems/IVAR system/All parts,Storage & organization/Storage solution systems/IVAR system/All parts,Storage & organization/Display & storage cabinets/Dining room cabinets & cupboards,Storage & organization/Storage solution systems/IVAR system/All parts,Storage & organization/Storage solution systems/IVAR system/All parts,Storage & organization/Storage solution systems/IVAR system/All parts,Storage & organization/Storage solution systems/IVAR system/All parts,Furniture/Chairs/Bar stools & chairs,Storage & organization/Display & storage cabinets/Dining room cabinets & cupboards,Storage & organization/Storage solution systems/IVAR system/All parts,Storage & organization/Storage solution systems/BESTÅ storage system/BESTÅ all parts & accessories,Cookware & tableware/Serveware/Trays,Cookware & tableware/Serveware/Trays,Cookware & tableware/Serveware/Trays,Storage & organization/Storage containers/Food storage & organizing/Food containers,Storage & organization/Armoires & wardrobes/Solitaire wardrobes,Storage & organization/Storage solution systems/SMÅSTAD system/SMÅSTAD doors & drawers,Furniture/Kids furniture/Toy storage,Furniture/Kids furniture/Toy storage,Storage & organization/Storage solution systems/SMÅSTAD system/SMÅSTAD doors & drawers,Furniture/Kids furniture/Toy storage,Furniture/Kids furniture/Toy storage,Storage & organization/Storage solution systems/SMÅSTAD system/SMÅSTAD doors & drawers,Home electronics/Speakers/Wi-Fi speakers,Kitchen & appliances/Kitchen drawer organization/Drawer dividers,Storage & organization/TV & media furniture/TV stands & benches,Kitchen & appliances/Kitchen islands & carts,Kitchen & appliances/Kitchen islands & carts,Kitchen & appliances/Kitchen islands & carts,Kitchen & appliances/Kitchen islands & carts,Kitchen & appliances/Kitchen systems/SEKTION kitchen/SEKTION kitchen cabinets,Storage & organization/Storage containers/Food storage & organizing/Food containers,Storage & organization/Display & storage cabinets/Dining room cabinets & cupboards,"Storage & organization/Shelving units, bookcases & storage options/Shelf units & cube storage",Storage & organization/Storage containers/Paper & media organizers/Desk accessories,"Storage & organization/Shelving units, bookcases & storage options/Storage shelves & units",Home Décor/Storage boxes & baskets/Secondary storage boxes,"Storage & organization/Shelving units, bookcases & storage options/Shelf units & cube storage",Furniture/Tables & desks/Bar tables,Furniture/Patio furniture/Outdoor tables/Outdoor dining tables,Cookware & tableware/Cookware & kitchenware/Cooking pans/Grill pans & griddles,Storage & organization/Display & storage cabinets/Display cabinets,Storage & organization/Display & storage cabinets/Display cabinets,Furniture/Tables & desks/Accent tables/End tables & side tables,Storage & organization/Storage containers/Food storage & organizing/Food containers,Kitchen & appliances/Kitchen drawer organization/Shelves & drawers,Home Décor/Storage boxes & baskets/Paper & media boxes,Furniture/Tables & desks/Desks & computer desks/Desks for home,Furniture/Tables & desks/Desks & computer desks/Desks for home,Furniture/Tables & desks/Desks & computer desks/Desks for home,Storage & organization/Wall shelves & hooks/Hooks,Storage & organization/Wall shelves/Shelves,Storage & organization/Wall shelves/Shelves,"Storage & organization/Display & storage cabinets/Buffet tables, sideboard buffets & buffet cabinets",Storage & organization/Storage solution systems/BESTÅ storage system/BESTÅ all parts & accessories/BESTÅ fittings & inside organizers,Furniture/Patio furniture/Outdoor chairs/Outdoor dining chairs,Bathroom/Bathroom vanities/Vanity cabinets with sink,Bathroom/Bathroom vanities/Vanity cabinets with sink
