Beds & mattresses/Bedding/Cushions & cushions covers/Cushion covers,Furniture/Sofas & sectionals/Sofa & armchairs covers/FLOTTEBO covers,Beds & mattresses/Bedding/Cushions & cushions covers/Children's cushions & blankets,Beds & mattresses/Bedding/Bedlinen/Duvet cover sets,Baby & kids/Baby/Baby textiles/Baby blankets & quilts,Beds & mattresses/Bedding/Bedlinen/Duvet cover sets,Rugs/Rugs/Large & medium rugs,Beds & mattresses/Bedding/Pillows/Down & feather pillows,Rugs/Rugs/Runners & small rugs,Beds & mattresses/Bedding/Pillows/Down & feather pillows,Beds & mattresses/Bedding/Blankets & throws,Beds & mattresses/Bedding/Bedlinen/Pillowcases,Bathroom/Bathroom textiles/Towels/Wash cloths,Bathroom/Bathroom textiles/Towels/Hand towels,Bathroom/Bathroom textiles/Towels/Bath sheets,Beds & mattresses/Bedding/Bedlinen/Duvet cover sets,Bathroom/Bathroom textiles/Towels/Bath sheets,Pet accessories/Cats,Pet accessories/Cats,Beds & mattresses/Bedding/Comforters/Down & feather comforters,Beds & mattresses/Bedding/Comforters/Down & feather comforters,Beds & mattresses/Bedding/Comforters/Down & feather comforters,Beds & mattresses/Bedding/Comforters/Down & feather comforters,Beds & mattresses/Bedding/Comforters/Down & feather comforters,Beds & mattresses/Bedding/Comforters/Down & feather comforters,Pet accessories/Cats,Beds & mattresses/Bedding/Pillows/Polyester pillows,Beds & mattresses/Bedding/Blankets & throws,Bathroom/Bathroom textiles/Towels/Bath towels,Furniture/Sofas & sectionals/Sofa & armchairs covers/UPPLAND covers,Rugs/Rugs/Runners & small rugs,Baby & kids/Baby/Baby textiles/Baby quilts & pillows,Beds & mattresses/Bedding/Bedlinen/Baby bed linen,Beds & mattresses/Bedding/Bedlinen/Baby bed linen,Furniture/Sofas & sectionals/Sofa & armchairs covers/BRÅTHULT covers,Furniture/Sofas & sectionals/Sofa & armchairs covers/BRÅTHULT covers,Beds & mattresses/Bedding/Cushions & cushions covers/Cushion covers,"Baby & kids/Baby/Changing, bathing & potty/Changing accessories",Beds & mattresses/Bedding/Blankets & throws,Bathroom/Bathroom textiles/Towels/Bath towels,Beds & mattresses/Bedding/Blankets & throws,Bathroom/Bathroom textiles/Towels/Hand towels,Outdoor/Umbrellas & gazebos/Patio umbrellas & bases,Beds & mattresses/Bedding/Cushions & cushions covers/Cushion covers,Beds & mattresses/Bedding/Bedlinen/Baby bed linen,Rugs/Bath mats,Beds & mattresses/Bedding/Cushions & cushions covers/Cushion covers,Bathroom/Bathroom textiles/Towels/Bath sheets,Furniture/Sofas & sectionals/Sofa & armchairs covers/VRETSTORP covers,Beds & mattresses/Bedding/Cushions & cushions covers/Cushions,Bathroom/Bathroom textiles/Towels/Wash cloths,Bathroom/Bathroom textiles/Towels/Hand towels,Bathroom/Bathroom textiles/Towels/Wash cloths,Outdoor/Umbrellas & gazebos/Patio umbrellas & bases,Beds & mattresses/Bedding/Bedlinen/Duvet cover sets,Baby & kids/Baby/Baby textiles/Baby towels & washcloths,Furniture/Sofas & sectionals/Sofa & armchairs covers/FÄRLÖV covers,Furniture/Sofas & sectionals/Sofa & armchairs covers/UPPLAND covers,"Outdoor/Outdoor cushions/Outdoor pillows/FUNKÖN Cushion cover, in",Beds & mattresses/Bedding/Pillows/Down & feather pillows,Beds & mattresses/Bedding/Cushions & cushions covers/Cushions,Outdoor/Umbrellas & gazebos/Patio umbrellas & bases,Beds & mattresses/Bedding/Bedlinen/Baby bed linen,Furniture/Patio furniture/Outdoor seat cushions,Beds & mattresses/Bedding/Pillows/Down & feather pillows,Furniture/Sofas & sectionals/Sofa & armchairs covers/KLIPPAN covers,Furniture/Sofas & sectionals/Sofa & armchairs covers/UPPLAND covers,Beds & mattresses/Bedding/Pillows/Polyester pillows,Beds & mattresses/Bedding/Bedspreads,Outdoor/Umbrellas & gazebos/Patio umbrellas & bases,"Outdoor/Outdoor cushions/Outdoor pillows/FUNKÖN Back cushion, indoor",Rugs/Bath mats,Beds & mattresses/Bedding/Blankets & throws/FÄLTMAL Pillow,Beds & mattresses/Bedding/Cushions & cushions covers/Cushion covers,Beds & mattresses/Bedding/Cushions & cushions covers/Cushion covers,Furniture/Sofas & sectionals/Sofa & armchairs covers/UPPLAND covers,Beds & mattresses/Bedding/Cushions & cushions covers/Children's cushions & blankets,Beds & mattresses/Bedding/Bedspreads,Beds & mattresses/Bedding/Cushions & cushions covers/Cushion covers,Beds & mattresses/Bedding/Blankets & throws,Rugs/Rugs/Large & medium rugs,Beds & mattresses/Bedding/Cushions & cushions covers/Cushion covers,Beds & mattresses/Bedding/Comforters/Polyester comforters,Beds & mattresses/Bedding/Blankets & throws,Beds & mattresses/Bedding/Bedspreads,Beds & mattresses/Bedding/Cushions & cushions covers/Cushion covers,Beds & mattresses/Bedding/Cushions & cushions covers/Cushion covers,Beds & mattresses/Bedding/Cushions & cushions covers/Cushion covers,Home Textiles/Fabrics & sewing/Fabrics,Bathroom/Bathroom textiles/Towels/Bath towels,Beds & mattresses/Bedding/Blankets & throws,Beds & mattresses/Bedding/Blankets & throws,Home Textiles/Fabrics & sewing/Fabrics,Beds & mattresses/Bedding/Blankets & throws,Home Textiles/Window treatments/Curtains & drapes/Light filtering curtains,"Furniture/Patio furniture/Outdoor seat cushions/SÖTHOLMEN Cushion cover, in",Bathroom/Bathroom textiles/Towels/Hand towels,Bathroom/Bathroom textiles/Towels/Bath towels,Beds & mattresses/Bedding/Blankets & throws,Furniture/Chairs/High chairs
Storage & organization/Storage solution systems/AURDAL system/AURDAL parts,Storage & organization/Storage solution systems/AURDAL system/AURDAL parts,Storage & organization/Storage solution systems/AURDAL system/AURDAL parts,Storage & organization/Storage solution systems/AURDAL system/AURDAL parts,Storage & organization/Storage solution systems/AURDAL system/AURDAL parts,Storage & organization/Storage solution systems/AURDAL system/AURDAL parts,Storage & organization/Storage solution systems/AURDAL system/AURDAL parts,Storage & organization/Storage solution systems/AURDAL system/AURDAL parts,Storage & organization/Storage solution systems/AURDAL system/AURDAL parts,Cookware & tableware/Dinnerware/Deep plates/FÄRGKLAR Deep plate,Storage & organization/Storage containers/Bins & bags/Trash cans & pedal bins,Home Décor/Mirrors/Wall mirrors,Kitchen & appliances/Kitchen systems/SEKTION kitchen/SEKTION kitchen cabinets/Cabinet doors & drawer fronts,Home Décor/Storage boxes & baskets/Secondary storage boxes,Kitchen & appliances/Kitchen systems/SEKTION kitchen/SEKTION kitchen cabinets,Storage & organization/Clothes organizers/Shoe cabinets,Kitchen & appliances/Kitchen systems/SEKTION kitchen/SEKTION kitchen cabinets,Storage & organization/Storage solution systems/AURDAL system/AURDAL parts,Storage & organization/Storage solution systems/AURDAL system/AURDAL parts,Kitchen & appliances/Kitchen systems/SEKTION kitchen/SEKTION kitchen cabinets,Kitchen & appliances/Kitchen systems/SEKTION kitchen/SEKTION kitchen cabinets,Kitchen & appliances/Kitchen systems/SEKTION kitchen/SEKTION kitchen cabinets,Storage & organization/Storage containers/Bathroom accessories/Towel rails & towel holders,Kitchen & appliances/Appliances/Range hoods & filters/Filters,Storage & organization/Storage containers/Bathroom accessories/Towel rails & towel holders,Storage & organization/Storage solution systems/AURDAL system/AURDAL parts,Kitchen & appliances/Appliances/Range hoods & filters/Filters,Kitchen & appliances/Appliances/Range hoods & filters/Filters,Home Textiles/Window treatments/Curtain rods & rails/Curtain rods,Cookware & tableware/Drinkware/Drinking accessories,Storage & organization/Clothes organizers/Shoe cabinets,Storage & organization/Clothes organizers/Shoe cabinets,Storage & organization/Clothes organizers/Shoe cabinets,Storage & organization/Storage containers/Bathroom accessories/Towel rails & towel holders,Kitchen & appliances/Kitchen systems/SEKTION kitchen/SEKTION kitchen cabinets,Kitchen & appliances/Kitchen systems/SEKTION kitchen/SEKTION kitchen cabinets,Storage & organization/Storage containers/Bins & bags/Trash cans & pedal bins,Storage & organization/Storage solution systems/BESTÅ storage system/BESTÅ all parts & accessories,Cookware & tableware/Table linen/Place mats & coasters,Home Décor/Storage boxes & baskets/Baskets,Storage & organization/Storage solution systems/BESTÅ storage system/BESTÅ all parts & accessories,Home Décor/Mirrors/Vanity mirrors,Storage & organization/Storage solution systems/BESTÅ storage system/BESTÅ all parts & accessories/BESTÅ doors & drawer fronts,Storage & organization/Bags/Shopping bags & tote bags,Furniture/Tables & desks/Makeup vanities & dressing tables,Kitchen & appliances/Kitchen systems/SEKTION kitchen/SEKTION kitchen cabinets,Storage & organization/Clothes organizers/Shoe cabinets,Storage & organization/Storage containers/Bins & bags/Trash cans & pedal bins,Kitchen & appliances/Kitchen systems/SEKTION kitchen/SEKTION kitchen cabinets,Storage & organization/Storage containers/Food storage & organizing/Jars & tins,Home Décor/Mirrors/Wall mirrors,Kitchen & appliances/Kitchen drawer organization/Drawer dividers,Storage & organization/Clothes organizers/Shoe cabinets,Outdoor/Grills/GRILLSKÄR Door/side units,Cookware & tableware/Dinnerware/Deep plates/BESEGRA Deep plate,Home Textiles/Window treatments/Curtain rods & rails/Track systems,Storage & organization/Clothes organizers/Shoe cabinets,Home Décor/Noticeboards,Home Décor/Wall décor/Art posters,Storage & organization/Storage containers/Food storage & organizing/Food containers,Storage & organization/TV & media furniture/TV stands & benches,Cookware & tableware/Dinnerware/Bowls,Storage & organization/Storage containers/Bathroom accessories/Shower accessories,Cookware & tableware/Table linen/Place mats & coasters,Storage & organization/Storage containers/Food storage & organizing/Food containers,Storage & organization/Storage containers/Bathroom accessories/Bathroom shelves,Bathroom/Bathroom storage/Bathroom storage/Bathroom wall cabinets,Cookware & tableware/Dinnerware/Plates,Home Textiles/Window treatments/Curtain rods & rails/Track systems,Furniture/Tables & desks/Accent tables/End tables & side tables,Kitchen & appliances/Appliances/Range hoods & filters/Filters,Storage & organization/Storage containers/Bathroom accessories/Towel rails & towel holders,Cookware & tableware/Cookware & kitchenware/Cooking pans/Frying pans & skillets,Cookware & tableware/Cookware & kitchenware/Pots & pans/Cooking & stock pots,Kitchen & appliances/Appliances/Range hoods & filters/Filters,Cookware & tableware/Serveware/Trays,Kitchen & appliances/Appliances/Range hoods & filters/Filters,Cookware & tableware/Cookware & kitchenware/Pots & pans/Cooking & stock pots,Cookware & tableware/Cookware & kitchenware/Cooking pans/Frying pans & skillets,Furniture/Kids furniture/Toy storage,Cookware & tableware/Flatware/Flatware,Cookware & tableware/Flatware/Flatware,Cookware & tableware/Cookware & kitchenware/Cooking pans/Frying pans & skillets,Home Décor/Mirrors/Makeup & magnifying mirrors,Cookware & tableware/Table linen/Place mats & coasters,Cookware & tableware/Cookware & kitchenware/Pots & pans/Cooking & stock pots,Cookware & tableware/Flatware/Flatware,Furniture/Patio furniture/Outdoor tables/Outdoor dining tables,Cookware & tableware/Flatware/Flatware,Cookware & tableware/Flatware/Flatware/DRAGON Salad,Cookware & tableware/Table linen/Place mats & coasters,Furniture/Kids furniture/Toy storage,Furniture/Kids furniture/Toy storage,Cookware & tableware/Flatware/Flatware,Storage & organization/Storage containers/Paper & media organizers/Media accessories,Cookware & tableware/Flatware/Flatware,Furniture/Kids furniture/Toy storage,Cookware & tableware/Cookware & kitchenware/Cooking pans/Frying pans & skillets,Home Décor/Flower pots & stands/Indoor plant pots,Home Décor/Storage boxes & baskets/Baskets
Home Textiles/Window treatments/Curtains & drapes/Panel curtains,Home Textiles/Window treatments/Curtains & drapes/Light filtering curtains,Home Textiles/Window treatments/Curtains & drapes/Light filtering curtains,Home Textiles/Window treatments/Curtains & drapes/Light filtering curtains,Home Textiles/Window treatments/Curtains & drapes/Panel curtains,"Home Textiles/Window treatments/Shades, blinds & window treatments/Roman shades",Home Textiles/Window treatments/Curtains & drapes/Light filtering curtains,Home Décor/Noticeboards,Home Textiles/Window treatments/Curtains & drapes/Light filtering curtains,Home Textiles/Window treatments/Curtains & drapes/Light filtering curtains,Home Textiles/Window treatments/Curtains & drapes/Panel curtains,Home Textiles/Window treatments/Curtains & drapes/Light filtering curtains,"Home Textiles/Window treatments/Shades, blinds & window treatments/Pleated & cellular blinds and shades",Home Textiles/Window treatments/Curtains & drapes/Panel curtains,Home Textiles/Window treatments/Curtains & drapes/Light filtering curtains,Storage & organization/Storage solution systems/PAX system/PAX doors without hinges,Home Décor/Candle holders & candles/Lanterns,Storage & organization/Storage solution systems/PAX system/PAX doors without hinges,Outdoor/Umbrellas & gazebos/Patio umbrellas & bases,Home electronics/Speakers/Bluetooth speakers,Home Décor/Wall décor/Wall decals & stickers,Storage & organization/Storage solution systems/PAX system/PAX doors without hinges,Home Textiles/Window treatments/Curtains & drapes/Light filtering curtains,Cookware & tableware/Dinnerware/Dinnerware sets,"Home Textiles/Window treatments/Shades, blinds & window treatments/Black-out shades & blinds",Home Décor/Wall décor/Art cards,Home electronics/Cords & chargers/Cables & accessories,Furniture/Tables & desks/Accent tables/Coffee tables,Furniture/Tables & desks/Accent tables/Coffee tables,Storage & organization/Storage solution systems/PAX system/PAX doors without hinges,Home Décor/Flower pots & stands/Indoor plant pots,Bathroom/Bathroom sinks,Home Textiles/Window treatments/Curtains & drapes/Room darkening curtains & drapes,"Laundry & cleaning/Laundry baskets/TORKIS Flexible laundry basket, in",Storage & organization/Storage solution systems/PAX system/PAX doors without hinges,Storage & organization/Storage solution systems/PAX system/PAX doors without hinges,"Storage & organization/Clothes organizers/Clothes racks & stands/TURBO Clothes rack, indoor",Storage & organization/Clothes organizers/Shoe racks & stands,Storage & organization/Storage solution systems/PAX system/PAX doors without hinges,Furniture/Tables & desks/Makeup vanities & dressing tables,Storage & organization/Storage solution systems/PAX system/PAX doors without hinges,Cookware & tableware/Napkins & napkin holders/Napkin holders,Kitchen & appliances/Kitchen systems/SEKTION kitchen/SEKTION kitchen cabinets,Furniture/Tables & desks/Dining tables/Dining table tops & underframes,"Laundry & cleaning/Drying racks/MULIG Drying rack, indoor",Cookware & tableware/Dinnerware/Side plates,Cookware & tableware/Dinnerware/Plates,Home Décor/Wall décor/Picture & photo frames,Bathroom/Bathroom sinks,Home Décor/Wall décor/Picture & photo frames,Bathroom/Bathroom sinks,Home Textiles/Window treatments/Curtain rods & rails/Curtain rods,Cookware & tableware/Dinnerware/Deep plates/FLITIGHET Deep plate,Cookware & tableware/Dinnerware/Bowls,Home Décor/Wall décor/Wall decals & stickers,Cookware & tableware/Napkins & napkin holders/Napkins,"Laundry & cleaning/Laundry baskets/TORKIS Flexible laundry basket, in",Rugs/Rugs/Door mats,Furniture/Patio furniture/Outdoor chairs/Outdoor dining chairs,Furniture/Patio furniture/Outdoor chairs/Outdoor dining chairs,"Outdoor/Outdoor storage benches, boxes & cabinets",Cookware & tableware/Serveware/Trays,Cookware & tableware/Dinnerware/Bowls,Furniture/Patio furniture/Outdoor tables/Outdoor dining tables,Storage & organization/Wall shelves & hooks/Hooks,Storage & organization/Wall shelves & hooks/Hooks,"Storage & organization/Wall shelves & hooks/Hooks/BRANDUR Hook, in-","Storage & organization/Wall shelves & hooks/Hooks/BRANDUR Hook, in-","Storage & organization/Wall shelves & hooks/Hooks/BRANDUR Rail with 4 hooks, in-",Kitchen & appliances/Kitchen systems/SEKTION kitchen/SEKTION kitchen cabinets,Kitchen & appliances/Kitchen systems/SEKTION kitchen/SEKTION kitchen cabinets,Home Décor/Mirrors/Vanity mirrors,Home Décor/Vases & bowls/Vases,Bathroom/Bathroom sinks,Home electronics/Speakers/Wi-Fi speakers,Home Décor/Storage boxes & baskets/Secondary storage boxes,Laundry & cleaning/Cleaning accessories,Outdoor/Outdoor flooring,Cookware & tableware/Dinnerware/Plates,Cookware & tableware/Coffee & tea/Mugs & cups,Home Textiles/Window treatments/Curtain rods & rails/Track systems,Outdoor/Outdoor flooring,Outdoor/Umbrellas & gazebos/Patio umbrellas & bases,"Laundry & cleaning/Laundry baskets/TORKIS Flexible laundry basket, in",Home Textiles/Window treatments/Curtain rods & rails/Track systems,Home Textiles/Window treatments/Curtain rods & rails/Track systems,Bathroom/Bathroom textiles/Shower curtains,"Outdoor/Umbrellas & gazebos/Shades, canopies & screens",Baby & kids/Baby/Baby toys/Newborn,Cookware & tableware/Dinnerware/Side plates,Home Décor/Wall décor/Wall decals & stickers,Lighting/Lamps & light fixtures/Ceiling lights/Pendants lights,Storage & organization/Storage solution systems/PAX system/PAX sliding doors,Bathroom/Bathroom sinks,Baby & kids/Kids/Toys & play/Physical play,Home Décor/Storage boxes & baskets/Kids boxes & baskets,Storage & organization/Dressers & storage drawers/Drawer units/Drawer units for home,Cookware & tableware/Napkins & napkin holders/Napkin holders,Home Textiles/Window treatments/Curtains & drapes/Light filtering curtains,Home Textiles/Window treatments/Curtain rods & rails/Track systems
Kitchen & appliances/Kitchen drawer organization/Shelves & drawers,Home Décor/Storage boxes & baskets/Paper & media boxes,Home Décor/Storage boxes & baskets/Kids boxes & baskets,Storage & organization/Storage solution systems/IVAR system/All parts,Storage & organization/Storage solution systems/IVAR system/All parts,Storage & organization/Display & storage cabinets/Dining room cabinets & cupboards,"Storage & organization/Shelving units, bookcases & storage options/Shelf units & cube storage",Furniture/Tables & desks/Desks & computer desks/Desks for home,"Storage & organization/Display & storage cabinets/Buffet tables, sideboard buffets & buffet cabinets",Storage & organization/TV & media furniture/TV stands & benches,"Storage & organization/Shelving units, bookcases & storage options/Shelf units & cube storage",Storage & organization/TV & media furniture/TV stands & benches,"Storage & organization/Storage solution systems/ELVARLI system/Post, side units & interiors","Storage & organization/Storage solution systems/ELVARLI system/Post, side units & interiors","Storage & organization/Shelving units, bookcases & storage options/Shelf units & cube storage",Storage & organization/Dressers & storage drawers/Drawer units/Drawer units for home,Storage & organization/Wall shelves/Shelves,Home Décor/Storage boxes & baskets/Secondary storage boxes,Kitchen & appliances/Kitchen drawer organization/Shelves & drawers,Home electronics/Speakers/Wi-Fi speakers,Storage & organization/Storage containers/Paper & media organizers/Magazine files,Storage & organization/Display & storage cabinets/Dining room cabinets & cupboards,Kitchen & appliances/Kitchen drawer organization/Shelves & drawers,Storage & organization/Display & storage cabinets/Display cabinets,"Storage & organization/Shelving units, bookcases & storage options/Shelf units & cube storage",Cookware & tableware/Knives & cutting boards/Sharpening tools,Storage & organization/Display & storage cabinets/Display cabinets,Home Décor/Wall décor/Picture ledges,"Storage & organization/Shelving units, bookcases & storage options/Storage shelves & units/KOLBJÖRN Cabinet, indoor",Storage & organization/Display & storage cabinets/Display cabinets,"Storage & organization/Shelving units, bookcases & storage options/Storage shelves & units",Storage & organization/Storage solution systems/BESTÅ storage system/BESTÅ all parts & accessories,Kitchen & appliances/Kitchen islands & carts,"Storage & organization/Storage solution systems/ELVARLI system/Post, side units & interiors","Storage & organization/Storage solution systems/ELVARLI system/Post, side units & interiors",Home Décor/Flower pots & stands/Outdoor plant pots,Kitchen & appliances/Kitchen islands & carts,Kitchen & appliances/Kitchen islands & carts,Kitchen & appliances/Kitchen islands & carts,Storage & organization/Clothes organizers/Clothes racks & stands,Storage & organization/TV & media furniture/TV stands & benches,Storage & organization/Display & storage cabinets/Filing cabinets & storage cabinets/Office storage cabinets & units,Storage & organization/Wall shelves & hooks/Hooks,Storage & organization/Wall shelves/Brackets,"Storage & organization/Display & storage cabinets/Buffet tables, sideboard buffets & buffet cabinets",Storage & organization/Storage containers/Cable management & accessories,Storage & organization/Storage containers/Bins & bags/Trash cans & pedal bins,Furniture/Tables & desks/Accent tables/Coffee tables,Storage & organization/Display & storage cabinets/Dining room cabinets & cupboards,Storage & organization/Storage containers/Food storage & organizing/Food containers,Storage & organization/Clothes organizers/Shoe racks & stands,Storage & organization/Storage solution systems/BESTÅ storage system/BESTÅ all parts & accessories,Storage & organization/Clothes organizers/Shoe racks & stands,Storage & organization/TV & media furniture/TV stands & benches,"Storage & organization/Shelving units, bookcases & storage options/Storage shelves & units",Storage & organization/TV & media furniture/TV stands & benches,Storage & organization/Storage solution systems/PAX system/PAX Interior organizers,Storage & organization/Storage containers/Paper & media organizers/Desk accessories,Storage & organization/Storage solution systems/PAX system/PAX Interior organizers,Storage & organization/Storage solution systems/PAX system/PAX Interior organizers,Storage & organization/Clothes organizers/Shoe racks & stands,Storage & organization/Wall shelves/Brackets,Home Décor/Mirrors/Mirror cabinets,Storage & organization/Display & storage cabinets/Display cabinets,Bathroom/Bathroom storage/Bathroom storage/Bathroom wall cabinets,Storage & organization/Wall shelves/Brackets,Storage & organization/TV & media furniture/TV stands & benches,Storage & organization/Storage solution systems/PAX system/PAX Interior organizers,Home Décor/Mirrors/Mirror cabinets,Storage & organization/Storage containers/Food storage & organizing/Food containers,"Storage & organization/Shelving units, bookcases & storage options/Shelf units & cube storage",Storage & organization/Storage solution systems/BOAXEL system/BOAXEL parts,Storage & organization/Storage solution systems/BOAXEL system/BOAXEL parts,Furniture/Tables & desks/Accent tables/End tables & side tables,Bathroom/Bathroom storage/Bathroom storage/Bathroom tall cabinets,Kitchen & appliances/Kitchen systems/SEKTION kitchen/SEKTION kitchen cabinets,Storage & organization/Display & storage cabinets/Dining room cabinets & cupboards,Storage & organization/Storage solution systems/BOAXEL system/BOAXEL parts,Storage & organization/Storage containers/Bins & bags/Trash cans & pedal bins,Storage & organization/Storage solution systems/BESTÅ storage system/BESTÅ all parts & accessories,Storage & organization/Storage solution systems/PAX system/PAX Interior organizers,Storage & organization/TV & media furniture/TV stands & benches,Storage & organization/Storage solution systems/PAX system/PAX Interior organizers,Storage & organization/Storage solution systems/BOAXEL system/BOAXEL parts,Storage & organization/Wall shelves/Brackets,Storage & organization/Wall shelves/Shelves,Storage & organization/Wall shelves/Shelves,Furniture/Tables & desks/Accent tables/End tables & side tables,Home Décor/Noticeboards,Home Décor/Mirrors/Mirror cabinets,Laundry & cleaning/Ironing boards,Storage & organization/Storage containers/Paper & media organizers/Newspaper racks,Storage & organization/Armoires & wardrobes/Solitaire wardrobes,Bathroom/Bathroom vanities/Bathroom vanity legs,Home Décor/Noticeboards,Storage & organization/Storage solution systems/BOAXEL system/BOAXEL parts,Storage & organization/Storage solution systems/BOAXEL system/BOAXEL parts,Home Décor/Mirrors/Mirror cabinets,Furniture/Tables & desks/Table & desk systems/Table bar system,Home Décor/Noticeboards
